[
  {
    "question": "What is the email address for contacting the Skoltech education team with questions or technical problems?\n",
    "true_answer": "education@skoltech.ru \n",
    "source_doc": "\n### Text Below Video 1\n\nPlease take the time to go through the STUDENT ACADEMIC INTEGRITY REGULATIONS: [**https://www.skoltech.ru/app/data/uploads/sites/2/2015/04/1.-STUDENT-ACADEMIC-INTEGRITY-REGULATIONS.pdf**](https://www.skoltech.ru/app/data/uploads/sites/2/2015/04/1.-STUDENT-ACADEMIC-INTEGRITY-REGULATIONS.pdf)\n\nIf you have any questions or technical problems when dealing with this course, please email us at education@skoltech.ru\n\nBy the end of this course, you will learn about the following topics and know how to find resources related to them:\n\n1) Skoltech at a Glance — brief history, mission and vision, its role within the Skolkovo ecosystem, Russia and the world  \n2) Navigating the campus — different locations on campus and where to find them  \n3) Education process, part 1 — academic integrity requirements and education process details  \n4) Education process, part 2 — your curriculum structure and degree requirements  \n5) Education process, part 3 — research process and intellectual property  \n6) Experience & success — student life, scholarships and future career opportunities  \n7) Services & resources — student benefits and support services  \n8) Being an international student, part 1\\* — first day in Moscow, visa and migration rules in Russia  \n9) Being an international student, part 2\\* — Russia's culture code, useful tips on living in Moscow\n\n\\* for international students only\n\n## “Meet Skoltech” \\- Module 1\n",
    "context": "Sim: 5.97 - If you have any questions or technical problems when dealing with this course, please email us at education@skoltech.ru\nSim: 4.36 - Until then, if you have urgent questions or need assistance, feel free to reach out to the Education Department via [education@skoltech.ru](mailto:education@skoltech.ru). For more details on the Education Department, as well as for all the relevant links, see the description below.\nSim: 3.79 - If you need to communicate any concerns or issues informally or outside of the formal evaluation period (or if you are unable to solve an issue directly with your research advisor or faculty, please talk to the [Education Department (links to an external site)](https://helpdesk.skoltech.ru/servicedesk/customer/portal/21) (email: education@skoltech.ru). \nSim: 3.53 - To reach the library or ask questions, email the team at [Library@skoltech.ru](mailto:Library@skoltech.ru) \nSim: 3.38 - If you need a consultation or have questions about the technology transfer process at Skoltech, reach out to the KTO team at kto@skoltech.ru to book an appointment. \nSim: 3.36 - * Email us at education@skoltech.ru ",
    "generated_answer": "education@skoltech.ru",
    "logprobs": [
      [
        {
          "prob": 0.9997040909250393,
          "token": "education"
        },
        {
          "prob": 0.00017950712826564924,
          "token": " education"
        },
        {
          "prob": 8.47931633712839e-05,
          "token": "教育"
        },
        {
          "prob": 1.4734842376665843e-05,
          "token": "contact"
        },
        {
          "prob": 7.886992779536313e-06,
          "token": "educ"
        }
      ],
      [
        {
          "prob": 1.0,
          "token": "@"
        },
        {
          "prob": 3.775134544279098e-11,
          "token": "@example"
        },
        {
          "prob": 3.331544542166412e-11,
          "token": "@s"
        },
        {
          "prob": 1.783247290814639e-11,
          "token": "@g"
        },
        {
          "prob": 8.423463754468647e-12,
          "token": "@gmail"
        }
      ],
      [
        {
          "prob": 0.9999998807907247,
          "token": "sk"
        },
        {
          "prob": 4.691164021834418e-08,
          "token": "sky"
        },
        {
          "prob": 2.510999155743982e-08,
          "token": "sku"
        },
        {
          "prob": 1.9555681087850496e-08,
          "token": "ski"
        },
        {
          "prob": 8.677780879537103e-09,
          "token": ".sk"
        }
      ],
      [
        {
          "prob": 0.9999997615814777,
          "token": "ol"
        },
        {
          "prob": 1.8553913626159784e-07,
          "token": "olk"
        },
        {
          "prob": 4.139937718785167e-08,
          "token": "ол"
        },
        {
          "prob": 2.061153622438558e-09,
          "token": "col"
        },
        {
          "prob": 1.103256032343554e-09,
          "token": "olt"
        }
      ],
      [
        {
          "prob": 0.9999976158197796,
          "token": "tech"
        },
        {
          "prob": 8.315271330899149e-07,
          "token": "techn"
        },
        {
          "prob": 5.714996835964923e-07,
          "token": " tech"
        },
        {
          "prob": 3.0590173704000945e-07,
          "token": "Tech"
        },
        {
          "prob": 1.275188159256623e-07,
          "token": "te"
        }
      ],
      [
        {
          "prob": 0.9999996423722521,
          "token": ".ru"
        },
        {
          "prob": 9.931194312156244e-08,
          "token": ".rs"
        },
        {
          "prob": 8.764248219443636e-08,
          "token": " ru"
        },
        {
          "prob": 7.734421907141565e-08,
          "token": "_ru"
        },
        {
          "prob": 4.691164021834418e-08,
          "token": ".rb"
        }
      ],
      [
        {
          "prob": 0.9999955892755635,
          "token": ""
        },
        {
          "prob": 3.927844816012785e-07,
          "token": "<tool_call>"
        },
        {
          "prob": 2.699565630800286e-07,
          "token": ""
        },
        {
          "prob": 4.4069239507990437e-08,
          "token": "ienie"
        },
        {
          "prob": 3.224174437983862e-08,
          "token": "ędzi"
        }
      ]
    ],
    "language_consistency_score": 0.52378015448347,
    "feedback": "Feedback: The response is completely correct, accurate, and factual. It provides the correct email address for contacting the Skoltech education team, which matches the reference answer.",
    "score": 5
  },
  {
    "question": "What should I do if there is a fire at Skoltech?\n",
    "true_answer": "Walk to the nearest fire exit, take the stairs, check in with an employee in a bright vest, and follow the instructions of security and safety personnel. \n",
    "source_doc": "*Text Overlay:* \n\n1. *Walk to the nearest fire exit*   \n2. *Take the stairs (don’t take the elevators)*   \n3. *Check in with an employee in a bright vest*  \n4. *Follow the instructions of security and safety personnel.* \n\n![][image5]\n",
    "context": "",
    "generated_answer": "The document does not provide specific instructions for a fire at Skoltech.",
    "logprobs": [
      [
        {
          "prob": 0.7175010811856655,
          "token": "The"
        },
        {
          "prob": 0.20556750151206585,
          "token": "Use"
        },
        {
          "prob": 0.04047864591571191,
          "token": "If"
        },
        {
          "prob": 0.010234604472052052,
          "token": "There"
        },
        {
          "prob": 0.009032006745764383,
          "token": "Information"
        }
      ],
      [
        {
          "prob": 0.6503088758534472,
          "token": " document"
        },
        {
          "prob": 0.2710890633240446,
          "token": " context"
        },
        {
          "prob": 0.03237697149743537,
          "token": " information"
        },
        {
          "prob": 0.022252345389908217,
          "token": " given"
        },
        {
          "prob": 0.015293798414437633,
          "token": " question"
        }
      ],
      [
        {
          "prob": 0.9993675181589384,
          "token": " does"
        },
        {
          "prob": 0.0002304141338770065,
          "token": " provides"
        },
        {
          "prob": 0.0002304141338770065,
          "token": " provided"
        },
        {
          "prob": 5.825781647716307e-05,
          "token": " indicates"
        },
        {
          "prob": 5.825781647716307e-05,
          "token": " states"
        }
      ],
      [
        {
          "prob": 1.0,
          "token": " not"
        },
        {
          "prob": 3.6534822137210456e-08,
          "token": "not"
        },
        {
          "prob": 4.363462252943702e-09,
          "token": "_not"
        },
        {
          "prob": 9.736200313009565e-10,
          "token": " NOT"
        },
        {
          "prob": 5.905303998944039e-10,
          "token": " Not"
        }
      ],
      [
        {
          "prob": 0.9818323838723747,
          "token": " provide"
        },
        {
          "prob": 0.017982883942210773,
          "token": " specify"
        },
        {
          "prob": 6.485643723117846e-05,
          "token": "提供"
        },
        {
          "prob": 5.7235604969187217e-05,
          "token": " contain"
        },
        {
          "prob": 3.933741766043767e-05,
          "token": "provide"
        }
      ],
      [
        {
          "prob": 0.9984628974997415,
          "token": " specific"
        },
        {
          "prob": 0.0008034960597375363,
          "token": " information"
        },
        {
          "prob": 0.00033494699026591286,
          "token": " specifics"
        },
        {
          "prob": 0.000230205475373066,
          "token": "具体"
        },
        {
          "prob": 9.596391940506744e-05,
          "token": " instructions"
        }
      ],
      [
        {
          "prob": 0.9656000563594269,
          "token": " instructions"
        },
        {
          "prob": 0.029158594591376815,
          "token": " information"
        },
        {
          "prob": 0.0018640465880201912,
          "token": " actions"
        },
        {
          "prob": 0.0012811392351131698,
          "token": " guidance"
        },
        {
          "prob": 0.00113060140676697,
          "token": " details"
        }
      ],
      [
        {
          "prob": 0.9911452064204952,
          "token": " for"
        },
        {
          "prob": 0.005201051597708662,
          "token": "."
        },
        {
          "prob": 0.00357462700154382,
          "token": ","
        },
        {
          "prob": 5.777849174509039e-05,
          "token": " on"
        },
        {
          "prob": 1.1377259600297445e-05,
          "token": ";"
        }
      ],
      [
        {
          "prob": 0.5117595986378759,
          "token": " a"
        },
        {
          "prob": 0.2739251738252146,
          "token": " what"
        },
        {
          "prob": 0.1007714278567191,
          "token": " dealing"
        },
        {
          "prob": 0.07848086692603641,
          "token": " handling"
        },
        {
          "prob": 0.015453798977883258,
          "token": " fires"
        }
      ],
      [
        {
          "prob": 0.9999991655356624,
          "token": " fire"
        },
        {
          "prob": 3.4663241069161144e-07,
          "token": "火"
        },
        {
          "prob": 3.4663241069161144e-07,
          "token": "fire"
        },
        {
          "prob": 2.8453348089834e-08,
          "token": "_fire"
        },
        {
          "prob": 2.8453348089834e-08,
          "token": " fires"
        }
      ],
      [
        {
          "prob": 0.9795482171875793,
          "token": " at"
        },
        {
          "prob": 0.020329876253519685,
          "token": " emergency"
        },
        {
          "prob": 7.33209472935452e-05,
          "token": " evacuation"
        },
        {
          "prob": 2.6973269116510185e-05,
          "token": " situation"
        },
        {
          "prob": 7.72797098888099e-06,
          "token": " drill"
        }
      ],
      [
        {
          "prob": 0.9999997615814777,
          "token": " Sk"
        },
        {
          "prob": 2.382369667501818e-07,
          "token": "Sk"
        },
        {
          "prob": 1.0467401794744658e-08,
          "token": "_sk"
        },
        {
          "prob": 1.0467401794744658e-08,
          "token": " SK"
        },
        {
          "prob": 2.7894680928689246e-10,
          "token": " the"
        }
      ],
      [
        {
          "prob": 0.9999810460826691,
          "token": "ol"
        },
        {
          "prob": 1.6701382233621983e-05,
          "token": "olk"
        },
        {
          "prob": 1.5534705375723988e-06,
          "token": "olt"
        },
        {
          "prob": 2.382324227839884e-07,
          "token": "ok"
        },
        {
          "prob": 1.6373459003983336e-07,
          "token": "ол"
        }
      ],
      [
        {
          "prob": 0.9993710899134133,
          "token": "tech"
        },
        {
          "prob": 0.0002958584507187747,
          "token": "itech"
        },
        {
          "prob": 0.00020334034121872104,
          "token": "Tech"
        },
        {
          "prob": 5.8257983154351416e-05,
          "token": " tech"
        },
        {
          "prob": 4.004008722597079e-05,
          "token": "-tech"
        }
      ],
      [
        {
          "prob": 0.9849327255095451,
          "token": "."
        },
        {
          "prob": 0.01404930966911893,
          "token": ","
        },
        {
          "prob": 0.001017728578929935,
          "token": ";"
        },
        {
          "prob": 1.6127069612525004e-07,
          "token": " campus"
        },
        {
          "prob": 4.0775578736817594e-08,
          "token": " or"
        }
      ],
      [
        {
          "prob": 0.9659944626248522,
          "token": ""
        },
        {
          "prob": 0.013779167941125959,
          "token": " Please"
        },
        {
          "prob": 0.003483919252760008,
          "token": " Safety"
        },
        {
          "prob": 0.003483919252760008,
          "token": " You"
        },
        {
          "prob": 0.0030745479494155453,
          "token": " It"
        }
      ]
    ],
    "language_consistency_score": 0.7720256453762869,
    "feedback": "Feedback: The response states that the document does not provide specific instructions for a fire at Skoltech, which matches the criteria for a score of 0 as it indicates that no relevant information was found in the provided context or documents.",
    "score": 0
  },
  {
    "question": "How does Skoltech ensure student input before drafting a policy?\n",
    "true_answer": "Skoltech provides students the opportunity to express their concerns or opinions on the issue through the Student Council before a policy is drafted. \n",
    "source_doc": "Among other things, it highlights that we have all gathered here for science, innovation, and education. Please leave your conflicts and arguments on other topics outside of the Campus. *Text Overlay: Policies*\n\nNow along with the Code of Ethics, you will likely hear the term “Policy”. A Policy is an official document passed by Skoltech’s leadership team to optimize the university’s functions and/or activities. For instance, you can hear something like “Skoltech Policy on Student Scholarships and Other Benefits” or “Skoltech’s IP policy”, which, btw, you will learn about in the next modules. The policies don’t just appear out of thin air: their formation is a long process that involves all the leadership and representative parties of Skoltech you’ve read about already. That includes the students, too. In fact, before a policy is drafted, **Skoltech makes sure to give the students the opportunity to voice their concerns or opinions** on the issue in question through the Student Council. You can also participate in working groups and contribute your feedback any time. So this way, you the students are quite literally the policy makers of the institute\\! *Text Overlay: Feedback and freedom for exploration*\n\nFinally, Skoltech is a young university. That means you, as part of the growing community, have an opportunity to shape its values and mission. One way to do that is through feedback, and here we want to stress that **your feedback and participation in university-wide initiatives is crucial** to strengthening Skoltech as an international community of scientists every day. As a student, you have incredible freedom to explore your passions, try your hand in different subject areas and even work-related activities. This university was literally built to open your abilities and your mind, to help you reach for incredible goals and achieve them. The growth of our community and university wouldn’t be possible without your input. Please keep that in mind as you dive into your academic year and the next lessons of this orientation course. Embrace the opportunities that come your way, and get the most out of them while you are still here. Life tends to be quick, but the memories, knowledge and experience that you’ll gain from the next few years at Skoltech will last you a lifetime. This is the end of Module 1\\.",
    "context": "Sim: 6.01 - The policies don’t just appear out of thin air: their formation is a long process that involves all the leadership and representative parties of Skoltech you’ve read about already. That includes the students, too. In fact, before a policy is drafted, **Skoltech makes sure to give the students the opportunity to voice their concerns or opinions** on the issue in question through the Student Council. You can also participate in working groups and contribute your feedback any time. So this way, you the students are quite literally the policy makers of the institute\\!",
    "generated_answer": "Skoltech ensures student input before drafting a policy by giving students the opportunity to voice their concerns or opinions through the Student Council.",
    "logprobs": [
      [
        {
          "prob": 0.9968210509895069,
          "token": "Sk"
        },
        {
          "prob": 0.003172663440846801,
          "token": "Before"
        },
        {
          "prob": 4.769904288628014e-06,
          "token": " Sk"
        },
        {
          "prob": 7.314885140360312e-07,
          "token": "Through"
        },
        {
          "prob": 1.2711364367274743e-07,
          "token": "before"
        }
      ],
      [
        {
          "prob": 0.9999777083605178,
          "token": "ol"
        },
        {
          "prob": 1.8925091296908553e-05,
          "token": "olk"
        },
        {
          "prob": 7.338054231806457e-07,
          "token": "olt"
        },
        {
          "prob": 6.475810130566981e-07,
          "token": "ол"
        },
        {
          "prob": 6.475810130566981e-07,
          "token": "ö"
        }
      ],
      [
        {
          "prob": 0.9997863034267085,
          "token": "tech"
        },
        {
          "prob": 8.480011805181931e-05,
          "token": "Tech"
        },
        {
          "prob": 6.604239834330446e-05,
          "token": "te"
        },
        {
          "prob": 1.147644799504116e-05,
          "token": "tek"
        },
        {
          "prob": 1.147644799504116e-05,
          "token": " tech"
        }
      ],
      [
        {
          "prob": 0.9985621414492043,
          "token": " ensures"
        },
        {
          "prob": 0.0013248724417660883,
          "token": " gives"
        },
        {
          "prob": 6.596151483690708e-05,
          "token": "确保"
        },
        {
          "prob": 1.4718003369192106e-05,
          "token": " ensure"
        },
        {
          "prob": 8.926920293168849e-06,
          "token": " ensured"
        }
      ],
      [
        {
          "prob": 0.999991059383269,
          "token": " student"
        },
        {
          "prob": 4.785076321313246e-06,
          "token": "学生"
        },
        {
          "prob": 3.726621186095193e-06,
          "token": "student"
        },
        {
          "prob": 3.4662976610628127e-07,
          "token": " students"
        },
        {
          "prob": 4.1398982374506896e-08,
          "token": ".student"
        }
      ],
      [
        {
          "prob": 0.9999867679437158,
          "token": " input"
        },
        {
          "prob": 1.3007123989067183e-05,
          "token": "input"
        },
        {
          "prob": 7.734318642157583e-08,
          "token": "输入"
        },
        {
          "prob": 4.691101388455558e-08,
          "token": "(input"
        },
        {
          "prob": 3.653433434796543e-08,
          "token": "_input"
        }
      ],
      [
        {
          "prob": 0.9990713882643698,
          "token": " before"
        },
        {
          "prob": 0.0009110353310143418,
          "token": " by"
        },
        {
          "prob": 1.6686194137737095e-05,
          "token": " through"
        },
        {
          "prob": 7.331402042570447e-07,
          "token": "before"
        },
        {
          "prob": 6.819266161877052e-08,
          "token": "_before"
        }
      ],
      [
        {
          "prob": 0.9999824765407688,
          "token": " drafting"
        },
        {
          "prob": 6.144106881838195e-06,
          "token": " drafted"
        },
        {
          "prob": 4.785035250849994e-06,
          "token": "_draft"
        },
        {
          "prob": 1.9946994589021863e-06,
          "token": "draft"
        },
        {
          "prob": 1.3709355525136263e-06,
          "token": " crafting"
        }
      ],
      [
        {
          "prob": 1.0,
          "token": " a"
        },
        {
          "prob": 9.237449661970594e-09,
          "token": " policies"
        },
        {
          "prob": 2.646573638909117e-09,
          "token": " policy"
        },
        {
          "prob": 6.224144622907783e-11,
          "token": "a"
        },
        {
          "prob": 9.545034922840628e-12,
          "token": "政策"
        }
      ],
      [
        {
          "prob": 0.9999966621509202,
          "token": " policy"
        },
        {
          "prob": 2.260322940135999e-06,
          "token": "policy"
        },
        {
          "prob": 1.0677009553134769e-06,
          "token": "政策"
        },
        {
          "prob": 2.6465635430511496e-09,
          "token": ".policy"
        },
        {
          "prob": 1.8189547487781048e-09,
          "token": "_policy"
        }
      ],
      [
        {
          "prob": 0.9999998807907247,
          "token": " by"
        },
        {
          "prob": 1.6373771305908126e-07,
          "token": " through"
        },
        {
          "prob": 3.581747930283181e-10,
          "token": "by"
        },
        {
          "prob": 2.172439935079017e-10,
          "token": " By"
        },
        {
          "prob": 4.277787868968998e-11,
          "token": "_by"
        }
      ],
      [
        {
          "prob": 0.9965316369509748,
          "token": " giving"
        },
        {
          "prob": 0.0019237589209813845,
          "token": " allowing"
        },
        {
          "prob": 0.0014982249541009031,
          "token": " providing"
        },
        {
          "prob": 1.4688080616065246e-05,
          "token": " involving"
        },
        {
          "prob": 7.861963012757174e-06,
          "token": " Giving"
        }
      ],
      [
        {
          "prob": 0.9753924276834892,
          "token": " students"
        },
        {
          "prob": 0.02293902989959055,
          "token": " the"
        },
        {
          "prob": 0.0016616981487074334,
          "token": " them"
        },
        {
          "prob": 5.99301642862021e-06,
          "token": "students"
        },
        {
          "prob": 1.8097341495129837e-07,
          "token": "学生"
        }
      ],
      [
        {
          "prob": 0.9999963045256735,
          "token": " the"
        },
        {
          "prob": 3.2887473357670864e-06,
          "token": " opportunities"
        },
        {
          "prob": 3.466314189697482e-07,
          "token": " an"
        },
        {
          "prob": 2.5109895770606383e-08,
          "token": "机会"
        },
        {
          "prob": 2.2159405241782167e-08,
          "token": "的机会"
        }
      ],
      [
        {
          "prob": 0.9998456478015768,
          "token": " opportunity"
        },
        {
          "prob": 9.609680441568883e-05,
          "token": " chance"
        },
        {
          "prob": 5.828565817852365e-05,
          "token": "机会"
        },
        {
          "prob": 1.3438333632178725e-08,
          "token": " opportunities"
        },
        {
          "prob": 1.0465784755915588e-08,
          "token": "的机会"
        }
      ],
      [
        {
          "prob": 1.0,
          "token": " to"
        },
        {
          "prob": 2.335593038799337e-09,
          "token": " through"
        },
        {
          "prob": 1.162823303022097e-10,
          "token": "to"
        },
        {
          "prob": 3.775134544279098e-11,
          "token": "\tto"
        },
        {
          "prob": 6.560200168153779e-12,
          "token": "_to"
        }
      ],
      [
        {
          "prob": 0.999991297797926,
          "token": " voice"
        },
        {
          "prob": 5.422201831302804e-06,
          "token": "voice"
        },
        {
          "prob": 1.2098567629757041e-06,
          "token": " express"
        },
        {
          "prob": 9.422373944097135e-07,
          "token": " vo"
        },
        {
          "prob": 7.33815220605445e-07,
          "token": " voiced"
        }
      ],
      [
        {
          "prob": 0.9999716289935482,
          "token": " their"
        },
        {
          "prob": 2.7535661536881667e-05,
          "token": " concerns"
        },
        {
          "prob": 8.315049292164037e-07,
          "token": "他们的"
        },
        {
          "prob": 1.725733424460403e-08,
          "token": "their"
        },
        {
          "prob": 9.73592176206895e-10,
          "token": " Their"
        }
      ],
      [
        {
          "prob": 0.9999994039539004,
          "token": " concerns"
        },
        {
          "prob": 3.9278597995802437e-07,
          "token": " Concern"
        },
        {
          "prob": 2.3823673954981372e-07,
          "token": " opinions"
        },
        {
          "prob": 1.7257827987960214e-08,
          "token": "Concern"
        },
        {
          "prob": 5.602796437537268e-09,
          "token": " views"
        }
      ],
      [
        {
          "prob": 0.9999971389852362,
          "token": " or"
        },
        {
          "prob": 2.902312105056987e-06,
          "token": "或"
        },
        {
          "prob": 4.599046606658694e-10,
          "token": " and"
        },
        {
          "prob": 1.6918946955790182e-10,
          "token": " или"
        },
        {
          "prob": 4.277779709743936e-11,
          "token": "或是"
        }
      ],
      [
        {
          "prob": 0.9999983310727032,
          "token": " opinions"
        },
        {
          "prob": 1.067701973552941e-06,
          "token": "意见"
        },
        {
          "prob": 3.466320801173418e-07,
          "token": "的意见"
        },
        {
          "prob": 1.8553878237411744e-07,
          "token": " Op"
        },
        {
          "prob": 6.825590357542018e-08,
          "token": " opinion"
        }
      ],
      [
        {
          "prob": 0.9399112209862985,
          "token": " through"
        },
        {
          "prob": 0.06008651990167183,
          "token": " on"
        },
        {
          "prob": 1.003547076924864e-06,
          "token": "通过"
        },
        {
          "prob": 6.086820706199226e-07,
          "token": " via"
        },
        {
          "prob": 2.8752105141399574e-07,
          "token": " about"
        }
      ],
      [
        {
          "prob": 1.0,
          "token": " the"
        },
        {
          "prob": 1.4166087866431961e-09,
          "token": "the"
        },
        {
          "prob": 2.020683909022217e-11,
          "token": " meetings"
        },
        {
          "prob": 1.57371021068629e-11,
          "token": " initiatives"
        },
        {
          "prob": 1.2256067444099483e-11,
          "token": " their"
        }
      ],
      [
        {
          "prob": 0.9999909401759619,
          "token": " Student"
        },
        {
          "prob": 7.889257112872668e-06,
          "token": "Student"
        },
        {
          "prob": 7.33815220605445e-07,
          "token": " Students"
        },
        {
          "prob": 2.102415807124786e-07,
          "token": ".Student"
        },
        {
          "prob": 1.2751796464856653e-07,
          "token": "(Student"
        }
      ],
      [
        {
          "prob": 0.9999938011552557,
          "token": " Council"
        },
        {
          "prob": 6.144177195963701e-06,
          "token": "Council"
        },
        {
          "prob": 1.344033304471242e-08,
          "token": "ouncil"
        },
        {
          "prob": 6.691547801839581e-10,
          "token": " Counsel"
        },
        {
          "prob": 1.3176438873691744e-10,
          "token": " council"
        }
      ],
      [
        {
          "prob": 0.9997967894605428,
          "token": "."
        },
        {
          "prob": 0.0001398132250813237,
          "token": " before"
        },
        {
          "prob": 5.143441111129444e-05,
          "token": ","
        },
        {
          "prob": 1.01280360550662e-05,
          "token": " and"
        },
        {
          "prob": 1.7599887646971433e-06,
          "token": " on"
        }
      ],
      [
        {
          "prob": 0.9999614968828868,
          "token": ""
        },
        {
          "prob": 3.120169471072154e-05,
          "token": " Students"
        },
        {
          "prob": 8.314969994052664e-07,
          "token": "Students"
        },
        {
          "prob": 5.368548123952241e-07,
          "token": "students"
        },
        {
          "prob": 3.6897455682657627e-07,
          "token": " Additionally"
        }
      ]
    ],
    "language_consistency_score": 0.7548853817430486,
    "feedback": "Feedback: The response is accurate and factual, stating that Skoltech ensures student input through the Student Council. However, it lacks the detail that the reference answer provides, specifically mentioning that this opportunity is given before a policy is drafted.",
    "score": 4
  },
  {
    "question": "What should students do if they have questions or technical issues with the course material?\n",
    "true_answer": "Students should contact Education. \n",
    "source_doc": "in the university as they relate to academic misconduct. That means: No copying or publishing any information or material from this course. Using your common sense and/or contacting Education if you have questions or technical issues with the course material. You can find a link to Education in the description of this video. ",
    "context": "",
    "generated_answer": "The context does not provide specific information on what students should do if they have questions or technical issues with the course material.",
    "logprobs": [
      [
        {
          "prob": 0.8556207794095065,
          "token": "The"
        },
        {
          "prob": 0.10218931721364487,
          "token": "Students"
        },
        {
          "prob": 0.033176013971074884,
          "token": "If"
        },
        {
          "prob": 0.00448988524743724,
          "token": "Use"
        },
        {
          "prob": 0.0011352207711717258,
          "token": "Based"
        }
      ],
      [
        {
          "prob": 0.5901909681038915,
          "token": " context"
        },
        {
          "prob": 0.315906441856803,
          "token": " document"
        },
        {
          "prob": 0.054896308162855414,
          "token": " documents"
        },
        {
          "prob": 0.022884185893661695,
          "token": " question"
        },
        {
          "prob": 0.010809726580112877,
          "token": " information"
        }
      ],
      [
        {
          "prob": 0.9839101068069799,
          "token": " does"
        },
        {
          "prob": 0.015903428411880922,
          "token": " provided"
        },
        {
          "prob": 9.456519695792724e-05,
          "token": " doesn"
        },
        {
          "prob": 8.3453493407673e-05,
          "token": " is"
        },
        {
          "prob": 1.7320219989234193e-06,
          "token": " did"
        }
      ],
      [
        {
          "prob": 0.9999998807907247,
          "token": " not"
        },
        {
          "prob": 4.691164021834418e-08,
          "token": "not"
        },
        {
          "prob": 9.237449661970594e-09,
          "token": "_not"
        },
        {
          "prob": 1.8189616875530459e-09,
          "token": " Not"
        },
        {
          "prob": 7.582560427911907e-10,
          "token": "\tnot"
        }
      ],
      [
        {
          "prob": 0.9945356669198034,
          "token": " provide"
        },
        {
          "prob": 0.00521884411359525,
          "token": " specify"
        },
        {
          "prob": 0.0001575955118669238,
          "token": "provide"
        },
        {
          "prob": 6.569558336911419e-05,
          "token": "提供"
        },
        {
          "prob": 1.4658666038194973e-05,
          "token": " provided"
        }
      ],
      [
        {
          "prob": 0.9989480129997409,
          "token": " specific"
        },
        {
          "prob": 0.0008038865709805164,
          "token": " information"
        },
        {
          "prob": 0.00012327993965533023,
          "token": " a"
        },
        {
          "prob": 5.1390724630565595e-05,
          "token": " specifics"
        },
        {
          "prob": 3.1170050113287226e-05,
          "token": " this"
        }
      ],
      [
        {
          "prob": 0.9382025665525083,
          "token": " information"
        },
        {
          "prob": 0.036378062387912684,
          "token": " instructions"
        },
        {
          "prob": 0.01718377992557588,
          "token": " guidance"
        },
        {
          "prob": 0.007163265205486571,
          "token": " advice"
        },
        {
          "prob": 0.0007550025979892683,
          "token": " details"
        }
      ],
      [
        {
          "prob": 0.999271566174575,
          "token": " on"
        },
        {
          "prob": 0.0007096571391441993,
          "token": " about"
        },
        {
          "prob": 1.6689536243295772e-05,
          "token": " for"
        },
        {
          "prob": 9.415592049551224e-07,
          "token": ","
        },
        {
          "prob": 7.332870461271387e-07,
          "token": " regarding"
        }
      ],
      [
        {
          "prob": 0.9939434040060078,
          "token": " what"
        },
        {
          "prob": 0.005910204147742391,
          "token": " how"
        },
        {
          "prob": 0.00013899467910373647,
          "token": " this"
        },
        {
          "prob": 4.7561363742637086e-06,
          "token": " student"
        },
        {
          "prob": 1.749684791499303e-06,
          "token": "what"
        }
      ],
      [
        {
          "prob": 0.9999563713049341,
          "token": " students"
        },
        {
          "prob": 4.006353980622842e-05,
          "token": " actions"
        },
        {
          "prob": 2.902193089495249e-06,
          "token": "students"
        },
        {
          "prob": 3.46617535161579e-07,
          "token": "学生们"
        },
        {
          "prob": 6.825303950381516e-08,
          "token": " action"
        }
      ],
      [
        {
          "prob": 0.9999959469005546,
          "token": " should"
        },
        {
          "prob": 2.5612790004194033e-06,
          "token": "should"
        },
        {
          "prob": 1.3709538566001813e-06,
          "token": "应该"
        },
        {
          "prob": 4.691146126497983e-08,
          "token": "应"
        },
        {
          "prob": 3.224174437983862e-08,
          "token": "应当"
        }
      ],
      [
        {
          "prob": 1.0,
          "token": " do"
        },
        {
          "prob": 2.510999155743982e-08,
          "token": "do"
        },
        {
          "prob": 4.363462252943702e-09,
          "token": " doing"
        },
        {
          "prob": 5.905303998944039e-10,
          "token": ".do"
        },
        {
          "prob": 5.211412487888539e-10,
          "token": " Do"
        }
      ],
      [
        {
          "prob": 0.996973878275028,
          "token": " if"
        },
        {
          "prob": 0.00218087135704037,
          "token": " for"
        },
        {
          "prob": 0.0008022977360948163,
          "token": "."
        },
        {
          "prob": 3.994405223833508e-05,
          "token": ","
        },
        {
          "prob": 1.755019171845647e-06,
          "token": " in"
        }
      ],
      [
        {
          "prob": 0.9999976158197796,
          "token": " they"
        },
        {
          "prob": 2.2603250957489616e-06,
          "token": "他们"
        },
        {
          "prob": 9.931175369924415e-08,
          "token": "they"
        },
        {
          "prob": 3.398261337819773e-09,
          "token": " они"
        },
        {
          "prob": 8.592150230932485e-10,
          "token": " They"
        }
      ],
      [
        {
          "prob": 0.9999994039539004,
          "token": " have"
        },
        {
          "prob": 3.059020287707785e-07,
          "token": " encounter"
        },
        {
          "prob": 1.6373755690670415e-07,
          "token": "have"
        },
        {
          "prob": 1.4449788680693535e-07,
          "token": " Have"
        },
        {
          "prob": 1.186112015134383e-08,
          "token": "Have"
        }
      ],
      [
        {
          "prob": 0.9999998807907247,
          "token": " questions"
        },
        {
          "prob": 1.6373771305908126e-07,
          "token": "questions"
        },
        {
          "prob": 1.7257827987960214e-08,
          "token": " Questions"
        },
        {
          "prob": 1.3440409951135022e-08,
          "token": "_questions"
        },
        {
          "prob": 3.850741922767617e-09,
          "token": " such"
        }
      ],
      [
        {
          "prob": 0.9999996423722521,
          "token": " or"
        },
        {
          "prob": 3.927863545481039e-07,
          "token": "或"
        },
        {
          "prob": 3.581747930283181e-10,
          "token": " или"
        },
        {
          "prob": 5.4927883509546835e-11,
          "token": "或者"
        },
        {
          "prob": 2.289734845645553e-11,
          "token": "或是"
        }
      ],
      [
        {
          "prob": 0.9999970197767496,
          "token": " technical"
        },
        {
          "prob": 1.994727993510925e-06,
          "token": "technical"
        },
        {
          "prob": 3.9278523077893697e-07,
          "token": " tech"
        },
        {
          "prob": 3.059014453095186e-07,
          "token": " Technical"
        },
        {
          "prob": 1.637372446023967e-07,
          "token": "技术"
        }
      ],
      [
        {
          "prob": 0.9999970197767496,
          "token": " issues"
        },
        {
          "prob": 2.260322940135999e-06,
          "token": "issues"
        },
        {
          "prob": 5.714991385721822e-07,
          "token": " Issues"
        },
        {
          "prob": 8.764214786553686e-08,
          "token": "_issues"
        },
        {
          "prob": 7.194105586938129e-09,
          "token": "Issues"
        }
      ],
      [
        {
          "prob": 0.9999988079084972,
          "token": " with"
        },
        {
          "prob": 1.2098659934854867e-06,
          "token": "."
        },
        {
          "prob": 1.0467381829779195e-08,
          "token": " regarding"
        },
        {
          "prob": 1.4166060846789406e-09,
          "token": "with"
        },
        {
          "prob": 5.211402547917536e-10,
          "token": " related"
        }
      ],
      [
        {
          "prob": 0.9995694822610254,
          "token": " the"
        },
        {
          "prob": 0.0004305571096741222,
          "token": " course"
        },
        {
          "prob": 5.209166536404791e-10,
          "token": "course"
        },
        {
          "prob": 5.209166536404791e-10,
          "token": " their"
        },
        {
          "prob": 3.1595192158785715e-10,
          "token": " coursework"
        }
      ],
      [
        {
          "prob": 1.0,
          "token": " course"
        },
        {
          "prob": 3.6534822137210456e-08,
          "token": " coursework"
        },
        {
          "prob": 1.186112015134383e-08,
          "token": "课程"
        },
        {
          "prob": 4.363462252943702e-09,
          "token": "course"
        },
        {
          "prob": 3.398267819495071e-09,
          "token": ".course"
        }
      ],
      [
        {
          "prob": 0.9999974966112362,
          "token": " material"
        },
        {
          "prob": 1.5534957233607605e-06,
          "token": "material"
        },
        {
          "prob": 5.043462196197153e-07,
          "token": " materials"
        },
        {
          "prob": 4.450839766446488e-07,
          "token": "材料"
        },
        {
          "prob": 1.955564378838448e-08,
          "token": "_material"
        }
      ],
      [
        {
          "prob": 0.9999983310727032,
          "token": "."
        },
        {
          "prob": 1.553497204890439e-06,
          "token": ","
        },
        {
          "prob": 1.275188159256623e-07,
          "token": ";"
        },
        {
          "prob": 6.348788006680007e-09,
          "token": "。"
        },
        {
          "prob": 2.1940824251802136e-09,
          "token": " beyond"
        }
      ],
      [
        {
          "prob": 0.9998607829329756,
          "token": ""
        },
        {
          "prob": 4.005971923151676e-05,
          "token": " Additional"
        },
        {
          "prob": 1.5687611454154738e-05,
          "token": " Based"
        },
        {
          "prob": 1.1477301720701961e-05,
          "token": " Therefore"
        },
        {
          "prob": 8.396973317001739e-06,
          "token": " No"
        }
      ]
    ],
    "language_consistency_score": 0.7774559915459036,
    "feedback": "Feedback: The response states that the context does not provide specific information on what students should do if they have questions or technical issues with the course material. This is a correct statement, but it does not align with the reference answer, which indicates that students should contact Education. The response does not provide the correct and factual information as required by the reference answer.",
    "score": 0
  },
  {
    "question": "What does the letter section, like \"A\" or \"C\", in a Skoltech location indicate?\n",
    "true_answer": "The letter section, like \"A\" or \"C\", in a Skoltech location indicates a laboratory facility. \n",
    "source_doc": "\n### Sometimes the location can include an additional letter section \\- like A, B, or C and look like this: E-C4 or E-A1. The C4 and A1 here means it’s a laboratory facility.",
    "context": "Sim: 1.41 - 1) The first letter E indicates that the room is located on the main Skoltech campus. That’s an easy one\\! R3 (or R1 or R2) indicate the ring you’re on.   \nSim: 1.02 - ### Sometimes the location can include an additional letter section \\- like A, B, or C and look like this: E-C4 or E-A1. The C4 and A1 here means it’s a laboratory facility.",
    "generated_answer": "The letter section, like \"A\" or \"C\", indicates an additional section or wing within the ring of buildings, suggesting it's a specific area or type of facility such as a laboratory.",
    "logprobs": [
      [
        {
          "prob": 0.7771405979086164,
          "token": "The"
        },
        {
          "prob": 0.2226545157712364,
          "token": "It"
        },
        {
          "prob": 0.00010867657123117219,
          "token": "These"
        },
        {
          "prob": 6.591567244414986e-05,
          "token": "A"
        },
        {
          "prob": 1.297956548318848e-05,
          "token": "This"
        }
      ],
      [
        {
          "prob": 0.996823893869935,
          "token": " letter"
        },
        {
          "prob": 0.0031726725179227,
          "token": " additional"
        },
        {
          "prob": 2.8931014721655345e-06,
          "token": " letters"
        },
        {
          "prob": 3.455316963175461e-07,
          "token": "letter"
        },
        {
          "prob": 5.298900183264917e-08,
          "token": "-letter"
        }
      ],
      [
        {
          "prob": 0.9984980763623067,
          "token": " section"
        },
        {
          "prob": 0.0015011812350883861,
          "token": " sections"
        },
        {
          "prob": 7.327194205132467e-07,
          "token": "section"
        },
        {
          "prob": 4.684118541803004e-08,
          "token": "(section"
        },
        {
          "prob": 2.8410615093319544e-08,
          "token": " segment"
        }
      ],
      [
        {
          "prob": 0.9867484400379728,
          "token": ","
        },
        {
          "prob": 0.0096737427547675,
          "token": " like"
        },
        {
          "prob": 0.003558771078660157,
          "token": " indicates"
        },
        {
          "prob": 9.995855545385945e-06,
          "token": " ("
        },
        {
          "prob": 2.527348075818016e-06,
          "token": " indicating"
        }
      ],
      [
        {
          "prob": 0.9914222426714454,
          "token": " like"
        },
        {
          "prob": 0.008577484930474293,
          "token": " such"
        },
        {
          "prob": 1.8394766666341164e-07,
          "token": "like"
        },
        {
          "prob": 8.689064232113559e-08,
          "token": "如"
        },
        {
          "prob": 8.082088712686887e-09,
          "token": "_like"
        }
      ],
      [
        {
          "prob": 0.9999998807907247,
          "token": " \""
        },
        {
          "prob": 6.82560337633487e-08,
          "token": " A"
        },
        {
          "prob": 2.646573638909117e-09,
          "token": " '"
        },
        {
          "prob": 2.335593038799337e-09,
          "token": "\"A"
        },
        {
          "prob": 1.493094676197164e-10,
          "token": " “"
        }
      ],
      [
        {
          "prob": 1.0,
          "token": "A"
        },
        {
          "prob": 8.25807328555592e-14,
          "token": " A"
        },
        {
          "prob": 8.25807328555592e-14,
          "token": "C"
        },
        {
          "prob": 2.6810038677818034e-14,
          "token": "Ａ"
        },
        {
          "prob": 1.435037960133826e-14,
          "token": "\tA"
        }
      ],
      [
        {
          "prob": 1.0,
          "token": "\""
        },
        {
          "prob": 2.8453348089834e-08,
          "token": "\","
        },
        {
          "prob": 7.582560427911907e-10,
          "token": "”"
        },
        {
          "prob": 2.172439935079017e-10,
          "token": ",\""
        },
        {
          "prob": 7.991959892953932e-11,
          "token": "'"
        }
      ],
      [
        {
          "prob": 0.9999997615814777,
          "token": " or"
        },
        {
          "prob": 2.382369667501818e-07,
          "token": "或"
        },
        {
          "prob": 2.7894680928689246e-10,
          "token": "or"
        },
        {
          "prob": 1.3176514270095466e-10,
          "token": " или"
        },
        {
          "prob": 1.162823303022097e-10,
          "token": " 或"
        }
      ],
      [
        {
          "prob": 1.0,
          "token": " \""
        },
        {
          "prob": 1.4166087866431961e-09,
          "token": "\"C"
        },
        {
          "prob": 2.5946094982764667e-11,
          "token": " “"
        },
        {
          "prob": 3.0988191387218256e-12,
          "token": " '"
        },
        {
          "prob": 1.6586783589142312e-12,
          "token": "\""
        }
      ],
      [
        {
          "prob": 1.0,
          "token": "C"
        },
        {
          "prob": 8.592166619174109e-10,
          "token": " C"
        },
        {
          "prob": 1.026187963170189e-10,
          "token": "'C"
        },
        {
          "prob": 6.224144622907783e-11,
          "token": "Cc"
        },
        {
          "prob": 5.4927883509546835e-11,
          "token": "B"
        }
      ],
      [
        {
          "prob": 0.9999909401759619,
          "token": "\","
        },
        {
          "prob": 8.939699493298122e-06,
          "token": ",\""
        },
        {
          "prob": 7.734348146298033e-08,
          "token": "\""
        },
        {
          "prob": 1.1861007035426688e-08,
          "token": "\"،"
        },
        {
          "prob": 6.348739569456282e-09,
          "token": ","
        }
      ],
      [
        {
          "prob": 0.9739993089040481,
          "token": " indicates"
        },
        {
          "prob": 0.02595620001951453,
          "token": " in"
        },
        {
          "prob": 1.4355975384685254e-05,
          "token": " typically"
        },
        {
          "prob": 9.866707968481277e-06,
          "token": " indicating"
        },
        {
          "prob": 8.707339220891473e-06,
          "token": " indicated"
        }
      ],
      [
        {
          "prob": 0.959303899943177,
          "token": " an"
        },
        {
          "prob": 0.022560666746307544,
          "token": " that"
        },
        {
          "prob": 0.013683736085194785,
          "token": " additional"
        },
        {
          "prob": 0.0026944873955877854,
          "token": " a"
        },
        {
          "prob": 0.001634289217633235,
          "token": " it"
        }
      ],
      [
        {
          "prob": 0.9999847414437658,
          "token": " additional"
        },
        {
          "prob": 1.3007099179970686e-05,
          "token": "additional"
        },
        {
          "prob": 1.2098486863374133e-06,
          "token": " addition"
        },
        {
          "prob": 3.9278036114969935e-07,
          "token": " area"
        },
        {
          "prob": 2.699537311378345e-07,
          "token": " Additional"
        }
      ],
      [
        {
          "prob": 0.9870319662145466,
          "token": " section"
        },
        {
          "prob": 0.005869106095090779,
          "token": " specific"
        },
        {
          "prob": 0.0014839424128179264,
          "token": " designation"
        },
        {
          "prob": 0.001309574582925731,
          "token": " location"
        },
        {
          "prob": 0.001155695513135471,
          "token": " segment"
        }
      ],
      [
        {
          "prob": 0.7734649535332193,
          "token": " or"
        },
        {
          "prob": 0.11861467816482862,
          "token": " of"
        },
        {
          "prob": 0.10467708608152991,
          "token": " within"
        },
        {
          "prob": 0.0027895498558727526,
          "token": " on"
        },
        {
          "prob": 0.00033316421941488274,
          "token": " and"
        }
      ],
      [
        {
          "prob": 0.5374206364047558,
          "token": " wing"
        },
        {
          "prob": 0.4185436124707565,
          "token": " building"
        },
        {
          "prob": 0.02675660115661975,
          "token": " block"
        },
        {
          "prob": 0.005970204701104227,
          "token": " area"
        },
        {
          "prob": 0.0015095041434987902,
          "token": " subdivision"
        }
      ],
      [
        {
          "prob": 0.5301726039605084,
          "token": " within"
        },
        {
          "prob": 0.3215659200749088,
          "token": " of"
        },
        {
          "prob": 0.08130459725632136,
          "token": " on"
        },
        {
          "prob": 0.06332008401052827,
          "token": " in"
        },
        {
          "prob": 0.003572275544625622,
          "token": ","
        }
      ],
      [
        {
          "prob": 0.8175696552259107,
          "token": " the"
        },
        {
          "prob": 0.18242445897639878,
          "token": " a"
        },
        {
          "prob": 5.02332307241204e-06,
          "token": " that"
        },
        {
          "prob": 4.672418297205466e-07,
          "token": " an"
        },
        {
          "prob": 2.2070941240149879e-07,
          "token": " its"
        }
      ],
      [
        {
          "prob": 0.4556047355106373,
          "token": " ring"
        },
        {
          "prob": 0.16760760550452394,
          "token": " building"
        },
        {
          "prob": 0.08971388635299886,
          "token": " specified"
        },
        {
          "prob": 0.06165939224908783,
          "token": " laboratory"
        },
        {
          "prob": 0.06165939224908783,
          "token": " facility"
        }
      ],
      [
        {
          "prob": 0.5441027416963009,
          "token": " of"
        },
        {
          "prob": 0.4237476413043774,
          "token": ","
        },
        {
          "prob": 0.01449984519592626,
          "token": "."
        },
        {
          "prob": 0.004154275202363057,
          "token": " indicated"
        },
        {
          "prob": 0.0032353527806944673,
          "token": " or"
        }
      ],
      [
        {
          "prob": 0.8319555642781915,
          "token": " buildings"
        },
        {
          "prob": 0.08768747787807564,
          "token": " the"
        },
        {
          "prob": 0.05318514380592616,
          "token": " rooms"
        },
        {
          "prob": 0.009242192172134806,
          "token": " laboratories"
        },
        {
          "prob": 0.006352059592434099,
          "token": " facilities"
        }
      ],
      [
        {
          "prob": 0.7691321269185775,
          "token": ","
        },
        {
          "prob": 0.22036003721421202,
          "token": "."
        },
        {
          "prob": 0.005182370734237777,
          "token": " on"
        },
        {
          "prob": 0.005182370734237777,
          "token": " at"
        },
        {
          "prob": 0.00010755672449217487,
          "token": " and"
        }
      ],
      [
        {
          "prob": 0.27852536005363837,
          "token": " suggesting"
        },
        {
          "prob": 0.27852536005363837,
          "token": " specifying"
        },
        {
          "prob": 0.19142749383626098,
          "token": " specifically"
        },
        {
          "prob": 0.11610664412364344,
          "token": " often"
        },
        {
          "prob": 0.037694308491438684,
          "token": " typically"
        }
      ],
      [
        {
          "prob": 0.986887860238061,
          "token": " it"
        },
        {
          "prob": 0.008538253053910164,
          "token": " a"
        },
        {
          "prob": 0.0024462504567514293,
          "token": " specific"
        },
        {
          "prob": 0.0008999252509951014,
          "token": " the"
        },
        {
          "prob": 0.0004816952754079488,
          "token": " locations"
        }
      ],
      [
        {
          "prob": 0.9231761382781875,
          "token": "'s"
        },
        {
          "prob": 0.059016671200398926,
          "token": " could"
        },
        {
          "prob": 0.00798703981684649,
          "token": " is"
        },
        {
          "prob": 0.0037728104648890016,
          "token": " specifies"
        },
        {
          "prob": 0.0020194399189678827,
          "token": " might"
        }
      ],
      [
        {
          "prob": 0.8276552518939727,
          "token": " a"
        },
        {
          "prob": 0.16297498457050785,
          "token": " likely"
        },
        {
          "prob": 0.008114047666333246,
          "token": " part"
        },
        {
          "prob": 0.0005877796415135155,
          "token": " possibly"
        },
        {
          "prob": 0.00019082411088036907,
          "token": " specifically"
        }
      ],
      [
        {
          "prob": 0.9865721593711488,
          "token": " specific"
        },
        {
          "prob": 0.007532571383487593,
          "token": " laboratory"
        },
        {
          "prob": 0.0031400429202931746,
          "token": " specialized"
        },
        {
          "prob": 0.0005456576408629966,
          "token": " distinct"
        },
        {
          "prob": 0.0005456576408629966,
          "token": " part"
        }
      ],
      [
        {
          "prob": 0.6000085769881341,
          "token": " area"
        },
        {
          "prob": 0.3639235980338514,
          "token": " part"
        },
        {
          "prob": 0.01598968697080493,
          "token": " laboratory"
        },
        {
          "prob": 0.005191091327359477,
          "token": " subsection"
        },
        {
          "prob": 0.004581122017428494,
          "token": " lab"
        }
      ],
      [
        {
          "prob": 0.9634818830620356,
          "token": " or"
        },
        {
          "prob": 0.025675921240081848,
          "token": " within"
        },
        {
          "prob": 0.00833575316968942,
          "token": ","
        },
        {
          "prob": 0.001641407120732214,
          "token": " of"
        },
        {
          "prob": 0.0002852336521672412,
          "token": " possibly"
        }
      ],
      [
        {
          "prob": 0.4133849646767934,
          "token": " type"
        },
        {
          "prob": 0.19526923071934305,
          "token": " wing"
        },
        {
          "prob": 0.17232449127989696,
          "token": " laboratory"
        },
        {
          "prob": 0.10452007492087523,
          "token": " lab"
        },
        {
          "prob": 0.05594556461105956,
          "token": " facility"
        }
      ],
      [
        {
          "prob": 1.0,
          "token": " of"
        },
        {
          "prob": 1.3440409951135022e-08,
          "token": " within"
        },
        {
          "prob": 1.0467401794744658e-08,
          "token": ","
        },
        {
          "prob": 2.061153622438558e-09,
          "token": " like"
        },
        {
          "prob": 2.061153622438558e-09,
          "token": " ("
        }
      ],
      [
        {
          "prob": 0.9529027741783124,
          "token": " facility"
        },
        {
          "prob": 0.03694805282461649,
          "token": " space"
        },
        {
          "prob": 0.009341928514658867,
          "token": " room"
        },
        {
          "prob": 0.00041045569306318367,
          "token": " laboratory"
        },
        {
          "prob": 0.00011759752496117598,
          "token": " location"
        }
      ],
      [
        {
          "prob": 0.9109205363157344,
          "token": " such"
        },
        {
          "prob": 0.07477290985575502,
          "token": ","
        },
        {
          "prob": 0.012993586506811268,
          "token": " like"
        },
        {
          "prob": 0.0009412522495569364,
          "token": " within"
        },
        {
          "prob": 0.00034626735156836875,
          "token": "."
        }
      ],
      [
        {
          "prob": 1.0,
          "token": " as"
        },
        {
          "prob": 1.162823303022097e-10,
          "token": " a"
        },
        {
          "prob": 7.991959892953932e-11,
          "token": "as"
        },
        {
          "prob": 6.560200168153779e-12,
          "token": "作为"
        },
        {
          "prob": 2.7346982915918745e-12,
          "token": "\tas"
        }
      ],
      [
        {
          "prob": 1.0,
          "token": " a"
        },
        {
          "prob": 1.9555681087850496e-08,
          "token": " laboratory"
        },
        {
          "prob": 1.522997974471263e-08,
          "token": " an"
        },
        {
          "prob": 5.211412487888539e-10,
          "token": " another"
        },
        {
          "prob": 4.058652126475693e-10,
          "token": " laboratories"
        }
      ],
      [
        {
          "prob": 0.9998369482867208,
          "token": " laboratory"
        },
        {
          "prob": 0.0001584354856179393,
          "token": " lab"
        },
        {
          "prob": 3.726045485336082e-06,
          "token": "实验室"
        },
        {
          "prob": 3.465762175942344e-07,
          "token": " classroom"
        },
        {
          "prob": 2.3819811863644441e-07,
          "token": " Laboratory"
        }
      ],
      [
        {
          "prob": 0.9999870063564401,
          "token": "."
        },
        {
          "prob": 1.3007123989067183e-05,
          "token": " within"
        },
        {
          "prob": 4.1398824450223246e-08,
          "token": ","
        },
        {
          "prob": 2.2159193914233397e-08,
          "token": " in"
        },
        {
          "prob": 1.7257597572636077e-08,
          "token": " facility"
        }
      ],
      [
        {
          "prob": 0.9999988079084972,
          "token": ""
        },
        {
          "prob": 2.53601689161434e-07,
          "token": ""
        },
        {
          "prob": 1.275189375371399e-07,
          "token": "<tool_call>"
        },
        {
          "prob": 6.348788006680007e-09,
          "token": "UrlParser"
        },
        {
          "prob": 5.9641343865087276e-09,
          "token": "indre"
        }
      ]
    ],
    "language_consistency_score": 0.4913366248150977,
    "feedback": "Feedback: The response is mostly correct, as it indicates that the letter section represents a specific area or type of facility. However, it lacks the specific detail that the reference answer provides, which is that the letter section indicates a laboratory facility.",
    "score": 3
  },
  {
    "question": "What should you do if you need to evacuate a Skoltech building?\n",
    "true_answer": "You should walk to the nearest fire exit, take the stairs, check in with an employee in a bright vest, and follow the instructions of security and safety personnel. \n",
    "source_doc": "*Text Overlay:* \n\n1. *Walk to the nearest fire exit*   \n2. *Take the stairs (don’t take the elevators)*   \n3. *Check in with an employee in a bright vest*  \n4. *Follow the instructions of security and safety personnel.* \n\n![][image5]\n",
    "context": "",
    "generated_answer": "The document does not provide specific instructions for evacuating a Skoltech building.",
    "logprobs": [
      [
        {
          "prob": 0.411075582128795,
          "token": "The"
        },
        {
          "prob": 0.411075582128795,
          "token": "Use"
        },
        {
          "prob": 0.11777511913205047,
          "token": "If"
        },
        {
          "prob": 0.03823598301964377,
          "token": "You"
        },
        {
          "prob": 0.0066444191351805355,
          "token": "There"
        }
      ],
      [
        {
          "prob": 0.7519338702818279,
          "token": " document"
        },
        {
          "prob": 0.19011865583395604,
          "token": " context"
        },
        {
          "prob": 0.015605893323242238,
          "token": " question"
        },
        {
          "prob": 0.015605893323242238,
          "token": " information"
        },
        {
          "prob": 0.012153881940669863,
          "token": " given"
        }
      ],
      [
        {
          "prob": 0.9951934499443386,
          "token": " does"
        },
        {
          "prob": 0.002795294076661001,
          "token": " states"
        },
        {
          "prob": 0.0016954315604080135,
          "token": " indicates"
        },
        {
          "prob": 8.441056701106802e-05,
          "token": " suggests"
        },
        {
          "prob": 7.449206393267696e-05,
          "token": " provided"
        }
      ],
      [
        {
          "prob": 1.0,
          "token": " not"
        },
        {
          "prob": 3.6534822137210456e-08,
          "token": "not"
        },
        {
          "prob": 3.850741922767617e-09,
          "token": "_not"
        },
        {
          "prob": 5.211412487888539e-10,
          "token": " Not"
        },
        {
          "prob": 2.7894680928689246e-10,
          "token": " NOT"
        }
      ],
      [
        {
          "prob": 0.9887863162153515,
          "token": " provide"
        },
        {
          "prob": 0.01098442192249033,
          "token": " specify"
        },
        {
          "prob": 0.00010768748329601401,
          "token": "提供"
        },
        {
          "prob": 5.764095614263936e-05,
          "token": "provide"
        },
        {
          "prob": 4.4890821780872035e-05,
          "token": " contain"
        }
      ],
      [
        {
          "prob": 0.9977423967181347,
          "token": " specific"
        },
        {
          "prob": 0.001323785017514384,
          "token": " information"
        },
        {
          "prob": 0.00048699329247431963,
          "token": " specifics"
        },
        {
          "prob": 0.0002953763629600765,
          "token": "具体"
        },
        {
          "prob": 3.527767578414988e-05,
          "token": " instructions"
        }
      ],
      [
        {
          "prob": 0.9280089579912353,
          "token": " instructions"
        },
        {
          "prob": 0.05932562477097249,
          "token": " information"
        },
        {
          "prob": 0.0070854371499745284,
          "token": " details"
        },
        {
          "prob": 0.0015809747259954508,
          "token": " steps"
        },
        {
          "prob": 0.0013952052987555147,
          "token": " actions"
        }
      ],
      [
        {
          "prob": 0.9854807202274968,
          "token": " for"
        },
        {
          "prob": 0.014057129849552175,
          "token": " on"
        },
        {
          "prob": 0.00025746531413644387,
          "token": "."
        },
        {
          "prob": 0.00020051418826318773,
          "token": ","
        },
        {
          "prob": 2.860181283459223e-06,
          "token": ";"
        }
      ],
      [
        {
          "prob": 0.9940588316735076,
          "token": " evac"
        },
        {
          "prob": 0.005216341243925249,
          "token": " evacuation"
        },
        {
          "prob": 0.0003778704923176901,
          "token": " ev"
        },
        {
          "prob": 0.0002597064619790766,
          "token": " evacuate"
        },
        {
          "prob": 1.660247865588349e-05,
          "token": "ev"
        }
      ],
      [
        {
          "prob": 0.9999986886995842,
          "token": "uating"
        },
        {
          "prob": 5.043471815847051e-07,
          "token": "uing"
        },
        {
          "prob": 4.4508482557577276e-07,
          "token": "uting"
        },
        {
          "prob": 3.4663241069161144e-07,
          "token": "uations"
        },
        {
          "prob": 1.955564378838448e-08,
          "token": "ulating"
        }
      ],
      [
        {
          "prob": 0.9999417100552707,
          "token": " a"
        },
        {
          "prob": 5.829127258796956e-05,
          "token": " Sk"
        },
        {
          "prob": 2.0610317545466268e-09,
          "token": " an"
        },
        {
          "prob": 8.591658598218467e-10,
          "token": " buildings"
        },
        {
          "prob": 4.598783454629882e-10,
          "token": " the"
        }
      ],
      [
        {
          "prob": 0.9999998807907247,
          "token": " Sk"
        },
        {
          "prob": 1.1253517471925912e-07,
          "token": "Sk"
        },
        {
          "prob": 2.335593038799337e-09,
          "token": " building"
        },
        {
          "prob": 4.058652126475693e-10,
          "token": "_sk"
        },
        {
          "prob": 4.058652126475693e-10,
          "token": " SK"
        }
      ],
      [
        {
          "prob": 0.9999879600069962,
          "token": "ol"
        },
        {
          "prob": 1.1478757578876643e-05,
          "token": "olk"
        },
        {
          "prob": 2.3823401316229748e-07,
          "token": "olt"
        },
        {
          "prob": 2.1024077870602525e-07,
          "token": "ok"
        },
        {
          "prob": 3.6534404031744556e-08,
          "token": "oll"
        }
      ],
      [
        {
          "prob": 0.9992391895303306,
          "token": "tech"
        },
        {
          "prob": 0.00037983977758037686,
          "token": "Tech"
        },
        {
          "prob": 0.00023038447088092592,
          "token": " tech"
        },
        {
          "prob": 6.600625602948207e-05,
          "token": "itech"
        },
        {
          "prob": 5.140572388337227e-05,
          "token": "-tech"
        }
      ],
      [
        {
          "prob": 0.9999998807907247,
          "token": " building"
        },
        {
          "prob": 7.734421907141565e-08,
          "token": "building"
        },
        {
          "prob": 8.152020714470167e-09,
          "token": " buildings"
        },
        {
          "prob": 7.194133030325383e-09,
          "token": "-building"
        },
        {
          "prob": 6.34880011604368e-09,
          "token": " Building"
        }
      ],
      [
        {
          "prob": 0.9998303939575447,
          "token": "."
        },
        {
          "prob": 8.480383823137128e-05,
          "token": ";"
        },
        {
          "prob": 8.480383823137128e-05,
          "token": ","
        },
        {
          "prob": 7.1929119009119645e-09,
          "token": ".\n\n"
        },
        {
          "prob": 6.347722473118683e-09,
          "token": " and"
        }
      ],
      [
        {
          "prob": 0.9993938308075889,
          "token": ""
        },
        {
          "prob": 0.00017945132856396625,
          "token": " Further"
        },
        {
          "prob": 0.00013975683520882088,
          "token": " No"
        },
        {
          "prob": 7.027414998027616e-05,
          "token": " Additional"
        },
        {
          "prob": 4.8298669857592616e-05,
          "token": " Please"
        }
      ]
    ],
    "language_consistency_score": 0.7509235527092524,
    "feedback": "Feedback: The response states that the document does not provide specific instructions for evacuating a Skoltech building. This is accurate in the sense that it acknowledges the lack of information in the provided context. However, it does not attempt to provide the correct evacuation procedures as outlined in the reference answer. The response is not incorrect, but it fails to provide the necessary information to be considered correct or useful.",
    "score": 0
  },
  {
    "question": "Where can I find information about Skoltech policies?\n",
    "true_answer": "The Skoltech Wiki. \n",
    "source_doc": "* If you are unsure about a certain situation (e.g. terms of getting a scholarship), there is a good chance that we have a policy about it. Don’t forget to consult policies in our [Wiki  Ссылка:  Wiki (links to an external site)](https://wiki.skoltech.ru/pages/viewpage.action?pageId=136773929)  \n* Getting feedback from you makes Skoltech a better place for everyone. Tell us what you think\\! ## “Navigating the Skoltech Campus” \\- Module 2\n",
    "context": "Sim: 2.17 - Now along with the Code of Ethics, you will likely hear the term “Policy”. A Policy is an official document passed by Skoltech’s leadership team to optimize the university’s functions and/or activities. For instance, you can hear something like “Skoltech Policy on Student Scholarships and Other Benefits” or “Skoltech’s IP policy”, which, btw, you will learn about in the next modules.   \nSim: 1.87 - *       [Scholarship Policy](https://skoltech.instructure.com/courses/2072/files/folder/Policies/Scholarship-Related%20Documents?preview=247567)  \nSim: 1.63 - * [Skoltech Policy on Protection, Management and Commercialization of Intellectual Property  (links to an external site)](https://box.skoltech.ru/index.php/s/5ObKxspK8llpIGf\\#pdfviewer) (updated in June 2022\\)  \nSim: 1.22 - * If you are unsure about a certain situation (e.g. terms of getting a scholarship), there is a good chance that we have a policy about it. Don’t forget to consult policies in our [Wiki  Ссылка:  Wiki (links to an external site)](https://wiki.skoltech.ru/pages/viewpage.action?pageId=136773929)  \nSim: 1.00 - *       [IP regulations](https://skoltech.instructure.com/courses/2072/files/folder/Policies/IP%20Policy)\nSim: 0.62 - [Disciplinary Board Policy (links to an external site).](http://www.skoltech.ru/app/data/uploads/sites/2/2015/04/DISCIPLINARY-BOARD-POLICY.pdf)",
    "generated_answer": "You can find information about Skoltech policies in the Code of Ethics, on the university's Wiki, and in documents such as the Scholarship Policy, IP policy, and Disciplinary Board Policy.",
    "logprobs": [
      [
        {
          "prob": 0.9996819316122284,
          "token": "You"
        },
        {
          "prob": 0.00012337050096454524,
          "token": "For"
        },
        {
          "prob": 9.608104275909934e-05,
          "token": "Information"
        },
        {
          "prob": 6.603547058338595e-05,
          "token": "Sk"
        },
        {
          "prob": 1.0126867401904402e-05,
          "token": "P"
        }
      ],
      [
        {
          "prob": 1.0,
          "token": " can"
        },
        {
          "prob": 3.6534822137210456e-08,
          "token": "可以"
        },
        {
          "prob": 4.363462252943702e-09,
          "token": " Can"
        },
        {
          "prob": 2.646573638909117e-09,
          "token": "can"
        },
        {
          "prob": 4.058652126475693e-10,
          "token": "_can"
        }
      ],
      [
        {
          "prob": 0.9999995231630692,
          "token": " find"
        },
        {
          "prob": 2.1024338523818466e-07,
          "token": " consult"
        },
        {
          "prob": 2.1024338523818466e-07,
          "token": "find"
        },
        {
          "prob": 3.2241867372567335e-08,
          "token": ".find"
        },
        {
          "prob": 2.215948977336598e-08,
          "token": "找到"
        }
      ],
      [
        {
          "prob": 0.7548765637778384,
          "token": " information"
        },
        {
          "prob": 0.2450725462851988,
          "token": " Sk"
        },
        {
          "prob": 3.0244344107857836e-05,
          "token": " Information"
        },
        {
          "prob": 7.646967739610441e-06,
          "token": " policies"
        },
        {
          "prob": 3.1877304163504063e-06,
          "token": "Sk"
        }
      ],
      [
        {
          "prob": 0.9999997615814777,
          "token": " about"
        },
        {
          "prob": 2.699578503363014e-07,
          "token": "about"
        },
        {
          "prob": 1.0467401794744658e-08,
          "token": "关于"
        },
        {
          "prob": 4.5990553786523166e-10,
          "token": "_about"
        },
        {
          "prob": 2.7894680928689246e-10,
          "token": " on"
        }
      ],
      [
        {
          "prob": 0.9999992847447459,
          "token": " Sk"
        },
        {
          "prob": 6.47594599989589e-07,
          "token": "Sk"
        },
        {
          "prob": 7.734421907141565e-08,
          "token": "_sk"
        },
        {
          "prob": 4.363462252943702e-09,
          "token": " Skyl"
        },
        {
          "prob": 2.646573638909117e-09,
          "token": " sk"
        }
      ],
      [
        {
          "prob": 0.9999992847447459,
          "token": "ol"
        },
        {
          "prob": 3.4663241069161144e-07,
          "token": "olk"
        },
        {
          "prob": 1.6373755690670415e-07,
          "token": "olt"
        },
        {
          "prob": 5.3157852544244216e-08,
          "token": "ole"
        },
        {
          "prob": 4.691164021834418e-08,
          "token": "ол"
        }
      ],
      [
        {
          "prob": 0.9997598509638483,
          "token": "tech"
        },
        {
          "prob": 0.00012338014907459777,
          "token": "Tech"
        },
        {
          "prob": 7.483384321365884e-05,
          "token": "te"
        },
        {
          "prob": 2.1440255048196645e-05,
          "token": " tech"
        },
        {
          "prob": 1.1476141544909228e-05,
          "token": "itech"
        }
      ],
      [
        {
          "prob": 0.9999998807907247,
          "token": " policies"
        },
        {
          "prob": 6.82560337633487e-08,
          "token": " Policies"
        },
        {
          "prob": 5.3157852544244216e-08,
          "token": " pol"
        },
        {
          "prob": 4.363462252943702e-09,
          "token": "'s"
        },
        {
          "prob": 2.172439935079017e-10,
          "token": " policy"
        }
      ],
      [
        {
          "prob": 0.9858922321972678,
          "token": " in"
        },
        {
          "prob": 0.01406299616489453,
          "token": " on"
        },
        {
          "prob": 3.9500080820692096e-05,
          "token": " through"
        },
        {
          "prob": 4.7176118991905795e-06,
          "token": " at"
        },
        {
          "prob": 3.417426597592592e-07,
          "token": " by"
        }
      ],
      [
        {
          "prob": 0.8516456200450955,
          "token": " the"
        },
        {
          "prob": 0.1479938134069763,
          "token": " their"
        },
        {
          "prob": 0.0003237352681505091,
          "token": " documents"
        },
        {
          "prob": 1.826389405027189e-05,
          "token": " official"
        },
        {
          "prob": 7.613523760990633e-06,
          "token": " several"
        }
      ],
      [
        {
          "prob": 0.9659874525583975,
          "token": " Code"
        },
        {
          "prob": 0.017692675308886827,
          "token": " Wiki"
        },
        {
          "prob": 0.012159986052927669,
          "token": " university"
        },
        {
          "prob": 0.0008808664352139668,
          "token": " wiki"
        },
        {
          "prob": 0.0007773619006670599,
          "token": " University"
        }
      ],
      [
        {
          "prob": 1.0,
          "token": " of"
        },
        {
          "prob": 2.172439935079017e-10,
          "token": "_of"
        },
        {
          "prob": 2.5946094982764667e-11,
          "token": " của"
        },
        {
          "prob": 1.3887943864964021e-11,
          "token": " and"
        },
        {
          "prob": 8.423463754468647e-12,
          "token": " Of"
        }
      ],
      [
        {
          "prob": 0.9999941587791524,
          "token": " Ethics"
        },
        {
          "prob": 5.42221734436887e-06,
          "token": " ethics"
        },
        {
          "prob": 2.3823560355122348e-07,
          "token": " Eth"
        },
        {
          "prob": 6.023539370819118e-08,
          "token": "伦理"
        },
        {
          "prob": 6.023539370819118e-08,
          "token": "Eth"
        }
      ],
      [
        {
          "prob": 0.9982585292980256,
          "token": ","
        },
        {
          "prob": 0.0015008212213105747,
          "token": " document"
        },
        {
          "prob": 0.00017924744782694122,
          "token": " and"
        },
        {
          "prob": 5.1355253627365324e-05,
          "token": " or"
        },
        {
          "prob": 7.8755832173375e-06,
          "token": " documents"
        }
      ],
      [
        {
          "prob": 0.8881898917312863,
          "token": " on"
        },
        {
          "prob": 0.10607916621888255,
          "token": " the"
        },
        {
          "prob": 0.0017146096203012183,
          "token": " through"
        },
        {
          "prob": 0.0008099242356382667,
          "token": " their"
        },
        {
          "prob": 0.0005566522437871537,
          "token": " in"
        }
      ],
      [
        {
          "prob": 0.9932362296637404,
          "token": " the"
        },
        {
          "prob": 0.006692372571308753,
          "token": " their"
        },
        {
          "prob": 5.1096919494560516e-05,
          "token": " Sk"
        },
        {
          "prob": 1.2919324471872352e-05,
          "token": " Wiki"
        },
        {
          "prob": 1.9812425760428574e-06,
          "token": " policies"
        }
      ],
      [
        {
          "prob": 0.8185271938978413,
          "token": " university"
        },
        {
          "prob": 0.1611775513436811,
          "token": " Wiki"
        },
        {
          "prob": 0.013230259080249442,
          "token": " Sk"
        },
        {
          "prob": 0.0026051924788774174,
          "token": " wiki"
        },
        {
          "prob": 0.002028925942601467,
          "token": " ["
        }
      ],
      [
        {
          "prob": 0.9994116908177392,
          "token": "'s"
        },
        {
          "prob": 0.00048780812443969575,
          "token": "’s"
        },
        {
          "prob": 9.605511496163644e-05,
          "token": " Wiki"
        },
        {
          "prob": 3.2868252881979582e-06,
          "token": " wiki"
        },
        {
          "prob": 7.333898529355194e-07,
          "token": "Wiki"
        }
      ],
      [
        {
          "prob": 0.9689169764974145,
          "token": " Wiki"
        },
        {
          "prob": 0.02582076166324884,
          "token": " wiki"
        },
        {
          "prob": 0.002721488905756583,
          "token": " policies"
        },
        {
          "prob": 0.001870450147275074,
          "token": " ["
        },
        {
          "prob": 0.00028684282032046053,
          "token": " website"
        }
      ],
      [
        {
          "prob": 0.9996091463601251,
          "token": ","
        },
        {
          "prob": 0.00026115642348428406,
          "token": " ("
        },
        {
          "prob": 8.47850772506549e-05,
          "token": " page"
        },
        {
          "prob": 3.534367854130636e-05,
          "token": " and"
        },
        {
          "prob": 3.7251963114174943e-06,
          "token": " at"
        }
      ],
      [
        {
          "prob": 0.9947934850132433,
          "token": " and"
        },
        {
          "prob": 0.0024658469595343446,
          "token": " in"
        },
        {
          "prob": 0.0014956117831167572,
          "token": " or"
        },
        {
          "prob": 0.00042849995010357323,
          "token": " Scholarship"
        },
        {
          "prob": 0.0002293593860456507,
          "token": " the"
        }
      ],
      [
        {
          "prob": 0.7425689292696794,
          "token": " in"
        },
        {
          "prob": 0.2127495538946675,
          "token": " through"
        },
        {
          "prob": 0.02879252113479782,
          "token": " on"
        },
        {
          "prob": 0.009347565256512504,
          "token": " from"
        },
        {
          "prob": 0.00303471012431997,
          "token": " via"
        }
      ],
      [
        {
          "prob": 0.4581165999590462,
          "token": " documents"
        },
        {
          "prob": 0.3148586275880252,
          "token": " official"
        },
        {
          "prob": 0.11583001596508997,
          "token": " various"
        },
        {
          "prob": 0.10221963031551615,
          "token": " specific"
        },
        {
          "prob": 0.0044912171121820775,
          "token": " the"
        }
      ],
      [
        {
          "prob": 0.8674129078032267,
          "token": " such"
        },
        {
          "prob": 0.06283518778017695,
          "token": " linked"
        },
        {
          "prob": 0.03811146789747793,
          "token": " like"
        },
        {
          "prob": 0.026193603284922894,
          "token": " available"
        },
        {
          "prob": 0.0016745010353021103,
          "token": " accessible"
        }
      ],
      [
        {
          "prob": 1.0,
          "token": " as"
        },
        {
          "prob": 3.1608814543136926e-10,
          "token": "作为"
        },
        {
          "prob": 5.4927883509546835e-11,
          "token": "as"
        },
        {
          "prob": 2.9400777392844726e-11,
          "token": "\tas"
        },
        {
          "prob": 3.5114221133765118e-12,
          "token": " als"
        }
      ],
      [
        {
          "prob": 0.9961130893001309,
          "token": " the"
        },
        {
          "prob": 0.0027978770968218746,
          "token": " scholarship"
        },
        {
          "prob": 0.000908337702848638,
          "token": " Scholarship"
        },
        {
          "prob": 6.579973112364116e-05,
          "token": " those"
        },
        {
          "prob": 3.9909554327335966e-05,
          "token": " policies"
        }
      ],
      [
        {
          "prob": 0.9983741296305949,
          "token": " Scholarship"
        },
        {
          "prob": 0.0009103995686602465,
          "token": " scholarship"
        },
        {
          "prob": 0.0006257078629561129,
          "token": " Scholar"
        },
        {
          "prob": 5.136122906971519e-05,
          "token": " IP"
        },
        {
          "prob": 1.471523850110844e-05,
          "token": " Sch"
        }
      ],
      [
        {
          "prob": 0.9999898673126559,
          "token": " Policy"
        },
        {
          "prob": 4.78506719451317e-06,
          "token": "Policy"
        },
        {
          "prob": 4.2228069778170326e-06,
          "token": ","
        },
        {
          "prob": 6.475884240756635e-07,
          "token": " policy"
        },
        {
          "prob": 1.855371898888086e-07,
          "token": "_policy"
        }
      ],
      [
        {
          "prob": 0.9999151301890851,
          "token": ","
        },
        {
          "prob": 8.48110364334263e-05,
          "token": " and"
        },
        {
          "prob": 7.581924100817951e-10,
          "token": ",,"
        },
        {
          "prob": 2.789234001213198e-10,
          "token": " or"
        },
        {
          "prob": 2.6202428559831763e-10,
          "token": " ("
        }
      ],
      [
        {
          "prob": 0.999715409232722,
          "token": " IP"
        },
        {
          "prob": 0.00013980189195671698,
          "token": " Intellectual"
        },
        {
          "prob": 0.00013980189195671698,
          "token": " Sk"
        },
        {
          "prob": 3.7255942265612038e-06,
          "token": "IP"
        },
        {
          "prob": 3.926747425117096e-07,
          "token": " IPs"
        }
      ],
      [
        {
          "prob": 0.6224489044493103,
          "token": " policy"
        },
        {
          "prob": 0.37753434465304614,
          "token": " Policy"
        },
        {
          "prob": 7.145030790640883e-06,
          "token": "政策"
        },
        {
          "prob": 3.824459387810609e-06,
          "token": " policies"
        },
        {
          "prob": 2.9784919660516883e-06,
          "token": "_policy"
        }
      ],
      [
        {
          "prob": 0.9999934435319415,
          "token": ","
        },
        {
          "prob": 6.144171336422507e-06,
          "token": " on"
        },
        {
          "prob": 1.8553789765836951e-07,
          "token": " and"
        },
        {
          "prob": 8.764198070156538e-08,
          "token": " for"
        },
        {
          "prob": 6.825564320030807e-08,
          "token": " related"
        }
      ],
      [
        {
          "prob": 0.9993602556715925,
          "token": " and"
        },
        {
          "prob": 0.0005527305561228095,
          "token": " Disc"
        },
        {
          "prob": 5.825737200699216e-05,
          "token": " IP"
        },
        {
          "prob": 1.1471556714890746e-05,
          "token": " Protection"
        },
        {
          "prob": 1.01236132687146e-05,
          "token": " disciplinary"
        }
      ],
      [
        {
          "prob": 0.9992078861427669,
          "token": " Disc"
        },
        {
          "prob": 0.0002958102065570878,
          "token": " Discipline"
        },
        {
          "prob": 0.0002958102065570878,
          "token": " the"
        },
        {
          "prob": 9.603551342854165e-05,
          "token": " others"
        },
        {
          "prob": 6.600417876262311e-05,
          "token": " disciplinary"
        }
      ],
      [
        {
          "prob": 1.0,
          "token": "iplinary"
        },
        {
          "prob": 4.139937718785167e-08,
          "token": "ipl"
        },
        {
          "prob": 1.162823303022097e-10,
          "token": "iplina"
        },
        {
          "prob": 2.4374100555808313e-11,
          "token": "pl"
        },
        {
          "prob": 1.304651588236747e-11,
          "token": "ulsive"
        }
      ],
      [
        {
          "prob": 0.9999992847447459,
          "token": " Board"
        },
        {
          "prob": 7.33820819192633e-07,
          "token": "Board"
        },
        {
          "prob": 2.510999155743982e-08,
          "token": "_board"
        },
        {
          "prob": 3.850741922767617e-09,
          "token": " Boards"
        },
        {
          "prob": 1.8189616875530459e-09,
          "token": " BOARD"
        }
      ],
      [
        {
          "prob": 0.9999100050888825,
          "token": " Policy"
        },
        {
          "prob": 8.481063202385453e-05,
          "token": " policy"
        },
        {
          "prob": 4.7846884476613034e-06,
          "token": "Policy"
        },
        {
          "prob": 2.382156108626421e-07,
          "token": "_policy"
        },
        {
          "prob": 1.1252508691228128e-07,
          "token": "_POLICY"
        }
      ],
      [
        {
          "prob": 0.9929775722518401,
          "token": "."
        },
        {
          "prob": 0.006690630418238538,
          "token": " available"
        },
        {
          "prob": 0.00025942377065909914,
          "token": " posted"
        },
        {
          "prob": 2.4130169516960417e-05,
          "token": " accessible"
        },
        {
          "prob": 1.6584406804415626e-05,
          "token": " on"
        }
      ],
      [
        {
          "prob": 0.9948381980986798,
          "token": ""
        },
        {
          "prob": 0.0019204896226069326,
          "token": " Additionally"
        },
        {
          "prob": 0.0010279640188524833,
          "token": " Links"
        },
        {
          "prob": 0.0007065086491401926,
          "token": " Policies"
        },
        {
          "prob": 0.0006234916945154466,
          "token": " These"
        }
      ]
    ],
    "language_consistency_score": 0.6827902187714363,
    "feedback": "Feedback: The response provides multiple sources where Skoltech policies can be found, which is more detailed than the reference answer. However, the reference answer specifically mentions the Skoltech Wiki as the primary source, and the response does not emphasize this as the main source. The response is mostly correct and factual, but it includes additional information that was not explicitly asked for in the question.",
    "score": 4
  },
  {
    "question": "What are the six target domains of Skoltech's research and education activities?\n",
    "true_answer": "The six target domains are Artificial Intelligence & Telecommunications, Cutting-edge Engineering, Advanced Materials, Photonics, Life Sciences & Health, Agro, Energy Efficiency & ESG, and Advanced Studies. \n",
    "source_doc": "Ah, wait, let’s back up a little. Skoltech was established in 2011 in collaboration with MIT with the vision of being a worldleading institute of science and technology and the mission to impact economy and society development by academic and technology excellence and entrepreneurial spirit. Skoltech became a home for talents who are working in promising areas of global science and technology agenda. The broad, but well-structured portfolio divided among several Centers covers Artificial Intelligence and Communications, Life Sciences and Health, Cutting-edge Engineering and Advanced Materials, Energy Efficiency and ESG, Photonics, and Advanced Studies. Skoltech research excellence is globally recognized: the Institute appeared among top-100 world’s leading young universities in the prestigious Nature Index ranking. To learn more about the faculty, students, alumni, and their achievements, see the link below. You can also find more information about the university’s achievements there as well. Today Skoltech brings together some of the most qualified, high-achieving faculty, researchers and students from around the world. So as you join this community, be sure that with their help, you will master and apply unique technological competencies that are shaping the future and humanity literally as we speak right now. *Text Overlay: Skoltech’s Strategy and Goals*\n\nSkoltech’s mission, as stated in the Skoltech Strategy 2021-2025, is to facilitate the economy and society development by academic and technology excellence and entrepreneurial spirit. Our unofficial motto is: “Targeting excellence today, we impact tomorrow”. In context of these aspirations, you will witness Skoltech becoming: a world leading university producing substantial economic impact in Russia a full-fledged university providing education in BSc, MSc and PhD programs the 1st choice university for the brightest students in Russia. You can find more information about Skoltech’s five-year plan in the links below. Let’s now take a look at Governance & Management, which includes: Leadership, Collegial Bodies, Structure: Centers & Departments, Programs Management: Directors, Coordinators & Research Advisors\n\n*Text Overlays: Governance & Management  — Leadership, Collegial Bodies, Structure: Centers & Departments, Programs Management: Directors, Coordinators & Research Advisors*\n\nSo, who is behind Skoltech? You will obviously get to know your professors and fellow students in the next few weeks, but you should also probably know who runs the university on the administrative side. You know, just to have an idea. Skoltech was founded by the top Russian companies and leading institutes. Among them are VEB.RF, Sber, MIPT, New Economic School, Moscow School of Management.The Founders are entitled to approve the Charter, establish the Institute's governance bodies, and appoint the Board of Trustees. You can read more about the Founders below. Honored academics, statesmen and businessmen make up the Board of Trustees. Members of the Board set and hold Skoltech accountable for following its strategies, as well as oversee the development of the university. The final key player of the Skoltech government bodies is the Student Council, whose role is to voice student needs to the university administration. Each year, students elect the Council and its President, Vice President and Coordinator to represent you over the course of the next academic year. You will learn more about the Student Council’s role and activities in the next module.Meanwhile, let’s see what happens behind the scenes of the day-to-day management\\! Below you will see Skoltech’s current leadership team . It consists of the University President and Provost, as well as several Vice Presidents and Deans responsible for different areas of the university’s management. You will get to know team members and leaders of these departments as you attend Skoltech events throughout your time here. Skoltech’s research and education activities revolve around several target domains: \n\n* Artificial Intelligence & Telecommunications  \n* Cutting-edge Engineering, Advanced Materials  \n* Photonics  \n* Life Sciences & Health, Agro  \n* Energy Efficiency & ESG  \n* Advanced Studies\n\n*Text Overlay: **several target domains**:* \n\n* *Artificial Intelligence & Telecommunications*  \n* *Cutting-edge Engineering, Advanced Materials*  \n* *Photonics*  \n* *Life Sciences & Health, Agro*  \n* *Energy Efficiency & ESG*  \n* *Advanced Studies*\n\nBy the way, management doesn’t cover just academics and research, right? There are entire departments responsible for cooperation with industry, communications and student affairs. For instance, you will most likely hear from these people quite often: \n\n* Education Department — about your academic affairs, curriculum and more  \n* Student Department — about student activities, benefits, scholarships and more  \n* Accommodation team — if you’re living in the dorms, you will get to know the housing team pretty well:)\n\n*Text Overlay:* \n\n- *Education Department*   \n- *Student Department*  \n- *Accommodation team* \n\nFinally, the people you will interact the most with are members of your Centers and Programs. You will most likely hear from your Program Director and Coordinator, as well as spend a ton of time with your research advisor while working on your research. Now you know you’ll meet a lot of people here.",
    "context": "Sim: 4.87 -  Skoltech’s research and education activities revolve around several target domains: \nSim: 2.03 - Skoltech’s mission, as stated in the Skoltech Strategy 2021-2025, is to facilitate the economy and society development by academic and technology excellence and entrepreneurial spirit. Our unofficial motto is: “Targeting excellence today, we impact tomorrow”. In context of these aspirations, you will witness Skoltech becoming: a world leading university producing substantial economic impact in Russia a full-fledged university providing education in BSc, MSc and PhD programs the 1st choice university for the brightest students in Russia. You can find more information about Skoltech’s five-year plan in the links below. \nSim: 1.86 - Let us start by saying that you’ve come to a very unique university. Skoltech is a one-of-a-kind institute in Russia, and one with few similar educational organizations worldwide. Don’t get us wrong \\- there are dozens of incredible universities out there, but can you think of one that has been named among the Top 100 in just the first 8 years of its existence? Exactly\\! Ah, wait, let’s back up a little. Skoltech was established in 2011 in collaboration with MIT with the vision of being a worldleading institute of science and technology and the mission to impact economy and society development by academic and technology excellence and entrepreneurial spirit. Skoltech became a home for talents who are working in promising areas of global science and technology agenda. The broad, but well-structured portfolio divided among several Centers covers Artificial Intelligence and Communications, Life Sciences and Health, Cutting-edge Engineering and Advanced Materials, Energy Efficiency and ESG, Photonics, and Advanced Studies. Skoltech research excellence is globally recognized: the Institute appeared among top-100 world’s leading young universities in the prestigious Nature Index ranking. To learn more about the faculty, students, alumni, and their achievements, see the link below. You can also find more information about the university’s achievements there as well.   \nSim: 1.03 - Skoltech hosts more than 25 world-class laboratories based in Centers for Research, Education and Innovation (CREIs) established in collaboration with international and Russian Partners. Students have full access to the facilities throughout their studies and can conduct research based on their interests in IT, Biomedicine, Energy, Space, Cross Cutting Science. As part of your MSc Thesis project, you will develop very specific studies that go deep into one of the following topics: ",
    "generated_answer": "Skoltech's research and education activities revolve around six target domains: Artificial Intelligence and Communications, Life Sciences and Health, Cutting-edge Engineering and Advanced Materials, Energy Efficiency and ESG, Photonics, and Advanced Studies.",
    "logprobs": [
      [
        {
          "prob": 0.836985198937677,
          "token": "Sk"
        },
        {
          "prob": 0.1454462099597855,
          "token": "The"
        },
        {
          "prob": 0.017371072578641702,
          "token": "Art"
        },
        {
          "prob": 8.044402542599752e-05,
          "token": "Based"
        },
        {
          "prob": 6.264986999518287e-05,
          "token": "According"
        }
      ],
      [
        {
          "prob": 0.9999498154071286,
          "token": "ol"
        },
        {
          "prob": 3.120130788180609e-05,
          "token": "olk"
        },
        {
          "prob": 6.1439018035682605e-06,
          "token": "oll"
        },
        {
          "prob": 4.222637839536983e-06,
          "token": "ол"
        },
        {
          "prob": 2.5611593145418954e-06,
          "token": "olt"
        }
      ],
      [
        {
          "prob": 0.9999854566779314,
          "token": "tech"
        },
        {
          "prob": 8.939648340073653e-06,
          "token": "Tech"
        },
        {
          "prob": 2.260297072940795e-06,
          "token": " tech"
        },
        {
          "prob": 9.422320028995207e-07,
          "token": "techn"
        },
        {
          "prob": 7.33811021693085e-07,
          "token": "te"
        }
      ],
      [
        {
          "prob": 0.9999069062148269,
          "token": "'s"
        },
        {
          "prob": 6.605033467044703e-05,
          "token": "’s"
        },
        {
          "prob": 1.670013992084406e-05,
          "token": " focuses"
        },
        {
          "prob": 1.0129146883482833e-05,
          "token": " targets"
        },
        {
          "prob": 6.023010900482085e-08,
          "token": " does"
        }
      ],
      [
        {
          "prob": 0.8991673250563695,
          "token": " research"
        },
        {
          "prob": 0.0947715472855434,
          "token": " six"
        },
        {
          "prob": 0.006058542321215142,
          "token": " target"
        },
        {
          "prob": 8.472364251050107e-07,
          "token": "六个"
        },
        {
          "prob": 8.472364251050107e-07,
          "token": "六"
        }
      ],
      [
        {
          "prob": 1.0,
          "token": " and"
        },
        {
          "prob": 1.9555681087850496e-08,
          "token": "和"
        },
        {
          "prob": 2.7894680928689246e-10,
          "token": " и"
        },
        {
          "prob": 2.172439935079017e-10,
          "token": " activities"
        },
        {
          "prob": 1.6918979226151304e-10,
          "token": " và"
        }
      ],
      [
        {
          "prob": 0.9999909401759619,
          "token": " education"
        },
        {
          "prob": 6.144159617356885e-06,
          "token": "教育"
        },
        {
          "prob": 2.260310006501394e-06,
          "token": "education"
        },
        {
          "prob": 5.714958684372363e-07,
          "token": " educational"
        },
        {
          "prob": 1.2501409440567903e-09,
          "token": " Education"
        }
      ],
      [
        {
          "prob": 0.999997854237364,
          "token": " activities"
        },
        {
          "prob": 1.370956471489639e-06,
          "token": "activities"
        },
        {
          "prob": 7.338201193668986e-07,
          "token": "活动"
        },
        {
          "prob": 4.691155074157667e-08,
          "token": " Activities"
        },
        {
          "prob": 1.18610975280741e-08,
          "token": " focus"
        }
      ],
      [
        {
          "prob": 0.9844414823606593,
          "token": " rev"
        },
        {
          "prob": 0.010936157365939751,
          "token": " target"
        },
        {
          "prob": 0.004023187460344868,
          "token": " focus"
        },
        {
          "prob": 0.00048050122028243296,
          "token": " are"
        },
        {
          "prob": 6.50287377343352e-05,
          "token": "rev"
        }
      ],
      [
        {
          "prob": 0.9999992847447459,
          "token": "olve"
        },
        {
          "prob": 5.715002286213223e-07,
          "token": "olved"
        },
        {
          "prob": 7.734421907141565e-08,
          "token": "olv"
        },
        {
          "prob": 2.510999155743982e-08,
          "token": "ol"
        },
        {
          "prob": 5.602796437537268e-09,
          "token": "italize"
        }
      ],
      [
        {
          "prob": 0.9999998807907247,
          "token": " around"
        },
        {
          "prob": 6.023573837886479e-08,
          "token": "around"
        },
        {
          "prob": 9.237449661970594e-09,
          "token": "-around"
        },
        {
          "prob": 1.6052280551856116e-09,
          "token": " Around"
        },
        {
          "prob": 8.592166619174109e-10,
          "token": "围绕"
        }
      ],
      [
        {
          "prob": 0.4699767202668836,
          "token": " six"
        },
        {
          "prob": 0.2850552901930527,
          "token": " the"
        },
        {
          "prob": 0.13465058476908187,
          "token": " several"
        },
        {
          "prob": 0.09254390329472495,
          "token": " Artificial"
        },
        {
          "prob": 0.01419206722146281,
          "token": " five"
        }
      ],
      [
        {
          "prob": 0.9999986886995842,
          "token": " target"
        },
        {
          "prob": 9.422445831379603e-07,
          "token": " domains"
        },
        {
          "prob": 3.059020287707785e-07,
          "token": " targeted"
        },
        {
          "prob": 5.315775115378354e-08,
          "token": "target"
        },
        {
          "prob": 3.224180587614433e-08,
          "token": " main"
        }
      ],
      [
        {
          "prob": 0.9999897481064004,
          "token": " domains"
        },
        {
          "prob": 1.0129987330277146e-05,
          "token": "domains"
        },
        {
          "prob": 1.637359953911235e-07,
          "token": "_domains"
        },
        {
          "prob": 1.1861007035426688e-08,
          "token": " areas"
        },
        {
          "prob": 8.151942971113056e-09,
          "token": " domain"
        }
      ],
      [
        {
          "prob": 0.9999724634116024,
          "token": ":"
        },
        {
          "prob": 2.7535687796947383e-05,
          "token": " including"
        },
        {
          "prob": 3.224100643331903e-08,
          "token": " which"
        },
        {
          "prob": 2.510932105727906e-08,
          "token": ","
        },
        {
          "prob": 1.955515890180025e-08,
          "token": "："
        }
      ],
      [
        {
          "prob": 0.9999991655356624,
          "token": " Artificial"
        },
        {
          "prob": 7.33820819192633e-07,
          "token": " AI"
        },
        {
          "prob": 1.1253517471925912e-07,
          "token": " \n"
        },
        {
          "prob": 5.3157852544244216e-08,
          "token": " Art"
        },
        {
          "prob": 2.510999155743982e-08,
          "token": " artificial"
        }
      ],
      [
        {
          "prob": 0.9999991655356624,
          "token": " Intelligence"
        },
        {
          "prob": 6.47594599989589e-07,
          "token": " intelligence"
        },
        {
          "prob": 1.275189375371399e-07,
          "token": " Intelligent"
        },
        {
          "prob": 7.734421907141565e-08,
          "token": " Intel"
        },
        {
          "prob": 1.186112015134383e-08,
          "token": "intelligence"
        }
      ],
      [
        {
          "prob": 1.0,
          "token": " and"
        },
        {
          "prob": 2.335593038799337e-09,
          "token": "和"
        },
        {
          "prob": 5.905303998944039e-10,
          "token": " &"
        },
        {
          "prob": 6.224144622907783e-11,
          "token": ","
        },
        {
          "prob": 2.5946094982764667e-11,
          "token": " và"
        }
      ],
      [
        {
          "prob": 0.9999958276922101,
          "token": " Communications"
        },
        {
          "prob": 3.2887473357670864e-06,
          "token": " Communication"
        },
        {
          "prob": 8.31525547079287e-07,
          "token": "Communic"
        },
        {
          "prob": 4.691146126497983e-08,
          "token": " communications"
        },
        {
          "prob": 5.602775064605783e-09,
          "token": "communications"
        }
      ],
      [
        {
          "prob": 1.0,
          "token": ","
        },
        {
          "prob": 8.592166619174109e-10,
          "token": ";"
        },
        {
          "prob": 1.2917800047859961e-12,
          "token": ",\n"
        },
        {
          "prob": 5.384940217754036e-13,
          "token": "，"
        },
        {
          "prob": 1.5428112031918877e-13,
          "token": ",,"
        }
      ],
      [
        {
          "prob": 0.9999990463265931,
          "token": " Life"
        },
        {
          "prob": 9.422445831379603e-07,
          "token": "Life"
        },
        {
          "prob": 2.215948977336598e-08,
          "token": " Lif"
        },
        {
          "prob": 1.522997974471263e-08,
          "token": "_life"
        },
        {
          "prob": 1.3440409951135022e-08,
          "token": "-Life"
        }
      ],
      [
        {
          "prob": 1.0,
          "token": " Sciences"
        },
        {
          "prob": 4.691164021834418e-08,
          "token": " sciences"
        },
        {
          "prob": 2.8453348089834e-08,
          "token": " Science"
        },
        {
          "prob": 5.211412487888539e-10,
          "token": " Scientists"
        },
        {
          "prob": 2.4616969518153846e-10,
          "token": " Sci"
        }
      ],
      [
        {
          "prob": 1.0,
          "token": " and"
        },
        {
          "prob": 6.691586091292782e-10,
          "token": "和"
        },
        {
          "prob": 7.433680672352188e-12,
          "token": ","
        },
        {
          "prob": 5.789356328730652e-12,
          "token": " и"
        },
        {
          "prob": 1.8795288165390832e-12,
          "token": " và"
        }
      ],
      [
        {
          "prob": 0.9999986886995842,
          "token": " Health"
        },
        {
          "prob": 1.0677029917933763e-06,
          "token": "Health"
        },
        {
          "prob": 1.8553895931777327e-07,
          "token": " Heath"
        },
        {
          "prob": 1.7257795071296986e-08,
          "token": "_health"
        },
        {
          "prob": 1.2501504819116561e-09,
          "token": " Healthcare"
        }
      ],
      [
        {
          "prob": 1.0,
          "token": ","
        },
        {
          "prob": 6.914400106940203e-13,
          "token": ",\n"
        },
        {
          "prob": 3.701011678592672e-13,
          "token": ",,"
        },
        {
          "prob": 1.7482341282710566e-13,
          "token": "，"
        },
        {
          "prob": 1.2015425731771786e-13,
          "token": " ,"
        }
      ],
      [
        {
          "prob": 0.9999629272857378,
          "token": " Cutting"
        },
        {
          "prob": 3.1201724466990604e-05,
          "token": " Cut"
        },
        {
          "prob": 3.7265145681330178e-06,
          "token": "Cut"
        },
        {
          "prob": 1.7602808402881647e-06,
          "token": " Advanced"
        },
        {
          "prob": 1.8553223557747954e-07,
          "token": "_cut"
        }
      ],
      [
        {
          "prob": 0.9999952316511552,
          "token": "-edge"
        },
        {
          "prob": 4.222831140981511e-06,
          "token": "-"
        },
        {
          "prob": 5.043452576565602e-07,
          "token": "-ed"
        },
        {
          "prob": 2.5109895770606383e-08,
          "token": " Edge"
        },
        {
          "prob": 9.23741442396384e-09,
          "token": "=edge"
        }
      ],
      [
        {
          "prob": 0.999991059383269,
          "token": " Engineering"
        },
        {
          "prob": 8.939699493298122e-06,
          "token": "Engineering"
        },
        {
          "prob": 2.510975209104135e-08,
          "token": " Engineer"
        },
        {
          "prob": 1.7257663405271917e-08,
          "token": " engineering"
        },
        {
          "prob": 9.237361567205748e-09,
          "token": "工程"
        }
      ],
      [
        {
          "prob": 1.0,
          "token": " and"
        },
        {
          "prob": 3.581747930283181e-10,
          "token": ","
        },
        {
          "prob": 1.3176514270095466e-10,
          "token": "和"
        },
        {
          "prob": 3.0988191387218256e-12,
          "token": " и"
        },
        {
          "prob": 2.413362771833214e-12,
          "token": "and"
        }
      ],
      [
        {
          "prob": 0.999991059383269,
          "token": " Advanced"
        },
        {
          "prob": 8.939699493298122e-06,
          "token": "Advanced"
        },
        {
          "prob": 3.398235411242209e-09,
          "token": " Advance"
        },
        {
          "prob": 1.2501409440567903e-09,
          "token": " Advances"
        },
        {
          "prob": 5.905247681845038e-10,
          "token": " advanced"
        }
      ],
      [
        {
          "prob": 0.9999955892755635,
          "token": " Materials"
        },
        {
          "prob": 4.222831140981511e-06,
          "token": "Materials"
        },
        {
          "prob": 7.734392402719739e-08,
          "token": "材料"
        },
        {
          "prob": 6.825577338773997e-08,
          "token": " materials"
        },
        {
          "prob": 2.8453239549131867e-08,
          "token": " Material"
        }
      ],
      [
        {
          "prob": 1.0,
          "token": ","
        },
        {
          "prob": 2.129785170955785e-12,
          "token": ",,"
        },
        {
          "prob": 1.2917800047859961e-12,
          "token": ",\n"
        },
        {
          "prob": 6.101936677605324e-13,
          "token": "，"
        },
        {
          "prob": 4.1937956583795446e-13,
          "token": " ("
        }
      ],
      [
        {
          "prob": 0.9999976158197796,
          "token": " Energy"
        },
        {
          "prob": 2.2603250957489616e-06,
          "token": "Energy"
        },
        {
          "prob": 1.1253496007565217e-07,
          "token": "_energy"
        },
        {
          "prob": 1.8189582181622667e-09,
          "token": "能源"
        },
        {
          "prob": 5.211402547917536e-10,
          "token": " energy"
        }
      ],
      [
        {
          "prob": 0.999997854237364,
          "token": " Efficiency"
        },
        {
          "prob": 1.067701973552941e-06,
          "token": "效率"
        },
        {
          "prob": 7.338201193668986e-07,
          "token": " efficiency"
        },
        {
          "prob": 2.6995733543305574e-07,
          "token": "Eff"
        },
        {
          "prob": 6.825590357542018e-08,
          "token": " Efficient"
        }
      ],
      [
        {
          "prob": 1.0,
          "token": " and"
        },
        {
          "prob": 1.6052280551856116e-09,
          "token": "和"
        },
        {
          "prob": 1.2501528663867426e-09,
          "token": ","
        },
        {
          "prob": 2.020683909022217e-11,
          "token": " и"
        },
        {
          "prob": 1.3887943864964021e-11,
          "token": " và"
        }
      ],
      [
        {
          "prob": 0.9999998807907247,
          "token": " E"
        },
        {
          "prob": 1.4449802461092448e-07,
          "token": " Sustainability"
        },
        {
          "prob": 1.3440409951135022e-08,
          "token": " Environmental"
        },
        {
          "prob": 1.8189616875530459e-09,
          "token": " sustainability"
        },
        {
          "prob": 8.592166619174109e-10,
          "token": " Sustainable"
        }
      ],
      [
        {
          "prob": 0.9999998807907247,
          "token": "SG"
        },
        {
          "prob": 8.764248219443636e-08,
          "token": " SG"
        },
        {
          "prob": 3.6534822137210456e-08,
          "token": "SO"
        },
        {
          "prob": 1.522997974471263e-08,
          "token": "SR"
        },
        {
          "prob": 4.099093439508832e-09,
          "token": "ES"
        }
      ],
      [
        {
          "prob": 1.0,
          "token": ","
        },
        {
          "prob": 1.186112015134383e-08,
          "token": " ("
        },
        {
          "prob": 1.2256067444099483e-11,
          "token": "，"
        },
        {
          "prob": 9.545034922840628e-12,
          "token": " Photon"
        },
        {
          "prob": 7.433680672352188e-12,
          "token": ",\n"
        }
      ],
      [
        {
          "prob": 0.9999597088831099,
          "token": " Photon"
        },
        {
          "prob": 4.0063692636795675e-05,
          "token": "Photon"
        },
        {
          "prob": 2.1023496425073303e-07,
          "token": " photon"
        },
        {
          "prob": 6.825329986899493e-08,
          "token": " Phot"
        },
        {
          "prob": 3.3981317069099697e-09,
          "token": " and"
        }
      ],
      [
        {
          "prob": 1.0,
          "token": "ics"
        },
        {
          "prob": 1.6052280551856116e-09,
          "token": "ICS"
        },
        {
          "prob": 3.775134544279098e-11,
          "token": "omics"
        },
        {
          "prob": 1.783247290814639e-11,
          "token": "cs"
        },
        {
          "prob": 1.57371021068629e-11,
          "token": "ons"
        }
      ],
      [
        {
          "prob": 1.0,
          "token": ","
        },
        {
          "prob": 1.493094676197164e-10,
          "token": "，"
        },
        {
          "prob": 2.020683909022217e-11,
          "token": ",and"
        },
        {
          "prob": 1.57371021068629e-11,
          "token": " and"
        },
        {
          "prob": 4.508755242294825e-12,
          "token": ",,"
        }
      ],
      [
        {
          "prob": 1.0,
          "token": " and"
        },
        {
          "prob": 4.5990553786523166e-10,
          "token": " Advanced"
        },
        {
          "prob": 3.581747930283181e-10,
          "token": "和"
        },
        {
          "prob": 1.3887943864964021e-11,
          "token": " và"
        },
        {
          "prob": 1.3887943864964021e-11,
          "token": " и"
        }
      ],
      [
        {
          "prob": 0.9999920130413283,
          "token": " Advanced"
        },
        {
          "prob": 7.88926463665814e-06,
          "token": "Advanced"
        },
        {
          "prob": 6.02352788184049e-08,
          "token": " Advance"
        },
        {
          "prob": 1.5229863549631703e-08,
          "token": " Advances"
        },
        {
          "prob": 1.5229863549631703e-08,
          "token": " advanced"
        }
      ],
      [
        {
          "prob": 0.9999930859092101,
          "token": " Studies"
        },
        {
          "prob": 6.962258245244699e-06,
          "token": "Studies"
        },
        {
          "prob": 1.9555531890413292e-08,
          "token": " Stud"
        },
        {
          "prob": 4.3634289624956445e-09,
          "token": " studies"
        },
        {
          "prob": 3.850712544050321e-09,
          "token": " Study"
        }
      ],
      [
        {
          "prob": 1.0,
          "token": "."
        },
        {
          "prob": 1.6052280551856116e-09,
          "token": ","
        },
        {
          "prob": 5.905303998944039e-10,
          "token": ".\n\n"
        },
        {
          "prob": 4.5990553786523166e-10,
          "token": "。"
        },
        {
          "prob": 1.026187963170189e-10,
          "token": ".\n"
        }
      ],
      [
        {
          "prob": 0.9999979734461775,
          "token": ""
        },
        {
          "prob": 3.466320801173418e-07,
          "token": ""
        },
        {
          "prob": 1.8553878237411744e-07,
          "token": "<tool_call>"
        },
        {
          "prob": 9.931175369924415e-08,
          "token": " However"
        },
        {
          "prob": 1.3440384315611926e-08,
          "token": "uxe"
        }
      ]
    ],
    "language_consistency_score": 0.5565909611869655,
    "feedback": "Feedback: The response is mostly correct, accurate, and factual. However, it omits one of the six target domains, \"Agro,\" which is included in the reference answer. The response lists five domains correctly but fails to mention the sixth domain.",
    "score": 4
  },
  {
    "question": "Is the Skoltech Orientation course part of the academic curriculum?\n",
    "true_answer": "No, the Orientation course is not part of the academic curriculum. \n",
    "source_doc": "\n### Video 1 \n\nHi there, and congratulations on your admission to Skoltech\\! It was a big challenge, but the fact that you’ve made it means you have every bit of potential to succeed in your studies here. We are happy to have you onboard. My name is CyberBoris, and I will be your guide for this intro course. And here is what our course is for:   \nSkoltech will provide you with the resources, opportunities and skills to succeed. Although your classroom work will begin a bit later, your actual Skoltech journey is starting right now with this Orientation course. Orientation is mandatory for every incoming student. You can’t bypass it, sorry. We do ask you to take this seriously, as the information you’ll learn in the course will serve as the foundation to your time at Skoltech. Here’s how it’s going to work: I’m gonna go through the main points and break them down for you. We’ll also do a tour of the Skoltech campus, and explain the key locations throughout so you don’t get lost when you get here for the first time. You can find the important information from the videos in the text below, along with links to resources from both Skoltech and other useful sources. For example, underneath this video you can find a link to STUDENT ACADEMIC INTEGRITY REGULATIONS, along with a description of the course, and links to the separate modules. Please note that a number of text questions will refer to the linked content, so study them in detail. Finally, we want to highlight that although Orientation is not part of your academic curriculum, it is still part of your education at Skoltech. Your performance in this course falls under the same rules and regulations as all academic and research activities.",
    "context": "Sim: 7.42 - Finally, we want to highlight that although Orientation is not part of your academic curriculum, it is still part of your education at Skoltech. Your performance in this course falls under the same rules and regulations as all academic and research activities. in the university as they relate to academic misconduct. That means: No copying or publishing any information or material from this course. Using your common sense and/or contacting Education if you have questions or technical issues with the course material.   \nSim: 2.50 - Skoltech will provide you with the resources, opportunities and skills to succeed. Although your classroom work will begin a bit later, your actual Skoltech journey is starting right now with this Orientation course. Orientation is mandatory for every incoming student. You can’t bypass it, sorry. We do ask you to take this seriously, as the information you’ll learn in the course will serve as the foundation to your time at Skoltech.\nSim: 2.05 - We bet one of the reasons why you got interested in Skoltech is its research-based curriculum, are we right? Even if not, every program dedicates time for students' independent research as part of your academic plan.\nSim: 1.28 - As you now know, your curriculum at Skoltech will comprise compulsory and elective courses in various disciplines. While you will certainly dive deep into your subject area studies throughout your studies, you will also get practical training in applying your knowledge. In this section, we will talk about a few compulsory courses within your Master’s program curriculum that will teach you about entrepreneurship, innovation, industrial application and your required research component.   \nSim: 0.25 - Our [next module](https://skoltech.instructure.com/courses/3974/assignments/22739) is devoted to the education process, student status requirements and detailed program curriculum.",
    "generated_answer": "No, the Skoltech Orientation course is not part of the academic curriculum, but it is still part of the education at Skoltech and subject to the same rules and regulations.",
    "logprobs": [
      [
        {
          "prob": 0.9999886752461923,
          "token": "No"
        },
        {
          "prob": 5.422186318281121e-06,
          "token": "The"
        },
        {
          "prob": 1.994710872696699e-06,
          "token": "Although"
        },
        {
          "prob": 1.760326166706652e-06,
          "token": " No"
        },
        {
          "prob": 1.2098533015526917e-06,
          "token": "-No"
        }
      ],
      [
        {
          "prob": 0.9933039728192784,
          "token": ","
        },
        {
          "prob": 0.0066928289244517665,
          "token": "."
        },
        {
          "prob": 1.8613311846359997e-06,
          "token": ""
        },
        {
          "prob": 2.22304308308487e-07,
          "token": "。"
        },
        {
          "prob": 1.842967446846888e-07,
          "token": "repid"
        }
      ],
      [
        {
          "prob": 0.6632956033786502,
          "token": " the"
        },
        {
          "prob": 0.3133186669538681,
          "token": " Orientation"
        },
        {
          "prob": 0.01767623173117788,
          "token": " although"
        },
        {
          "prob": 0.002392217827894959,
          "token": " but"
        },
        {
          "prob": 0.0018630611176419694,
          "token": " it"
        }
      ],
      [
        {
          "prob": 0.9704893368459645,
          "token": " Sk"
        },
        {
          "prob": 0.029306237247331154,
          "token": " Orientation"
        },
        {
          "prob": 0.0001974638733151417,
          "token": " orientation"
        },
        {
          "prob": 2.4857033250329706e-06,
          "token": "Orientation"
        },
        {
          "prob": 2.1936254850858265e-06,
          "token": " Orient"
        }
      ],
      [
        {
          "prob": 0.9999998807907247,
          "token": "ol"
        },
        {
          "prob": 5.3157852544244216e-08,
          "token": "olt"
        },
        {
          "prob": 2.215948977336598e-08,
          "token": "olk"
        },
        {
          "prob": 8.152020714470167e-09,
          "token": "ол"
        },
        {
          "prob": 7.194133030325383e-09,
          "token": "col"
        }
      ],
      [
        {
          "prob": 0.9901235606058242,
          "token": "tech"
        },
        {
          "prob": 0.009706831476333801,
          "token": "Tech"
        },
        {
          "prob": 5.093675248127253e-05,
          "token": " tech"
        },
        {
          "prob": 3.966958271952937e-05,
          "token": "-tech"
        },
        {
          "prob": 2.123359751520754e-05,
          "token": "otech"
        }
      ],
      [
        {
          "prob": 0.9999880792130387,
          "token": " Orientation"
        },
        {
          "prob": 1.147876852587815e-05,
          "token": "Orientation"
        },
        {
          "prob": 5.043418907999665e-07,
          "token": " orientation"
        },
        {
          "prob": 2.5109704198035704e-08,
          "token": "_orientation"
        },
        {
          "prob": 1.186098441237271e-08,
          "token": " Orient"
        }
      ],
      [
        {
          "prob": 0.9999995231630692,
          "token": " course"
        },
        {
          "prob": 3.4663274126619643e-07,
          "token": " is"
        },
        {
          "prob": 4.139937718785167e-08,
          "token": "课程"
        },
        {
          "prob": 3.2241867372567335e-08,
          "token": "course"
        },
        {
          "prob": 1.7257827987960214e-08,
          "token": " Course"
        }
      ],
      [
        {
          "prob": 0.9998205030304157,
          "token": " is"
        },
        {
          "prob": 0.00017952801482389944,
          "token": ","
        },
        {
          "prob": 5.314832268618444e-08,
          "token": " falls"
        },
        {
          "prob": 6.34766193680844e-09,
          "token": " does"
        },
        {
          "prob": 1.2499287456068488e-09,
          "token": " was"
        }
      ],
      [
        {
          "prob": 0.9999760395072578,
          "token": " not"
        },
        {
          "prob": 1.670130259541543e-05,
          "token": " highlighted"
        },
        {
          "prob": 3.726564322802432e-06,
          "token": " described"
        },
        {
          "prob": 2.260275517170922e-06,
          "token": " mentioned"
        },
        {
          "prob": 4.4507463850915234e-07,
          "token": "not"
        }
      ],
      [
        {
          "prob": 0.9999924898711537,
          "token": " part"
        },
        {
          "prob": 4.222819059381988e-06,
          "token": " explicitly"
        },
        {
          "prob": 1.760332881830875e-06,
          "token": "part"
        },
        {
          "prob": 6.475902768436569e-07,
          "token": " officially"
        },
        {
          "prob": 4.4508185432392294e-07,
          "token": " considered"
        }
      ],
      [
        {
          "prob": 1.0,
          "token": " of"
        },
        {
          "prob": 9.545034922840628e-12,
          "token": " của"
        },
        {
          "prob": 1.6586783589142312e-12,
          "token": "ของ"
        },
        {
          "prob": 8.878265478459658e-13,
          "token": "_of"
        },
        {
          "prob": 1.9810087980489796e-13,
          "token": "of"
        }
      ],
      [
        {
          "prob": 1.0,
          "token": " the"
        },
        {
          "prob": 4.691164021834418e-08,
          "token": " your"
        },
        {
          "prob": 3.331544542166412e-11,
          "token": " its"
        },
        {
          "prob": 2.5946094982764667e-11,
          "token": "the"
        },
        {
          "prob": 7.835041785064389e-13,
          "token": " their"
        }
      ],
      [
        {
          "prob": 0.9999828341569776,
          "token": " academic"
        },
        {
          "prob": 1.3007074370921508e-05,
          "token": " formal"
        },
        {
          "prob": 1.9946994589021863e-06,
          "token": "academic"
        },
        {
          "prob": 9.422293071559931e-07,
          "token": "学术"
        },
        {
          "prob": 6.4758410097096e-07,
          "token": " official"
        }
      ],
      [
        {
          "prob": 1.0,
          "token": " curriculum"
        },
        {
          "prob": 4.691164021834418e-08,
          "token": " Curriculum"
        },
        {
          "prob": 9.237449661970594e-09,
          "token": " curvature"
        },
        {
          "prob": 6.34880011604368e-09,
          "token": " coursework"
        },
        {
          "prob": 4.363462252943702e-09,
          "token": "cur"
        }
      ],
      [
        {
          "prob": 0.4972236327613915,
          "token": ","
        },
        {
          "prob": 0.4972236327613915,
          "token": " but"
        },
        {
          "prob": 0.005523656602785243,
          "token": "."
        },
        {
          "prob": 7.328679488288492e-06,
          "token": ";"
        },
        {
          "prob": 4.445068804854063e-06,
          "token": " officially"
        }
      ],
      [
        {
          "prob": 0.9995735318946571,
          "token": " but"
        },
        {
          "prob": 0.0002611472084944401,
          "token": " though"
        },
        {
          "prob": 0.0001583937886502454,
          "token": " although"
        },
        {
          "prob": 2.560197145647331e-06,
          "token": "但"
        },
        {
          "prob": 2.2593660510396917e-06,
          "token": " despite"
        }
      ],
      [
        {
          "prob": 0.9999961853172863,
          "token": " it"
        },
        {
          "prob": 2.260320784525092e-06,
          "token": " is"
        },
        {
          "prob": 1.2098625320360655e-06,
          "token": " still"
        },
        {
          "prob": 2.699568205307921e-07,
          "token": "它"
        },
        {
          "prob": 1.3440358680137724e-08,
          "token": "it"
        }
      ],
      [
        {
          "prob": 0.9999094091471806,
          "token": " is"
        },
        {
          "prob": 5.828938252836796e-05,
          "token": " still"
        },
        {
          "prob": 2.429862972658863e-05,
          "token": " falls"
        },
        {
          "prob": 7.888610094163941e-06,
          "token": " does"
        },
        {
          "prob": 7.733728582983326e-08,
          "token": " remains"
        }
      ],
      [
        {
          "prob": 0.9615542584033385,
          "token": " still"
        },
        {
          "prob": 0.03728350187897092,
          "token": " part"
        },
        {
          "prob": 0.0011258644699929923,
          "token": " considered"
        },
        {
          "prob": 2.3366560468181498e-05,
          "token": "still"
        },
        {
          "prob": 5.213784379383307e-06,
          "token": " Still"
        }
      ],
      [
        {
          "prob": 0.5079171133427728,
          "token": " part"
        },
        {
          "prob": 0.3490859657078012,
          "token": " subject"
        },
        {
          "prob": 0.1284215499853792,
          "token": " considered"
        },
        {
          "prob": 0.011945067723457468,
          "token": " governed"
        },
        {
          "prob": 0.0020757415230878355,
          "token": " regulated"
        }
      ],
      [
        {
          "prob": 1.0,
          "token": " of"
        },
        {
          "prob": 4.8473687062702556e-11,
          "token": "_of"
        },
        {
          "prob": 4.277787868968998e-11,
          "token": " của"
        },
        {
          "prob": 9.545034922840628e-12,
          "token": "of"
        },
        {
          "prob": 6.560200168153779e-12,
          "token": "ของ"
        }
      ],
      [
        {
          "prob": 0.8655331557294431,
          "token": " the"
        },
        {
          "prob": 0.1327338004885238,
          "token": " your"
        },
        {
          "prob": 0.0016708719609283928,
          "token": " education"
        },
        {
          "prob": 3.46778577564863e-05,
          "token": " one"
        },
        {
          "prob": 1.6380660124874694e-05,
          "token": " educational"
        }
      ],
      [
        {
          "prob": 0.9602913740002799,
          "token": " education"
        },
        {
          "prob": 0.03285936397162458,
          "token": " students"
        },
        {
          "prob": 0.004447030269819995,
          "token": " educational"
        },
        {
          "prob": 0.0011243853359527603,
          "token": " overall"
        },
        {
          "prob": 0.0008756721801140143,
          "token": " student"
        }
      ],
      [
        {
          "prob": 0.9995942570688551,
          "token": " at"
        },
        {
          "prob": 0.00029592448179598503,
          "token": " and"
        },
        {
          "prob": 5.827098544438044e-05,
          "token": " process"
        },
        {
          "prob": 1.891781919992059e-05,
          "token": " under"
        },
        {
          "prob": 1.669491684758531e-05,
          "token": "."
        }
      ],
      [
        {
          "prob": 0.9999998807907247,
          "token": " Sk"
        },
        {
          "prob": 9.931194312156244e-08,
          "token": "Sk"
        },
        {
          "prob": 2.215948977336598e-08,
          "token": " the"
        },
        {
          "prob": 3.398267819495071e-09,
          "token": "_sk"
        },
        {
          "prob": 2.061153622438558e-09,
          "token": " SK"
        }
      ],
      [
        {
          "prob": 0.9999974966112362,
          "token": "ol"
        },
        {
          "prob": 9.422427859507568e-07,
          "token": "olk"
        },
        {
          "prob": 8.315263400842229e-07,
          "token": "col"
        },
        {
          "prob": 1.1253496007565217e-07,
          "token": "pol"
        },
        {
          "prob": 1.1253496007565217e-07,
          "token": "ол"
        }
      ],
      [
        {
          "prob": 0.999913580732002,
          "token": "tech"
        },
        {
          "prob": 5.1440395764016145e-05,
          "token": "itech"
        },
        {
          "prob": 1.0129214503059147e-05,
          "token": "Tech"
        },
        {
          "prob": 7.888640186880695e-06,
          "token": " tech"
        },
        {
          "prob": 3.7263297708910677e-06,
          "token": "te"
        }
      ],
      [
        {
          "prob": 0.9240217871376133,
          "token": " and"
        },
        {
          "prob": 0.07584833334189857,
          "token": "."
        },
        {
          "prob": 0.00010063408440404311,
          "token": ","
        },
        {
          "prob": 1.2019027409178464e-05,
          "token": " with"
        },
        {
          "prob": 1.0606754460679349e-05,
          "token": " subject"
        }
      ],
      [
        {
          "prob": 0.3998108006669151,
          "token": " subject"
        },
        {
          "prob": 0.352831814238834,
          "token": " falls"
        },
        {
          "prob": 0.1297995706496884,
          "token": " is"
        },
        {
          "prob": 0.10108800726430946,
          "token": " follows"
        },
        {
          "prob": 0.010654597578162325,
          "token": " its"
        }
      ],
      [
        {
          "prob": 1.0,
          "token": " to"
        },
        {
          "prob": 3.581747930283181e-10,
          "token": "to"
        },
        {
          "prob": 1.57371021068629e-11,
          "token": "_to"
        },
        {
          "prob": 5.109089028063325e-12,
          "token": " under"
        },
        {
          "prob": 2.413362771833214e-12,
          "token": "\tto"
        }
      ],
      [
        {
          "prob": 0.9985494228438467,
          "token": " the"
        },
        {
          "prob": 0.0013248560164092443,
          "token": " academic"
        },
        {
          "prob": 6.596069706654291e-05,
          "token": " similar"
        },
        {
          "prob": 5.821011085354494e-05,
          "token": " its"
        },
        {
          "prob": 5.036161368447351e-07,
          "token": " same"
        }
      ],
      [
        {
          "prob": 0.9988288306331643,
          "token": " same"
        },
        {
          "prob": 0.0011695080768348448,
          "token": " university"
        },
        {
          "prob": 1.3693531735165987e-06,
          "token": "same"
        },
        {
          "prob": 9.919570578397538e-08,
          "token": " institution"
        },
        {
          "prob": 5.309563518088013e-08,
          "token": " rules"
        }
      ],
      [
        {
          "prob": 0.9980209969523598,
          "token": " rules"
        },
        {
          "prob": 0.001168562659489634,
          "token": " regulations"
        },
        {
          "prob": 0.0008031405874626909,
          "token": " academic"
        },
        {
          "prob": 6.132054056268185e-06,
          "token": "rules"
        },
        {
          "prob": 4.442045059569635e-07,
          "token": " regulatory"
        }
      ],
      [
        {
          "prob": 0.9995055260934049,
          "token": " and"
        },
        {
          "prob": 0.0004878539497848498,
          "token": " as"
        },
        {
          "prob": 6.141171985085246e-06,
          "token": " regarding"
        },
        {
          "prob": 4.44865006505127e-07,
          "token": "."
        },
        {
          "prob": 1.1855262165947196e-08,
          "token": "和"
        }
      ],
      [
        {
          "prob": 0.9999994039539004,
          "token": " regulations"
        },
        {
          "prob": 3.4663241069161144e-07,
          "token": " regulation"
        },
        {
          "prob": 1.4449788680693535e-07,
          "token": " regulatory"
        },
        {
          "prob": 7.734421907141565e-08,
          "token": " Regulations"
        },
        {
          "prob": 3.850741922767617e-09,
          "token": " policies"
        }
      ],
      [
        {
          "prob": 0.6221198883831276,
          "token": "."
        },
        {
          "prob": 0.37733477507591545,
          "token": " as"
        },
        {
          "prob": 0.0003898992250247888,
          "token": " regarding"
        },
        {
          "prob": 0.0001434358406197428,
          "token": " related"
        },
        {
          "prob": 9.169546511206347e-06,
          "token": " concerning"
        }
      ],
      [
        {
          "prob": 0.9999985694905718,
          "token": ""
        },
        {
          "prob": 3.6898828046256017e-07,
          "token": ""
        },
        {
          "prob": 1.9750519410715577e-07,
          "token": "<tool_call>"
        },
        {
          "prob": 7.658100140818556e-09,
          "token": "ıklı"
        },
        {
          "prob": 5.263330122692228e-09,
          "token": "🤖"
        }
      ]
    ],
    "language_consistency_score": 0.7426050760128844,
    "feedback": "Feedback: The response is mostly correct and factual, stating that the Skoltech Orientation course is not part of the academic curriculum. However, it includes additional information about the course being subject to the same rules and regulations, which is not explicitly asked for in the question. This additional information, while potentially useful, is not necessary to answer the question accurately.",
    "score": 4
  },
  {
    "question": "What email address should I use to order a car pass for the Skolkovo Innovation Center Territory?\n",
    "true_answer": "security.campus@skoltech.ru \n",
    "source_doc": "Wait for an email confirmation from the security team before trying to enter the gates. You should get an answer within 10-20 minutes. Third, you can drive your personal car. This is surely a comfortable way, but it also involves a few nuances like parking and a security pass. Let’s go in order. If you decide to drive your own car, you will first need to order a security pass to enter the Skolkovo Innovation Center Territory. Without this pass, security will not let you through the territory gates no matter how hard you try to convince them. To order a car pass, send an email to security.campus@skoltech.ru from your Skoltech email address that ends with @skoltech.ru. In that email, write the following information: \n\n1.",
    "context": "Sim: 5.47 - To order a car pass, send an email to security.campus@skoltech.ru from your Skoltech email address that ends with @skoltech.ru. In that email, write the following information: \nSim: 3.00 - To order a pass for your taxi, email security.campus@skoltech.ru from your Skoltech email address with your taxi’s model and license number (i.e. Toyota, Х111СК197). \nSim: 0.63 - If you decide to drive your own car, you will first need to order a security pass to enter the Skolkovo Innovation Center Territory. Without this pass, security will not let you through the territory gates no matter how hard you try to convince them. ",
    "generated_answer": "security.campus@skoltech.ru",
    "logprobs": [
      [
        {
          "prob": 0.9998006026187986,
          "token": "security"
        },
        {
          "prob": 8.480133113591516e-05,
          "token": " security"
        },
        {
          "prob": 8.480133113591516e-05,
          "token": "To"
        },
        {
          "prob": 1.0128074690531338e-05,
          "token": "You"
        },
        {
          "prob": 4.784163727469807e-06,
          "token": "Security"
        }
      ],
      [
        {
          "prob": 1.0,
          "token": ".c"
        },
        {
          "prob": 9.237449661970594e-09,
          "token": ";c"
        },
        {
          "prob": 7.194133030325383e-09,
          "token": "@c"
        },
        {
          "prob": 4.363462252943702e-09,
          "token": ":c"
        },
        {
          "prob": 2.9989608248573072e-09,
          "token": ")c"
        }
      ],
      [
        {
          "prob": 0.9998955835638214,
          "token": "ampus"
        },
        {
          "prob": 9.610166172631932e-05,
          "token": "amp"
        },
        {
          "prob": 4.222412332368445e-06,
          "token": " campus"
        },
        {
          "prob": 1.99452635769203e-06,
          "token": "camp"
        },
        {
          "prob": 9.421475399340762e-07,
          "token": "AMP"
        }
      ],
      [
        {
          "prob": 1.0,
          "token": "@"
        },
        {
          "prob": 2.4616969518153846e-10,
          "token": "@gmail"
        },
        {
          "prob": 1.6918979226151304e-10,
          "token": "@s"
        },
        {
          "prob": 2.9400777392844726e-11,
          "token": "@mail"
        },
        {
          "prob": 2.9400777392844726e-11,
          "token": "@g"
        }
      ],
      [
        {
          "prob": 1.0,
          "token": "sk"
        },
        {
          "prob": 2.646573638909117e-09,
          "token": ".sk"
        },
        {
          "prob": 2.646573638909117e-09,
          "token": "ski"
        },
        {
          "prob": 1.2501528663867426e-09,
          "token": " sk"
        },
        {
          "prob": 9.736200313009565e-10,
          "token": "sku"
        }
      ],
      [
        {
          "prob": 1.0,
          "token": "ol"
        },
        {
          "prob": 3.6534822137210456e-08,
          "token": "olk"
        },
        {
          "prob": 7.194133030325383e-09,
          "token": "ол"
        },
        {
          "prob": 7.582560427911907e-10,
          "token": "olt"
        },
        {
          "prob": 2.7894680928689246e-10,
          "token": "pol"
        }
      ],
      [
        {
          "prob": 0.9999879600069962,
          "token": "tech"
        },
        {
          "prob": 2.9022844265838405e-06,
          "token": "tek"
        },
        {
          "prob": 1.994708970393078e-06,
          "token": "Tech"
        },
        {
          "prob": 1.7603244879295989e-06,
          "token": "itech"
        },
        {
          "prob": 1.2098521477472216e-06,
          "token": " tech"
        }
      ],
      [
        {
          "prob": 0.9999996423722521,
          "token": ".ru"
        },
        {
          "prob": 1.1253517471925912e-07,
          "token": ".rs"
        },
        {
          "prob": 7.734421907141565e-08,
          "token": " ru"
        },
        {
          "prob": 3.2241867372567335e-08,
          "token": ".r"
        },
        {
          "prob": 2.510999155743982e-08,
          "token": ".rb"
        }
      ],
      [
        {
          "prob": 0.9999907017622996,
          "token": ""
        },
        {
          "prob": 7.8114149124915e-07,
          "token": "<tool_call>"
        },
        {
          "prob": 4.7378626401625717e-07,
          "token": ""
        },
        {
          "prob": 1.3574203732712616e-07,
          "token": "."
        },
        {
          "prob": 9.329404693617776e-08,
          "token": "ienie"
        }
      ]
    ],
    "language_consistency_score": 0.44442843766653634,
    "feedback": "Feedback: The response is completely correct, accurate, and factual. It matches the reference answer exactly, providing the correct email address for ordering a car pass for the Skolkovo Innovation Center Territory.",
    "score": 5
  },
  {
    "question": "Where can I find more information about fire safety at Skoltech?\n",
    "true_answer": "The Skoltech instruction for fire safety can be found at https://box.skoltech.ru/index.php/s/PWWi2TSueEeAn1E. \n",
    "source_doc": "\n### For more details on fire safety consult our [instruction](https://box.skoltech.ru/index.php/s/PWWi2TSueEeAn1E) \n",
    "context": "Sim: 2.85 - ### For more details on fire safety consult our [instruction](https://box.skoltech.ru/index.php/s/PWWi2TSueEeAn1E) ",
    "generated_answer": "You can find more information about fire safety at Skoltech in the provided instruction at <https://box.skoltech.ru/index.php/s/PWWi2TSueEeAn1E>.",
    "logprobs": [
      [
        {
          "prob": 0.9901905293903934,
          "token": "You"
        },
        {
          "prob": 0.008566824674639772,
          "token": "Consult"
        },
        {
          "prob": 0.0010231612995128024,
          "token": "For"
        },
        {
          "prob": 0.00017779877380222166,
          "token": "More"
        },
        {
          "prob": 8.852079707013587e-06,
          "token": " Consult"
        }
      ],
      [
        {
          "prob": 1.0,
          "token": " can"
        },
        {
          "prob": 5.3157852544244216e-08,
          "token": "可以"
        },
        {
          "prob": 2.9989608248573072e-09,
          "token": "can"
        },
        {
          "prob": 7.582560427911907e-10,
          "token": " Can"
        },
        {
          "prob": 1.493094676197164e-10,
          "token": "_can"
        }
      ],
      [
        {
          "prob": 0.9999996423722521,
          "token": " find"
        },
        {
          "prob": 2.699578503363014e-07,
          "token": " consult"
        },
        {
          "prob": 6.82560337633487e-08,
          "token": "find"
        },
        {
          "prob": 1.7257827987960214e-08,
          "token": "找到"
        },
        {
          "prob": 8.152020714470167e-09,
          "token": ".find"
        }
      ],
      [
        {
          "prob": 1.0,
          "token": " more"
        },
        {
          "prob": 1.9555681087850496e-08,
          "token": "更多"
        },
        {
          "prob": 1.0467401794744658e-08,
          "token": "more"
        },
        {
          "prob": 7.582560427911907e-10,
          "token": "_more"
        },
        {
          "prob": 6.691586091292782e-10,
          "token": "更多的"
        }
      ],
      [
        {
          "prob": 0.9999986886995842,
          "token": " information"
        },
        {
          "prob": 6.47594599989589e-07,
          "token": "information"
        },
        {
          "prob": 5.715002286213223e-07,
          "token": " details"
        },
        {
          "prob": 3.6534752452633856e-08,
          "token": " detailed"
        },
        {
          "prob": 2.845329381943118e-08,
          "token": "信息"
        }
      ],
      [
        {
          "prob": 0.9999994039539004,
          "token": " about"
        },
        {
          "prob": 5.043471815847051e-07,
          "token": " on"
        },
        {
          "prob": 1.275189375371399e-07,
          "token": "about"
        },
        {
          "prob": 2.8453348089834e-08,
          "token": "关于"
        },
        {
          "prob": 1.917171513758312e-10,
          "token": "_about"
        }
      ],
      [
        {
          "prob": 0.9999998807907247,
          "token": " fire"
        },
        {
          "prob": 9.931194312156244e-08,
          "token": "fire"
        },
        {
          "prob": 9.237449661970594e-09,
          "token": "火"
        },
        {
          "prob": 9.736200313009565e-10,
          "token": "消防"
        },
        {
          "prob": 9.736200313009565e-10,
          "token": " Fire"
        }
      ],
      [
        {
          "prob": 0.9999997615814777,
          "token": " safety"
        },
        {
          "prob": 2.382369667501818e-07,
          "token": "安全"
        },
        {
          "prob": 1.522997974471263e-08,
          "token": " Safety"
        },
        {
          "prob": 2.061153622438558e-09,
          "token": "Safety"
        },
        {
          "prob": 4.5990553786523166e-10,
          "token": " safely"
        }
      ],
      [
        {
          "prob": 0.9999785427891018,
          "token": " at"
        },
        {
          "prob": 2.1444958378736654e-05,
          "token": " by"
        },
        {
          "prob": 2.646518112166888e-09,
          "token": " through"
        },
        {
          "prob": 1.250126637410931e-09,
          "token": " ["
        },
        {
          "prob": 6.691445697702166e-10,
          "token": "at"
        }
      ],
      [
        {
          "prob": 0.9999984502816872,
          "token": " Sk"
        },
        {
          "prob": 1.370956471489639e-06,
          "token": "Sk"
        },
        {
          "prob": 1.1253496007565217e-07,
          "token": " ["
        },
        {
          "prob": 2.845329381943118e-08,
          "token": "_sk"
        },
        {
          "prob": 2.8172576002392743e-09,
          "token": " the"
        }
      ],
      [
        {
          "prob": 0.9999996423722521,
          "token": "ol"
        },
        {
          "prob": 1.4449802461092448e-07,
          "token": "ole"
        },
        {
          "prob": 4.691164021834418e-08,
          "token": "ол"
        },
        {
          "prob": 4.691164021834418e-08,
          "token": "olk"
        },
        {
          "prob": 1.9555681087850496e-08,
          "token": "olt"
        }
      ],
      [
        {
          "prob": 0.9998172855444851,
          "token": "tech"
        },
        {
          "prob": 0.00010888882988932525,
          "token": "Tech"
        },
        {
          "prob": 2.4296382051580275e-05,
          "token": "etch"
        },
        {
          "prob": 1.1476798233783637e-05,
          "token": " tech"
        },
        {
          "prob": 1.0128238892902415e-05,
          "token": "te"
        }
      ],
      [
        {
          "prob": 0.4998893254729837,
          "token": " in"
        },
        {
          "prob": 0.4998893254729837,
          "token": " by"
        },
        {
          "prob": 0.00014798954749275706,
          "token": " through"
        },
        {
          "prob": 3.741761737139603e-05,
          "token": " ["
        },
        {
          "prob": 2.0028207325990423e-05,
          "token": " via"
        }
      ],
      [
        {
          "prob": 0.9999996423722521,
          "token": " the"
        },
        {
          "prob": 1.6373771305908126e-07,
          "token": " a"
        },
        {
          "prob": 9.931194312156244e-08,
          "token": " our"
        },
        {
          "prob": 7.734421907141565e-08,
          "token": " ["
        },
        {
          "prob": 5.3157852544244216e-08,
          "token": " their"
        }
      ],
      [
        {
          "prob": 0.9863805164520258,
          "token": " provided"
        },
        {
          "prob": 0.01241670068625759,
          "token": " instruction"
        },
        {
          "prob": 0.0007937731181163059,
          "token": " ["
        },
        {
          "prob": 9.480267962695984e-05,
          "token": " linked"
        },
        {
          "prob": 9.480267962695984e-05,
          "token": " document"
        }
      ],
      [
        {
          "prob": 0.9477900246767212,
          "token": " instruction"
        },
        {
          "prob": 0.041642989419867646,
          "token": " ["
        },
        {
          "prob": 0.003418264729224868,
          "token": " document"
        },
        {
          "prob": 0.003016608035755117,
          "token": " instructional"
        },
        {
          "prob": 0.0026621472478656908,
          "token": " link"
        }
      ],
      [
        {
          "prob": 0.6253869691142558,
          "token": " at"
        },
        {
          "prob": 0.15812258849240393,
          "token": " ["
        },
        {
          "prob": 0.12314599573916168,
          "token": " link"
        },
        {
          "prob": 0.03997965136201966,
          "token": " document"
        },
        {
          "prob": 0.02424888431568687,
          "token": " located"
        }
      ],
      [
        {
          "prob": 0.6456807957756922,
          "token": " <"
        },
        {
          "prob": 0.2691597925730945,
          "token": " ["
        },
        {
          "prob": 0.05300071197135827,
          "token": " this"
        },
        {
          "prob": 0.0321465567972272,
          "token": " the"
        },
        {
          "prob": 5.772239589824344e-06,
          "token": " []("
        }
      ],
      [
        {
          "prob": 0.9999985694905718,
          "token": "https"
        },
        {
          "prob": 8.315279260963632e-07,
          "token": " https"
        },
        {
          "prob": 3.059020287707785e-07,
          "token": "=https"
        },
        {
          "prob": 1.8553895931777327e-07,
          "token": "http"
        },
        {
          "prob": 4.139929822488149e-08,
          "token": "\"https"
        }
      ],
      [
        {
          "prob": 1.0,
          "token": "://"
        },
        {
          "prob": 1.7257827987960214e-08,
          "token": ":/"
        },
        {
          "prob": 1.2501528663867426e-09,
          "token": ":///"
        },
        {
          "prob": 8.592166619174109e-10,
          "token": ":\\/\\/"
        },
        {
          "prob": 6.691586091292782e-10,
          "token": "://%"
        }
      ],
      [
        {
          "prob": 0.999998927117538,
          "token": "box"
        },
        {
          "prob": 7.33820819192633e-07,
          "token": ".box"
        },
        {
          "prob": 1.1253496007565217e-07,
          "token": "\tbox"
        },
        {
          "prob": 1.1253496007565217e-07,
          "token": " box"
        },
        {
          "prob": 8.76423150298272e-08,
          "token": "箱"
        }
      ],
      [
        {
          "prob": 0.9999800924450729,
          "token": ".sk"
        },
        {
          "prob": 1.6701366305950292e-05,
          "token": "(sk"
        },
        {
          "prob": 1.7603110577708096e-06,
          "token": "_sk"
        },
        {
          "prob": 7.338068228047511e-07,
          "token": " sk"
        },
        {
          "prob": 3.4662579926611693e-07,
          "token": "-sk"
        }
      ],
      [
        {
          "prob": 0.9999998807907247,
          "token": "ol"
        },
        {
          "prob": 6.82560337633487e-08,
          "token": "ол"
        },
        {
          "prob": 2.8453348089834e-08,
          "token": "olk"
        },
        {
          "prob": 2.9989608248573072e-09,
          "token": "ole"
        },
        {
          "prob": 8.071593559922058e-10,
          "token": "olt"
        }
      ],
      [
        {
          "prob": 0.9999586360869611,
          "token": "tech"
        },
        {
          "prob": 8.939409628896255e-06,
          "token": "Tech"
        },
        {
          "prob": 8.939409628896255e-06,
          "token": " tech"
        },
        {
          "prob": 6.96201921918046e-06,
          "token": "techn"
        },
        {
          "prob": 4.784921168079426e-06,
          "token": "-tech"
        }
      ],
      [
        {
          "prob": 0.9999990463265931,
          "token": ".ru"
        },
        {
          "prob": 3.4663241069161144e-07,
          "token": " ru"
        },
        {
          "prob": 1.8553895931777327e-07,
          "token": ".rb"
        },
        {
          "prob": 1.275189375371399e-07,
          "token": ".rs"
        },
        {
          "prob": 1.1253517471925912e-07,
          "token": ".r"
        }
      ],
      [
        {
          "prob": 0.9998985631837561,
          "token": "/index"
        },
        {
          "prob": 7.484426353777002e-05,
          "token": "(index"
        },
        {
          "prob": 1.012906960451979e-05,
          "token": "=index"
        },
        {
          "prob": 4.22242441280431e-06,
          "token": ")index"
        },
        {
          "prob": 3.726276465697383e-06,
          "token": "[index"
        }
      ],
      [
        {
          "prob": 1.0,
          "token": ".php"
        },
        {
          "prob": 3.2241867372567335e-08,
          "token": "/php"
        },
        {
          "prob": 8.592166619174109e-10,
          "token": "."
        },
        {
          "prob": 6.691586091292782e-10,
          "token": ".js"
        },
        {
          "prob": 4.058652126475693e-10,
          "token": ".pdf"
        }
      ],
      [
        {
          "prob": 0.9999995231630692,
          "token": "/s"
        },
        {
          "prob": 9.931194312156244e-08,
          "token": "-s"
        },
        {
          "prob": 8.764248219443636e-08,
          "token": "\\s"
        },
        {
          "prob": 7.734421907141565e-08,
          "token": "=s"
        },
        {
          "prob": 6.023573837886479e-08,
          "token": ",s"
        }
      ],
      [
        {
          "prob": 0.9999994039539004,
          "token": "/P"
        },
        {
          "prob": 5.043471815847051e-07,
          "token": ">P"
        },
        {
          "prob": 4.139937718785167e-08,
          "token": "\tP"
        },
        {
          "prob": 3.6534822137210456e-08,
          "token": ",P"
        },
        {
          "prob": 2.510999155743982e-08,
          "token": "(P"
        }
      ],
      [
        {
          "prob": 0.9999969005680498,
          "token": "WW"
        },
        {
          "prob": 1.7603412757721762e-06,
          "token": " WW"
        },
        {
          "prob": 5.714991385721822e-07,
          "token": "ww"
        },
        {
          "prob": 1.4449761119935134e-07,
          "token": "W"
        },
        {
          "prob": 1.1253474543245463e-07,
          "token": "WWW"
        }
      ],
      [
        {
          "prob": 1.0,
          "token": "i"
        },
        {
          "prob": 1.026187963170189e-10,
          "token": "и"
        },
        {
          "prob": 2.4374100555808313e-11,
          "token": "I"
        },
        {
          "prob": 1.675205799218013e-11,
          "token": "iT"
        },
        {
          "prob": 8.423463754468647e-12,
          "token": "j"
        }
      ],
      [
        {
          "prob": 1.0,
          "token": "2"
        },
        {
          "prob": 9.640143775040296e-11,
          "token": ""
        },
        {
          "prob": 7.507751520922312e-11,
          "token": "1"
        },
        {
          "prob": 6.224144622907783e-11,
          "token": ""
        },
        {
          "prob": 2.4374100555808313e-11,
          "token": "3"
        }
      ],
      [
        {
          "prob": 0.9999973774024795,
          "token": "TS"
        },
        {
          "prob": 2.260322940135999e-06,
          "token": " TS"
        },
        {
          "prob": 3.466317495433874e-07,
          "token": "_TS"
        },
        {
          "prob": 1.3440384315611926e-08,
          "token": "Ts"
        },
        {
          "prob": 9.237432042950414e-09,
          "token": "ts"
        }
      ],
      [
        {
          "prob": 0.9999998807907247,
          "token": "ue"
        },
        {
          "prob": 2.510999155743982e-08,
          "token": "_ue"
        },
        {
          "prob": 2.215948977336598e-08,
          "token": " ue"
        },
        {
          "prob": 2.215948977336598e-08,
          "token": "uez"
        },
        {
          "prob": 5.602796437537268e-09,
          "token": "UE"
        }
      ],
      [
        {
          "prob": 1.0,
          "token": "E"
        },
        {
          "prob": 1.162823303022097e-10,
          "token": "'E"
        },
        {
          "prob": 1.162823303022097e-10,
          "token": "AE"
        },
        {
          "prob": 4.8473687062702556e-11,
          "token": ">E"
        },
        {
          "prob": 4.8473687062702556e-11,
          "token": "e"
        }
      ],
      [
        {
          "prob": 0.9989660949578595,
          "token": "e"
        },
        {
          "prob": 0.001032229492907848,
          "token": "a"
        },
        {
          "prob": 9.412710100630494e-07,
          "token": "ea"
        },
        {
          "prob": 5.038260654698607e-07,
          "token": "ae"
        },
        {
          "prob": 9.920932917655228e-08,
          "token": "aN"
        }
      ],
      [
        {
          "prob": 0.9999992847447459,
          "token": "An"
        },
        {
          "prob": 3.4663241069161144e-07,
          "token": ">An"
        },
        {
          "prob": 1.6373755690670415e-07,
          "token": "AN"
        },
        {
          "prob": 8.764248219443636e-08,
          "token": " An"
        },
        {
          "prob": 6.023573837886479e-08,
          "token": "安"
        }
      ],
      [
        {
          "prob": 1.0,
          "token": "1"
        },
        {
          "prob": 1.2256067444099483e-11,
          "token": "2"
        },
        {
          "prob": 6.560200168153779e-12,
          "token": ""
        },
        {
          "prob": 2.129785170955785e-12,
          "token": "１"
        },
        {
          "prob": 2.129785170955785e-12,
          "token": "0"
        }
      ],
      [
        {
          "prob": 1.0,
          "token": "E"
        },
        {
          "prob": 3.331544542166412e-11,
          "token": "Е"
        },
        {
          "prob": 3.331544542166412e-11,
          "token": "e"
        },
        {
          "prob": 8.423463754468647e-12,
          "token": " E"
        },
        {
          "prob": 3.0988191387218256e-12,
          "token": ">E"
        }
      ],
      [
        {
          "prob": 0.9999991655356624,
          "token": ">."
        },
        {
          "prob": 3.059020287707785e-07,
          "token": ">"
        },
        {
          "prob": 2.3823673954981372e-07,
          "token": "#."
        },
        {
          "prob": 9.931194312156244e-08,
          "token": "/>."
        },
        {
          "prob": 9.931194312156244e-08,
          "token": ">.\n\n"
        }
      ],
      [
        {
          "prob": 0.9999973774024795,
          "token": ""
        },
        {
          "prob": 2.699570779818012e-07,
          "token": ""
        },
        {
          "prob": 2.382362851497276e-07,
          "token": "<tool_call>"
        },
        {
          "prob": 1.7257795071296986e-08,
          "token": " bụ"
        },
        {
          "prob": 8.677764327999391e-09,
          "token": "GuidId"
        }
      ]
    ],
    "language_consistency_score": 0.39126068966447114,
    "feedback": "Feedback: The response is completely correct, accurate, and factual. It provides the exact link to the Skoltech instruction for fire safety, which matches the reference answer.",
    "score": 5
  },
  {
    "question": "What is the name of the universal laboratory for students and Skoltech community members where you can create almost anything, anytime?\n",
    "true_answer": "FabLab & Machine Shop \n",
    "source_doc": "Also, book crossing shelves. They are everywhere :) Bring your own books, exchange old ones anonymously or read on the spot as you desire. While no food or drinks are allowed on the premises of the library, your thoughts, debates and other activities are allowed any time. Librarians are there for you if you want to organize a group activity, do not hesitate to contact them and suggest your ideas. Like the campus, the library is open 24/7 and has several multifunctional zones that vary based on the level of noise, from silent to loud. If you need a quick distraction from your studies, just glance around and solve some quirky riddles, word search puzzles and even quests. That stuff will keep you entertained for a loooong time :)     \n\nAlright, so what else can you find on the campus? Quick answer: a lot\\! Let me just list a few spaces and facilities so you know they exist:\n\n* Music room  \n* Exercise room   \n* Several photo zones  \n* A coffee shop, cafeteria and several food machines around the campus  \n* Fully equipped kitchens with hot water, basic kitchenware and some ingredients for tea  \n* Outside terraces (aka summer lounge zones)   \n* Art exhibitions   \n* An indoor basketball court  \n* A table tennis table  \n* A multifaith prayer and meditation room \n\n*Text Overlay:* \n\n* *Music room*  \n* *Exercise room*   \n* *Several photo zones*  \n* *A coffee shop, cafeteria and several food machines around the campus*  \n* *Fully equipped kitchens with hot water, basic kitchenware and some ingredients for tea*  \n* *Outside terraces (aka summer lounge zones)*   \n* *Art exhibitions*   \n* *An indoor basketball court*  \n* *A table tennis table*  \n* *A multifaith prayer and meditation room* \n\nWell, that’s a quick tour\\! You’ll get to know all of these facilities as you spend time on campus. Speaking of tours, check out [this virtual tour](https://360.skoltech.ru/)  of Skoltech to see the campus with your own eyes. The link is available in the description. Let’s keep exploring the campus, shall we? We’ve already talked about the classrooms, the library and the cafeteria, but we haven’t yet seen the most technological part: research facilities\\! *Text Overlay: Research Facilities*\n\nOne of the most impressive (and open to all students) research space here is the FabLab. FabLab & Machine Shop (links to an external site)is a universal laboratory for students and Skoltech community members where you can create almost anything, anytime\\! In fact, it is one of the most unique university facilities, because students can come here with an idea and leave with a prototype within a few hours. How cool is that? At Skoltech, creative research and spontaneous ideas revolve about this laboratory. It has equipment to quickly create prototypes and conduct experiences. There are machine tools, 3D printers and a bunch of other things like:\n\n- Metalworking  \n- Woodworking  \n- Auxiliary equipment  \n- 3D printing  \n- Electronics  \n- Laser cutting and engraving  \n- Working with fabric  \n- Casting  \n- And more\n\nYou can find the complete equipment catalog on the FabLab page, linked below. The complete video tour of the facilities is also available there. As a Skoltech student, you have 24/7 access to the FabLab Facility and any basic materials, tools and equipment you may need. Some tools can be custom ordered for your project, too.",
    "context": "Sim: 8.63 - One of the most impressive (and open to all students) research space here is the FabLab. FabLab & Machine Shop (links to an external site)is a universal laboratory for students and Skoltech community members where you can create almost anything, anytime\\! In fact, it is one of the most unique university facilities, because students can come here with an idea and leave with a prototype within a few hours. How cool is that? At Skoltech, creative research and spontaneous ideas revolve about this laboratory. It has equipment to quickly create prototypes and conduct experiences. There are machine tools, 3D printers and a bunch of other things like:\nSim: 3.42 - As a Skoltech student, you have 24/7 access to the FabLab Facility and any basic materials, tools and equipment you may need. Some tools can be custom ordered for your project, too.\nSim: 1.01 - Contrary to popular belief, the library is no longer a strict, no-talking-allowed place where you will bury yourself in books. By all means, you can do that too, but the Skoltech library is truly special. The librarians, designers and architects at Skoltech have put a lot of thought into creating a space where you can….well, do everything. Sometimes you need a few hours of quiet, at others \\- a large networking zone to debate a new concept with your friends. Or perhaps you want to eat? Just kidding, that’s what the cafeteria is for.\nSim: 0.11 - The Skoltech library is not only about books for loan, it is an academic hub for learning outside a classroom and doing research outside a lab. It combines digital infrastructure and self-directed learning space. In the library students can discover, analyze, share information, and create new knowledge. There are designated areas either for group collaboration or silent individual study, which makes the library your go-to place for any type of work.",
    "generated_answer": "FabLab.",
    "logprobs": [
      [
        {
          "prob": 0.880785024558106,
          "token": "Fab"
        },
        {
          "prob": 0.1192012925453758,
          "token": "The"
        },
        {
          "prob": 8.922434872000503e-06,
          "token": " Fab"
        },
        {
          "prob": 3.2823803546001345e-06,
          "token": "Fabric"
        },
        {
          "prob": 8.299157221345384e-07,
          "token": "It"
        }
      ],
      [
        {
          "prob": 0.9999963045256735,
          "token": "Lab"
        },
        {
          "prob": 3.7266389560521204e-06,
          "token": " Lab"
        },
        {
          "prob": 3.224174437983862e-08,
          "token": "lab"
        },
        {
          "prob": 1.1861074904847522e-08,
          "token": "_lab"
        },
        {
          "prob": 2.9989493847514694e-09,
          "token": "Labor"
        }
      ],
      [
        {
          "prob": 0.9990611554333447,
          "token": "."
        },
        {
          "prob": 0.000911025773923509,
          "token": ""
        },
        {
          "prob": 1.8907736723657303e-05,
          "token": " Machine"
        },
        {
          "prob": 6.138443379497423e-06,
          "token": " &"
        },
        {
          "prob": 3.463072780337651e-07,
          "token": ".M"
        }
      ],
      [
        {
          "prob": 0.9999949932351057,
          "token": ""
        },
        {
          "prob": 8.315247540751075e-07,
          "token": ""
        },
        {
          "prob": 3.689868728866604e-07,
          "token": "<tool_call>"
        },
        {
          "prob": 6.023539370819118e-08,
          "token": "ordable"
        },
        {
          "prob": 4.691137178855366e-08,
          "token": "usercontent"
        }
      ]
    ],
    "language_consistency_score": 0.48202225473565286,
    "feedback": "Feedback: The response \"FabLab\" is partially correct but lacks the additional information provided in the reference answer, which includes \"FabLab & Machine Shop.\" The response is accurate in identifying the FabLab as the universal laboratory, but it does not mention the Machine Shop, which is also part of the correct answer.",
    "score": 3
  },
  {
    "question": "How many enterprises have Skoltech faculty, students and alumni founded in Russia and abroad?\n",
    "true_answer": "120 \n",
    "source_doc": "\n### Text After Video 2\n\nMore information about the Skolkovo Foundation and the project goals: [https://old.sk.ru/foundation/about/](https://old.sk.ru/foundation/about/)  \nThe Skolkovo Innovation Center: [https://sk.ru/](https://sk.ru/) \n\nFaculty, students and alumni founded more than 120 enterprises in Russia and abroad, 71+ companies received Skolkovo residency. Skoltech campus, marked with the prestigious Prix Versailles Award, cultivates strong and active interaction between research, teaching & learning, building a community of faculty, students, and staff, which now exceeds 2200 people. Over the 10 years of its existence, Skoltech has achieved a lot, and we mean A LOT: from the development of new technology to the construction of one of the most comfortable campuses in the world. Read about our university’s top 10 achievements in the last 10 years in the 2021 Annual Report: [https://www.skoltech.ru/app/data/uploads/2019/10/SKOLTECH-ANNUAL-REPORT-2021-ONLINE-VERSION.pdf](https://www.skoltech.ru/app/data/uploads/2019/10/SKOLTECH-ANNUAL-REPORT-2021-ONLINE-VERSION.pdf)\n\nFor more information on Skoltech strategy, see the [Strategy booklet](https://www.skoltech.ru/app/data/uploads/2019/10/Skoltech-strategy-2021-2025-Dec-2021-for-site.pdf): [https://www.skoltech.ru/app/data/uploads/2019/10/Skoltech-strategy-2021-2025-Dec-2021-for-site.pdf](https://www.skoltech.ru/app/data/uploads/2019/10/Skoltech-strategy-2021-2025-Dec-2021-for-site.pdf)\n\nSkoltech Founders: [founded (links to an external site)](https://www.skoltech.ru/en/about/founders/)  \nMandatory reading: [Code of Ethics https://www.skoltech.ru/app/data/uploads/2018/10/Code-of-Ethics.pdf](https://www.skoltech.ru/app/data/uploads/2018/10/Code-of-Ethics.pdf)\n\nHighlights: \n\n* Skoltech is part of the bigger Skolkovo community which provides a number of career opportunities for students and alumi. * Skoltech is a place of mutual respect and non-discrimination zone. Please remember that while communicating with others.",
    "context": "Sim: 8.69 - Faculty, students and alumni founded more than 120 enterprises in Russia and abroad, 71+ companies received Skolkovo residency. Skoltech campus, marked with the prestigious Prix Versailles Award, cultivates strong and active interaction between research, teaching & learning, building a community of faculty, students, and staff, which now exceeds 2200 people.\nSim: 4.93 - * 93 Startups are founded by Skoltech community members — researchers, students and alumni. Alumni Workshop will teach you all about that.  \nSim: 2.01 - Let us start by saying that you’ve come to a very unique university. Skoltech is a one-of-a-kind institute in Russia, and one with few similar educational organizations worldwide. Don’t get us wrong \\- there are dozens of incredible universities out there, but can you think of one that has been named among the Top 100 in just the first 8 years of its existence? Exactly\\! Ah, wait, let’s back up a little. Skoltech was established in 2011 in collaboration with MIT with the vision of being a worldleading institute of science and technology and the mission to impact economy and society development by academic and technology excellence and entrepreneurial spirit. Skoltech became a home for talents who are working in promising areas of global science and technology agenda. The broad, but well-structured portfolio divided among several Centers covers Artificial Intelligence and Communications, Life Sciences and Health, Cutting-edge Engineering and Advanced Materials, Energy Efficiency and ESG, Photonics, and Advanced Studies. Skoltech research excellence is globally recognized: the Institute appeared among top-100 world’s leading young universities in the prestigious Nature Index ranking. To learn more about the faculty, students, alumni, and their achievements, see the link below. You can also find more information about the university’s achievements there as well.   \nSim: 0.58 - So, who is behind Skoltech? You will obviously get to know your professors and fellow students in the next few weeks, but you should also probably know who runs the university on the administrative side. You know, just to have an idea. Skoltech was founded by the top Russian companies and leading institutes. Among them are VEB.RF, Sber, MIPT, New Economic School, Moscow School of Management.The Founders are entitled to approve the Charter, establish the Institute's governance bodies, and appoint the Board of Trustees. You can read more about the Founders below. Honored academics, statesmen and businessmen make up the Board of Trustees. Members of the Board set and hold Skoltech accountable for following its strategies, as well as oversee the development of the university. The final key player of the Skoltech government bodies is the Student Council, whose role is to voice student needs to the university administration. Each year, students elect the Council and its President, Vice President and Coordinator to represent you over the course of the next academic year. You will learn more about the Student Council’s role and activities in the next module.Meanwhile, let’s see what happens behind the scenes of the day-to-day management\\! Below you will see Skoltech’s current leadership team . It consists of the University President and Provost, as well as several Vice Presidents and Deans responsible for different areas of the university’s management. You will get to know team members and leaders of these departments as you attend Skoltech events throughout your time here.  ",
    "generated_answer": "More than 120 enterprises.",
    "logprobs": [
      [
        {
          "prob": 0.9942907101784939,
          "token": "More"
        },
        {
          "prob": 0.0027927573866034327,
          "token": "Sk"
        },
        {
          "prob": 0.0011641944846515798,
          "token": "more"
        },
        {
          "prob": 0.0006231484029285343,
          "token": "1"
        },
        {
          "prob": 0.000549926535434969,
          "token": "Faculty"
        }
      ],
      [
        {
          "prob": 1.0,
          "token": " than"
        },
        {
          "prob": 6.34880011604368e-09,
          "token": "than"
        },
        {
          "prob": 3.850741922767617e-09,
          "token": "_than"
        },
        {
          "prob": 7.582560427911907e-10,
          "token": "Than"
        },
        {
          "prob": 5.211412487888539e-10,
          "token": " Than"
        }
      ],
      [
        {
          "prob": 1.0,
          "token": " "
        },
        {
          "prob": 6.691586091292782e-10,
          "token": "1"
        },
        {
          "prob": 9.173890754179198e-16,
          "token": " one"
        },
        {
          "prob": 5.564246011263937e-16,
          "token": "\n"
        },
        {
          "prob": 4.910429870159115e-16,
          "token": " two"
        }
      ],
      [
        {
          "prob": 1.0,
          "token": "1"
        },
        {
          "prob": 2.9989608248573072e-09,
          "token": "9"
        },
        {
          "prob": 2.335593038799337e-09,
          "token": "8"
        },
        {
          "prob": 1.917171513758312e-10,
          "token": "7"
        },
        {
          "prob": 5.4927883509546835e-11,
          "token": "2"
        }
      ],
      [
        {
          "prob": 1.0,
          "token": "2"
        },
        {
          "prob": 1.917171513758312e-10,
          "token": "0"
        },
        {
          "prob": 7.05287985111216e-11,
          "token": "1"
        },
        {
          "prob": 6.1627377326348205e-12,
          "token": "4"
        },
        {
          "prob": 5.438596960491441e-12,
          "token": "8"
        }
      ],
      [
        {
          "prob": 1.0,
          "token": "0"
        },
        {
          "prob": 4.277787868968998e-11,
          "token": "1"
        },
        {
          "prob": 2.7346982915918745e-12,
          "token": "０"
        },
        {
          "prob": 2.7346982915918745e-12,
          "token": "5"
        },
        {
          "prob": 2.7346982915918745e-12,
          "token": "2"
        }
      ],
      [
        {
          "prob": 0.9992768037955121,
          "token": " enterprises"
        },
        {
          "prob": 0.0007096608614537903,
          "token": "."
        },
        {
          "prob": 1.147059402393471e-05,
          "token": " Enterprises"
        },
        {
          "prob": 7.332905427205875e-07,
          "token": " enter"
        },
        {
          "prob": 7.332905427205875e-07,
          "token": "enter"
        }
      ],
      [
        {
          "prob": 0.932205731112435,
          "token": "."
        },
        {
          "prob": 0.06752876421464862,
          "token": " have"
        },
        {
          "prob": 0.00024354669357118643,
          "token": " in"
        },
        {
          "prob": 1.373996424019577e-05,
          "token": " were"
        },
        {
          "prob": 2.387647768886918e-06,
          "token": "have"
        }
      ],
      [
        {
          "prob": 0.9999969005680498,
          "token": ""
        },
        {
          "prob": 6.083576662864179e-07,
          "token": ""
        },
        {
          "prob": 2.5360120545506016e-07,
          "token": "<tool_call>"
        },
        {
          "prob": 3.889096736506024e-08,
          "token": " bụ"
        },
        {
          "prob": 1.837079218699681e-08,
          "token": "🤖"
        }
      ]
    ],
    "language_consistency_score": 0.33333420214501025,
    "feedback": "Feedback: The response is mostly correct, accurate, and factual. It provides the correct number of enterprises founded by Skoltech faculty, students, and alumni, which is 120. However, the response includes the phrase \"more than,\" which adds additional information not explicitly asked for in the question. This slight addition does not detract from the accuracy but is not necessary for a fully correct answer.",
    "score": 4
  },
  {
    "question": "How often does a Skoltech student need to repeat the required safety training course?\n",
    "true_answer": "Every 3 months. \n",
    "source_doc": "On a more serious note, all this equipment and machinery requires training. That’s why to gain access to the lab, you’ll need to pass at least one required safety training course and repeat it every 3 months. Here are some of the important safety rules at the FabLab and any research facility at Skoltech, really:\n\n* Every new student needs to pass the EHS induction training and safety training provided by a responsible person before lab access. * Always wear safety goggles and other required means of personal protection. Always\\! * No food or drinks  \n* Do not work in the FabLab without an employee accompanying you (for safety reasons)   \n* Pay attentions to signs on machinery and equipment  \n* Do not try to access rooms or areas marked with red lines  \n* Be extra careful around yellow lines\n\n *Text Overlay:* \n\n* *Every new student needs to pass the EHS induction training and safety training provided by a responsible person before lab access.*  \n* *Always wear safety goggles and other required means of personal protection. Always\\!*   \n* *No food or drinks*  \n* *Do not work in the FabLab without an employee accompanying you (for safety reasons)*   \n* *Pay attentions to signs on machinery and equipment*  \n* *Do not try to access rooms or areas marked with red lines*  \n* *Be extra careful around yellow lines*\n\nSome of the more advanced equipment requires more targeted training \\- special (free\\!) 1-3 hour courses led by FabLab employees. That equipment is marked with a special sign. If you want to use it, ask the FabLab team about training. Speaking of the FabLab team, they are your most valuable resource\\! All of the FabLab employees are trained experts. You can consult with them about your projects, get help with any equipment and, of course, learn from them. At this point you may be asking, “What about other labs?”\n\nDuh, Skoltech has dozens of labs with fascinating and unique equipment\\! To save you some time and intrigue right now, we won’t go into detail about each and every lab here. That’s mostly because your scientific advisors and program coordinators will give you a much more in-depth orientation around the labs related to your center. If you want to take a look at some of the interesting objects right now, click the Skoltech virtual tour link in the description. Let’s talk about some safety and ground rules here at Skoltech. As an educational institution, it should come to you as no surprise that there are some rules to ensure your safety. Some are just good, logical practices \\- like no running \\- while others are strictly prohibited for everyone’s safety \\- like no food or drinks in laboratories. *Text Overlay: Ground Rules and Safety*\n\nFor a start, you should know that the campus is closed to visitors without a pass. That’s basically anyone who is not a student or an employee of Skoltech. Each visitor \\- even your mom and girlfriend \\- will need a pass to enter the halls beyond the security line. Talk to the Education Office if you need a guest pass for someone as an exception. It is prohibited to: \n\n* ### smoke tobacco products, as well as evaporative mixtures used in devices for \n\n* ### drink alcoholic beverages (including beer and other low-alcohol drinks);\n\n* ### generating aerosol, steam, or smoke outside designated areas, use open fire, including in areas directly adjacent to buildings;\n\n* ### perform actions that violate/change the designated modes of operation of technical means of protection and fire alarm;\n\n* ### use evacuation and emergency exits to enter the building, as well as exit the building in the absence of factors that threaten the life and health of citizens;\n\n* ### ride bicycles inside the buildings;\n\n* ### place bicycles, scooters, electric scooters, skateboards, gyro scooters, segways, unicycles in places not intended for parking and attaching them to poles, building facades, trees, etc. * ### ride inside the buildings and in outdoor areas on roller skates, scooters, electric scooters, skateboards, gyroscooters, segways, unicycles at а speed of more than 10 km/h.",
    "context": "Sim: 1.30 - On a more serious note, all this equipment and machinery requires training. That’s why to gain access to the lab, you’ll need to pass at least one required safety training course and repeat it every 3 months. ",
    "generated_answer": "Every 3 months.",
    "logprobs": [
      [
        {
          "prob": 0.9994508660879637,
          "token": "Every"
        },
        {
          "prob": 0.00020335663118991248,
          "token": "every"
        },
        {
          "prob": 0.00010884896090952201,
          "token": " Every"
        },
        {
          "prob": 0.00010884896090952201,
          "token": "A"
        },
        {
          "prob": 5.826265030923848e-05,
          "token": "Students"
        }
      ],
      [
        {
          "prob": 1.0,
          "token": " "
        },
        {
          "prob": 3.2241867372567335e-08,
          "token": " three"
        },
        {
          "prob": 4.5990553786523166e-10,
          "token": "3"
        },
        {
          "prob": 3.775134544279098e-11,
          "token": "三个月"
        },
        {
          "prob": 7.433680672352188e-12,
          "token": " month"
        }
      ],
      [
        {
          "prob": 1.0,
          "token": "3"
        },
        {
          "prob": 1.162823303022097e-10,
          "token": "３"
        },
        {
          "prob": 7.05287985111216e-11,
          "token": "三个月"
        },
        {
          "prob": 2.9400777392844726e-11,
          "token": ""
        },
        {
          "prob": 5.789356328730652e-12,
          "token": "4"
        }
      ],
      [
        {
          "prob": 0.9999991655356624,
          "token": " months"
        },
        {
          "prob": 7.33820819192633e-07,
          "token": "months"
        },
        {
          "prob": 1.275189375371399e-07,
          "token": "_months"
        },
        {
          "prob": 2.8453348089834e-08,
          "token": " Months"
        },
        {
          "prob": 1.9555681087850496e-08,
          "token": "个月"
        }
      ],
      [
        {
          "prob": 0.9999997615814777,
          "token": "."
        },
        {
          "prob": 2.382369667501818e-07,
          "token": ""
        },
        {
          "prob": 1.186112015134383e-08,
          "token": "。"
        },
        {
          "prob": 3.850741922767617e-09,
          "token": " or"
        },
        {
          "prob": 3.850741922767617e-09,
          "token": ".\n\n"
        }
      ],
      [
        {
          "prob": 0.9999970197767496,
          "token": ""
        },
        {
          "prob": 9.422427859507568e-07,
          "token": ""
        },
        {
          "prob": 2.238022783058102e-07,
          "token": "<tool_call>"
        },
        {
          "prob": 2.6729344911815487e-08,
          "token": "orado"
        },
        {
          "prob": 1.3440358680137724e-08,
          "token": "🤖"
        }
      ]
    ],
    "language_consistency_score": 0.6999262369461846,
    "feedback": "Feedback: The response is completely correct, accurate, and factual. It matches the reference answer exactly, providing the correct frequency of the required safety training course for Skoltech students.",
    "score": 5
  },
  {
    "question": "What should students do if they hear an alarm during an emergency at Skoltech?\n",
    "true_answer": "Students should walk to the nearest fire exit, take the stairs, check in with an employee in a bright vest, and follow the instructions of security and safety personnel. \n",
    "source_doc": "\n### For more information on campus regulations, feel free to refer to [this official document](https://drive.google.com/file/d/1UeumlluoILU0lGHeXphZKpHAOtq9KhC9/view?usp=sharing) by clicking the link in the description. We also expect you to follow some basic social behavior rules. Avoid any discriminatory or violent actions or words. Be respectful of others’ space and activities, don’t interrupt people when they’re conferencing or studying in silence. And the most important rule: don’t cut in line at the cafeteria \\- everyone there is as hungry as you are\\! But that one is a pretty obvious one, right? In case of emergency, you will hear an alarm throughout the building and you will be asked to walk towards general assembly areas outside of the buildings. In case of a fire or any kind of alarm-sounding emergency \n\n1. Walk to the nearest fire exit  \n2. Take the stairs (don’t take the elevators)   \n3. Check in with an employee in a bright vest  \n4. Follow the instructions of security and safety personnel.",
    "context": "Sim: 1.43 - 2. Save emergency numbers on your phone or just flip your student pass when necessary. Skoltech cares about you, don’t hesitate to use your medical insurance or request mental health support.  ",
    "generated_answer": "The context does not provide specific instructions for what students should do if they hear an alarm during an emergency at Skoltech.",
    "logprobs": [
      [
        {
          "prob": 0.9738186225860197,
          "token": "The"
        },
        {
          "prob": 0.0229020176387352,
          "token": "Based"
        },
        {
          "prob": 0.0016590165933441192,
          "token": "Students"
        },
        {
          "prob": 0.0012920434220248546,
          "token": "Save"
        },
        {
          "prob": 0.00022452348055446668,
          "token": "There"
        }
      ],
      [
        {
          "prob": 0.8022548712383377,
          "token": " context"
        },
        {
          "prob": 0.08455705140948454,
          "token": " given"
        },
        {
          "prob": 0.04526012812879439,
          "token": " documents"
        },
        {
          "prob": 0.02745165537263598,
          "token": " document"
        },
        {
          "prob": 0.0188672284226773,
          "token": " provided"
        }
      ],
      [
        {
          "prob": 0.7972941157711273,
          "token": " does"
        },
        {
          "prob": 0.20158752497296276,
          "token": " provided"
        },
        {
          "prob": 0.000823842237619808,
          "token": " doesn"
        },
        {
          "prob": 0.00020829983904154317,
          "token": "提供的"
        },
        {
          "prob": 5.2666447109457524e-05,
          "token": " provides"
        }
      ],
      [
        {
          "prob": 0.9999997615814777,
          "token": " not"
        },
        {
          "prob": 1.6373771305908126e-07,
          "token": "not"
        },
        {
          "prob": 1.186112015134383e-08,
          "token": "_not"
        },
        {
          "prob": 9.237449661970594e-09,
          "token": " NOT"
        },
        {
          "prob": 2.9989608248573072e-09,
          "token": " Not"
        }
      ],
      [
        {
          "prob": 0.7115441470345286,
          "token": " provide"
        },
        {
          "prob": 0.26176245537874376,
          "token": " specify"
        },
        {
          "prob": 0.02148677335097539,
          "token": " specifically"
        },
        {
          "prob": 0.0029079185572951556,
          "token": " explicitly"
        },
        {
          "prob": 0.001998581248026272,
          "token": " mention"
        }
      ],
      [
        {
          "prob": 0.9973451236958648,
          "token": " specific"
        },
        {
          "prob": 0.0016990969632277536,
          "token": " information"
        },
        {
          "prob": 0.0004295989894155774,
          "token": " explicit"
        },
        {
          "prob": 0.0003345718698271982,
          "token": " instructions"
        },
        {
          "prob": 0.00013947030538378084,
          "token": " specifics"
        }
      ],
      [
        {
          "prob": 0.9901014732058679,
          "token": " instructions"
        },
        {
          "prob": 0.00588735895394046,
          "token": " information"
        },
        {
          "prob": 0.0027809914538218018,
          "token": " guidance"
        },
        {
          "prob": 0.0007967673915471401,
          "token": " actions"
        },
        {
          "prob": 0.0002282776796600369,
          "token": " steps"
        }
      ],
      [
        {
          "prob": 0.9999151301890851,
          "token": " for"
        },
        {
          "prob": 8.48110364334263e-05,
          "token": " on"
        },
        {
          "prob": 4.139590295963707e-08,
          "token": " regarding"
        },
        {
          "prob": 3.65317561415722e-08,
          "token": "for"
        },
        {
          "prob": 3.2239161640913233e-08,
          "token": " about"
        }
      ],
      [
        {
          "prob": 0.2884004760560959,
          "token": " what"
        },
        {
          "prob": 0.2545125268234274,
          "token": " responding"
        },
        {
          "prob": 0.22460651659065345,
          "token": " alarms"
        },
        {
          "prob": 0.056789414100066785,
          "token": " alarm"
        },
        {
          "prob": 0.056789414100066785,
          "token": " students"
        }
      ],
      [
        {
          "prob": 0.9999367038714213,
          "token": " students"
        },
        {
          "prob": 5.144162221324315e-05,
          "token": " to"
        },
        {
          "prob": 1.0129456005230989e-05,
          "token": "students"
        },
        {
          "prob": 5.043159186617052e-07,
          "token": " Students"
        },
        {
          "prob": 5.043159186617052e-07,
          "token": " actions"
        }
      ],
      [
        {
          "prob": 0.9999972581939645,
          "token": " should"
        },
        {
          "prob": 1.5534957233607605e-06,
          "token": "should"
        },
        {
          "prob": 1.0677009553134769e-06,
          "token": "应该"
        },
        {
          "prob": 7.734407154916583e-08,
          "token": "应"
        },
        {
          "prob": 5.315775115378354e-08,
          "token": " Should"
        }
      ],
      [
        {
          "prob": 1.0,
          "token": " do"
        },
        {
          "prob": 2.215948977336598e-08,
          "token": "do"
        },
        {
          "prob": 1.7257827987960214e-08,
          "token": " doing"
        },
        {
          "prob": 3.398267819495071e-09,
          "token": " Do"
        },
        {
          "prob": 2.061153622438558e-09,
          "token": "_do"
        }
      ],
      [
        {
          "prob": 0.9998427876608137,
          "token": " if"
        },
        {
          "prob": 0.0001233903863089833,
          "token": " during"
        },
        {
          "prob": 2.1442034012785842e-05,
          "token": " upon"
        },
        {
          "prob": 1.1477093756036526e-05,
          "token": " in"
        },
        {
          "prob": 8.313978831466105e-07,
          "token": " when"
        }
      ],
      [
        {
          "prob": 0.9999988079084972,
          "token": " they"
        },
        {
          "prob": 1.0677029917933763e-06,
          "token": "他们"
        },
        {
          "prob": 1.275189375371399e-07,
          "token": "they"
        },
        {
          "prob": 5.602785751061334e-09,
          "token": " an"
        },
        {
          "prob": 3.398261337819773e-09,
          "token": " они"
        }
      ],
      [
        {
          "prob": 0.9999973774024795,
          "token": " hear"
        },
        {
          "prob": 1.5534957233607605e-06,
          "token": "hear"
        },
        {
          "prob": 5.714991385721822e-07,
          "token": " hears"
        },
        {
          "prob": 2.382362851497276e-07,
          "token": " heard"
        },
        {
          "prob": 2.1024278372789506e-07,
          "token": " hearing"
        }
      ],
      [
        {
          "prob": 1.0,
          "token": " an"
        },
        {
          "prob": 1.4166087866431961e-09,
          "token": " a"
        },
        {
          "prob": 1.6918979226151304e-10,
          "token": "an"
        },
        {
          "prob": 1.783247290814639e-11,
          "token": " An"
        },
        {
          "prob": 1.8795288165390832e-12,
          "token": "\tan"
        }
      ],
      [
        {
          "prob": 0.9997523444434523,
          "token": " alarm"
        },
        {
          "prob": 0.0002305027061332081,
          "token": " emergency"
        },
        {
          "prob": 1.4735545005454231e-05,
          "token": "alarm"
        },
        {
          "prob": 1.2095671914951093e-06,
          "token": " alarms"
        },
        {
          "prob": 4.4497490246653176e-07,
          "token": "报警"
        }
      ],
      [
        {
          "prob": 0.999998927117538,
          "token": " during"
        },
        {
          "prob": 5.715002286213223e-07,
          "token": "during"
        },
        {
          "prob": 3.059020287707785e-07,
          "token": " durante"
        },
        {
          "prob": 1.4449788680693535e-07,
          "token": "期间"
        },
        {
          "prob": 5.315775115378354e-08,
          "token": "."
        }
      ],
      [
        {
          "prob": 0.9999998807907247,
          "token": " an"
        },
        {
          "prob": 1.6373771305908126e-07,
          "token": " a"
        },
        {
          "prob": 1.3440409951135022e-08,
          "token": "an"
        },
        {
          "prob": 9.736200313009565e-10,
          "token": " emergencies"
        },
        {
          "prob": 2.289734845645553e-11,
          "token": " emergency"
        }
      ],
      [
        {
          "prob": 0.9999711521845835,
          "token": " emergency"
        },
        {
          "prob": 2.4300136016915854e-05,
          "token": "emergency"
        },
        {
          "prob": 4.2227304620416605e-06,
          "token": "紧急"
        },
        {
          "prob": 1.6373302855254685e-07,
          "token": "应急"
        },
        {
          "prob": 1.2751541085137618e-07,
          "token": " Emergency"
        }
      ],
      [
        {
          "prob": 0.9999850990607846,
          "token": " at"
        },
        {
          "prob": 1.4738974314670568e-05,
          "token": "."
        },
        {
          "prob": 1.444958197628687e-07,
          "token": ","
        },
        {
          "prob": 3.2241375404467544e-08,
          "token": ";"
        },
        {
          "prob": 4.598985203171805e-10,
          "token": "at"
        }
      ],
      [
        {
          "prob": 0.9999997615814777,
          "token": " Sk"
        },
        {
          "prob": 2.699578503363014e-07,
          "token": "Sk"
        },
        {
          "prob": 6.34880011604368e-09,
          "token": "_sk"
        },
        {
          "prob": 1.8189616875530459e-09,
          "token": " SK"
        },
        {
          "prob": 1.026187963170189e-10,
          "token": " Sketch"
        }
      ],
      [
        {
          "prob": 0.9998763952461884,
          "token": "ol"
        },
        {
          "prob": 0.00010889526843745734,
          "token": "olk"
        },
        {
          "prob": 8.938667959837776e-06,
          "token": "olt"
        },
        {
          "prob": 1.3707891286187466e-06,
          "token": "opt"
        },
        {
          "prob": 1.3707891286187466e-06,
          "token": "ole"
        }
      ],
      [
        {
          "prob": 0.9998556583877783,
          "token": "tech"
        },
        {
          "prob": 7.48410516393564e-05,
          "token": "Tech"
        },
        {
          "prob": 1.473707685234926e-05,
          "token": "te"
        },
        {
          "prob": 7.88818880818261e-06,
          "token": "ten"
        },
        {
          "prob": 4.494554501137141e-06,
          "token": "tec"
        }
      ],
      [
        {
          "prob": 0.9999878408000585,
          "token": "."
        },
        {
          "prob": 1.1478757578876643e-05,
          "token": ","
        },
        {
          "prob": 7.338124213278687e-07,
          "token": ";"
        },
        {
          "prob": 4.691110336029911e-08,
          "token": " beyond"
        },
        {
          "prob": 2.9989265046707144e-09,
          "token": "。"
        }
      ],
      [
        {
          "prob": 0.9628098618326446,
          "token": ""
        },
        {
          "prob": 0.025658015636052186,
          "token": " It"
        },
        {
          "prob": 0.005725075772998647,
          "token": " The"
        },
        {
          "prob": 0.0027043343070724713,
          "token": " Based"
        },
        {
          "prob": 0.0023865666495447137,
          "token": " However"
        }
      ]
    ],
    "language_consistency_score": 0.7310849900955867,
    "feedback": "Feedback: The response states that the context does not provide specific instructions for what students should do if they hear an alarm during an emergency at Skoltech. This is a direct acknowledgment of the lack of information in the provided context, which aligns with the criteria for a score of 0. The response does not attempt to provide any incorrect or inaccurate information, but it also does not offer any of the correct steps that students should follow, as outlined in the reference answer.",
    "score": 0
  },
  {
    "question": "How many ECTS credits are needed to graduate from Skoltech?\n",
    "true_answer": "120 ECTS credits. \n",
    "source_doc": "So, how do you succeed and graduate from Skoltech? To get your degree, you will need to meet several requirements. *Text Overlay: MSc Degree Requirements*  \n***![][image10]***  \nYou need 120 credits to graduate. Here’s how you get them: \n\n* STE: Science, Technology and Engineering (36 ECTS-credits)  \n  * Provide a solid foundation of scientific and engineering fundamentals  \n  * Core and recommended electives  \n* Sector: Industrial Immersion (12 ECTS-credits)  \n  * Orients students to how a sector works, provides knowledge and skills to make an impact in an industrial sector  \n  * Happens in the summer term between Year 1 and Year 2  \n* Enterpreneurship and Innovation: Entrepreneurship and Innovation (12 ECTS-credits)  \n  * Orients students in the process of, provide the skills for, and experience with innovation  \n  * Includes Innovation Workshop  \n* MSc Thesis Project (36 ECTS-credits)  \n* Early research, Thesis Project, Defense\n\n* Options: elective coursework and short-term projects (24 ECTS-credits)  \n* Follow your dreams and passions, choose courses to diversify your experience  \n* Additionally you can take 20 credits as an extracurricular activity. ECTS credits are based on the workload students need in order to achieve the learning outcomes. 1 ECTS equals 27 astronomical hours (36 academic hours). This information is available in the description. *Text Overlay:* \n\n- *STE: Science, Technology and Engineering*   \n- *Sector: Industrial Immersion*  \n- *Enterpreneurship and Innovation: Entrepreneurship and Innovation*  \n- *MSc Thesis Project*   \n- *Early research, Thesis Project, Defense*  \n- *Options*\n\nHow will your course performance be assessed? The assessment criteria are set separately for all courses and described in detail in the each course syllabus. You can refer to the assessment rules prior to course registration. Your instructors will also walk through it at the very beginning of a course. *Text Overlay: Grading System*\n\nSkoltech uses an “A-F” grading system. * A-E are technically passing grades (although there is a world of difference between an A and an E), but you will receive a full number of credits if you get one of these grades. Aim to get as close to an A as possible, as it comes with many obvious and not-so-obvious benefits like scholarships :)   \n* F is a failing grade, which means you will not have passed the course if you get it. If you ever feel you are having trouble with a course and are likely to receive a poor grade, talk to your instructor as soon as possible. * Some projects have a Pass/Fail grading scale, and you will be notified in advance if that applies to your course. * The course instructor sets the grading scheme for each class, which is explained in the Course Syllabus. The course instructor also makes the final decision about your grade. We expect you to perform at a “B” grade or better level.",
    "context": "Sim: 3.20 -   1. You must be registered for a minimum of 12 credits and a maximum of 18 credits per term. During Term 1, it’s best to take only 12 credits for a smooth introduction to Skoltech coursework.   \nSim: 0.23 - Most academic programs at Skoltech focus on preparing specialists who are ready to meet the needs of industry and interests of business. One of such programs is Industrial Immersion. What is industrial immersion? Industrial immersion is a compulsory educational element aimed at getting a real hands-on work experience in the industrial sector. Basically, this is your mandatory summer internship which grants you 12 credits upon successful completion.",
    "generated_answer": "The given documents do not provide information on the total ECTS credits needed to graduate from Skoltech.",
    "logprobs": [
      [
        {
          "prob": 0.9965795847504637,
          "token": "The"
        },
        {
          "prob": 0.003171895009260322,
          "token": "Based"
        },
        {
          "prob": 0.0001789459860056497,
          "token": "Information"
        },
        {
          "prob": 5.809525588060689e-05,
          "token": "No"
        },
        {
          "prob": 5.4037005512974445e-06,
          "token": "This"
        }
      ],
      [
        {
          "prob": 0.5235182340307013,
          "token": " given"
        },
        {
          "prob": 0.2182348683765642,
          "token": " documents"
        },
        {
          "prob": 0.1323661386887372,
          "token": " information"
        },
        {
          "prob": 0.10308685246292672,
          "token": " provided"
        },
        {
          "prob": 0.01580888084160016,
          "token": " context"
        }
      ],
      [
        {
          "prob": 0.9809157429661227,
          "token": " documents"
        },
        {
          "prob": 0.013992014391339165,
          "token": " context"
        },
        {
          "prob": 0.0035377352632003905,
          "token": " document"
        },
        {
          "prob": 0.001013578122928359,
          "token": " text"
        },
        {
          "prob": 0.0003728745534464842,
          "token": " texts"
        }
      ],
      [
        {
          "prob": 0.9998935574378137,
          "token": " do"
        },
        {
          "prob": 5.143936556926253e-05,
          "token": " provide"
        },
        {
          "prob": 2.7533508296714027e-05,
          "token": " does"
        },
        {
          "prob": 1.0129011645684426e-05,
          "token": " only"
        },
        {
          "prob": 7.88848220139841e-06,
          "token": " don"
        }
      ],
      [
        {
          "prob": 1.0,
          "token": " not"
        },
        {
          "prob": 1.9555681087850496e-08,
          "token": "not"
        },
        {
          "prob": 1.7257827987960214e-08,
          "token": "_not"
        },
        {
          "prob": 4.944450501938644e-09,
          "token": " NOT"
        },
        {
          "prob": 4.944450501938644e-09,
          "token": " Not"
        }
      ],
      [
        {
          "prob": 0.7739974777609816,
          "token": " provide"
        },
        {
          "prob": 0.22175397691864213,
          "token": " specify"
        },
        {
          "prob": 0.004061566731735397,
          "token": " contain"
        },
        {
          "prob": 8.429512824701483e-05,
          "token": "提供"
        },
        {
          "prob": 3.981819914290413e-05,
          "token": "provide"
        }
      ],
      [
        {
          "prob": 0.9946322444202367,
          "token": " information"
        },
        {
          "prob": 0.0027937177005191963,
          "token": " the"
        },
        {
          "prob": 0.0021757495328447946,
          "token": " specific"
        },
        {
          "prob": 0.0002598561010035081,
          "token": " enough"
        },
        {
          "prob": 5.7981733432459316e-05,
          "token": " E"
        }
      ],
      [
        {
          "prob": 0.9924217976619093,
          "token": " on"
        },
        {
          "prob": 0.0075772345333596685,
          "token": " about"
        },
        {
          "prob": 4.4171212850732217e-07,
          "token": "关于"
        },
        {
          "prob": 3.035840102350227e-07,
          "token": " regarding"
        },
        {
          "prob": 9.855939196685856e-08,
          "token": "about"
        }
      ],
      [
        {
          "prob": 0.9923645050635698,
          "token": " the"
        },
        {
          "prob": 0.004055567378526879,
          "token": " how"
        },
        {
          "prob": 0.0035790256497730977,
          "token": " E"
        },
        {
          "prob": 6.426505808975827e-07,
          "token": " total"
        },
        {
          "prob": 8.69732154437867e-08,
          "token": "the"
        }
      ],
      [
        {
          "prob": 0.9696271398650398,
          "token": " total"
        },
        {
          "prob": 0.020123968035302336,
          "token": " number"
        },
        {
          "prob": 0.008388917959141876,
          "token": " E"
        },
        {
          "prob": 0.0016518758884851755,
          "token": " exact"
        },
        {
          "prob": 0.00013559423003315724,
          "token": " required"
        }
      ],
      [
        {
          "prob": 0.5621716773897366,
          "token": " E"
        },
        {
          "prob": 0.43781974257169204,
          "token": " number"
        },
        {
          "prob": 3.454102988431489e-06,
          "token": "number"
        },
        {
          "prob": 2.0950193642887296e-06,
          "token": " required"
        },
        {
          "prob": 1.270693477132785e-06,
          "token": " credits"
        }
      ],
      [
        {
          "prob": 0.999995112442896,
          "token": "CTS"
        },
        {
          "prob": 4.78509457496562e-06,
          "token": "CT"
        },
        {
          "prob": 6.825564320030807e-08,
          "token": "cts"
        },
        {
          "prob": 9.23739680501087e-09,
          "token": "TC"
        },
        {
          "prob": 2.9989436647149156e-09,
          "token": "TRS"
        }
      ],
      [
        {
          "prob": 0.998936355174281,
          "token": " credits"
        },
        {
          "prob": 0.0010321984844347944,
          "token": " credit"
        },
        {
          "prob": 3.116969340241354e-05,
          "token": "credits"
        },
        {
          "prob": 1.124154671860574e-07,
          "token": "credit"
        },
        {
          "prob": 8.754925387383932e-08,
          "token": " ("
        }
      ],
      [
        {
          "prob": 0.9706778868590444,
          "token": " needed"
        },
        {
          "prob": 0.02931193232904846,
          "token": " required"
        },
        {
          "prob": 8.677645162709547e-06,
          "token": "needed"
        },
        {
          "prob": 6.28606507216127e-07,
          "token": "所需"
        },
        {
          "prob": 4.895592400637005e-07,
          "token": "_needed"
        }
      ],
      [
        {
          "prob": 0.9999833109787883,
          "token": " to"
        },
        {
          "prob": 1.670143001672819e-05,
          "token": " for"
        },
        {
          "prob": 9.736033181488868e-10,
          "token": "to"
        },
        {
          "prob": 2.28969554007927e-11,
          "token": "_to"
        },
        {
          "prob": 1.3887705464653542e-11,
          "token": "\tto"
        }
      ],
      [
        {
          "prob": 0.9997972661136226,
          "token": " graduate"
        },
        {
          "prob": 0.0001398132250813237,
          "token": "毕业"
        },
        {
          "prob": 2.7530856366464485e-05,
          "token": " graduation"
        },
        {
          "prob": 2.1441052496828916e-05,
          "token": "graduate"
        },
        {
          "prob": 8.937960447861026e-06,
          "token": " graduates"
        }
      ],
      [
        {
          "prob": 1.0,
          "token": " from"
        },
        {
          "prob": 2.8453348089834e-08,
          "token": "从"
        },
        {
          "prob": 5.905303998944039e-10,
          "token": "."
        },
        {
          "prob": 3.581747930283181e-10,
          "token": "from"
        },
        {
          "prob": 1.026187963170189e-10,
          "token": " FROM"
        }
      ],
      [
        {
          "prob": 0.9999990463265931,
          "token": " Sk"
        },
        {
          "prob": 8.315279260963632e-07,
          "token": "Sk"
        },
        {
          "prob": 1.4449788680693535e-07,
          "token": " SK"
        },
        {
          "prob": 1.7257827987960214e-08,
          "token": "_sk"
        },
        {
          "prob": 1.6918979226151304e-10,
          "token": " sk"
        }
      ],
      [
        {
          "prob": 0.9999954700677164,
          "token": "ol"
        },
        {
          "prob": 3.2887441993747145e-06,
          "token": "olk"
        },
        {
          "prob": 6.47592129616951e-07,
          "token": "olt"
        },
        {
          "prob": 1.1253474543245463e-07,
          "token": "ole"
        },
        {
          "prob": 9.931156427728716e-08,
          "token": "opt"
        }
      ],
      [
        {
          "prob": 0.9999164412717095,
          "token": "tech"
        },
        {
          "prob": 5.8289771653276064e-05,
          "token": "Tech"
        },
        {
          "prob": 6.143696732143438e-06,
          "token": "tec"
        },
        {
          "prob": 5.421793336535685e-06,
          "token": " tech"
        },
        {
          "prob": 4.78471582594654e-06,
          "token": "tek"
        }
      ],
      [
        {
          "prob": 0.99995911288632,
          "token": "."
        },
        {
          "prob": 4.00636544290992e-05,
          "token": ";"
        },
        {
          "prob": 7.337914270864167e-07,
          "token": ","
        },
        {
          "prob": 1.1253066728948622e-07,
          "token": " for"
        },
        {
          "prob": 1.0466982538466678e-08,
          "token": "。"
        }
      ],
      [
        {
          "prob": 0.9966348784257374,
          "token": ""
        },
        {
          "prob": 0.0031720704614913524,
          "token": " They"
        },
        {
          "prob": 0.00012299446068238896,
          "token": " The"
        },
        {
          "prob": 1.7719032055114782e-05,
          "token": " Only"
        },
        {
          "prob": 5.076587679509857e-06,
          "token": " Based"
        }
      ]
    ],
    "language_consistency_score": 0.3574922209191592,
    "feedback": "Feedback: The response states that the given documents do not provide information on the total ECTS credits needed to graduate from Skoltech. This is accurate in the sense that the provided context does not contain the specific information. However, it does not attempt to provide the correct answer, which is 120 ECTS credits.",
    "score": 0
  },
  {
    "question": "How many weeks before the start of a standard term does registration typically occur at Skoltech?\n\n",
    "true_answer": "Registration typically occurs about 3 weeks before the start of a standard term at Skoltech. \n",
    "source_doc": "Any performance below this may be reported to the Disciplinary Board for further examination. *Text Overlay: A-E, F,*  Pass/Fail\n\nSkoltech’s variety of courses allows you to not only choose the ones that complement your educational track, but also be flexible about registering for them or making changes in your schedule (with some regulations, of course). When it comes to course registration, we mostly expect you to register for courses yourself with some exceptions. For instance, the Education Department has already registered you for your first course \\- Innovation Workshop :) \n\nFor standard terms (so, not Term 1A), registration will happen about 3 weeks before the start of the term (check the calendar\\!). Here’s a quick timeline: \n\n*Graph:* \n\n![][image11]\n\nSide note:  Short-term projects follow regular registration schedule\n\nSo how do you register for your courses?As we’ve already mentioned, you do not need to register for any courses in Term 1A \\- you are already signed up for a compulsory course called Innovation Workshop. Instructions on how to register for the other terms will be sent to you individually by the Education Department. Meanwhile, you can explore [the courses offered in 2022-2023](https://www.skoltech.ru/en/education/course-catalog/) (and in the upcoming terms) [using the link below](https://www.skoltech.ru/en/education/course-catalog/) and choose which ones you want to register for. You can filter courses based on your program, credit load, and instructors. After you’ve registered for courses, you will be added to your course “page” on Canvas. Here you will see information about your registered courses, your grades, assignments, group work and more. Make sure to bookmark Canvas in your browser and check it for updates from your professors and program coordinators on a daily basis\\! As a student, you have rights and channels for feedback. As Skoltech constantly works on improving this communication, please be aware of the following:\n\nYour student rights:\n\n* To obtain full information on your courses and educational programs, course syllabi, assessment criteria and feedback on your progress  \n* To provide your feedback on the quality of courses\n\n At the end of each course, you will be asked to submit a formal evaluation of the coursework, the course load and your professor, course instructor and teaching assistant. These evaluations are used to collect your *anonymous* feedback on each of your learning experiences. The feedback is then followed-up to Education Department, course instructors and program coordinators. If you need to communicate any concerns or issues informally or outside of the formal evaluation period (or if you are unable to solve an issue directly with your research advisor or faculty, please talk to the [Education Department](https://helpdesk.skoltech.ru/servicedesk/customer/portal/21) информация для связи также в описании. If you are a student of a network or a joint program, you probably have a few questions about the logistics of your studies. *Text Overlay: Network and Joint Programs and double degrees*\n\nYour schedule, curriculum and even travel times will depend on the program you are in. Moreover, there will be specific regulations on how to submit your original diploma and receive your scholarship if you are a student of a joint or network program. The details of your studies are normally coordinated by the Centers to which your programs belong. Each program has its own *coordinator*, who will be in touch with you regarding the essential information (if they haven’t reached out yet). Until then, if you have urgent questions or need assistance, feel free to reach out to the Education Department via [education@skoltech.ru](mailto:education@skoltech.ru). For more details on the Education Department, as well as for all the relevant links, see the description below. *Text Overlay: education@skoltech.ru.*  \n",
    "context": "Sim: 4.35 - For standard terms (so, not Term 1A), registration will happen about 3 weeks before the start of the term (check the calendar\\!). Here’s a quick timeline: ",
    "generated_answer": "Registration for standard terms typically occurs about 3 weeks before the start of the term.",
    "logprobs": [
      [
        {
          "prob": 0.9987584289828287,
          "token": "Registration"
        },
        {
          "prob": 0.0007092927857173879,
          "token": "About"
        },
        {
          "prob": 0.0003350460283109597,
          "token": " Registration"
        },
        {
          "prob": 0.0001232565456617471,
          "token": "3"
        },
        {
          "prob": 2.1418775995721647e-05,
          "token": "_registration"
        }
      ],
      [
        {
          "prob": 0.6791755591288788,
          "token": " for"
        },
        {
          "prob": 0.3208198175716597,
          "token": " typically"
        },
        {
          "prob": 1.9711860262508134e-06,
          "token": " occurs"
        },
        {
          "prob": 1.7395655625843797e-06,
          "token": "typically"
        },
        {
          "prob": 3.8814954256814605e-07,
          "token": " usually"
        }
      ],
      [
        {
          "prob": 0.985936148983184,
          "token": " standard"
        },
        {
          "prob": 0.014063626520379485,
          "token": " a"
        },
        {
          "prob": 8.640986659566481e-08,
          "token": "标准"
        },
        {
          "prob": 6.729607176979939e-08,
          "token": "standard"
        },
        {
          "prob": 6.729607176979939e-08,
          "token": " the"
        }
      ],
      [
        {
          "prob": 0.9999992847447459,
          "token": " terms"
        },
        {
          "prob": 4.4508482557577276e-07,
          "token": "_terms"
        },
        {
          "prob": 1.4449788680693535e-07,
          "token": "terms"
        },
        {
          "prob": 8.764248219443636e-08,
          "token": " term"
        },
        {
          "prob": 1.186112015134383e-08,
          "token": " Terms"
        }
      ],
      [
        {
          "prob": 0.9953466054403297,
          "token": " typically"
        },
        {
          "prob": 0.002467217155768698,
          "token": " occurs"
        },
        {
          "prob": 0.0014964428491427157,
          "token": " at"
        },
        {
          "prob": 0.000623810188427094,
          "token": " ("
        },
        {
          "prob": 3.105768049978981e-05,
          "token": " usually"
        }
      ],
      [
        {
          "prob": 0.9999668609159512,
          "token": " occurs"
        },
        {
          "prob": 2.430002014511409e-05,
          "token": " happens"
        },
        {
          "prob": 7.889061496968893e-06,
          "token": " occur"
        },
        {
          "prob": 4.450703939668756e-07,
          "token": " occurring"
        },
        {
          "prob": 1.855329433281412e-07,
          "token": "occ"
        }
      ],
      [
        {
          "prob": 0.9999941587791524,
          "token": " about"
        },
        {
          "prob": 3.7266318480591813e-06,
          "token": "about"
        },
        {
          "prob": 1.2098602244086199e-06,
          "token": " approximately"
        },
        {
          "prob": 5.714975035023703e-07,
          "token": " "
        },
        {
          "prob": 1.8553807460118162e-07,
          "token": " around"
        }
      ],
      [
        {
          "prob": 1.0,
          "token": " "
        },
        {
          "prob": 2.172439935079017e-10,
          "token": "3"
        },
        {
          "prob": 2.129785170955785e-12,
          "token": " three"
        },
        {
          "prob": 6.041735480699455e-14,
          "token": "  "
        },
        {
          "prob": 2.0879679116459336e-14,
          "token": " about"
        }
      ],
      [
        {
          "prob": 1.0,
          "token": "3"
        },
        {
          "prob": 2.020683909022217e-11,
          "token": "2"
        },
        {
          "prob": 1.57371021068629e-11,
          "token": "３"
        },
        {
          "prob": 4.752193062771153e-13,
          "token": "4"
        },
        {
          "prob": 3.2661313427874473e-13,
          "token": ""
        }
      ],
      [
        {
          "prob": 0.9999990463265931,
          "token": " weeks"
        },
        {
          "prob": 8.315279260963632e-07,
          "token": "weeks"
        },
        {
          "prob": 1.1253517471925912e-07,
          "token": " Weeks"
        },
        {
          "prob": 1.4166087866431961e-09,
          "token": "_week"
        },
        {
          "prob": 6.691586091292782e-10,
          "token": " semanas"
        }
      ],
      [
        {
          "prob": 0.9999996423722521,
          "token": " before"
        },
        {
          "prob": 3.927863545481039e-07,
          "token": "before"
        },
        {
          "prob": 1.0467401794744658e-08,
          "token": " Before"
        },
        {
          "prob": 3.850741922767617e-09,
          "token": "Before"
        },
        {
          "prob": 1.8189616875530459e-09,
          "token": "_before"
        }
      ],
      [
        {
          "prob": 0.9999822381318528,
          "token": " the"
        },
        {
          "prob": 1.3007061966414663e-05,
          "token": " their"
        },
        {
          "prob": 4.785030687486948e-06,
          "token": " they"
        },
        {
          "prob": 2.2159109383778193e-08,
          "token": " start"
        },
        {
          "prob": 4.598976431312031e-10,
          "token": "the"
        }
      ],
      [
        {
          "prob": 0.9999896288992495,
          "token": " start"
        },
        {
          "prob": 1.0129987330277146e-05,
          "token": " term"
        },
        {
          "prob": 2.699550183806035e-07,
          "token": "start"
        },
        {
          "prob": 1.7257663405271917e-08,
          "token": ".start"
        },
        {
          "prob": 3.398235411242209e-09,
          "token": " Start"
        }
      ],
      [
        {
          "prob": 0.998830376795955,
          "token": " of"
        },
        {
          "prob": 0.0011695103074966034,
          "token": "."
        },
        {
          "prob": 9.919570578397538e-08,
          "token": " at"
        },
        {
          "prob": 4.358355140757578e-09,
          "token": " của"
        },
        {
          "prob": 2.9954507614062018e-09,
          "token": ","
        }
      ],
      [
        {
          "prob": 0.9996189139669129,
          "token": " the"
        },
        {
          "prob": 0.00037998415902487534,
          "token": " a"
        },
        {
          "prob": 1.0672967909538389e-06,
          "token": " term"
        },
        {
          "prob": 2.2151038210971456e-08,
          "token": " these"
        },
        {
          "prob": 9.233926526601374e-09,
          "token": " terms"
        }
      ],
      [
        {
          "prob": 0.9999998807907247,
          "token": " term"
        },
        {
          "prob": 1.2751905914873347e-07,
          "token": "term"
        },
        {
          "prob": 4.139937718785167e-08,
          "token": " terms"
        },
        {
          "prob": 3.398267819495071e-09,
          "token": " standard"
        },
        {
          "prob": 1.8189616875530459e-09,
          "token": " semester"
        }
      ],
      [
        {
          "prob": 0.7772994494994885,
          "token": "."
        },
        {
          "prob": 0.22270001424141084,
          "token": " at"
        },
        {
          "prob": 4.442273823731504e-07,
          "token": ","
        },
        {
          "prob": 1.1838247462498554e-08,
          "token": ".at"
        },
        {
          "prob": 8.136300560649687e-09,
          "token": ".\n\n"
        }
      ],
      [
        {
          "prob": 0.999998927117538,
          "token": ""
        },
        {
          "prob": 2.8736836176841304e-07,
          "token": ""
        },
        {
          "prob": 1.275189375371399e-07,
          "token": "<tool_call>"
        },
        {
          "prob": 7.19411930861867e-09,
          "token": " bụ"
        },
        {
          "prob": 7.19411930861867e-09,
          "token": "checker"
        }
      ]
    ],
    "language_consistency_score": 0.8679184331330864,
    "feedback": "Feedback: The response is completely correct, accurate, and factual. It provides the exact information that matches the reference answer, stating that registration typically occurs about 3 weeks before the start of a standard term at Skoltech.",
    "score": 5
  },
  {
    "question": "What are some examples of equipment available in the FabLab at Skoltech?\n",
    "true_answer": "The FabLab has equipment for metalworking, woodworking, 3D printing, electronics, laser cutting and engraving, working with fabric, casting, and more. \n",
    "source_doc": "Also, book crossing shelves. They are everywhere :) Bring your own books, exchange old ones anonymously or read on the spot as you desire. While no food or drinks are allowed on the premises of the library, your thoughts, debates and other activities are allowed any time. Librarians are there for you if you want to organize a group activity, do not hesitate to contact them and suggest your ideas. Like the campus, the library is open 24/7 and has several multifunctional zones that vary based on the level of noise, from silent to loud. If you need a quick distraction from your studies, just glance around and solve some quirky riddles, word search puzzles and even quests. That stuff will keep you entertained for a loooong time :)     \n\nAlright, so what else can you find on the campus? Quick answer: a lot\\! Let me just list a few spaces and facilities so you know they exist:\n\n* Music room  \n* Exercise room   \n* Several photo zones  \n* A coffee shop, cafeteria and several food machines around the campus  \n* Fully equipped kitchens with hot water, basic kitchenware and some ingredients for tea  \n* Outside terraces (aka summer lounge zones)   \n* Art exhibitions   \n* An indoor basketball court  \n* A table tennis table  \n* A multifaith prayer and meditation room \n\n*Text Overlay:* \n\n* *Music room*  \n* *Exercise room*   \n* *Several photo zones*  \n* *A coffee shop, cafeteria and several food machines around the campus*  \n* *Fully equipped kitchens with hot water, basic kitchenware and some ingredients for tea*  \n* *Outside terraces (aka summer lounge zones)*   \n* *Art exhibitions*   \n* *An indoor basketball court*  \n* *A table tennis table*  \n* *A multifaith prayer and meditation room* \n\nWell, that’s a quick tour\\! You’ll get to know all of these facilities as you spend time on campus. Speaking of tours, check out [this virtual tour](https://360.skoltech.ru/)  of Skoltech to see the campus with your own eyes. The link is available in the description. Let’s keep exploring the campus, shall we? We’ve already talked about the classrooms, the library and the cafeteria, but we haven’t yet seen the most technological part: research facilities\\! *Text Overlay: Research Facilities*\n\nOne of the most impressive (and open to all students) research space here is the FabLab. FabLab & Machine Shop (links to an external site)is a universal laboratory for students and Skoltech community members where you can create almost anything, anytime\\! In fact, it is one of the most unique university facilities, because students can come here with an idea and leave with a prototype within a few hours. How cool is that? At Skoltech, creative research and spontaneous ideas revolve about this laboratory. It has equipment to quickly create prototypes and conduct experiences. There are machine tools, 3D printers and a bunch of other things like:\n\n- Metalworking  \n- Woodworking  \n- Auxiliary equipment  \n- 3D printing  \n- Electronics  \n- Laser cutting and engraving  \n- Working with fabric  \n- Casting  \n- And more\n\nYou can find the complete equipment catalog on the FabLab page, linked below. The complete video tour of the facilities is also available there. As a Skoltech student, you have 24/7 access to the FabLab Facility and any basic materials, tools and equipment you may need. Some tools can be custom ordered for your project, too.",
    "context": "Sim: 3.41 - One of the most impressive (and open to all students) research space here is the FabLab. FabLab & Machine Shop (links to an external site)is a universal laboratory for students and Skoltech community members where you can create almost anything, anytime\\! In fact, it is one of the most unique university facilities, because students can come here with an idea and leave with a prototype within a few hours. How cool is that? At Skoltech, creative research and spontaneous ideas revolve about this laboratory. It has equipment to quickly create prototypes and conduct experiences. There are machine tools, 3D printers and a bunch of other things like:\nSim: 1.73 - As a Skoltech student, you have 24/7 access to the FabLab Facility and any basic materials, tools and equipment you may need. Some tools can be custom ordered for your project, too.",
    "generated_answer": "Some examples of equipment available in the FabLab at Skoltech include machine tools, 3D printers, and other tools like those mentioned in the document.",
    "logprobs": [
      [
        {
          "prob": 0.7838600090084423,
          "token": "Some"
        },
        {
          "prob": 0.17490281716276843,
          "token": "The"
        },
        {
          "prob": 0.026822215727080937,
          "token": "Examples"
        },
        {
          "prob": 0.009867339380101092,
          "token": "There"
        },
        {
          "prob": 0.0028270400646464174,
          "token": "Equipment"
        }
      ],
      [
        {
          "prob": 0.9991944370137356,
          "token": " examples"
        },
        {
          "prob": 0.0008040847733952274,
          "token": " equipment"
        },
        {
          "prob": 4.447267204387628e-07,
          "token": "examples"
        },
        {
          "prob": 3.0565590694943163e-07,
          "token": " example"
        },
        {
          "prob": 2.697403911395587e-07,
          "token": " tools"
        }
      ],
      [
        {
          "prob": 0.999876633606226,
          "token": " of"
        },
        {
          "prob": 0.0001233946226544279,
          "token": " include"
        },
        {
          "prob": 7.1932411738246895e-09,
          "token": " includes"
        },
        {
          "prob": 3.3978465363142988e-09,
          "token": "include"
        },
        {
          "prob": 7.58162041807597e-10,
          "token": " are"
        }
      ],
      [
        {
          "prob": 0.9999440939703319,
          "token": " equipment"
        },
        {
          "prob": 5.14419656242667e-05,
          "token": "equipment"
        },
        {
          "prob": 2.902157109007149e-06,
          "token": "设备"
        },
        {
          "prob": 1.5534127599537094e-06,
          "token": " available"
        },
        {
          "prob": 2.510860268411768e-08,
          "token": " the"
        }
      ],
      [
        {
          "prob": 0.9998833077248994,
          "token": " available"
        },
        {
          "prob": 8.480836736588857e-05,
          "token": " in"
        },
        {
          "prob": 3.119925479322547e-05,
          "token": " include"
        },
        {
          "prob": 6.475198753862476e-07,
          "token": "available"
        },
        {
          "prob": 2.5107070223397102e-08,
          "token": " includes"
        }
      ],
      [
        {
          "prob": 0.9890125928681703,
          "token": " in"
        },
        {
          "prob": 0.010986936344888492,
          "token": " include"
        },
        {
          "prob": 2.356193360645074e-07,
          "token": " includes"
        },
        {
          "prob": 1.8350052343380288e-07,
          "token": " are"
        },
        {
          "prob": 1.9340831321464333e-08,
          "token": "include"
        }
      ],
      [
        {
          "prob": 1.0,
          "token": " the"
        },
        {
          "prob": 2.4616969518153846e-10,
          "token": " Sk"
        },
        {
          "prob": 2.020683909022217e-11,
          "token": "the"
        },
        {
          "prob": 1.0815941557285693e-11,
          "token": " Fab"
        },
        {
          "prob": 5.732239023403102e-13,
          "token": " The"
        }
      ],
      [
        {
          "prob": 0.9999814036965474,
          "token": " Fab"
        },
        {
          "prob": 1.3007061966414663e-05,
          "token": "Fab"
        },
        {
          "prob": 5.422150121403128e-06,
          "token": " Sk"
        },
        {
          "prob": 1.6373474618938104e-07,
          "token": " Fabric"
        },
        {
          "prob": 1.5079434418231184e-09,
          "token": " fab"
        }
      ],
      [
        {
          "prob": 0.9999982118638471,
          "token": "Lab"
        },
        {
          "prob": 1.553497204890439e-06,
          "token": " Lab"
        },
        {
          "prob": 2.3823651234966232e-07,
          "token": "lab"
        },
        {
          "prob": 9.237432042950414e-09,
          "token": "La"
        },
        {
          "prob": 8.152005165739432e-09,
          "token": "L"
        }
      ],
      [
        {
          "prob": 0.9968272106900609,
          "token": " at"
        },
        {
          "prob": 0.0031726831078774057,
          "token": " include"
        },
        {
          "prob": 1.2711449225070052e-07,
          "token": " are"
        },
        {
          "prob": 2.8363077013085146e-08,
          "token": " includes"
        },
        {
          "prob": 1.9493638744616092e-08,
          "token": "include"
        }
      ],
      [
        {
          "prob": 0.9999997615814777,
          "token": " Sk"
        },
        {
          "prob": 2.699578503363014e-07,
          "token": "Sk"
        },
        {
          "prob": 9.237449661970594e-09,
          "token": "_sk"
        },
        {
          "prob": 5.211412487888539e-10,
          "token": " SK"
        },
        {
          "prob": 2.172439935079017e-10,
          "token": " Ski"
        }
      ],
      [
        {
          "prob": 0.9999976158197796,
          "token": "ol"
        },
        {
          "prob": 1.994729895832688e-06,
          "token": "olk"
        },
        {
          "prob": 2.1024298423113373e-07,
          "token": "col"
        },
        {
          "prob": 9.931175369924415e-08,
          "token": "ол"
        },
        {
          "prob": 2.5109943663977427e-08,
          "token": "hol"
        }
      ],
      [
        {
          "prob": 0.9999176331638507,
          "token": "tech"
        },
        {
          "prob": 7.484569109242154e-05,
          "token": "Tech"
        },
        {
          "prob": 3.2884901615257806e-06,
          "token": " tech"
        },
        {
          "prob": 1.5533727613226755e-06,
          "token": "otech"
        },
        {
          "prob": 5.714539033663261e-07,
          "token": "itech"
        }
      ],
      [
        {
          "prob": 0.9999787811971367,
          "token": " include"
        },
        {
          "prob": 1.300702475296511e-05,
          "token": " are"
        },
        {
          "prob": 6.962158650053971e-06,
          "token": "include"
        },
        {
          "prob": 1.209841763547506e-06,
          "token": " includes"
        },
        {
          "prob": 9.930985949593232e-08,
          "token": " Include"
        }
      ],
      [
        {
          "prob": 0.9999979734461775,
          "token": " machine"
        },
        {
          "prob": 9.422436845439301e-07,
          "token": " machines"
        },
        {
          "prob": 9.422436845439301e-07,
          "token": " "
        },
        {
          "prob": 4.139929822488149e-08,
          "token": "machine"
        },
        {
          "prob": 2.845329381943118e-08,
          "token": "机器"
        }
      ],
      [
        {
          "prob": 0.9999998807907247,
          "token": " tools"
        },
        {
          "prob": 4.139937718785167e-08,
          "token": "-tools"
        },
        {
          "prob": 2.510999155743982e-08,
          "token": "工具"
        },
        {
          "prob": 1.522997974471263e-08,
          "token": "tools"
        },
        {
          "prob": 2.646573638909117e-09,
          "token": " Tools"
        }
      ],
      [
        {
          "prob": 0.9999545833252356,
          "token": ","
        },
        {
          "prob": 4.539785156619626e-05,
          "token": " and"
        },
        {
          "prob": 1.5736381735986496e-11,
          "token": "、"
        },
        {
          "prob": 5.108855157880887e-12,
          "token": "和"
        },
        {
          "prob": 4.508548852583217e-12,
          "token": "，"
        }
      ],
      [
        {
          "prob": 1.0,
          "token": " "
        },
        {
          "prob": 2.061153622438558e-09,
          "token": "3"
        },
        {
          "prob": 9.545034922840628e-12,
          "token": " and"
        },
        {
          "prob": 1.0603575991523846e-13,
          "token": " printers"
        },
        {
          "prob": 6.041735480699455e-14,
          "token": " three"
        }
      ],
      [
        {
          "prob": 1.0,
          "token": "3"
        },
        {
          "prob": 6.914400106940203e-13,
          "token": "３"
        },
        {
          "prob": 6.914400106940203e-13,
          "token": ""
        },
        {
          "prob": 3.701011678592672e-13,
          "token": "三维"
        },
        {
          "prob": 2.2447770550209742e-13,
          "token": "2"
        }
      ],
      [
        {
          "prob": 1.0,
          "token": "D"
        },
        {
          "prob": 4.8473687062702556e-11,
          "token": "d"
        },
        {
          "prob": 7.433680672352188e-12,
          "token": "Д"
        },
        {
          "prob": 2.413362771833214e-12,
          "token": "Ｄ"
        },
        {
          "prob": 1.8795288165390832e-12,
          "token": "Ds"
        }
      ],
      [
        {
          "prob": 0.9999959469005546,
          "token": " printers"
        },
        {
          "prob": 3.2887473357670864e-06,
          "token": "打印机"
        },
        {
          "prob": 2.102425832248476e-07,
          "token": " Print"
        },
        {
          "prob": 1.6373708845046632e-07,
          "token": " printing"
        },
        {
          "prob": 1.4449747339575647e-07,
          "token": " printer"
        }
      ],
      [
        {
          "prob": 0.9999966621509202,
          "token": ","
        },
        {
          "prob": 3.288750472162449e-06,
          "token": " and"
        },
        {
          "prob": 1.1032518237638113e-09,
          "token": "."
        },
        {
          "prob": 3.16086939653085e-10,
          "token": "和其他"
        },
        {
          "prob": 1.6918914685490615e-10,
          "token": "，"
        }
      ],
      [
        {
          "prob": 0.9999998807907247,
          "token": " and"
        },
        {
          "prob": 8.764248219443636e-08,
          "token": "以及其他"
        },
        {
          "prob": 4.691164021834418e-08,
          "token": " among"
        },
        {
          "prob": 7.194133030325383e-09,
          "token": " as"
        },
        {
          "prob": 4.363462252943702e-09,
          "token": "和其他"
        }
      ],
      [
        {
          "prob": 0.9899789009178587,
          "token": " other"
        },
        {
          "prob": 0.005194931945817855,
          "token": " various"
        },
        {
          "prob": 0.0024539120949701523,
          "token": " basic"
        },
        {
          "prob": 0.002165569823026035,
          "token": " a"
        },
        {
          "prob": 0.00020142937093879356,
          "token": " additional"
        }
      ],
      [
        {
          "prob": 0.31643795546376496,
          "token": " tools"
        },
        {
          "prob": 0.27925551555697475,
          "token": " materials"
        },
        {
          "prob": 0.16937703207916344,
          "token": " things"
        },
        {
          "prob": 0.1494747061788334,
          "token": " items"
        },
        {
          "prob": 0.05498867137833477,
          "token": " basic"
        }
      ],
      [
        {
          "prob": 0.42782074180661145,
          "token": " like"
        },
        {
          "prob": 0.3331871287331783,
          "token": " for"
        },
        {
          "prob": 0.20208820899829277,
          "token": " and"
        },
        {
          "prob": 0.035117665002471064,
          "token": "."
        },
        {
          "prob": 0.0008258883205845799,
          "token": " mentioned"
        }
      ],
      [
        {
          "prob": 0.9277418038938762,
          "token": " those"
        },
        {
          "prob": 0.046189549091996074,
          "token": " prot"
        },
        {
          "prob": 0.007083396769585254,
          "token": " prototypes"
        },
        {
          "prob": 0.007083396769585254,
          "token": "原型"
        },
        {
          "prob": 0.003345959713745826,
          "token": " basic"
        }
      ],
      [
        {
          "prob": 0.5368102465817125,
          "token": " mentioned"
        },
        {
          "prob": 0.19748145352758453,
          "token": " typically"
        },
        {
          "prob": 0.15379871064936207,
          "token": " used"
        },
        {
          "prob": 0.0641128411452436,
          "token": " needed"
        },
        {
          "prob": 0.018368636528447654,
          "token": " listed"
        }
      ],
      [
        {
          "prob": 0.9739492106428524,
          "token": " in"
        },
        {
          "prob": 0.025954869538944617,
          "token": "."
        },
        {
          "prob": 9.360789799711463e-05,
          "token": " for"
        },
        {
          "prob": 1.5130307526859456e-06,
          "token": " but"
        },
        {
          "prob": 4.912091670485533e-07,
          "token": ","
        }
      ],
      [
        {
          "prob": 0.9999998807907247,
          "token": " the"
        },
        {
          "prob": 7.734421907141565e-08,
          "token": " your"
        },
        {
          "prob": 2.510999155743982e-08,
          "token": " a"
        },
        {
          "prob": 2.215948977336598e-08,
          "token": "the"
        },
        {
          "prob": 1.9555681087850496e-08,
          "token": " various"
        }
      ],
      [
        {
          "prob": 0.6149471626290575,
          "token": " document"
        },
        {
          "prob": 0.1554829920404066,
          "token": " context"
        },
        {
          "prob": 0.13721325888024413,
          "token": " text"
        },
        {
          "prob": 0.08322404842995483,
          "token": " documents"
        },
        {
          "prob": 0.006831445900848128,
          "token": " documentation"
        }
      ],
      [
        {
          "prob": 0.9999138191081796,
          "token": "."
        },
        {
          "prob": 5.1440444821423804e-05,
          "token": " text"
        },
        {
          "prob": 2.1443567721419596e-05,
          "token": " for"
        },
        {
          "prob": 1.012922416303547e-05,
          "token": " description"
        },
        {
          "prob": 1.994562498462115e-06,
          "token": ","
        }
      ],
      [
        {
          "prob": 0.9999972581939645,
          "token": ""
        },
        {
          "prob": 3.9278523077893697e-07,
          "token": ""
        },
        {
          "prob": 3.466317495433874e-07,
          "token": "pecific"
        },
        {
          "prob": 2.5360120545506016e-07,
          "token": "<tool_call>"
        },
        {
          "prob": 1.9750481739625307e-07,
          "token": "具体的"
        }
      ]
    ],
    "language_consistency_score": 0.5346492446904421,
    "feedback": "Feedback: The response is somewhat correct, accurate, and factual. It mentions some of the equipment available in the FabLab at Skoltech, such as machine tools and 3D printers. However, it lacks the comprehensive list of equipment provided in the reference answer, including metalworking, woodworking, electronics, laser cutting and engraving, working with fabric, and casting.",
    "score": 3
  },
  {
    "question": "What are some of the things you can do at the Skoltech FabLab?\n",
    "true_answer": "At the Skoltech FabLab you can do metalworking, woodworking, 3D printing, electronics, laser cutting and engraving, work with fabric, casting, and more. \n",
    "source_doc": "Also, book crossing shelves. They are everywhere :) Bring your own books, exchange old ones anonymously or read on the spot as you desire. While no food or drinks are allowed on the premises of the library, your thoughts, debates and other activities are allowed any time. Librarians are there for you if you want to organize a group activity, do not hesitate to contact them and suggest your ideas. Like the campus, the library is open 24/7 and has several multifunctional zones that vary based on the level of noise, from silent to loud. If you need a quick distraction from your studies, just glance around and solve some quirky riddles, word search puzzles and even quests. That stuff will keep you entertained for a loooong time :)     \n\nAlright, so what else can you find on the campus? Quick answer: a lot\\! Let me just list a few spaces and facilities so you know they exist:\n\n* Music room  \n* Exercise room   \n* Several photo zones  \n* A coffee shop, cafeteria and several food machines around the campus  \n* Fully equipped kitchens with hot water, basic kitchenware and some ingredients for tea  \n* Outside terraces (aka summer lounge zones)   \n* Art exhibitions   \n* An indoor basketball court  \n* A table tennis table  \n* A multifaith prayer and meditation room \n\n*Text Overlay:* \n\n* *Music room*  \n* *Exercise room*   \n* *Several photo zones*  \n* *A coffee shop, cafeteria and several food machines around the campus*  \n* *Fully equipped kitchens with hot water, basic kitchenware and some ingredients for tea*  \n* *Outside terraces (aka summer lounge zones)*   \n* *Art exhibitions*   \n* *An indoor basketball court*  \n* *A table tennis table*  \n* *A multifaith prayer and meditation room* \n\nWell, that’s a quick tour\\! You’ll get to know all of these facilities as you spend time on campus. Speaking of tours, check out [this virtual tour](https://360.skoltech.ru/)  of Skoltech to see the campus with your own eyes. The link is available in the description. Let’s keep exploring the campus, shall we? We’ve already talked about the classrooms, the library and the cafeteria, but we haven’t yet seen the most technological part: research facilities\\! *Text Overlay: Research Facilities*\n\nOne of the most impressive (and open to all students) research space here is the FabLab. FabLab & Machine Shop (links to an external site)is a universal laboratory for students and Skoltech community members where you can create almost anything, anytime\\! In fact, it is one of the most unique university facilities, because students can come here with an idea and leave with a prototype within a few hours. How cool is that? At Skoltech, creative research and spontaneous ideas revolve about this laboratory. It has equipment to quickly create prototypes and conduct experiences. There are machine tools, 3D printers and a bunch of other things like:\n\n- Metalworking  \n- Woodworking  \n- Auxiliary equipment  \n- 3D printing  \n- Electronics  \n- Laser cutting and engraving  \n- Working with fabric  \n- Casting  \n- And more\n\nYou can find the complete equipment catalog on the FabLab page, linked below. The complete video tour of the facilities is also available there. As a Skoltech student, you have 24/7 access to the FabLab Facility and any basic materials, tools and equipment you may need. Some tools can be custom ordered for your project, too.",
    "context": "Sim: 4.16 - One of the most impressive (and open to all students) research space here is the FabLab. FabLab & Machine Shop (links to an external site)is a universal laboratory for students and Skoltech community members where you can create almost anything, anytime\\! In fact, it is one of the most unique university facilities, because students can come here with an idea and leave with a prototype within a few hours. How cool is that? At Skoltech, creative research and spontaneous ideas revolve about this laboratory. It has equipment to quickly create prototypes and conduct experiences. There are machine tools, 3D printers and a bunch of other things like:\nSim: 2.82 - As a Skoltech student, you have 24/7 access to the FabLab Facility and any basic materials, tools and equipment you may need. Some tools can be custom ordered for your project, too.\nSim: 1.34 - The Skoltech library is not only about books for loan, it is an academic hub for learning outside a classroom and doing research outside a lab. It combines digital infrastructure and self-directed learning space. In the library students can discover, analyze, share information, and create new knowledge. There are designated areas either for group collaboration or silent individual study, which makes the library your go-to place for any type of work.\nSim: 1.18 - Contrary to popular belief, the library is no longer a strict, no-talking-allowed place where you will bury yourself in books. By all means, you can do that too, but the Skoltech library is truly special. The librarians, designers and architects at Skoltech have put a lot of thought into creating a space where you can….well, do everything. Sometimes you need a few hours of quiet, at others \\- a large networking zone to debate a new concept with your friends. Or perhaps you want to eat? Just kidding, that’s what the cafeteria is for.\nSim: 0.62 - For a little extra motivation, if you win prizes or get top scores, you can be awarded a scholarship. If you don’t feel like competing in sports, but want to just work out before or after classes, Skoltech has a gym with a shower, changing rooms and all the equipment you may need. Send a request for gym membership via HelpDesk (links to an external site)to get your access at the beginning of the year\\!",
    "generated_answer": "At the Skoltech FabLab, you can create almost anything, anytime, using equipment to quickly create prototypes and conduct experiments, including machine tools and 3D printers.",
    "logprobs": [
      [
        {
          "prob": 0.8519363203675042,
          "token": "At"
        },
        {
          "prob": 0.1480443317528905,
          "token": "You"
        },
        {
          "prob": 1.1081394420225036e-05,
          "token": "Create"
        },
        {
          "prob": 2.801815286162671e-06,
          "token": "Students"
        },
        {
          "prob": 1.4997036525177749e-06,
          "token": " At"
        }
      ],
      [
        {
          "prob": 0.9994471746722718,
          "token": " the"
        },
        {
          "prob": 0.0005527785265734312,
          "token": " Sk"
        },
        {
          "prob": 2.192873328099415e-09,
          "token": " Skyl"
        },
        {
          "prob": 1.7078114651002222e-09,
          "token": " The"
        },
        {
          "prob": 7.578367437638516e-10,
          "token": "Sk"
        }
      ],
      [
        {
          "prob": 1.0,
          "token": " Sk"
        },
        {
          "prob": 1.7257827987960214e-08,
          "token": "Sk"
        },
        {
          "prob": 5.211412487888539e-10,
          "token": "_sk"
        },
        {
          "prob": 4.058652126475693e-10,
          "token": " Fab"
        },
        {
          "prob": 7.05287985111216e-11,
          "token": " SK"
        }
      ],
      [
        {
          "prob": 0.9999979734461775,
          "token": "ol"
        },
        {
          "prob": 1.553497204890439e-06,
          "token": "col"
        },
        {
          "prob": 1.6373740075447596e-07,
          "token": "ол"
        },
        {
          "prob": 7.734407154916583e-08,
          "token": "oll"
        },
        {
          "prob": 6.412048743288674e-08,
          "token": "olt"
        }
      ],
      [
        {
          "prob": 0.9996846716847217,
          "token": "tech"
        },
        {
          "prob": 0.00029595129349042285,
          "token": "Tech"
        },
        {
          "prob": 5.420537020224372e-06,
          "token": " tech"
        },
        {
          "prob": 4.2215184760182805e-06,
          "token": "otech"
        },
        {
          "prob": 2.9014043887853682e-06,
          "token": "-tech"
        }
      ],
      [
        {
          "prob": 0.9999868871505255,
          "token": " Fab"
        },
        {
          "prob": 1.3007123989067183e-05,
          "token": "Fab"
        },
        {
          "prob": 9.931061717292157e-08,
          "token": " Fabric"
        },
        {
          "prob": 1.8189374019565548e-09,
          "token": " fab"
        },
        {
          "prob": 2.789430849700478e-10,
          "token": " Far"
        }
      ],
      [
        {
          "prob": 0.9999980926550052,
          "token": "Lab"
        },
        {
          "prob": 1.7603429545652396e-06,
          "token": " Lab"
        },
        {
          "prob": 1.4449774900307763e-07,
          "token": "lab"
        },
        {
          "prob": 1.6052249934589952e-09,
          "token": " lab"
        },
        {
          "prob": 1.6052249934589952e-09,
          "token": "La"
        }
      ],
      [
        {
          "prob": 1.0,
          "token": ","
        },
        {
          "prob": 1.4166087866431961e-09,
          "token": " facility"
        },
        {
          "prob": 2.4616969518153846e-10,
          "token": " facilities"
        },
        {
          "prob": 1.493094676197164e-10,
          "token": "，"
        },
        {
          "prob": 9.056076989672867e-11,
          "token": " you"
        }
      ],
      [
        {
          "prob": 0.9980732443617326,
          "token": " you"
        },
        {
          "prob": 0.0019267342527389902,
          "token": " students"
        },
        {
          "prob": 2.5061617875971394e-08,
          "token": "you"
        },
        {
          "prob": 4.355056167555718e-09,
          "token": "students"
        },
        {
          "prob": 1.4138797302811623e-09,
          "token": "你"
        }
      ],
      [
        {
          "prob": 0.9999997615814777,
          "token": " can"
        },
        {
          "prob": 1.8553913626159784e-07,
          "token": "可以"
        },
        {
          "prob": 4.944450501938644e-09,
          "token": "can"
        },
        {
          "prob": 2.061153622438558e-09,
          "token": " Can"
        },
        {
          "prob": 8.592166619174109e-10,
          "token": "_can"
        }
      ],
      [
        {
          "prob": 0.9858813407624744,
          "token": " create"
        },
        {
          "prob": 0.014062841933280357,
          "token": " come"
        },
        {
          "prob": 2.3957735902778955e-05,
          "token": " turn"
        },
        {
          "prob": 1.4531101362333563e-05,
          "token": " bring"
        },
        {
          "prob": 1.2823651943402164e-05,
          "token": " use"
        }
      ],
      [
        {
          "prob": 0.9506883734480633,
          "token": " almost"
        },
        {
          "prob": 0.04733198210828137,
          "token": " prototypes"
        },
        {
          "prob": 0.0018352601113538498,
          "token": " anything"
        },
        {
          "prob": 8.063574014434942e-05,
          "token": " nearly"
        },
        {
          "prob": 3.361397749484487e-05,
          "token": " virtually"
        }
      ],
      [
        {
          "prob": 0.9999181099254703,
          "token": " anything"
        },
        {
          "prob": 7.484569109242154e-05,
          "token": "anything"
        },
        {
          "prob": 6.1437084503261755e-06,
          "token": " any"
        },
        {
          "prob": 5.714539033663261e-07,
          "token": " Anything"
        },
        {
          "prob": 7.733787586874965e-08,
          "token": "Anything"
        }
      ],
      [
        {
          "prob": 0.8696296858742837,
          "token": ","
        },
        {
          "prob": 0.10386245777216307,
          "token": " with"
        },
        {
          "prob": 0.018048584560405714,
          "token": " from"
        },
        {
          "prob": 0.006639703202017576,
          "token": " within"
        },
        {
          "prob": 0.0007929994618270017,
          "token": " and"
        }
      ],
      [
        {
          "prob": 0.5276899391785373,
          "token": " anytime"
        },
        {
          "prob": 0.2824520538243482,
          "token": " leave"
        },
        {
          "prob": 0.08092386830368835,
          "token": " get"
        },
        {
          "prob": 0.05561810708341758,
          "token": " quickly"
        },
        {
          "prob": 0.018056555694432427,
          "token": " including"
        }
      ],
      [
        {
          "prob": 0.9968866781274569,
          "token": ","
        },
        {
          "prob": 0.0028000499065905246,
          "token": " with"
        },
        {
          "prob": 0.00020283483819798524,
          "token": ";"
        },
        {
          "prob": 5.811315411408329e-05,
          "token": " and"
        },
        {
          "prob": 2.1378634660198864e-05,
          "token": " using"
        }
      ],
      [
        {
          "prob": 0.7215170951731897,
          "token": " using"
        },
        {
          "prob": 0.16099222499582372,
          "token": " use"
        },
        {
          "prob": 0.052266516839750046,
          "token": " and"
        },
        {
          "prob": 0.04612503921996501,
          "token": " with"
        },
        {
          "prob": 0.0102918873880034,
          "token": " including"
        }
      ],
      [
        {
          "prob": 0.8879948879035121,
          "token": " equipment"
        },
        {
          "prob": 0.09359398166521293,
          "token": " machine"
        },
        {
          "prob": 0.007682661856194213,
          "token": " available"
        },
        {
          "prob": 0.005280211126338632,
          "token": " tools"
        },
        {
          "prob": 0.0041122325599748715,
          "token": " various"
        }
      ],
      [
        {
          "prob": 0.5551033351227534,
          "token": " to"
        },
        {
          "prob": 0.43231491207914885,
          "token": " like"
        },
        {
          "prob": 0.01016707102003096,
          "token": " for"
        },
        {
          "prob": 0.0022685801849399675,
          "token": " such"
        },
        {
          "prob": 0.00014502547919912926,
          "token": " including"
        }
      ],
      [
        {
          "prob": 0.9925186695022231,
          "token": " quickly"
        },
        {
          "prob": 0.0035795820486666905,
          "token": " make"
        },
        {
          "prob": 0.0031589700704957747,
          "token": " create"
        },
        {
          "prob": 0.0007048614977338189,
          "token": " rapidly"
        },
        {
          "prob": 2.4119034122793936e-05,
          "token": " produce"
        }
      ],
      [
        {
          "prob": 0.8995876447259924,
          "token": " create"
        },
        {
          "prob": 0.09481584441815195,
          "token": " make"
        },
        {
          "prob": 0.004720602928403282,
          "token": " produce"
        },
        {
          "prob": 0.00034195932918870974,
          "token": " generate"
        },
        {
          "prob": 0.0002663181933507395,
          "token": " prototype"
        }
      ],
      [
        {
          "prob": 0.9999997615814777,
          "token": " prototypes"
        },
        {
          "prob": 1.2751905914873347e-07,
          "token": "prot"
        },
        {
          "prob": 6.023573837886479e-08,
          "token": "原型"
        },
        {
          "prob": 4.139937718785167e-08,
          "token": " prot"
        },
        {
          "prob": 2.215948977336598e-08,
          "token": " Prot"
        }
      ],
      [
        {
          "prob": 0.9999961853172863,
          "token": " and"
        },
        {
          "prob": 3.2887473357670864e-06,
          "token": ","
        },
        {
          "prob": 3.466314189697482e-07,
          "token": "."
        },
        {
          "prob": 1.4449747339575647e-07,
          "token": " such"
        },
        {
          "prob": 4.139921926206193e-08,
          "token": " like"
        }
      ],
      [
        {
          "prob": 0.9998568501347177,
          "token": " conduct"
        },
        {
          "prob": 0.00012339215143524314,
          "token": "conduct"
        },
        {
          "prob": 6.961308829041898e-06,
          "token": " conducting"
        },
        {
          "prob": 4.784432924553433e-06,
          "token": " conducts"
        },
        {
          "prob": 2.560922401849761e-06,
          "token": " prototypes"
        }
      ],
      [
        {
          "prob": 0.7981553544130601,
          "token": " experiments"
        },
        {
          "prob": 0.2018052681777936,
          "token": " experiences"
        },
        {
          "prob": 1.3330546550241511e-05,
          "token": " tests"
        },
        {
          "prob": 5.556998558352049e-06,
          "token": "实验"
        },
        {
          "prob": 4.904034015412745e-06,
          "token": " experience"
        }
      ],
      [
        {
          "prob": 0.6222659128805765,
          "token": ","
        },
        {
          "prob": 0.37742335465614013,
          "token": "."
        },
        {
          "prob": 0.00011173415518707487,
          "token": ";"
        },
        {
          "prob": 7.679368693484326e-05,
          "token": " including"
        },
        {
          "prob": 6.777019085805028e-05,
          "token": " within"
        }
      ],
      [
        {
          "prob": 0.9740443206204212,
          "token": " including"
        },
        {
          "prob": 0.0202156439174411,
          "token": " such"
        },
        {
          "prob": 0.0045107198648022635,
          "token": " with"
        },
        {
          "prob": 0.0005387286624729906,
          "token": " like"
        },
        {
          "prob": 0.0003702624338950868,
          "token": " and"
        }
      ],
      [
        {
          "prob": 0.9905431709239444,
          "token": " machine"
        },
        {
          "prob": 0.008569876698477426,
          "token": " using"
        },
        {
          "prob": 0.00042666903709125977,
          "token": " access"
        },
        {
          "prob": 0.0002283795871981371,
          "token": " "
        },
        {
          "prob": 0.00012224278408825217,
          "token": " accessing"
        }
      ],
      [
        {
          "prob": 0.9999994039539004,
          "token": " tools"
        },
        {
          "prob": 4.4508482557577276e-07,
          "token": "-tools"
        },
        {
          "prob": 4.691164021834418e-08,
          "token": "工具"
        },
        {
          "prob": 4.139937718785167e-08,
          "token": "tools"
        },
        {
          "prob": 1.522997974471263e-08,
          "token": " Tools"
        }
      ],
      [
        {
          "prob": 0.7772997506488211,
          "token": " and"
        },
        {
          "prob": 0.22270009388515652,
          "token": ","
        },
        {
          "prob": 1.634221211804872e-07,
          "token": "和"
        },
        {
          "prob": 9.717443801221145e-10,
          "token": " и"
        },
        {
          "prob": 5.893927599475101e-10,
          "token": "、"
        }
      ],
      [
        {
          "prob": 1.0,
          "token": " "
        },
        {
          "prob": 2.510999155743982e-08,
          "token": "3"
        },
        {
          "prob": 3.775134544279098e-11,
          "token": " a"
        },
        {
          "prob": 1.3887943864964021e-11,
          "token": " printers"
        },
        {
          "prob": 1.463778514125909e-12,
          "token": " three"
        }
      ],
      [
        {
          "prob": 1.0,
          "token": "3"
        },
        {
          "prob": 4.508755242294825e-12,
          "token": ""
        },
        {
          "prob": 3.0988191387218256e-12,
          "token": "３"
        },
        {
          "prob": 1.463778514125909e-12,
          "token": "三维"
        },
        {
          "prob": 2.2447770550209742e-13,
          "token": "¾"
        }
      ],
      [
        {
          "prob": 1.0,
          "token": "D"
        },
        {
          "prob": 1.917171513758312e-10,
          "token": "d"
        },
        {
          "prob": 2.9400777392844726e-11,
          "token": "DP"
        },
        {
          "prob": 2.9400777392844726e-11,
          "token": "Д"
        },
        {
          "prob": 1.2256067444099483e-11,
          "token": "Ds"
        }
      ],
      [
        {
          "prob": 0.999995112442896,
          "token": " printers"
        },
        {
          "prob": 3.2887441993747145e-06,
          "token": "打印机"
        },
        {
          "prob": 5.714980485251211e-07,
          "token": " printing"
        },
        {
          "prob": 3.059008618493715e-07,
          "token": " printer"
        },
        {
          "prob": 3.059008618493715e-07,
          "token": " Print"
        }
      ],
      [
        {
          "prob": 0.9999996423722521,
          "token": "."
        },
        {
          "prob": 3.927863545481039e-07,
          "token": ","
        },
        {
          "prob": 5.602796437537268e-09,
          "token": " within"
        },
        {
          "prob": 5.905303998944039e-10,
          "token": "。"
        },
        {
          "prob": 2.172439935079017e-10,
          "token": ";"
        }
      ],
      [
        {
          "prob": 0.9998411192709713,
          "token": ""
        },
        {
          "prob": 0.00013981935868482556,
          "token": " Students"
        },
        {
          "prob": 3.0890119866313373e-06,
          "token": " You"
        },
        {
          "prob": 1.7600659753704836e-06,
          "token": "Students"
        },
        {
          "prob": 1.3707407598758687e-06,
          "token": "students"
        }
      ]
    ],
    "language_consistency_score": 0.5004003462742986,
    "feedback": "Feedback: The response is somewhat correct, accurate, and factual. It mentions that the Skoltech FabLab allows for creating prototypes and conducting experiments using equipment like machine tools and 3D printers. However, it lacks the additional details provided in the reference answer, such as metalworking, woodworking, electronics, laser cutting and engraving, working with fabric, and casting.",
    "score": 3
  },
  {
    "question": "What email address should students contact if they have urgent questions or need assistance?\n",
    "true_answer": "education@skoltech.ru \n",
    "source_doc": "Any performance below this may be reported to the Disciplinary Board for further examination. *Text Overlay: A-E, F,*  Pass/Fail\n\nSkoltech’s variety of courses allows you to not only choose the ones that complement your educational track, but also be flexible about registering for them or making changes in your schedule (with some regulations, of course). When it comes to course registration, we mostly expect you to register for courses yourself with some exceptions. For instance, the Education Department has already registered you for your first course \\- Innovation Workshop :) \n\nFor standard terms (so, not Term 1A), registration will happen about 3 weeks before the start of the term (check the calendar\\!). Here’s a quick timeline: \n\n*Graph:* \n\n![][image11]\n\nSide note:  Short-term projects follow regular registration schedule\n\nSo how do you register for your courses?As we’ve already mentioned, you do not need to register for any courses in Term 1A \\- you are already signed up for a compulsory course called Innovation Workshop. Instructions on how to register for the other terms will be sent to you individually by the Education Department. Meanwhile, you can explore [the courses offered in 2022-2023](https://www.skoltech.ru/en/education/course-catalog/) (and in the upcoming terms) [using the link below](https://www.skoltech.ru/en/education/course-catalog/) and choose which ones you want to register for. You can filter courses based on your program, credit load, and instructors. After you’ve registered for courses, you will be added to your course “page” on Canvas. Here you will see information about your registered courses, your grades, assignments, group work and more. Make sure to bookmark Canvas in your browser and check it for updates from your professors and program coordinators on a daily basis\\! As a student, you have rights and channels for feedback. As Skoltech constantly works on improving this communication, please be aware of the following:\n\nYour student rights:\n\n* To obtain full information on your courses and educational programs, course syllabi, assessment criteria and feedback on your progress  \n* To provide your feedback on the quality of courses\n\n At the end of each course, you will be asked to submit a formal evaluation of the coursework, the course load and your professor, course instructor and teaching assistant. These evaluations are used to collect your *anonymous* feedback on each of your learning experiences. The feedback is then followed-up to Education Department, course instructors and program coordinators. If you need to communicate any concerns or issues informally or outside of the formal evaluation period (or if you are unable to solve an issue directly with your research advisor or faculty, please talk to the [Education Department](https://helpdesk.skoltech.ru/servicedesk/customer/portal/21) информация для связи также в описании. If you are a student of a network or a joint program, you probably have a few questions about the logistics of your studies. *Text Overlay: Network and Joint Programs and double degrees*\n\nYour schedule, curriculum and even travel times will depend on the program you are in. Moreover, there will be specific regulations on how to submit your original diploma and receive your scholarship if you are a student of a joint or network program. The details of your studies are normally coordinated by the Centers to which your programs belong. Each program has its own *coordinator*, who will be in touch with you regarding the essential information (if they haven’t reached out yet). Until then, if you have urgent questions or need assistance, feel free to reach out to the Education Department via [education@skoltech.ru](mailto:education@skoltech.ru). For more details on the Education Department, as well as for all the relevant links, see the description below. *Text Overlay: education@skoltech.ru.*  \n",
    "context": "Sim: 3.04 - Until then, if you have urgent questions or need assistance, feel free to reach out to the Education Department via [education@skoltech.ru](mailto:education@skoltech.ru). For more details on the Education Department, as well as for all the relevant links, see the description below.",
    "generated_answer": "students should contact [education@skoltech.ru](mailto:education@skoltech.ru) if they have urgent questions or need assistance.",
    "logprobs": [
      [
        {
          "prob": 0.8067235126246991,
          "token": "students"
        },
        {
          "prob": 0.18000435193200062,
          "token": "education"
        },
        {
          "prob": 0.010155151840471143,
          "token": "Students"
        },
        {
          "prob": 0.0009445762612981527,
          "token": " students"
        },
        {
          "prob": 0.0005729144629140614,
          "token": "edu"
        }
      ],
      [
        {
          "prob": 0.9999992847447459,
          "token": " should"
        },
        {
          "prob": 3.059020287707785e-07,
          "token": "应该"
        },
        {
          "prob": 1.8553895931777327e-07,
          "token": "should"
        },
        {
          "prob": 1.275189375371399e-07,
          "token": " can"
        },
        {
          "prob": 6.023573837886479e-08,
          "token": "应"
        }
      ],
      [
        {
          "prob": 0.9995476862197713,
          "token": " contact"
        },
        {
          "prob": 0.00043054766571878027,
          "token": " reach"
        },
        {
          "prob": 2.1435716290108746e-05,
          "token": "contact"
        },
        {
          "prob": 1.636637135237316e-07,
          "token": "_contact"
        },
        {
          "prob": 5.3133828412509574e-08,
          "token": ".contact"
        }
      ],
      [
        {
          "prob": 0.9030989496239743,
          "token": " ["
        },
        {
          "prob": 0.0840012812473773,
          "token": " the"
        },
        {
          "prob": 0.012882016771934825,
          "token": " education"
        },
        {
          "prob": 8.07350384083237e-06,
          "token": "教育"
        },
        {
          "prob": 5.548832632081823e-06,
          "token": "education"
        }
      ],
      [
        {
          "prob": 0.9999727018181879,
          "token": "education"
        },
        {
          "prob": 1.6701238885123605e-05,
          "token": "教育"
        },
        {
          "prob": 8.939528983688169e-06,
          "token": " education"
        },
        {
          "prob": 4.4507294068738415e-07,
          "token": "edu"
        },
        {
          "prob": 3.927754915808339e-07,
          "token": "educ"
        }
      ],
      [
        {
          "prob": 1.0,
          "token": "@"
        },
        {
          "prob": 2.646573638909117e-09,
          "token": "@example"
        },
        {
          "prob": 1.917171513758312e-10,
          "token": "@s"
        },
        {
          "prob": 1.2378189627675852e-10,
          "token": "<"
        },
        {
          "prob": 9.640143775040296e-11,
          "token": "@email"
        }
      ],
      [
        {
          "prob": 0.9999998807907247,
          "token": "sk"
        },
        {
          "prob": 4.691164021834418e-08,
          "token": "sky"
        },
        {
          "prob": 2.215948977336598e-08,
          "token": "sku"
        },
        {
          "prob": 1.4307241918567688e-08,
          "token": "<"
        },
        {
          "prob": 1.3440409951135022e-08,
          "token": "ski"
        }
      ],
      [
        {
          "prob": 0.9999998807907247,
          "token": "ol"
        },
        {
          "prob": 1.1253517471925912e-07,
          "token": "ол"
        },
        {
          "prob": 3.2241867372567335e-08,
          "token": "olk"
        },
        {
          "prob": 2.061153622438558e-09,
          "token": "ole"
        },
        {
          "prob": 1.2501528663867426e-09,
          "token": "olare"
        }
      ],
      [
        {
          "prob": 0.9999971389852362,
          "token": "tech"
        },
        {
          "prob": 1.0677009553134769e-06,
          "token": " tech"
        },
        {
          "prob": 8.315263400842229e-07,
          "token": "Tech"
        },
        {
          "prob": 2.699570779818012e-07,
          "token": "itech"
        },
        {
          "prob": 2.382362851497276e-07,
          "token": "techn"
        }
      ],
      [
        {
          "prob": 0.9999986886995842,
          "token": ".ru"
        },
        {
          "prob": 5.043471815847051e-07,
          "token": ".rs"
        },
        {
          "prob": 4.4508482557577276e-07,
          "token": " ru"
        },
        {
          "prob": 3.059020287707785e-07,
          "token": ".rb"
        },
        {
          "prob": 4.691155074157667e-08,
          "token": "_ru"
        }
      ],
      [
        {
          "prob": 0.9994506279166882,
          "token": "]("
        },
        {
          "prob": 0.0003352784033807298,
          "token": "]"
        },
        {
          "prob": 0.00020335663118991248,
          "token": "]."
        },
        {
          "prob": 6.958481265518261e-06,
          "token": "]["
        },
        {
          "prob": 3.7246066225039354e-06,
          "token": "]()"
        }
      ],
      [
        {
          "prob": 0.9999969005680498,
          "token": "mailto"
        },
        {
          "prob": 8.315263400842229e-07,
          "token": "http"
        },
        {
          "prob": 4.450839766446488e-07,
          "token": "(mail"
        },
        {
          "prob": 1.1979272719177258e-07,
          "token": "gmail"
        },
        {
          "prob": 1.1979272719177258e-07,
          "token": "/mail"
        }
      ],
      [
        {
          "prob": 1.0,
          "token": ":"
        },
        {
          "prob": 1.4166087866431961e-09,
          "token": "："
        },
        {
          "prob": 2.289734845645553e-11,
          "token": ":<"
        },
        {
          "prob": 1.478363929001648e-11,
          "token": ";"
        },
        {
          "prob": 1.2256067444099483e-11,
          "token": "教育"
        }
      ],
      [
        {
          "prob": 0.9999963045256735,
          "token": "education"
        },
        {
          "prob": 2.5612790004194033e-06,
          "token": " education"
        },
        {
          "prob": 8.31525547079287e-07,
          "token": "教育"
        },
        {
          "prob": 1.6373708845046632e-07,
          "token": "Education"
        },
        {
          "prob": 2.2159405241782167e-08,
          "token": "edu"
        }
      ],
      [
        {
          "prob": 1.0,
          "token": "@"
        },
        {
          "prob": 3.398267819495071e-09,
          "token": "@example"
        },
        {
          "prob": 4.3204126993085624e-10,
          "token": "@s"
        },
        {
          "prob": 2.7894680928689246e-10,
          "token": "@email"
        },
        {
          "prob": 2.7894680928689246e-10,
          "token": "@gmail"
        }
      ],
      [
        {
          "prob": 0.9999982118638471,
          "token": "sk"
        },
        {
          "prob": 1.003013181147361e-06,
          "token": "sky"
        },
        {
          "prob": 9.931175369924415e-08,
          "token": "ed"
        },
        {
          "prob": 8.233233559423349e-08,
          "token": "sku"
        },
        {
          "prob": 6.825590357542018e-08,
          "token": " sk"
        }
      ],
      [
        {
          "prob": 0.9999998807907247,
          "token": "ol"
        },
        {
          "prob": 6.023573837886479e-08,
          "token": "ол"
        },
        {
          "prob": 2.215948977336598e-08,
          "token": "ok"
        },
        {
          "prob": 6.34880011604368e-09,
          "token": "olk"
        },
        {
          "prob": 2.335593038799337e-09,
          "token": "olt"
        }
      ],
      [
        {
          "prob": 0.9999985694905718,
          "token": "tech"
        },
        {
          "prob": 4.4508482557577276e-07,
          "token": " tech"
        },
        {
          "prob": 3.4663241069161144e-07,
          "token": "techn"
        },
        {
          "prob": 3.059020287707785e-07,
          "token": "tek"
        },
        {
          "prob": 1.8553895931777327e-07,
          "token": "Tech"
        }
      ],
      [
        {
          "prob": 0.9999971389852362,
          "token": ".ru"
        },
        {
          "prob": 1.209863685851439e-06,
          "token": " ru"
        },
        {
          "prob": 8.315263400842229e-07,
          "token": "_ru"
        },
        {
          "prob": 6.47593364802092e-07,
          "token": "ru"
        },
        {
          "prob": 4.691155074157667e-08,
          "token": "RU"
        }
      ],
      [
        {
          "prob": 0.9999417100552707,
          "token": ")"
        },
        {
          "prob": 5.829127258796956e-05,
          "token": ")."
        },
        {
          "prob": 5.904954841587826e-10,
          "token": "）"
        },
        {
          "prob": 2.789303162612206e-10,
          "token": "))"
        },
        {
          "prob": 2.4615514013746875e-10,
          "token": " )"
        }
      ],
      [
        {
          "prob": 0.9914214227512674,
          "token": " if"
        },
        {
          "prob": 0.008577476750351117,
          "token": " for"
        },
        {
          "prob": 3.43659156883941e-07,
          "token": "\tif"
        },
        {
          "prob": 3.0327814149491143e-07,
          "token": "如果"
        },
        {
          "prob": 1.4325845021965302e-07,
          "token": " If"
        }
      ],
      [
        {
          "prob": 0.9999977350285647,
          "token": " they"
        },
        {
          "prob": 2.2603250957489616e-06,
          "token": "他们"
        },
        {
          "prob": 1.0467381829779195e-08,
          "token": "they"
        },
        {
          "prob": 1.2501504819116561e-09,
          "token": " они"
        },
        {
          "prob": 6.691573328117371e-10,
          "token": " They"
        }
      ],
      [
        {
          "prob": 0.9999997615814777,
          "token": " have"
        },
        {
          "prob": 6.023573837886479e-08,
          "token": "have"
        },
        {
          "prob": 4.139937718785167e-08,
          "token": " Have"
        },
        {
          "prob": 3.6534822137210456e-08,
          "token": " need"
        },
        {
          "prob": 9.237449661970594e-09,
          "token": "_have"
        }
      ],
      [
        {
          "prob": 0.9999592320834669,
          "token": " urgent"
        },
        {
          "prob": 4.00636544290992e-05,
          "token": "urgent"
        },
        {
          "prob": 5.043269807052217e-07,
          "token": " urgently"
        },
        {
          "prob": 2.3822719733000979e-07,
          "token": " urgency"
        },
        {
          "prob": 1.343987161541799e-08,
          "token": " urg"
        }
      ],
      [
        {
          "prob": 0.9999996423722521,
          "token": " questions"
        },
        {
          "prob": 3.4663274126619643e-07,
          "token": "questions"
        },
        {
          "prob": 2.215948977336598e-08,
          "token": " Questions"
        },
        {
          "prob": 2.335593038799337e-09,
          "token": "_questions"
        },
        {
          "prob": 1.103256032343554e-09,
          "token": "Questions"
        }
      ],
      [
        {
          "prob": 0.9999997615814777,
          "token": " or"
        },
        {
          "prob": 1.8553913626159784e-07,
          "token": "或"
        },
        {
          "prob": 9.056076989672867e-11,
          "token": " или"
        },
        {
          "prob": 3.775134544279098e-11,
          "token": "or"
        },
        {
          "prob": 1.3887943864964021e-11,
          "token": "或者"
        }
      ],
      [
        {
          "prob": 0.9999849798550975,
          "token": " need"
        },
        {
          "prob": 1.4738974314670568e-05,
          "token": "需要"
        },
        {
          "prob": 2.699537311378345e-07,
          "token": "need"
        },
        {
          "prob": 2.2159151648965488e-08,
          "token": "_need"
        },
        {
          "prob": 8.151896325454668e-09,
          "token": " Need"
        }
      ],
      [
        {
          "prob": 0.9999991655356624,
          "token": " assistance"
        },
        {
          "prob": 5.715002286213223e-07,
          "token": " Assistance"
        },
        {
          "prob": 5.3157852544244216e-08,
          "token": " assist"
        },
        {
          "prob": 4.691164021834418e-08,
          "token": "ass"
        },
        {
          "prob": 1.3440409951135022e-08,
          "token": " assistant"
        }
      ],
      [
        {
          "prob": 1.0,
          "token": "."
        },
        {
          "prob": 3.850741922767617e-09,
          "token": "。"
        },
        {
          "prob": 6.691586091292782e-10,
          "token": ".\n\n"
        },
        {
          "prob": 4.5990553786523166e-10,
          "token": ""
        },
        {
          "prob": 3.3647407934131505e-10,
          "token": ".)"
        }
      ],
      [
        {
          "prob": 0.999998927117538,
          "token": ""
        },
        {
          "prob": 2.2380270517518682e-07,
          "token": ""
        },
        {
          "prob": 1.3574320241537807e-07,
          "token": "<tool_call>"
        },
        {
          "prob": 8.677764327999391e-09,
          "token": " bụ"
        },
        {
          "prob": 4.644872530556089e-09,
          "token": "eka"
        }
      ]
    ],
    "language_consistency_score": 0.4299928272855708,
    "feedback": "Feedback: The response is completely correct, accurate, and factual. It provides the correct email address for students to contact if they have urgent questions or need assistance, which matches the reference answer.",
    "score": 5
  },
  {
    "question": "What does Skoltech's Disciplinary Board review cases related to?\n",
    "true_answer": "Skoltech's Disciplinary Board reviews individual cases related to academic misconduct, full-time student status violation, poor academic performance, violation of the attendance regulations, violation of other policies and regulations governing education, and other academic-related issues and conflicts. \n",
    "source_doc": "\n### Video 4 \n\nIn this module, we’re going to talk about Academic Integrity. This includes Academic Misconduct and Disciplinary Measures. On top of that, we’ll discuss the Education Process, which covers Academic Structure, the Grading System, and Course Registration. *Text Overlay:* \n\n- *Academic Integrity : Academic Misconduct , Disciplinary Measures*  \n- *Education Process : Academic structure, grading system, course registration* \n\n\nLet’s start with Academic Integrity. It relies on our community’s personal values and policies on ethics, conflict of interest, and others. We expect everyone to: \n\n- Follow professional courtesy  \n- Be committed to honesty without compromising their values  \n- Promote the truth without compromise\n\n*Text Overlay:* \n\n- *Follow professional courtesy*  \n- *Be committed to honesty without compromising their values*  \n- *Promote the truth without compromise*\n\nThis is very important because it leads to the respectful culture that you develop in terms of how you conduct your academic studies, publish in top journals recognized in the most prominent fields, and other achievements. If, at any stage or time, the integrity of your studies is compromised, you will enter the realms of academic misconduct. *Text Overlay: academic misconduct.*\n\nFormal definitions of academic misconduct say that it is the intent of the individual participating in this to cheat the system in some way to gain something in return. ​​What’s considered academic misconduct? * Deliberate interference with the integrity of others’ work  \n* Fabrication or falsification of data  \n* Unauthorized collaboration  \n* Plagiarism  \n* Cheating\n\n*Text Overlay:* \n\n* *Deliberate interference with the integrity of others’ work*  \n* *Fabrication or falsification of data*  \n* *Unauthorized collaboration*  \n* *Plagiarism*  \n* *Cheating*\n\nResearch Misconduct includes such offenses as:\n\n* Substitution of data  \n* Unrealistic precision of data  \n* Results that contradict known physics\n\n*Text Overlay: Research Misconduct includes such offenses as:*\n\n* *Substitution of data*  \n* *Unrealistic precision of data*  \n* *Results that contradict known physics*\n\nYou can learn more about disciplinary actions by clicking the link below. Discipline is an important part of any academic organization, and in this case Skoltech is no exception. Students who cheat, plagiarize or participate in any other form of academic or research misconduct (including failing classes and violating full time status) are subject to an evaluation by the Skoltech Disciplinary Board (DB). *Text Overlays: Disciplinary Measures at Skoltech*\n\nIf a faculty member witnesses a student’s academic misconduct, the student’s name will be submitted to the Disciplinary Board. Both the student and the witness will be given a chance to explain their positions in writing. Then the Disciplinary Board will make a decision regarding the student’s status at Skoltech. Each case of academic and research misconduct is taken seriously and reviewed on an individual basis. For more information about this, please see the Disciplinary Board Policy via the link below. The DBP Skoltech Disciplinary Board is an internal committee formed in order to address the issues related to student misconduct and the other disputes between students and Skoltech. The Disciplinary Board reviews individual cases related to the following:\n\n- academic misconduct  \n- full-time student status violation  \n- poor academic performance  \n- violation of the attendance regulations  \n- violation (by the students) of other policies  \n- and regulations governing educational  \n- processes  \n- other academic-related issues /conflicts\n\n*Text Overlay:*\n\n- *academic misconduct*  \n- *full-time student status violation*  \n- *poor academic performance*  \n- *violation of the attendance regulations*  \n- *violation (by the students) of other policies*  \n- *and regulations governing educational*\n\nNow this lesson wouldn’t make sense without some actual advice on how to avoid academic and research misconduct. 1.",
    "context": "Sim: 8.24 - The DBP Skoltech Disciplinary Board is an internal committee formed in order to address the issues related to student misconduct and the other disputes between students and Skoltech. The Disciplinary Board reviews individual cases related to the following:\nSim: 4.23 - If a faculty member witnesses a student’s academic misconduct, the student’s name will be submitted to the Disciplinary Board. Both the student and the witness will be given a chance to explain their positions in writing. Then the Disciplinary Board will make a decision regarding the student’s status at Skoltech. Each case of academic and research misconduct is taken seriously and reviewed on an individual basis. For more information about this, please see the Disciplinary Board Policy via the link below. \nSim: 3.69 - Discipline is an important part of any academic organization, and in this case Skoltech is no exception. Students who cheat, plagiarize or participate in any other form of academic or research misconduct (including failing classes and violating full time status) are subject to an evaluation by the Skoltech Disciplinary Board (DB).",
    "generated_answer": "Skoltech's Disciplinary Board reviews cases related to student misconduct and disputes between students and Skoltech.",
    "logprobs": [
      [
        {
          "prob": 0.9911806910165648,
          "token": "Sk"
        },
        {
          "prob": 0.008575395162616694,
          "token": "The"
        },
        {
          "prob": 0.0001779765637395781,
          "token": "Student"
        },
        {
          "prob": 2.7293590031457294e-05,
          "token": " Sk"
        },
        {
          "prob": 2.125626928932883e-05,
          "token": "Cases"
        }
      ],
      [
        {
          "prob": 0.9999984502816872,
          "token": "ol"
        },
        {
          "prob": 3.0590173704000945e-07,
          "token": "ол"
        },
        {
          "prob": 2.5360144730813174e-07,
          "token": "oll"
        },
        {
          "prob": 2.3823651234966232e-07,
          "token": "olk"
        },
        {
          "prob": 1.5381705313987978e-07,
          "token": "hol"
        }
      ],
      [
        {
          "prob": 0.999874845907329,
          "token": "tech"
        },
        {
          "prob": 7.484247913274521e-05,
          "token": "Tech"
        },
        {
          "prob": 1.4737357942463797e-05,
          "token": " tech"
        },
        {
          "prob": 1.4737357942463797e-05,
          "token": "te"
        },
        {
          "prob": 4.784519618364044e-06,
          "token": "tek"
        }
      ],
      [
        {
          "prob": 0.9999998807907247,
          "token": "'s"
        },
        {
          "prob": 6.023573837886479e-08,
          "token": " Disc"
        },
        {
          "prob": 1.0467401794744658e-08,
          "token": "’s"
        },
        {
          "prob": 5.211412487888539e-10,
          "token": "'S"
        },
        {
          "prob": 4.058652126475693e-10,
          "token": " Discipline"
        }
      ],
      [
        {
          "prob": 0.9999948740268748,
          "token": " Disc"
        },
        {
          "prob": 3.7266354020539563e-06,
          "token": "Disc"
        },
        {
          "prob": 1.2098613782217925e-06,
          "token": " Discipline"
        },
        {
          "prob": 7.734377650551034e-08,
          "token": "_disc"
        },
        {
          "prob": 6.825564320030807e-08,
          "token": " DB"
        }
      ],
      [
        {
          "prob": 0.9999997615814777,
          "token": "iplinary"
        },
        {
          "prob": 2.699578503363014e-07,
          "token": "ipl"
        },
        {
          "prob": 2.4862258480890196e-09,
          "token": "itational"
        },
        {
          "prob": 2.061153622438558e-09,
          "token": "our"
        },
        {
          "prob": 1.8189616875530459e-09,
          "token": "ursive"
        }
      ],
      [
        {
          "prob": 0.9999928474936721,
          "token": " Board"
        },
        {
          "prob": 6.962258245244699e-06,
          "token": "Board"
        },
        {
          "prob": 2.6995604817923813e-07,
          "token": "_board"
        },
        {
          "prob": 7.582502577787526e-10,
          "token": "板"
        },
        {
          "prob": 5.905258945221871e-10,
          "token": "(Board"
        }
      ],
      [
        {
          "prob": 0.9999941587791524,
          "token": " reviews"
        },
        {
          "prob": 3.288741062985334e-06,
          "token": "reviews"
        },
        {
          "prob": 7.338173200706349e-07,
          "token": " reviewers"
        },
        {
          "prob": 7.338173200706349e-07,
          "token": " review"
        },
        {
          "prob": 3.059005701197153e-07,
          "token": " reviewed"
        }
      ],
      [
        {
          "prob": 0.9968234201720128,
          "token": " cases"
        },
        {
          "prob": 0.0031726710050749133,
          "token": " individual"
        },
        {
          "prob": 3.714815823317269e-06,
          "token": " issues"
        },
        {
          "prob": 4.6762629988362344e-08,
          "token": "cases"
        },
        {
          "prob": 3.6418772853414954e-08,
          "token": "individual"
        }
      ],
      [
        {
          "prob": 0.9999945164027223,
          "token": " related"
        },
        {
          "prob": 4.2228271137778295e-06,
          "token": " of"
        },
        {
          "prob": 3.9278410701298514e-07,
          "token": " relating"
        },
        {
          "prob": 3.466307578234157e-07,
          "token": " involving"
        },
        {
          "prob": 3.059005701197153e-07,
          "token": "related"
        }
      ],
      [
        {
          "prob": 1.0,
          "token": " to"
        },
        {
          "prob": 4.058652126475693e-10,
          "token": "to"
        },
        {
          "prob": 2.5946094982764667e-11,
          "token": "到"
        },
        {
          "prob": 1.57371021068629e-11,
          "token": "_to"
        },
        {
          "prob": 5.109089028063325e-12,
          "token": "\tto"
        }
      ],
      [
        {
          "prob": 0.9999392069583942,
          "token": " student"
        },
        {
          "prob": 2.144409943268609e-05,
          "token": " issues"
        },
        {
          "prob": 1.4738299633412718e-05,
          "token": " academic"
        },
        {
          "prob": 1.3006503775850402e-05,
          "token": " misconduct"
        },
        {
          "prob": 4.7848253406541e-06,
          "token": " students"
        }
      ],
      [
        {
          "prob": 0.9999984502816872,
          "token": " misconduct"
        },
        {
          "prob": 1.370956471489639e-06,
          "token": " conduct"
        },
        {
          "prob": 5.315775115378354e-08,
          "token": " mis"
        },
        {
          "prob": 4.139929822488149e-08,
          "token": " academic"
        },
        {
          "prob": 1.18610975280741e-08,
          "token": " disputes"
        }
      ],
      [
        {
          "prob": 0.9975841138568614,
          "token": " and"
        },
        {
          "prob": 0.001323574834649976,
          "token": ","
        },
        {
          "prob": 0.0010308011176790065,
          "token": " including"
        },
        {
          "prob": 5.8153847385537164e-05,
          "token": " such"
        },
        {
          "prob": 3.280815566783842e-06,
          "token": "."
        }
      ],
      [
        {
          "prob": 0.9706793459391061,
          "token": " disputes"
        },
        {
          "prob": 0.029311974260133992,
          "token": " other"
        },
        {
          "prob": 2.4861893355806944e-06,
          "token": " research"
        },
        {
          "prob": 1.9362462014140204e-06,
          "token": " disputed"
        },
        {
          "prob": 1.036397907733337e-06,
          "token": " conflicts"
        }
      ],
      [
        {
          "prob": 0.9999749666753994,
          "token": " between"
        },
        {
          "prob": 1.4738833753528276e-05,
          "token": " involving"
        },
        {
          "prob": 8.939554559922333e-06,
          "token": "."
        },
        {
          "prob": 9.422221185442924e-07,
          "token": ","
        },
        {
          "prob": 3.0589473558501603e-07,
          "token": "之间"
        }
      ],
      [
        {
          "prob": 0.9999997615814777,
          "token": " students"
        },
        {
          "prob": 2.382369667501818e-07,
          "token": "students"
        },
        {
          "prob": 8.152020714470167e-09,
          "token": "学生"
        },
        {
          "prob": 6.34880011604368e-09,
          "token": "学生们"
        },
        {
          "prob": 4.944450501938644e-09,
          "token": " Students"
        }
      ],
      [
        {
          "prob": 0.994076619024973,
          "token": " and"
        },
        {
          "prob": 0.005910996116390646,
          "token": "."
        },
        {
          "prob": 1.1410901460969127e-05,
          "token": ","
        },
        {
          "prob": 9.366638307210955e-07,
          "token": " or"
        },
        {
          "prob": 2.496124559633007e-08,
          "token": " involving"
        }
      ],
      [
        {
          "prob": 0.8519496373592031,
          "token": " Sk"
        },
        {
          "prob": 0.14804664369295154,
          "token": " the"
        },
        {
          "prob": 3.5976569357665894e-06,
          "token": "Sk"
        },
        {
          "prob": 1.0863972230434488e-07,
          "token": "_sk"
        },
        {
          "prob": 1.1450542487494226e-08,
          "token": " SK"
        }
      ],
      [
        {
          "prob": 0.9999648344963598,
          "token": "ol"
        },
        {
          "prob": 2.7535477717122882e-05,
          "token": "olk"
        },
        {
          "prob": 1.370910711644191e-06,
          "token": "opt"
        },
        {
          "prob": 1.209824456746042e-06,
          "token": "col"
        },
        {
          "prob": 1.067666335749473e-06,
          "token": "olt"
        }
      ],
      [
        {
          "prob": 0.9999786619922026,
          "token": "tech"
        },
        {
          "prob": 7.889159304314481e-06,
          "token": "Tech"
        },
        {
          "prob": 7.889159304314481e-06,
          "token": " tech"
        },
        {
          "prob": 1.7603093790081653e-06,
          "token": "itech"
        },
        {
          "prob": 1.209841763547506e-06,
          "token": "te"
        }
      ],
      [
        {
          "prob": 0.9980727693729643,
          "token": "."
        },
        {
          "prob": 0.0019267333340007235,
          "token": ","
        },
        {
          "prob": 4.442273823731504e-07,
          "token": " on"
        },
        {
          "prob": 7.180273738542893e-09,
          "token": ".\n\n"
        },
        {
          "prob": 5.5920028102442495e-09,
          "token": " including"
        }
      ],
      [
        {
          "prob": 0.9999779467683537,
          "token": ""
        },
        {
          "prob": 4.785012434078284e-06,
          "token": " It"
        },
        {
          "prob": 3.7265714306665768e-06,
          "token": " Specifically"
        },
        {
          "prob": 3.5007898814756853e-06,
          "token": "pecific"
        },
        {
          "prob": 6.475810130566981e-07,
          "token": " The"
        }
      ]
    ],
    "language_consistency_score": 0.8305821578394428,
    "feedback": "Feedback: The response is somewhat correct, accurate, and factual. It mentions that the Disciplinary Board reviews cases related to student misconduct, which is accurate. However, it lacks the specific details provided in the reference answer, such as academic misconduct, full-time student status violation, poor academic performance, and other academic-related issues. Additionally, the mention of disputes between students and Skoltech is not as precise as the reference answer, which specifies the types of policies and regulations that can be violated.",
    "score": 3
  },
  {
    "question": "How many ECTS credits are required for the Science, Technology, and Engineering track?\n",
    "true_answer": "36 ECTS credits \n",
    "source_doc": "\n### Text After Video 4\n\n[Learn more about what’s considered academic misconduct (links to an external site)](https://www.skoltech.ru/app/data/uploads/sites/2/2015/04/1.-STUDENT-ACADEMIC-INTEGRITY-REGULATIONS.pdf)  \n[Disciplinary Board Policy (links to an external site).](http://www.skoltech.ru/app/data/uploads/sites/2/2015/04/DISCIPLINARY-BOARD-POLICY.pdf)\n\nSave these links\\! 1) [Course timetable (links to an external site)](https://schedule.skoltech.ru/)  \n2) [Course catalog (links to an external site)](https://www.skoltech.ru/en/education/course-catalog/)  \n3) [Education resources for students (Canvas)](https://skoltech.instructure.com/courses/2072)\n\n![][image12]  \n[View the 2022-2023 academic calendar with key dates, breaks and holidays](https://www.skoltech.ru/en/education/academic-calendar/msc-academic-calendar-2022-2023/)   \n[(links to an external site)](https://www.skoltech.ru/en/education/academic-calendar/msc-academic-calendar-2022-2023/)\n\n[Your updated term schedule can be found on the Skoltech website (links to an external site)](https://schedule.skoltech.ru/)![][image13]\n\n* **STE:** **Science, Technology and Engineering** (36 ECTS-credits)  \n  * Provide a solid foundation of scientific and engineering fundamentals  \n  * Core and recommended electives  \n* **Sector:** **Industrial Immersion** (12 ECTS-credits)  \n  * Orients students to how a sector works, provides knowledge and skills to make an impact in an industrial sector  \n  * Happens in the summer term between Year 1 and Year 2  \n* **Enterpreneurship and Innovation: Entrepreneurship and Innovation** (12 ECTS-credits)  \n  * Orients students in the process of, provide the skills for, and experience with innovation  \n  * Includes Innovation Workshop  \n* **MSc Thesis Project** (36 ECTS-credits)  \n* Early research, Thesis Project, Defense\n\n* **Options: elective coursework and short-term projects** (24 ECTS-credits)  \n* Follow your dreams and passions, choose courses to diversify your experience  \n* Additionally you can take 20 credits as an extracurricular activity. **ECTS credits** are based on the workload students need in order to achieve the learning outcomes. 1 ECTS equals 27 astronomical hours (36 academic hours). [The courses offered in 2022-2023 (links to an external site)](https://www.skoltech.ru/en/education/course-catalog/)\n\nIf you need to communicate any concerns or issues informally or outside of the formal evaluation period (or if you are unable to solve an issue directly with your research advisor or faculty, please talk to the [Education Department (links to an external site)](https://helpdesk.skoltech.ru/servicedesk/customer/portal/21) (email: education@skoltech.ru).",
    "context": "Sim: 6.40 - * STE: Science, Technology and Engineering (36 ECTS-credits)  \nSim: 6.14 - * **STE:** **Science, Technology and Engineering** (36 ECTS-credits)  ",
    "generated_answer": "36 ECTS-credits.",
    "logprobs": [
      [
        {
          "prob": 0.9999952316511552,
          "token": "3"
        },
        {
          "prob": 4.78509457496562e-06,
          "token": "The"
        },
        {
          "prob": 2.335584129235952e-09,
          "token": "Thirty"
        },
        {
          "prob": 7.582531502794546e-10,
          "token": "4"
        },
        {
          "prob": 2.1724316478941435e-10,
          "token": "There"
        }
      ],
      [
        {
          "prob": 1.0,
          "token": "6"
        },
        {
          "prob": 3.97896253583724e-12,
          "token": "5"
        },
        {
          "prob": 2.413362771833214e-12,
          "token": "2"
        },
        {
          "prob": 1.6586783589142312e-12,
          "token": "4"
        },
        {
          "prob": 1.2917800047859961e-12,
          "token": "8"
        }
      ],
      [
        {
          "prob": 0.9999551793156879,
          "token": " E"
        },
        {
          "prob": 2.429974205504413e-05,
          "token": ""
        },
        {
          "prob": 8.93937552781983e-06,
          "token": "李"
        },
        {
          "prob": 8.93937552781983e-06,
          "token": "ECT"
        },
        {
          "prob": 2.6994575036966624e-07,
          "token": "'E"
        }
      ],
      [
        {
          "prob": 0.9999998807907247,
          "token": "CTS"
        },
        {
          "prob": 1.2751905914873347e-07,
          "token": "CT"
        },
        {
          "prob": 2.061153622438558e-09,
          "token": "cts"
        },
        {
          "prob": 9.056076989672867e-11,
          "token": "TC"
        },
        {
          "prob": 7.05287985111216e-11,
          "token": "TS"
        }
      ],
      [
        {
          "prob": 0.9705705194114803,
          "token": "-"
        },
        {
          "prob": 0.029308689840108846,
          "token": " credits"
        },
        {
          "prob": 0.00011977794509464289,
          "token": "credits"
        },
        {
          "prob": 4.3198672128605526e-07,
          "token": " Credits"
        },
        {
          "prob": 4.3198672128605526e-07,
          "token": "-c"
        }
      ],
      [
        {
          "prob": 0.9999969005680498,
          "token": "credits"
        },
        {
          "prob": 1.7603412757721762e-06,
          "token": " credits"
        },
        {
          "prob": 8.315263400842229e-07,
          "token": "credit"
        },
        {
          "prob": 2.1024278372789506e-07,
          "token": "credentials"
        },
        {
          "prob": 8.764214786553686e-08,
          "token": "Credits"
        }
      ],
      [
        {
          "prob": 0.8139904641353883,
          "token": "."
        },
        {
          "prob": 0.1816258253282596,
          "token": " are"
        },
        {
          "prob": 0.004271429491763806,
          "token": ""
        },
        {
          "prob": 4.187562124708811e-05,
          "token": "|required"
        },
        {
          "prob": 2.105638471018678e-05,
          "token": ".are"
        }
      ],
      [
        {
          "prob": 0.9999979734461775,
          "token": ""
        },
        {
          "prob": 4.7378987873237787e-07,
          "token": ""
        },
        {
          "prob": 1.8553878237411744e-07,
          "token": "<tool_call>"
        },
        {
          "prob": 2.2159447507533765e-08,
          "token": " bụ"
        },
        {
          "prob": 1.26260725953192e-08,
          "token": "enen"
        }
      ]
    ],
    "language_consistency_score": 0.3399611039991405,
    "feedback": "Feedback: The response is fully correct, accurate, and factual. It matches the reference answer exactly in terms of content and specificity.",
    "score": 5
  },
  {
    "question": "What should you do if you are unsure about whether a certain action is appropriate during data manipulation?\n",
    "true_answer": "You should consult with your advisor or the Education Department. \n",
    "source_doc": "Always consult with your advisor or Education Department if you are unsure about whether a particular action (e.g., dropping a data point) could be questionable. 2. Make sure you understand why it is ok to manipulate data in certain ways (especially applies if you are following a protocol or methodology originally created by someone else). 3. Be vigilant about your collaborations. Beware of people who will not show you raw data or who refuse to explain how they convert raw data into a plot / figure / table. Now let’s talk about the education process itself.",
    "context": "Sim: 3.19 - 1. Always consult with your advisor or Education Department if you are unsure about whether a particular action (e.g., dropping a data point) could be questionable.  ",
    "generated_answer": "You should always consult with your advisor or Education Department.",
    "logprobs": [
      [
        {
          "prob": 0.5106275348903849,
          "token": "You"
        },
        {
          "prob": 0.3976771240304529,
          "token": "Always"
        },
        {
          "prob": 0.06910592206280358,
          "token": "If"
        },
        {
          "prob": 0.022435408106762998,
          "token": "Consult"
        },
        {
          "prob": 8.091467723618596e-05,
          "token": " Always"
        }
      ],
      [
        {
          "prob": 0.9999997615814777,
          "token": " should"
        },
        {
          "prob": 1.4449802461092448e-07,
          "token": "should"
        },
        {
          "prob": 8.764248219443636e-08,
          "token": "应该"
        },
        {
          "prob": 2.8453348089834e-08,
          "token": " Should"
        },
        {
          "prob": 2.9989608248573072e-09,
          "token": "应"
        }
      ],
      [
        {
          "prob": 0.904591591985148,
          "token": " always"
        },
        {
          "prob": 0.09534325376114217,
          "token": " consult"
        },
        {
          "prob": 3.198408320828581e-05,
          "token": " Always"
        },
        {
          "prob": 1.3332949523771491e-05,
          "token": "always"
        },
        {
          "prob": 9.163593262349345e-06,
          "token": "consult"
        }
      ],
      [
        {
          "prob": 0.9999797348316635,
          "token": " consult"
        },
        {
          "prob": 1.473890403393186e-05,
          "token": "consult"
        },
        {
          "prob": 4.785021560773912e-06,
          "token": "咨询"
        },
        {
          "prob": 3.4662579926611693e-07,
          "token": " consulted"
        },
        {
          "prob": 1.125328136620996e-07,
          "token": " Consult"
        }
      ],
      [
        {
          "prob": 0.9999991655356624,
          "token": " with"
        },
        {
          "prob": 8.315279260963632e-07,
          "token": " your"
        },
        {
          "prob": 7.194133030325383e-09,
          "token": "with"
        },
        {
          "prob": 8.592166619174109e-10,
          "token": " với"
        },
        {
          "prob": 4.058652126475693e-10,
          "token": "_with"
        }
      ],
      [
        {
          "prob": 1.0,
          "token": " your"
        },
        {
          "prob": 8.152020714470167e-09,
          "token": "your"
        },
        {
          "prob": 3.398267819495071e-09,
          "token": "你的"
        },
        {
          "prob": 9.056076989672867e-11,
          "token": "您的"
        },
        {
          "prob": 9.056076989672867e-11,
          "token": " an"
        }
      ],
      [
        {
          "prob": 0.9999240694467058,
          "token": " advisor"
        },
        {
          "prob": 7.484611936412656e-05,
          "token": "advisor"
        },
        {
          "prob": 3.466062962955991e-07,
          "token": "顾问"
        },
        {
          "prob": 3.466062962955991e-07,
          "token": " advisors"
        },
        {
          "prob": 2.3821879140541234e-07,
          "token": " adviser"
        }
      ],
      [
        {
          "prob": 0.9999985694905718,
          "token": " or"
        },
        {
          "prob": 1.3709577789362383e-06,
          "token": "或"
        },
        {
          "prob": 7.582545965339434e-10,
          "token": "或者"
        },
        {
          "prob": 2.1724357914826287e-10,
          "token": " или"
        },
        {
          "prob": 4.847359460656998e-11,
          "token": "或是"
        }
      ],
      [
        {
          "prob": 0.9947718965589782,
          "token": " Education"
        },
        {
          "prob": 0.0052200835530716375,
          "token": " the"
        },
        {
          "prob": 7.848081946561722e-06,
          "token": "Education"
        },
        {
          "prob": 9.879277187359726e-08,
          "token": " Educational"
        },
        {
          "prob": 3.634382970863674e-08,
          "token": " Ed"
        }
      ],
      [
        {
          "prob": 0.9999957084838798,
          "token": " Department"
        },
        {
          "prob": 4.2228351681890325e-06,
          "token": "Department"
        },
        {
          "prob": 5.315764976351624e-08,
          "token": "_department"
        },
        {
          "prob": 5.602775064605783e-09,
          "token": " Depart"
        },
        {
          "prob": 5.602775064605783e-09,
          "token": " Division"
        }
      ],
      [
        {
          "prob": 0.999663823633758,
          "token": "."
        },
        {
          "prob": 0.00033534971441097653,
          "token": " if"
        },
        {
          "prob": 6.473772432674506e-07,
          "token": " for"
        },
        {
          "prob": 6.823312451153405e-08,
          "token": " when"
        },
        {
          "prob": 6.823312451153405e-08,
          "token": " in"
        }
      ],
      [
        {
          "prob": 0.9999982118638471,
          "token": ""
        },
        {
          "prob": 3.466320801173418e-07,
          "token": ""
        },
        {
          "prob": 2.2380249174039673e-07,
          "token": "<tool_call>"
        },
        {
          "prob": 2.2159447507533765e-08,
          "token": " bụ"
        },
        {
          "prob": 7.19411930861867e-09,
          "token": "🤖"
        }
      ]
    ],
    "language_consistency_score": 0.7961728278294805,
    "feedback": "Feedback: The response is completely correct, accurate, and factual. It matches the reference answer in terms of the advice given, which is to consult with your advisor or the Education Department.",
    "score": 5
  },
  {
    "question": "What is the name of the carsharing service that has parking options around the Skolkovo territory?\n",
    "true_answer": "BelkaCar and DeliMobil are carsharing services that have parking options around the Skolkovo territory. \n",
    "source_doc": "your car’s model and license number (i.e. Toyota, Х111СК197)   \n2. How long you need the pass for (1 day or the whole month). If you ask for a monthly pass, you’ll need to *renew it every month* via email. Next, you’ll need to find a parking spot because you can park only in designated parking lots. Wait, let us stress that again: if you park your car anywhere *besides* a parking lot, it will be towed and your access to the Skolkovo Innovation Center territory will be restricted… *forever*\\! A current list of all Skolkovo parking lots is published on [sta-parking.ru (links to an external site).](https://www.sta-parking.ru/) (RUS). ![][image9]\n\n \n\nIn terms of parking prices, parking is free for 2 hours and then 50 RUB per hour. Spaces are pretty limited, though. To secure a spot and entry in the long-term, you can email Clients@sta-parking.ru. Monthly parking plans start at 5000 RUB/month. Finally, you can also park outside of the Skolkovo territory. You can try the [Tri Kita Mall parking lot (links to an external site)](https://yandex.ru/maps/org/tri\\_kita/1112120378/?indoorLevel=1\\&ll=37.355723%2C55.702835\\&z=17.03) or near the [“Innovatsya” apartments (links to an external site)](https://yandex.ru/maps/213/moscow/?indoorLevel=1\\&ll=37.355723%2C55.702835\\&mode=poi\\&poi%5Bpoint%5D=37.357476%2C55.700718\\&poi%5Buri%5D=ymapsbm1%3A%2F%2Forg%3Foid%3D191529528774\\&z=17.03), but spaces there are not guaranteed. **Carsharing is another option.** \n\nA great option for transportation without the upkeep fees, are we right? Carsharing services [BelkaCar (links to an external site)](https://belkacar.ru/) and [DeliMobil (links to an external site)](https://delimobil.ru/) have access to the Skolkovo territory with some parking options around the territory. If you choose to use a different car sharing service, you may need to search for a different parking option outside of the Skolkovo Innovation Center Territory (for example, there is an “external” parking lot just behind the Skoltech campus that’s not part of the Skolkovo infrastructure). In that case, we suggest looking for an “end destination” spot ahead of time. *Phew, we’re almost there:)*\n\nAre you up for a scooter or a bike ride? The Skolkovo territory has lots of electric scooter and bike stations where you can rent one from March to November (watch out for puddles\\!). For instance, there is a bike/scooter stop right outside of the MCD Skolkovo station so you can start your day with a breeze. To rent one of these sweet rides, scan a QR code on the vehicle and follow the instructions. [*Virtual campus tour (links to an external site).*](https://360.skoltech.ru/)\n\n[*This brochure that shows how Skoltech navigation works (links to an external site).*](https://box.skoltech.ru/index.php/s/Od9t3Fm1ONOCuY5\\#pdfviewer) \n\n*You can also save [this handout (links to an external site)](https://box.skoltech.ru/index.php/s/mjp6yaRe3tgF2x2) with a map to your smartphone and glance at them as you explore the campus:*\n\n *![][image4]*\n\n[Full equipment catalog on FabLab’s website (links to an external site).](https://fablab.skoltech.ru/en)\n\n[Video tour (links to an external site).](https://box.skoltech.ru/index.php/s/xwVtNw081ffzffQ)\n\n[Skoltech’s virtual tour (links to an external site).](https://360.skoltech.ru/)\n\nFor more information about campus rules, see [this official document (links to an external site).](https://drive.google.com/file/d/1UeumlluoILU0lGHeXphZKpHAOtq9KhC9/view?usp=sharing)\n\nHighlights: \n\n* There are enough ways to get around Skoltech using the developed transport system. Choose a favourite bus route or just rent a bicycle — the choice is yours\\!",
    "context": "Sim: 7.71 - Carsharing services [BelkaCar (links to an external site)](https://belkacar.ru/) and [DeliMobil (links to an external site)](https://delimobil.ru/) have access to the Skolkovo territory with some parking options around the territory.\nSim: 1.26 - If you choose to use a different car sharing service, you may need to search for a different parking option outside of the Skolkovo Innovation Center Territory (for example, there is an “external” parking lot just behind the Skoltech campus that’s not part of the Skolkovo infrastructure). In that case, we suggest looking for an “end destination” spot ahead of time. *Phew, we’re almost there:)*\nSim: 0.85 - Finally, if you are in a huge rush, feel free to catch a taxi. Watch out if you’re traveling to the campus, as not all services have automatic access to the Skolkovo Territory. Here’s a quick list of apps you can use: яндекс такси, ситимобил, убер. \nSim: 0.71 - Finally, you can also park outside of the Skolkovo territory. You can try the [Tri Kita Mall parking lot (links to an external site)](https://yandex.ru/maps/org/tri\\_kita/1112120378/?indoorLevel=1\\&ll=37.355723%2C55.702835\\&z=17.03) or near the [“Innovatsya” apartments (links to an external site)](https://yandex.ru/maps/213/moscow/?indoorLevel=1\\&ll=37.355723%2C55.702835\\&mode=poi\\&poi%5Bpoint%5D=37.357476%2C55.700718\\&poi%5Buri%5D=ymapsbm1%3A%2F%2Forg%3Foid%3D191529528774\\&z=17.03), but spaces there are not guaranteed.   \nSim: 0.67 - * By taxi: If you don't want to worry about taking public transport on your first day, you can always order a taxi directly from the airport or the railway station directly to the Skoltech dormitories or your planned accommodation. We recommend using the [Uber App](https://support-uber.com/) or [Yandex Taxi](https://taxi.yandex.ru/ru\\_ru/) (which have open access to the Skolkovo territory). You’ll see the price in advance, would be able to choose the type of the vehicle (considering your bags) and can pay by credit card if you don't have cash on you yet.\nSim: 0.65 - Oh, almost forgot\\! When it gets warmer, you can rent electric scooters and bikes all around the city (and even in the Skolkovo Territory). If you see a little parking lot with scooters or bikes, look for a QR code to download its app and reserve yourself a machine. The system will tell you how long you have rented it for, its charge (if it’s electric) and the nearest parking location. Just watch out for those puddles\\!",
    "generated_answer": "BelkaCar and DeliMobil.",
    "logprobs": [
      [
        {
          "prob": 0.9997865417361715,
          "token": "Bel"
        },
        {
          "prob": 0.00017952185132445825,
          "token": "Car"
        },
        {
          "prob": 2.429564059615663e-05,
          "token": "The"
        },
        {
          "prob": 2.56074167906866e-06,
          "token": "bel"
        },
        {
          "prob": 2.2598466000973686e-06,
          "token": " Bel"
        }
      ],
      [
        {
          "prob": 0.9999823573372132,
          "token": "ka"
        },
        {
          "prob": 6.962185208632192e-06,
          "token": "ca"
        },
        {
          "prob": 4.222778787633222e-06,
          "token": "k"
        },
        {
          "prob": 3.288703426546071e-06,
          "token": "ка"
        },
        {
          "prob": 1.3709355525136263e-06,
          "token": "kar"
        }
      ],
      [
        {
          "prob": 0.9999992847447459,
          "token": "Car"
        },
        {
          "prob": 7.33820819192633e-07,
          "token": " Car"
        },
        {
          "prob": 1.186112015134383e-08,
          "token": "CAR"
        },
        {
          "prob": 8.152020714470167e-09,
          "token": "_car"
        },
        {
          "prob": 6.34880011604368e-09,
          "token": "-car"
        }
      ],
      [
        {
          "prob": 0.9998233630346849,
          "token": " and"
        },
        {
          "prob": 7.483862496308113e-05,
          "token": ""
        },
        {
          "prob": 6.604485472360928e-05,
          "token": "和"
        },
        {
          "prob": 2.7531591529457437e-05,
          "token": "."
        },
        {
          "prob": 4.784273229540691e-06,
          "token": " has"
        }
      ],
      [
        {
          "prob": 0.9999785427891018,
          "token": " Del"
        },
        {
          "prob": 1.8925109345290664e-05,
          "token": "Del"
        },
        {
          "prob": 1.0676816089481587e-06,
          "token": " DEL"
        },
        {
          "prob": 7.338061229923647e-07,
          "token": "_del"
        },
        {
          "prob": 3.058959024830531e-07,
          "token": " Dil"
        }
      ],
      [
        {
          "prob": 0.9239780234151582,
          "token": "i"
        },
        {
          "prob": 0.07584473478054599,
          "token": "im"
        },
        {
          "prob": 7.837016666768848e-05,
          "token": "IM"
        },
        {
          "prob": 1.981508126340897e-05,
          "token": "iT"
        },
        {
          "prob": 1.2018454310954883e-05,
          "token": "imi"
        }
      ],
      [
        {
          "prob": 1.0,
          "token": "M"
        },
        {
          "prob": 8.592166619174109e-10,
          "token": "Mob"
        },
        {
          "prob": 4.058652126475693e-10,
          "token": " Mobil"
        },
        {
          "prob": 7.991959892953932e-11,
          "token": " mobil"
        },
        {
          "prob": 7.05287985111216e-11,
          "token": "Mobile"
        }
      ],
      [
        {
          "prob": 0.9999997615814777,
          "token": "obil"
        },
        {
          "prob": 4.691164021834418e-08,
          "token": "obl"
        },
        {
          "prob": 3.6534822137210456e-08,
          "token": " mobil"
        },
        {
          "prob": 3.2241867372567335e-08,
          "token": "ibil"
        },
        {
          "prob": 1.186112015134383e-08,
          "token": "oble"
        }
      ],
      [
        {
          "prob": 0.7499736821285191,
          "token": "."
        },
        {
          "prob": 0.24348082086943781,
          "token": " have"
        },
        {
          "prob": 0.005726118700806669,
          "token": " are"
        },
        {
          "prob": 0.0006838873530849128,
          "token": ""
        },
        {
          "prob": 5.61369192050395e-05,
          "token": " both"
        }
      ],
      [
        {
          "prob": 0.9999980926550052,
          "token": ""
        },
        {
          "prob": 3.9278560536830205e-07,
          "token": ""
        },
        {
          "prob": 2.873680877127177e-07,
          "token": "<tool_call>"
        },
        {
          "prob": 1.3440384315611926e-08,
          "token": " bụ"
        },
        {
          "prob": 1.0467381829779195e-08,
          "token": "orado"
        }
      ]
    ],
    "language_consistency_score": 0.32540703792311365,
    "feedback": "Feedback: The response is completely correct, accurate, and factual. It provides the names of the carsharing services, BelkaCar and DeliMobil, which have parking options around the Skolkovo territory, matching the reference answer.",
    "score": 5
  },
  {
    "question": "What is the name of the internal committee at Skoltech responsible for addressing student misconduct?\n",
    "true_answer": "Skoltech Disciplinary Board (DB) \n",
    "source_doc": "\n### Video 4 \n\nIn this module, we’re going to talk about Academic Integrity. This includes Academic Misconduct and Disciplinary Measures. On top of that, we’ll discuss the Education Process, which covers Academic Structure, the Grading System, and Course Registration. *Text Overlay:* \n\n- *Academic Integrity : Academic Misconduct , Disciplinary Measures*  \n- *Education Process : Academic structure, grading system, course registration* \n\n\nLet’s start with Academic Integrity. It relies on our community’s personal values and policies on ethics, conflict of interest, and others. We expect everyone to: \n\n- Follow professional courtesy  \n- Be committed to honesty without compromising their values  \n- Promote the truth without compromise\n\n*Text Overlay:* \n\n- *Follow professional courtesy*  \n- *Be committed to honesty without compromising their values*  \n- *Promote the truth without compromise*\n\nThis is very important because it leads to the respectful culture that you develop in terms of how you conduct your academic studies, publish in top journals recognized in the most prominent fields, and other achievements. If, at any stage or time, the integrity of your studies is compromised, you will enter the realms of academic misconduct. *Text Overlay: academic misconduct.*\n\nFormal definitions of academic misconduct say that it is the intent of the individual participating in this to cheat the system in some way to gain something in return. ​​What’s considered academic misconduct? * Deliberate interference with the integrity of others’ work  \n* Fabrication or falsification of data  \n* Unauthorized collaboration  \n* Plagiarism  \n* Cheating\n\n*Text Overlay:* \n\n* *Deliberate interference with the integrity of others’ work*  \n* *Fabrication or falsification of data*  \n* *Unauthorized collaboration*  \n* *Plagiarism*  \n* *Cheating*\n\nResearch Misconduct includes such offenses as:\n\n* Substitution of data  \n* Unrealistic precision of data  \n* Results that contradict known physics\n\n*Text Overlay: Research Misconduct includes such offenses as:*\n\n* *Substitution of data*  \n* *Unrealistic precision of data*  \n* *Results that contradict known physics*\n\nYou can learn more about disciplinary actions by clicking the link below. Discipline is an important part of any academic organization, and in this case Skoltech is no exception. Students who cheat, plagiarize or participate in any other form of academic or research misconduct (including failing classes and violating full time status) are subject to an evaluation by the Skoltech Disciplinary Board (DB). *Text Overlays: Disciplinary Measures at Skoltech*\n\nIf a faculty member witnesses a student’s academic misconduct, the student’s name will be submitted to the Disciplinary Board. Both the student and the witness will be given a chance to explain their positions in writing. Then the Disciplinary Board will make a decision regarding the student’s status at Skoltech. Each case of academic and research misconduct is taken seriously and reviewed on an individual basis. For more information about this, please see the Disciplinary Board Policy via the link below. The DBP Skoltech Disciplinary Board is an internal committee formed in order to address the issues related to student misconduct and the other disputes between students and Skoltech. The Disciplinary Board reviews individual cases related to the following:\n\n- academic misconduct  \n- full-time student status violation  \n- poor academic performance  \n- violation of the attendance regulations  \n- violation (by the students) of other policies  \n- and regulations governing educational  \n- processes  \n- other academic-related issues /conflicts\n\n*Text Overlay:*\n\n- *academic misconduct*  \n- *full-time student status violation*  \n- *poor academic performance*  \n- *violation of the attendance regulations*  \n- *violation (by the students) of other policies*  \n- *and regulations governing educational*\n\nNow this lesson wouldn’t make sense without some actual advice on how to avoid academic and research misconduct. 1.",
    "context": "Sim: 7.75 - The DBP Skoltech Disciplinary Board is an internal committee formed in order to address the issues related to student misconduct and the other disputes between students and Skoltech. The Disciplinary Board reviews individual cases related to the following:\nSim: 4.28 - Discipline is an important part of any academic organization, and in this case Skoltech is no exception. Students who cheat, plagiarize or participate in any other form of academic or research misconduct (including failing classes and violating full time status) are subject to an evaluation by the Skoltech Disciplinary Board (DB).\nSim: 4.12 - If a faculty member witnesses a student’s academic misconduct, the student’s name will be submitted to the Disciplinary Board. Both the student and the witness will be given a chance to explain their positions in writing. Then the Disciplinary Board will make a decision regarding the student’s status at Skoltech. Each case of academic and research misconduct is taken seriously and reviewed on an individual basis. For more information about this, please see the Disciplinary Board Policy via the link below. ",
    "generated_answer": "The DBP Skoltech Disciplinary Board.",
    "logprobs": [
      [
        {
          "prob": 0.9992903742048809,
          "token": "The"
        },
        {
          "prob": 0.00070967033651176,
          "token": "DB"
        },
        {
          "prob": 9.230897704904775e-09,
          "token": "Db"
        },
        {
          "prob": 5.598822474695727e-09,
          "token": "It"
        },
        {
          "prob": 2.9968337158298627e-09,
          "token": " The"
        }
      ],
      [
        {
          "prob": 0.997205222222544,
          "token": " DB"
        },
        {
          "prob": 0.0016988587833085475,
          "token": " name"
        },
        {
          "prob": 0.0010304099385987351,
          "token": " internal"
        },
        {
          "prob": 2.4232907508317494e-05,
          "token": "DB"
        },
        {
          "prob": 1.887260734357459e-05,
          "token": " Disc"
        }
      ],
      [
        {
          "prob": 0.9999997615814777,
          "token": "P"
        },
        {
          "prob": 2.699578503363014e-07,
          "token": "S"
        },
        {
          "prob": 4.691164021834418e-08,
          "token": " Sk"
        },
        {
          "prob": 3.850741922767617e-09,
          "token": "D"
        },
        {
          "prob": 1.9362746373840963e-09,
          "token": "Sk"
        }
      ],
      [
        {
          "prob": 0.9999988079084972,
          "token": " Sk"
        },
        {
          "prob": 9.422445831379603e-07,
          "token": " ("
        },
        {
          "prob": 8.76423150298272e-08,
          "token": " Disc"
        },
        {
          "prob": 4.691155074157667e-08,
          "token": "Sk"
        },
        {
          "prob": 2.5109943663977427e-08,
          "token": "_sk"
        }
      ],
      [
        {
          "prob": 0.9999998807907247,
          "token": "ol"
        },
        {
          "prob": 4.691164021834418e-08,
          "token": "olk"
        },
        {
          "prob": 1.522997974471263e-08,
          "token": "olt"
        },
        {
          "prob": 8.152020714470167e-09,
          "token": "ол"
        },
        {
          "prob": 7.194133030325383e-09,
          "token": "col"
        }
      ],
      [
        {
          "prob": 0.9997574679353942,
          "token": "tech"
        },
        {
          "prob": 0.00013980775840064373,
          "token": "Tech"
        },
        {
          "prob": 8.479769193568691e-05,
          "token": " tech"
        },
        {
          "prob": 6.960618425850654e-06,
          "token": "otech"
        },
        {
          "prob": 3.7257505619964264e-06,
          "token": "itech"
        }
      ],
      [
        {
          "prob": 0.9999980926550052,
          "token": " Disc"
        },
        {
          "prob": 1.553497204890439e-06,
          "token": "Disc"
        },
        {
          "prob": 3.0590173704000945e-07,
          "token": "_disc"
        },
        {
          "prob": 4.139929822488149e-08,
          "token": " Discipline"
        },
        {
          "prob": 9.237432042950414e-09,
          "token": " Discrim"
        }
      ],
      [
        {
          "prob": 0.9999994039539004,
          "token": "iplinary"
        },
        {
          "prob": 6.47594599989589e-07,
          "token": "ipl"
        },
        {
          "prob": 1.3440409951135022e-08,
          "token": "our"
        },
        {
          "prob": 5.602796437537268e-09,
          "token": "pl"
        },
        {
          "prob": 8.592166619174109e-10,
          "token": "ip"
        }
      ],
      [
        {
          "prob": 0.9999982118638471,
          "token": " Board"
        },
        {
          "prob": 1.7603429545652396e-06,
          "token": "Board"
        },
        {
          "prob": 2.2159447507533765e-08,
          "token": "_board"
        },
        {
          "prob": 1.955564378838448e-08,
          "token": " Committee"
        },
        {
          "prob": 7.582545965339434e-10,
          "token": " Boards"
        }
      ],
      [
        {
          "prob": 0.9999088132058339,
          "token": "."
        },
        {
          "prob": 7.484497731169222e-05,
          "token": " is"
        },
        {
          "prob": 1.4737849863065211e-05,
          "token": ""
        },
        {
          "prob": 1.06760626328772e-06,
          "token": "。"
        },
        {
          "prob": 2.2378242977893918e-07,
          "token": ".\n\n"
        }
      ],
      [
        {
          "prob": 0.9999983310727032,
          "token": ""
        },
        {
          "prob": 5.714996835964923e-07,
          "token": ""
        },
        {
          "prob": 2.2380249174039673e-07,
          "token": "<tool_call>"
        },
        {
          "prob": 7.658100140818556e-09,
          "token": "/WebAPI"
        },
        {
          "prob": 7.19411930861867e-09,
          "token": "ienie"
        }
      ]
    ],
    "language_consistency_score": 0.7067982537594868,
    "feedback": "Feedback: The response is mostly correct, accurate, and factual. The answer provided, \"The DBP Skoltech Disciplinary Board,\" is very close to the reference answer, \"Skoltech Disciplinary Board (DB).\" However, the inclusion of \"DBP\" is not necessary and slightly deviates from the reference answer.",
    "score": 4
  },
  {
    "question": "What is the name of the Skolkovo train station that can be used to reach the Skoltech campus?\n",
    "true_answer": "The Skolkovo train station is called \"MCD Skolkovo\" (Сколково). \n",
    "source_doc": "\n### Text After Video 3\n\n**Topic 1  “ Location & Transportation  — Premises Location, Public Transport & Carsharing, Personal Cars & Parking”**\n\nBy now you’ve probably heard that our campus and its premises are pretty cool. In fact, you may have visited it during an Open Doors event or perhaps a conference or a summer school. ![][image7]The campus is located within the Skolkovo Innovation Center territory a few minutes away from the center of Moscow. The campus is part of the Skolkovo Innovation Center, which is a closed territory. This means you may need a car pass if you decide to drive here. So, you can reach the campus in multiple ways. **First, you can use public transportation.** \n\nThis is the safest and surest way to reach the campus if you need to be there by a certain time (or just want your arrival time to be predictable). No matter where you are traveling from, you can use Moscow’s MCD-1(Moscow Central Diameter \\#1) metro line to get to the Skolkovo Train station. It’s about a 20 minute ride from the city center. You’ll need to exit the train at the “MCD Skolkovo” (Сколково) station. Once you arrive, take the stairs, escalator or an elevator to the second floor and walk down the looooong hall of the Orbion building. Then, once again, go down to the 1st floor and exit. Once you exit the building, you can take the Sk1 bus shuttle from the nearest bus stop (look to your left). Or, you can take a walk towards the Amaltea business center, walk down the stairs, cross the road and catch any shuttle bus that goes towards Skoltech (the wooden building that looks like a crown, you’ll know it when you see it). This way will take about 10 minutes if you are a fast walker. Remember that the shuttle buses at Skolkovo have paid fares (same as within the Moscow public transportation system, we’ll talk about that in the next modules) and can be tracked via [Yandex maps](https://yandex.ru/maps/213/moscow/?ll=37.622504%2C55.753215\\&z=10) \n\n[(links to an external site)](https://yandex.ru/maps/213/moscow/?ll=37.622504%2C55.753215\\&z=10)\n\nBy the way, the Skolkovo Innovation Center website also has some tips on how to reach other buildings on the territory. Visit [https://sk.ru/transport/](https://sk.ru/transport/) \n\n[(links to an external site)](https://sk.ru/transport/)\n\nfor more information. ![][image8]\n\n \n\nThe next best thing is to take a taxi\n\nCurrently, only taxi services [Yandex (links to an external site)](https://taxi.yandex.ru/ru\\_ru/) , [Citi Mobil](https://city-mobil.ru/) \n\n[(links to an external site)](https://city-mobil.ru/) , and [Uber  (links to an external site)](https://support-uber.com/) have automatic access to the Skolkovo Innovation Center. All you need to do is download a relevant app to your smartphone, order a taxi to Skoltech (just type “Сколтех” in the destination, it will be there) and relax. Don’t forget to buckle up\\! If you take a different taxi service, you’ll need to order a territory pass ahead of time. To order a pass for your taxi, email security.campus@skoltech.ru from your Skoltech email address with your taxi’s model and license number (i.e. Toyota, Х111СК197).",
    "context": "Sim: 4.41 - This is the safest and surest way to reach the campus if you need to be there by a certain time (or just want your arrival time to be predictable). No matter where you are traveling from, you can use Moscow’s MCD-1(Moscow Central Diameter \\#1) metro line to get to the Skolkovo Train station. It’s about a 20 minute ride from the city center. You’ll need to exit the train at the “MCD Skolkovo” (Сколково) station.\nSim: 2.24 - The buses, metro, trains and other city-sponsored modes of transfer are integrated by one system. You can buy yourself single- or double-ride tickets or get a permanent Troika card and top off its balance every once in a while. If you’re planning to explore the city center, we recommend using the underground metro. Yandex Metro app (links to an external site)has the current map and allows you to plan your route to point A to point B. The metro is designed in a sun-like way, with multi-colored lines stemming away from the center outwards. There are also several circle lines which connect them. You will notice on the map (and have already seen it mentioned in this course) the MCD lines. These are newer extensions of the metro line that take you a little bit outside of the city for a few extra rubles. One of these lines, MCD 1, takes you almost directly to Skoltech and is the best way to get to campus from the city center. If you use the metro app to plan your route, select the stop called “Skolkovo” and it will calculate your route for you. Easy, huh\\! If you live or end up far away from a metro station, you can take the bus, a tramway or a small overground shuttle (aka marshrutka). The Yandex Transport app shows you the nearest stops, when the next bus, tram or shuttle will arrive there and where it can take you. You can also plan your route there.\nSim: 2.02 - → From there, take an SK1 shuttle and exit at the Technopark stop. The Skoltech dorms will be on your right\\! [Here](https://old.sk.ru/city/transport/p/inner.aspx) you will find the exact map of bus routes around Skolkovo. ",
    "generated_answer": "MCD Skolkovo station.",
    "logprobs": [
      [
        {
          "prob": 0.9859072960340005,
          "token": "M"
        },
        {
          "prob": 0.014063210750823752,
          "token": "The"
        },
        {
          "prob": 1.6466334722789265e-05,
          "token": "\"M"
        },
        {
          "prob": 1.1317135315956577e-05,
          "token": "Sk"
        },
        {
          "prob": 1.0526575607416617e-06,
          "token": "You"
        }
      ],
      [
        {
          "prob": 0.9999976158197796,
          "token": "CD"
        },
        {
          "prob": 1.553497204890439e-06,
          "token": "PC"
        },
        {
          "prob": 3.0590173704000945e-07,
          "token": "cd"
        },
        {
          "prob": 1.6373740075447596e-07,
          "token": "DC"
        },
        {
          "prob": 5.658613155173702e-08,
          "token": " CD"
        }
      ],
      [
        {
          "prob": 0.9999998807907247,
          "token": " Sk"
        },
        {
          "prob": 4.691164021834418e-08,
          "token": "Sk"
        },
        {
          "prob": 1.522997974471263e-08,
          "token": "-S"
        },
        {
          "prob": 1.186112015134383e-08,
          "token": "-"
        },
        {
          "prob": 3.850741922767617e-09,
          "token": " "
        }
      ],
      [
        {
          "prob": 0.9999113161575117,
          "token": "olk"
        },
        {
          "prob": 8.481071290561461e-05,
          "token": "ol"
        },
        {
          "prob": 1.2097598468746687e-06,
          "token": "olt"
        },
        {
          "prob": 5.714500885126851e-07,
          "token": "оль"
        },
        {
          "prob": 3.466019991784416e-07,
          "token": "olg"
        }
      ],
      [
        {
          "prob": 0.9999839070045525,
          "token": "ovo"
        },
        {
          "prob": 1.4738960258496015e-05,
          "token": "ово"
        },
        {
          "prob": 1.0676867000629394e-06,
          "token": "owo"
        },
        {
          "prob": 4.691092440898271e-08,
          "token": "avo"
        },
        {
          "prob": 4.691092440898271e-08,
          "token": "ogo"
        }
      ],
      [
        {
          "prob": 0.7644070884020625,
          "token": " station"
        },
        {
          "prob": 0.11722562020433083,
          "token": "."
        },
        {
          "prob": 0.10345124673388012,
          "token": " ("
        },
        {
          "prob": 0.009622464873158178,
          "token": ""
        },
        {
          "prob": 0.002432940129174685,
          "token": "站"
        }
      ],
      [
        {
          "prob": 0.9974876738142887,
          "token": "."
        },
        {
          "prob": 0.002472525166365199,
          "token": ""
        },
        {
          "prob": 1.8877953601988802e-05,
          "token": " can"
        },
        {
          "prob": 1.4702165048014526e-05,
          "token": " ("
        },
        {
          "prob": 3.957034041086936e-06,
          "token": "。"
        }
      ],
      [
        {
          "prob": 0.9999982118638471,
          "token": ""
        },
        {
          "prob": 3.9278560536830205e-07,
          "token": ""
        },
        {
          "prob": 1.742975558207526e-07,
          "token": "<tool_call>"
        },
        {
          "prob": 1.0467381829779195e-08,
          "token": "eker"
        },
        {
          "prob": 7.658100140818556e-09,
          "token": "uxe"
        }
      ]
    ],
    "language_consistency_score": 0.38897060379877835,
    "feedback": "Feedback: The response is completely correct, accurate, and factual. It matches the reference answer by providing the correct name of the train station, \"MCD Skolkovo.\"",
    "score": 5
  },
  {
    "question": "What is the email address for the Skoltech Education Department?\n",
    "true_answer": "education@skoltech.ru \n",
    "source_doc": "\n### Text After Video 4\n\n[Learn more about what’s considered academic misconduct (links to an external site)](https://www.skoltech.ru/app/data/uploads/sites/2/2015/04/1.-STUDENT-ACADEMIC-INTEGRITY-REGULATIONS.pdf)  \n[Disciplinary Board Policy (links to an external site).](http://www.skoltech.ru/app/data/uploads/sites/2/2015/04/DISCIPLINARY-BOARD-POLICY.pdf)\n\nSave these links\\! 1) [Course timetable (links to an external site)](https://schedule.skoltech.ru/)  \n2) [Course catalog (links to an external site)](https://www.skoltech.ru/en/education/course-catalog/)  \n3) [Education resources for students (Canvas)](https://skoltech.instructure.com/courses/2072)\n\n![][image12]  \n[View the 2022-2023 academic calendar with key dates, breaks and holidays](https://www.skoltech.ru/en/education/academic-calendar/msc-academic-calendar-2022-2023/)   \n[(links to an external site)](https://www.skoltech.ru/en/education/academic-calendar/msc-academic-calendar-2022-2023/)\n\n[Your updated term schedule can be found on the Skoltech website (links to an external site)](https://schedule.skoltech.ru/)![][image13]\n\n* **STE:** **Science, Technology and Engineering** (36 ECTS-credits)  \n  * Provide a solid foundation of scientific and engineering fundamentals  \n  * Core and recommended electives  \n* **Sector:** **Industrial Immersion** (12 ECTS-credits)  \n  * Orients students to how a sector works, provides knowledge and skills to make an impact in an industrial sector  \n  * Happens in the summer term between Year 1 and Year 2  \n* **Enterpreneurship and Innovation: Entrepreneurship and Innovation** (12 ECTS-credits)  \n  * Orients students in the process of, provide the skills for, and experience with innovation  \n  * Includes Innovation Workshop  \n* **MSc Thesis Project** (36 ECTS-credits)  \n* Early research, Thesis Project, Defense\n\n* **Options: elective coursework and short-term projects** (24 ECTS-credits)  \n* Follow your dreams and passions, choose courses to diversify your experience  \n* Additionally you can take 20 credits as an extracurricular activity. **ECTS credits** are based on the workload students need in order to achieve the learning outcomes. 1 ECTS equals 27 astronomical hours (36 academic hours). [The courses offered in 2022-2023 (links to an external site)](https://www.skoltech.ru/en/education/course-catalog/)\n\nIf you need to communicate any concerns or issues informally or outside of the formal evaluation period (or if you are unable to solve an issue directly with your research advisor or faculty, please talk to the [Education Department (links to an external site)](https://helpdesk.skoltech.ru/servicedesk/customer/portal/21) (email: education@skoltech.ru).",
    "context": "Sim: 6.19 - Until then, if you have urgent questions or need assistance, feel free to reach out to the Education Department via [education@skoltech.ru](mailto:education@skoltech.ru). For more details on the Education Department, as well as for all the relevant links, see the description below.\nSim: 4.71 - * Email us at education@skoltech.ru \nSim: 4.68 - *Text Overlay: education@skoltech.ru.*  \nSim: 3.37 - If you have any questions or technical problems when dealing with this course, please email us at education@skoltech.ru\nSim: 1.75 - *Text Overlay:  [Scholarships@skoltech.ru](mailto:Scholarships@skoltech.ru).* \nSim: 0.97 - To reach the library or ask questions, email the team at [Library@skoltech.ru](mailto:Library@skoltech.ru) ",
    "generated_answer": "education@skoltech.ru",
    "logprobs": [
      [
        {
          "prob": 0.9982656569901288,
          "token": "education"
        },
        {
          "prob": 0.0013244795525219212,
          "token": "The"
        },
        {
          "prob": 0.00023016003486121518,
          "token": " education"
        },
        {
          "prob": 0.00013959911778385555,
          "token": "教育"
        },
        {
          "prob": 1.8892686144859346e-05,
          "token": "educ"
        }
      ],
      [
        {
          "prob": 1.0,
          "token": "@"
        },
        {
          "prob": 5.211412487888539e-10,
          "token": "@s"
        },
        {
          "prob": 1.917171513758312e-10,
          "token": "@example"
        },
        {
          "prob": 7.05287985111216e-11,
          "token": "@gmail"
        },
        {
          "prob": 4.8473687062702556e-11,
          "token": "@mail"
        }
      ],
      [
        {
          "prob": 0.9999997615814777,
          "token": "sk"
        },
        {
          "prob": 6.82560337633487e-08,
          "token": "sky"
        },
        {
          "prob": 5.3157852544244216e-08,
          "token": "sku"
        },
        {
          "prob": 3.6534822137210456e-08,
          "token": "ski"
        },
        {
          "prob": 6.758262544305561e-09,
          "token": "sc"
        }
      ],
      [
        {
          "prob": 1.0,
          "token": "ol"
        },
        {
          "prob": 5.3157852544244216e-08,
          "token": "ол"
        },
        {
          "prob": 3.2241867372567335e-08,
          "token": "olk"
        },
        {
          "prob": 3.581747930283181e-10,
          "token": "ole"
        },
        {
          "prob": 3.1608814543136926e-10,
          "token": "ols"
        }
      ],
      [
        {
          "prob": 0.9999977350285647,
          "token": "tech"
        },
        {
          "prob": 9.422436845439301e-07,
          "token": " tech"
        },
        {
          "prob": 5.714996835964923e-07,
          "token": "Tech"
        },
        {
          "prob": 3.0590173704000945e-07,
          "token": "techn"
        },
        {
          "prob": 1.6373740075447596e-07,
          "token": "itech"
        }
      ],
      [
        {
          "prob": 0.9999996423722521,
          "token": ".ru"
        },
        {
          "prob": 1.2751905914873347e-07,
          "token": ".rs"
        },
        {
          "prob": 7.734421907141565e-08,
          "token": ".rb"
        },
        {
          "prob": 7.734421907141565e-08,
          "token": " ru"
        },
        {
          "prob": 3.6534822137210456e-08,
          "token": "_ru"
        }
      ],
      [
        {
          "prob": 0.9999946356109105,
          "token": ""
        },
        {
          "prob": 3.9278410701298514e-07,
          "token": "<tool_call>"
        },
        {
          "prob": 2.699563056295106e-07,
          "token": ""
        },
        {
          "prob": 9.931137485569145e-08,
          "token": "ienie"
        },
        {
          "prob": 5.3157548373442334e-08,
          "token": "ędzi"
        }
      ]
    ],
    "language_consistency_score": 0.5236420893878776,
    "feedback": "Feedback: The response is completely correct, accurate, and factual. It matches the reference answer exactly, providing the correct email address for the Skoltech Education Department.",
    "score": 5
  },
  {
    "question": "Which public transportation line can be used to get to the Skolkovo Train station?\n",
    "true_answer": "The MCD-1 (Moscow Central Diameter #1) metro line can be used to get to the Skolkovo Train station. \n",
    "source_doc": "\n### Text After Video 3\n\n**Topic 1  “ Location & Transportation  — Premises Location, Public Transport & Carsharing, Personal Cars & Parking”**\n\nBy now you’ve probably heard that our campus and its premises are pretty cool. In fact, you may have visited it during an Open Doors event or perhaps a conference or a summer school. ![][image7]The campus is located within the Skolkovo Innovation Center territory a few minutes away from the center of Moscow. The campus is part of the Skolkovo Innovation Center, which is a closed territory. This means you may need a car pass if you decide to drive here. So, you can reach the campus in multiple ways. **First, you can use public transportation.** \n\nThis is the safest and surest way to reach the campus if you need to be there by a certain time (or just want your arrival time to be predictable). No matter where you are traveling from, you can use Moscow’s MCD-1(Moscow Central Diameter \\#1) metro line to get to the Skolkovo Train station. It’s about a 20 minute ride from the city center. You’ll need to exit the train at the “MCD Skolkovo” (Сколково) station. Once you arrive, take the stairs, escalator or an elevator to the second floor and walk down the looooong hall of the Orbion building. Then, once again, go down to the 1st floor and exit. Once you exit the building, you can take the Sk1 bus shuttle from the nearest bus stop (look to your left). Or, you can take a walk towards the Amaltea business center, walk down the stairs, cross the road and catch any shuttle bus that goes towards Skoltech (the wooden building that looks like a crown, you’ll know it when you see it). This way will take about 10 minutes if you are a fast walker. Remember that the shuttle buses at Skolkovo have paid fares (same as within the Moscow public transportation system, we’ll talk about that in the next modules) and can be tracked via [Yandex maps](https://yandex.ru/maps/213/moscow/?ll=37.622504%2C55.753215\\&z=10) \n\n[(links to an external site)](https://yandex.ru/maps/213/moscow/?ll=37.622504%2C55.753215\\&z=10)\n\nBy the way, the Skolkovo Innovation Center website also has some tips on how to reach other buildings on the territory. Visit [https://sk.ru/transport/](https://sk.ru/transport/) \n\n[(links to an external site)](https://sk.ru/transport/)\n\nfor more information. ![][image8]\n\n \n\nThe next best thing is to take a taxi\n\nCurrently, only taxi services [Yandex (links to an external site)](https://taxi.yandex.ru/ru\\_ru/) , [Citi Mobil](https://city-mobil.ru/) \n\n[(links to an external site)](https://city-mobil.ru/) , and [Uber  (links to an external site)](https://support-uber.com/) have automatic access to the Skolkovo Innovation Center. All you need to do is download a relevant app to your smartphone, order a taxi to Skoltech (just type “Сколтех” in the destination, it will be there) and relax. Don’t forget to buckle up\\! If you take a different taxi service, you’ll need to order a territory pass ahead of time. To order a pass for your taxi, email security.campus@skoltech.ru from your Skoltech email address with your taxi’s model and license number (i.e. Toyota, Х111СК197).",
    "context": "Sim: 6.51 - This is the safest and surest way to reach the campus if you need to be there by a certain time (or just want your arrival time to be predictable). No matter where you are traveling from, you can use Moscow’s MCD-1(Moscow Central Diameter \\#1) metro line to get to the Skolkovo Train station. It’s about a 20 minute ride from the city center. You’ll need to exit the train at the “MCD Skolkovo” (Сколково) station.\nSim: 2.37 - The buses, metro, trains and other city-sponsored modes of transfer are integrated by one system. You can buy yourself single- or double-ride tickets or get a permanent Troika card and top off its balance every once in a while. If you’re planning to explore the city center, we recommend using the underground metro. Yandex Metro app (links to an external site)has the current map and allows you to plan your route to point A to point B. The metro is designed in a sun-like way, with multi-colored lines stemming away from the center outwards. There are also several circle lines which connect them. You will notice on the map (and have already seen it mentioned in this course) the MCD lines. These are newer extensions of the metro line that take you a little bit outside of the city for a few extra rubles. One of these lines, MCD 1, takes you almost directly to Skoltech and is the best way to get to campus from the city center. If you use the metro app to plan your route, select the stop called “Skolkovo” and it will calculate your route for you. Easy, huh\\! If you live or end up far away from a metro station, you can take the bus, a tramway or a small overground shuttle (aka marshrutka). The Yandex Transport app shows you the nearest stops, when the next bus, tram or shuttle will arrive there and where it can take you. You can also plan your route there.\nSim: 1.28 - → From there, take an SK1 shuttle and exit at the Technopark stop. The Skoltech dorms will be on your right\\! [Here](https://old.sk.ru/city/transport/p/inner.aspx) you will find the exact map of bus routes around Skolkovo. \nSim: 0.73 - * By taxi: If you don't want to worry about taking public transport on your first day, you can always order a taxi directly from the airport or the railway station directly to the Skoltech dormitories or your planned accommodation. We recommend using the [Uber App](https://support-uber.com/) or [Yandex Taxi](https://taxi.yandex.ru/ru\\_ru/) (which have open access to the Skolkovo territory). You’ll see the price in advance, would be able to choose the type of the vehicle (considering your bags) and can pay by credit card if you don't have cash on you yet.\nSim: 0.57 - Remember that the shuttle buses at Skolkovo have paid fares (same as within the Moscow public transportation system, we’ll talk about that in the next modules) and can be tracked via [Yandex maps](https://yandex.ru/maps/213/moscow/?ll=37.622504%2C55.753215\\&z=10) \nSim: 0.43 - The closest metro stations like Yugo-Zapadnaya, Park Pobedy & Slavyansky Boulevard have bus stops with direct routes to Skolkovo and should get you to the campus within 45 minutes.",
    "generated_answer": "The MCD-1 metro line can be used to get to the Skolkovo Train station.",
    "logprobs": [
      [
        {
          "prob": 0.7308500171433373,
          "token": "The"
        },
        {
          "prob": 0.23727226133447665,
          "token": "Use"
        },
        {
          "prob": 0.028338127080365157,
          "token": "You"
        },
        {
          "prob": 0.0033845066323275196,
          "token": "M"
        },
        {
          "prob": 5.4705454635237374e-05,
          "token": "use"
        }
      ],
      [
        {
          "prob": 0.9999008277075381,
          "token": " M"
        },
        {
          "prob": 9.610211997584463e-05,
          "token": " Moscow"
        },
        {
          "prob": 2.5610347494663965e-06,
          "token": " Sk"
        },
        {
          "prob": 3.0587198196298637e-07,
          "token": " safest"
        },
        {
          "prob": 8.763379005752914e-08,
          "token": " Mos"
        }
      ],
      [
        {
          "prob": 0.9999996423722521,
          "token": "CD"
        },
        {
          "prob": 1.6373771305908126e-07,
          "token": "DC"
        },
        {
          "prob": 1.1253517471925912e-07,
          "token": "CDATA"
        },
        {
          "prob": 2.510999155743982e-08,
          "token": "VD"
        },
        {
          "prob": 1.9555681087850496e-08,
          "token": " CD"
        }
      ],
      [
        {
          "prob": 0.9999075021477618,
          "token": "-"
        },
        {
          "prob": 8.481038937903707e-05,
          "token": " Sk"
        },
        {
          "prob": 4.784674758577432e-06,
          "token": " ("
        },
        {
          "prob": 2.2601203216961684e-06,
          "token": " "
        },
        {
          "prob": 5.714479086077528e-07,
          "token": "-S"
        }
      ],
      [
        {
          "prob": 1.0,
          "token": "1"
        },
        {
          "prob": 9.545034922840628e-12,
          "token": "１"
        },
        {
          "prob": 3.97896253583724e-12,
          "token": "2"
        },
        {
          "prob": 3.068246448279046e-13,
          "token": "0"
        },
        {
          "prob": 1.2015425731771786e-13,
          "token": "3"
        }
      ],
      [
        {
          "prob": 0.9772934383061079,
          "token": " metro"
        },
        {
          "prob": 0.020283078900397898,
          "token": " ("
        },
        {
          "prob": 0.0018866202235400967,
          "token": " Moscow"
        },
        {
          "prob": 0.00037149754869139146,
          "token": "(M"
        },
        {
          "prob": 8.28923075342593e-05,
          "token": " Metro"
        }
      ],
      [
        {
          "prob": 0.9999998807907247,
          "token": " line"
        },
        {
          "prob": 1.6373771305908126e-07,
          "token": "线"
        },
        {
          "prob": 2.510999155743982e-08,
          "token": "line"
        },
        {
          "prob": 1.3440409951135022e-08,
          "token": ".line"
        },
        {
          "prob": 1.3440409951135022e-08,
          "token": "(line"
        }
      ],
      [
        {
          "prob": 0.999957920890168,
          "token": " can"
        },
        {
          "prob": 4.006361622143917e-05,
          "token": "可以"
        },
        {
          "prob": 9.422059443684904e-07,
          "token": " ("
        },
        {
          "prob": 9.422059443684904e-07,
          "token": ","
        },
        {
          "prob": 1.637308424953633e-07,
          "token": "can"
        }
      ],
      [
        {
          "prob": 1.0,
          "token": " be"
        },
        {
          "prob": 5.211412487888539e-10,
          "token": "be"
        },
        {
          "prob": 1.6918979226151304e-10,
          "token": " быть"
        },
        {
          "prob": 6.224144622907783e-11,
          "token": " reach"
        },
        {
          "prob": 4.277787868968998e-11,
          "token": " get"
        }
      ],
      [
        {
          "prob": 0.9999997615814777,
          "token": " used"
        },
        {
          "prob": 2.1024338523818466e-07,
          "token": "used"
        },
        {
          "prob": 1.522997974471263e-08,
          "token": "用于"
        },
        {
          "prob": 2.061153622438558e-09,
          "token": "_used"
        },
        {
          "prob": 9.736200313009565e-10,
          "token": " use"
        }
      ],
      [
        {
          "prob": 1.0,
          "token": " to"
        },
        {
          "prob": 1.3887943864964021e-11,
          "token": " for"
        },
        {
          "prob": 1.2256067444099483e-11,
          "token": "to"
        },
        {
          "prob": 2.413362771833214e-12,
          "token": "\tto"
        },
        {
          "prob": 8.878265478459658e-13,
          "token": "_to"
        }
      ],
      [
        {
          "prob": 0.9999867679437158,
          "token": " get"
        },
        {
          "prob": 1.3007123989067183e-05,
          "token": " reach"
        },
        {
          "prob": 1.6373552693935322e-07,
          "token": "get"
        },
        {
          "prob": 6.02349341503609e-08,
          "token": ".get"
        },
        {
          "prob": 4.1398824450223246e-08,
          "token": " gets"
        }
      ],
      [
        {
          "prob": 1.0,
          "token": " to"
        },
        {
          "prob": 9.056076989672867e-11,
          "token": "to"
        },
        {
          "prob": 4.8473687062702556e-11,
          "token": "到"
        },
        {
          "prob": 9.545034922840628e-12,
          "token": "\tto"
        },
        {
          "prob": 8.423463754468647e-12,
          "token": "_to"
        }
      ],
      [
        {
          "prob": 1.0,
          "token": " the"
        },
        {
          "prob": 4.8473687062702556e-11,
          "token": " Sk"
        },
        {
          "prob": 8.423463754468647e-12,
          "token": "the"
        },
        {
          "prob": 1.1287447887691582e-13,
          "token": " a"
        },
        {
          "prob": 6.846183213793546e-14,
          "token": "\tthe"
        }
      ],
      [
        {
          "prob": 0.9999998807907247,
          "token": " Sk"
        },
        {
          "prob": 1.1253517471925912e-07,
          "token": "Sk"
        },
        {
          "prob": 4.058652126475693e-10,
          "token": "_sk"
        },
        {
          "prob": 9.056076989672867e-11,
          "token": " SK"
        },
        {
          "prob": 9.056076989672867e-11,
          "token": " Sc"
        }
      ],
      [
        {
          "prob": 0.9988195541717935,
          "token": "olk"
        },
        {
          "prob": 0.0011694974812495932,
          "token": "ol"
        },
        {
          "prob": 5.415845212261831e-06,
          "token": "olg"
        },
        {
          "prob": 1.066443153393091e-06,
          "token": "olt"
        },
        {
          "prob": 6.076409923552684e-07,
          "token": "ok"
        }
      ],
      [
        {
          "prob": 0.9999684105356298,
          "token": "ovo"
        },
        {
          "prob": 3.1201903005200916e-05,
          "token": "ово"
        },
        {
          "prob": 1.444934771486722e-07,
          "token": "avo"
        },
        {
          "prob": 1.2751504602738124e-07,
          "token": "ov"
        },
        {
          "prob": 4.139803483784145e-08,
          "token": "ivo"
        }
      ],
      [
        {
          "prob": 0.9999675761227764,
          "token": " Train"
        },
        {
          "prob": 2.430004331943024e-05,
          "token": "Train"
        },
        {
          "prob": 7.88906902056781e-06,
          "token": "_train"
        },
        {
          "prob": 2.1023656822233823e-07,
          "token": " train"
        },
        {
          "prob": 6.348594260002369e-09,
          "token": " TRAIN"
        }
      ],
      [
        {
          "prob": 0.9999986886995842,
          "token": " station"
        },
        {
          "prob": 8.315279260963632e-07,
          "token": "站"
        },
        {
          "prob": 1.6373755690670415e-07,
          "token": "_station"
        },
        {
          "prob": 9.931175369924415e-08,
          "token": " ("
        },
        {
          "prob": 8.76423150298272e-08,
          "token": ".station"
        }
      ],
      [
        {
          "prob": 0.9999996423722521,
          "token": "."
        },
        {
          "prob": 2.699578503363014e-07,
          "token": ","
        },
        {
          "prob": 7.734421907141565e-08,
          "token": " ("
        },
        {
          "prob": 4.139937718785167e-08,
          "token": ".\n\n"
        },
        {
          "prob": 1.9555681087850496e-08,
          "token": "。"
        }
      ],
      [
        {
          "prob": 0.9999979734461775,
          "token": ""
        },
        {
          "prob": 3.2563070405243817e-07,
          "token": ""
        },
        {
          "prob": 1.8553878237411744e-07,
          "token": "<tool_call>"
        },
        {
          "prob": 4.4069323563474324e-08,
          "token": "pecific"
        },
        {
          "prob": 2.0816874453306735e-08,
          "token": " Specifically"
        }
      ]
    ],
    "language_consistency_score": 0.5796642670218501,
    "feedback": "Feedback: The response is mostly correct, accurate, and factual. It correctly identifies the MCD-1 metro line as the line that can be used to get to the Skolkovo Train station. However, it lacks the full name \"Moscow Central Diameter #1\" which is included in the reference answer, making it slightly less detailed.",
    "score": 4
  },
  {
    "question": "What is the name of the train station you should get off at to reach Skoltech from Moscow's MCD-1 metro line?\n",
    "true_answer": "MCD Skolkovo (Сколково) station \n",
    "source_doc": "\n### Text After Video 3\n\n**Topic 1  “ Location & Transportation  — Premises Location, Public Transport & Carsharing, Personal Cars & Parking”**\n\nBy now you’ve probably heard that our campus and its premises are pretty cool. In fact, you may have visited it during an Open Doors event or perhaps a conference or a summer school. ![][image7]The campus is located within the Skolkovo Innovation Center territory a few minutes away from the center of Moscow. The campus is part of the Skolkovo Innovation Center, which is a closed territory. This means you may need a car pass if you decide to drive here. So, you can reach the campus in multiple ways. **First, you can use public transportation.** \n\nThis is the safest and surest way to reach the campus if you need to be there by a certain time (or just want your arrival time to be predictable). No matter where you are traveling from, you can use Moscow’s MCD-1(Moscow Central Diameter \\#1) metro line to get to the Skolkovo Train station. It’s about a 20 minute ride from the city center. You’ll need to exit the train at the “MCD Skolkovo” (Сколково) station. Once you arrive, take the stairs, escalator or an elevator to the second floor and walk down the looooong hall of the Orbion building. Then, once again, go down to the 1st floor and exit. Once you exit the building, you can take the Sk1 bus shuttle from the nearest bus stop (look to your left). Or, you can take a walk towards the Amaltea business center, walk down the stairs, cross the road and catch any shuttle bus that goes towards Skoltech (the wooden building that looks like a crown, you’ll know it when you see it). This way will take about 10 minutes if you are a fast walker. Remember that the shuttle buses at Skolkovo have paid fares (same as within the Moscow public transportation system, we’ll talk about that in the next modules) and can be tracked via [Yandex maps](https://yandex.ru/maps/213/moscow/?ll=37.622504%2C55.753215\\&z=10) \n\n[(links to an external site)](https://yandex.ru/maps/213/moscow/?ll=37.622504%2C55.753215\\&z=10)\n\nBy the way, the Skolkovo Innovation Center website also has some tips on how to reach other buildings on the territory. Visit [https://sk.ru/transport/](https://sk.ru/transport/) \n\n[(links to an external site)](https://sk.ru/transport/)\n\nfor more information. ![][image8]\n\n \n\nThe next best thing is to take a taxi\n\nCurrently, only taxi services [Yandex (links to an external site)](https://taxi.yandex.ru/ru\\_ru/) , [Citi Mobil](https://city-mobil.ru/) \n\n[(links to an external site)](https://city-mobil.ru/) , and [Uber  (links to an external site)](https://support-uber.com/) have automatic access to the Skolkovo Innovation Center. All you need to do is download a relevant app to your smartphone, order a taxi to Skoltech (just type “Сколтех” in the destination, it will be there) and relax. Don’t forget to buckle up\\! If you take a different taxi service, you’ll need to order a territory pass ahead of time. To order a pass for your taxi, email security.campus@skoltech.ru from your Skoltech email address with your taxi’s model and license number (i.e. Toyota, Х111СК197).",
    "context": "Sim: 5.50 - This is the safest and surest way to reach the campus if you need to be there by a certain time (or just want your arrival time to be predictable). No matter where you are traveling from, you can use Moscow’s MCD-1(Moscow Central Diameter \\#1) metro line to get to the Skolkovo Train station. It’s about a 20 minute ride from the city center. You’ll need to exit the train at the “MCD Skolkovo” (Сколково) station.\nSim: 3.21 - The buses, metro, trains and other city-sponsored modes of transfer are integrated by one system. You can buy yourself single- or double-ride tickets or get a permanent Troika card and top off its balance every once in a while. If you’re planning to explore the city center, we recommend using the underground metro. Yandex Metro app (links to an external site)has the current map and allows you to plan your route to point A to point B. The metro is designed in a sun-like way, with multi-colored lines stemming away from the center outwards. There are also several circle lines which connect them. You will notice on the map (and have already seen it mentioned in this course) the MCD lines. These are newer extensions of the metro line that take you a little bit outside of the city for a few extra rubles. One of these lines, MCD 1, takes you almost directly to Skoltech and is the best way to get to campus from the city center. If you use the metro app to plan your route, select the stop called “Skolkovo” and it will calculate your route for you. Easy, huh\\! If you live or end up far away from a metro station, you can take the bus, a tramway or a small overground shuttle (aka marshrutka). The Yandex Transport app shows you the nearest stops, when the next bus, tram or shuttle will arrive there and where it can take you. You can also plan your route there.\nSim: 2.39 - → From there, take an SK1 shuttle and exit at the Technopark stop. The Skoltech dorms will be on your right\\! [Here](https://old.sk.ru/city/transport/p/inner.aspx) you will find the exact map of bus routes around Skolkovo. \nSim: 2.32 - → If you’re traveling to the Skoltech Dormitories, you’ll need to go to the Slavyansky Bulvar metro station which will be located on the dark blue metro line. ",
    "generated_answer": "MCD Skolkovo station.",
    "logprobs": [
      [
        {
          "prob": 0.8510779344499895,
          "token": "M"
        },
        {
          "prob": 0.14789517326065368,
          "token": "You"
        },
        {
          "prob": 0.0009965098388508467,
          "token": "The"
        },
        {
          "prob": 1.4214442656011573e-05,
          "token": "\"M"
        },
        {
          "prob": 1.1070219071425392e-05,
          "token": "Get"
        }
      ],
      [
        {
          "prob": 0.9999990463265931,
          "token": "CD"
        },
        {
          "prob": 3.9278597995802437e-07,
          "token": "PC"
        },
        {
          "prob": 2.1024318473456359e-07,
          "token": "cd"
        },
        {
          "prob": 1.1253517471925912e-07,
          "token": "DC"
        },
        {
          "prob": 4.139937718785167e-08,
          "token": "CDATA"
        }
      ],
      [
        {
          "prob": 1.0,
          "token": " Sk"
        },
        {
          "prob": 1.9555681087850496e-08,
          "token": "Sk"
        },
        {
          "prob": 2.4616969518153846e-10,
          "token": "-S"
        },
        {
          "prob": 1.493094676197164e-10,
          "token": "_sk"
        },
        {
          "prob": 1.162823303022097e-10,
          "token": " SK"
        }
      ],
      [
        {
          "prob": 0.9998355182423089,
          "token": "olk"
        },
        {
          "prob": 0.0001584353345221579,
          "token": "ol"
        },
        {
          "prob": 1.3707342236901665e-06,
          "token": "olg"
        },
        {
          "prob": 1.3707342236901665e-06,
          "token": "оль"
        },
        {
          "prob": 8.31392332985481e-07,
          "token": "olt"
        }
      ],
      [
        {
          "prob": 0.9999876023871354,
          "token": "ovo"
        },
        {
          "prob": 1.1478757578876643e-05,
          "token": "ово"
        },
        {
          "prob": 8.315184100688966e-07,
          "token": "owo"
        },
        {
          "prob": 4.691110336029911e-08,
          "token": "avo"
        },
        {
          "prob": 3.6534404031744556e-08,
          "token": "ervo"
        }
      ],
      [
        {
          "prob": 0.9474505750169936,
          "token": " station"
        },
        {
          "prob": 0.017353165312048887,
          "token": " ("
        },
        {
          "prob": 0.015314114637921587,
          "token": ""
        },
        {
          "prob": 0.013514658733791214,
          "token": "."
        },
        {
          "prob": 0.0034170408516908573,
          "token": "站"
        }
      ],
      [
        {
          "prob": 0.9982969013402139,
          "token": "."
        },
        {
          "prob": 0.0017007181212681912,
          "token": ""
        },
        {
          "prob": 1.285703889059114e-06,
          "token": "。"
        },
        {
          "prob": 3.4604250728717226e-07,
          "token": " ("
        },
        {
          "prob": 5.648983256001893e-08,
          "token": "．"
        }
      ],
      [
        {
          "prob": 0.9999969005680498,
          "token": ""
        },
        {
          "prob": 5.714991385721822e-07,
          "token": ""
        },
        {
          "prob": 2.382362851497276e-07,
          "token": "<tool_call>"
        },
        {
          "prob": 2.8453239549131867e-08,
          "token": "eker"
        },
        {
          "prob": 1.621216720304997e-08,
          "token": "🤖"
        }
      ]
    ],
    "language_consistency_score": 0.3087518537969934,
    "feedback": "Feedback: The response is completely correct, accurate, and factual. The name of the station, \"MCD Skolkovo,\" matches the reference answer. The response is concise and directly answers the question without any additional unnecessary information.",
    "score": 5
  },
  {
    "question": "How many ECTS credits does a student need to take for the Entrepreneurship and Innovation track?\n",
    "true_answer": "12 ECTS credits \n",
    "source_doc": "\n### Text After Video 4\n\n[Learn more about what’s considered academic misconduct (links to an external site)](https://www.skoltech.ru/app/data/uploads/sites/2/2015/04/1.-STUDENT-ACADEMIC-INTEGRITY-REGULATIONS.pdf)  \n[Disciplinary Board Policy (links to an external site).](http://www.skoltech.ru/app/data/uploads/sites/2/2015/04/DISCIPLINARY-BOARD-POLICY.pdf)\n\nSave these links\\! 1) [Course timetable (links to an external site)](https://schedule.skoltech.ru/)  \n2) [Course catalog (links to an external site)](https://www.skoltech.ru/en/education/course-catalog/)  \n3) [Education resources for students (Canvas)](https://skoltech.instructure.com/courses/2072)\n\n![][image12]  \n[View the 2022-2023 academic calendar with key dates, breaks and holidays](https://www.skoltech.ru/en/education/academic-calendar/msc-academic-calendar-2022-2023/)   \n[(links to an external site)](https://www.skoltech.ru/en/education/academic-calendar/msc-academic-calendar-2022-2023/)\n\n[Your updated term schedule can be found on the Skoltech website (links to an external site)](https://schedule.skoltech.ru/)![][image13]\n\n* **STE:** **Science, Technology and Engineering** (36 ECTS-credits)  \n  * Provide a solid foundation of scientific and engineering fundamentals  \n  * Core and recommended electives  \n* **Sector:** **Industrial Immersion** (12 ECTS-credits)  \n  * Orients students to how a sector works, provides knowledge and skills to make an impact in an industrial sector  \n  * Happens in the summer term between Year 1 and Year 2  \n* **Enterpreneurship and Innovation: Entrepreneurship and Innovation** (12 ECTS-credits)  \n  * Orients students in the process of, provide the skills for, and experience with innovation  \n  * Includes Innovation Workshop  \n* **MSc Thesis Project** (36 ECTS-credits)  \n* Early research, Thesis Project, Defense\n\n* **Options: elective coursework and short-term projects** (24 ECTS-credits)  \n* Follow your dreams and passions, choose courses to diversify your experience  \n* Additionally you can take 20 credits as an extracurricular activity. **ECTS credits** are based on the workload students need in order to achieve the learning outcomes. 1 ECTS equals 27 astronomical hours (36 academic hours). [The courses offered in 2022-2023 (links to an external site)](https://www.skoltech.ru/en/education/course-catalog/)\n\nIf you need to communicate any concerns or issues informally or outside of the formal evaluation period (or if you are unable to solve an issue directly with your research advisor or faculty, please talk to the [Education Department (links to an external site)](https://helpdesk.skoltech.ru/servicedesk/customer/portal/21) (email: education@skoltech.ru).",
    "context": "Sim: 6.91 - * Enterpreneurship and Innovation: Entrepreneurship and Innovation (12 ECTS-credits)  \nSim: 6.65 - * **Enterpreneurship and Innovation: Entrepreneurship and Innovation** (12 ECTS-credits)  ",
    "generated_answer": "12 ECTS-credits.",
    "logprobs": [
      [
        {
          "prob": 0.9705854558052283,
          "token": "1"
        },
        {
          "prob": 0.029309144046480457,
          "token": "A"
        },
        {
          "prob": 5.657995835382194e-05,
          "token": "The"
        },
        {
          "prob": 4.4064515872104003e-05,
          "token": "Students"
        },
        {
          "prob": 1.9360597090202164e-06,
          "token": "Student"
        }
      ],
      [
        {
          "prob": 1.0,
          "token": "2"
        },
        {
          "prob": 5.789356328730652e-12,
          "token": "0"
        },
        {
          "prob": 5.109089028063325e-12,
          "token": "２"
        },
        {
          "prob": 2.129785170955785e-12,
          "token": ""
        },
        {
          "prob": 1.3750926572355787e-12,
          "token": "1"
        }
      ],
      [
        {
          "prob": 0.9999243078326592,
          "token": " E"
        },
        {
          "prob": 5.829027196054636e-05,
          "token": ""
        },
        {
          "prob": 6.96178020132239e-06,
          "token": "李"
        },
        {
          "prob": 6.96178020132239e-06,
          "token": "ECT"
        },
        {
          "prob": 3.689608337010101e-07,
          "token": " EC"
        }
      ],
      [
        {
          "prob": 0.9999997615814777,
          "token": "CTS"
        },
        {
          "prob": 2.382369667501818e-07,
          "token": "CT"
        },
        {
          "prob": 1.8189616875530459e-09,
          "token": "cts"
        },
        {
          "prob": 7.05287985111216e-11,
          "token": "TS"
        },
        {
          "prob": 4.8473687062702556e-11,
          "token": "TC"
        }
      ],
      [
        {
          "prob": 0.8806569497318297,
          "token": "-"
        },
        {
          "prob": 0.11918395772624855,
          "token": " credits"
        },
        {
          "prob": 0.00015813101820626215,
          "token": "credits"
        },
        {
          "prob": 5.032963680794117e-07,
          "token": " Credits"
        },
        {
          "prob": 3.05264678162178e-07,
          "token": "Credits"
        }
      ],
      [
        {
          "prob": 0.9999952316511552,
          "token": "credits"
        },
        {
          "prob": 2.5612765577945685e-06,
          "token": " credits"
        },
        {
          "prob": 1.7603379181908526e-06,
          "token": "credit"
        },
        {
          "prob": 2.3823583075050818e-07,
          "token": "credentials"
        },
        {
          "prob": 8.764214786553686e-08,
          "token": "cred"
        }
      ],
      [
        {
          "prob": 0.999371804312377,
          "token": "."
        },
        {
          "prob": 0.0006263329424040021,
          "token": ""
        },
        {
          "prob": 1.0670331994427314e-06,
          "token": "。"
        },
        {
          "prob": 1.741883814484155e-07,
          "token": " are"
        },
        {
          "prob": 1.5372070709445066e-07,
          "token": "．"
        }
      ],
      [
        {
          "prob": 0.9999984502816872,
          "token": ""
        },
        {
          "prob": 3.9278560536830205e-07,
          "token": ""
        },
        {
          "prob": 1.6373740075447596e-07,
          "token": "<tool_call>"
        },
        {
          "prob": 1.4307214629695401e-08,
          "token": " bụ"
        },
        {
          "prob": 8.677764327999391e-09,
          "token": "eka"
        }
      ]
    ],
    "language_consistency_score": 0.3455120611732408,
    "feedback": "Feedback: The response is completely correct, accurate, and factual. The answer provided matches the reference answer exactly, with only a minor difference in punctuation.",
    "score": 5
  },
  {
    "question": "How many ECTS credits are needed for the MSc Thesis Project?\n",
    "true_answer": "36 ECTS-credits \n",
    "source_doc": "\n### Text After Video 4\n\n[Learn more about what’s considered academic misconduct (links to an external site)](https://www.skoltech.ru/app/data/uploads/sites/2/2015/04/1.-STUDENT-ACADEMIC-INTEGRITY-REGULATIONS.pdf)  \n[Disciplinary Board Policy (links to an external site).](http://www.skoltech.ru/app/data/uploads/sites/2/2015/04/DISCIPLINARY-BOARD-POLICY.pdf)\n\nSave these links\\! 1) [Course timetable (links to an external site)](https://schedule.skoltech.ru/)  \n2) [Course catalog (links to an external site)](https://www.skoltech.ru/en/education/course-catalog/)  \n3) [Education resources for students (Canvas)](https://skoltech.instructure.com/courses/2072)\n\n![][image12]  \n[View the 2022-2023 academic calendar with key dates, breaks and holidays](https://www.skoltech.ru/en/education/academic-calendar/msc-academic-calendar-2022-2023/)   \n[(links to an external site)](https://www.skoltech.ru/en/education/academic-calendar/msc-academic-calendar-2022-2023/)\n\n[Your updated term schedule can be found on the Skoltech website (links to an external site)](https://schedule.skoltech.ru/)![][image13]\n\n* **STE:** **Science, Technology and Engineering** (36 ECTS-credits)  \n  * Provide a solid foundation of scientific and engineering fundamentals  \n  * Core and recommended electives  \n* **Sector:** **Industrial Immersion** (12 ECTS-credits)  \n  * Orients students to how a sector works, provides knowledge and skills to make an impact in an industrial sector  \n  * Happens in the summer term between Year 1 and Year 2  \n* **Enterpreneurship and Innovation: Entrepreneurship and Innovation** (12 ECTS-credits)  \n  * Orients students in the process of, provide the skills for, and experience with innovation  \n  * Includes Innovation Workshop  \n* **MSc Thesis Project** (36 ECTS-credits)  \n* Early research, Thesis Project, Defense\n\n* **Options: elective coursework and short-term projects** (24 ECTS-credits)  \n* Follow your dreams and passions, choose courses to diversify your experience  \n* Additionally you can take 20 credits as an extracurricular activity. **ECTS credits** are based on the workload students need in order to achieve the learning outcomes. 1 ECTS equals 27 astronomical hours (36 academic hours). [The courses offered in 2022-2023 (links to an external site)](https://www.skoltech.ru/en/education/course-catalog/)\n\nIf you need to communicate any concerns or issues informally or outside of the formal evaluation period (or if you are unable to solve an issue directly with your research advisor or faculty, please talk to the [Education Department (links to an external site)](https://helpdesk.skoltech.ru/servicedesk/customer/portal/21) (email: education@skoltech.ru).",
    "context": "Sim: 6.44 - * MSc Thesis Project (36 ECTS-credits)  \nSim: 6.13 - * **MSc Thesis Project** (36 ECTS-credits)  ",
    "generated_answer": "36 ECTS-credits.",
    "logprobs": [
      [
        {
          "prob": 0.9999958276922101,
          "token": "3"
        },
        {
          "prob": 4.2228351681890325e-06,
          "token": "The"
        },
        {
          "prob": 9.736163172423694e-10,
          "token": "4"
        },
        {
          "prob": 8.592133842722118e-10,
          "token": "Thirty"
        },
        {
          "prob": 2.461687561204665e-10,
          "token": "2"
        }
      ],
      [
        {
          "prob": 1.0,
          "token": "6"
        },
        {
          "prob": 5.109089028063325e-12,
          "token": "5"
        },
        {
          "prob": 1.6586783589142312e-12,
          "token": "4"
        },
        {
          "prob": 1.6586783589142312e-12,
          "token": "2"
        },
        {
          "prob": 8.878265478459658e-13,
          "token": "8"
        }
      ],
      [
        {
          "prob": 0.9999653112986742,
          "token": " E"
        },
        {
          "prob": 2.429999697082004e-05,
          "token": ""
        },
        {
          "prob": 6.144001412158703e-06,
          "token": "李"
        },
        {
          "prob": 1.994665217910508e-06,
          "token": "ECT"
        },
        {
          "prob": 2.535932244330909e-07,
          "token": "'E"
        }
      ],
      [
        {
          "prob": 0.9999996423722521,
          "token": "CTS"
        },
        {
          "prob": 3.4663274126619643e-07,
          "token": "CT"
        },
        {
          "prob": 5.602796437537268e-09,
          "token": "cts"
        },
        {
          "prob": 5.905303998944039e-10,
          "token": "TS"
        },
        {
          "prob": 1.493094676197164e-10,
          "token": "TC"
        }
      ],
      [
        {
          "prob": 0.9978019735797764,
          "token": "-"
        },
        {
          "prob": 0.0021826826103546085,
          "token": " credits"
        },
        {
          "prob": 1.4706806757145136e-05,
          "token": "credits"
        },
        {
          "prob": 5.032392536028018e-07,
          "token": "-c"
        },
        {
          "prob": 1.272388094740147e-07,
          "token": " Credits"
        }
      ],
      [
        {
          "prob": 0.9999974966112362,
          "token": "credits"
        },
        {
          "prob": 1.7603412757721762e-06,
          "token": " credits"
        },
        {
          "prob": 5.043462196197153e-07,
          "token": "credit"
        },
        {
          "prob": 1.1253496007565217e-07,
          "token": "credentials"
        },
        {
          "prob": 6.825590357542018e-08,
          "token": "Credits"
        }
      ],
      [
        {
          "prob": 0.7792719739656521,
          "token": "."
        },
        {
          "prob": 0.19703081679141823,
          "token": " are"
        },
        {
          "prob": 0.0235319752894153,
          "token": ""
        },
        {
          "prob": 3.32353871895843e-05,
          "token": "都是"
        },
        {
          "prob": 3.32353871895843e-05,
          "token": ".are"
        }
      ],
      [
        {
          "prob": 0.9999972581939645,
          "token": ""
        },
        {
          "prob": 6.083576662864179e-07,
          "token": ""
        },
        {
          "prob": 2.238022783058102e-07,
          "token": "<tool_call>"
        },
        {
          "prob": 2.845329381943118e-08,
          "token": " bụ"
        },
        {
          "prob": 1.4307214629695401e-08,
          "token": "GuidId"
        }
      ]
    ],
    "language_consistency_score": 0.3286406173247874,
    "feedback": "Feedback: The response is completely correct, accurate, and factual. It matches the reference answer exactly, providing the correct number of ECTS credits needed for the MSc Thesis Project.",
    "score": 5
  },
  {
    "question": "What department should students contact if they want to end their studies at Skoltech?\n",
    "true_answer": "The Education Department. \n",
    "source_doc": "The Independent Studies Period is mandatory to maintain full-time status. * Attendance Policy  \n  1. Students are expected to attend all educational curriculum elements full-time, unless the Course Instructor specifies otherwise. 2. Skoltech strongly advises you to focus on your course and research work, and avoid taking on jobs in addition to your studies. Academic Integrity   \n  3. Please ensure to clarify course collaboration policy, be aware of plagiarism. Review the Academic Integrity section above for more information. **Academic Leave and Return**   \nIn exceptional cases, you may request a leave of absence and temporarily stop your studies. Academic leave of absence may be granted on the following grounds:\n\n* for medical reasons;  \n* in case of call to military service;  \n* in other exceptional cases. You will need to apply for academic leave in written form, stating the reason for your request. Your application will be reviewed within 10 days of submission. Likewise, when you return from academic leave or wish to end it earlier, you will need to request reinstatement in written form. More information and instructions about this process can be found [here (links to an external site)](https://www.skoltech.ru/app/data/uploads/sites/2/2015/04/11.-REGULATIONS-ON-ACADEMIC-LEAVE-OF-ABSENCE.pdf)\n\nContact the [Education Department (links to an external site)](https://helpdesk.skoltech.ru/servicedesk/customer/portal/21)for support. **Withdrawal and Reinstatement** \n\nIf you wish to end (or resume) your education at Skoltech, please contact the [Education Department  (links to an external site)](https://helpdesk.skoltech.ru/servicedesk/customer/portal/21)\n\n What’s next? The [third part](https://skoltech.instructure.com/courses/3974/assignments/22741) of Education module tells about library resources and intellectual property management. ## “Education Process, Part 3” \\- Module 3.3\n",
    "context": "Sim: 5.92 - If you wish to end (or resume) your education at Skoltech, please contact the [Education Department  (links to an external site)](https://helpdesk.skoltech.ru/servicedesk/customer/portal/21)\nSim: 1.73 - Until then, if you have urgent questions or need assistance, feel free to reach out to the Education Department via [education@skoltech.ru](mailto:education@skoltech.ru). For more details on the Education Department, as well as for all the relevant links, see the description below.\nSim: 1.36 - Contact the [Education Department (links to an external site)](https://helpdesk.skoltech.ru/servicedesk/customer/portal/21)for support. \nSim: 0.63 - Every once in a while we will ask you to complete a survey to let us know about any feedback or contribute information about your graduation plans. It is essential that you complete these requests, as this is the best opportunity to directly affect (and improve) the way Skoltech operates. Oh and by the way, not all communication on campus is digital\\! You’ll notice some classy white information boards on the walls where you can write inspiring (and very kind) messages, post announcements about your events and more. Talk to the Student Department if you want to learn more.",
    "generated_answer": "Students should contact the Education Department if they want to end their studies at Skoltech.",
    "logprobs": [
      [
        {
          "prob": 0.9883339568669162,
          "token": "Students"
        },
        {
          "prob": 0.010979400039266254,
          "token": "The"
        },
        {
          "prob": 0.00022787006940850179,
          "token": " Students"
        },
        {
          "prob": 0.00017746538849387658,
          "token": "students"
        },
        {
          "prob": 0.00012197005886831613,
          "token": "Contact"
        }
      ],
      [
        {
          "prob": 0.9999992847447459,
          "token": " should"
        },
        {
          "prob": 5.043471815847051e-07,
          "token": "should"
        },
        {
          "prob": 2.1024318473456359e-07,
          "token": "应该"
        },
        {
          "prob": 2.8453348089834e-08,
          "token": "应"
        },
        {
          "prob": 2.646573638909117e-09,
          "token": " Should"
        }
      ],
      [
        {
          "prob": 0.9999961853172863,
          "token": " contact"
        },
        {
          "prob": 3.7266389560521204e-06,
          "token": "contact"
        },
        {
          "prob": 8.764214786553686e-08,
          "token": "_contact"
        },
        {
          "prob": 8.151989617038353e-09,
          "token": ".contact"
        },
        {
          "prob": 8.151989617038353e-09,
          "token": " Contact"
        }
      ],
      [
        {
          "prob": 1.0,
          "token": " the"
        },
        {
          "prob": 9.545034922840628e-12,
          "token": "the"
        },
        {
          "prob": 1.0603575991523846e-13,
          "token": " The"
        },
        {
          "prob": 4.420228103641173e-14,
          "token": "\tthe"
        },
        {
          "prob": 9.862862046580453e-15,
          "token": ".the"
        }
      ],
      [
        {
          "prob": 0.9999992847447459,
          "token": " Education"
        },
        {
          "prob": 4.4508482557577276e-07,
          "token": "Education"
        },
        {
          "prob": 2.6995759288455584e-07,
          "token": " ["
        },
        {
          "prob": 1.7257827987960214e-08,
          "token": " Educational"
        },
        {
          "prob": 1.4166087866431961e-09,
          "token": " education"
        }
      ],
      [
        {
          "prob": 0.9999988079084972,
          "token": " Department"
        },
        {
          "prob": 1.2098659934854867e-06,
          "token": "Department"
        },
        {
          "prob": 3.6534752452633856e-08,
          "token": "_department"
        },
        {
          "prob": 1.18610975280741e-08,
          "token": " department"
        },
        {
          "prob": 1.2501504819116561e-09,
          "token": " Depart"
        }
      ],
      [
        {
          "prob": 0.9989425408544641,
          "token": " if"
        },
        {
          "prob": 0.000626063908603543,
          "token": "."
        },
        {
          "prob": 0.0004302870122211862,
          "token": " to"
        },
        {
          "prob": 8.306497385920182e-07,
          "token": " at"
        },
        {
          "prob": 9.920686925893111e-08,
          "token": "如果"
        }
      ],
      [
        {
          "prob": 0.9999952316511552,
          "token": " they"
        },
        {
          "prob": 4.78509457496562e-06,
          "token": "他们"
        },
        {
          "prob": 5.602775064605783e-09,
          "token": "they"
        },
        {
          "prob": 2.6465635430511496e-09,
          "token": " они"
        },
        {
          "prob": 1.91716420034333e-10,
          "token": " They"
        }
      ],
      [
        {
          "prob": 0.9999860527077029,
          "token": " want"
        },
        {
          "prob": 1.1478735684904949e-05,
          "token": " wish"
        },
        {
          "prob": 2.260297072940795e-06,
          "token": "want"
        },
        {
          "prob": 9.931061717292157e-08,
          "token": "想要"
        },
        {
          "prob": 5.3157142815080565e-08,
          "token": ".want"
        }
      ],
      [
        {
          "prob": 1.0,
          "token": " to"
        },
        {
          "prob": 9.056076989672867e-11,
          "token": "to"
        },
        {
          "prob": 7.433680672352188e-12,
          "token": "\tto"
        },
        {
          "prob": 3.97896253583724e-12,
          "token": "_to"
        },
        {
          "prob": 1.5428112031918877e-13,
          "token": ".to"
        }
      ],
      [
        {
          "prob": 0.9999998807907247,
          "token": " end"
        },
        {
          "prob": 8.764248219443636e-08,
          "token": ".end"
        },
        {
          "prob": 2.510999155743982e-08,
          "token": "end"
        },
        {
          "prob": 1.7257827987960214e-08,
          "token": " ended"
        },
        {
          "prob": 6.34880011604368e-09,
          "token": " ending"
        }
      ],
      [
        {
          "prob": 0.9999431404007152,
          "token": " their"
        },
        {
          "prob": 4.006300490383416e-05,
          "token": " ("
        },
        {
          "prob": 1.6700745138602296e-05,
          "token": " or"
        },
        {
          "prob": 1.4448975660418572e-07,
          "token": "他们的"
        },
        {
          "prob": 1.0466802862345344e-08,
          "token": "their"
        }
      ],
      [
        {
          "prob": 0.9999998807907247,
          "token": " studies"
        },
        {
          "prob": 7.734421907141565e-08,
          "token": " Studies"
        },
        {
          "prob": 1.522997974471263e-08,
          "token": " education"
        },
        {
          "prob": 1.0467401794744658e-08,
          "token": "Studies"
        },
        {
          "prob": 1.917171513758312e-10,
          "token": " studying"
        }
      ],
      [
        {
          "prob": 1.0,
          "token": " at"
        },
        {
          "prob": 2.5946094982764667e-11,
          "token": "_at"
        },
        {
          "prob": 1.3887943864964021e-11,
          "token": "at"
        },
        {
          "prob": 5.109089028063325e-12,
          "token": " or"
        },
        {
          "prob": 3.0988191387218256e-12,
          "token": " tại"
        }
      ],
      [
        {
          "prob": 0.9999998807907247,
          "token": " Sk"
        },
        {
          "prob": 1.4449802461092448e-07,
          "token": "Sk"
        },
        {
          "prob": 4.944450501938644e-09,
          "token": "_sk"
        },
        {
          "prob": 3.850741922767617e-09,
          "token": " SK"
        },
        {
          "prob": 1.5893910094516368e-10,
          "token": " Sketch"
        }
      ],
      [
        {
          "prob": 0.9999996423722521,
          "token": "ol"
        },
        {
          "prob": 2.1024338523818466e-07,
          "token": "olk"
        },
        {
          "prob": 5.3157852544244216e-08,
          "token": "ол"
        },
        {
          "prob": 1.0467401794744658e-08,
          "token": "olt"
        },
        {
          "prob": 6.34880011604368e-09,
          "token": "oll"
        }
      ],
      [
        {
          "prob": 0.9999811652878874,
          "token": "tech"
        },
        {
          "prob": 5.422144950440283e-06,
          "token": "Tech"
        },
        {
          "prob": 3.7265820924882136e-06,
          "token": "itech"
        },
        {
          "prob": 2.260286295030162e-06,
          "token": " tech"
        },
        {
          "prob": 1.7603127365350548e-06,
          "token": "tek"
        }
      ],
      [
        {
          "prob": 1.0,
          "token": "."
        },
        {
          "prob": 2.646573638909117e-09,
          "token": "。"
        },
        {
          "prob": 8.592166619174109e-10,
          "token": ","
        },
        {
          "prob": 5.211412487888539e-10,
          "token": ".\n\n"
        },
        {
          "prob": 4.5536814829435366e-11,
          "token": " or"
        }
      ],
      [
        {
          "prob": 0.9999988079084972,
          "token": ""
        },
        {
          "prob": 2.3823673954981372e-07,
          "token": ""
        },
        {
          "prob": 1.6373755690670415e-07,
          "token": "<tool_call>"
        },
        {
          "prob": 3.6534752452633856e-08,
          "token": " bụ"
        },
        {
          "prob": 4.644872530556089e-09,
          "token": "心仪的"
        }
      ]
    ],
    "language_consistency_score": 0.9466867452820823,
    "feedback": "Feedback: The response is completely correct, accurate, and factual. It correctly identifies the Education Department as the department students should contact to end their studies at Skoltech, which aligns with the reference answer.",
    "score": 5
  },
  {
    "question": "How many credits are required per term to maintain full-time student status at Skoltech?\n",
    "true_answer": "A minimum of 12 credits and a maximum of 18 credits per term. \n",
    "source_doc": "In this section, we would like to cover the most critical academic policies and guidelines that regulate the students’ eligibility for their degree. * Full-time Status requirement  \n  1. You must be registered for a minimum of 12 credits and a maximum of 18 credits per term. During Term 1, it’s best to take only 12 credits for a smooth introduction to Skoltech coursework. 2.",
    "context": "Sim: 4.92 -   1. You must be registered for a minimum of 12 credits and a maximum of 18 credits per term. During Term 1, it’s best to take only 12 credits for a smooth introduction to Skoltech coursework.   \nSim: 0.11 - Most academic programs at Skoltech focus on preparing specialists who are ready to meet the needs of industry and interests of business. One of such programs is Industrial Immersion. What is industrial immersion? Industrial immersion is a compulsory educational element aimed at getting a real hands-on work experience in the industrial sector. Basically, this is your mandatory summer internship which grants you 12 credits upon successful completion.",
    "generated_answer": "You must be registered for a minimum of 12 credits and a maximum of 18 credits per term to maintain full-time student status at Skoltech.",
    "logprobs": [
      [
        {
          "prob": 0.8182839851534377,
          "token": "You"
        },
        {
          "prob": 0.08624650136208342,
          "token": "To"
        },
        {
          "prob": 0.05231114736905099,
          "token": "A"
        },
        {
          "prob": 0.02180653054396269,
          "token": "For"
        },
        {
          "prob": 0.00909031436473737,
          "token": "1"
        }
      ],
      [
        {
          "prob": 0.9999961853172863,
          "token": " must"
        },
        {
          "prob": 1.3709538566001813e-06,
          "token": "必须"
        },
        {
          "prob": 1.0676999370749836e-06,
          "token": " need"
        },
        {
          "prob": 1.0676999370749836e-06,
          "token": " are"
        },
        {
          "prob": 1.2751857270305506e-07,
          "token": "须"
        }
      ],
      [
        {
          "prob": 0.9302758479534481,
          "token": " be"
        },
        {
          "prob": 0.0673889508776249,
          "token": " maintain"
        },
        {
          "prob": 0.0023059230940296197,
          "token": " register"
        },
        {
          "prob": 2.260647455300133e-05,
          "token": " take"
        },
        {
          "prob": 9.932591718944684e-07,
          "token": " maintained"
        }
      ],
      [
        {
          "prob": 0.9997217237721113,
          "token": " registered"
        },
        {
          "prob": 0.00017951020973617872,
          "token": "registered"
        },
        {
          "prob": 9.608489129713058e-05,
          "token": "注册"
        },
        {
          "prob": 2.5605756207303687e-06,
          "token": "_registered"
        },
        {
          "prob": 7.732268380103615e-08,
          "token": "\tregister"
        }
      ],
      [
        {
          "prob": 1.0,
          "token": " for"
        },
        {
          "prob": 2.7894680928689246e-10,
          "token": "for"
        },
        {
          "prob": 1.3176514270095466e-10,
          "token": "\tfor"
        },
        {
          "prob": 3.5114221133765118e-12,
          "token": " для"
        },
        {
          "prob": 1.6586783589142312e-12,
          "token": " für"
        }
      ],
      [
        {
          "prob": 1.0,
          "token": " a"
        },
        {
          "prob": 5.602796437537268e-09,
          "token": " at"
        },
        {
          "prob": 4.363462252943702e-09,
          "token": " between"
        },
        {
          "prob": 2.061153622438558e-09,
          "token": " "
        },
        {
          "prob": 4.277787868968998e-11,
          "token": "a"
        }
      ],
      [
        {
          "prob": 0.999998927117538,
          "token": " minimum"
        },
        {
          "prob": 1.0677029917933763e-06,
          "token": "minimum"
        },
        {
          "prob": 2.3355885840133965e-09,
          "token": " maximum"
        },
        {
          "prob": 1.8189582181622667e-09,
          "token": " mínimo"
        },
        {
          "prob": 8.592150230932485e-10,
          "token": "_minimum"
        }
      ],
      [
        {
          "prob": 1.0,
          "token": " of"
        },
        {
          "prob": 6.560200168153779e-12,
          "token": " của"
        },
        {
          "prob": 8.25807328555592e-14,
          "token": "of"
        },
        {
          "prob": 3.900837610180715e-14,
          "token": " and"
        },
        {
          "prob": 2.3659776091347615e-14,
          "token": "_of"
        }
      ],
      [
        {
          "prob": 1.0,
          "token": " "
        },
        {
          "prob": 1.2256067444099483e-11,
          "token": "1"
        },
        {
          "prob": 8.17659982521153e-15,
          "token": ""
        },
        {
          "prob": 6.367942346736252e-15,
          "token": " either"
        },
        {
          "prob": 1.5125188821494485e-15,
          "token": " twelve"
        }
      ],
      [
        {
          "prob": 1.0,
          "token": "1"
        },
        {
          "prob": 3.5114221133765118e-12,
          "token": "１"
        },
        {
          "prob": 5.384940217754036e-13,
          "token": "9"
        },
        {
          "prob": 4.752193062771153e-13,
          "token": " twelve"
        },
        {
          "prob": 6.431393941452e-14,
          "token": "₁"
        }
      ],
      [
        {
          "prob": 1.0,
          "token": "2"
        },
        {
          "prob": 2.9400777392844726e-11,
          "token": "２"
        },
        {
          "prob": 1.9810087980489796e-13,
          "token": ""
        },
        {
          "prob": 7.75774191812223e-14,
          "token": " twenty"
        },
        {
          "prob": 7.75774191812223e-14,
          "token": "0"
        }
      ],
      [
        {
          "prob": 0.999876276066191,
          "token": " credits"
        },
        {
          "prob": 0.0001233945049762016,
          "token": "credits"
        },
        {
          "prob": 2.38207432519079e-07,
          "token": " and"
        },
        {
          "prob": 7.73346307104166e-08,
          "token": " credit"
        },
        {
          "prob": 1.7255688535434933e-08,
          "token": "Credits"
        }
      ],
      [
        {
          "prob": 1.0,
          "token": " and"
        },
        {
          "prob": 1.522997974471263e-08,
          "token": "和"
        },
        {
          "prob": 3.331544542166412e-11,
          "token": " и"
        },
        {
          "prob": 2.9400777392844726e-11,
          "token": " và"
        },
        {
          "prob": 8.878265478459658e-13,
          "token": "and"
        }
      ],
      [
        {
          "prob": 1.0,
          "token": " a"
        },
        {
          "prob": 6.224144622907783e-11,
          "token": " up"
        },
        {
          "prob": 1.783247290814639e-11,
          "token": "a"
        },
        {
          "prob": 1.006039279283317e-12,
          "token": "\ta"
        },
        {
          "prob": 4.752193062771153e-13,
          "token": " maximum"
        }
      ],
      [
        {
          "prob": 0.9999988079084972,
          "token": " maximum"
        },
        {
          "prob": 1.2098659934854867e-06,
          "token": "maximum"
        },
        {
          "prob": 1.2501504819116561e-09,
          "token": ".maximum"
        },
        {
          "prob": 6.691573328117371e-10,
          "token": " maxim"
        },
        {
          "prob": 5.905292735481273e-10,
          "token": " máximo"
        }
      ],
      [
        {
          "prob": 1.0,
          "token": " of"
        },
        {
          "prob": 1.783247290814639e-11,
          "token": " của"
        },
        {
          "prob": 3.2661313427874473e-13,
          "token": " or"
        },
        {
          "prob": 2.543665647376923e-13,
          "token": "_of"
        },
        {
          "prob": 1.3615261080896538e-13,
          "token": "of"
        }
      ],
      [
        {
          "prob": 1.0,
          "token": " "
        },
        {
          "prob": 7.05287985111216e-11,
          "token": "1"
        },
        {
          "prob": 1.5428112031918877e-13,
          "token": ""
        },
        {
          "prob": 1.34809340538292e-14,
          "token": "  "
        },
        {
          "prob": 7.681204685202095e-15,
          "token": "\n"
        }
      ],
      [
        {
          "prob": 1.0,
          "token": "1"
        },
        {
          "prob": 6.101936677605324e-13,
          "token": "１"
        },
        {
          "prob": 8.25807328555592e-14,
          "token": "2"
        },
        {
          "prob": 3.037975385443128e-14,
          "token": "9"
        },
        {
          "prob": 9.265301443284929e-15,
          "token": "3"
        }
      ],
      [
        {
          "prob": 1.0,
          "token": "8"
        },
        {
          "prob": 7.194133030325383e-09,
          "token": "2"
        },
        {
          "prob": 4.363462252943702e-09,
          "token": "5"
        },
        {
          "prob": 4.5990553786523166e-10,
          "token": "6"
        },
        {
          "prob": 3.775134544279098e-11,
          "token": "7"
        }
      ],
      [
        {
          "prob": 0.9999414716651684,
          "token": " credits"
        },
        {
          "prob": 5.829127258796956e-05,
          "token": "credits"
        },
        {
          "prob": 8.76373002398104e-08,
          "token": " credentials"
        },
        {
          "prob": 6.023217687700718e-08,
          "token": "Credits"
        },
        {
          "prob": 1.955452483748492e-08,
          "token": " Credits"
        }
      ],
      [
        {
          "prob": 1.0,
          "token": " per"
        },
        {
          "prob": 2.061153622438558e-09,
          "token": "_per"
        },
        {
          "prob": 1.103256032343554e-09,
          "token": "per"
        },
        {
          "prob": 4.8473687062702556e-11,
          "token": " to"
        },
        {
          "prob": 9.545034922840628e-12,
          "token": ".per"
        }
      ],
      [
        {
          "prob": 0.9999998807907247,
          "token": " term"
        },
        {
          "prob": 1.4449802461092448e-07,
          "token": "term"
        },
        {
          "prob": 4.363462252943702e-09,
          "token": "(term"
        },
        {
          "prob": 3.850741922767617e-09,
          "token": ".term"
        },
        {
          "prob": 2.9989608248573072e-09,
          "token": "_term"
        }
      ],
      [
        {
          "prob": 0.9998574460087201,
          "token": " to"
        },
        {
          "prob": 0.00013982175886379007,
          "token": "."
        },
        {
          "prob": 2.5609248441368465e-06,
          "token": " at"
        },
        {
          "prob": 7.733315568346205e-08,
          "token": " for"
        },
        {
          "prob": 4.5983975255576063e-10,
          "token": " per"
        }
      ],
      [
        {
          "prob": 0.9999991655356624,
          "token": " maintain"
        },
        {
          "prob": 4.4508482557577276e-07,
          "token": "maint"
        },
        {
          "prob": 1.8553895931777327e-07,
          "token": " maintained"
        },
        {
          "prob": 8.764248219443636e-08,
          "token": " maintaining"
        },
        {
          "prob": 5.3157852544244216e-08,
          "token": " maintains"
        }
      ],
      [
        {
          "prob": 1.0,
          "token": " full"
        },
        {
          "prob": 2.510999155743982e-08,
          "token": "full"
        },
        {
          "prob": 3.398267819495071e-09,
          "token": "满"
        },
        {
          "prob": 2.9989608248573072e-09,
          "token": "_full"
        },
        {
          "prob": 1.8189616875530459e-09,
          "token": "(full"
        }
      ],
      [
        {
          "prob": 1.0,
          "token": "-time"
        },
        {
          "prob": 1.0467401794744658e-08,
          "token": "-Time"
        },
        {
          "prob": 1.2501528663867426e-09,
          "token": "-term"
        },
        {
          "prob": 4.5990553786523166e-10,
          "token": "time"
        },
        {
          "prob": 1.917171513758312e-10,
          "token": "_time"
        }
      ],
      [
        {
          "prob": 0.9990831682195428,
          "token": " student"
        },
        {
          "prob": 0.0009110457570459582,
          "token": " status"
        },
        {
          "prob": 3.723235779029296e-06,
          "token": "student"
        },
        {
          "prob": 1.5520755865854369e-06,
          "token": "学生"
        },
        {
          "prob": 2.3801850012163258e-07,
          "token": ".student"
        }
      ],
      [
        {
          "prob": 0.9999995231630692,
          "token": " status"
        },
        {
          "prob": 4.450852500419419e-07,
          "token": "status"
        },
        {
          "prob": 1.7257827987960214e-08,
          "token": ".status"
        },
        {
          "prob": 1.6052280551856116e-09,
          "token": "(status"
        },
        {
          "prob": 9.736200313009565e-10,
          "token": "\tstatus"
        }
      ],
      [
        {
          "prob": 1.0,
          "token": " at"
        },
        {
          "prob": 4.5990553786523166e-10,
          "token": "."
        },
        {
          "prob": 7.991959892953932e-11,
          "token": "at"
        },
        {
          "prob": 2.289734845645553e-11,
          "token": ".at"
        },
        {
          "prob": 1.2256067444099483e-11,
          "token": " tại"
        }
      ],
      [
        {
          "prob": 0.9999994039539004,
          "token": " Sk"
        },
        {
          "prob": 5.043471815847051e-07,
          "token": "Sk"
        },
        {
          "prob": 1.9555681087850496e-08,
          "token": " SK"
        },
        {
          "prob": 1.7257827987960214e-08,
          "token": "_sk"
        },
        {
          "prob": 2.7894680928689246e-10,
          "token": " Ski"
        }
      ],
      [
        {
          "prob": 0.9999996423722521,
          "token": "ol"
        },
        {
          "prob": 3.4663274126619643e-07,
          "token": "olk"
        },
        {
          "prob": 9.237449661970594e-09,
          "token": "olt"
        },
        {
          "prob": 8.152020714470167e-09,
          "token": "ok"
        },
        {
          "prob": 7.194133030325383e-09,
          "token": "ол"
        }
      ],
      [
        {
          "prob": 0.9999756818971167,
          "token": "tech"
        },
        {
          "prob": 1.4738847809582182e-05,
          "token": "Tech"
        },
        {
          "prob": 3.2886814721554065e-06,
          "token": " tech"
        },
        {
          "prob": 2.260275517170922e-06,
          "token": "tek"
        },
        {
          "prob": 1.0676785542909426e-06,
          "token": "te"
        }
      ],
      [
        {
          "prob": 0.9999998807907247,
          "token": "."
        },
        {
          "prob": 1.6373771305908126e-07,
          "token": " during"
        },
        {
          "prob": 2.8453348089834e-08,
          "token": ","
        },
        {
          "prob": 4.363462252943702e-09,
          "token": ".\n\n"
        },
        {
          "prob": 1.2501528663867426e-09,
          "token": "。"
        }
      ],
      [
        {
          "prob": 0.9999556561097608,
          "token": ""
        },
        {
          "prob": 3.5355949785571226e-05,
          "token": " During"
        },
        {
          "prob": 7.811146733447158e-07,
          "token": ""
        },
        {
          "prob": 5.0432553781622e-07,
          "token": "<tool_call>"
        },
        {
          "prob": 3.927691237741795e-07,
          "token": " However"
        }
      ]
    ],
    "language_consistency_score": 0.6384158242248335,
    "feedback": "Feedback: The response is completely correct, accurate, and factual. It provides the exact minimum and maximum credit requirements for maintaining full-time student status at Skoltech, which aligns perfectly with the reference answer.",
    "score": 5
  },
  {
    "question": "Is the Introduction Week (IW) course at Skoltech mandatory for all students?\n",
    "true_answer": "Yes, IW is mandatory and students are required to be present in class every day. \n",
    "source_doc": "We bet your first impression from IW was that it’s an optional class because it doesn’t have any textbook learning. Well, this course sets the foundation to your entire Skoltech curriculum and is definitely not an optional class. In fact:\n\n- You must be present in class at all times, every day.",
    "context": "Sim: 3.89 - Skoltech will provide you with the resources, opportunities and skills to succeed. Although your classroom work will begin a bit later, your actual Skoltech journey is starting right now with this Orientation course. Orientation is mandatory for every incoming student. You can’t bypass it, sorry. We do ask you to take this seriously, as the information you’ll learn in the course will serve as the foundation to your time at Skoltech.\nSim: 0.85 - IW ground rules. We bet your first impression from IW was that it’s an optional class because it doesn’t have any textbook learning. Well, this course sets the foundation to your entire Skoltech curriculum and is definitely not an optional class. In fact:",
    "generated_answer": "No, the IW course is not explicitly stated to be mandatory for all students in the given context.",
    "logprobs": [
      [
        {
          "prob": 0.8515340143348354,
          "token": "No"
        },
        {
          "prob": 0.14797442585814297,
          "token": "Yes"
        },
        {
          "prob": 0.0004709700487078178,
          "token": "The"
        },
        {
          "prob": 1.4222063141257993e-05,
          "token": "Based"
        },
        {
          "prob": 2.1810240214940986e-06,
          "token": " Yes"
        }
      ],
      [
        {
          "prob": 0.9990886418330229,
          "token": ","
        },
        {
          "prob": 0.0009110509701065104,
          "token": "."
        },
        {
          "prob": 1.1243262173382379e-07,
          "token": ""
        },
        {
          "prob": 6.406217680340148e-08,
          "token": "，"
        },
        {
          "prob": 3.650152805745391e-08,
          "token": "。"
        }
      ],
      [
        {
          "prob": 0.9801012285259304,
          "token": " the"
        },
        {
          "prob": 0.009608572214867273,
          "token": " based"
        },
        {
          "prob": 0.007483163565136774,
          "token": " IW"
        },
        {
          "prob": 0.0014735222734380713,
          "token": " but"
        },
        {
          "prob": 0.0006960426366910446,
          "token": " according"
        }
      ],
      [
        {
          "prob": 0.7319169110806214,
          "token": " IW"
        },
        {
          "prob": 0.23761863816521275,
          "token": " Introduction"
        },
        {
          "prob": 0.009213472264245483,
          "token": " Information"
        },
        {
          "prob": 0.008130860735245717,
          "token": " Orientation"
        },
        {
          "prob": 0.004931616325780133,
          "token": " introduction"
        }
      ],
      [
        {
          "prob": 0.8656406884416665,
          "token": " course"
        },
        {
          "prob": 0.13275028918492515,
          "token": " ground"
        },
        {
          "prob": 0.001301438351361641,
          "token": " ("
        },
        {
          "prob": 0.00025626840594160523,
          "token": " Ground"
        },
        {
          "prob": 1.6382691086699135e-05,
          "token": " grounding"
        }
      ],
      [
        {
          "prob": 0.49577762428400585,
          "token": " is"
        },
        {
          "prob": 0.49577762428400585,
          "token": " at"
        },
        {
          "prob": 0.0070718884211523935,
          "token": ","
        },
        {
          "prob": 0.0009570760224943809,
          "token": " does"
        },
        {
          "prob": 0.0003107170921523162,
          "token": " mentioned"
        }
      ],
      [
        {
          "prob": 0.977237309398542,
          "token": " not"
        },
        {
          "prob": 0.020281913490932633,
          "token": " mandatory"
        },
        {
          "prob": 0.002137697444908266,
          "token": " described"
        },
        {
          "prob": 0.00010642973958909839,
          "token": " explicitly"
        },
        {
          "prob": 9.392391553026442e-05,
          "token": " definitely"
        }
      ],
      [
        {
          "prob": 0.8766432475887069,
          "token": " explicitly"
        },
        {
          "prob": 0.07195925548286318,
          "token": " mandatory"
        },
        {
          "prob": 0.026472330694148755,
          "token": " mentioned"
        },
        {
          "prob": 0.0125046435930152,
          "token": " specifically"
        },
        {
          "prob": 0.005212710983544236,
          "token": " described"
        }
      ],
      [
        {
          "prob": 0.9517853759493422,
          "token": " stated"
        },
        {
          "prob": 0.04738659828805764,
          "token": " mentioned"
        },
        {
          "prob": 0.0005965093818540513,
          "token": " described"
        },
        {
          "prob": 7.124288607377543e-05,
          "token": " mandatory"
        },
        {
          "prob": 6.287162629129403e-05,
          "token": " said"
        }
      ],
      [
        {
          "prob": 0.9148934771772459,
          "token": " to"
        },
        {
          "prob": 0.08509835833825936,
          "token": " as"
        },
        {
          "prob": 8.178945757615064e-06,
          "token": " in"
        },
        {
          "prob": 4.8633789221574495e-08,
          "token": " by"
        },
        {
          "prob": 7.939247844053726e-09,
          "token": " for"
        }
      ],
      [
        {
          "prob": 0.9999998807907247,
          "token": " be"
        },
        {
          "prob": 6.82560337633487e-08,
          "token": " require"
        },
        {
          "prob": 1.7257827987960214e-08,
          "token": " being"
        },
        {
          "prob": 6.34880011604368e-09,
          "token": " быть"
        },
        {
          "prob": 6.34880011604368e-09,
          "token": " mandatory"
        }
      ],
      [
        {
          "prob": 0.9999861719135179,
          "token": " mandatory"
        },
        {
          "prob": 7.889219494052938e-06,
          "token": "mandatory"
        },
        {
          "prob": 2.561254574275878e-06,
          "token": " compulsory"
        },
        {
          "prob": 1.3709407822277047e-06,
          "token": " for"
        },
        {
          "prob": 1.2098509939428517e-06,
          "token": " mandated"
        }
      ],
      [
        {
          "prob": 0.9279279685218584,
          "token": " for"
        },
        {
          "prob": 0.04619881148821099,
          "token": " in"
        },
        {
          "prob": 0.024728441833059354,
          "token": ","
        },
        {
          "prob": 0.0009588259715915907,
          "token": "."
        },
        {
          "prob": 0.00014704065496901994,
          "token": ";"
        }
      ],
      [
        {
          "prob": 0.9999994039539004,
          "token": " all"
        },
        {
          "prob": 1.6373755690670415e-07,
          "token": "所有"
        },
        {
          "prob": 1.4449788680693535e-07,
          "token": " everyone"
        },
        {
          "prob": 1.4449788680693535e-07,
          "token": " Sk"
        },
        {
          "prob": 6.023573837886479e-08,
          "token": "所有的"
        }
      ],
      [
        {
          "prob": 0.9996430955916169,
          "token": " students"
        },
        {
          "prob": 0.0002959391573699207,
          "token": " Sk"
        },
        {
          "prob": 5.827387523622869e-05,
          "token": " incoming"
        },
        {
          "prob": 1.5529461733368939e-06,
          "token": "students"
        },
        {
          "prob": 3.92646282773028e-07,
          "token": " Students"
        }
      ],
      [
        {
          "prob": 0.9424046887131986,
          "token": " in"
        },
        {
          "prob": 0.046919568589838666,
          "token": ","
        },
        {
          "prob": 0.008153398458849905,
          "token": " based"
        },
        {
          "prob": 0.0023359877691729795,
          "token": "."
        },
        {
          "prob": 0.00014933470188825668,
          "token": ";"
        }
      ],
      [
        {
          "prob": 0.9999883176260755,
          "token": " the"
        },
        {
          "prob": 6.962225046689487e-06,
          "token": " this"
        },
        {
          "prob": 3.7266105241617084e-06,
          "token": " both"
        },
        {
          "prob": 8.31519203067026e-07,
          "token": " either"
        },
        {
          "prob": 2.1024097920735177e-07,
          "token": " these"
        }
      ],
      [
        {
          "prob": 0.7766114427508662,
          "token": " given"
        },
        {
          "prob": 0.2225029036446361,
          "token": " provided"
        },
        {
          "prob": 0.00048672306747062923,
          "token": " documents"
        },
        {
          "prob": 0.0002605240843874739,
          "token": " document"
        },
        {
          "prob": 6.587080419393056e-05,
          "token": " second"
        }
      ],
      [
        {
          "prob": 0.5521811569523444,
          "token": " context"
        },
        {
          "prob": 0.3349148014071906,
          "token": " documents"
        },
        {
          "prob": 0.035299756154549576,
          "token": " texts"
        },
        {
          "prob": 0.03115192546838151,
          "token": " text"
        },
        {
          "prob": 0.027491477735392855,
          "token": " contexts"
        }
      ],
      [
        {
          "prob": 0.9626223649982091,
          "token": "."
        },
        {
          "prob": 0.03732492131245829,
          "token": ","
        },
        {
          "prob": 4.952195157307967e-05,
          "token": ";"
        },
        {
          "prob": 1.3197153077572828e-06,
          "token": " documents"
        },
        {
          "prob": 1.1646446713892781e-06,
          "token": " snippets"
        }
      ],
      [
        {
          "prob": 0.6733154880460964,
          "token": ""
        },
        {
          "prob": 0.3180517065167888,
          "token": " However"
        },
        {
          "prob": 0.008475791895352944,
          "token": " The"
        },
        {
          "prob": 5.710943656616629e-05,
          "token": " Only"
        },
        {
          "prob": 2.2364376695652452e-05,
          "token": " however"
        }
      ]
    ],
    "language_consistency_score": 0.6269047702578436,
    "feedback": "Feedback: The response is completely incorrect, as it states that the IW course is not explicitly stated to be mandatory, which contradicts the reference answer that clearly indicates IW is mandatory for all students.",
    "score": 1
  },
  {
    "question": "Is the Innovation Workshop (IW) course at Skoltech mandatory for all students?\n",
    "true_answer": "Yes, the Innovation Workshop (IW) course is mandatory for all Skoltech students. \n",
    "source_doc": "We bet your first impression from IW was that it’s an optional class because it doesn’t have any textbook learning. Well, this course sets the foundation to your entire Skoltech curriculum and is definitely not an optional class. In fact:\n\n- You must be present in class at all times, every day.",
    "context": "Sim: 2.82 - Skoltech will provide you with the resources, opportunities and skills to succeed. Although your classroom work will begin a bit later, your actual Skoltech journey is starting right now with this Orientation course. Orientation is mandatory for every incoming student. You can’t bypass it, sorry. We do ask you to take this seriously, as the information you’ll learn in the course will serve as the foundation to your time at Skoltech.\nSim: 2.15 - Innovation Workshop is our flagship course that was designed by MIT specifically for Skoltech. There is a long history of IW development and even a book written about it. This class doesn’t feel like a class at all, which is one of the reasons why students love it. They’ve described it as useful, exciting and even turbulent\\!\nSim: 2.12 - As you now know, your curriculum at Skoltech will comprise compulsory and elective courses in various disciplines. While you will certainly dive deep into your subject area studies throughout your studies, you will also get practical training in applying your knowledge. In this section, we will talk about a few compulsory courses within your Master’s program curriculum that will teach you about entrepreneurship, innovation, industrial application and your required research component.   \nSim: 1.73 - IW ground rules. We bet your first impression from IW was that it’s an optional class because it doesn’t have any textbook learning. Well, this course sets the foundation to your entire Skoltech curriculum and is definitely not an optional class. In fact:",
    "generated_answer": "Yes, the Innovation Workshop (IW) course at Skoltech is mandatory for all students.",
    "logprobs": [
      [
        {
          "prob": 0.9932977391440425,
          "token": "Yes"
        },
        {
          "prob": 0.006692787436516535,
          "token": "No"
        },
        {
          "prob": 7.8364521524151e-06,
          "token": " Yes"
        },
        {
          "prob": 8.259559801807043e-07,
          "token": "yes"
        },
        {
          "prob": 5.009676255525974e-07,
          "token": " yes"
        }
      ],
      [
        {
          "prob": 0.9986749586521727,
          "token": ","
        },
        {
          "prob": 0.0013250221745998098,
          "token": "."
        },
        {
          "prob": 6.340389675966825e-09,
          "token": ".,"
        },
        {
          "prob": 5.59537425022007e-09,
          "token": "。"
        },
        {
          "prob": 3.1881481457170617e-09,
          "token": "，"
        }
      ],
      [
        {
          "prob": 0.9999945164027223,
          "token": " the"
        },
        {
          "prob": 1.7603362394025924e-06,
          "token": " it"
        },
        {
          "prob": 1.5534912787802026e-06,
          "token": " despite"
        },
        {
          "prob": 1.370951241715711e-06,
          "token": " Innovation"
        },
        {
          "prob": 3.466307578234157e-07,
          "token": " although"
        }
      ],
      [
        {
          "prob": 0.9999974966112362,
          "token": " Innovation"
        },
        {
          "prob": 1.209863685851439e-06,
          "token": " innovation"
        },
        {
          "prob": 1.0677009553134769e-06,
          "token": " Innov"
        },
        {
          "prob": 1.1253496007565217e-07,
          "token": " course"
        },
        {
          "prob": 5.315775115378354e-08,
          "token": " IW"
        }
      ],
      [
        {
          "prob": 0.9999996423722521,
          "token": " Workshop"
        },
        {
          "prob": 2.699578503363014e-07,
          "token": " workshop"
        },
        {
          "prob": 4.139937718785167e-08,
          "token": " Workplace"
        },
        {
          "prob": 2.510999155743982e-08,
          "token": " Work"
        },
        {
          "prob": 6.34880011604368e-09,
          "token": " Workout"
        }
      ],
      [
        {
          "prob": 0.9981197966815452,
          "token": " ("
        },
        {
          "prob": 0.0017004164688213977,
          "token": " course"
        },
        {
          "prob": 0.00017922266270600367,
          "token": " is"
        },
        {
          "prob": 4.442485652904472e-07,
          "token": " at"
        },
        {
          "prob": 7.719875144022193e-08,
          "token": "course"
        }
      ],
      [
        {
          "prob": 0.9998058457769751,
          "token": "IW"
        },
        {
          "prob": 0.0001584304995332353,
          "token": " IW"
        },
        {
          "prob": 3.535062273324653e-05,
          "token": "_IW"
        },
        {
          "prob": 1.637058610574576e-07,
          "token": "I"
        },
        {
          "prob": 5.314751171332679e-08,
          "token": "IQ"
        }
      ],
      [
        {
          "prob": 1.0,
          "token": ")"
        },
        {
          "prob": 1.917171513758312e-10,
          "token": "）"
        },
        {
          "prob": 4.8473687062702556e-11,
          "token": "]"
        },
        {
          "prob": 8.423463754468647e-12,
          "token": "),"
        },
        {
          "prob": 5.789356328730652e-12,
          "token": "}"
        }
      ],
      [
        {
          "prob": 0.9998906970290482,
          "token": " course"
        },
        {
          "prob": 0.00010889682620790966,
          "token": " is"
        },
        {
          "prob": 2.3821084012810764e-07,
          "token": " class"
        },
        {
          "prob": 7.733581075223682e-08,
          "token": "course"
        },
        {
          "prob": 6.0229189973304e-08,
          "token": " at"
        }
      ],
      [
        {
          "prob": 0.9984987894978749,
          "token": " at"
        },
        {
          "prob": 0.001501181950907551,
          "token": " is"
        },
        {
          "prob": 6.681536253775855e-10,
          "token": "at"
        },
        {
          "prob": 6.681536253775855e-10,
          "token": ","
        },
        {
          "prob": 1.7983110866054413e-10,
          "token": " for"
        }
      ],
      [
        {
          "prob": 0.9999998807907247,
          "token": " Sk"
        },
        {
          "prob": 1.1253517471925912e-07,
          "token": "Sk"
        },
        {
          "prob": 1.9555681087850496e-08,
          "token": "_sk"
        },
        {
          "prob": 2.335593038799337e-09,
          "token": " SK"
        },
        {
          "prob": 4.895668966831769e-10,
          "token": " Ski"
        }
      ],
      [
        {
          "prob": 0.9999997615814777,
          "token": "ol"
        },
        {
          "prob": 5.3157852544244216e-08,
          "token": "ok"
        },
        {
          "prob": 3.6534822137210456e-08,
          "token": "olt"
        },
        {
          "prob": 3.2241867372567335e-08,
          "token": "ол"
        },
        {
          "prob": 2.215948977336598e-08,
          "token": "oll"
        }
      ],
      [
        {
          "prob": 0.999911792908844,
          "token": "tech"
        },
        {
          "prob": 5.828954929586764e-05,
          "token": "Tech"
        },
        {
          "prob": 1.4737906083608018e-05,
          "token": " tech"
        },
        {
          "prob": 6.143673295845014e-06,
          "token": "te"
        },
        {
          "prob": 1.8737144918230112e-06,
          "token": "ten"
        }
      ],
      [
        {
          "prob": 1.0,
          "token": " is"
        },
        {
          "prob": 4.691164021834418e-08,
          "token": ","
        },
        {
          "prob": 1.2501528663867426e-09,
          "token": " was"
        },
        {
          "prob": 1.917171513758312e-10,
          "token": " for"
        },
        {
          "prob": 1.917171513758312e-10,
          "token": "is"
        }
      ],
      [
        {
          "prob": 0.9982557970276094,
          "token": " mandatory"
        },
        {
          "prob": 0.0017006483796569397,
          "token": " not"
        },
        {
          "prob": 2.7488407773460636e-05,
          "token": " compulsory"
        },
        {
          "prob": 5.412788423368124e-06,
          "token": "mandatory"
        },
        {
          "prob": 5.412788423368124e-06,
          "token": " definitely"
        }
      ],
      [
        {
          "prob": 1.0,
          "token": " for"
        },
        {
          "prob": 6.691586091292782e-10,
          "token": "\tfor"
        },
        {
          "prob": 4.058652126475693e-10,
          "token": ","
        },
        {
          "prob": 3.1608814543136926e-10,
          "token": " and"
        },
        {
          "prob": 1.493094676197164e-10,
          "token": "."
        }
      ],
      [
        {
          "prob": 0.9999998807907247,
          "token": " all"
        },
        {
          "prob": 6.82560337633487e-08,
          "token": "所有"
        },
        {
          "prob": 8.152020714470167e-09,
          "token": "所有的"
        },
        {
          "prob": 3.581747930283181e-10,
          "token": "all"
        },
        {
          "prob": 2.7894680928689246e-10,
          "token": " students"
        }
      ],
      [
        {
          "prob": 0.9999963045256735,
          "token": " students"
        },
        {
          "prob": 2.902309337197794e-06,
          "token": "students"
        },
        {
          "prob": 7.338187197174319e-07,
          "token": " incoming"
        },
        {
          "prob": 5.315764976351624e-08,
          "token": "学生"
        },
        {
          "prob": 4.139921926206193e-08,
          "token": "_students"
        }
      ],
      [
        {
          "prob": 0.9999437363807097,
          "token": "."
        },
        {
          "prob": 4.0063043110911196e-05,
          "token": ","
        },
        {
          "prob": 1.3006565795841255e-05,
          "token": " as"
        },
        {
          "prob": 1.3708819490945362e-06,
          "token": " despite"
        },
        {
          "prob": 6.475587805086693e-07,
          "token": " based"
        }
      ],
      [
        {
          "prob": 0.9999988079084972,
          "token": ""
        },
        {
          "prob": 2.53601689161434e-07,
          "token": ""
        },
        {
          "prob": 1.3574320241537807e-07,
          "token": "<tool_call>"
        },
        {
          "prob": 7.265803114446648e-08,
          "token": " It"
        },
        {
          "prob": 6.412048743288674e-08,
          "token": " However"
        }
      ]
    ],
    "language_consistency_score": 0.8047172921437127,
    "feedback": "Feedback: The response is completely correct, accurate, and factual. It matches the reference answer by stating that the Innovation Workshop (IW) course is mandatory for all Skoltech students.",
    "score": 5
  },
  {
    "question": "What is the minimum number of credits a Skoltech student must be registered for each term to maintain full-time status?\n",
    "true_answer": "12 credits \n",
    "source_doc": "In this section, we would like to cover the most critical academic policies and guidelines that regulate the students’ eligibility for their degree. * Full-time Status requirement  \n  1. You must be registered for a minimum of 12 credits and a maximum of 18 credits per term. During Term 1, it’s best to take only 12 credits for a smooth introduction to Skoltech coursework. 2.",
    "context": "Sim: 6.09 -   1. You must be registered for a minimum of 12 credits and a maximum of 18 credits per term. During Term 1, it’s best to take only 12 credits for a smooth introduction to Skoltech coursework.   ",
    "generated_answer": "A Skoltech student must be registered for a minimum of 12 credits each term to maintain full-time status.",
    "logprobs": [
      [
        {
          "prob": 0.38706909865182565,
          "token": "A"
        },
        {
          "prob": 0.3415873010066365,
          "token": "1"
        },
        {
          "prob": 0.2660284575112162,
          "token": "The"
        },
        {
          "prob": 0.004872481161902399,
          "token": "According"
        },
        {
          "prob": 0.00027488657695941293,
          "token": "To"
        }
      ],
      [
        {
          "prob": 0.9999032114269176,
          "token": " Sk"
        },
        {
          "prob": 9.610239492660866e-05,
          "token": " minimum"
        },
        {
          "prob": 3.0587285707099816e-07,
          "token": " student"
        },
        {
          "prob": 2.3821402060718123e-07,
          "token": "Sk"
        },
        {
          "prob": 1.444841070716725e-07,
          "token": " sk"
        }
      ],
      [
        {
          "prob": 0.9999996423722521,
          "token": "ol"
        },
        {
          "prob": 2.382369667501818e-07,
          "token": "olt"
        },
        {
          "prob": 6.023573837886479e-08,
          "token": "ол"
        },
        {
          "prob": 2.215948977336598e-08,
          "token": "oll"
        },
        {
          "prob": 1.0467401794744658e-08,
          "token": "col"
        }
      ],
      [
        {
          "prob": 0.9999200169669461,
          "token": "tech"
        },
        {
          "prob": 4.006208794491641e-05,
          "token": " tech"
        },
        {
          "prob": 2.1443690422849376e-05,
          "token": "Tech"
        },
        {
          "prob": 6.143720168531264e-06,
          "token": "-tech"
        },
        {
          "prob": 4.784734078223732e-06,
          "token": "tek"
        }
      ],
      [
        {
          "prob": 0.9999769931373511,
          "token": " student"
        },
        {
          "prob": 2.144491747576362e-05,
          "token": "学生"
        },
        {
          "prob": 1.5534646115638898e-06,
          "token": "student"
        },
        {
          "prob": 6.023435970800357e-08,
          "token": ".student"
        },
        {
          "prob": 3.6533985931063466e-08,
          "token": " students"
        }
      ],
      [
        {
          "prob": 0.9999917746265009,
          "token": " must"
        },
        {
          "prob": 7.889257112872668e-06,
          "token": "必须"
        },
        {
          "prob": 1.8553754377325157e-07,
          "token": "must"
        },
        {
          "prob": 5.3157446983561815e-08,
          "token": "须"
        },
        {
          "prob": 6.348751678727569e-09,
          "token": " Must"
        }
      ],
      [
        {
          "prob": 0.999860067878919,
          "token": " be"
        },
        {
          "prob": 0.000139822025552885,
          "token": " register"
        },
        {
          "prob": 5.315045154881207e-08,
          "token": "注册"
        },
        {
          "prob": 3.2237378441925346e-08,
          "token": "register"
        },
        {
          "prob": 1.3438538686441405e-08,
          "token": "_be"
        }
      ],
      [
        {
          "prob": 0.999579368203004,
          "token": " registered"
        },
        {
          "prob": 0.0002611487027950286,
          "token": "注册"
        },
        {
          "prob": 0.00015839469498936715,
          "token": "registered"
        },
        {
          "prob": 1.0672550597746642e-06,
          "token": "_registered"
        },
        {
          "prob": 2.8441356846848437e-08,
          "token": "Registered"
        }
      ],
      [
        {
          "prob": 1.0,
          "token": " for"
        },
        {
          "prob": 2.646573638909117e-09,
          "token": "for"
        },
        {
          "prob": 1.6918979226151304e-10,
          "token": "\tfor"
        },
        {
          "prob": 5.109089028063325e-12,
          "token": " для"
        },
        {
          "prob": 3.97896253583724e-12,
          "token": " für"
        }
      ],
      [
        {
          "prob": 0.9997965511486372,
          "token": " a"
        },
        {
          "prob": 0.00020342704214340812,
          "token": " at"
        },
        {
          "prob": 1.8185905002640507e-09,
          "token": "至少"
        },
        {
          "prob": 3.1602364275240186e-10,
          "token": "a"
        },
        {
          "prob": 5.4916674624659555e-11,
          "token": "at"
        }
      ],
      [
        {
          "prob": 0.9999985694905718,
          "token": " minimum"
        },
        {
          "prob": 1.3709577789362383e-06,
          "token": "minimum"
        },
        {
          "prob": 3.1608754254165217e-10,
          "token": "_minimum"
        },
        {
          "prob": 2.789462772385846e-10,
          "token": " Minimum"
        },
        {
          "prob": 1.6918946955790182e-10,
          "token": " mínimo"
        }
      ],
      [
        {
          "prob": 1.0,
          "token": " of"
        },
        {
          "prob": 2.5946094982764667e-11,
          "token": " của"
        },
        {
          "prob": 2.2447770550209742e-13,
          "token": "_of"
        },
        {
          "prob": 1.9810087980489796e-13,
          "token": "of"
        },
        {
          "prob": 1.2015425731771786e-13,
          "token": "ของ"
        }
      ],
      [
        {
          "prob": 1.0,
          "token": " "
        },
        {
          "prob": 3.775134544279098e-11,
          "token": "1"
        },
        {
          "prob": 3.900837610180715e-14,
          "token": " at"
        },
        {
          "prob": 2.493722053335376e-15,
          "token": ""
        },
        {
          "prob": 1.039538011670222e-15,
          "token": " a"
        }
      ],
      [
        {
          "prob": 1.0,
          "token": "1"
        },
        {
          "prob": 2.7346982915918745e-12,
          "token": "１"
        },
        {
          "prob": 8.878265478459658e-13,
          "token": " twelve"
        },
        {
          "prob": 2.222630272345391e-14,
          "token": "十二"
        },
        {
          "prob": 1.9614643309355633e-14,
          "token": "9"
        }
      ],
      [
        {
          "prob": 1.0,
          "token": "2"
        },
        {
          "prob": 2.7346982915918745e-12,
          "token": "２"
        },
        {
          "prob": 1.0603575991523846e-13,
          "token": "1"
        },
        {
          "prob": 5.008774637843506e-14,
          "token": "0"
        },
        {
          "prob": 2.6810038677818034e-14,
          "token": "3"
        }
      ],
      [
        {
          "prob": 0.9999244270256572,
          "token": " credits"
        },
        {
          "prob": 7.484619074298232e-05,
          "token": "credits"
        },
        {
          "prob": 6.475464294229121e-07,
          "token": " credit"
        },
        {
          "prob": 4.6908061280758204e-08,
          "token": "Credits"
        },
        {
          "prob": 2.845117735445891e-08,
          "token": " Credits"
        }
      ],
      [
        {
          "prob": 0.8806734058907798,
          "token": " each"
        },
        {
          "prob": 0.11918617416910622,
          "token": " per"
        },
        {
          "prob": 0.00013955266241467396,
          "token": " to"
        },
        {
          "prob": 5.703198349179074e-07,
          "token": "each"
        },
        {
          "prob": 3.645936202040493e-08,
          "token": "每"
        }
      ],
      [
        {
          "prob": 1.0,
          "token": " term"
        },
        {
          "prob": 5.3157852544244216e-08,
          "token": "term"
        },
        {
          "prob": 2.9989608248573072e-09,
          "token": "(term"
        },
        {
          "prob": 1.4166087866431961e-09,
          "token": "_term"
        },
        {
          "prob": 6.691586091292782e-10,
          "token": "-term"
        }
      ],
      [
        {
          "prob": 0.9999988079084972,
          "token": " to"
        },
        {
          "prob": 1.2098659934854867e-06,
          "token": "."
        },
        {
          "prob": 2.845329381943118e-08,
          "token": " for"
        },
        {
          "prob": 2.2897304783270907e-11,
          "token": ","
        },
        {
          "prob": 1.2256044067528294e-11,
          "token": "to"
        }
      ],
      [
        {
          "prob": 0.9999983310727032,
          "token": " maintain"
        },
        {
          "prob": 7.338201193668986e-07,
          "token": " maintained"
        },
        {
          "prob": 4.450844011100084e-07,
          "token": "maint"
        },
        {
          "prob": 2.6995733543305574e-07,
          "token": " maintaining"
        },
        {
          "prob": 9.931175369924415e-08,
          "token": " maintains"
        }
      ],
      [
        {
          "prob": 1.0,
          "token": " full"
        },
        {
          "prob": 2.510999155743982e-08,
          "token": "full"
        },
        {
          "prob": 4.363462252943702e-09,
          "token": "_full"
        },
        {
          "prob": 3.398267819495071e-09,
          "token": "满"
        },
        {
          "prob": 2.061153622438558e-09,
          "token": "(full"
        }
      ],
      [
        {
          "prob": 1.0,
          "token": "-time"
        },
        {
          "prob": 4.944450501938644e-09,
          "token": "-Time"
        },
        {
          "prob": 2.061153622438558e-09,
          "token": "-term"
        },
        {
          "prob": 2.172439935079017e-10,
          "token": "time"
        },
        {
          "prob": 1.162823303022097e-10,
          "token": "_time"
        }
      ],
      [
        {
          "prob": 0.9999983310727032,
          "token": " status"
        },
        {
          "prob": 1.370956471489639e-06,
          "token": "status"
        },
        {
          "prob": 2.1024298423113373e-07,
          "token": ".status"
        },
        {
          "prob": 2.2159447507533765e-08,
          "token": "_status"
        },
        {
          "prob": 1.955564378838448e-08,
          "token": "(status"
        }
      ],
      [
        {
          "prob": 1.0,
          "token": "."
        },
        {
          "prob": 3.850741922767617e-09,
          "token": " during"
        },
        {
          "prob": 1.8189616875530459e-09,
          "token": " according"
        },
        {
          "prob": 1.4166087866431961e-09,
          "token": ","
        },
        {
          "prob": 9.736200313009565e-10,
          "token": ".\n\n"
        }
      ],
      [
        {
          "prob": 0.999998927117538,
          "token": ""
        },
        {
          "prob": 2.6995759288455584e-07,
          "token": ""
        },
        {
          "prob": 1.4449788680693535e-07,
          "token": "<tool_call>"
        },
        {
          "prob": 1.5229950695859287e-08,
          "token": " bụ"
        },
        {
          "prob": 3.398261337819773e-09,
          "token": "ícul"
        }
      ]
    ],
    "language_consistency_score": 0.3527707308350325,
    "feedback": "Feedback: The response is completely correct, accurate, and factual. It provides the exact minimum number of credits required for a Skoltech student to maintain full-time status, which matches the reference answer.",
    "score": 5
  },
  {
    "question": "What is the maximum number of credits a Skoltech student can take per term?\n",
    "true_answer": "18 credits \n",
    "source_doc": "In this section, we would like to cover the most critical academic policies and guidelines that regulate the students’ eligibility for their degree. * Full-time Status requirement  \n  1. You must be registered for a minimum of 12 credits and a maximum of 18 credits per term. During Term 1, it’s best to take only 12 credits for a smooth introduction to Skoltech coursework. 2.",
    "context": "Sim: 6.58 -   1. You must be registered for a minimum of 12 credits and a maximum of 18 credits per term. During Term 1, it’s best to take only 12 credits for a smooth introduction to Skoltech coursework.   ",
    "generated_answer": "18 credits.",
    "logprobs": [
      [
        {
          "prob": 0.7146454291066631,
          "token": "1"
        },
        {
          "prob": 0.23201140876032347,
          "token": "The"
        },
        {
          "prob": 0.05176874279295379,
          "token": "A"
        },
        {
          "prob": 0.0015632802026951241,
          "token": "According"
        },
        {
          "prob": 4.390932357746731e-06,
          "token": "8"
        }
      ],
      [
        {
          "prob": 1.0,
          "token": "8"
        },
        {
          "prob": 1.026187963170189e-10,
          "token": "6"
        },
        {
          "prob": 5.4927883509546835e-11,
          "token": "2"
        },
        {
          "prob": 1.3750926572355787e-12,
          "token": ""
        },
        {
          "prob": 1.1399918530443554e-12,
          "token": "８"
        }
      ],
      [
        {
          "prob": 0.9775970763041402,
          "token": " credits"
        },
        {
          "prob": 0.01580138205014697,
          "token": "credits"
        },
        {
          "prob": 0.004527171754387611,
          "token": "Credits"
        },
        {
          "prob": 0.0014697574802169668,
          "token": ""
        },
        {
          "prob": 0.000540693560479765,
          "token": " Credits"
        }
      ],
      [
        {
          "prob": 0.9955483650602494,
          "token": "."
        },
        {
          "prob": 0.004068577841476542,
          "token": " per"
        },
        {
          "prob": 0.00037843668973876443,
          "token": ""
        },
        {
          "prob": 7.305550213622173e-07,
          "token": "。"
        },
        {
          "prob": 6.447125435197797e-07,
          "token": "_per"
        }
      ],
      [
        {
          "prob": 0.9999971389852362,
          "token": ""
        },
        {
          "prob": 9.422427859507568e-07,
          "token": ""
        },
        {
          "prob": 1.8553860543063036e-07,
          "token": "<tool_call>"
        },
        {
          "prob": 5.315775115378354e-08,
          "token": " bụ"
        },
        {
          "prob": 1.4307214629695401e-08,
          "token": "orado"
        }
      ]
    ],
    "language_consistency_score": 0.42652273103768135,
    "feedback": "Feedback: The response is completely correct, accurate, and factual. It matches the reference answer exactly, providing the correct number of credits a Skoltech student can take per term.",
    "score": 5
  },
  {
    "question": "How many credits are students required to take per term at Skoltech?\n",
    "true_answer": "Students are required to take a minimum of 12 credits and a maximum of 18 credits per term at Skoltech. \n",
    "source_doc": "In this section, we would like to cover the most critical academic policies and guidelines that regulate the students’ eligibility for their degree. * Full-time Status requirement  \n  1. You must be registered for a minimum of 12 credits and a maximum of 18 credits per term. During Term 1, it’s best to take only 12 credits for a smooth introduction to Skoltech coursework. 2.",
    "context": "Sim: 6.30 -   1. You must be registered for a minimum of 12 credits and a maximum of 18 credits per term. During Term 1, it’s best to take only 12 credits for a smooth introduction to Skoltech coursework.   \nSim: 1.44 - Most academic programs at Skoltech focus on preparing specialists who are ready to meet the needs of industry and interests of business. One of such programs is Industrial Immersion. What is industrial immersion? Industrial immersion is a compulsory educational element aimed at getting a real hands-on work experience in the industrial sector. Basically, this is your mandatory summer internship which grants you 12 credits upon successful completion.\nSim: 0.86 - Skoltech follows a term structure. We have two terms (first of them is divided to 1A and 1B) in the fall and two terms in the spring. In between there is a very short winter term. ",
    "generated_answer": "Students are required to take a minimum of 12 credits and a maximum of 18 credits per term at Skoltech.",
    "logprobs": [
      [
        {
          "prob": 0.9992778751476347,
          "token": "Students"
        },
        {
          "prob": 0.0003352205342766236,
          "token": "At"
        },
        {
          "prob": 0.00026107001459624914,
          "token": " Students"
        },
        {
          "prob": 5.140773391973081e-05,
          "token": "For"
        },
        {
          "prob": 1.2997910665502694e-05,
          "token": "You"
        }
      ],
      [
        {
          "prob": 0.6388214150156484,
          "token": " are"
        },
        {
          "prob": 0.3017578606349937,
          "token": " at"
        },
        {
          "prob": 0.059419645843670335,
          "token": " must"
        },
        {
          "prob": 4.1369758229216535e-07,
          "token": "须"
        },
        {
          "prob": 2.509202675091885e-07,
          "token": "必须"
        }
      ],
      [
        {
          "prob": 0.997814079557511,
          "token": " required"
        },
        {
          "prob": 0.002182709670910856,
          "token": " registered"
        },
        {
          "prob": 2.2553876733526432e-06,
          "token": "required"
        },
        {
          "prob": 5.032450127519698e-07,
          "token": "注册"
        },
        {
          "prob": 3.0523352958154485e-07,
          "token": "registered"
        }
      ],
      [
        {
          "prob": 1.0,
          "token": " to"
        },
        {
          "prob": 1.3176514270095466e-10,
          "token": "to"
        },
        {
          "prob": 3.0988191387218256e-12,
          "token": " for"
        },
        {
          "prob": 2.413362771833214e-12,
          "token": " by"
        },
        {
          "prob": 1.6586783589142312e-12,
          "token": "\tto"
        }
      ],
      [
        {
          "prob": 0.8516663692795216,
          "token": " take"
        },
        {
          "prob": 0.11526051446208803,
          "token": " register"
        },
        {
          "prob": 0.03302269028196154,
          "token": " be"
        },
        {
          "prob": 3.0112788542763992e-05,
          "token": "注册"
        },
        {
          "prob": 8.627458364338458e-06,
          "token": "register"
        }
      ],
      [
        {
          "prob": 0.9046477828806735,
          "token": " a"
        },
        {
          "prob": 0.0953491641611327,
          "token": " between"
        },
        {
          "prob": 1.8045320783737437e-06,
          "token": " "
        },
        {
          "prob": 8.524005971719839e-07,
          "token": "between"
        },
        {
          "prob": 2.44216859936264e-07,
          "token": " at"
        }
      ],
      [
        {
          "prob": 0.9999979734461775,
          "token": " minimum"
        },
        {
          "prob": 1.994729895832688e-06,
          "token": "minimum"
        },
        {
          "prob": 4.9444410711567335e-09,
          "token": " maximum"
        },
        {
          "prob": 4.363453930307876e-09,
          "token": " mínimo"
        },
        {
          "prob": 8.592150230932485e-10,
          "token": "_minimum"
        }
      ],
      [
        {
          "prob": 1.0,
          "token": " of"
        },
        {
          "prob": 4.508755242294825e-12,
          "token": " của"
        },
        {
          "prob": 3.2661313427874473e-13,
          "token": "of"
        },
        {
          "prob": 3.2661313427874473e-13,
          "token": " "
        },
        {
          "prob": 5.008774637843506e-14,
          "token": " or"
        }
      ],
      [
        {
          "prob": 1.0,
          "token": " "
        },
        {
          "prob": 1.917171513758312e-10,
          "token": "1"
        },
        {
          "prob": 2.389552736575778e-13,
          "token": " twelve"
        },
        {
          "prob": 3.664497806917865e-14,
          "token": " at"
        },
        {
          "prob": 9.265301443284929e-15,
          "token": " a"
        }
      ],
      [
        {
          "prob": 1.0,
          "token": "1"
        },
        {
          "prob": 8.423463754468647e-12,
          "token": " twelve"
        },
        {
          "prob": 4.508755242294825e-12,
          "token": "6"
        },
        {
          "prob": 4.235583571640497e-12,
          "token": "9"
        },
        {
          "prob": 2.5690112979751028e-12,
          "token": "１"
        }
      ],
      [
        {
          "prob": 1.0,
          "token": "2"
        },
        {
          "prob": 3.5114221133765118e-12,
          "token": "0"
        },
        {
          "prob": 2.7346982915918745e-12,
          "token": "２"
        },
        {
          "prob": 2.2447770550209742e-13,
          "token": "1"
        },
        {
          "prob": 3.037975385443128e-14,
          "token": "5"
        }
      ],
      [
        {
          "prob": 0.9819220286864889,
          "token": " credits"
        },
        {
          "prob": 0.017984530399775326,
          "token": " and"
        },
        {
          "prob": 6.486231342961535e-05,
          "token": "credits"
        },
        {
          "prob": 2.7038634977289896e-05,
          "token": " to"
        },
        {
          "prob": 1.3461743681880495e-06,
          "token": " credit"
        }
      ],
      [
        {
          "prob": 1.0,
          "token": " and"
        },
        {
          "prob": 1.522997974471263e-08,
          "token": "和"
        },
        {
          "prob": 9.056076989672867e-11,
          "token": " và"
        },
        {
          "prob": 7.05287985111216e-11,
          "token": " и"
        },
        {
          "prob": 3.331544542166412e-11,
          "token": ","
        }
      ],
      [
        {
          "prob": 1.0,
          "token": " a"
        },
        {
          "prob": 2.335593038799337e-09,
          "token": " maximum"
        },
        {
          "prob": 9.736200313009565e-10,
          "token": " up"
        },
        {
          "prob": 3.1608814543136926e-10,
          "token": "a"
        },
        {
          "prob": 2.7346982915918745e-12,
          "token": "maximum"
        }
      ],
      [
        {
          "prob": 0.9999977350285647,
          "token": " maximum"
        },
        {
          "prob": 2.2603250957489616e-06,
          "token": "maximum"
        },
        {
          "prob": 1.18610975280741e-08,
          "token": " máximo"
        },
        {
          "prob": 1.4166060846789406e-09,
          "token": " Maximum"
        },
        {
          "prob": 8.592150230932485e-10,
          "token": " max"
        }
      ],
      [
        {
          "prob": 1.0,
          "token": " of"
        },
        {
          "prob": 8.423463754468647e-12,
          "token": " của"
        },
        {
          "prob": 5.384940217754036e-13,
          "token": "of"
        },
        {
          "prob": 2.543665647376923e-13,
          "token": " or"
        },
        {
          "prob": 1.3615261080896538e-13,
          "token": "_of"
        }
      ],
      [
        {
          "prob": 1.0,
          "token": " "
        },
        {
          "prob": 4.5990553786523166e-10,
          "token": "1"
        },
        {
          "prob": 3.442477108469977e-14,
          "token": ""
        },
        {
          "prob": 3.008002974381331e-15,
          "token": "\n"
        },
        {
          "prob": 1.2539221950995622e-15,
          "token": "  "
        }
      ],
      [
        {
          "prob": 1.0,
          "token": "1"
        },
        {
          "prob": 8.25807328555592e-14,
          "token": "１"
        },
        {
          "prob": 3.628344178047045e-15,
          "token": "8"
        },
        {
          "prob": 2.067368194863644e-15,
          "token": "2"
        },
        {
          "prob": 7.144633303166281e-16,
          "token": "₁"
        }
      ],
      [
        {
          "prob": 1.0,
          "token": "8"
        },
        {
          "prob": 8.423463754468647e-12,
          "token": "6"
        },
        {
          "prob": 8.878265478459658e-13,
          "token": "2"
        },
        {
          "prob": 1.9810087980489796e-13,
          "token": "9"
        },
        {
          "prob": 1.9810087980489796e-13,
          "token": "7"
        }
      ],
      [
        {
          "prob": 0.9999337240286982,
          "token": " credits"
        },
        {
          "prob": 6.605216142043291e-05,
          "token": "credits"
        },
        {
          "prob": 1.1252766243660385e-07,
          "token": "Credits"
        },
        {
          "prob": 5.315430399318313e-08,
          "token": " credentials"
        },
        {
          "prob": 2.5108315340607866e-08,
          "token": " per"
        }
      ],
      [
        {
          "prob": 1.0,
          "token": " per"
        },
        {
          "prob": 2.335593038799337e-09,
          "token": "_per"
        },
        {
          "prob": 8.592166619174109e-10,
          "token": "per"
        },
        {
          "prob": 5.109089028063325e-12,
          "token": "-per"
        },
        {
          "prob": 3.5114221133765118e-12,
          "token": ".per"
        }
      ],
      [
        {
          "prob": 0.9999997615814777,
          "token": " term"
        },
        {
          "prob": 1.8553913626159784e-07,
          "token": "term"
        },
        {
          "prob": 1.186112015134383e-08,
          "token": "(term"
        },
        {
          "prob": 4.944450501938644e-09,
          "token": ".term"
        },
        {
          "prob": 3.850741922767617e-09,
          "token": "_term"
        }
      ],
      [
        {
          "prob": 1.0,
          "token": " at"
        },
        {
          "prob": 5.602796437537268e-09,
          "token": "."
        },
        {
          "prob": 7.05287985111216e-11,
          "token": ","
        },
        {
          "prob": 4.8473687062702556e-11,
          "token": "at"
        },
        {
          "prob": 2.289734845645553e-11,
          "token": ".at"
        }
      ],
      [
        {
          "prob": 0.9999994039539004,
          "token": " Sk"
        },
        {
          "prob": 5.043471815847051e-07,
          "token": "Sk"
        },
        {
          "prob": 2.215948977336598e-08,
          "token": "_sk"
        },
        {
          "prob": 1.3440409951135022e-08,
          "token": " SK"
        },
        {
          "prob": 4.895668966831769e-10,
          "token": " Ski"
        }
      ],
      [
        {
          "prob": 0.9999985694905718,
          "token": "ol"
        },
        {
          "prob": 1.3709577789362383e-06,
          "token": "olk"
        },
        {
          "prob": 2.5109943663977427e-08,
          "token": "olt"
        },
        {
          "prob": 8.152005165739432e-09,
          "token": "col"
        },
        {
          "prob": 5.602785751061334e-09,
          "token": "ол"
        }
      ],
      [
        {
          "prob": 0.9997855884695626,
          "token": "tech"
        },
        {
          "prob": 0.00020342471411898496,
          "token": "Tech"
        },
        {
          "prob": 6.9608109352402675e-06,
          "token": " tech"
        },
        {
          "prob": 1.2096075658296824e-06,
          "token": "techn"
        },
        {
          "prob": 8.313503115391858e-07,
          "token": "te"
        }
      ],
      [
        {
          "prob": 0.9999996423722521,
          "token": "."
        },
        {
          "prob": 3.059023205018258e-07,
          "token": ","
        },
        {
          "prob": 9.237449661970594e-09,
          "token": " during"
        },
        {
          "prob": 4.363462252943702e-09,
          "token": ".\n\n"
        },
        {
          "prob": 1.6052280551856116e-09,
          "token": "。"
        }
      ],
      [
        {
          "prob": 0.9999848606494245,
          "token": ""
        },
        {
          "prob": 1.1478724737934761e-05,
          "token": " During"
        },
        {
          "prob": 5.043399668920043e-07,
          "token": ""
        },
        {
          "prob": 2.5359806138611865e-07,
          "token": "<tool_call>"
        },
        {
          "prob": 4.4068735178453895e-08,
          "token": " bụ"
        }
      ]
    ],
    "language_consistency_score": 0.6735677890877713,
    "feedback": "Feedback: The response is completely correct, accurate, and factual. It matches the reference answer in terms of the minimum and maximum credit requirements per term at Skoltech.",
    "score": 5
  },
  {
    "question": "What is the name of the document that provides information about academic leave of absence at Skoltech?\n",
    "true_answer": "REGULATIONS ON ACADEMIC LEAVE OF ABSENCE \n",
    "source_doc": "The Independent Studies Period is mandatory to maintain full-time status. * Attendance Policy  \n  1. Students are expected to attend all educational curriculum elements full-time, unless the Course Instructor specifies otherwise. 2. Skoltech strongly advises you to focus on your course and research work, and avoid taking on jobs in addition to your studies. Academic Integrity   \n  3. Please ensure to clarify course collaboration policy, be aware of plagiarism. Review the Academic Integrity section above for more information. **Academic Leave and Return**   \nIn exceptional cases, you may request a leave of absence and temporarily stop your studies. Academic leave of absence may be granted on the following grounds:\n\n* for medical reasons;  \n* in case of call to military service;  \n* in other exceptional cases. You will need to apply for academic leave in written form, stating the reason for your request. Your application will be reviewed within 10 days of submission. Likewise, when you return from academic leave or wish to end it earlier, you will need to request reinstatement in written form. More information and instructions about this process can be found [here (links to an external site)](https://www.skoltech.ru/app/data/uploads/sites/2/2015/04/11.-REGULATIONS-ON-ACADEMIC-LEAVE-OF-ABSENCE.pdf)\n\nContact the [Education Department (links to an external site)](https://helpdesk.skoltech.ru/servicedesk/customer/portal/21)for support. **Withdrawal and Reinstatement** \n\nIf you wish to end (or resume) your education at Skoltech, please contact the [Education Department  (links to an external site)](https://helpdesk.skoltech.ru/servicedesk/customer/portal/21)\n\n What’s next? The [third part](https://skoltech.instructure.com/courses/3974/assignments/22741) of Education module tells about library resources and intellectual property management. ## “Education Process, Part 3” \\- Module 3.3\n",
    "context": "Sim: 1.48 - More information and instructions about this process can be found [here (links to an external site)](https://www.skoltech.ru/app/data/uploads/sites/2/2015/04/11.-REGULATIONS-ON-ACADEMIC-LEAVE-OF-ABSENCE.pdf)",
    "generated_answer": "The document is named \"REGULATIONS ON ACADEMIC LEAVE OF ABSENCE.\"",
    "logprobs": [
      [
        {
          "prob": 0.9992972785751018,
          "token": "The"
        },
        {
          "prob": 0.0005526957669719515,
          "token": "REG"
        },
        {
          "prob": 7.479923816682594e-05,
          "token": "Reg"
        },
        {
          "prob": 4.536803127132733e-05,
          "token": " REG"
        },
        {
          "prob": 2.7517101936861547e-05,
          "token": "1"
        }
      ],
      [
        {
          "prob": 0.9999249037905161,
          "token": " document"
        },
        {
          "prob": 3.1200534238362485e-05,
          "token": " name"
        },
        {
          "prob": 1.4738088801853288e-05,
          "token": " Regulations"
        },
        {
          "prob": 1.3006317717652238e-05,
          "token": "document"
        },
        {
          "prob": 1.1478035099859243e-05,
          "token": " regulations"
        }
      ],
      [
        {
          "prob": 0.9220120911782517,
          "token": " is"
        },
        {
          "prob": 0.04590427525734014,
          "token": " named"
        },
        {
          "prob": 0.02457078794937282,
          "token": " providing"
        },
        {
          "prob": 0.0029345628370999596,
          "token": " name"
        },
        {
          "prob": 0.0020168935758772205,
          "token": " regulating"
        }
      ],
      [
        {
          "prob": 0.5827048580916064,
          "token": " named"
        },
        {
          "prob": 0.24290752402054566,
          "token": " titled"
        },
        {
          "prob": 0.1669477369969816,
          "token": " called"
        },
        {
          "prob": 0.004449007023679773,
          "token": "名为"
        },
        {
          "prob": 0.001124885137599672,
          "token": " REG"
        }
      ],
      [
        {
          "prob": 0.9997018272905177,
          "token": " \""
        },
        {
          "prob": 0.0002959563738746832,
          "token": " REG"
        },
        {
          "prob": 1.5530365172624049e-06,
          "token": " Regulations"
        },
        {
          "prob": 2.3816586361373926e-07,
          "token": "REG"
        },
        {
          "prob": 2.3816586361373926e-07,
          "token": " \\\""
        }
      ],
      [
        {
          "prob": 0.9997057588680142,
          "token": "REG"
        },
        {
          "prob": 0.0002611815795713335,
          "token": " REG"
        },
        {
          "prob": 1.3003465158544677e-05,
          "token": "Reg"
        },
        {
          "prob": 1.0127108848116325e-05,
          "token": "(REG"
        },
        {
          "prob": 4.221607047929864e-06,
          "token": "\tREG"
        }
      ],
      [
        {
          "prob": 0.9999980926550052,
          "token": "UL"
        },
        {
          "prob": 9.422436845439301e-07,
          "token": "ULATION"
        },
        {
          "prob": 3.0590173704000945e-07,
          "token": "ULAR"
        },
        {
          "prob": 2.6995733543305574e-07,
          "token": "ulations"
        },
        {
          "prob": 1.6373740075447596e-07,
          "token": " UL"
        }
      ],
      [
        {
          "prob": 0.9999998807907247,
          "token": "ATIONS"
        },
        {
          "prob": 9.931194312156244e-08,
          "token": "AT"
        },
        {
          "prob": 2.215948977336598e-08,
          "token": "ATIVE"
        },
        {
          "prob": 1.186112015134383e-08,
          "token": "ATIONAL"
        },
        {
          "prob": 1.0467401794744658e-08,
          "token": "ATED"
        }
      ],
      [
        {
          "prob": 0.9997015890012473,
          "token": " ON"
        },
        {
          "prob": 0.00023049105572857674,
          "token": "ON"
        },
        {
          "prob": 5.827726536702264e-05,
          "token": "-"
        },
        {
          "prob": 6.142378579270178e-06,
          "token": "_ON"
        },
        {
          "prob": 8.312805447720322e-07,
          "token": " On"
        }
      ],
      [
        {
          "prob": 0.7247280195985961,
          "token": " A"
        },
        {
          "prob": 0.2666125547425638,
          "token": " AC"
        },
        {
          "prob": 0.00430938955827985,
          "token": "_ac"
        },
        {
          "prob": 0.002035611490062777,
          "token": " Academic"
        },
        {
