[
  {
    "question": "Is the Skoltech Orientation course part of the academic curriculum?\n",
    "true_answer": "No, the Orientation course is not part of the academic curriculum. \n",
    "source_doc": "\n### Video 1 \n\nHi there, and congratulations on your admission to Skoltech\\! It was a big challenge, but the fact that you\u2019ve made it means you have every bit of potential to succeed in your studies here. We are happy to have you onboard. My name is CyberBoris, and I will be your guide for this intro course. And here is what our course is for:   \nSkoltech will provide you with the resources, opportunities and skills to succeed. Although your classroom work will begin a bit later, your actual Skoltech journey is starting right now with this Orientation course. Orientation is mandatory for every incoming student. You can\u2019t bypass it, sorry. We do ask you to take this seriously, as the information you\u2019ll learn in the course will serve as the foundation to your time at Skoltech. Here\u2019s how it\u2019s going to work: I\u2019m gonna go through the main points and break them down for you. We\u2019ll also do a tour of the Skoltech campus, and explain the key locations throughout so you don\u2019t get lost when you get here for the first time. You can find the important information from the videos in the text below, along with links to resources from both Skoltech and other useful sources. For example, underneath this video you can find a link to STUDENT ACADEMIC INTEGRITY REGULATIONS, along with a description of the course, and links to the separate modules. Please note that a number of text questions will refer to the linked content, so study them in detail. Finally, we want to highlight that although Orientation is not part of your academic curriculum, it is still part of your education at Skoltech. Your performance in this course falls under the same rules and regulations as all academic and research activities.",
    "context": "Sim: 7.42 - Finally, we want to highlight that although Orientation is not part of your academic curriculum, it is still part of your education at Skoltech. Your performance in this course falls under the same rules and regulations as all academic and research activities. in the university as they relate to academic misconduct. That means: No copying or publishing any information or material from this course. Using your common sense and/or contacting Education if you have questions or technical issues with the course material.   \nSim: 2.05 - We bet one of the reasons why you got interested in Skoltech is its research-based curriculum, are we right? Even if not, every program dedicates time for students' independent research as part of your academic plan.\nSim: 1.11 - IW ground rules. We bet your first impression from IW was that it\u2019s an optional class because it doesn\u2019t have any textbook learning. Well, this course sets the foundation to your entire Skoltech curriculum and is definitely not an optional class. In fact:\nSim: 0.64 - Skoltech provides academic mobility opportunities for its best performing students. Academic mobility allows a student\u2019s immersion into a worldwide ecosystem of science, research and innovations and provides a unique opportunity: ",
    "generated_answer": "No, the Skoltech Orientation course is not part of the academic curriculum, but it is still subject to the same rules and regulations as other academic activities.",
    "logprobs": [
      [
        {
          "prob": 0.99998354938796,
          "token": "No"
        },
        {
          "prob": 1.1478713790975014e-05,
          "token": "Although"
        },
        {
          "prob": 1.9947013611967364e-06,
          "token": " No"
        },
        {
          "prob": 1.0676867000629394e-06,
          "token": "-No"
        },
        {
          "prob": 5.714915082864157e-07,
          "token": "The"
        }
      ],
      [
        {
          "prob": 0.9992875172520937,
          "token": ","
        },
        {
          "prob": 0.0007096683061315453,
          "token": "."
        },
        {
          "prob": 1.993313168786599e-06,
          "token": ""
        },
        {
          "prob": 2.1009366229906012e-07,
          "token": "\uff0c"
        },
        {
          "prob": 1.2742824759569216e-07,
          "token": "repid"
        }
      ],
      [
        {
          "prob": 0.9291247097759012,
          "token": " the"
        },
        {
          "prob": 0.059396955047734463,
          "token": " Orientation"
        },
        {
          "prob": 0.010321645568465416,
          "token": " although"
        },
        {
          "prob": 0.00024274183729497233,
          "token": " despite"
        },
        {
          "prob": 0.00024274183729497233,
          "token": " while"
        }
      ],
      [
        {
          "prob": 0.973720505769943,
          "token": " Sk"
        },
        {
          "prob": 0.025948774953336383,
          "token": " Orientation"
        },
        {
          "prob": 0.0002882647136728829,
          "token": " orientation"
        },
        {
          "prob": 3.0382877289669707e-05,
          "token": " document"
        },
        {
          "prob": 4.6593651394108284e-06,
          "token": " Orient"
        }
      ],
      [
        {
          "prob": 0.9999992847447459,
          "token": "ol"
        },
        {
          "prob": 3.059020287707785e-07,
          "token": "olt"
        },
        {
          "prob": 2.1024318473456359e-07,
          "token": "olk"
        },
        {
          "prob": 4.691164021834418e-08,
          "token": "\u043e\u043b"
        },
        {
          "prob": 3.6534822137210456e-08,
          "token": "opt"
        }
      ],
      [
        {
          "prob": 0.9996866969655822,
          "token": "tech"
        },
        {
          "prob": 0.00015841161427161443,
          "token": "Tech"
        },
        {
          "prob": 0.00010887460412485157,
          "token": "otech"
        },
        {
          "prob": 2.429320785447503e-05,
          "token": " tech"
        },
        {
          "prob": 6.960120581428743e-06,
          "token": "-tech"
        }
      ],
      [
        {
          "prob": 0.9999889136593714,
          "token": " Orientation"
        },
        {
          "prob": 1.0129977669573009e-05,
          "token": "Orientation"
        },
        {
          "prob": 9.422346986507607e-07,
          "token": " orientation"
        },
        {
          "prob": 4.1398903412289764e-08,
          "token": "_orientation"
        },
        {
          "prob": 9.833101448140822e-09,
          "token": " Orient"
        }
      ],
      [
        {
          "prob": 0.9999809268774651,
          "token": " course"
        },
        {
          "prob": 1.8925145442106525e-05,
          "token": " is"
        },
        {
          "prob": 7.734274386157936e-08,
          "token": "\u8bfe\u7a0b"
        },
        {
          "prob": 3.653412529742552e-08,
          "token": "course"
        },
        {
          "prob": 9.237273473281032e-09,
          "token": " Course"
        }
      ],
      [
        {
          "prob": 0.9996646575567589,
          "token": " is"
        },
        {
          "prob": 0.0003353500342255387,
          "token": ","
        },
        {
          "prob": 1.7081828481474937e-09,
          "token": " itself"
        },
        {
          "prob": 1.7081828481474937e-09,
          "token": " falls"
        },
        {
          "prob": 1.2497332688032945e-09,
          "token": " was"
        }
      ],
      [
        {
          "prob": 0.9999923706636761,
          "token": " not"
        },
        {
          "prob": 4.222819059381988e-06,
          "token": " highlighted"
        },
        {
          "prob": 1.9947184819293245e-06,
          "token": " described"
        },
        {
          "prob": 5.714964134584279e-07,
          "token": " mentioned"
        },
        {
          "prob": 3.927833578374701e-07,
          "token": "not"
        }
      ],
      [
        {
          "prob": 0.9999848606494245,
          "token": " part"
        },
        {
          "prob": 1.3007099179970686e-05,
          "token": " explicitly"
        },
        {
          "prob": 1.7603194516080454e-06,
          "token": "part"
        },
        {
          "prob": 2.1024017720319298e-07,
          "token": " officially"
        },
        {
          "prob": 4.1398745488307334e-08,
          "token": " specifically"
        }
      ],
      [
        {
          "prob": 1.0,
          "token": " of"
        },
        {
          "prob": 4.508755242294825e-12,
          "token": " c\u1ee7a"
        },
        {
          "prob": 1.6586783589142312e-12,
          "token": "_of"
        },
        {
          "prob": 6.101936677605324e-13,
          "token": "\u0e02\u0e2d\u0e07"
        },
        {
          "prob": 1.5428112031918877e-13,
          "token": "of"
        }
      ],
      [
        {
          "prob": 1.0,
          "token": " the"
        },
        {
          "prob": 1.4166087866431961e-09,
          "token": " your"
        },
        {
          "prob": 4.277787868968998e-11,
          "token": " its"
        },
        {
          "prob": 1.0815941557285693e-11,
          "token": "the"
        },
        {
          "prob": 1.1399918530443554e-12,
          "token": " academic"
        }
      ],
      [
        {
          "prob": 0.9999953508594287,
          "token": " academic"
        },
        {
          "prob": 1.9947241888728423e-06,
          "token": "academic"
        },
        {
          "prob": 1.3709525491573226e-06,
          "token": " formal"
        },
        {
          "prob": 9.422409887669812e-07,
          "token": "\u5b66\u672f"
        },
        {
          "prob": 1.6373693229868488e-07,
          "token": " official"
        }
      ],
      [
        {
          "prob": 0.9999998807907247,
          "token": " curriculum"
        },
        {
          "prob": 6.023573837886479e-08,
          "token": " Curriculum"
        },
        {
          "prob": 8.152020714470167e-09,
          "token": " curvature"
        },
        {
          "prob": 3.1923771805723365e-09,
          "token": " cur"
        },
        {
          "prob": 2.9989608248573072e-09,
          "token": "cur"
        }
      ],
      [
        {
          "prob": 0.777271512615024,
          "token": ","
        },
        {
          "prob": 0.22269202346371952,
          "token": " but"
        },
        {
          "prob": 2.4253114331969286e-05,
          "token": "."
        },
        {
          "prob": 4.214559318420811e-06,
          "token": " itself"
        },
        {
          "prob": 1.5504497268445429e-06,
          "token": ";"
        }
      ],
      [
        {
          "prob": 0.9999899865198352,
          "token": " but"
        },
        {
          "prob": 3.2887285174577226e-06,
          "token": " although"
        },
        {
          "prob": 2.9022927300980684e-06,
          "token": " though"
        },
        {
          "prob": 2.5612643447053347e-06,
          "token": "\u4f46"
        },
        {
          "prob": 6.475890416644057e-07,
          "token": " despite"
        }
      ],
      [
        {
          "prob": 0.9999990463265931,
          "token": " it"
        },
        {
          "prob": 6.47594599989589e-07,
          "token": " is"
        },
        {
          "prob": 2.1024318473456359e-07,
          "token": "\u5b83"
        },
        {
          "prob": 2.8453348089834e-08,
          "token": " still"
        },
        {
          "prob": 8.152020714470167e-09,
          "token": "it"
        }
      ],
      [
        {
          "prob": 0.9998992782944437,
          "token": " is"
        },
        {
          "prob": 8.480966144874997e-05,
          "token": " falls"
        },
        {
          "prob": 8.938872552052487e-06,
          "token": " does"
        },
        {
          "prob": 6.961600943313965e-06,
          "token": " still"
        },
        {
          "prob": 1.7256083491322062e-08,
          "token": " remains"
        }
      ],
      [
        {
          "prob": 0.5545266022379597,
          "token": " still"
        },
        {
          "prob": 0.4318657520568484,
          "token": " part"
        },
        {
          "prob": 0.01304121414719462,
          "token": " considered"
        },
        {
          "prob": 0.0005056627477213175,
          "token": " subject"
        },
        {
          "prob": 1.347545578339436e-05,
          "token": "still"
        }
      ],
      [
        {
          "prob": 0.685060968301226,
          "token": " subject"
        },
        {
          "prob": 0.2855758818273142,
          "token": " part"
        },
        {
          "prob": 0.02068704749441275,
          "token": " considered"
        },
        {
          "prob": 0.006716102612663917,
          "token": " governed"
        },
        {
          "prob": 0.0011670836356204462,
          "token": " regulated"
        }
      ],
      [
        {
          "prob": 1.0,
          "token": " to"
        },
        {
          "prob": 7.991959892953932e-11,
          "token": "to"
        },
        {
          "prob": 2.129785170955785e-12,
          "token": "_to"
        },
        {
          "prob": 8.878265478459658e-13,
          "token": "\tto"
        },
        {
          "prob": 8.25807328555592e-14,
          "token": " under"
        }
      ],
      [
        {
          "prob": 0.9999848606494245,
          "token": " the"
        },
        {
          "prob": 1.0129939026848598e-05,
          "token": " Sk"
        },
        {
          "prob": 2.9022761230933693e-06,
          "token": " academic"
        },
        {
          "prob": 1.9947032634931005e-06,
          "token": " similar"
        },
        {
          "prob": 7.734303890129564e-08,
          "token": " its"
        }
      ],
      [
        {
          "prob": 0.9975253935511227,
          "token": " same"
        },
        {
          "prob": 0.0024726183084775653,
          "token": " university"
        },
        {
          "prob": 1.5496559089953542e-06,
          "token": "same"
        },
        {
          "prob": 2.6928981829740685e-07,
          "token": " rules"
        },
        {
          "prob": 7.715282468781604e-08,
          "token": " University"
        }
      ],
      [
        {
          "prob": 0.9999491002239198,
          "token": " rules"
        },
        {
          "prob": 2.429960301120258e-05,
          "token": " regulations"
        },
        {
          "prob": 1.8924549853448838e-05,
          "token": " academic"
        },
        {
          "prob": 6.9619528245078585e-06,
          "token": "rules"
        },
        {
          "prob": 3.4661522124761626e-07,
          "token": " educational"
        }
      ],
      [
        {
          "prob": 1.0,
          "token": " and"
        },
        {
          "prob": 3.6534822137210456e-08,
          "token": " as"
        },
        {
          "prob": 1.522997974471263e-08,
          "token": "\u548c"
        },
        {
          "prob": 1.2501528663867426e-09,
          "token": " regarding"
        },
        {
          "prob": 2.4616969518153846e-10,
          "token": "and"
        }
      ],
      [
        {
          "prob": 0.9999992847447459,
          "token": " regulations"
        },
        {
          "prob": 3.4663241069161144e-07,
          "token": " regulation"
        },
        {
          "prob": 2.3823673954981372e-07,
          "token": " regulatory"
        },
        {
          "prob": 9.931194312156244e-08,
          "token": " Regulations"
        },
        {
          "prob": 2.335593038799337e-09,
          "token": " regulates"
        }
      ],
      [
        {
          "prob": 0.9990575858914796,
          "token": " as"
        },
        {
          "prob": 0.0009110227330519964,
          "token": "."
        },
        {
          "prob": 2.142519088863411e-05,
          "token": " regarding"
        },
        {
          "prob": 7.881887251102193e-06,
          "token": " related"
        },
        {
          "prob": 9.413571899427502e-07,
          "token": " that"
        }
      ],
      [
        {
          "prob": 0.9625509013052636,
          "token": " other"
        },
        {
          "prob": 0.03732214494185418,
          "token": " academic"
        },
        {
          "prob": 0.00011878826284812807,
          "token": " all"
        },
        {
          "prob": 4.064710832174529e-06,
          "token": "\u5176\u4ed6"
        },
        {
          "prob": 1.495323549463874e-06,
          "token": "\u5176\u4ed6\u7684"
        }
      ],
      [
        {
          "prob": 0.9999877215940446,
          "token": " academic"
        },
        {
          "prob": 6.1441361792926976e-06,
          "token": " educational"
        },
        {
          "prob": 2.2603013841194386e-06,
          "token": "\u5b66\u672f"
        },
        {
          "prob": 1.0676907729722432e-06,
          "token": "academic"
        },
        {
          "prob": 9.422338000661571e-07,
          "token": " academics"
        }
      ],
      [
        {
          "prob": 0.6224574006009916,
          "token": " activities"
        },
        {
          "prob": 0.3775394978295304,
          "token": " and"
        },
        {
          "prob": 1.406958767171408e-06,
          "token": "\u6d3b\u52a8"
        },
        {
          "prob": 8.533636292409475e-07,
          "token": " activity"
        },
        {
          "prob": 6.64600262697506e-07,
          "token": "activities"
        }
      ],
      [
        {
          "prob": 0.9988294252840438,
          "token": "."
        },
        {
          "prob": 0.0011695091921651922,
          "token": " at"
        },
        {
          "prob": 5.037573606598549e-07,
          "token": " and"
        },
        {
          "prob": 2.379581278728077e-07,
          "token": " regarding"
        },
        {
          "prob": 2.379581278728077e-07,
          "token": ","
        }
      ],
      [
        {
          "prob": 0.999998927117538,
          "token": ""
        },
        {
          "prob": 3.2563101459822534e-07,
          "token": ""
        },
        {
          "prob": 1.6373755690670415e-07,
          "token": "<tool_call>"
        },
        {
          "prob": 9.833195224350998e-09,
          "token": " However"
        },
        {
          "prob": 4.363453930307876e-09,
          "token": " It"
        }
      ]
    ],
    "language_consistency_score": 0.7403311194331893
  },
  {
    "question": "What should students do if they have questions or technical issues with the course material?\n",
    "true_answer": "Students should contact Education. \n",
    "source_doc": "in the university as they relate to academic misconduct. That means: No copying or publishing any information or material from this course. Using your common sense and/or contacting Education if you have questions or technical issues with the course material. You can find a link to Education in the description of this video. ",
    "context": "Sim: 2.25 - Finally, we want to highlight that although Orientation is not part of your academic curriculum, it is still part of your education at Skoltech. Your performance in this course falls under the same rules and regulations as all academic and research activities. in the university as they relate to academic misconduct. That means: No copying or publishing any information or material from this course. Using your common sense and/or contacting Education if you have questions or technical issues with the course material.   ",
    "generated_answer": "Students should use their common sense and/or contact Education if they have questions or technical issues with the course material.",
    "logprobs": [
      [
        {
          "prob": 0.9888091607250361,
          "token": "Students"
        },
        {
          "prob": 0.004579095297016933,
          "token": "They"
        },
        {
          "prob": 0.004041037416257131,
          "token": "Contact"
        },
        {
          "prob": 0.0021630114601244813,
          "token": "If"
        },
        {
          "prob": 0.00010768994809510971,
          "token": "Use"
        }
      ],
      [
        {
          "prob": 0.9999985694905718,
          "token": " should"
        },
        {
          "prob": 1.0677029917933763e-06,
          "token": "should"
        },
        {
          "prob": 2.3823673954981372e-07,
          "token": "\u5e94\u8be5"
        },
        {
          "prob": 6.825590357542018e-08,
          "token": "\u5e94"
        },
        {
          "prob": 7.19411930861867e-09,
          "token": " Should"
        }
      ],
      [
        {
          "prob": 0.9964042722963143,
          "token": " use"
        },
        {
          "prob": 0.003593595563800866,
          "token": " contact"
        },
        {
          "prob": 1.7540169018380475e-06,
          "token": " either"
        },
        {
          "prob": 9.895476785541304e-08,
          "token": "contact"
        },
        {
          "prob": 9.895476785541304e-08,
          "token": "use"
        }
      ],
      [
        {
          "prob": 0.9999992847447459,
          "token": " their"
        },
        {
          "prob": 3.4663241069161144e-07,
          "token": "\u4ed6\u4eec\u7684"
        },
        {
          "prob": 3.059020287707785e-07,
          "token": " common"
        },
        {
          "prob": 3.850741922767617e-09,
          "token": "their"
        },
        {
          "prob": 1.162823303022097e-10,
          "token": " Their"
        }
      ],
      [
        {
          "prob": 0.9999979734461775,
          "token": " common"
        },
        {
          "prob": 1.994729895832688e-06,
          "token": "common"
        },
        {
          "prob": 3.224180587614433e-08,
          "token": " commons"
        },
        {
          "prob": 6.348788006680007e-09,
          "token": ".common"
        },
        {
          "prob": 5.602785751061334e-09,
          "token": "(common"
        }
      ],
      [
        {
          "prob": 0.9999996423722521,
          "token": " sense"
        },
        {
          "prob": 3.059023205018258e-07,
          "token": "sense"
        },
        {
          "prob": 1.186112015134383e-08,
          "token": " Sense"
        },
        {
          "prob": 6.34880011604368e-09,
          "token": " senses"
        },
        {
          "prob": 1.493094676197164e-10,
          "token": " sentido"
        }
      ],
      [
        {
          "prob": 0.9914224771982877,
          "token": " and"
        },
        {
          "prob": 0.008577484930474293,
          "token": " or"
        },
        {
          "prob": 1.509935836479894e-08,
          "token": "\u548c"
        },
        {
          "prob": 4.326038601025932e-09,
          "token": "\u6216"
        },
        {
          "prob": 4.326038601025932e-09,
          "token": ","
        }
      ],
      [
        {
          "prob": 0.9999971389852362,
          "token": "/or"
        },
        {
          "prob": 2.902312105056987e-06,
          "token": " contact"
        },
        {
          "prob": 9.237432042950414e-09,
          "token": " or"
        },
        {
          "prob": 8.152005165739432e-09,
          "token": "contact"
        },
        {
          "prob": 2.646568590975319e-09,
          "token": ","
        }
      ],
      [
        {
          "prob": 0.9996759749815745,
          "token": " contact"
        },
        {
          "prob": 0.00017950199259898073,
          "token": " contacting"
        },
        {
          "prob": 0.0001233697950348959,
          "token": "contact"
        },
        {
          "prob": 1.4734420815474425e-05,
          "token": " contacted"
        },
        {
          "prob": 2.9013794859386157e-06,
          "token": "_contact"
        }
      ],
      [
        {
          "prob": 0.9999871255623688,
          "token": " Education"
        },
        {
          "prob": 1.0129968008878086e-05,
          "token": "Education"
        },
        {
          "prob": 1.7603244879295989e-06,
          "token": " the"
        },
        {
          "prob": 9.422338000661571e-07,
          "token": " education"
        },
        {
          "prob": 1.0467262040786102e-08,
          "token": " Educational"
        }
      ],
      [
        {
          "prob": 0.8173536838258229,
          "token": " if"
        },
        {
          "prob": 0.18237625293472895,
          "token": " for"
        },
        {
          "prob": 0.0002135407142456276,
          "token": "."
        },
        {
          "prob": 5.399154787772135e-05,
          "token": " with"
        },
        {
          "prob": 1.2697595013607986e-06,
          "token": " directly"
        }
      ],
      [
        {
          "prob": 0.9999963045256735,
          "token": " they"
        },
        {
          "prob": 3.7266389560521204e-06,
          "token": "\u4ed6\u4eec"
        },
        {
          "prob": 5.315764976351624e-08,
          "token": "they"
        },
        {
          "prob": 4.94443164039281e-09,
          "token": " \u043e\u043d\u0438"
        },
        {
          "prob": 1.8189547487781048e-09,
          "token": " They"
        }
      ],
      [
        {
          "prob": 0.9999997615814777,
          "token": " have"
        },
        {
          "prob": 1.6373771305908126e-07,
          "token": "have"
        },
        {
          "prob": 6.82560337633487e-08,
          "token": " Have"
        },
        {
          "prob": 4.363462252943702e-09,
          "token": "_have"
        },
        {
          "prob": 4.363462252943702e-09,
          "token": "Have"
        }
      ],
      [
        {
          "prob": 0.9999995231630692,
          "token": " questions"
        },
        {
          "prob": 2.699578503363014e-07,
          "token": " any"
        },
        {
          "prob": 1.8553913626159784e-07,
          "token": "questions"
        },
        {
          "prob": 1.3440409951135022e-08,
          "token": "_questions"
        },
        {
          "prob": 6.34880011604368e-09,
          "token": " Questions"
        }
      ],
      [
        {
          "prob": 0.9999997615814777,
          "token": " or"
        },
        {
          "prob": 2.382369667501818e-07,
          "token": "\u6216"
        },
        {
          "prob": 7.582560427911907e-10,
          "token": "\u6216\u8005"
        },
        {
          "prob": 2.7894680928689246e-10,
          "token": " \u0438\u043b\u0438"
        },
        {
          "prob": 4.8473687062702556e-11,
          "token": "\u6216\u662f"
        }
      ],
      [
        {
          "prob": 0.9999843838268748,
          "token": " technical"
        },
        {
          "prob": 1.4738974314670568e-05,
          "token": "technical"
        },
        {
          "prob": 5.71492053303449e-07,
          "token": " Technical"
        },
        {
          "prob": 2.1024017720319298e-07,
          "token": "\u6280\u672f"
        },
        {
          "prob": 8.764114488649052e-08,
          "token": "Technical"
        }
      ],
      [
        {
          "prob": 0.999995112442896,
          "token": " issues"
        },
        {
          "prob": 3.2887441993747145e-06,
          "token": "issues"
        },
        {
          "prob": 1.5534927603056423e-06,
          "token": " Issues"
        },
        {
          "prob": 5.3157548373442334e-08,
          "token": "_issues"
        },
        {
          "prob": 5.602764378170615e-09,
          "token": "Issues"
        }
      ],
      [
        {
          "prob": 1.0,
          "token": " with"
        },
        {
          "prob": 1.2501528663867426e-09,
          "token": "with"
        },
        {
          "prob": 1.6918979226151304e-10,
          "token": "_with"
        },
        {
          "prob": 5.4927883509546835e-11,
          "token": " v\u1edbi"
        },
        {
          "prob": 3.775134544279098e-11,
          "token": "\twith"
        }
      ],
      [
        {
          "prob": 1.0,
          "token": " the"
        },
        {
          "prob": 7.05287985111216e-11,
          "token": "the"
        },
        {
          "prob": 5.4927883509546835e-11,
          "token": " course"
        },
        {
          "prob": 2.2447770550209742e-13,
          "token": " their"
        },
        {
          "prob": 8.25807328555592e-14,
          "token": " this"
        }
      ],
      [
        {
          "prob": 0.9999998807907247,
          "token": " course"
        },
        {
          "prob": 1.1253517471925912e-07,
          "token": ".course"
        },
        {
          "prob": 4.691164021834418e-08,
          "token": " coursework"
        },
        {
          "prob": 1.522997974471263e-08,
          "token": "\u8bfe\u7a0b"
        },
        {
          "prob": 9.237449661970594e-09,
          "token": "course"
        }
      ],
      [
        {
          "prob": 0.9999974966112362,
          "token": " material"
        },
        {
          "prob": 1.994727993510925e-06,
          "token": "material"
        },
        {
          "prob": 3.466317495433874e-07,
          "token": "\u6750\u6599"
        },
        {
          "prob": 1.637372446023967e-07,
          "token": " materials"
        },
        {
          "prob": 3.850734578067279e-09,
          "token": "_material"
        }
      ],
      [
        {
          "prob": 1.0,
          "token": "."
        },
        {
          "prob": 5.211412487888539e-10,
          "token": "\u3002"
        },
        {
          "prob": 3.581747930283181e-10,
          "token": ","
        },
        {
          "prob": 7.05287985111216e-11,
          "token": ".\n\n"
        },
        {
          "prob": 5.4927883509546835e-11,
          "token": "\uff0e"
        }
      ],
      [
        {
          "prob": 0.9999971389852362,
          "token": ""
        },
        {
          "prob": 8.315263400842229e-07,
          "token": ""
        },
        {
          "prob": 2.5360120545506016e-07,
          "token": "<tool_call>"
        },
        {
          "prob": 5.658613155173702e-08,
          "token": " b\u1ee5"
        },
        {
          "prob": 2.5109943663977427e-08,
          "token": "UrlParser"
        }
      ]
    ],
    "language_consistency_score": 0.7644259339515831
  },
  {
    "question": "What is the email address for contacting the Skoltech education team with questions or technical problems?\n",
    "true_answer": "education@skoltech.ru \n",
    "source_doc": "\n### Text Below Video 1\n\nPlease take the time to go through the STUDENT ACADEMIC INTEGRITY REGULATIONS: [**https://www.skoltech.ru/app/data/uploads/sites/2/2015/04/1.-STUDENT-ACADEMIC-INTEGRITY-REGULATIONS.pdf**](https://www.skoltech.ru/app/data/uploads/sites/2/2015/04/1.-STUDENT-ACADEMIC-INTEGRITY-REGULATIONS.pdf)\n\nIf you have any questions or technical problems when dealing with this course, please email us at education@skoltech.ru\n\nBy the end of this course, you will learn about the following topics and know how to find resources related to them:\n\n1) Skoltech at a Glance \u2014 brief history, mission and vision, its role within the Skolkovo ecosystem, Russia and the world  \n2) Navigating the campus \u2014 different locations on campus and where to find them  \n3) Education process, part 1 \u2014 academic integrity requirements and education process details  \n4) Education process, part 2 \u2014 your curriculum structure and degree requirements  \n5) Education process, part 3 \u2014 research process and intellectual property  \n6) Experience & success \u2014 student life, scholarships and future career opportunities  \n7) Services & resources \u2014 student benefits and support services  \n8) Being an international student, part 1\\* \u2014 first day in Moscow, visa and migration rules in Russia  \n9) Being an international student, part 2\\* \u2014 Russia's culture code, useful tips on living in Moscow\n\n\\* for international students only\n\n## \u201cMeet Skoltech\u201d \\- Module 1\n",
    "context": "Sim: 5.97 - If you have any questions or technical problems when dealing with this course, please email us at education@skoltech.ru\nSim: 4.36 - Until then, if you have urgent questions or need assistance, feel free to reach out to the Education Department via [education@skoltech.ru](mailto:education@skoltech.ru). For more details on the Education Department, as well as for all the relevant links, see the description below.\nSim: 3.79 - If you need to communicate any concerns or issues informally or outside of the formal evaluation period (or if you are unable to solve an issue directly with your research advisor or faculty, please talk to the [Education Department (links to an external site)](https://helpdesk.skoltech.ru/servicedesk/customer/portal/21) (email: education@skoltech.ru). \nSim: 3.38 - If you need a consultation or have questions about the technology transfer process at Skoltech, reach out to the KTO team at kto@skoltech.ru to book an appointment. \nSim: 2.50 - 1. Email studept@skoltech.ru from your Skoltech email address and ask to pick up your original diploma. Wait for an answer. If you wish for someone else to pick up your diploma, include their full name in your email and ask them to have Skoltech or government ID on them.   \nSim: 1.95 - Keep an eye on your email for announcements on new scholarship opportunities and contact scholarships@skoltech.ru if you need any help or have questions. Good luck\\! ",
    "generated_answer": "education@skoltech.ru",
    "logprobs": [
      [
        {
          "prob": 0.9996340422476869,
          "token": "education"
        },
        {
          "prob": 0.00023047544950553753,
          "token": " education"
        },
        {
          "prob": 0.00010886889357436657,
          "token": "\u6559\u80b2"
        },
        {
          "prob": 1.669558556454103e-05,
          "token": "educ"
        },
        {
          "prob": 4.221305105862114e-06,
          "token": "edu"
        }
      ],
      [
        {
          "prob": 1.0,
          "token": "@"
        },
        {
          "prob": 4.058652126475693e-10,
          "token": "@s"
        },
        {
          "prob": 1.917171513758312e-10,
          "token": "@example"
        },
        {
          "prob": 2.9400777392844726e-11,
          "token": "@g"
        },
        {
          "prob": 1.1513509855710022e-11,
          "token": "\"@"
        }
      ],
      [
        {
          "prob": 1.0,
          "token": "sk"
        },
        {
          "prob": 3.6534822137210456e-08,
          "token": "sky"
        },
        {
          "prob": 2.510999155743982e-08,
          "token": "ski"
        },
        {
          "prob": 2.081691415838163e-08,
          "token": "sku"
        },
        {
          "prob": 6.34880011604368e-09,
          "token": ".sk"
        }
      ],
      [
        {
          "prob": 0.9999997615814777,
          "token": "ol"
        },
        {
          "prob": 1.4449802461092448e-07,
          "token": "olk"
        },
        {
          "prob": 1.1253517471925912e-07,
          "token": "\u043e\u043b"
        },
        {
          "prob": 2.335593038799337e-09,
          "token": "ols"
        },
        {
          "prob": 2.061153622438558e-09,
          "token": "ok"
        }
      ],
      [
        {
          "prob": 0.999997854237364,
          "token": "tech"
        },
        {
          "prob": 7.338201193668986e-07,
          "token": " tech"
        },
        {
          "prob": 3.9278560536830205e-07,
          "token": "te"
        },
        {
          "prob": 3.466320801173418e-07,
          "token": "techn"
        },
        {
          "prob": 2.6995733543305574e-07,
          "token": "Tech"
        }
      ],
      [
        {
          "prob": 0.9999997615814777,
          "token": ".ru"
        },
        {
          "prob": 7.734421907141565e-08,
          "token": ".rs"
        },
        {
          "prob": 7.734421907141565e-08,
          "token": " ru"
        },
        {
          "prob": 6.023573837886479e-08,
          "token": "_ru"
        },
        {
          "prob": 3.2241867372567335e-08,
          "token": ".rb"
        }
      ],
      [
        {
          "prob": 0.9999938011552557,
          "token": ""
        },
        {
          "prob": 5.043447766756707e-07,
          "token": "<tool_call>"
        },
        {
          "prob": 3.6898652099352444e-07,
          "token": ""
        },
        {
          "prob": 9.329440282540231e-08,
          "token": "ienie"
        },
        {
          "prob": 4.691137178855366e-08,
          "token": "uy\u1ebfn"
        }
      ]
    ],
    "language_consistency_score": 0.5237305173836304
  },
  {
    "question": "What are the six target domains of Skoltech's research and education activities?\n",
    "true_answer": "The six target domains are Artificial Intelligence & Telecommunications, Cutting-edge Engineering, Advanced Materials, Photonics, Life Sciences & Health, Agro, Energy Efficiency & ESG, and Advanced Studies. \n",
    "source_doc": "Ah, wait, let\u2019s back up a little. Skoltech was established in 2011 in collaboration with MIT with the vision of being a worldleading institute of science and technology and the mission to impact economy and society development by academic and technology excellence and entrepreneurial spirit. Skoltech became a home for talents who are working in promising areas of global science and technology agenda. The broad, but well-structured portfolio divided among several Centers covers Artificial Intelligence and Communications, Life Sciences and Health, Cutting-edge Engineering and Advanced Materials, Energy Efficiency and ESG, Photonics, and Advanced Studies. Skoltech research excellence is globally recognized: the Institute appeared among top-100 world\u2019s leading young universities in the prestigious Nature Index ranking. To learn more about the faculty, students, alumni, and their achievements, see the link below. You can also find more information about the university\u2019s achievements there as well. Today Skoltech brings together some of the most qualified, high-achieving faculty, researchers and students from around the world. So as you join this community, be sure that with their help, you will master and apply unique technological competencies that are shaping the future and humanity literally as we speak right now. *Text Overlay: Skoltech\u2019s Strategy and Goals*\n\nSkoltech\u2019s mission, as stated in the Skoltech Strategy 2021-2025, is to facilitate the economy and society development by academic and technology excellence and entrepreneurial spirit. Our unofficial motto is: \u201cTargeting excellence today, we impact tomorrow\u201d. In context of these aspirations, you will witness Skoltech becoming: a world leading university producing substantial economic impact in Russia a full-fledged university providing education in BSc, MSc and PhD programs the 1st choice university for the brightest students in Russia. You can find more information about Skoltech\u2019s five-year plan in the links below. Let\u2019s now take a look at Governance & Management, which includes: Leadership, Collegial Bodies, Structure: Centers & Departments, Programs Management: Directors, Coordinators & Research Advisors\n\n*Text Overlays: Governance & Management  \u2014 Leadership, Collegial Bodies, Structure: Centers & Departments, Programs Management: Directors, Coordinators & Research Advisors*\n\nSo, who is behind Skoltech? You will obviously get to know your professors and fellow students in the next few weeks, but you should also probably know who runs the university on the administrative side. You know, just to have an idea. Skoltech was founded by the top Russian companies and leading institutes. Among them are VEB.RF, Sber, MIPT, New Economic School, Moscow School of Management.The Founders are entitled to approve the Charter, establish the Institute's governance bodies, and appoint the Board of Trustees. You can read more about the Founders below. Honored academics, statesmen and businessmen make up the Board of Trustees. Members of the Board set and hold Skoltech accountable for following its strategies, as well as oversee the development of the university. The final key player of the Skoltech government bodies is the Student Council, whose role is to voice student needs to the university administration. Each year, students elect the Council and its President, Vice President and Coordinator to represent you over the course of the next academic year. You will learn more about the Student Council\u2019s role and activities in the next module.Meanwhile, let\u2019s see what happens behind the scenes of the day-to-day management\\! Below you will see Skoltech\u2019s current leadership team . It consists of the University President and Provost, as well as several Vice Presidents and Deans responsible for different areas of the university\u2019s management. You will get to know team members and leaders of these departments as you attend Skoltech events throughout your time here. Skoltech\u2019s research and education activities revolve around several target domains: \n\n* Artificial Intelligence & Telecommunications  \n* Cutting-edge Engineering, Advanced Materials  \n* Photonics  \n* Life Sciences & Health, Agro  \n* Energy Efficiency & ESG  \n* Advanced Studies\n\n*Text Overlay: **several target domains**:* \n\n* *Artificial Intelligence & Telecommunications*  \n* *Cutting-edge Engineering, Advanced Materials*  \n* *Photonics*  \n* *Life Sciences & Health, Agro*  \n* *Energy Efficiency & ESG*  \n* *Advanced Studies*\n\nBy the way, management doesn\u2019t cover just academics and research, right? There are entire departments responsible for cooperation with industry, communications and student affairs. For instance, you will most likely hear from these people quite often: \n\n* Education Department \u2014 about your academic affairs, curriculum and more  \n* Student Department \u2014 about student activities, benefits, scholarships and more  \n* Accommodation team \u2014 if you\u2019re living in the dorms, you will get to know the housing team pretty well:)\n\n*Text Overlay:* \n\n- *Education Department*   \n- *Student Department*  \n- *Accommodation team* \n\nFinally, the people you will interact the most with are members of your Centers and Programs. You will most likely hear from your Program Director and Coordinator, as well as spend a ton of time with your research advisor while working on your research. Now you know you\u2019ll meet a lot of people here.",
    "context": "Sim: 4.87 -  Skoltech\u2019s research and education activities revolve around several target domains: \nSim: 2.03 - Skoltech\u2019s mission, as stated in the Skoltech Strategy 2021-2025, is to facilitate the economy and society development by academic and technology excellence and entrepreneurial spirit. Our unofficial motto is: \u201cTargeting excellence today, we impact tomorrow\u201d. In context of these aspirations, you will witness Skoltech becoming: a world leading university producing substantial economic impact in Russia a full-fledged university providing education in BSc, MSc and PhD programs the 1st choice university for the brightest students in Russia. You can find more information about Skoltech\u2019s five-year plan in the links below. \nSim: 1.03 - Skoltech hosts more than 25 world-class laboratories based in Centers for Research, Education and Innovation (CREIs) established in collaboration with international and Russian Partners. Students have full access to the facilities throughout their studies and can conduct research based on their interests in IT, Biomedicine, Energy, Space, Cross Cutting Science. As part of your MSc Thesis project, you will develop very specific studies that go deep into one of the following topics: ",
    "generated_answer": "The context provided does not list the six target domains of Skoltech's research and education activities; it only mentions that Skoltech's activities revolve around several target domains without specifying them.",
    "logprobs": [
      [
        {
          "prob": 0.9732820492496441,
          "token": "The"
        },
        {
          "prob": 0.025937090964876938,
          "token": "Based"
        },
        {
          "prob": 0.0006911998969499949,
          "token": "According"
        },
        {
          "prob": 5.673714258997933e-05,
          "token": "Information"
        },
        {
          "prob": 1.2659767712466387e-05,
          "token": "There"
        }
      ],
      [
        {
          "prob": 0.6832782649043864,
          "token": " context"
        },
        {
          "prob": 0.2848327659991472,
          "token": " document"
        },
        {
          "prob": 0.014180986703701883,
          "token": " documents"
        },
        {
          "prob": 0.009746440124131632,
          "token": " provided"
        },
        {
          "prob": 0.003585514946276468,
          "token": " given"
        }
      ],
      [
        {
          "prob": 0.7611052161970204,
          "token": " provided"
        },
        {
          "prob": 0.21806029535575838,
          "token": " does"
        },
        {
          "prob": 0.02028276940753667,
          "token": " only"
        },
        {
          "prob": 0.0004770050161824838,
          "token": " provides"
        },
        {
          "prob": 2.0958137734042174e-05,
          "token": " doesn"
        }
      ],
      [
        {
          "prob": 0.9998889092831814,
          "token": " does"
        },
        {
          "prob": 6.604920085103893e-05,
          "token": " only"
        },
        {
          "prob": 2.1443036023337e-05,
          "token": " doesn"
        },
        {
          "prob": 1.1477630093635532e-05,
          "token": " did"
        },
        {
          "prob": 8.938787304727275e-06,
          "token": "does"
        }
      ],
      [
        {
          "prob": 0.9999997615814777,
          "token": " not"
        },
        {
          "prob": 1.2751905914873347e-07,
          "token": "not"
        },
        {
          "prob": 3.6534822137210456e-08,
          "token": "_not"
        },
        {
          "prob": 3.2241867372567335e-08,
          "token": " NOT"
        },
        {
          "prob": 1.9555681087850496e-08,
          "token": " Not"
        }
      ],
      [
        {
          "prob": 0.9477701041520524,
          "token": " list"
        },
        {
          "prob": 0.041642115724344814,
          "token": " explicitly"
        },
        {
          "prob": 0.009291611950492506,
          "token": " specify"
        },
        {
          "prob": 0.00052419687601395,
          "token": "\u5217\u51fa"
        },
        {
          "prob": 0.00019284125381182775,
          "token": " specifically"
        }
      ],
      [
        {
          "prob": 0.9664003235042831,
          "token": " the"
        },
        {
          "prob": 0.03306840233075342,
          "token": " six"
        },
        {
          "prob": 0.00036735667943287557,
          "token": " specific"
        },
        {
          "prob": 6.383704927778173e-05,
          "token": " Sk"
        },
        {
          "prob": 3.0154486904504037e-05,
          "token": " any"
        }
      ],
      [
        {
          "prob": 0.9958460749980368,
          "token": " six"
        },
        {
          "prob": 0.00406979443411713,
          "token": " specific"
        },
        {
          "prob": 5.1231151234132617e-05,
          "token": "\u516d"
        },
        {
          "prob": 2.1356321173915632e-05,
          "token": "\u516d\u4e2a"
        },
        {
          "prob": 8.902639177461363e-06,
          "token": "six"
        }
      ],
      [
        {
          "prob": 0.9525723094915114,
          "token": " target"
        },
        {
          "prob": 0.04742578411138641,
          "token": " specific"
        },
        {
          "prob": 1.0170648200286744e-06,
          "token": "target"
        },
        {
          "prob": 2.2693783617433206e-07,
          "token": "(target"
        },
        {
          "prob": 1.5597194175464049e-07,
          "token": " specifically"
        }
      ],
      [
        {
          "prob": 0.9999765163221908,
          "token": " domains"
        },
        {
          "prob": 2.1444897024306356e-05,
          "token": "domains"
        },
        {
          "prob": 1.9946861428911334e-06,
          "token": "_domains"
        },
        {
          "prob": 1.3440102328084965e-08,
          "token": "Domains"
        },
        {
          "prob": 1.0467162217672382e-08,
          "token": "-dom"
        }
      ],
      [
        {
          "prob": 0.9999965429424904,
          "token": " of"
        },
        {
          "prob": 2.902309337197794e-06,
          "token": ";"
        },
        {
          "prob": 4.4508355217969405e-07,
          "token": " explicitly"
        },
        {
          "prob": 1.5229921647061352e-08,
          "token": "."
        },
        {
          "prob": 9.23741442396384e-09,
          "token": " specifically"
        }
      ],
      [
        {
          "prob": 0.9999998807907247,
          "token": " Sk"
        },
        {
          "prob": 9.931194312156244e-08,
          "token": "Sk"
        },
        {
          "prob": 6.691586091292782e-10,
          "token": "_sk"
        },
        {
          "prob": 5.211412487888539e-10,
          "token": " SK"
        },
        {
          "prob": 1.162823303022097e-10,
          "token": " research"
        }
      ],
      [
        {
          "prob": 0.9999954700677164,
          "token": "ol"
        },
        {
          "prob": 2.260318628916241e-06,
          "token": "olk"
        },
        {
          "prob": 1.9947241888728423e-06,
          "token": "olt"
        },
        {
          "prob": 1.44497335592293e-07,
          "token": "\u043e\u043b"
        },
        {
          "prob": 3.6534682768190175e-08,
          "token": "ot"
        }
      ],
      [
        {
          "prob": 0.9999769931373511,
          "token": "tech"
        },
        {
          "prob": 8.939571610785762e-06,
          "token": "Tech"
        },
        {
          "prob": 6.144071725077197e-06,
          "token": " tech"
        },
        {
          "prob": 3.7265678767328097e-06,
          "token": "te"
        },
        {
          "prob": 9.422239156920759e-07,
          "token": "tek"
        }
      ],
      [
        {
          "prob": 0.9999998807907247,
          "token": "'s"
        },
        {
          "prob": 6.023573837886479e-08,
          "token": "\u2019s"
        },
        {
          "prob": 1.57371021068629e-11,
          "token": "."
        },
        {
          "prob": 7.433680672352188e-12,
          "token": ";"
        },
        {
          "prob": 5.789356328730652e-12,
          "token": "'S"
        }
      ],
      [
        {
          "prob": 1.0,
          "token": " research"
        },
        {
          "prob": 3.6534822137210456e-08,
          "token": "research"
        },
        {
          "prob": 5.602796437537268e-09,
          "token": " activities"
        },
        {
          "prob": 3.850741922767617e-09,
          "token": "\u7814\u7a76"
        },
        {
          "prob": 4.5990553786523166e-10,
          "token": " Research"
        }
      ],
      [
        {
          "prob": 1.0,
          "token": " and"
        },
        {
          "prob": 8.592166619174109e-10,
          "token": "\u548c"
        },
        {
          "prob": 7.433680672352188e-12,
          "token": " \u0438"
        },
        {
          "prob": 6.560200168153779e-12,
          "token": "and"
        },
        {
          "prob": 3.5114221133765118e-12,
          "token": " v\u00e0"
        }
      ],
      [
        {
          "prob": 0.9999939203633587,
          "token": " education"
        },
        {
          "prob": 3.7266318480591813e-06,
          "token": "\u6559\u80b2"
        },
        {
          "prob": 1.994722286556522e-06,
          "token": " educational"
        },
        {
          "prob": 3.466307578234157e-07,
          "token": "education"
        },
        {
          "prob": 2.9989436647149156e-09,
          "token": " Education"
        }
      ],
      [
        {
          "prob": 0.9999994039539004,
          "token": " activities"
        },
        {
          "prob": 5.043471815847051e-07,
          "token": "activities"
        },
        {
          "prob": 9.931194312156244e-08,
          "token": "\u6d3b\u52a8"
        },
        {
          "prob": 1.7257827987960214e-08,
          "token": "_activities"
        },
        {
          "prob": 1.0467401794744658e-08,
          "token": " Activities"
        }
      ],
      [
        {
          "prob": 0.9963195384365362,
          "token": ";"
        },
        {
          "prob": 0.0035932888496692174,
          "token": "."
        },
        {
          "prob": 3.522738112394235e-05,
          "token": " directly"
        },
        {
          "prob": 2.743511200488113e-05,
          "token": " explicitly"
        },
        {
          "prob": 2.4211401366369044e-05,
          "token": ","
        }
      ],
      [
        {
          "prob": 0.9999967813595916,
          "token": " it"
        },
        {
          "prob": 2.902312105056987e-06,
          "token": " instead"
        },
        {
          "prob": 2.699570779818012e-07,
          "token": " only"
        },
        {
          "prob": 7.734392402719739e-08,
          "token": "\u5b83"
        },
        {
          "prob": 1.1861074904847522e-08,
          "token": "it"
        }
      ],
      [
        {
          "prob": 0.9987315552130093,
          "token": " only"
        },
        {
          "prob": 0.0009107252111435514,
          "token": " merely"
        },
        {
          "prob": 0.00012325325440083642,
          "token": "\u4ec5"
        },
        {
          "prob": 0.00010877061524220929,
          "token": " mentions"
        },
        {
          "prob": 7.475687770346835e-05,
          "token": "only"
        }
      ],
      [
        {
          "prob": 0.7972890308870592,
          "token": " mentions"
        },
        {
          "prob": 0.20158622729743525,
          "token": " states"
        },
        {
          "prob": 0.0010578273106620025,
          "token": " indicates"
        },
        {
          "prob": 1.9374792267344748e-05,
          "token": " notes"
        },
        {
          "prob": 9.152003833398906e-06,
          "token": " mention"
        }
      ],
      [
        {
          "prob": 0.9959152390305116,
          "token": " that"
        },
        {
          "prob": 0.004070077775844906,
          "token": " \""
        },
        {
          "prob": 1.143201082806048e-05,
          "token": " several"
        },
        {
          "prob": 9.383965930897407e-07,
          "token": "that"
        },
        {
          "prob": 8.281320867976331e-07,
          "token": " the"
        }
      ],
      [
        {
          "prob": 0.8968953060486196,
          "token": " Sk"
        },
        {
          "prob": 0.030690069466890745,
          "token": " they"
        },
        {
          "prob": 0.023901450133330324,
          "token": " such"
        },
        {
          "prob": 0.01861446808037979,
          "token": " several"
        },
        {
          "prob": 0.0127935243420418,
          "token": " activities"
        }
      ],
      [
        {
          "prob": 0.9999990463265931,
          "token": "ol"
        },
        {
          "prob": 5.043471815847051e-07,
          "token": "olk"
        },
        {
          "prob": 1.6373755690670415e-07,
          "token": "\u043e\u043b"
        },
        {
          "prob": 6.023573837886479e-08,
          "token": "oll"
        },
        {
          "prob": 3.6534822137210456e-08,
          "token": "olt"
        }
      ],
      [
        {
          "prob": 0.9997708130697388,
          "token": "tech"
        },
        {
          "prob": 0.00020342180412592125,
          "token": "Tech"
        },
        {
          "prob": 2.1440500413847554e-05,
          "token": " tech"
        },
        {
          "prob": 1.3706453346588027e-06,
          "token": "te"
        },
        {
          "prob": 9.420298435358593e-07,
          "token": "itech"
        }
      ],
      [
        {
          "prob": 0.9719042927149484,
          "token": "'s"
        },
        {
          "prob": 0.025900372339398407,
          "token": "\u2019s"
        },
        {
          "prob": 0.0010042661805710735,
          "token": " focuses"
        },
        {
          "prob": 0.0010042661805710735,
          "token": " revolves"
        },
        {
          "prob": 9.341135035935457e-05,
          "token": " operates"
        }
      ],
      [
        {
          "prob": 0.9994462220492041,
          "token": " activities"
        },
        {
          "prob": 0.0005527779994029991,
          "token": " research"
        },
        {
          "prob": 8.31068109318202e-07,
          "token": "activities"
        },
        {
          "prob": 6.821828966775053e-08,
          "token": "\u6d3b\u52a8"
        },
        {
          "prob": 1.3432977698041719e-08,
          "token": " activ"
        }
      ],
      [
        {
          "prob": 0.9996743071173864,
          "token": " rev"
        },
        {
          "prob": 0.0002611733599892507,
          "token": " \""
        },
        {
          "prob": 2.7527469619083668e-05,
          "token": " revolves"
        },
        {
          "prob": 2.7527469619083668e-05,
          "token": " are"
        },
        {
          "prob": 6.960034292016553e-06,
          "token": "rev"
        }
      ],
      [
        {
          "prob": 0.9999979734461775,
          "token": "olve"
        },
        {
          "prob": 1.7603429545652396e-06,
          "token": "olved"
        },
        {
          "prob": 2.1024298423113373e-07,
          "token": "olv"
        },
        {
          "prob": 3.224180587614433e-08,
          "token": "ol"
        },
        {
          "prob": 1.18610975280741e-08,
          "token": "italize"
        }
      ],
      [
        {
          "prob": 0.9999998807907247,
          "token": " around"
        },
        {
          "prob": 1.1253517471925912e-07,
          "token": "around"
        },
        {
          "prob": 4.691164021834418e-08,
          "token": " \""
        },
        {
          "prob": 1.186112015134383e-08,
          "token": "-around"
        },
        {
          "prob": 1.8189616875530459e-09,
          "token": " Around"
        }
      ],
      [
        {
          "prob": 0.9988302578423817,
          "token": " several"
        },
        {
          "prob": 0.001169509749830765,
          "token": " \""
        },
        {
          "prob": 8.753990310405111e-08,
          "token": " multiple"
        },
        {
          "prob": 4.685673358788839e-08,
          "token": " Several"
        },
        {
          "prob": 6.341369311659378e-09,
          "token": " target"
        }
      ],
      [
        {
          "prob": 0.9999881984200047,
          "token": " target"
        },
        {
          "prob": 4.78506263111966e-06,
          "token": " unspecified"
        },
        {
          "prob": 1.994710872696699e-06,
          "token": " such"
        },
        {
          "prob": 1.5534823896572347e-06,
          "token": " domains"
        },
        {
          "prob": 7.338131211462616e-07,
          "token": " targeted"
        }
      ],
      [
        {
          "prob": 0.9999970197767496,
          "token": " domains"
        },
        {
          "prob": 2.561281443046568e-06,
          "token": "domains"
        },
        {
          "prob": 2.699570779818012e-07,
          "token": "_domains"
        },
        {
          "prob": 7.734392402719739e-08,
          "token": " areas"
        },
        {
          "prob": 9.23741442396384e-09,
          "token": " domain"
        }
      ],
      [
        {
          "prob": 0.9966435222191945,
          "token": " without"
        },
        {
          "prob": 0.003172097687707355,
          "token": "."
        },
        {
          "prob": 0.0001789575910029165,
          "token": " but"
        },
        {
          "prob": 3.714146308737898e-06,
          "token": "without"
        },
        {
          "prob": 1.366358068487473e-06,
          "token": ","
        }
      ],
      [
        {
          "prob": 0.9904290263907924,
          "token": " specifying"
        },
        {
          "prob": 0.00667345974052045,
          "token": " enumer"
        },
        {
          "prob": 0.000903154564151467,
          "token": " listing"
        },
        {
          "prob": 0.0007033774817956759,
          "token": " elabor"
        },
        {
          "prob": 0.0004834238021811602,
          "token": " naming"
        }
      ],
      [
        {
          "prob": 0.9524980045301813,
          "token": " them"
        },
        {
          "prob": 0.04742208680501878,
          "token": " what"
        },
        {
          "prob": 2.6228421264991888e-05,
          "token": " those"
        },
        {
          "prob": 2.6228421264991888e-05,
          "token": " their"
        },
        {
          "prob": 8.515121678593825e-06,
          "token": " these"
        }
      ],
      [
        {
          "prob": 0.9999982118638471,
          "token": "."
        },
        {
          "prob": 1.553497204890439e-06,
          "token": " further"
        },
        {
          "prob": 7.734407154916583e-08,
          "token": " all"
        },
        {
          "prob": 7.734407154916583e-08,
          "token": " in"
        },
        {
          "prob": 4.691155074157667e-08,
          "token": " explicitly"
        }
      ],
      [
        {
          "prob": 0.9999948740268748,
          "token": ""
        },
        {
          "prob": 6.47592129616951e-07,
          "token": ""
        },
        {
          "prob": 4.737885232106008e-07,
          "token": "<tool_call>"
        },
        {
          "prob": 3.256297724168536e-07,
          "token": " Therefore"
        },
        {
          "prob": 1.7429705715215876e-07,
          "token": " Based"
        }
      ]
    ],
    "language_consistency_score": 0.6326587398913442
  },
  {
    "question": "How does Skoltech ensure student input before drafting a policy?\n",
    "true_answer": "Skoltech provides students the opportunity to express their concerns or opinions on the issue through the Student Council before a policy is drafted. \n",
    "source_doc": "Among other things, it highlights that we have all gathered here for science, innovation, and education. Please leave your conflicts and arguments on other topics outside of the Campus. *Text Overlay: Policies*\n\nNow along with the Code of Ethics, you will likely hear the term \u201cPolicy\u201d. A Policy is an official document passed by Skoltech\u2019s leadership team to optimize the university\u2019s functions and/or activities. For instance, you can hear something like \u201cSkoltech Policy on Student Scholarships and Other Benefits\u201d or \u201cSkoltech\u2019s IP policy\u201d, which, btw, you will learn about in the next modules. The policies don\u2019t just appear out of thin air: their formation is a long process that involves all the leadership and representative parties of Skoltech you\u2019ve read about already. That includes the students, too. In fact, before a policy is drafted, **Skoltech makes sure to give the students the opportunity to voice their concerns or opinions** on the issue in question through the Student Council. You can also participate in working groups and contribute your feedback any time. So this way, you the students are quite literally the policy makers of the institute\\! *Text Overlay: Feedback and freedom for exploration*\n\nFinally, Skoltech is a young university. That means you, as part of the growing community, have an opportunity to shape its values and mission. One way to do that is through feedback, and here we want to stress that **your feedback and participation in university-wide initiatives is crucial** to strengthening Skoltech as an international community of scientists every day. As a student, you have incredible freedom to explore your passions, try your hand in different subject areas and even work-related activities. This university was literally built to open your abilities and your mind, to help you reach for incredible goals and achieve them. The growth of our community and university wouldn\u2019t be possible without your input. Please keep that in mind as you dive into your academic year and the next lessons of this orientation course. Embrace the opportunities that come your way, and get the most out of them while you are still here. Life tends to be quick, but the memories, knowledge and experience that you\u2019ll gain from the next few years at Skoltech will last you a lifetime. This is the end of Module 1\\.",
    "context": "Sim: 6.01 - The policies don\u2019t just appear out of thin air: their formation is a long process that involves all the leadership and representative parties of Skoltech you\u2019ve read about already. That includes the students, too. In fact, before a policy is drafted, **Skoltech makes sure to give the students the opportunity to voice their concerns or opinions** on the issue in question through the Student Council. You can also participate in working groups and contribute your feedback any time. So this way, you the students are quite literally the policy makers of the institute\\!",
    "generated_answer": "Skoltech ensures student input before drafting a policy by giving students the opportunity to voice their concerns or opinions through the Student Council.",
    "logprobs": [
      [
        {
          "prob": 0.9968210509895069,
          "token": "Sk"
        },
        {
          "prob": 0.003172663440846801,
          "token": "Before"
        },
        {
          "prob": 4.769904288628014e-06,
          "token": " Sk"
        },
        {
          "prob": 7.314885140360312e-07,
          "token": "Through"
        },
        {
          "prob": 1.2711364367274743e-07,
          "token": "before"
        }
      ],
      [
        {
          "prob": 0.9999777083605178,
          "token": "ol"
        },
        {
          "prob": 1.8925091296908553e-05,
          "token": "olk"
        },
        {
          "prob": 7.338054231806457e-07,
          "token": "olt"
        },
        {
          "prob": 6.475810130566981e-07,
          "token": "\u043e\u043b"
        },
        {
          "prob": 6.475810130566981e-07,
          "token": "\u00f6"
        }
      ],
      [
        {
          "prob": 0.9997863034267085,
          "token": "tech"
        },
        {
          "prob": 8.480011805181931e-05,
          "token": "Tech"
        },
        {
          "prob": 6.604239834330446e-05,
          "token": "te"
        },
        {
          "prob": 1.147644799504116e-05,
          "token": "tek"
        },
        {
          "prob": 1.147644799504116e-05,
          "token": " tech"
        }
      ],
      [
        {
          "prob": 0.9985621414492043,
          "token": " ensures"
        },
        {
          "prob": 0.0013248724417660883,
          "token": " gives"
        },
        {
          "prob": 6.596151483690708e-05,
          "token": "\u786e\u4fdd"
        },
        {
          "prob": 1.4718003369192106e-05,
          "token": " ensure"
        },
        {
          "prob": 8.926920293168849e-06,
          "token": " ensured"
        }
      ],
      [
        {
          "prob": 0.999991059383269,
          "token": " student"
        },
        {
          "prob": 4.785076321313246e-06,
          "token": "\u5b66\u751f"
        },
        {
          "prob": 3.726621186095193e-06,
          "token": "student"
        },
        {
          "prob": 3.4662976610628127e-07,
          "token": " students"
        },
        {
          "prob": 4.1398982374506896e-08,
          "token": ".student"
        }
      ],
      [
        {
          "prob": 0.9999867679437158,
          "token": " input"
        },
        {
          "prob": 1.3007123989067183e-05,
          "token": "input"
        },
        {
          "prob": 7.734318642157583e-08,
          "token": "\u8f93\u5165"
        },
        {
          "prob": 4.691101388455558e-08,
          "token": "(input"
        },
        {
          "prob": 3.653433434796543e-08,
          "token": "_input"
        }
      ],
      [
        {
          "prob": 0.9990713882643698,
          "token": " before"
        },
        {
          "prob": 0.0009110353310143418,
          "token": " by"
        },
        {
          "prob": 1.6686194137737095e-05,
          "token": " through"
        },
        {
          "prob": 7.331402042570447e-07,
          "token": "before"
        },
        {
          "prob": 6.819266161877052e-08,
          "token": "_before"
        }
      ],
      [
        {
          "prob": 0.9999824765407688,
          "token": " drafting"
        },
        {
          "prob": 6.144106881838195e-06,
          "token": " drafted"
        },
        {
          "prob": 4.785035250849994e-06,
          "token": "_draft"
        },
        {
          "prob": 1.9946994589021863e-06,
          "token": "draft"
        },
        {
          "prob": 1.3709355525136263e-06,
          "token": " crafting"
        }
      ],
      [
        {
          "prob": 1.0,
          "token": " a"
        },
        {
          "prob": 9.237449661970594e-09,
          "token": " policies"
        },
        {
          "prob": 2.646573638909117e-09,
          "token": " policy"
        },
        {
          "prob": 6.224144622907783e-11,
          "token": "a"
        },
        {
          "prob": 9.545034922840628e-12,
          "token": "\u653f\u7b56"
        }
      ],
      [
        {
          "prob": 0.9999966621509202,
          "token": " policy"
        },
        {
          "prob": 2.260322940135999e-06,
          "token": "policy"
        },
        {
          "prob": 1.0677009553134769e-06,
          "token": "\u653f\u7b56"
        },
        {
          "prob": 2.6465635430511496e-09,
          "token": ".policy"
        },
        {
          "prob": 1.8189547487781048e-09,
          "token": "_policy"
        }
      ],
      [
        {
          "prob": 0.9999998807907247,
          "token": " by"
        },
        {
          "prob": 1.6373771305908126e-07,
          "token": " through"
        },
        {
          "prob": 3.581747930283181e-10,
          "token": "by"
        },
        {
          "prob": 2.172439935079017e-10,
          "token": " By"
        },
        {
          "prob": 4.277787868968998e-11,
          "token": "_by"
        }
      ],
      [
        {
          "prob": 0.9965316369509748,
          "token": " giving"
        },
        {
          "prob": 0.0019237589209813845,
          "token": " allowing"
        },
        {
          "prob": 0.0014982249541009031,
          "token": " providing"
        },
        {
          "prob": 1.4688080616065246e-05,
          "token": " involving"
        },
        {
          "prob": 7.861963012757174e-06,
          "token": " Giving"
        }
      ],
      [
        {
          "prob": 0.9753924276834892,
          "token": " students"
        },
        {
          "prob": 0.02293902989959055,
          "token": " the"
        },
        {
          "prob": 0.0016616981487074334,
          "token": " them"
        },
        {
          "prob": 5.99301642862021e-06,
          "token": "students"
        },
        {
          "prob": 1.8097341495129837e-07,
          "token": "\u5b66\u751f"
        }
      ],
      [
        {
          "prob": 0.9999963045256735,
          "token": " the"
        },
        {
          "prob": 3.2887473357670864e-06,
          "token": " opportunities"
        },
        {
          "prob": 3.466314189697482e-07,
          "token": " an"
        },
        {
          "prob": 2.5109895770606383e-08,
          "token": "\u673a\u4f1a"
        },
        {
          "prob": 2.2159405241782167e-08,
          "token": "\u7684\u673a\u4f1a"
        }
      ],
      [
        {
          "prob": 0.9998456478015768,
          "token": " opportunity"
        },
        {
          "prob": 9.609680441568883e-05,
          "token": " chance"
        },
        {
          "prob": 5.828565817852365e-05,
          "token": "\u673a\u4f1a"
        },
        {
          "prob": 1.3438333632178725e-08,
          "token": " opportunities"
        },
        {
          "prob": 1.0465784755915588e-08,
          "token": "\u7684\u673a\u4f1a"
        }
      ],
      [
        {
          "prob": 1.0,
          "token": " to"
        },
        {
          "prob": 2.335593038799337e-09,
          "token": " through"
        },
        {
          "prob": 1.162823303022097e-10,
          "token": "to"
        },
        {
          "prob": 3.775134544279098e-11,
          "token": "\tto"
        },
        {
          "prob": 6.560200168153779e-12,
          "token": "_to"
        }
      ],
      [
        {
          "prob": 0.999991297797926,
          "token": " voice"
        },
        {
          "prob": 5.422201831302804e-06,
          "token": "voice"
        },
        {
          "prob": 1.2098567629757041e-06,
          "token": " express"
        },
        {
          "prob": 9.422373944097135e-07,
          "token": " vo"
        },
        {
          "prob": 7.33815220605445e-07,
          "token": " voiced"
        }
      ],
      [
        {
          "prob": 0.9999716289935482,
          "token": " their"
        },
        {
          "prob": 2.7535661536881667e-05,
          "token": " concerns"
        },
        {
          "prob": 8.315049292164037e-07,
          "token": "\u4ed6\u4eec\u7684"
        },
        {
          "prob": 1.725733424460403e-08,
          "token": "their"
        },
        {
          "prob": 9.73592176206895e-10,
          "token": " Their"
        }
      ],
      [
        {
          "prob": 0.9999994039539004,
          "token": " concerns"
        },
        {
          "prob": 3.9278597995802437e-07,
          "token": " Concern"
        },
        {
          "prob": 2.3823673954981372e-07,
          "token": " opinions"
        },
        {
          "prob": 1.7257827987960214e-08,
          "token": "Concern"
        },
        {
          "prob": 5.602796437537268e-09,
          "token": " views"
        }
      ],
      [
        {
          "prob": 0.9999971389852362,
          "token": " or"
        },
        {
          "prob": 2.902312105056987e-06,
          "token": "\u6216"
        },
        {
          "prob": 4.599046606658694e-10,
          "token": " and"
        },
        {
          "prob": 1.6918946955790182e-10,
          "token": " \u0438\u043b\u0438"
        },
        {
          "prob": 4.277779709743936e-11,
          "token": "\u6216\u662f"
        }
      ],
      [
        {
          "prob": 0.9999983310727032,
          "token": " opinions"
        },
        {
          "prob": 1.067701973552941e-06,
          "token": "\u610f\u89c1"
        },
        {
          "prob": 3.466320801173418e-07,
          "token": "\u7684\u610f\u89c1"
        },
        {
          "prob": 1.8553878237411744e-07,
          "token": " Op"
        },
        {
          "prob": 6.825590357542018e-08,
          "token": " opinion"
        }
      ],
      [
        {
          "prob": 0.9399112209862985,
          "token": " through"
        },
        {
          "prob": 0.06008651990167183,
          "token": " on"
        },
        {
          "prob": 1.003547076924864e-06,
          "token": "\u901a\u8fc7"
        },
        {
          "prob": 6.086820706199226e-07,
          "token": " via"
        },
        {
          "prob": 2.8752105141399574e-07,
          "token": " about"
        }
      ],
      [
        {
          "prob": 1.0,
          "token": " the"
        },
        {
          "prob": 1.4166087866431961e-09,
          "token": "the"
        },
        {
          "prob": 2.020683909022217e-11,
          "token": " meetings"
        },
        {
          "prob": 1.57371021068629e-11,
          "token": " initiatives"
        },
        {
          "prob": 1.2256067444099483e-11,
          "token": " their"
        }
      ],
      [
        {
          "prob": 0.9999909401759619,
          "token": " Student"
        },
        {
          "prob": 7.889257112872668e-06,
          "token": "Student"
        },
        {
          "prob": 7.33815220605445e-07,
          "token": " Students"
        },
        {
          "prob": 2.102415807124786e-07,
          "token": ".Student"
        },
        {
          "prob": 1.2751796464856653e-07,
          "token": "(Student"
        }
      ],
      [
        {
          "prob": 0.9999938011552557,
          "token": " Council"
        },
        {
          "prob": 6.144177195963701e-06,
          "token": "Council"
        },
        {
          "prob": 1.344033304471242e-08,
          "token": "ouncil"
        },
        {
          "prob": 6.691547801839581e-10,
          "token": " Counsel"
        },
        {
          "prob": 1.3176438873691744e-10,
          "token": " council"
        }
      ],
      [
        {
          "prob": 0.9997967894605428,
          "token": "."
        },
        {
          "prob": 0.0001398132250813237,
          "token": " before"
        },
        {
          "prob": 5.143441111129444e-05,
          "token": ","
        },
        {
          "prob": 1.01280360550662e-05,
          "token": " and"
        },
        {
          "prob": 1.7599887646971433e-06,
          "token": " on"
        }
      ],
      [
        {
          "prob": 0.9999614968828868,
          "token": ""
        },
        {
          "prob": 3.120169471072154e-05,
          "token": " Students"
        },
        {
          "prob": 8.314969994052664e-07,
          "token": "Students"
        },
        {
          "prob": 5.368548123952241e-07,
          "token": "students"
        },
        {
          "prob": 3.6897455682657627e-07,
          "token": " Additionally"
        }
      ]
    ],
    "language_consistency_score": 0.7533649763633474
  },
  {
    "question": "How many enterprises have Skoltech faculty, students and alumni founded in Russia and abroad?\n",
    "true_answer": "120 \n",
    "source_doc": "\n### Text After Video 2\n\nMore information about the Skolkovo Foundation and the project goals: [https://old.sk.ru/foundation/about/](https://old.sk.ru/foundation/about/)  \nThe Skolkovo Innovation Center: [https://sk.ru/](https://sk.ru/) \n\nFaculty, students and alumni founded more than 120 enterprises in Russia and abroad, 71+ companies received Skolkovo residency. Skoltech campus, marked with the prestigious Prix Versailles Award, cultivates strong and active interaction between research, teaching & learning, building a community of faculty, students, and staff, which now exceeds 2200 people. Over the 10 years of its existence, Skoltech has achieved a lot, and we mean A LOT: from the development of new technology to the construction of one of the most comfortable campuses in the world. Read about our university\u2019s top 10 achievements in the last 10 years in the 2021 Annual Report: [https://www.skoltech.ru/app/data/uploads/2019/10/SKOLTECH-ANNUAL-REPORT-2021-ONLINE-VERSION.pdf](https://www.skoltech.ru/app/data/uploads/2019/10/SKOLTECH-ANNUAL-REPORT-2021-ONLINE-VERSION.pdf)\n\nFor more information on Skoltech strategy, see the [Strategy booklet](https://www.skoltech.ru/app/data/uploads/2019/10/Skoltech-strategy-2021-2025-Dec-2021-for-site.pdf): [https://www.skoltech.ru/app/data/uploads/2019/10/Skoltech-strategy-2021-2025-Dec-2021-for-site.pdf](https://www.skoltech.ru/app/data/uploads/2019/10/Skoltech-strategy-2021-2025-Dec-2021-for-site.pdf)\n\nSkoltech Founders: [founded (links to an external site)](https://www.skoltech.ru/en/about/founders/)  \nMandatory reading: [Code of Ethics https://www.skoltech.ru/app/data/uploads/2018/10/Code-of-Ethics.pdf](https://www.skoltech.ru/app/data/uploads/2018/10/Code-of-Ethics.pdf)\n\nHighlights: \n\n* Skoltech is part of the bigger Skolkovo community which provides a number of career opportunities for students and alumi. * Skoltech is a place of mutual respect and non-discrimination zone. Please remember that while communicating with others.",
    "context": "Sim: 8.69 - Faculty, students and alumni founded more than 120 enterprises in Russia and abroad, 71+ companies received Skolkovo residency. Skoltech campus, marked with the prestigious Prix Versailles Award, cultivates strong and active interaction between research, teaching & learning, building a community of faculty, students, and staff, which now exceeds 2200 people.",
    "generated_answer": "More than 120 enterprises.",
    "logprobs": [
      [
        {
          "prob": 0.9691082734543581,
          "token": "More"
        },
        {
          "prob": 0.015664179309360385,
          "token": "1"
        },
        {
          "prob": 0.012199275112300767,
          "token": "Sk"
        },
        {
          "prob": 0.0011347093433110153,
          "token": "Faculty"
        },
        {
          "prob": 0.0010013774808057712,
          "token": "Over"
        }
      ],
      [
        {
          "prob": 1.0,
          "token": " than"
        },
        {
          "prob": 3.398267819495071e-09,
          "token": "than"
        },
        {
          "prob": 2.061153622438558e-09,
          "token": "_than"
        },
        {
          "prob": 2.172439935079017e-10,
          "token": " Than"
        },
        {
          "prob": 1.493094676197164e-10,
          "token": "Than"
        }
      ],
      [
        {
          "prob": 1.0,
          "token": " "
        },
        {
          "prob": 1.2501528663867426e-09,
          "token": "1"
        },
        {
          "prob": 1.334793228597603e-15,
          "token": " one"
        },
        {
          "prob": 9.76555587454154e-16,
          "token": " ("
        },
        {
          "prob": 8.095930175212601e-16,
          "token": "\n"
        }
      ],
      [
        {
          "prob": 1.0,
          "token": "1"
        },
        {
          "prob": 8.878265478459658e-13,
          "token": "2"
        },
        {
          "prob": 5.384940217754036e-13,
          "token": "8"
        },
        {
          "prob": 3.2661313427874473e-13,
          "token": "\u4e00\u767e"
        },
        {
          "prob": 1.2790354113010132e-13,
          "token": "9"
        }
      ],
      [
        {
          "prob": 1.0,
          "token": "2"
        },
        {
          "prob": 9.056076989672867e-11,
          "token": "0"
        },
        {
          "prob": 2.020683909022217e-11,
          "token": "1"
        },
        {
          "prob": 2.129785170955785e-12,
          "token": "5"
        },
        {
          "prob": 6.914400106940203e-13,
          "token": "4"
        }
      ],
      [
        {
          "prob": 1.0,
          "token": "0"
        },
        {
          "prob": 2.129785170955785e-12,
          "token": "1"
        },
        {
          "prob": 6.101936677605324e-13,
          "token": "5"
        },
        {
          "prob": 2.543665647376923e-13,
          "token": "\uff10"
        },
        {
          "prob": 1.9810087980489796e-13,
          "token": "9"
        }
      ],
      [
        {
          "prob": 0.9997822520581376,
          "token": " enterprises"
        },
        {
          "prob": 0.000203424132117042,
          "token": "."
        },
        {
          "prob": 1.3004469684073204e-05,
          "token": " Enterprises"
        },
        {
          "prob": 4.4498848223009117e-07,
          "token": "enter"
        },
        {
          "prob": 3.465573784185509e-07,
          "token": " enter"
        }
      ],
      [
        {
          "prob": 0.9769947680145946,
          "token": "."
        },
        {
          "prob": 0.02297671551276715,
          "token": " have"
        },
        {
          "prob": 2.3741774562257817e-05,
          "token": " were"
        },
        {
          "prob": 1.3394192657715695e-06,
          "token": "have"
        },
        {
          "prob": 7.169394695827472e-07,
          "token": ".have"
        }
      ],
      [
        {
          "prob": 0.9999974966112362,
          "token": ""
        },
        {
          "prob": 6.083576662864179e-07,
          "token": ""
        },
        {
          "prob": 2.238022783058102e-07,
          "token": "<tool_call>"
        },
        {
          "prob": 2.0816874453306735e-08,
          "token": " b\u1ee5"
        },
        {
          "prob": 1.0467381829779195e-08,
          "token": "\ud83e\udd16"
        }
      ]
    ],
    "language_consistency_score": 0.3333604537247219
  },
  {
    "question": "Where can I find information about Skoltech policies?\n",
    "true_answer": "The Skoltech Wiki. \n",
    "source_doc": "* If you are unsure about a certain situation (e.g. terms of getting a scholarship), there is a good chance that we have a policy about it. Don\u2019t forget to consult policies in our [Wiki  \u0421\u0441\u044b\u043b\u043a\u0430:  Wiki (links to an external site)](https://wiki.skoltech.ru/pages/viewpage.action?pageId=136773929)  \n* Getting feedback from you makes Skoltech a better place for everyone. Tell us what you think\\! ## \u201cNavigating the Skoltech Campus\u201d \\- Module 2\n",
    "context": "Sim: 2.60 - Finally, the Education Department has a [Canvas course with more information on policies, resources and academics](https://skoltech.instructure.com/courses/2072). Review it before the start of your studies at Skoltech.\nSim: 1.63 - * [Skoltech Policy on Protection, Management and Commercialization of Intellectual Property  (links to an external site)](https://box.skoltech.ru/index.php/s/5ObKxspK8llpIGf\\#pdfviewer) (updated in June 2022\\)  \nSim: 0.59 - You can explore the different centers\u2019 missions and ongoing projects on the Skoltech website: [on the Skoltech website (links to an external site)](https://www.skoltech.ru/research/en)  ",
    "generated_answer": "You can find information about Skoltech policies on the Skoltech website, specifically through the provided external link for the Skoltech Policy on Protection, Management and Commercialization of Intellectual Property.",
    "logprobs": [
      [
        {
          "prob": 0.9999885560391694,
          "token": "You"
        },
        {
          "prob": 2.902287194419277e-06,
          "token": " b\u1ea1n"
        },
        {
          "prob": 2.902287194419277e-06,
          "token": "The"
        },
        {
          "prob": 1.5534823896572347e-06,
          "token": " You"
        },
        {
          "prob": 1.2098533015526917e-06,
          "token": "you"
        }
      ],
      [
        {
          "prob": 0.9999997615814777,
          "token": " can"
        },
        {
          "prob": 1.8553913626159784e-07,
          "token": "\u53ef\u4ee5"
        },
        {
          "prob": 3.850741922767617e-09,
          "token": "can"
        },
        {
          "prob": 1.103256032343554e-09,
          "token": " Can"
        },
        {
          "prob": 7.582560427911907e-10,
          "token": "_can"
        }
      ],
      [
        {
          "prob": 0.9999996423722521,
          "token": " find"
        },
        {
          "prob": 2.699578503363014e-07,
          "token": "find"
        },
        {
          "prob": 8.764248219443636e-08,
          "token": "\u627e\u5230"
        },
        {
          "prob": 3.2241867372567335e-08,
          "token": ".find"
        },
        {
          "prob": 1.7257827987960214e-08,
          "token": " found"
        }
      ],
      [
        {
          "prob": 0.7766568773705244,
          "token": " information"
        },
        {
          "prob": 0.22251592751260296,
          "token": " Sk"
        },
        {
          "prob": 0.0005515618396647983,
          "token": " the"
        },
        {
          "prob": 0.0002605392405911323,
          "token": " Information"
        },
        {
          "prob": 5.407319428585507e-06,
          "token": " more"
        }
      ],
      [
        {
          "prob": 0.9999997615814777,
          "token": " about"
        },
        {
          "prob": 2.382369667501818e-07,
          "token": "about"
        },
        {
          "prob": 1.186112015134383e-08,
          "token": "\u5173\u4e8e"
        },
        {
          "prob": 1.917171513758312e-10,
          "token": " on"
        },
        {
          "prob": 1.3176514270095466e-10,
          "token": "_about"
        }
      ],
      [
        {
          "prob": 0.9999996423722521,
          "token": " Sk"
        },
        {
          "prob": 3.4663274126619643e-07,
          "token": "Sk"
        },
        {
          "prob": 8.152020714470167e-09,
          "token": "_sk"
        },
        {
          "prob": 2.4616969518153846e-10,
          "token": " Sc"
        },
        {
          "prob": 2.172439935079017e-10,
          "token": " Skyl"
        }
      ],
      [
        {
          "prob": 0.9999992847447459,
          "token": "ol"
        },
        {
          "prob": 4.4508482557577276e-07,
          "token": "olt"
        },
        {
          "prob": 8.764248219443636e-08,
          "token": "\u043e\u043b"
        },
        {
          "prob": 8.764248219443636e-08,
          "token": "ole"
        },
        {
          "prob": 3.6534822137210456e-08,
          "token": "olk"
        }
      ],
      [
        {
          "prob": 0.9997991726845671,
          "token": "tech"
        },
        {
          "prob": 8.48011693903664e-05,
          "token": "Tech"
        },
        {
          "prob": 6.604321712658821e-05,
          "token": "te"
        },
        {
          "prob": 2.4295941809693496e-05,
          "token": " tech"
        },
        {
          "prob": 1.3004680520270802e-05,
          "token": "tek"
        }
      ],
      [
        {
          "prob": 0.9999997615814777,
          "token": " policies"
        },
        {
          "prob": 1.4449802461092448e-07,
          "token": " pol"
        },
        {
          "prob": 6.023573837886479e-08,
          "token": "'s"
        },
        {
          "prob": 2.510999155743982e-08,
          "token": " Policies"
        },
        {
          "prob": 8.152020714470167e-09,
          "token": " policy"
        }
      ],
      [
        {
          "prob": 0.8748576057937673,
          "token": " on"
        },
        {
          "prob": 0.11839909834323618,
          "token": " in"
        },
        {
          "prob": 0.005894744003908147,
          "token": " at"
        },
        {
          "prob": 0.0003768383765309117,
          "token": " through"
        },
        {
          "prob": 0.00020170714392415127,
          "token": " ["
        }
      ],
      [
        {
          "prob": 0.9999915362117302,
          "token": " the"
        },
        {
          "prob": 3.288731653835139e-06,
          "token": " their"
        },
        {
          "prob": 2.902295497941424e-06,
          "token": " Canvas"
        },
        {
          "prob": 1.3709473193983572e-06,
          "token": " this"
        },
        {
          "prob": 3.9278298325024844e-07,
          "token": " ["
        }
      ],
      [
        {
          "prob": 0.9349678280227164,
          "token": " Sk"
        },
        {
          "prob": 0.036252639040552134,
          "token": " ["
        },
        {
          "prob": 0.015112348329120506,
          "token": " Canvas"
        },
        {
          "prob": 0.013336600591228332,
          "token": " Education"
        },
        {
          "prob": 0.00011538414834160346,
          "token": " education"
        }
      ],
      [
        {
          "prob": 0.9999996423722521,
          "token": "ol"
        },
        {
          "prob": 1.4449802461092448e-07,
          "token": "\u043e\u043b"
        },
        {
          "prob": 8.764248219443636e-08,
          "token": "olk"
        },
        {
          "prob": 2.510999155743982e-08,
          "token": "ole"
        },
        {
          "prob": 1.7257827987960214e-08,
          "token": "olare"
        }
      ],
      [
        {
          "prob": 0.9999033306101257,
          "token": "tech"
        },
        {
          "prob": 4.539555700163772e-05,
          "token": "Tech"
        },
        {
          "prob": 1.6700092141428838e-05,
          "token": " tech"
        },
        {
          "prob": 7.888564955304052e-06,
          "token": "-tech"
        },
        {
          "prob": 4.784656506526527e-06,
          "token": "tek"
        }
      ],
      [
        {
          "prob": 0.9525336943177941,
          "token": " website"
        },
        {
          "prob": 0.047423861928370524,
          "token": " Policy"
        },
        {
          "prob": 1.0934039326927342e-05,
          "token": " Education"
        },
        {
          "prob": 9.649255838751533e-06,
          "token": " site"
        },
        {
          "prob": 6.631830086285119e-06,
          "token": "website"
        }
      ],
      [
        {
          "prob": 0.5555925725639927,
          "token": ","
        },
        {
          "prob": 0.20439108511384568,
          "token": " or"
        },
        {
          "prob": 0.15917993713947717,
          "token": " through"
        },
        {
          "prob": 0.03551784910040584,
          "token": " at"
        },
        {
          "prob": 0.02154266444644292,
          "token": " under"
        }
      ],
      [
        {
          "prob": 0.9995561425049928,
          "token": " specifically"
        },
        {
          "prob": 0.00013977949507135994,
          "token": " particularly"
        },
        {
          "prob": 0.0001088603802189007,
          "token": " under"
        },
        {
          "prob": 6.602715823073796e-05,
          "token": " ["
        },
        {
          "prob": 5.8268762625089224e-05,
          "token": " in"
        }
      ],
      [
        {
          "prob": 0.7338595826530011,
          "token": " through"
        },
        {
          "prob": 0.185548771314993,
          "token": " at"
        },
        {
          "prob": 0.03653671939171518,
          "token": " via"
        },
        {
          "prob": 0.015230767006759053,
          "token": " ["
        },
        {
          "prob": 0.010467942871508764,
          "token": " in"
        }
      ],
      [
        {
          "prob": 0.8167930093650794,
          "token": " the"
        },
        {
          "prob": 0.1822511549877481,
          "token": " a"
        },
        {
          "prob": 0.0005119059250512111,
          "token": " this"
        },
        {
          "prob": 0.0002740034967102464,
          "token": " links"
        },
        {
          "prob": 8.895591127179695e-05,
          "token": " ["
        }
      ],
      [
        {
          "prob": 0.6613770766927343,
          "token": " provided"
        },
        {
          "prob": 0.14757316864292697,
          "token": " link"
        },
        {
          "prob": 0.11493009929944,
          "token": " ["
        },
        {
          "prob": 0.04228042070405636,
          "token": " Education"
        },
        {
          "prob": 0.029058879852669785,
          "token": " Canvas"
        }
      ],
      [
        {
          "prob": 0.5724527108472258,
          "token": " external"
        },
        {
          "prob": 0.34721014105978976,
          "token": " link"
        },
        {
          "prob": 0.07747305437982979,
          "token": " links"
        },
        {
          "prob": 0.0012522352951970595,
          "token": " ["
        },
        {
          "prob": 0.00046067162061225035,
          "token": " Canvas"
        }
      ],
      [
        {
          "prob": 0.9045905203683052,
          "token": " link"
        },
        {
          "prob": 0.09534314010319446,
          "token": " links"
        },
        {
          "prob": 3.198405270590167e-05,
          "token": "\u94fe\u63a5"
        },
        {
          "prob": 2.19822965170516e-05,
          "token": " site"
        },
        {
          "prob": 4.328570832007951e-06,
          "token": "link"
        }
      ],
      [
        {
          "prob": 0.8160349152866752,
          "token": " for"
        },
        {
          "prob": 0.1251430129724206,
          "token": "."
        },
        {
          "prob": 0.05216736913633702,
          "token": " to"
        },
        {
          "prob": 0.0037789915453523624,
          "token": " ["
        },
        {
          "prob": 0.0012268589293249873,
          "token": ":"
        }
      ],
      [
        {
          "prob": 0.9998984440011163,
          "token": " the"
        },
        {
          "prob": 8.480966144874997e-05,
          "token": " Sk"
        },
        {
          "prob": 1.012906960451979e-05,
          "token": " ["
        },
        {
          "prob": 1.994532064085875e-06,
          "token": " intellectual"
        },
        {
          "prob": 1.994532064085875e-06,
          "token": " policy"
        }
      ],
      [
        {
          "prob": 0.8315992734413067,
          "token": " Sk"
        },
        {
          "prob": 0.14451028296304985,
          "token": " Policy"
        },
        {
          "prob": 0.015231275396939654,
          "token": " Intellectual"
        },
        {
          "prob": 0.0071947450531014145,
          "token": " policy"
        },
        {
          "prob": 0.0004058997406098814,
          "token": " Protection"
        }
      ],
      [
        {
          "prob": 0.9999462394998376,
          "token": "ol"
        },
        {
          "prob": 4.5397505209397035e-05,
          "token": "olk"
        },
        {
          "prob": 1.209802535152927e-06,
          "token": "ole"
        },
        {
          "prob": 9.421951617388703e-07,
          "token": "opol"
        },
        {
          "prob": 8.851104426571503e-07,
          "token": "\u043e\u043b"
        }
      ],
      [
        {
          "prob": 0.9997486508085994,
          "token": "tech"
        },
        {
          "prob": 0.00013980642509631722,
          "token": "Tech"
        },
        {
          "prob": 4.005521142196975e-05,
          "token": " tech"
        },
        {
          "prob": 4.005521142196975e-05,
          "token": "te"
        },
        {
          "prob": 1.3004023218702832e-05,
          "token": "tek"
        }
      ],
      [
        {
          "prob": 0.9999972581939645,
          "token": " Policy"
        },
        {
          "prob": 1.5534957233607605e-06,
          "token": "Policy"
        },
        {
          "prob": 8.315263400842229e-07,
          "token": " Intellectual"
        },
        {
          "prob": 1.8553860543063036e-07,
          "token": " policy"
        },
        {
          "prob": 9.931175369924415e-08,
          "token": " Patent"
        }
      ],
      [
        {
          "prob": 1.0,
          "token": " on"
        },
        {
          "prob": 3.398267819495071e-09,
          "token": "on"
        },
        {
          "prob": 5.4927883509546835e-11,
          "token": ".on"
        },
        {
          "prob": 2.9400777392844726e-11,
          "token": " for"
        },
        {
          "prob": 2.5946094982764667e-11,
          "token": "_on"
        }
      ],
      [
        {
          "prob": 0.9999721058045592,
          "token": " Protection"
        },
        {
          "prob": 2.4300159191342506e-05,
          "token": "Protection"
        },
        {
          "prob": 3.2886689268551154e-06,
          "token": " the"
        },
        {
          "prob": 9.930910182472368e-08,
          "token": " Protect"
        },
        {
          "prob": 5.315633170763946e-08,
          "token": " protection"
        }
      ],
      [
        {
          "prob": 1.0,
          "token": ","
        },
        {
          "prob": 1.4166087866431961e-09,
          "token": " and"
        },
        {
          "prob": 9.736200313009565e-10,
          "token": "."
        },
        {
          "prob": 5.905303998944039e-10,
          "token": " Management"
        },
        {
          "prob": 2.289734845645553e-11,
          "token": "\uff0c"
        }
      ],
      [
        {
          "prob": 0.9999965429424904,
          "token": " Management"
        },
        {
          "prob": 3.2887473357670864e-06,
          "token": "Management"
        },
        {
          "prob": 8.764214786553686e-08,
          "token": " MANAGEMENT"
        },
        {
          "prob": 4.139921926206193e-08,
          "token": " management"
        },
        {
          "prob": 2.2159405241782167e-08,
          "token": " Managing"
        }
      ],
      [
        {
          "prob": 0.9994471746722718,
          "token": " and"
        },
        {
          "prob": 0.0005527785265734312,
          "token": ","
        },
        {
          "prob": 9.730816406926608e-10,
          "token": "\u548c"
        },
        {
          "prob": 7.987540513719823e-11,
          "token": " \u0438"
        },
        {
          "prob": 7.987540513719823e-11,
          "token": "and"
        }
      ],
      [
        {
          "prob": 0.9998412384322287,
          "token": " Commercial"
        },
        {
          "prob": 0.0001584362410990077,
          "token": "Commercial"
        },
        {
          "prob": 1.8550976589758522e-07,
          "token": " commercial"
        },
        {
          "prob": 8.762860861683498e-08,
          "token": "\u5546\u4e1a"
        },
        {
          "prob": 2.2155981983612878e-08,
          "token": " Commerce"
        }
      ],
      [
        {
          "prob": 0.9999997615814777,
          "token": "ization"
        },
        {
          "prob": 2.1024338523818466e-07,
          "token": "IZATION"
        },
        {
          "prob": 5.602796437537268e-09,
          "token": "iz"
        },
        {
          "prob": 4.363462252943702e-09,
          "token": "\u5316"
        },
        {
          "prob": 2.061153622438558e-09,
          "token": "isation"
        }
      ],
      [
        {
          "prob": 1.0,
          "token": " of"
        },
        {
          "prob": 7.991959892953932e-11,
          "token": "."
        },
        {
          "prob": 7.05287985111216e-11,
          "token": " and"
        },
        {
          "prob": 2.020683909022217e-11,
          "token": " c\u1ee7a"
        },
        {
          "prob": 1.57371021068629e-11,
          "token": "_of"
        }
      ],
      [
        {
          "prob": 0.999998927117538,
          "token": " Intellectual"
        },
        {
          "prob": 6.47594599989589e-07,
          "token": "Intel"
        },
        {
          "prob": 2.1024318473456359e-07,
          "token": "\u77e5\u8bc6\u4ea7\u6743"
        },
        {
          "prob": 1.4449788680693535e-07,
          "token": " Intel"
        },
        {
          "prob": 9.931175369924415e-08,
          "token": " intellectual"
        }
      ],
      [
        {
          "prob": 0.9999984502816872,
          "token": " Property"
        },
        {
          "prob": 1.370956471489639e-06,
          "token": "Property"
        },
        {
          "prob": 1.1253496007565217e-07,
          "token": "_property"
        },
        {
          "prob": 1.7257795071296986e-08,
          "token": "_Property"
        },
        {
          "prob": 1.3440384315611926e-08,
          "token": " Properties"
        }
      ],
      [
        {
          "prob": 0.9998965370444355,
          "token": "."
        },
        {
          "prob": 6.604970476837299e-05,
          "token": ","
        },
        {
          "prob": 3.535385932757689e-05,
          "token": " and"
        },
        {
          "prob": 8.314430786950503e-07,
          "token": ":"
        },
        {
          "prob": 2.3821243036233644e-07,
          "token": ".["
        }
      ],
      [
        {
          "prob": 0.9918600771578291,
          "token": ""
        },
        {
          "prob": 0.00757294337781225,
          "token": " Additionally"
        },
        {
          "prob": 0.00048412207318303675,
          "token": " There"
        },
        {
          "prob": 1.138546530941453e-05,
          "token": " You"
        },
        {
          "prob": 5.052269605074147e-06,
          "token": " Alternatively"
        }
      ]
    ],
    "language_consistency_score": 0.6845428308855079
  },
  {
    "question": "What does the letter section, like \"A\" or \"C\", in a Skoltech location indicate?\n",
    "true_answer": "The letter section, like \"A\" or \"C\", in a Skoltech location indicates a laboratory facility. \n",
    "source_doc": "\n### Sometimes the location can include an additional letter section \\- like A, B, or C and look like this: E-C4 or E-A1. The C4 and A1 here means it\u2019s a laboratory facility.",
    "context": "Sim: 1.41 - 1) The first letter E indicates that the room is located on the main Skoltech campus. That\u2019s an easy one\\! R3 (or R1 or R2) indicate the ring you\u2019re on.   \nSim: 1.02 - ### Sometimes the location can include an additional letter section \\- like A, B, or C and look like this: E-C4 or E-A1. The C4 and A1 here means it\u2019s a laboratory facility.",
    "generated_answer": "The letter section, like \"A\" or \"C\", indicates an additional section or wing within the ring of buildings, suggesting it's a specific area or type of facility such as a laboratory.",
    "logprobs": [
      [
        {
          "prob": 0.7771405979086164,
          "token": "The"
        },
        {
          "prob": 0.2226545157712364,
          "token": "It"
        },
        {
          "prob": 0.00010867657123117219,
          "token": "These"
        },
        {
          "prob": 6.591567244414986e-05,
          "token": "A"
        },
        {
          "prob": 1.297956548318848e-05,
          "token": "This"
        }
      ],
      [
        {
          "prob": 0.996823893869935,
          "token": " letter"
        },
        {
          "prob": 0.0031726725179227,
          "token": " additional"
        },
        {
          "prob": 2.8931014721655345e-06,
          "token": " letters"
        },
        {
          "prob": 3.455316963175461e-07,
          "token": "letter"
        },
        {
          "prob": 5.298900183264917e-08,
          "token": "-letter"
        }
      ],
      [
        {
          "prob": 0.9984980763623067,
          "token": " section"
        },
        {
          "prob": 0.0015011812350883861,
          "token": " sections"
        },
        {
          "prob": 7.327194205132467e-07,
          "token": "section"
        },
        {
          "prob": 4.684118541803004e-08,
          "token": "(section"
        },
        {
          "prob": 2.8410615093319544e-08,
          "token": " segment"
        }
      ],
      [
        {
          "prob": 0.9867484400379728,
          "token": ","
        },
        {
          "prob": 0.0096737427547675,
          "token": " like"
        },
        {
          "prob": 0.003558771078660157,
          "token": " indicates"
        },
        {
          "prob": 9.995855545385945e-06,
          "token": " ("
        },
        {
          "prob": 2.527348075818016e-06,
          "token": " indicating"
        }
      ],
      [
        {
          "prob": 0.9914222426714454,
          "token": " like"
        },
        {
          "prob": 0.008577484930474293,
          "token": " such"
        },
        {
          "prob": 1.8394766666341164e-07,
          "token": "like"
        },
        {
          "prob": 8.689064232113559e-08,
          "token": "\u5982"
        },
        {
          "prob": 8.082088712686887e-09,
          "token": "_like"
        }
      ],
      [
        {
          "prob": 0.9999998807907247,
          "token": " \""
        },
        {
          "prob": 6.82560337633487e-08,
          "token": " A"
        },
        {
          "prob": 2.646573638909117e-09,
          "token": " '"
        },
        {
          "prob": 2.335593038799337e-09,
          "token": "\"A"
        },
        {
          "prob": 1.493094676197164e-10,
          "token": " \u201c"
        }
      ],
      [
        {
          "prob": 1.0,
          "token": "A"
        },
        {
          "prob": 8.25807328555592e-14,
          "token": " A"
        },
        {
          "prob": 8.25807328555592e-14,
          "token": "C"
        },
        {
          "prob": 2.6810038677818034e-14,
          "token": "\uff21"
        },
        {
          "prob": 1.435037960133826e-14,
          "token": "\tA"
        }
      ],
      [
        {
          "prob": 1.0,
          "token": "\""
        },
        {
          "prob": 2.8453348089834e-08,
          "token": "\","
        },
        {
          "prob": 7.582560427911907e-10,
          "token": "\u201d"
        },
        {
          "prob": 2.172439935079017e-10,
          "token": ",\""
        },
        {
          "prob": 7.991959892953932e-11,
          "token": "'"
        }
      ],
      [
        {
          "prob": 0.9999997615814777,
          "token": " or"
        },
        {
          "prob": 2.382369667501818e-07,
          "token": "\u6216"
        },
        {
          "prob": 2.7894680928689246e-10,
          "token": "or"
        },
        {
          "prob": 1.3176514270095466e-10,
          "token": " \u0438\u043b\u0438"
        },
        {
          "prob": 1.162823303022097e-10,
          "token": " \u6216"
        }
      ],
      [
        {
          "prob": 1.0,
          "token": " \""
        },
        {
          "prob": 1.4166087866431961e-09,
          "token": "\"C"
        },
        {
          "prob": 2.5946094982764667e-11,
          "token": " \u201c"
        },
        {
          "prob": 3.0988191387218256e-12,
          "token": " '"
        },
        {
          "prob": 1.6586783589142312e-12,
          "token": "\""
        }
      ],
      [
        {
          "prob": 1.0,
          "token": "C"
        },
        {
          "prob": 8.592166619174109e-10,
          "token": " C"
        },
        {
          "prob": 1.026187963170189e-10,
          "token": "'C"
        },
        {
          "prob": 6.224144622907783e-11,
          "token": "Cc"
        },
        {
          "prob": 5.4927883509546835e-11,
          "token": "B"
        }
      ],
      [
        {
          "prob": 0.9999909401759619,
          "token": "\","
        },
        {
          "prob": 8.939699493298122e-06,
          "token": ",\""
        },
        {
          "prob": 7.734348146298033e-08,
          "token": "\""
        },
        {
          "prob": 1.1861007035426688e-08,
          "token": "\"\u060c"
        },
        {
          "prob": 6.348739569456282e-09,
          "token": ","
        }
      ],
      [
        {
          "prob": 0.9739993089040481,
          "token": " indicates"
        },
        {
          "prob": 0.02595620001951453,
          "token": " in"
        },
        {
          "prob": 1.4355975384685254e-05,
          "token": " typically"
        },
        {
          "prob": 9.866707968481277e-06,
          "token": " indicating"
        },
        {
          "prob": 8.707339220891473e-06,
          "token": " indicated"
        }
      ],
      [
        {
          "prob": 0.959303899943177,
          "token": " an"
        },
        {
          "prob": 0.022560666746307544,
          "token": " that"
        },
        {
          "prob": 0.013683736085194785,
          "token": " additional"
        },
        {
          "prob": 0.0026944873955877854,
          "token": " a"
        },
        {
          "prob": 0.001634289217633235,
          "token": " it"
        }
      ],
      [
        {
          "prob": 0.9999847414437658,
          "token": " additional"
        },
        {
          "prob": 1.3007099179970686e-05,
          "token": "additional"
        },
        {
          "prob": 1.2098486863374133e-06,
          "token": " addition"
        },
        {
          "prob": 3.9278036114969935e-07,
          "token": " area"
        },
        {
          "prob": 2.699537311378345e-07,
          "token": " Additional"
        }
      ],
      [
        {
          "prob": 0.9870319662145466,
          "token": " section"
        },
        {
          "prob": 0.005869106095090779,
          "token": " specific"
        },
        {
          "prob": 0.0014839424128179264,
          "token": " designation"
        },
        {
          "prob": 0.001309574582925731,
          "token": " location"
        },
        {
          "prob": 0.001155695513135471,
          "token": " segment"
        }
      ],
      [
        {
          "prob": 0.7734649535332193,
          "token": " or"
        },
        {
          "prob": 0.11861467816482862,
          "token": " of"
        },
        {
          "prob": 0.10467708608152991,
          "token": " within"
        },
        {
          "prob": 0.0027895498558727526,
          "token": " on"
        },
        {
          "prob": 0.00033316421941488274,
          "token": " and"
        }
      ],
      [
        {
          "prob": 0.5374206364047558,
          "token": " wing"
        },
        {
          "prob": 0.4185436124707565,
          "token": " building"
        },
        {
          "prob": 0.02675660115661975,
          "token": " block"
        },
        {
          "prob": 0.005970204701104227,
          "token": " area"
        },
        {
          "prob": 0.0015095041434987902,
          "token": " subdivision"
        }
      ],
      [
        {
          "prob": 0.5301726039605084,
          "token": " within"
        },
        {
          "prob": 0.3215659200749088,
          "token": " of"
        },
        {
          "prob": 0.08130459725632136,
          "token": " on"
        },
        {
          "prob": 0.06332008401052827,
          "token": " in"
        },
        {
          "prob": 0.003572275544625622,
          "token": ","
        }
      ],
      [
        {
          "prob": 0.8175696552259107,
          "token": " the"
        },
        {
          "prob": 0.18242445897639878,
          "token": " a"
        },
        {
          "prob": 5.02332307241204e-06,
          "token": " that"
        },
        {
          "prob": 4.672418297205466e-07,
          "token": " an"
        },
        {
          "prob": 2.2070941240149879e-07,
          "token": " its"
        }
      ],
      [
        {
          "prob": 0.4556047355106373,
          "token": " ring"
        },
        {
          "prob": 0.16760760550452394,
          "token": " building"
        },
        {
          "prob": 0.08971388635299886,
          "token": " specified"
        },
        {
          "prob": 0.06165939224908783,
          "token": " laboratory"
        },
        {
          "prob": 0.06165939224908783,
          "token": " facility"
        }
      ],
      [
        {
          "prob": 0.5441027416963009,
          "token": " of"
        },
        {
          "prob": 0.4237476413043774,
          "token": ","
        },
        {
          "prob": 0.01449984519592626,
          "token": "."
        },
        {
          "prob": 0.004154275202363057,
          "token": " indicated"
        },
        {
          "prob": 0.0032353527806944673,
          "token": " or"
        }
      ],
      [
        {
          "prob": 0.8319555642781915,
          "token": " buildings"
        },
        {
          "prob": 0.08768747787807564,
          "token": " the"
        },
        {
          "prob": 0.05318514380592616,
          "token": " rooms"
        },
        {
          "prob": 0.009242192172134806,
          "token": " laboratories"
        },
        {
          "prob": 0.006352059592434099,
          "token": " facilities"
        }
      ],
      [
        {
          "prob": 0.7691321269185775,
          "token": ","
        },
        {
          "prob": 0.22036003721421202,
          "token": "."
        },
        {
          "prob": 0.005182370734237777,
          "token": " on"
        },
        {
          "prob": 0.005182370734237777,
          "token": " at"
        },
        {
          "prob": 0.00010755672449217487,
          "token": " and"
        }
      ],
      [
        {
          "prob": 0.27852536005363837,
          "token": " suggesting"
        },
        {
          "prob": 0.27852536005363837,
          "token": " specifying"
        },
        {
          "prob": 0.19142749383626098,
          "token": " specifically"
        },
        {
          "prob": 0.11610664412364344,
          "token": " often"
        },
        {
          "prob": 0.037694308491438684,
          "token": " typically"
        }
      ],
      [
        {
          "prob": 0.986887860238061,
          "token": " it"
        },
        {
          "prob": 0.008538253053910164,
          "token": " a"
        },
        {
          "prob": 0.0024462504567514293,
          "token": " specific"
        },
        {
          "prob": 0.0008999252509951014,
          "token": " the"
        },
        {
          "prob": 0.0004816952754079488,
          "token": " locations"
        }
      ],
      [
        {
          "prob": 0.9231761382781875,
          "token": "'s"
        },
        {
          "prob": 0.059016671200398926,
          "token": " could"
        },
        {
          "prob": 0.00798703981684649,
          "token": " is"
        },
        {
          "prob": 0.0037728104648890016,
          "token": " specifies"
        },
        {
          "prob": 0.0020194399189678827,
          "token": " might"
        }
      ],
      [
        {
          "prob": 0.8276552518939727,
          "token": " a"
        },
        {
          "prob": 0.16297498457050785,
          "token": " likely"
        },
        {
          "prob": 0.008114047666333246,
          "token": " part"
        },
        {
          "prob": 0.0005877796415135155,
          "token": " possibly"
        },
        {
          "prob": 0.00019082411088036907,
          "token": " specifically"
        }
      ],
      [
        {
          "prob": 0.9865721593711488,
          "token": " specific"
        },
        {
          "prob": 0.007532571383487593,
          "token": " laboratory"
        },
        {
          "prob": 0.0031400429202931746,
          "token": " specialized"
        },
        {
          "prob": 0.0005456576408629966,
          "token": " distinct"
        },
        {
          "prob": 0.0005456576408629966,
          "token": " part"
        }
      ],
      [
        {
          "prob": 0.6000085769881341,
          "token": " area"
        },
        {
          "prob": 0.3639235980338514,
          "token": " part"
        },
        {
          "prob": 0.01598968697080493,
          "token": " laboratory"
        },
        {
          "prob": 0.005191091327359477,
          "token": " subsection"
        },
        {
          "prob": 0.004581122017428494,
          "token": " lab"
        }
      ],
      [
        {
          "prob": 0.9634818830620356,
          "token": " or"
        },
        {
          "prob": 0.025675921240081848,
          "token": " within"
        },
        {
          "prob": 0.00833575316968942,
          "token": ","
        },
        {
          "prob": 0.001641407120732214,
          "token": " of"
        },
        {
          "prob": 0.0002852336521672412,
          "token": " possibly"
        }
      ],
      [
        {
          "prob": 0.4133849646767934,
          "token": " type"
        },
        {
          "prob": 0.19526923071934305,
          "token": " wing"
        },
        {
          "prob": 0.17232449127989696,
          "token": " laboratory"
        },
        {
          "prob": 0.10452007492087523,
          "token": " lab"
        },
        {
          "prob": 0.05594556461105956,
          "token": " facility"
        }
      ],
      [
        {
          "prob": 1.0,
          "token": " of"
        },
        {
          "prob": 1.3440409951135022e-08,
          "token": " within"
        },
        {
          "prob": 1.0467401794744658e-08,
          "token": ","
        },
        {
          "prob": 2.061153622438558e-09,
          "token": " like"
        },
        {
          "prob": 2.061153622438558e-09,
          "token": " ("
        }
      ],
      [
        {
          "prob": 0.9529027741783124,
          "token": " facility"
        },
        {
          "prob": 0.03694805282461649,
          "token": " space"
        },
        {
          "prob": 0.009341928514658867,
          "token": " room"
        },
        {
          "prob": 0.00041045569306318367,
          "token": " laboratory"
        },
        {
          "prob": 0.00011759752496117598,
          "token": " location"
        }
      ],
      [
        {
          "prob": 0.9109205363157344,
          "token": " such"
        },
        {
          "prob": 0.07477290985575502,
          "token": ","
        },
        {
          "prob": 0.012993586506811268,
          "token": " like"
        },
        {
          "prob": 0.0009412522495569364,
          "token": " within"
        },
        {
          "prob": 0.00034626735156836875,
          "token": "."
        }
      ],
      [
        {
          "prob": 1.0,
          "token": " as"
        },
        {
          "prob": 1.162823303022097e-10,
          "token": " a"
        },
        {
          "prob": 7.991959892953932e-11,
          "token": "as"
        },
        {
          "prob": 6.560200168153779e-12,
          "token": "\u4f5c\u4e3a"
        },
        {
          "prob": 2.7346982915918745e-12,
          "token": "\tas"
        }
      ],
      [
        {
          "prob": 1.0,
          "token": " a"
        },
        {
          "prob": 1.9555681087850496e-08,
          "token": " laboratory"
        },
        {
          "prob": 1.522997974471263e-08,
          "token": " an"
        },
        {
          "prob": 5.211412487888539e-10,
          "token": " another"
        },
        {
          "prob": 4.058652126475693e-10,
          "token": " laboratories"
        }
      ],
      [
        {
          "prob": 0.9998369482867208,
          "token": " laboratory"
        },
        {
          "prob": 0.0001584354856179393,
          "token": " lab"
        },
        {
          "prob": 3.726045485336082e-06,
          "token": "\u5b9e\u9a8c\u5ba4"
        },
        {
          "prob": 3.465762175942344e-07,
          "token": " classroom"
        },
        {
          "prob": 2.3819811863644441e-07,
          "token": " Laboratory"
        }
      ],
      [
        {
          "prob": 0.9999870063564401,
          "token": "."
        },
        {
          "prob": 1.3007123989067183e-05,
          "token": " within"
        },
        {
          "prob": 4.1398824450223246e-08,
          "token": ","
        },
        {
          "prob": 2.2159193914233397e-08,
          "token": " in"
        },
        {
          "prob": 1.7257597572636077e-08,
          "token": " facility"
        }
      ],
      [
        {
          "prob": 0.9999988079084972,
          "token": ""
        },
        {
          "prob": 2.53601689161434e-07,
          "token": ""
        },
        {
          "prob": 1.275189375371399e-07,
          "token": "<tool_call>"
        },
        {
          "prob": 6.348788006680007e-09,
          "token": "UrlParser"
        },
        {
          "prob": 5.9641343865087276e-09,
          "token": "indre"
        }
      ]
    ],
    "language_consistency_score": 0.4762677916974593
  },
  {
    "question": "What should students do if they hear an alarm during an emergency at Skoltech?\n",
    "true_answer": "Students should walk to the nearest fire exit, take the stairs, check in with an employee in a bright vest, and follow the instructions of security and safety personnel. \n",
    "source_doc": "\n### For more information on campus regulations, feel free to refer to [this official document](https://drive.google.com/file/d/1UeumlluoILU0lGHeXphZKpHAOtq9KhC9/view?usp=sharing) by clicking the link in the description. We also expect you to follow some basic social behavior rules. Avoid any discriminatory or violent actions or words. Be respectful of others\u2019 space and activities, don\u2019t interrupt people when they\u2019re conferencing or studying in silence. And the most important rule: don\u2019t cut in line at the cafeteria \\- everyone there is as hungry as you are\\! But that one is a pretty obvious one, right? In case of emergency, you will hear an alarm throughout the building and you will be asked to walk towards general assembly areas outside of the buildings. In case of a fire or any kind of alarm-sounding emergency \n\n1. Walk to the nearest fire exit  \n2. Take the stairs (don\u2019t take the elevators)   \n3. Check in with an employee in a bright vest  \n4. Follow the instructions of security and safety personnel.",
    "context": "Sim: 1.43 - 2. Save emergency numbers on your phone or just flip your student pass when necessary. Skoltech cares about you, don\u2019t hesitate to use your medical insurance or request mental health support.  ",
    "generated_answer": "The context does not provide specific instructions for what students should do if they hear an alarm during an emergency at Skoltech.",
    "logprobs": [
      [
        {
          "prob": 0.9738186225860197,
          "token": "The"
        },
        {
          "prob": 0.0229020176387352,
          "token": "Based"
        },
        {
          "prob": 0.0016590165933441192,
          "token": "Students"
        },
        {
          "prob": 0.0012920434220248546,
          "token": "Save"
        },
        {
          "prob": 0.00022452348055446668,
          "token": "There"
        }
      ],
      [
        {
          "prob": 0.8022548712383377,
          "token": " context"
        },
        {
          "prob": 0.08455705140948454,
          "token": " given"
        },
        {
          "prob": 0.04526012812879439,
          "token": " documents"
        },
        {
          "prob": 0.02745165537263598,
          "token": " document"
        },
        {
          "prob": 0.0188672284226773,
          "token": " provided"
        }
      ],
      [
        {
          "prob": 0.7972941157711273,
          "token": " does"
        },
        {
          "prob": 0.20158752497296276,
          "token": " provided"
        },
        {
          "prob": 0.000823842237619808,
          "token": " doesn"
        },
        {
          "prob": 0.00020829983904154317,
          "token": "\u63d0\u4f9b\u7684"
        },
        {
          "prob": 5.2666447109457524e-05,
          "token": " provides"
        }
      ],
      [
        {
          "prob": 0.9999997615814777,
          "token": " not"
        },
        {
          "prob": 1.6373771305908126e-07,
          "token": "not"
        },
        {
          "prob": 1.186112015134383e-08,
          "token": "_not"
        },
        {
          "prob": 9.237449661970594e-09,
          "token": " NOT"
        },
        {
          "prob": 2.9989608248573072e-09,
          "token": " Not"
        }
      ],
      [
        {
          "prob": 0.7115441470345286,
          "token": " provide"
        },
        {
          "prob": 0.26176245537874376,
          "token": " specify"
        },
        {
          "prob": 0.02148677335097539,
          "token": " specifically"
        },
        {
          "prob": 0.0029079185572951556,
          "token": " explicitly"
        },
        {
          "prob": 0.001998581248026272,
          "token": " mention"
        }
      ],
      [
        {
          "prob": 0.9973451236958648,
          "token": " specific"
        },
        {
          "prob": 0.0016990969632277536,
          "token": " information"
        },
        {
          "prob": 0.0004295989894155774,
          "token": " explicit"
        },
        {
          "prob": 0.0003345718698271982,
          "token": " instructions"
        },
        {
          "prob": 0.00013947030538378084,
          "token": " specifics"
        }
      ],
      [
        {
          "prob": 0.9901014732058679,
          "token": " instructions"
        },
        {
          "prob": 0.00588735895394046,
          "token": " information"
        },
        {
          "prob": 0.0027809914538218018,
          "token": " guidance"
        },
        {
          "prob": 0.0007967673915471401,
          "token": " actions"
        },
        {
          "prob": 0.0002282776796600369,
          "token": " steps"
        }
      ],
      [
        {
          "prob": 0.9999151301890851,
          "token": " for"
        },
        {
          "prob": 8.48110364334263e-05,
          "token": " on"
        },
        {
          "prob": 4.139590295963707e-08,
          "token": " regarding"
        },
        {
          "prob": 3.65317561415722e-08,
          "token": "for"
        },
        {
          "prob": 3.2239161640913233e-08,
          "token": " about"
        }
      ],
      [
        {
          "prob": 0.2884004760560959,
          "token": " what"
        },
        {
          "prob": 0.2545125268234274,
          "token": " responding"
        },
        {
          "prob": 0.22460651659065345,
          "token": " alarms"
        },
        {
          "prob": 0.056789414100066785,
          "token": " alarm"
        },
        {
          "prob": 0.056789414100066785,
          "token": " students"
        }
      ],
      [
        {
          "prob": 0.9999367038714213,
          "token": " students"
        },
        {
          "prob": 5.144162221324315e-05,
          "token": " to"
        },
        {
          "prob": 1.0129456005230989e-05,
          "token": "students"
        },
        {
          "prob": 5.043159186617052e-07,
          "token": " Students"
        },
        {
          "prob": 5.043159186617052e-07,
          "token": " actions"
        }
      ],
      [
        {
          "prob": 0.9999972581939645,
          "token": " should"
        },
        {
          "prob": 1.5534957233607605e-06,
          "token": "should"
        },
        {
          "prob": 1.0677009553134769e-06,
          "token": "\u5e94\u8be5"
        },
        {
          "prob": 7.734407154916583e-08,
          "token": "\u5e94"
        },
        {
          "prob": 5.315775115378354e-08,
          "token": " Should"
        }
      ],
      [
        {
          "prob": 1.0,
          "token": " do"
        },
        {
          "prob": 2.215948977336598e-08,
          "token": "do"
        },
        {
          "prob": 1.7257827987960214e-08,
          "token": " doing"
        },
        {
          "prob": 3.398267819495071e-09,
          "token": " Do"
        },
        {
          "prob": 2.061153622438558e-09,
          "token": "_do"
        }
      ],
      [
        {
          "prob": 0.9998427876608137,
          "token": " if"
        },
        {
          "prob": 0.0001233903863089833,
          "token": " during"
        },
        {
          "prob": 2.1442034012785842e-05,
          "token": " upon"
        },
        {
          "prob": 1.1477093756036526e-05,
          "token": " in"
        },
        {
          "prob": 8.313978831466105e-07,
          "token": " when"
        }
      ],
      [
        {
          "prob": 0.9999988079084972,
          "token": " they"
        },
        {
          "prob": 1.0677029917933763e-06,
          "token": "\u4ed6\u4eec"
        },
        {
          "prob": 1.275189375371399e-07,
          "token": "they"
        },
        {
          "prob": 5.602785751061334e-09,
          "token": " an"
        },
        {
          "prob": 3.398261337819773e-09,
          "token": " \u043e\u043d\u0438"
        }
      ],
      [
        {
          "prob": 0.9999973774024795,
          "token": " hear"
        },
        {
          "prob": 1.5534957233607605e-06,
          "token": "hear"
        },
        {
          "prob": 5.714991385721822e-07,
          "token": " hears"
        },
        {
          "prob": 2.382362851497276e-07,
          "token": " heard"
        },
        {
          "prob": 2.1024278372789506e-07,
          "token": " hearing"
        }
      ],
      [
        {
          "prob": 1.0,
          "token": " an"
        },
        {
          "prob": 1.4166087866431961e-09,
          "token": " a"
        },
        {
          "prob": 1.6918979226151304e-10,
          "token": "an"
        },
        {
          "prob": 1.783247290814639e-11,
          "token": " An"
        },
        {
          "prob": 1.8795288165390832e-12,
          "token": "\tan"
        }
      ],
      [
        {
          "prob": 0.9997523444434523,
          "token": " alarm"
        },
        {
          "prob": 0.0002305027061332081,
          "token": " emergency"
        },
        {
          "prob": 1.4735545005454231e-05,
          "token": "alarm"
        },
        {
          "prob": 1.2095671914951093e-06,
          "token": " alarms"
        },
        {
          "prob": 4.4497490246653176e-07,
          "token": "\u62a5\u8b66"
        }
      ],
      [
        {
          "prob": 0.999998927117538,
          "token": " during"
        },
        {
          "prob": 5.715002286213223e-07,
          "token": "during"
        },
        {
          "prob": 3.059020287707785e-07,
          "token": " durante"
        },
        {
          "prob": 1.4449788680693535e-07,
          "token": "\u671f\u95f4"
        },
        {
          "prob": 5.315775115378354e-08,
          "token": "."
        }
      ],
      [
        {
          "prob": 0.9999998807907247,
          "token": " an"
        },
        {
          "prob": 1.6373771305908126e-07,
          "token": " a"
        },
        {
          "prob": 1.3440409951135022e-08,
          "token": "an"
        },
        {
          "prob": 9.736200313009565e-10,
          "token": " emergencies"
        },
        {
          "prob": 2.289734845645553e-11,
          "token": " emergency"
        }
      ],
      [
        {
          "prob": 0.9999711521845835,
          "token": " emergency"
        },
        {
          "prob": 2.4300136016915854e-05,
          "token": "emergency"
        },
        {
          "prob": 4.2227304620416605e-06,
          "token": "\u7d27\u6025"
        },
        {
          "prob": 1.6373302855254685e-07,
          "token": "\u5e94\u6025"
        },
        {
          "prob": 1.2751541085137618e-07,
          "token": " Emergency"
        }
      ],
      [
        {
          "prob": 0.9999850990607846,
          "token": " at"
        },
        {
          "prob": 1.4738974314670568e-05,
          "token": "."
        },
        {
          "prob": 1.444958197628687e-07,
          "token": ","
        },
        {
          "prob": 3.2241375404467544e-08,
          "token": ";"
        },
        {
          "prob": 4.598985203171805e-10,
          "token": "at"
        }
      ],
      [
        {
          "prob": 0.9999997615814777,
          "token": " Sk"
        },
        {
          "prob": 2.699578503363014e-07,
          "token": "Sk"
        },
        {
          "prob": 6.34880011604368e-09,
          "token": "_sk"
        },
        {
          "prob": 1.8189616875530459e-09,
          "token": " SK"
        },
        {
          "prob": 1.026187963170189e-10,
          "token": " Sketch"
        }
      ],
      [
        {
          "prob": 0.9998763952461884,
          "token": "ol"
        },
        {
          "prob": 0.00010889526843745734,
          "token": "olk"
        },
        {
          "prob": 8.938667959837776e-06,
          "token": "olt"
        },
        {
          "prob": 1.3707891286187466e-06,
          "token": "opt"
        },
        {
          "prob": 1.3707891286187466e-06,
          "token": "ole"
        }
      ],
      [
        {
          "prob": 0.9998556583877783,
          "token": "tech"
        },
        {
          "prob": 7.48410516393564e-05,
          "token": "Tech"
        },
        {
          "prob": 1.473707685234926e-05,
          "token": "te"
        },
        {
          "prob": 7.88818880818261e-06,
          "token": "ten"
        },
        {
          "prob": 4.494554501137141e-06,
          "token": "tec"
        }
      ],
      [
        {
          "prob": 0.9999878408000585,
          "token": "."
        },
        {
          "prob": 1.1478757578876643e-05,
          "token": ","
        },
        {
          "prob": 7.338124213278687e-07,
          "token": ";"
        },
        {
          "prob": 4.691110336029911e-08,
          "token": " beyond"
        },
        {
          "prob": 2.9989265046707144e-09,
          "token": "\u3002"
        }
      ],
      [
        {
          "prob": 0.9628098618326446,
          "token": ""
        },
        {
          "prob": 0.025658015636052186,
          "token": " It"
        },
        {
          "prob": 0.005725075772998647,
          "token": " The"
        },
        {
          "prob": 0.0027043343070724713,
          "token": " Based"
        },
        {
          "prob": 0.0023865666495447137,
          "token": " However"
        }
      ]
    ],
    "language_consistency_score": 0.7224217016834327
  },
  {
    "question": "What should I do if there is a fire at Skoltech?\n",
    "true_answer": "Walk to the nearest fire exit, take the stairs, check in with an employee in a bright vest, and follow the instructions of security and safety personnel. \n",
    "source_doc": "*Text Overlay:* \n\n1. *Walk to the nearest fire exit*   \n2. *Take the stairs (don\u2019t take the elevators)*   \n3. *Check in with an employee in a bright vest*  \n4. *Follow the instructions of security and safety personnel.* \n\n![][image5]\n",
    "context": "",
    "generated_answer": "The document does not provide specific instructions for a fire at Skoltech.",
    "logprobs": [
      [
        {
          "prob": 0.7175010811856655,
          "token": "The"
        },
        {
          "prob": 0.20556750151206585,
          "token": "Use"
        },
        {
          "prob": 0.04047864591571191,
          "token": "If"
        },
        {
          "prob": 0.010234604472052052,
          "token": "There"
        },
        {
          "prob": 0.009032006745764383,
          "token": "Information"
        }
      ],
      [
        {
          "prob": 0.6503088758534472,
          "token": " document"
        },
        {
          "prob": 0.2710890633240446,
          "token": " context"
        },
        {
          "prob": 0.03237697149743537,
          "token": " information"
        },
        {
          "prob": 0.022252345389908217,
          "token": " given"
        },
        {
          "prob": 0.015293798414437633,
          "token": " question"
        }
      ],
      [
        {
          "prob": 0.9993675181589384,
          "token": " does"
        },
        {
          "prob": 0.0002304141338770065,
          "token": " provides"
        },
        {
          "prob": 0.0002304141338770065,
          "token": " provided"
        },
        {
          "prob": 5.825781647716307e-05,
          "token": " indicates"
        },
        {
          "prob": 5.825781647716307e-05,
          "token": " states"
        }
      ],
      [
        {
          "prob": 1.0,
          "token": " not"
        },
        {
          "prob": 3.6534822137210456e-08,
          "token": "not"
        },
        {
          "prob": 4.363462252943702e-09,
          "token": "_not"
        },
        {
          "prob": 9.736200313009565e-10,
          "token": " NOT"
        },
        {
          "prob": 5.905303998944039e-10,
          "token": " Not"
        }
      ],
      [
        {
          "prob": 0.9818323838723747,
          "token": " provide"
        },
        {
          "prob": 0.017982883942210773,
          "token": " specify"
        },
        {
          "prob": 6.485643723117846e-05,
          "token": "\u63d0\u4f9b"
        },
        {
          "prob": 5.7235604969187217e-05,
          "token": " contain"
        },
        {
          "prob": 3.933741766043767e-05,
          "token": "provide"
        }
      ],
      [
        {
          "prob": 0.9984628974997415,
          "token": " specific"
        },
        {
          "prob": 0.0008034960597375363,
          "token": " information"
        },
        {
          "prob": 0.00033494699026591286,
          "token": " specifics"
        },
        {
          "prob": 0.000230205475373066,
          "token": "\u5177\u4f53"
        },
        {
          "prob": 9.596391940506744e-05,
          "token": " instructions"
        }
      ],
      [
        {
          "prob": 0.9656000563594269,
          "token": " instructions"
        },
        {
          "prob": 0.029158594591376815,
          "token": " information"
        },
        {
          "prob": 0.0018640465880201912,
          "token": " actions"
        },
        {
          "prob": 0.0012811392351131698,
          "token": " guidance"
        },
        {
          "prob": 0.00113060140676697,
          "token": " details"
        }
      ],
      [
        {
          "prob": 0.9911452064204952,
          "token": " for"
        },
        {
          "prob": 0.005201051597708662,
          "token": "."
        },
        {
          "prob": 0.00357462700154382,
          "token": ","
        },
        {
          "prob": 5.777849174509039e-05,
          "token": " on"
        },
        {
          "prob": 1.1377259600297445e-05,
          "token": ";"
        }
      ],
      [
        {
          "prob": 0.5117595986378759,
          "token": " a"
        },
        {
          "prob": 0.2739251738252146,
          "token": " what"
        },
        {
          "prob": 0.1007714278567191,
          "token": " dealing"
        },
        {
          "prob": 0.07848086692603641,
          "token": " handling"
        },
        {
          "prob": 0.015453798977883258,
          "token": " fires"
        }
      ],
      [
        {
          "prob": 0.9999991655356624,
          "token": " fire"
        },
        {
          "prob": 3.4663241069161144e-07,
          "token": "\u706b"
        },
        {
          "prob": 3.4663241069161144e-07,
          "token": "fire"
        },
        {
          "prob": 2.8453348089834e-08,
          "token": "_fire"
        },
        {
          "prob": 2.8453348089834e-08,
          "token": " fires"
        }
      ],
      [
        {
          "prob": 0.9795482171875793,
          "token": " at"
        },
        {
          "prob": 0.020329876253519685,
          "token": " emergency"
        },
        {
          "prob": 7.33209472935452e-05,
          "token": " evacuation"
        },
        {
          "prob": 2.6973269116510185e-05,
          "token": " situation"
        },
        {
          "prob": 7.72797098888099e-06,
          "token": " drill"
        }
      ],
      [
        {
          "prob": 0.9999997615814777,
          "token": " Sk"
        },
        {
          "prob": 2.382369667501818e-07,
          "token": "Sk"
        },
        {
          "prob": 1.0467401794744658e-08,
          "token": "_sk"
        },
        {
          "prob": 1.0467401794744658e-08,
          "token": " SK"
        },
        {
          "prob": 2.7894680928689246e-10,
          "token": " the"
        }
      ],
      [
        {
          "prob": 0.9999810460826691,
          "token": "ol"
        },
        {
          "prob": 1.6701382233621983e-05,
          "token": "olk"
        },
        {
          "prob": 1.5534705375723988e-06,
          "token": "olt"
        },
        {
          "prob": 2.382324227839884e-07,
          "token": "ok"
        },
        {
          "prob": 1.6373459003983336e-07,
          "token": "\u043e\u043b"
        }
      ],
      [
        {
          "prob": 0.9993710899134133,
          "token": "tech"
        },
        {
          "prob": 0.0002958584507187747,
          "token": "itech"
        },
        {
          "prob": 0.00020334034121872104,
          "token": "Tech"
        },
        {
          "prob": 5.8257983154351416e-05,
          "token": " tech"
        },
        {
          "prob": 4.004008722597079e-05,
          "token": "-tech"
        }
      ],
      [
        {
          "prob": 0.9849327255095451,
          "token": "."
        },
        {
          "prob": 0.01404930966911893,
          "token": ","
        },
        {
          "prob": 0.001017728578929935,
          "token": ";"
        },
        {
          "prob": 1.6127069612525004e-07,
          "token": " campus"
        },
        {
          "prob": 4.0775578736817594e-08,
          "token": " or"
        }
      ],
      [
        {
          "prob": 0.9659944626248522,
          "token": ""
        },
        {
          "prob": 0.013779167941125959,
          "token": " Please"
        },
        {
          "prob": 0.003483919252760008,
          "token": " Safety"
        },
        {
          "prob": 0.003483919252760008,
          "token": " You"
        },
        {
          "prob": 0.0030745479494155453,
          "token": " It"
        }
      ]
    ],
    "language_consistency_score": 0.7563580424451729
  },
  {
    "question": "What should you do if you need to evacuate a Skoltech building?\n",
    "true_answer": "You should walk to the nearest fire exit, take the stairs, check in with an employee in a bright vest, and follow the instructions of security and safety personnel. \n",
    "source_doc": "*Text Overlay:* \n\n1. *Walk to the nearest fire exit*   \n2. *Take the stairs (don\u2019t take the elevators)*   \n3. *Check in with an employee in a bright vest*  \n4. *Follow the instructions of security and safety personnel.* \n\n![][image5]\n",
    "context": "",
    "generated_answer": "The document does not provide specific instructions for evacuating a Skoltech building.",
    "logprobs": [
      [
        {
          "prob": 0.411075582128795,
          "token": "The"
        },
        {
          "prob": 0.411075582128795,
          "token": "Use"
        },
        {
          "prob": 0.11777511913205047,
          "token": "If"
        },
        {
          "prob": 0.03823598301964377,
          "token": "You"
        },
        {
          "prob": 0.0066444191351805355,
          "token": "There"
        }
      ],
      [
        {
          "prob": 0.7519338702818279,
          "token": " document"
        },
        {
          "prob": 0.19011865583395604,
          "token": " context"
        },
        {
          "prob": 0.015605893323242238,
          "token": " question"
        },
        {
          "prob": 0.015605893323242238,
          "token": " information"
        },
        {
          "prob": 0.012153881940669863,
          "token": " given"
        }
      ],
      [
        {
          "prob": 0.9951934499443386,
          "token": " does"
        },
        {
          "prob": 0.002795294076661001,
          "token": " states"
        },
        {
          "prob": 0.0016954315604080135,
          "token": " indicates"
        },
        {
          "prob": 8.441056701106802e-05,
          "token": " suggests"
        },
        {
          "prob": 7.449206393267696e-05,
          "token": " provided"
        }
      ],
      [
        {
          "prob": 1.0,
          "token": " not"
        },
        {
          "prob": 3.6534822137210456e-08,
          "token": "not"
        },
        {
          "prob": 3.850741922767617e-09,
          "token": "_not"
        },
        {
          "prob": 5.211412487888539e-10,
          "token": " Not"
        },
        {
          "prob": 2.7894680928689246e-10,
          "token": " NOT"
        }
      ],
      [
        {
          "prob": 0.9887863162153515,
          "token": " provide"
        },
        {
          "prob": 0.01098442192249033,
          "token": " specify"
        },
        {
          "prob": 0.00010768748329601401,
          "token": "\u63d0\u4f9b"
        },
        {
          "prob": 5.764095614263936e-05,
          "token": "provide"
        },
        {
          "prob": 4.4890821780872035e-05,
          "token": " contain"
        }
      ],
      [
        {
          "prob": 0.9977423967181347,
          "token": " specific"
        },
        {
          "prob": 0.001323785017514384,
          "token": " information"
        },
        {
          "prob": 0.00048699329247431963,
          "token": " specifics"
        },
        {
          "prob": 0.0002953763629600765,
          "token": "\u5177\u4f53"
        },
        {
          "prob": 3.527767578414988e-05,
          "token": " instructions"
        }
      ],
      [
        {
          "prob": 0.9280089579912353,
          "token": " instructions"
        },
        {
          "prob": 0.05932562477097249,
          "token": " information"
        },
        {
          "prob": 0.0070854371499745284,
          "token": " details"
        },
        {
          "prob": 0.0015809747259954508,
          "token": " steps"
        },
        {
          "prob": 0.0013952052987555147,
          "token": " actions"
        }
      ],
      [
        {
          "prob": 0.9854807202274968,
          "token": " for"
        },
        {
          "prob": 0.014057129849552175,
          "token": " on"
        },
        {
          "prob": 0.00025746531413644387,
          "token": "."
        },
        {
          "prob": 0.00020051418826318773,
          "token": ","
        },
        {
          "prob": 2.860181283459223e-06,
          "token": ";"
        }
      ],
      [
        {
          "prob": 0.9940588316735076,
          "token": " evac"
        },
        {
          "prob": 0.005216341243925249,
          "token": " evacuation"
        },
        {
          "prob": 0.0003778704923176901,
          "token": " ev"
        },
        {
          "prob": 0.0002597064619790766,
          "token": " evacuate"
        },
        {
          "prob": 1.660247865588349e-05,
          "token": "ev"
        }
      ],
      [
        {
          "prob": 0.9999986886995842,
          "token": "uating"
        },
        {
          "prob": 5.043471815847051e-07,
          "token": "uing"
        },
        {
          "prob": 4.4508482557577276e-07,
          "token": "uting"
        },
        {
          "prob": 3.4663241069161144e-07,
          "token": "uations"
        },
        {
          "prob": 1.955564378838448e-08,
          "token": "ulating"
        }
      ],
      [
        {
          "prob": 0.9999417100552707,
          "token": " a"
        },
        {
          "prob": 5.829127258796956e-05,
          "token": " Sk"
        },
        {
          "prob": 2.0610317545466268e-09,
          "token": " an"
        },
        {
          "prob": 8.591658598218467e-10,
          "token": " buildings"
        },
        {
          "prob": 4.598783454629882e-10,
          "token": " the"
        }
      ],
      [
        {
          "prob": 0.9999998807907247,
          "token": " Sk"
        },
        {
          "prob": 1.1253517471925912e-07,
          "token": "Sk"
        },
        {
          "prob": 2.335593038799337e-09,
          "token": " building"
        },
        {
          "prob": 4.058652126475693e-10,
          "token": "_sk"
        },
        {
          "prob": 4.058652126475693e-10,
          "token": " SK"
        }
      ],
      [
        {
          "prob": 0.9999879600069962,
          "token": "ol"
        },
        {
          "prob": 1.1478757578876643e-05,
          "token": "olk"
        },
        {
          "prob": 2.3823401316229748e-07,
          "token": "olt"
        },
        {
          "prob": 2.1024077870602525e-07,
          "token": "ok"
        },
        {
          "prob": 3.6534404031744556e-08,
          "token": "oll"
        }
      ],
      [
        {
          "prob": 0.9992391895303306,
          "token": "tech"
        },
        {
          "prob": 0.00037983977758037686,
          "token": "Tech"
        },
        {
          "prob": 0.00023038447088092592,
          "token": " tech"
        },
        {
          "prob": 6.600625602948207e-05,
          "token": "itech"
        },
        {
          "prob": 5.140572388337227e-05,
          "token": "-tech"
        }
      ],
      [
        {
          "prob": 0.9999998807907247,
          "token": " building"
        },
        {
          "prob": 7.734421907141565e-08,
          "token": "building"
        },
        {
          "prob": 8.152020714470167e-09,
          "token": " buildings"
        },
        {
          "prob": 7.194133030325383e-09,
          "token": "-building"
        },
        {
          "prob": 6.34880011604368e-09,
          "token": " Building"
        }
      ],
      [
        {
          "prob": 0.9998303939575447,
          "token": "."
        },
        {
          "prob": 8.480383823137128e-05,
          "token": ";"
        },
        {
          "prob": 8.480383823137128e-05,
          "token": ","
        },
        {
          "prob": 7.1929119009119645e-09,
          "token": ".\n\n"
        },
        {
          "prob": 6.347722473118683e-09,
          "token": " and"
        }
      ],
      [
        {
          "prob": 0.9993938308075889,
          "token": ""
        },
        {
          "prob": 0.00017945132856396625,
          "token": " Further"
        },
        {
          "prob": 0.00013975683520882088,
          "token": " No"
        },
        {
          "prob": 7.027414998027616e-05,
          "token": " Additional"
        },
        {
          "prob": 4.8298669857592616e-05,
          "token": " Please"
        }
      ]
    ],
    "language_consistency_score": 0.7417502335119768
  },
  {
    "question": "Where can I find more information about fire safety at Skoltech?\n",
    "true_answer": "The Skoltech instruction for fire safety can be found at https://box.skoltech.ru/index.php/s/PWWi2TSueEeAn1E. \n",
    "source_doc": "\n### For more details on fire safety consult our [instruction](https://box.skoltech.ru/index.php/s/PWWi2TSueEeAn1E) \n",
    "context": "Sim: 2.85 - ### For more details on fire safety consult our [instruction](https://box.skoltech.ru/index.php/s/PWWi2TSueEeAn1E) ",
    "generated_answer": "You can find more information about fire safety at Skoltech in the provided instruction at <https://box.skoltech.ru/index.php/s/PWWi2TSueEeAn1E>.",
    "logprobs": [
      [
        {
          "prob": 0.9901905293903934,
          "token": "You"
        },
        {
          "prob": 0.008566824674639772,
          "token": "Consult"
        },
        {
          "prob": 0.0010231612995128024,
          "token": "For"
        },
        {
          "prob": 0.00017779877380222166,
          "token": "More"
        },
        {
          "prob": 8.852079707013587e-06,
          "token": " Consult"
        }
      ],
      [
        {
          "prob": 1.0,
          "token": " can"
        },
        {
          "prob": 5.3157852544244216e-08,
          "token": "\u53ef\u4ee5"
        },
        {
          "prob": 2.9989608248573072e-09,
          "token": "can"
        },
        {
          "prob": 7.582560427911907e-10,
          "token": " Can"
        },
        {
          "prob": 1.493094676197164e-10,
          "token": "_can"
        }
      ],
      [
        {
          "prob": 0.9999996423722521,
          "token": " find"
        },
        {
          "prob": 2.699578503363014e-07,
          "token": " consult"
        },
        {
          "prob": 6.82560337633487e-08,
          "token": "find"
        },
        {
          "prob": 1.7257827987960214e-08,
          "token": "\u627e\u5230"
        },
        {
          "prob": 8.152020714470167e-09,
          "token": ".find"
        }
      ],
      [
        {
          "prob": 1.0,
          "token": " more"
        },
        {
          "prob": 1.9555681087850496e-08,
          "token": "\u66f4\u591a"
        },
        {
          "prob": 1.0467401794744658e-08,
          "token": "more"
        },
        {
          "prob": 7.582560427911907e-10,
          "token": "_more"
        },
        {
          "prob": 6.691586091292782e-10,
          "token": "\u66f4\u591a\u7684"
        }
      ],
      [
        {
          "prob": 0.9999986886995842,
          "token": " information"
        },
        {
          "prob": 6.47594599989589e-07,
          "token": "information"
        },
        {
          "prob": 5.715002286213223e-07,
          "token": " details"
        },
        {
          "prob": 3.6534752452633856e-08,
          "token": " detailed"
        },
        {
          "prob": 2.845329381943118e-08,
          "token": "\u4fe1\u606f"
        }
      ],
      [
        {
          "prob": 0.9999994039539004,
          "token": " about"
        },
        {
          "prob": 5.043471815847051e-07,
          "token": " on"
        },
        {
          "prob": 1.275189375371399e-07,
          "token": "about"
        },
        {
          "prob": 2.8453348089834e-08,
          "token": "\u5173\u4e8e"
        },
        {
          "prob": 1.917171513758312e-10,
          "token": "_about"
        }
      ],
      [
        {
          "prob": 0.9999998807907247,
          "token": " fire"
        },
        {
          "prob": 9.931194312156244e-08,
          "token": "fire"
        },
        {
          "prob": 9.237449661970594e-09,
          "token": "\u706b"
        },
        {
          "prob": 9.736200313009565e-10,
          "token": "\u6d88\u9632"
        },
        {
          "prob": 9.736200313009565e-10,
          "token": " Fire"
        }
      ],
      [
        {
          "prob": 0.9999997615814777,
          "token": " safety"
        },
        {
          "prob": 2.382369667501818e-07,
          "token": "\u5b89\u5168"
        },
        {
          "prob": 1.522997974471263e-08,
          "token": " Safety"
        },
        {
          "prob": 2.061153622438558e-09,
          "token": "Safety"
        },
        {
          "prob": 4.5990553786523166e-10,
          "token": " safely"
        }
      ],
      [
        {
          "prob": 0.9999785427891018,
          "token": " at"
        },
        {
          "prob": 2.1444958378736654e-05,
          "token": " by"
        },
        {
          "prob": 2.646518112166888e-09,
          "token": " through"
        },
        {
          "prob": 1.250126637410931e-09,
          "token": " ["
        },
        {
          "prob": 6.691445697702166e-10,
          "token": "at"
        }
      ],
      [
        {
          "prob": 0.9999984502816872,
          "token": " Sk"
        },
        {
          "prob": 1.370956471489639e-06,
          "token": "Sk"
        },
        {
          "prob": 1.1253496007565217e-07,
          "token": " ["
        },
        {
          "prob": 2.845329381943118e-08,
          "token": "_sk"
        },
        {
          "prob": 2.8172576002392743e-09,
          "token": " the"
        }
      ],
      [
        {
          "prob": 0.9999996423722521,
          "token": "ol"
        },
        {
          "prob": 1.4449802461092448e-07,
          "token": "ole"
        },
        {
          "prob": 4.691164021834418e-08,
          "token": "\u043e\u043b"
        },
        {
          "prob": 4.691164021834418e-08,
          "token": "olk"
        },
        {
          "prob": 1.9555681087850496e-08,
          "token": "olt"
        }
      ],
      [
        {
          "prob": 0.9998172855444851,
          "token": "tech"
        },
        {
          "prob": 0.00010888882988932525,
          "token": "Tech"
        },
        {
          "prob": 2.4296382051580275e-05,
          "token": "etch"
        },
        {
          "prob": 1.1476798233783637e-05,
          "token": " tech"
        },
        {
          "prob": 1.0128238892902415e-05,
          "token": "te"
        }
      ],
      [
        {
          "prob": 0.4998893254729837,
          "token": " in"
        },
        {
          "prob": 0.4998893254729837,
          "token": " by"
        },
        {
          "prob": 0.00014798954749275706,
          "token": " through"
        },
        {
          "prob": 3.741761737139603e-05,
          "token": " ["
        },
        {
          "prob": 2.0028207325990423e-05,
          "token": " via"
        }
      ],
      [
        {
          "prob": 0.9999996423722521,
          "token": " the"
        },
        {
          "prob": 1.6373771305908126e-07,
          "token": " a"
        },
        {
          "prob": 9.931194312156244e-08,
          "token": " our"
        },
        {
          "prob": 7.734421907141565e-08,
          "token": " ["
        },
        {
          "prob": 5.3157852544244216e-08,
          "token": " their"
        }
      ],
      [
        {
          "prob": 0.9863805164520258,
          "token": " provided"
        },
        {
          "prob": 0.01241670068625759,
          "token": " instruction"
        },
        {
          "prob": 0.0007937731181163059,
          "token": " ["
        },
        {
          "prob": 9.480267962695984e-05,
          "token": " linked"
        },
        {
          "prob": 9.480267962695984e-05,
          "token": " document"
        }
      ],
      [
        {
          "prob": 0.9477900246767212,
          "token": " instruction"
        },
        {
          "prob": 0.041642989419867646,
          "token": " ["
        },
        {
          "prob": 0.003418264729224868,
          "token": " document"
        },
        {
          "prob": 0.003016608035755117,
          "token": " instructional"
        },
        {
          "prob": 0.0026621472478656908,
          "token": " link"
        }
      ],
      [
        {
          "prob": 0.6253869691142558,
          "token": " at"
        },
        {
          "prob": 0.15812258849240393,
          "token": " ["
        },
        {
          "prob": 0.12314599573916168,
          "token": " link"
        },
        {
          "prob": 0.03997965136201966,
          "token": " document"
        },
        {
          "prob": 0.02424888431568687,
          "token": " located"
        }
      ],
      [
        {
          "prob": 0.6456807957756922,
          "token": " <"
        },
        {
          "prob": 0.2691597925730945,
          "token": " ["
        },
        {
          "prob": 0.05300071197135827,
          "token": " this"
        },
        {
          "prob": 0.0321465567972272,
          "token": " the"
        },
        {
          "prob": 5.772239589824344e-06,
          "token": " []("
        }
      ],
      [
        {
          "prob": 0.9999985694905718,
          "token": "https"
        },
        {
          "prob": 8.315279260963632e-07,
          "token": " https"
        },
        {
          "prob": 3.059020287707785e-07,
          "token": "=https"
        },
        {
          "prob": 1.8553895931777327e-07,
          "token": "http"
        },
        {
          "prob": 4.139929822488149e-08,
          "token": "\"https"
        }
      ],
      [
        {
          "prob": 1.0,
          "token": "://"
        },
        {
          "prob": 1.7257827987960214e-08,
          "token": ":/"
        },
        {
          "prob": 1.2501528663867426e-09,
          "token": ":///"
        },
        {
          "prob": 8.592166619174109e-10,
          "token": ":\\/\\/"
        },
        {
          "prob": 6.691586091292782e-10,
          "token": "://%"
        }
      ],
      [
        {
          "prob": 0.999998927117538,
          "token": "box"
        },
        {
          "prob": 7.33820819192633e-07,
          "token": ".box"
        },
        {
          "prob": 1.1253496007565217e-07,
          "token": "\tbox"
        },
        {
          "prob": 1.1253496007565217e-07,
          "token": " box"
        },
        {
          "prob": 8.76423150298272e-08,
          "token": "\u7bb1"
        }
      ],
      [
        {
          "prob": 0.9999800924450729,
          "token": ".sk"
        },
        {
          "prob": 1.6701366305950292e-05,
          "token": "(sk"
        },
        {
          "prob": 1.7603110577708096e-06,
          "token": "_sk"
        },
        {
          "prob": 7.338068228047511e-07,
          "token": " sk"
        },
        {
          "prob": 3.4662579926611693e-07,
          "token": "-sk"
        }
      ],
      [
        {
          "prob": 0.9999998807907247,
          "token": "ol"
        },
        {
          "prob": 6.82560337633487e-08,
          "token": "\u043e\u043b"
        },
        {
          "prob": 2.8453348089834e-08,
          "token": "olk"
        },
        {
          "prob": 2.9989608248573072e-09,
          "token": "ole"
        },
        {
          "prob": 8.071593559922058e-10,
          "token": "olt"
        }
      ],
      [
        {
          "prob": 0.9999586360869611,
          "token": "tech"
        },
        {
          "prob": 8.939409628896255e-06,
          "token": "Tech"
        },
        {
          "prob": 8.939409628896255e-06,
          "token": " tech"
        },
        {
          "prob": 6.96201921918046e-06,
          "token": "techn"
        },
        {
          "prob": 4.784921168079426e-06,
          "token": "-tech"
        }
      ],
      [
        {
          "prob": 0.9999990463265931,
          "token": ".ru"
        },
        {
          "prob": 3.4663241069161144e-07,
          "token": " ru"
        },
        {
          "prob": 1.8553895931777327e-07,
          "token": ".rb"
        },
        {
          "prob": 1.275189375371399e-07,
          "token": ".rs"
        },
        {
          "prob": 1.1253517471925912e-07,
          "token": ".r"
        }
      ],
      [
        {
          "prob": 0.9998985631837561,
          "token": "/index"
        },
        {
          "prob": 7.484426353777002e-05,
          "token": "(index"
        },
        {
          "prob": 1.012906960451979e-05,
          "token": "=index"
        },
        {
          "prob": 4.22242441280431e-06,
          "token": ")index"
        },
        {
          "prob": 3.726276465697383e-06,
          "token": "[index"
        }
      ],
      [
        {
          "prob": 1.0,
          "token": ".php"
        },
        {
          "prob": 3.2241867372567335e-08,
          "token": "/php"
        },
        {
          "prob": 8.592166619174109e-10,
          "token": "."
        },
        {
          "prob": 6.691586091292782e-10,
          "token": ".js"
        },
        {
          "prob": 4.058652126475693e-10,
          "token": ".pdf"
        }
      ],
      [
        {
          "prob": 0.9999995231630692,
          "token": "/s"
        },
        {
          "prob": 9.931194312156244e-08,
          "token": "-s"
        },
        {
          "prob": 8.764248219443636e-08,
          "token": "\\s"
        },
        {
          "prob": 7.734421907141565e-08,
          "token": "=s"
        },
        {
          "prob": 6.023573837886479e-08,
          "token": ",s"
        }
      ],
      [
        {
          "prob": 0.9999994039539004,
          "token": "/P"
        },
        {
          "prob": 5.043471815847051e-07,
          "token": ">P"
        },
        {
          "prob": 4.139937718785167e-08,
          "token": "\tP"
        },
        {
          "prob": 3.6534822137210456e-08,
          "token": ",P"
        },
        {
          "prob": 2.510999155743982e-08,
          "token": "(P"
        }
      ],
      [
        {
          "prob": 0.9999969005680498,
          "token": "WW"
        },
        {
          "prob": 1.7603412757721762e-06,
          "token": " WW"
        },
        {
          "prob": 5.714991385721822e-07,
          "token": "ww"
        },
        {
          "prob": 1.4449761119935134e-07,
          "token": "W"
        },
        {
          "prob": 1.1253474543245463e-07,
          "token": "WWW"
        }
      ],
      [
        {
          "prob": 1.0,
          "token": "i"
        },
        {
          "prob": 1.026187963170189e-10,
          "token": "\u0438"
        },
        {
          "prob": 2.4374100555808313e-11,
          "token": "I"
        },
        {
          "prob": 1.675205799218013e-11,
          "token": "iT"
        },
        {
          "prob": 8.423463754468647e-12,
          "token": "j"
        }
      ],
      [
        {
          "prob": 1.0,
          "token": "2"
        },
        {
          "prob": 9.640143775040296e-11,
          "token": ""
        },
        {
          "prob": 7.507751520922312e-11,
          "token": "1"
        },
        {
          "prob": 6.224144622907783e-11,
          "token": ""
        },
        {
          "prob": 2.4374100555808313e-11,
          "token": "3"
        }
      ],
      [
        {
          "prob": 0.9999973774024795,
          "token": "TS"
        },
        {
          "prob": 2.260322940135999e-06,
          "token": " TS"
        },
        {
          "prob": 3.466317495433874e-07,
          "token": "_TS"
        },
        {
          "prob": 1.3440384315611926e-08,
          "token": "Ts"
        },
        {
          "prob": 9.237432042950414e-09,
          "token": "ts"
        }
      ],
      [
        {
          "prob": 0.9999998807907247,
          "token": "ue"
        },
        {
          "prob": 2.510999155743982e-08,
          "token": "_ue"
        },
        {
          "prob": 2.215948977336598e-08,
          "token": " ue"
        },
        {
          "prob": 2.215948977336598e-08,
          "token": "uez"
        },
        {
          "prob": 5.602796437537268e-09,
          "token": "UE"
        }
      ],
      [
        {
          "prob": 1.0,
          "token": "E"
        },
        {
          "prob": 1.162823303022097e-10,
          "token": "'E"
        },
        {
          "prob": 1.162823303022097e-10,
          "token": "AE"
        },
        {
          "prob": 4.8473687062702556e-11,
          "token": ">E"
        },
        {
          "prob": 4.8473687062702556e-11,
          "token": "e"
        }
      ],
      [
        {
          "prob": 0.9989660949578595,
          "token": "e"
        },
        {
          "prob": 0.001032229492907848,
          "token": "a"
        },
        {
          "prob": 9.412710100630494e-07,
          "token": "ea"
        },
        {
          "prob": 5.038260654698607e-07,
          "token": "ae"
        },
        {
          "prob": 9.920932917655228e-08,
          "token": "aN"
        }
      ],
      [
        {
          "prob": 0.9999992847447459,
          "token": "An"
        },
        {
          "prob": 3.4663241069161144e-07,
          "token": ">An"
        },
        {
          "prob": 1.6373755690670415e-07,
          "token": "AN"
        },
        {
          "prob": 8.764248219443636e-08,
          "token": " An"
        },
        {
          "prob": 6.023573837886479e-08,
          "token": "\u5b89"
        }
      ],
      [
        {
          "prob": 1.0,
          "token": "1"
        },
        {
          "prob": 1.2256067444099483e-11,
          "token": "2"
        },
        {
          "prob": 6.560200168153779e-12,
          "token": ""
        },
        {
          "prob": 2.129785170955785e-12,
          "token": "\uff11"
        },
        {
          "prob": 2.129785170955785e-12,
          "token": "0"
        }
      ],
      [
        {
          "prob": 1.0,
          "token": "E"
        },
        {
          "prob": 3.331544542166412e-11,
          "token": "\u0415"
        },
        {
          "prob": 3.331544542166412e-11,
          "token": "e"
        },
        {
          "prob": 8.423463754468647e-12,
          "token": " E"
        },
        {
          "prob": 3.0988191387218256e-12,
          "token": ">E"
        }
      ],
      [
        {
          "prob": 0.9999991655356624,
          "token": ">."
        },
        {
          "prob": 3.059020287707785e-07,
          "token": ">"
        },
        {
          "prob": 2.3823673954981372e-07,
          "token": "#."
        },
        {
          "prob": 9.931194312156244e-08,
          "token": "/>."
        },
        {
          "prob": 9.931194312156244e-08,
          "token": ">.\n\n"
        }
      ],
      [
        {
          "prob": 0.9999973774024795,
          "token": ""
        },
        {
          "prob": 2.699570779818012e-07,
          "token": ""
        },
        {
          "prob": 2.382362851497276e-07,
          "token": "<tool_call>"
        },
        {
          "prob": 1.7257795071296986e-08,
          "token": " b\u1ee5"
        },
        {
          "prob": 8.677764327999391e-09,
          "token": "GuidId"
        }
      ]
    ],
    "language_consistency_score": 0.3886450478917643
  },
  {
    "question": "What is the name of the universal laboratory for students and Skoltech community members where you can create almost anything, anytime?\n",
    "true_answer": "FabLab & Machine Shop \n",
    "source_doc": "Also, book crossing shelves. They are everywhere :) Bring your own books, exchange old ones anonymously or read on the spot as you desire. While no food or drinks are allowed on the premises of the library, your thoughts, debates and other activities are allowed any time. Librarians are there for you if you want to organize a group activity, do not hesitate to contact them and suggest your ideas. Like the campus, the library is open 24/7 and has several multifunctional zones that vary based on the level of noise, from silent to loud. If you need a quick distraction from your studies, just glance around and solve some quirky riddles, word search puzzles and even quests. That stuff will keep you entertained for a loooong time :)     \n\nAlright, so what else can you find on the campus? Quick answer: a lot\\! Let me just list a few spaces and facilities so you know they exist:\n\n* Music room  \n* Exercise room   \n* Several photo zones  \n* A coffee shop, cafeteria and several food machines around the campus  \n* Fully equipped kitchens with hot water, basic kitchenware and some ingredients for tea  \n* Outside terraces (aka summer lounge zones)   \n* Art exhibitions   \n* An indoor basketball court  \n* A table tennis table  \n* A multifaith prayer and meditation room \n\n*Text Overlay:* \n\n* *Music room*  \n* *Exercise room*   \n* *Several photo zones*  \n* *A coffee shop, cafeteria and several food machines around the campus*  \n* *Fully equipped kitchens with hot water, basic kitchenware and some ingredients for tea*  \n* *Outside terraces (aka summer lounge zones)*   \n* *Art exhibitions*   \n* *An indoor basketball court*  \n* *A table tennis table*  \n* *A multifaith prayer and meditation room* \n\nWell, that\u2019s a quick tour\\! You\u2019ll get to know all of these facilities as you spend time on campus. Speaking of tours, check out [this virtual tour](https://360.skoltech.ru/)  of Skoltech to see the campus with your own eyes. The link is available in the description. Let\u2019s keep exploring the campus, shall we? We\u2019ve already talked about the classrooms, the library and the cafeteria, but we haven\u2019t yet seen the most technological part: research facilities\\! *Text Overlay: Research Facilities*\n\nOne of the most impressive (and open to all students) research space here is the FabLab. FabLab & Machine Shop (links to an external site)is a universal laboratory for students and Skoltech community members where you can create almost anything, anytime\\! In fact, it is one of the most unique university facilities, because students can come here with an idea and leave with a prototype within a few hours. How cool is that? At Skoltech, creative research and spontaneous ideas revolve about this laboratory. It has equipment to quickly create prototypes and conduct experiences. There are machine tools, 3D printers and a bunch of other things like:\n\n- Metalworking  \n- Woodworking  \n- Auxiliary equipment  \n- 3D printing  \n- Electronics  \n- Laser cutting and engraving  \n- Working with fabric  \n- Casting  \n- And more\n\nYou can find the complete equipment catalog on the FabLab page, linked below. The complete video tour of the facilities is also available there. As a Skoltech student, you have 24/7 access to the FabLab Facility and any basic materials, tools and equipment you may need. Some tools can be custom ordered for your project, too.",
    "context": "Sim: 8.63 - One of the most impressive (and open to all students) research space here is the FabLab. FabLab & Machine Shop (links to an external site)is a universal laboratory for students and Skoltech community members where you can create almost anything, anytime\\! In fact, it is one of the most unique university facilities, because students can come here with an idea and leave with a prototype within a few hours. How cool is that? At Skoltech, creative research and spontaneous ideas revolve about this laboratory. It has equipment to quickly create prototypes and conduct experiences. There are machine tools, 3D printers and a bunch of other things like:\nSim: 3.42 - As a Skoltech student, you have 24/7 access to the FabLab Facility and any basic materials, tools and equipment you may need. Some tools can be custom ordered for your project, too.\nSim: 0.11 - The Skoltech library is not only about books for loan, it is an academic hub for learning outside a classroom and doing research outside a lab. It combines digital infrastructure and self-directed learning space. In the library students can discover, analyze, share information, and create new knowledge. There are designated areas either for group collaboration or silent individual study, which makes the library your go-to place for any type of work.",
    "generated_answer": "FabLab.",
    "logprobs": [
      [
        {
          "prob": 0.924127043349706,
          "token": "Fab"
        },
        {
          "prob": 0.07585695973434882,
          "token": "The"
        },
        {
          "prob": 1.0607958260313847e-05,
          "token": " Fab"
        },
        {
          "prob": 3.0392309264725946e-06,
          "token": "Fabric"
        },
        {
          "prob": 1.843386738852461e-06,
          "token": "It"
        }
      ],
      [
        {
          "prob": 0.9999963045256735,
          "token": "Lab"
        },
        {
          "prob": 3.7266389560521204e-06,
          "token": " Lab"
        },
        {
          "prob": 2.8453239549131867e-08,
          "token": "lab"
        },
        {
          "prob": 1.0467361864851814e-08,
          "token": "_lab"
        },
        {
          "prob": 2.6465635430511496e-09,
          "token": "Labor"
        }
      ],
      [
        {
          "prob": 0.9990597276034376,
          "token": "."
        },
        {
          "prob": 0.0009110244706916179,
          "token": ""
        },
        {
          "prob": 2.4277991371908314e-05,
          "token": " Machine"
        },
        {
          "prob": 2.2582049665189473e-06,
          "token": " &"
        },
        {
          "prob": 4.177259159843021e-07,
          "token": "\u3002"
        }
      ],
      [
        {
          "prob": 0.999995112442896,
          "token": ""
        },
        {
          "prob": 9.422409887669812e-07,
          "token": ""
        },
        {
          "prob": 3.466310883964243e-07,
          "token": "<tool_call>"
        },
        {
          "prob": 5.6585915693187436e-08,
          "token": "ordable"
        },
        {
          "prob": 3.889089318649755e-08,
          "token": "usercontent"
        }
      ]
    ],
    "language_consistency_score": 0.4837985694266319
  },
  {
    "question": "What are some examples of equipment available in the FabLab at Skoltech?\n",
    "true_answer": "The FabLab has equipment for metalworking, woodworking, 3D printing, electronics, laser cutting and engraving, working with fabric, casting, and more. \n",
    "source_doc": "Also, book crossing shelves. They are everywhere :) Bring your own books, exchange old ones anonymously or read on the spot as you desire. While no food or drinks are allowed on the premises of the library, your thoughts, debates and other activities are allowed any time. Librarians are there for you if you want to organize a group activity, do not hesitate to contact them and suggest your ideas. Like the campus, the library is open 24/7 and has several multifunctional zones that vary based on the level of noise, from silent to loud. If you need a quick distraction from your studies, just glance around and solve some quirky riddles, word search puzzles and even quests. That stuff will keep you entertained for a loooong time :)     \n\nAlright, so what else can you find on the campus? Quick answer: a lot\\! Let me just list a few spaces and facilities so you know they exist:\n\n* Music room  \n* Exercise room   \n* Several photo zones  \n* A coffee shop, cafeteria and several food machines around the campus  \n* Fully equipped kitchens with hot water, basic kitchenware and some ingredients for tea  \n* Outside terraces (aka summer lounge zones)   \n* Art exhibitions   \n* An indoor basketball court  \n* A table tennis table  \n* A multifaith prayer and meditation room \n\n*Text Overlay:* \n\n* *Music room*  \n* *Exercise room*   \n* *Several photo zones*  \n* *A coffee shop, cafeteria and several food machines around the campus*  \n* *Fully equipped kitchens with hot water, basic kitchenware and some ingredients for tea*  \n* *Outside terraces (aka summer lounge zones)*   \n* *Art exhibitions*   \n* *An indoor basketball court*  \n* *A table tennis table*  \n* *A multifaith prayer and meditation room* \n\nWell, that\u2019s a quick tour\\! You\u2019ll get to know all of these facilities as you spend time on campus. Speaking of tours, check out [this virtual tour](https://360.skoltech.ru/)  of Skoltech to see the campus with your own eyes. The link is available in the description. Let\u2019s keep exploring the campus, shall we? We\u2019ve already talked about the classrooms, the library and the cafeteria, but we haven\u2019t yet seen the most technological part: research facilities\\! *Text Overlay: Research Facilities*\n\nOne of the most impressive (and open to all students) research space here is the FabLab. FabLab & Machine Shop (links to an external site)is a universal laboratory for students and Skoltech community members where you can create almost anything, anytime\\! In fact, it is one of the most unique university facilities, because students can come here with an idea and leave with a prototype within a few hours. How cool is that? At Skoltech, creative research and spontaneous ideas revolve about this laboratory. It has equipment to quickly create prototypes and conduct experiences. There are machine tools, 3D printers and a bunch of other things like:\n\n- Metalworking  \n- Woodworking  \n- Auxiliary equipment  \n- 3D printing  \n- Electronics  \n- Laser cutting and engraving  \n- Working with fabric  \n- Casting  \n- And more\n\nYou can find the complete equipment catalog on the FabLab page, linked below. The complete video tour of the facilities is also available there. As a Skoltech student, you have 24/7 access to the FabLab Facility and any basic materials, tools and equipment you may need. Some tools can be custom ordered for your project, too.",
    "context": "Sim: 3.41 - One of the most impressive (and open to all students) research space here is the FabLab. FabLab & Machine Shop (links to an external site)is a universal laboratory for students and Skoltech community members where you can create almost anything, anytime\\! In fact, it is one of the most unique university facilities, because students can come here with an idea and leave with a prototype within a few hours. How cool is that? At Skoltech, creative research and spontaneous ideas revolve about this laboratory. It has equipment to quickly create prototypes and conduct experiences. There are machine tools, 3D printers and a bunch of other things like:\nSim: 1.73 - As a Skoltech student, you have 24/7 access to the FabLab Facility and any basic materials, tools and equipment you may need. Some tools can be custom ordered for your project, too.",
    "generated_answer": "Some examples of equipment available in the FabLab at Skoltech include machine tools, 3D printers, and other tools like those mentioned in the document.",
    "logprobs": [
      [
        {
          "prob": 0.7838600090084423,
          "token": "Some"
        },
        {
          "prob": 0.17490281716276843,
          "token": "The"
        },
        {
          "prob": 0.026822215727080937,
          "token": "Examples"
        },
        {
          "prob": 0.009867339380101092,
          "token": "There"
        },
        {
          "prob": 0.0028270400646464174,
          "token": "Equipment"
        }
      ],
      [
        {
          "prob": 0.9991944370137356,
          "token": " examples"
        },
        {
          "prob": 0.0008040847733952274,
          "token": " equipment"
        },
        {
          "prob": 4.447267204387628e-07,
          "token": "examples"
        },
        {
          "prob": 3.0565590694943163e-07,
          "token": " example"
        },
        {
          "prob": 2.697403911395587e-07,
          "token": " tools"
        }
      ],
      [
        {
          "prob": 0.999876633606226,
          "token": " of"
        },
        {
          "prob": 0.0001233946226544279,
          "token": " include"
        },
        {
          "prob": 7.1932411738246895e-09,
          "token": " includes"
        },
        {
          "prob": 3.3978465363142988e-09,
          "token": "include"
        },
        {
          "prob": 7.58162041807597e-10,
          "token": " are"
        }
      ],
      [
        {
          "prob": 0.9999440939703319,
          "token": " equipment"
        },
        {
          "prob": 5.14419656242667e-05,
          "token": "equipment"
        },
        {
          "prob": 2.902157109007149e-06,
          "token": "\u8bbe\u5907"
        },
        {
          "prob": 1.5534127599537094e-06,
          "token": " available"
        },
        {
          "prob": 2.510860268411768e-08,
          "token": " the"
        }
      ],
      [
        {
          "prob": 0.9998833077248994,
          "token": " available"
        },
        {
          "prob": 8.480836736588857e-05,
          "token": " in"
        },
        {
          "prob": 3.119925479322547e-05,
          "token": " include"
        },
        {
          "prob": 6.475198753862476e-07,
          "token": "available"
        },
        {
          "prob": 2.5107070223397102e-08,
          "token": " includes"
        }
      ],
      [
        {
          "prob": 0.9890125928681703,
          "token": " in"
        },
        {
          "prob": 0.010986936344888492,
          "token": " include"
        },
        {
          "prob": 2.356193360645074e-07,
          "token": " includes"
        },
        {
          "prob": 1.8350052343380288e-07,
          "token": " are"
        },
        {
          "prob": 1.9340831321464333e-08,
          "token": "include"
        }
      ],
      [
        {
          "prob": 1.0,
          "token": " the"
        },
        {
          "prob": 2.4616969518153846e-10,
          "token": " Sk"
        },
        {
          "prob": 2.020683909022217e-11,
          "token": "the"
        },
        {
          "prob": 1.0815941557285693e-11,
          "token": " Fab"
        },
        {
          "prob": 5.732239023403102e-13,
          "token": " The"
        }
      ],
      [
        {
          "prob": 0.9999814036965474,
          "token": " Fab"
        },
        {
          "prob": 1.3007061966414663e-05,
          "token": "Fab"
        },
        {
          "prob": 5.422150121403128e-06,
          "token": " Sk"
        },
        {
          "prob": 1.6373474618938104e-07,
          "token": " Fabric"
        },
        {
          "prob": 1.5079434418231184e-09,
          "token": " fab"
        }
      ],
      [
        {
          "prob": 0.9999982118638471,
          "token": "Lab"
        },
        {
          "prob": 1.553497204890439e-06,
          "token": " Lab"
        },
        {
          "prob": 2.3823651234966232e-07,
          "token": "lab"
        },
        {
          "prob": 9.237432042950414e-09,
          "token": "La"
        },
        {
          "prob": 8.152005165739432e-09,
          "token": "L"
        }
      ],
      [
        {
          "prob": 0.9968272106900609,
          "token": " at"
        },
        {
          "prob": 0.0031726831078774057,
          "token": " include"
        },
        {
          "prob": 1.2711449225070052e-07,
          "token": " are"
        },
        {
          "prob": 2.8363077013085146e-08,
          "token": " includes"
        },
        {
          "prob": 1.9493638744616092e-08,
          "token": "include"
        }
      ],
      [
        {
          "prob": 0.9999997615814777,
          "token": " Sk"
        },
        {
          "prob": 2.699578503363014e-07,
          "token": "Sk"
        },
        {
          "prob": 9.237449661970594e-09,
          "token": "_sk"
        },
        {
          "prob": 5.211412487888539e-10,
          "token": " SK"
        },
        {
          "prob": 2.172439935079017e-10,
          "token": " Ski"
        }
      ],
      [
        {
          "prob": 0.9999976158197796,
          "token": "ol"
        },
        {
          "prob": 1.994729895832688e-06,
          "token": "olk"
        },
        {
          "prob": 2.1024298423113373e-07,
          "token": "col"
        },
        {
          "prob": 9.931175369924415e-08,
          "token": "\u043e\u043b"
        },
        {
          "prob": 2.5109943663977427e-08,
          "token": "hol"
        }
      ],
      [
        {
          "prob": 0.9999176331638507,
          "token": "tech"
        },
        {
          "prob": 7.484569109242154e-05,
          "token": "Tech"
        },
        {
          "prob": 3.2884901615257806e-06,
          "token": " tech"
        },
        {
          "prob": 1.5533727613226755e-06,
          "token": "otech"
        },
        {
          "prob": 5.714539033663261e-07,
          "token": "itech"
        }
      ],
      [
        {
          "prob": 0.9999787811971367,
          "token": " include"
        },
        {
          "prob": 1.300702475296511e-05,
          "token": " are"
        },
        {
          "prob": 6.962158650053971e-06,
          "token": "include"
        },
        {
          "prob": 1.209841763547506e-06,
          "token": " includes"
        },
        {
          "prob": 9.930985949593232e-08,
          "token": " Include"
        }
      ],
      [
        {
          "prob": 0.9999979734461775,
          "token": " machine"
        },
        {
          "prob": 9.422436845439301e-07,
          "token": " machines"
        },
        {
          "prob": 9.422436845439301e-07,
          "token": " "
        },
        {
          "prob": 4.139929822488149e-08,
          "token": "machine"
        },
        {
          "prob": 2.845329381943118e-08,
          "token": "\u673a\u5668"
        }
      ],
      [
        {
          "prob": 0.9999998807907247,
          "token": " tools"
        },
        {
          "prob": 4.139937718785167e-08,
          "token": "-tools"
        },
        {
          "prob": 2.510999155743982e-08,
          "token": "\u5de5\u5177"
        },
        {
          "prob": 1.522997974471263e-08,
          "token": "tools"
        },
        {
          "prob": 2.646573638909117e-09,
          "token": " Tools"
        }
      ],
      [
        {
          "prob": 0.9999545833252356,
          "token": ","
        },
        {
          "prob": 4.539785156619626e-05,
          "token": " and"
        },
        {
          "prob": 1.5736381735986496e-11,
          "token": "\u3001"
        },
        {
          "prob": 5.108855157880887e-12,
          "token": "\u548c"
        },
        {
          "prob": 4.508548852583217e-12,
          "token": "\uff0c"
        }
      ],
      [
        {
          "prob": 1.0,
          "token": " "
        },
        {
          "prob": 2.061153622438558e-09,
          "token": "3"
        },
        {
          "prob": 9.545034922840628e-12,
          "token": " and"
        },
        {
          "prob": 1.0603575991523846e-13,
          "token": " printers"
        },
        {
          "prob": 6.041735480699455e-14,
          "token": " three"
        }
      ],
      [
        {
          "prob": 1.0,
          "token": "3"
        },
        {
          "prob": 6.914400106940203e-13,
          "token": "\uff13"
        },
        {
          "prob": 6.914400106940203e-13,
          "token": ""
        },
        {
          "prob": 3.701011678592672e-13,
          "token": "\u4e09\u7ef4"
        },
        {
          "prob": 2.2447770550209742e-13,
          "token": "2"
        }
      ],
      [
        {
          "prob": 1.0,
          "token": "D"
        },
        {
          "prob": 4.8473687062702556e-11,
          "token": "d"
        },
        {
          "prob": 7.433680672352188e-12,
          "token": "\u0414"
        },
        {
          "prob": 2.413362771833214e-12,
          "token": "\uff24"
        },
        {
          "prob": 1.8795288165390832e-12,
          "token": "Ds"
        }
      ],
      [
        {
          "prob": 0.9999959469005546,
          "token": " printers"
        },
        {
          "prob": 3.2887473357670864e-06,
          "token": "\u6253\u5370\u673a"
        },
        {
          "prob": 2.102425832248476e-07,
          "token": " Print"
        },
        {
          "prob": 1.6373708845046632e-07,
          "token": " printing"
        },
        {
          "prob": 1.4449747339575647e-07,
          "token": " printer"
        }
      ],
      [
        {
          "prob": 0.9999966621509202,
          "token": ","
        },
        {
          "prob": 3.288750472162449e-06,
          "token": " and"
        },
        {
          "prob": 1.1032518237638113e-09,
          "token": "."
        },
        {
          "prob": 3.16086939653085e-10,
          "token": "\u548c\u5176\u4ed6"
        },
        {
          "prob": 1.6918914685490615e-10,
          "token": "\uff0c"
        }
      ],
      [
        {
          "prob": 0.9999998807907247,
          "token": " and"
        },
        {
          "prob": 8.764248219443636e-08,
          "token": "\u4ee5\u53ca\u5176\u4ed6"
        },
        {
          "prob": 4.691164021834418e-08,
          "token": " among"
        },
        {
          "prob": 7.194133030325383e-09,
          "token": " as"
        },
        {
          "prob": 4.363462252943702e-09,
          "token": "\u548c\u5176\u4ed6"
        }
      ],
      [
        {
          "prob": 0.9899789009178587,
          "token": " other"
        },
        {
          "prob": 0.005194931945817855,
          "token": " various"
        },
        {
          "prob": 0.0024539120949701523,
          "token": " basic"
        },
        {
          "prob": 0.002165569823026035,
          "token": " a"
        },
        {
          "prob": 0.00020142937093879356,
          "token": " additional"
        }
      ],
      [
        {
          "prob": 0.31643795546376496,
          "token": " tools"
        },
        {
          "prob": 0.27925551555697475,
          "token": " materials"
        },
        {
          "prob": 0.16937703207916344,
          "token": " things"
        },
        {
          "prob": 0.1494747061788334,
          "token": " items"
        },
        {
          "prob": 0.05498867137833477,
          "token": " basic"
        }
      ],
      [
        {
          "prob": 0.42782074180661145,
          "token": " like"
        },
        {
          "prob": 0.3331871287331783,
          "token": " for"
        },
        {
          "prob": 0.20208820899829277,
          "token": " and"
        },
        {
          "prob": 0.035117665002471064,
          "token": "."
        },
        {
          "prob": 0.0008258883205845799,
          "token": " mentioned"
        }
      ],
      [
        {
          "prob": 0.9277418038938762,
          "token": " those"
        },
        {
          "prob": 0.046189549091996074,
          "token": " prot"
        },
        {
          "prob": 0.007083396769585254,
          "token": " prototypes"
        },
        {
          "prob": 0.007083396769585254,
          "token": "\u539f\u578b"
        },
        {
          "prob": 0.003345959713745826,
          "token": " basic"
        }
      ],
      [
        {
          "prob": 0.5368102465817125,
          "token": " mentioned"
        },
        {
          "prob": 0.19748145352758453,
          "token": " typically"
        },
        {
          "prob": 0.15379871064936207,
          "token": " used"
        },
        {
          "prob": 0.0641128411452436,
          "token": " needed"
        },
        {
          "prob": 0.018368636528447654,
          "token": " listed"
        }
      ],
      [
        {
          "prob": 0.9739492106428524,
          "token": " in"
        },
        {
          "prob": 0.025954869538944617,
          "token": "."
        },
        {
          "prob": 9.360789799711463e-05,
          "token": " for"
        },
        {
          "prob": 1.5130307526859456e-06,
          "token": " but"
        },
        {
          "prob": 4.912091670485533e-07,
          "token": ","
        }
      ],
      [
        {
          "prob": 0.9999998807907247,
          "token": " the"
        },
        {
          "prob": 7.734421907141565e-08,
          "token": " your"
        },
        {
          "prob": 2.510999155743982e-08,
          "token": " a"
        },
        {
          "prob": 2.215948977336598e-08,
          "token": "the"
        },
        {
          "prob": 1.9555681087850496e-08,
          "token": " various"
        }
      ],
      [
        {
          "prob": 0.6149471626290575,
          "token": " document"
        },
        {
          "prob": 0.1554829920404066,
          "token": " context"
        },
        {
          "prob": 0.13721325888024413,
          "token": " text"
        },
        {
          "prob": 0.08322404842995483,
          "token": " documents"
        },
        {
          "prob": 0.006831445900848128,
          "token": " documentation"
        }
      ],
      [
        {
          "prob": 0.9999138191081796,
          "token": "."
        },
        {
          "prob": 5.1440444821423804e-05,
          "token": " text"
        },
        {
          "prob": 2.1443567721419596e-05,
          "token": " for"
        },
        {
          "prob": 1.012922416303547e-05,
          "token": " description"
        },
        {
          "prob": 1.994562498462115e-06,
          "token": ","
        }
      ],
      [
        {
          "prob": 0.9999972581939645,
          "token": ""
        },
        {
          "prob": 3.9278523077893697e-07,
          "token": ""
        },
        {
          "prob": 3.466317495433874e-07,
          "token": "pecific"
        },
        {
          "prob": 2.5360120545506016e-07,
          "token": "<tool_call>"
        },
        {
          "prob": 1.9750481739625307e-07,
          "token": "\u5177\u4f53\u7684"
        }
      ]
    ],
    "language_consistency_score": 0.5262276885195174
  },
  {
    "question": "What are some of the things you can do at the Skoltech FabLab?\n",
    "true_answer": "At the Skoltech FabLab you can do metalworking, woodworking, 3D printing, electronics, laser cutting and engraving, work with fabric, casting, and more. \n",
    "source_doc": "Also, book crossing shelves. They are everywhere :) Bring your own books, exchange old ones anonymously or read on the spot as you desire. While no food or drinks are allowed on the premises of the library, your thoughts, debates and other activities are allowed any time. Librarians are there for you if you want to organize a group activity, do not hesitate to contact them and suggest your ideas. Like the campus, the library is open 24/7 and has several multifunctional zones that vary based on the level of noise, from silent to loud. If you need a quick distraction from your studies, just glance around and solve some quirky riddles, word search puzzles and even quests. That stuff will keep you entertained for a loooong time :)     \n\nAlright, so what else can you find on the campus? Quick answer: a lot\\! Let me just list a few spaces and facilities so you know they exist:\n\n* Music room  \n* Exercise room   \n* Several photo zones  \n* A coffee shop, cafeteria and several food machines around the campus  \n* Fully equipped kitchens with hot water, basic kitchenware and some ingredients for tea  \n* Outside terraces (aka summer lounge zones)   \n* Art exhibitions   \n* An indoor basketball court  \n* A table tennis table  \n* A multifaith prayer and meditation room \n\n*Text Overlay:* \n\n* *Music room*  \n* *Exercise room*   \n* *Several photo zones*  \n* *A coffee shop, cafeteria and several food machines around the campus*  \n* *Fully equipped kitchens with hot water, basic kitchenware and some ingredients for tea*  \n* *Outside terraces (aka summer lounge zones)*   \n* *Art exhibitions*   \n* *An indoor basketball court*  \n* *A table tennis table*  \n* *A multifaith prayer and meditation room* \n\nWell, that\u2019s a quick tour\\! You\u2019ll get to know all of these facilities as you spend time on campus. Speaking of tours, check out [this virtual tour](https://360.skoltech.ru/)  of Skoltech to see the campus with your own eyes. The link is available in the description. Let\u2019s keep exploring the campus, shall we? We\u2019ve already talked about the classrooms, the library and the cafeteria, but we haven\u2019t yet seen the most technological part: research facilities\\! *Text Overlay: Research Facilities*\n\nOne of the most impressive (and open to all students) research space here is the FabLab. FabLab & Machine Shop (links to an external site)is a universal laboratory for students and Skoltech community members where you can create almost anything, anytime\\! In fact, it is one of the most unique university facilities, because students can come here with an idea and leave with a prototype within a few hours. How cool is that? At Skoltech, creative research and spontaneous ideas revolve about this laboratory. It has equipment to quickly create prototypes and conduct experiences. There are machine tools, 3D printers and a bunch of other things like:\n\n- Metalworking  \n- Woodworking  \n- Auxiliary equipment  \n- 3D printing  \n- Electronics  \n- Laser cutting and engraving  \n- Working with fabric  \n- Casting  \n- And more\n\nYou can find the complete equipment catalog on the FabLab page, linked below. The complete video tour of the facilities is also available there. As a Skoltech student, you have 24/7 access to the FabLab Facility and any basic materials, tools and equipment you may need. Some tools can be custom ordered for your project, too.",
    "context": "Sim: 2.82 - As a Skoltech student, you have 24/7 access to the FabLab Facility and any basic materials, tools and equipment you may need. Some tools can be custom ordered for your project, too.\nSim: 2.39 -  Goooo Skoltech\\! Amid all the studying and research, it\u2019s important to keep up your physical activity. And we know some of you are excellent sports people. Skoltech has several competitive sports teams you can try out for:Volleyball, Football, Basketball. \nSim: 0.24 - Some of the more advanced equipment requires more targeted training \\- special (free\\!) 1-3 hour courses led by FabLab employees. That equipment is marked with a special sign. If you want to use it, ask the FabLab team about training. Speaking of the FabLab team, they are your most valuable resource\\! All of the FabLab employees are trained experts. You can consult with them about your projects, get help with any equipment and, of course, learn from them.  At this point you may be asking, \u201cWhat about other labs?\u201d",
    "generated_answer": "You can access basic materials, tools, and equipment 24/7, and some advanced equipment requires training. You can also consult with trained experts and use the facility for various projects.",
    "logprobs": [
      [
        {
          "prob": 0.776906410107835,
          "token": "You"
        },
        {
          "prob": 0.2225873999400815,
          "token": "At"
        },
        {
          "prob": 0.00048690807647626784,
          "token": "As"
        },
        {
          "prob": 7.870132306285993e-06,
          "token": " b\u1ea1n"
        },
        {
          "prob": 3.2807592483354564e-06,
          "token": " You"
        }
      ],
      [
        {
          "prob": 0.9984985517859623,
          "token": " can"
        },
        {
          "prob": 0.001501181950907551,
          "token": " have"
        },
        {
          "prob": 1.8526048212085737e-07,
          "token": "\u53ef\u4ee5"
        },
        {
          "prob": 1.5207106419953406e-08,
          "token": "can"
        },
        {
          "prob": 2.332085300839253e-09,
          "token": "have"
        }
      ],
      [
        {
          "prob": 0.7569034543780238,
          "token": " access"
        },
        {
          "prob": 0.21685645751369936,
          "token": " use"
        },
        {
          "prob": 0.022856502463176793,
          "token": " have"
        },
        {
          "prob": 0.002125985901754661,
          "token": " get"
        },
        {
          "prob": 0.0011379582507844335,
          "token": " gain"
        }
      ],
      [
        {
          "prob": 0.608567008389383,
          "token": " basic"
        },
        {
          "prob": 0.22387927761741747,
          "token": " "
        },
        {
          "prob": 0.1538698272499187,
          "token": " the"
        },
        {
          "prob": 0.011146292900886355,
          "token": " various"
        },
        {
          "prob": 0.0015084867067797002,
          "token": " tools"
        }
      ],
      [
        {
          "prob": 0.9984577872966285,
          "token": " materials"
        },
        {
          "prob": 0.0015011203917069235,
          "token": " tools"
        },
        {
          "prob": 3.530298470520716e-05,
          "token": " and"
        },
        {
          "prob": 2.8978454509464496e-06,
          "token": " equipment"
        },
        {
          "prob": 9.407926756729345e-07,
          "token": " facilities"
        }
      ],
      [
        {
          "prob": 0.9959243431284343,
          "token": ","
        },
        {
          "prob": 0.004070114650534032,
          "token": " and"
        },
        {
          "prob": 5.400151045356879e-06,
          "token": "/tools"
        },
        {
          "prob": 1.8478300737088872e-07,
          "token": " tools"
        },
        {
          "prob": 4.123066202737489e-08,
          "token": "/e"
        }
      ],
      [
        {
          "prob": 0.9999388493741573,
          "token": " tools"
        },
        {
          "prob": 3.12009805687773e-05,
          "token": " use"
        },
        {
          "prob": 2.7534768709548118e-05,
          "token": " equipment"
        },
        {
          "prob": 9.421879733876773e-07,
          "token": "tools"
        },
        {
          "prob": 8.314779681670825e-07,
          "token": "\u5de5\u5177"
        }
      ],
      [
        {
          "prob": 0.9984987894978749,
          "token": ","
        },
        {
          "prob": 0.001501181950907551,
          "token": " and"
        },
        {
          "prob": 7.571172470076028e-10,
          "token": ",and"
        },
        {
          "prob": 4.592148233073342e-10,
          "token": "\uff0c"
        },
        {
          "prob": 2.1691772305325962e-10,
          "token": " &"
        }
      ],
      [
        {
          "prob": 1.0,
          "token": " and"
        },
        {
          "prob": 4.139937718785167e-08,
          "token": "\u548c"
        },
        {
          "prob": 3.6534822137210456e-08,
          "token": " equipment"
        },
        {
          "prob": 3.398267819495071e-09,
          "token": " \u0438"
        },
        {
          "prob": 2.335593038799337e-09,
          "token": " v\u00e0"
        }
      ],
      [
        {
          "prob": 0.9997278000849631,
          "token": " equipment"
        },
        {
          "prob": 0.000261187557611691,
          "token": "equipment"
        },
        {
          "prob": 5.420774819079452e-06,
          "token": " "
        },
        {
          "prob": 4.783816987446187e-06,
          "token": "\u8bbe\u5907"
        },
        {
          "prob": 2.3817222341333224e-07,
          "token": " Equipment"
        }
      ],
      [
        {
          "prob": 0.9877639428473611,
          "token": " "
        },
        {
          "prob": 0.008545833210821132,
          "token": ","
        },
        {
          "prob": 0.0035624332920985696,
          "token": " for"
        },
        {
          "prob": 7.393590894133309e-05,
          "token": ";"
        },
        {
          "prob": 3.492485043039108e-05,
          "token": " anytime"
        }
      ],
      [
        {
          "prob": 1.0,
          "token": "2"
        },
        {
          "prob": 2.413362771833214e-12,
          "token": "\uff12"
        },
        {
          "prob": 2.413362771833214e-12,
          "token": "7"
        },
        {
          "prob": 1.6586783589142312e-12,
          "token": "3"
        },
        {
          "prob": 7.835041785064389e-13,
          "token": "1"
        }
      ],
      [
        {
          "prob": 1.0,
          "token": "4"
        },
        {
          "prob": 1.6586783589142312e-12,
          "token": "\uff14"
        },
        {
          "prob": 8.878265478459658e-13,
          "token": "/"
        },
        {
          "prob": 5.384940217754036e-13,
          "token": "5"
        },
        {
          "prob": 2.2447770550209742e-13,
          "token": "0"
        }
      ],
      [
        {
          "prob": 1.0,
          "token": "/"
        },
        {
          "prob": 3.775134544279098e-11,
          "token": " hours"
        },
        {
          "prob": 6.914400106940203e-13,
          "token": "\\/"
        },
        {
          "prob": 4.1937956583795446e-13,
          "token": " /"
        },
        {
          "prob": 2.543665647376923e-13,
          "token": "-hours"
        }
      ],
      [
        {
          "prob": 1.0,
          "token": "7"
        },
        {
          "prob": 7.05287985111216e-11,
          "token": "8"
        },
        {
          "prob": 2.761947433970946e-11,
          "token": "6"
        },
        {
          "prob": 1.0815941557285693e-11,
          "token": "9"
        },
        {
          "prob": 6.560200168153779e-12,
          "token": "5"
        }
      ],
      [
        {
          "prob": 0.999501715151397,
          "token": ","
        },
        {
          "prob": 0.00023044489953661634,
          "token": " for"
        },
        {
          "prob": 0.00017947066821392803,
          "token": "."
        },
        {
          "prob": 6.602356912920518e-05,
          "token": " and"
        },
        {
          "prob": 2.1434714621601032e-05,
          "token": ";"
        }
      ],
      [
        {
          "prob": 0.6234705531910874,
          "token": " and"
        },
        {
          "prob": 0.1227686200929721,
          "token": " request"
        },
        {
          "prob": 0.1227686200929721,
          "token": " use"
        },
        {
          "prob": 0.04516405135319168,
          "token": " some"
        },
        {
          "prob": 0.027393381862546605,
          "token": " customize"
        }
      ],
      [
        {
          "prob": 0.5279925386620808,
          "token": " some"
        },
        {
          "prob": 0.15127240404961317,
          "token": " request"
        },
        {
          "prob": 0.13349742802030903,
          "token": " can"
        },
        {
          "prob": 0.04334026939278702,
          "token": " custom"
        },
        {
          "prob": 0.03824765349631649,
          "token": " for"
        }
      ],
      [
        {
          "prob": 0.7306909240534397,
          "token": " advanced"
        },
        {
          "prob": 0.26880617682087243,
          "token": " more"
        },
        {
          "prob": 0.0002451195340931358,
          "token": " tools"
        },
        {
          "prob": 0.00014867251272196298,
          "token": " specialized"
        },
        {
          "prob": 4.826689808355092e-05,
          "token": " advance"
        }
      ],
      [
        {
          "prob": 0.9626523017903835,
          "token": " equipment"
        },
        {
          "prob": 0.037326078194498215,
          "token": " tools"
        },
        {
          "prob": 7.594676251798321e-06,
          "token": " machinery"
        },
        {
          "prob": 6.702278268344803e-06,
          "token": "equipment"
        },
        {
          "prob": 3.165932081129052e-06,
          "token": "\u8bbe\u5907"
        }
      ],
      [
        {
          "prob": 0.7859724049344823,
          "token": " requires"
        },
        {
          "prob": 0.1753741407454424,
          "token": " with"
        },
        {
          "prob": 0.03453321995836153,
          "token": " after"
        },
        {
          "prob": 0.0032120890494046895,
          "token": " requiring"
        },
        {
          "prob": 0.000492589809674414,
          "token": " may"
        }
      ],
      [
        {
          "prob": 0.4841742939502792,
          "token": " training"
        },
        {
          "prob": 0.377075319271522,
          "token": " targeted"
        },
        {
          "prob": 0.09533957131255735,
          "token": " specific"
        },
        {
          "prob": 0.035073468215988474,
          "token": " special"
        },
        {
          "prob": 0.006906375381631346,
          "token": " specialized"
        }
      ],
      [
        {
          "prob": 0.9338975775565053,
          "token": "."
        },
        {
          "prob": 0.019382426730499395,
          "token": " from"
        },
        {
          "prob": 0.017104931554238582,
          "token": " sessions"
        },
        {
          "prob": 0.010374665419931768,
          "token": ","
        },
        {
          "prob": 0.004900644940254581,
          "token": " through"
        }
      ],
      [
        {
          "prob": 0.937026819055066,
          "token": " You"
        },
        {
          "prob": 0.04117008208476477,
          "token": " There"
        },
        {
          "prob": 0.011795426004412881,
          "token": " The"
        },
        {
          "prob": 0.009186287008897565,
          "token": " Additionally"
        },
        {
          "prob": 0.00027740183103514314,
          "token": ""
        }
      ],
      [
        {
          "prob": 0.9998897435685532,
          "token": " can"
        },
        {
          "prob": 0.00010889672235585289,
          "token": " also"
        },
        {
          "prob": 5.714375541728848e-07,
          "token": "\u4e5f\u53ef\u4ee5"
        },
        {
          "prob": 5.042918715780878e-07,
          "token": " have"
        },
        {
          "prob": 2.3821061295265582e-07,
          "token": " may"
        }
      ],
      [
        {
          "prob": 0.9766988960301188,
          "token": " also"
        },
        {
          "prob": 0.02296975393317982,
          "token": " consult"
        },
        {
          "prob": 0.0001365831820753313,
          "token": " use"
        },
        {
          "prob": 0.0001063710891546523,
          "token": " ask"
        },
        {
          "prob": 5.693634113404006e-05,
          "token": " work"
        }
      ],
      [
        {
          "prob": 0.9955994088350193,
          "token": " consult"
        },
        {
          "prob": 0.002467844289075188,
          "token": " ask"
        },
        {
          "prob": 0.0011657270995320467,
          "token": " get"
        },
        {
          "prob": 0.000333986246588757,
          "token": " seek"
        },
        {
          "prob": 0.0002947418281204329,
          "token": " use"
        }
      ],
      [
        {
          "prob": 0.9989457527343795,
          "token": " with"
        },
        {
          "prob": 0.00043028844846143603,
          "token": " trained"
        },
        {
          "prob": 0.00029573263741514675,
          "token": " and"
        },
        {
          "prob": 0.00017937091166996599,
          "token": " the"
        },
        {
          "prob": 0.00010879395738844097,
          "token": " experts"
        }
      ],
      [
        {
          "prob": 0.8893123777066579,
          "token": " trained"
        },
        {
          "prob": 0.07299920638804011,
          "token": " the"
        },
        {
          "prob": 0.01628832461207167,
          "token": " Fab"
        },
        {
          "prob": 0.012685359962802656,
          "token": " experts"
        },
        {
          "prob": 0.0059921397559079765,
          "token": " expert"
        }
      ],
      [
        {
          "prob": 0.6880833028711797,
          "token": " experts"
        },
        {
          "prob": 0.1971391727872011,
          "token": " Fab"
        },
        {
          "prob": 0.10552099524312931,
          "token": " employees"
        },
        {
          "prob": 0.006745729929988884,
          "token": " staff"
        },
        {
          "prob": 0.001034491189758287,
          "token": " professionals"
        }
      ],
      [
        {
          "prob": 0.8274996360913424,
          "token": " and"
        },
        {
          "prob": 0.11198990430373401,
          "token": " for"
        },
        {
          "prob": 0.05994387615732168,
          "token": " about"
        },
        {
          "prob": 0.000216191425522935,
          "token": ","
        },
        {
          "prob": 0.00016837005149058509,
          "token": " on"
        }
      ],
      [
        {
          "prob": 0.8295963623512979,
          "token": " use"
        },
        {
          "prob": 0.09908115897173718,
          "token": " get"
        },
        {
          "prob": 0.05303432269052921,
          "token": " learn"
        },
        {
          "prob": 0.009215981194895279,
          "token": " utilize"
        },
        {
          "prob": 0.003841792534223199,
          "token": " seek"
        }
      ],
      [
        {
          "prob": 0.8211638134626208,
          "token": " the"
        },
        {
          "prob": 0.12592954563482225,
          "token": " competitive"
        },
        {
          "prob": 0.015040143013495245,
          "token": " facilities"
        },
        {
          "prob": 0.013272879623838897,
          "token": " their"
        },
        {
          "prob": 0.009122307864147626,
          "token": " various"
        }
      ],
      [
        {
          "prob": 0.7780502526972453,
          "token": " facility"
        },
        {
          "prob": 0.15320717865166106,
          "token": " Fab"
        },
        {
          "prob": 0.030168282201606816,
          "token": " facilities"
        },
        {
          "prob": 0.023495081802530515,
          "token": " lab"
        },
        {
          "prob": 0.00864335756379225,
          "token": " space"
        }
      ],
      [
        {
          "prob": 0.9993607318547877,
          "token": " for"
        },
        {
          "prob": 0.00029585534705639093,
          "token": "'s"
        },
        {
          "prob": 0.00020333820810483969,
          "token": " to"
        },
        {
          "prob": 6.60142509694618e-05,
          "token": " regardless"
        },
        {
          "prob": 4.5370886938727636e-05,
          "token": " as"
        }
      ],
      [
        {
          "prob": 0.5973168641565657,
          "token": " various"
        },
        {
          "prob": 0.24899871438033921,
          "token": " your"
        },
        {
          "prob": 0.13327942344675683,
          "token": " projects"
        },
        {
          "prob": 0.018037408521779274,
          "token": " project"
        },
        {
          "prob": 0.0019011288713010994,
          "token": " personal"
        }
      ],
      [
        {
          "prob": 0.9987125304014893,
          "token": " projects"
        },
        {
          "prob": 0.0011693720145127895,
          "token": " project"
        },
        {
          "prob": 7.475545184278165e-05,
          "token": "projects"
        },
        {
          "prob": 2.141779554440788e-05,
          "token": " personal"
        },
        {
          "prob": 8.928265507703227e-06,
          "token": " creative"
        }
      ],
      [
        {
          "prob": 0.999896656226848,
          "token": "."
        },
        {
          "prob": 9.610175337604957e-05,
          "token": " and"
        },
        {
          "prob": 6.9615876651265865e-06,
          "token": ","
        },
        {
          "prob": 2.699300469663706e-07,
          "token": " or"
        },
        {
          "prob": 3.223854673356868e-08,
          "token": " with"
        }
      ],
      [
        {
          "prob": 0.9908528744773971,
          "token": ""
        },
        {
          "prob": 0.008572557819576934,
          "token": " Sk"
        },
        {
          "prob": 0.0002588686919495185,
          "token": " Additionally"
        },
        {
          "prob": 0.0001474989345333958,
          "token": " The"
        },
        {
          "prob": 8.946262606945107e-05,
          "token": " There"
        }
      ]
    ],
    "language_consistency_score": 0.4622628907052288
  },
  {
    "question": "How often does a Skoltech student need to repeat the required safety training course?\n",
    "true_answer": "Every 3 months. \n",
    "source_doc": "On a more serious note, all this equipment and machinery requires training. That\u2019s why to gain access to the lab, you\u2019ll need to pass at least one required safety training course and repeat it every 3 months. Here are some of the important safety rules at the FabLab and any research facility at Skoltech, really:\n\n* Every new student needs to pass the EHS induction training and safety training provided by a responsible person before lab access. * Always wear safety goggles and other required means of personal protection. Always\\! * No food or drinks  \n* Do not work in the FabLab without an employee accompanying you (for safety reasons)   \n* Pay attentions to signs on machinery and equipment  \n* Do not try to access rooms or areas marked with red lines  \n* Be extra careful around yellow lines\n\n *Text Overlay:* \n\n* *Every new student needs to pass the EHS induction training and safety training provided by a responsible person before lab access.*  \n* *Always wear safety goggles and other required means of personal protection. Always\\!*   \n* *No food or drinks*  \n* *Do not work in the FabLab without an employee accompanying you (for safety reasons)*   \n* *Pay attentions to signs on machinery and equipment*  \n* *Do not try to access rooms or areas marked with red lines*  \n* *Be extra careful around yellow lines*\n\nSome of the more advanced equipment requires more targeted training \\- special (free\\!) 1-3 hour courses led by FabLab employees. That equipment is marked with a special sign. If you want to use it, ask the FabLab team about training. Speaking of the FabLab team, they are your most valuable resource\\! All of the FabLab employees are trained experts. You can consult with them about your projects, get help with any equipment and, of course, learn from them. At this point you may be asking, \u201cWhat about other labs?\u201d\n\nDuh, Skoltech has dozens of labs with fascinating and unique equipment\\! To save you some time and intrigue right now, we won\u2019t go into detail about each and every lab here. That\u2019s mostly because your scientific advisors and program coordinators will give you a much more in-depth orientation around the labs related to your center. If you want to take a look at some of the interesting objects right now, click the Skoltech virtual tour link in the description. Let\u2019s talk about some safety and ground rules here at Skoltech. As an educational institution, it should come to you as no surprise that there are some rules to ensure your safety. Some are just good, logical practices \\- like no running \\- while others are strictly prohibited for everyone\u2019s safety \\- like no food or drinks in laboratories. *Text Overlay: Ground Rules and Safety*\n\nFor a start, you should know that the campus is closed to visitors without a pass. That\u2019s basically anyone who is not a student or an employee of Skoltech. Each visitor \\- even your mom and girlfriend \\- will need a pass to enter the halls beyond the security line. Talk to the Education Office if you need a guest pass for someone as an exception. It is prohibited to: \n\n* ### smoke tobacco products, as well as evaporative mixtures used in devices for \n\n* ### drink alcoholic beverages (including beer and other low-alcohol drinks);\n\n* ### generating aerosol, steam, or smoke outside designated areas, use open fire, including in areas directly adjacent to buildings;\n\n* ### perform actions that violate/change the designated modes of operation of technical means of protection and fire alarm;\n\n* ### use evacuation and emergency exits to enter the building, as well as exit the building in the absence of factors that threaten the life and health of citizens;\n\n* ### ride bicycles inside the buildings;\n\n* ### place bicycles, scooters, electric scooters, skateboards, gyro scooters, segways, unicycles in places not intended for parking and attaching them to poles, building facades, trees, etc. * ### ride inside the buildings and in outdoor areas on roller skates, scooters, electric scooters, skateboards, gyroscooters, segways, unicycles at \u0430 speed of more than 10 km/h.",
    "context": "",
    "generated_answer": "The document does not specify how often a Skoltech student needs to repeat the required safety training course.",
    "logprobs": [
      [
        {
          "prob": 0.9444490741673456,
          "token": "The"
        },
        {
          "prob": 0.04702135290272185,
          "token": "Not"
        },
        {
          "prob": 0.0034062145675900313,
          "token": "There"
        },
        {
          "prob": 0.00300597380543673,
          "token": "Based"
        },
        {
          "prob": 0.0009758968127496022,
          "token": "Information"
        }
      ],
      [
        {
          "prob": 0.5782934608337816,
          "token": " document"
        },
        {
          "prob": 0.3095381839490807,
          "token": " context"
        },
        {
          "prob": 0.06906731279007731,
          "token": " frequency"
        },
        {
          "prob": 0.036969068507984704,
          "token": " documents"
        },
        {
          "prob": 0.003896511153516027,
          "token": " information"
        }
      ],
      [
        {
          "prob": 0.9999345583805643,
          "token": " does"
        },
        {
          "prob": 2.1443997179495543e-05,
          "token": " provided"
        },
        {
          "prob": 1.4738229355891133e-05,
          "token": "does"
        },
        {
          "prob": 1.1478144563453982e-05,
          "token": " states"
        },
        {
          "prob": 8.93918797422475e-06,
          "token": " doesn"
        }
      ],
      [
        {
          "prob": 0.9999998807907247,
          "token": " not"
        },
        {
          "prob": 5.3157852544244216e-08,
          "token": "not"
        },
        {
          "prob": 1.0467401794744658e-08,
          "token": "_not"
        },
        {
          "prob": 2.646573638909117e-09,
          "token": " Not"
        },
        {
          "prob": 1.6052280551856116e-09,
          "token": " NOT"
        }
      ],
      [
        {
          "prob": 0.9046228042251139,
          "token": " specify"
        },
        {
          "prob": 0.0953465499005646,
          "token": " provide"
        },
        {
          "prob": 8.087128027526642e-06,
          "token": "\u63d0\u4f9b"
        },
        {
          "prob": 4.905091097716262e-06,
          "token": " mention"
        },
        {
          "prob": 4.328727700629875e-06,
          "token": " specified"
        }
      ],
      [
        {
          "prob": 0.9859111194167254,
          "token": " how"
        },
        {
          "prob": 0.014063264397817674,
          "token": " the"
        },
        {
          "prob": 2.395846704601237e-05,
          "token": " a"
        },
        {
          "prob": 1.3516442191644863e-06,
          "token": "\u5982\u4f55"
        },
        {
          "prob": 1.8292515323575596e-07,
          "token": "how"
        }
      ],
      [
        {
          "prob": 0.9997258937810543,
          "token": " often"
        },
        {
          "prob": 0.0002611870594364352,
          "token": " frequently"
        },
        {
          "prob": 1.147575849375162e-05,
          "token": "often"
        },
        {
          "prob": 1.2095360465006491e-06,
          "token": " Often"
        },
        {
          "prob": 1.854883603088529e-07,
          "token": " oft"
        }
      ],
      [
        {
          "prob": 0.985896403514605,
          "token": " a"
        },
        {
          "prob": 0.014063056516856173,
          "token": " Sk"
        },
        {
          "prob": 3.9500231501829796e-05,
          "token": " students"
        },
        {
          "prob": 6.384617781111252e-07,
          "token": " the"
        },
        {
          "prob": 1.109480209247533e-07,
          "token": "."
        }
      ],
      [
        {
          "prob": 0.9997025421295748,
          "token": " Sk"
        },
        {
          "prob": 0.00029595665612081035,
          "token": " student"
        },
        {
          "prob": 9.419651617005303e-07,
          "token": "Sk"
        },
        {
          "prob": 1.8548393797444095e-07,
          "token": " safety"
        },
        {
          "prob": 1.1250169526573486e-07,
          "token": " required"
        }
      ],
      [
        {
          "prob": 0.9999952316511552,
          "token": "ol"
        },
        {
          "prob": 4.222831140981511e-06,
          "token": "olk"
        },
        {
          "prob": 2.3823583075050818e-07,
          "token": "olt"
        },
        {
          "prob": 1.1253474543245463e-07,
          "token": "\u00f6"
        },
        {
          "prob": 2.2159405241782167e-08,
          "token": "ole"
        }
      ],
      [
        {
          "prob": 0.9995928277206628,
          "token": "tech"
        },
        {
          "prob": 0.0002959241995805417,
          "token": "Tech"
        },
        {
          "prob": 3.534310553785724e-05,
          "token": "itech"
        },
        {
          "prob": 3.1190181164879476e-05,
          "token": "-tech"
        },
        {
          "prob": 2.143667711816978e-05,
          "token": " tech"
        }
      ],
      [
        {
          "prob": 0.9999730594272631,
          "token": " student"
        },
        {
          "prob": 2.4300182365791262e-05,
          "token": "\u5b66\u751f"
        },
        {
          "prob": 2.561220378066289e-06,
          "token": "student"
        },
        {
          "prob": 9.930929124198392e-08,
          "token": ".student"
        },
        {
          "prob": 5.3156433095392757e-08,
          "token": " students"
        }
      ],
      [
        {
          "prob": 0.9999700793634253,
          "token": " needs"
        },
        {
          "prob": 2.7535635276840996e-05,
          "token": " must"
        },
        {
          "prob": 1.2098313794369187e-06,
          "token": " should"
        },
        {
          "prob": 9.422176256898301e-07,
          "token": "needs"
        },
        {
          "prob": 1.6373287240463723e-07,
          "token": "\u9700\u8981"
        }
      ],
      [
        {
          "prob": 1.0,
          "token": " to"
        },
        {
          "prob": 4.8473687062702556e-11,
          "token": "to"
        },
        {
          "prob": 1.6586783589142312e-12,
          "token": "\tto"
        },
        {
          "prob": 1.1399918530443554e-12,
          "token": " repeat"
        },
        {
          "prob": 8.878265478459658e-13,
          "token": "_to"
        }
      ],
      [
        {
          "prob": 0.9999244270256572,
          "token": " repeat"
        },
        {
          "prob": 5.144098445599585e-05,
          "token": "\u91cd\u590d"
        },
        {
          "prob": 1.4738088801853288e-05,
          "token": "repeat"
        },
        {
          "prob": 2.561095810020892e-06,
          "token": " repeats"
        },
        {
          "prob": 2.561095810020892e-06,
          "token": " repeating"
        }
      ],
      [
        {
          "prob": 1.0,
          "token": " the"
        },
        {
          "prob": 4.139937718785167e-08,
          "token": " required"
        },
        {
          "prob": 3.850741922767617e-09,
          "token": " safety"
        },
        {
          "prob": 1.026187963170189e-10,
          "token": "the"
        },
        {
          "prob": 7.433680672352188e-12,
          "token": " mandatory"
        }
      ],
      [
        {
          "prob": 0.9996643001652582,
          "token": " required"
        },
        {
          "prob": 0.0003353500342255387,
          "token": " safety"
        },
        {
          "prob": 3.926545209063061e-07,
          "token": "required"
        },
        {
          "prob": 1.3435898851982526e-08,
          "token": " mandatory"
        },
        {
          "prob": 3.397127235008719e-09,
          "token": "_required"
        }
      ],
      [
        {
          "prob": 0.9999996423722521,
          "token": " safety"
        },
        {
          "prob": 3.4663274126619643e-07,
          "token": "\u5b89\u5168"
        },
        {
          "prob": 1.522997974471263e-08,
          "token": " Safety"
        },
        {
          "prob": 2.335593038799337e-09,
          "token": "Safety"
        },
        {
          "prob": 1.4166087866431961e-09,
          "token": "afety"
        }
      ],
      [
        {
          "prob": 0.9999994039539004,
          "token": " training"
        },
        {
          "prob": 4.4508482557577276e-07,
          "token": "\u57f9\u8bad"
        },
        {
          "prob": 9.931194312156244e-08,
          "token": "training"
        },
        {
          "prob": 1.522997974471263e-08,
          "token": "-training"
        },
        {
          "prob": 1.103256032343554e-09,
          "token": ".training"
        }
      ],
      [
        {
          "prob": 0.9999982118638471,
          "token": " course"
        },
        {
          "prob": 1.553497204890439e-06,
          "token": "\u8bfe\u7a0b"
        },
        {
          "prob": 1.8553878237411744e-07,
          "token": "."
        },
        {
          "prob": 6.825590357542018e-08,
          "token": "course"
        },
        {
          "prob": 3.6534752452633856e-08,
          "token": " courses"
        }
      ],
      [
        {
          "prob": 0.9999966621509202,
          "token": "."
        },
        {
          "prob": 3.288750472162449e-06,
          "token": ","
        },
        {
          "prob": 3.224174437983862e-08,
          "token": ";"
        },
        {
          "prob": 8.151989617038353e-09,
          "token": "\u3002"
        },
        {
          "prob": 3.398254856156838e-09,
          "token": ".\n\n"
        }
      ],
      [
        {
          "prob": 0.9999162028949069,
          "token": ""
        },
        {
          "prob": 2.1443608621818177e-05,
          "token": " Additional"
        },
        {
          "prob": 1.6700299186548724e-05,
          "token": " Further"
        },
        {
          "prob": 1.3845034307973346e-05,
          "token": " More"
        },
        {
          "prob": 6.53993112863845e-06,
          "token": " Therefore"
        }
      ]
    ],
    "language_consistency_score": 0.738435100856535
  },
  {
    "question": "What email address should I use to order a car pass for the Skolkovo Innovation Center Territory?\n",
    "true_answer": "security.campus@skoltech.ru \n",
    "source_doc": "Wait for an email confirmation from the security team before trying to enter the gates. You should get an answer within 10-20 minutes. Third, you can drive your personal car. This is surely a comfortable way, but it also involves a few nuances like parking and a security pass. Let\u2019s go in order. If you decide to drive your own car, you will first need to order a security pass to enter the Skolkovo Innovation Center Territory. Without this pass, security will not let you through the territory gates no matter how hard you try to convince them. To order a car pass, send an email to security.campus@skoltech.ru from your Skoltech email address that ends with @skoltech.ru. In that email, write the following information: \n\n1.",
    "context": "Sim: 5.47 - To order a car pass, send an email to security.campus@skoltech.ru from your Skoltech email address that ends with @skoltech.ru. In that email, write the following information: \nSim: 3.00 - To order a pass for your taxi, email security.campus@skoltech.ru from your Skoltech email address with your taxi\u2019s model and license number (i.e. Toyota, \u0425111\u0421\u041a197). \nSim: 0.63 - If you decide to drive your own car, you will first need to order a security pass to enter the Skolkovo Innovation Center Territory. Without this pass, security will not let you through the territory gates no matter how hard you try to convince them. ",
    "generated_answer": "security.campus@skoltech.ru",
    "logprobs": [
      [
        {
          "prob": 0.9998006026187986,
          "token": "security"
        },
        {
          "prob": 8.480133113591516e-05,
          "token": " security"
        },
        {
          "prob": 8.480133113591516e-05,
          "token": "To"
        },
        {
          "prob": 1.0128074690531338e-05,
          "token": "You"
        },
        {
          "prob": 4.784163727469807e-06,
          "token": "Security"
        }
      ],
      [
        {
          "prob": 1.0,
          "token": ".c"
        },
        {
          "prob": 9.237449661970594e-09,
          "token": ";c"
        },
        {
          "prob": 7.194133030325383e-09,
          "token": "@c"
        },
        {
          "prob": 4.363462252943702e-09,
          "token": ":c"
        },
        {
          "prob": 2.9989608248573072e-09,
          "token": ")c"
        }
      ],
      [
        {
          "prob": 0.9998955835638214,
          "token": "ampus"
        },
        {
          "prob": 9.610166172631932e-05,
          "token": "amp"
        },
        {
          "prob": 4.222412332368445e-06,
          "token": " campus"
        },
        {
          "prob": 1.99452635769203e-06,
          "token": "camp"
        },
        {
          "prob": 9.421475399340762e-07,
          "token": "AMP"
        }
      ],
      [
        {
          "prob": 1.0,
          "token": "@"
        },
        {
          "prob": 2.4616969518153846e-10,
          "token": "@gmail"
        },
        {
          "prob": 1.6918979226151304e-10,
          "token": "@s"
        },
        {
          "prob": 2.9400777392844726e-11,
          "token": "@mail"
        },
        {
          "prob": 2.9400777392844726e-11,
          "token": "@g"
        }
      ],
      [
        {
          "prob": 1.0,
          "token": "sk"
        },
        {
          "prob": 2.646573638909117e-09,
          "token": ".sk"
        },
        {
          "prob": 2.646573638909117e-09,
          "token": "ski"
        },
        {
          "prob": 1.2501528663867426e-09,
          "token": " sk"
        },
        {
          "prob": 9.736200313009565e-10,
          "token": "sku"
        }
      ],
      [
        {
          "prob": 1.0,
          "token": "ol"
        },
        {
          "prob": 3.6534822137210456e-08,
          "token": "olk"
        },
        {
          "prob": 7.194133030325383e-09,
          "token": "\u043e\u043b"
        },
        {
          "prob": 7.582560427911907e-10,
          "token": "olt"
        },
        {
          "prob": 2.7894680928689246e-10,
          "token": "pol"
        }
      ],
      [
        {
          "prob": 0.9999879600069962,
          "token": "tech"
        },
        {
          "prob": 2.9022844265838405e-06,
          "token": "tek"
        },
        {
          "prob": 1.994708970393078e-06,
          "token": "Tech"
        },
        {
          "prob": 1.7603244879295989e-06,
          "token": "itech"
        },
        {
          "prob": 1.2098521477472216e-06,
          "token": " tech"
        }
      ],
      [
        {
          "prob": 0.9999996423722521,
          "token": ".ru"
        },
        {
          "prob": 1.1253517471925912e-07,
          "token": ".rs"
        },
        {
          "prob": 7.734421907141565e-08,
          "token": " ru"
        },
        {
          "prob": 3.2241867372567335e-08,
          "token": ".r"
        },
        {
          "prob": 2.510999155743982e-08,
          "token": ".rb"
        }
      ],
      [
        {
          "prob": 0.9999907017622996,
          "token": ""
        },
        {
          "prob": 7.8114149124915e-07,
          "token": "<tool_call>"
        },
        {
          "prob": 4.7378626401625717e-07,
          "token": ""
        },
        {
          "prob": 1.3574203732712616e-07,
          "token": "."
        },
        {
          "prob": 9.329404693617776e-08,
          "token": "ienie"
        }
      ]
    ],
    "language_consistency_score": 0.4444090663363819
  },
  {
    "question": "How many ECTS credits are needed to graduate from Skoltech?\n",
    "true_answer": "120 ECTS credits. \n",
    "source_doc": "So, how do you succeed and graduate from Skoltech? To get your degree, you will need to meet several requirements. *Text Overlay: MSc Degree Requirements*  \n***![][image10]***  \nYou need 120 credits to graduate. Here\u2019s how you get them: \n\n* STE: Science, Technology and Engineering (36 ECTS-credits)  \n  * Provide a solid foundation of scientific and engineering fundamentals  \n  * Core and recommended electives  \n* Sector: Industrial Immersion (12 ECTS-credits)  \n  * Orients students to how a sector works, provides knowledge and skills to make an impact in an industrial sector  \n  * Happens in the summer term between Year 1 and Year 2  \n* Enterpreneurship and Innovation: Entrepreneurship and Innovation (12 ECTS-credits)  \n  * Orients students in the process of, provide the skills for, and experience with innovation  \n  * Includes Innovation Workshop  \n* MSc Thesis Project (36 ECTS-credits)  \n* Early research, Thesis Project, Defense\n\n* Options: elective coursework and short-term projects (24 ECTS-credits)  \n* Follow your dreams and passions, choose courses to diversify your experience  \n* Additionally you can take 20 credits as an extracurricular activity. ECTS credits are based on the workload students need in order to achieve the learning outcomes. 1 ECTS equals 27 astronomical hours (36 academic hours). This information is available in the description. *Text Overlay:* \n\n- *STE: Science, Technology and Engineering*   \n- *Sector: Industrial Immersion*  \n- *Enterpreneurship and Innovation: Entrepreneurship and Innovation*  \n- *MSc Thesis Project*   \n- *Early research, Thesis Project, Defense*  \n- *Options*\n\nHow will your course performance be assessed? The assessment criteria are set separately for all courses and described in detail in the each course syllabus. You can refer to the assessment rules prior to course registration. Your instructors will also walk through it at the very beginning of a course. *Text Overlay: Grading System*\n\nSkoltech uses an \u201cA-F\u201d grading system. * A-E are technically passing grades (although there is a world of difference between an A and an E), but you will receive a full number of credits if you get one of these grades. Aim to get as close to an A as possible, as it comes with many obvious and not-so-obvious benefits like scholarships :)   \n* F is a failing grade, which means you will not have passed the course if you get it. If you ever feel you are having trouble with a course and are likely to receive a poor grade, talk to your instructor as soon as possible. * Some projects have a Pass/Fail grading scale, and you will be notified in advance if that applies to your course. * The course instructor sets the grading scheme for each class, which is explained in the Course Syllabus. The course instructor also makes the final decision about your grade. We expect you to perform at a \u201cB\u201d grade or better level.",
    "context": "Sim: 3.20 -   1. You must be registered for a minimum of 12 credits and a maximum of 18 credits per term. During Term 1, it\u2019s best to take only 12 credits for a smooth introduction to Skoltech coursework.   ",
    "generated_answer": "The context does not specify the exact number of ECTS credits needed to graduate from Skoltech.",
    "logprobs": [
      [
        {
          "prob": 0.9845878802351771,
          "token": "The"
        },
        {
          "prob": 0.012394133579385787,
          "token": "Based"
        },
        {
          "prob": 0.0024405496058214093,
          "token": "1"
        },
        {
          "prob": 0.00033029231466115763,
          "token": "According"
        },
        {
          "prob": 0.00017679273617437507,
          "token": "No"
        }
      ],
      [
        {
          "prob": 0.6803493363048589,
          "token": " context"
        },
        {
          "prob": 0.1339687115655355,
          "token": " document"
        },
        {
          "prob": 0.09207525915243266,
          "token": " documents"
        },
        {
          "prob": 0.04349327275857018,
          "token": " text"
        },
        {
          "prob": 0.03387259488271266,
          "token": " minimum"
        }
      ],
      [
        {
          "prob": 0.82009810031819,
          "token": " does"
        },
        {
          "prob": 0.12576611136170143,
          "token": " provided"
        },
        {
          "prob": 0.02476481567214985,
          "token": " only"
        },
        {
          "prob": 0.021854873123750687,
          "token": " provides"
        },
        {
          "prob": 0.004303479678172865,
          "token": " states"
        }
      ],
      [
        {
          "prob": 0.9999998807907247,
          "token": " not"
        },
        {
          "prob": 1.4449802461092448e-07,
          "token": "not"
        },
        {
          "prob": 1.522997974471263e-08,
          "token": "_not"
        },
        {
          "prob": 3.850741922767617e-09,
          "token": " NOT"
        },
        {
          "prob": 2.061153622438558e-09,
          "token": " Not"
        }
      ],
      [
        {
          "prob": 0.7760164322060095,
          "token": " specify"
        },
        {
          "prob": 0.22233244352139814,
          "token": " provide"
        },
        {
          "prob": 0.0013220370345737892,
          "token": " explicitly"
        },
        {
          "prob": 0.00015789473190758627,
          "token": " directly"
        },
        {
          "prob": 0.00012296854085247773,
          "token": " specifically"
        }
      ],
      [
        {
          "prob": 0.9996831229484373,
          "token": " the"
        },
        {
          "prob": 0.00029595101124940996,
          "token": " how"
        },
        {
          "prob": 1.4734533230612844e-05,
          "token": " exactly"
        },
        {
          "prob": 4.221514450066454e-06,
          "token": " E"
        },
        {
          "prob": 1.7597890397567096e-06,
          "token": " a"
        }
      ],
      [
        {
          "prob": 0.8041940001333623,
          "token": " exact"
        },
        {
          "prob": 0.17943994406175393,
          "token": " total"
        },
        {
          "prob": 0.014729329317254326,
          "token": " number"
        },
        {
          "prob": 0.0015524598883549408,
          "token": " E"
        },
        {
          "prob": 6.821032706765352e-05,
          "token": " required"
        }
      ],
      [
        {
          "prob": 0.9984947485192963,
          "token": " number"
        },
        {
          "prob": 0.00150117622436379,
          "token": " E"
        },
        {
          "prob": 1.991730288277624e-06,
          "token": "number"
        },
        {
          "prob": 1.3688948733764634e-06,
          "token": " amount"
        },
        {
          "prob": 6.466201524016878e-07,
          "token": " credit"
        }
      ],
      [
        {
          "prob": 1.0,
          "token": " of"
        },
        {
          "prob": 5.4927883509546835e-11,
          "token": "_of"
        },
        {
          "prob": 4.8473687062702556e-11,
          "token": " c\u1ee7a"
        },
        {
          "prob": 1.2256067444099483e-11,
          "token": " or"
        },
        {
          "prob": 9.545034922840628e-12,
          "token": " needed"
        }
      ],
      [
        {
          "prob": 0.999985218266486,
          "token": " E"
        },
        {
          "prob": 1.4738988370858524e-05,
          "token": " credits"
        },
        {
          "prob": 1.9555382694114372e-08,
          "token": "ECT"
        },
        {
          "prob": 9.237308710750103e-09,
          "token": " credit"
        },
        {
          "prob": 7.19402325740449e-09,
          "token": " EU"
        }
      ],
      [
        {
          "prob": 0.9999980926550052,
          "token": "CTS"
        },
        {
          "prob": 1.7603429545652396e-06,
          "token": "CT"
        },
        {
          "prob": 1.275188159256623e-07,
          "token": "cts"
        },
        {
          "prob": 1.4166060846789406e-09,
          "token": "TS"
        },
        {
          "prob": 4.599046606658694e-10,
          "token": "PTS"
        }
      ],
      [
        {
          "prob": 0.9999684105356298,
          "token": " credits"
        },
        {
          "prob": 2.7535582756834786e-05,
          "token": "credits"
        },
        {
          "prob": 2.902229070429429e-06,
          "token": " credit"
        },
        {
          "prob": 1.067670408581093e-06,
          "token": " ("
        },
        {
          "prob": 4.691011913650662e-08,
          "token": " needed"
        }
      ],
      [
        {
          "prob": 0.9241361044265798,
          "token": " needed"
        },
        {
          "prob": 0.0758577193379113,
          "token": " required"
        },
        {
          "prob": 5.010897241173315e-06,
          "token": "needed"
        },
        {
          "prob": 6.781511974037517e-07,
          "token": " necessary"
        },
        {
          "prob": 1.9429357105265656e-07,
          "token": "required"
        }
      ],
      [
        {
          "prob": 0.9999645960934689,
          "token": " to"
        },
        {
          "prob": 3.535625324942473e-05,
          "token": " for"
        },
        {
          "prob": 5.905089996825076e-10,
          "token": "to"
        },
        {
          "prob": 1.5736531810533053e-11,
          "token": "\tto"
        },
        {
          "prob": 6.559962433273904e-12,
          "token": "_to"
        }
      ],
      [
        {
          "prob": 0.9998806857355593,
          "token": " graduate"
        },
        {
          "prob": 8.480812472755034e-05,
          "token": "\u6bd5\u4e1a"
        },
        {
          "prob": 1.473744227054363e-05,
          "token": " graduation"
        },
        {
          "prob": 1.1477531580769002e-05,
          "token": "graduate"
        },
        {
          "prob": 5.421602026783983e-06,
          "token": " graduates"
        }
      ],
      [
        {
          "prob": 1.0,
          "token": " from"
        },
        {
          "prob": 2.215948977336598e-08,
          "token": "\u4ece"
        },
        {
          "prob": 1.186112015134383e-08,
          "token": ","
        },
        {
          "prob": 3.850741922767617e-09,
          "token": "\u4f46\u4ece"
        },
        {
          "prob": 2.9989608248573072e-09,
          "token": ";"
        }
      ],
      [
        {
          "prob": 0.9999992847447459,
          "token": " Sk"
        },
        {
          "prob": 5.715002286213223e-07,
          "token": "Sk"
        },
        {
          "prob": 9.931194312156244e-08,
          "token": " SK"
        },
        {
          "prob": 1.0467401794744658e-08,
          "token": "_sk"
        },
        {
          "prob": 2.3125502732234879e-10,
          "token": " the"
        }
      ],
      [
        {
          "prob": 0.999997854237364,
          "token": "ol"
        },
        {
          "prob": 1.2098648396679127e-06,
          "token": "olk"
        },
        {
          "prob": 6.47593982395546e-07,
          "token": "olt"
        },
        {
          "prob": 9.931175369924415e-08,
          "token": "\u043e\u043b"
        },
        {
          "prob": 4.691155074157667e-08,
          "token": "ole"
        }
      ],
      [
        {
          "prob": 0.9998183580434946,
          "token": "tech"
        },
        {
          "prob": 0.00013981629184944022,
          "token": "Tech"
        },
        {
          "prob": 8.938156499787535e-06,
          "token": " tech"
        },
        {
          "prob": 6.1430991344598145e-06,
          "token": "itech"
        },
        {
          "prob": 5.4212659584308955e-06,
          "token": "ten"
        }
      ],
      [
        {
          "prob": 0.7571601794795626,
          "token": "."
        },
        {
          "prob": 0.21693001694739875,
          "token": ","
        },
        {
          "prob": 0.02590859891872311,
          "token": ";"
        },
        {
          "prob": 1.1762488515939665e-06,
          "token": " but"
        },
        {
          "prob": 1.4806773735517937e-08,
          "token": " for"
        }
      ],
      [
        {
          "prob": 0.9394410179253293,
          "token": ""
        },
        {
          "prob": 0.06005645769055134,
          "token": " It"
        },
        {
          "prob": 0.0003151472915838481,
          "token": " However"
        },
        {
          "prob": 0.0001313729364658547,
          "token": " Only"
        },
        {
          "prob": 1.777939356623197e-05,
          "token": " The"
        }
      ]
    ],
    "language_consistency_score": 0.3464877606954322
  },
  {
    "question": "What email address should students contact if they have urgent questions or need assistance?\n",
    "true_answer": "education@skoltech.ru \n",
    "source_doc": "Any performance below this may be reported to the Disciplinary Board for further examination. *Text Overlay: A-E, F,*  Pass/Fail\n\nSkoltech\u2019s variety of courses allows you to not only choose the ones that complement your educational track, but also be flexible about registering for them or making changes in your schedule (with some regulations, of course). When it comes to course registration, we mostly expect you to register for courses yourself with some exceptions. For instance, the Education Department has already registered you for your first course \\- Innovation Workshop :) \n\nFor standard terms (so, not Term 1A), registration will happen about 3 weeks before the start of the term (check the calendar\\!). Here\u2019s a quick timeline: \n\n*Graph:* \n\n![][image11]\n\nSide note:  Short-term projects follow regular registration schedule\n\nSo how do you register for your courses?As we\u2019ve already mentioned, you do not need to register for any courses in Term 1A \\- you are already signed up for a compulsory course called Innovation Workshop. Instructions on how to register for the other terms will be sent to you individually by the Education Department. Meanwhile, you can explore [the courses offered in 2022-2023](https://www.skoltech.ru/en/education/course-catalog/) (and in the upcoming terms) [using the link below](https://www.skoltech.ru/en/education/course-catalog/) and choose which ones you want to register for. You can filter courses based on your program, credit load, and instructors. After you\u2019ve registered for courses, you will be added to your course \u201cpage\u201d on Canvas. Here you will see information about your registered courses, your grades, assignments, group work and more. Make sure to bookmark Canvas in your browser and check it for updates from your professors and program coordinators on a daily basis\\! As a student, you have rights and channels for feedback. As Skoltech constantly works on improving this communication, please be aware of the following:\n\nYour student rights:\n\n* To obtain full information on your courses and educational programs, course syllabi, assessment criteria and feedback on your progress  \n* To provide your feedback on the quality of courses\n\n At the end of each course, you will be asked to submit a formal evaluation of the coursework, the course load and your professor, course instructor and teaching assistant. These evaluations are used to collect your *anonymous* feedback on each of your learning experiences. The feedback is then followed-up to Education Department, course instructors and program coordinators. If you need to communicate any concerns or issues informally or outside of the formal evaluation period (or if you are unable to solve an issue directly with your research advisor or faculty, please talk to the [Education Department](https://helpdesk.skoltech.ru/servicedesk/customer/portal/21) \u0438\u043d\u0444\u043e\u0440\u043c\u0430\u0446\u0438\u044f \u0434\u043b\u044f \u0441\u0432\u044f\u0437\u0438 \u0442\u0430\u043a\u0436\u0435 \u0432 \u043e\u043f\u0438\u0441\u0430\u043d\u0438\u0438. If you are a student of a network or a joint program, you probably have a few questions about the logistics of your studies. *Text Overlay: Network and Joint Programs and double degrees*\n\nYour schedule, curriculum and even travel times will depend on the program you are in. Moreover, there will be specific regulations on how to submit your original diploma and receive your scholarship if you are a student of a joint or network program. The details of your studies are normally coordinated by the Centers to which your programs belong. Each program has its own *coordinator*, who will be in touch with you regarding the essential information (if they haven\u2019t reached out yet). Until then, if you have urgent questions or need assistance, feel free to reach out to the Education Department via [education@skoltech.ru](mailto:education@skoltech.ru). For more details on the Education Department, as well as for all the relevant links, see the description below. *Text Overlay: education@skoltech.ru.*  \n",
    "context": "Sim: 3.04 - Until then, if you have urgent questions or need assistance, feel free to reach out to the Education Department via [education@skoltech.ru](mailto:education@skoltech.ru). For more details on the Education Department, as well as for all the relevant links, see the description below.",
    "generated_answer": "students should contact [education@skoltech.ru](mailto:education@skoltech.ru) if they have urgent questions or need assistance.",
    "logprobs": [
      [
        {
          "prob": 0.8067235126246991,
          "token": "students"
        },
        {
          "prob": 0.18000435193200062,
          "token": "education"
        },
        {
          "prob": 0.010155151840471143,
          "token": "Students"
        },
        {
          "prob": 0.0009445762612981527,
          "token": " students"
        },
        {
          "prob": 0.0005729144629140614,
          "token": "edu"
        }
      ],
      [
        {
          "prob": 0.9999992847447459,
          "token": " should"
        },
        {
          "prob": 3.059020287707785e-07,
          "token": "\u5e94\u8be5"
        },
        {
          "prob": 1.8553895931777327e-07,
          "token": "should"
        },
        {
          "prob": 1.275189375371399e-07,
          "token": " can"
        },
        {
          "prob": 6.023573837886479e-08,
          "token": "\u5e94"
        }
      ],
      [
        {
          "prob": 0.9995476862197713,
          "token": " contact"
        },
        {
          "prob": 0.00043054766571878027,
          "token": " reach"
        },
        {
          "prob": 2.1435716290108746e-05,
          "token": "contact"
        },
        {
          "prob": 1.636637135237316e-07,
          "token": "_contact"
        },
        {
          "prob": 5.3133828412509574e-08,
          "token": ".contact"
        }
      ],
      [
        {
          "prob": 0.9030989496239743,
          "token": " ["
        },
        {
          "prob": 0.0840012812473773,
          "token": " the"
        },
        {
          "prob": 0.012882016771934825,
          "token": " education"
        },
        {
          "prob": 8.07350384083237e-06,
          "token": "\u6559\u80b2"
        },
        {
          "prob": 5.548832632081823e-06,
          "token": "education"
        }
      ],
      [
        {
          "prob": 0.9999727018181879,
          "token": "education"
        },
        {
          "prob": 1.6701238885123605e-05,
          "token": "\u6559\u80b2"
        },
        {
          "prob": 8.939528983688169e-06,
          "token": " education"
        },
        {
          "prob": 4.4507294068738415e-07,
          "token": "edu"
        },
        {
          "prob": 3.927754915808339e-07,
          "token": "educ"
        }
      ],
      [
        {
          "prob": 1.0,
          "token": "@"
        },
        {
          "prob": 2.646573638909117e-09,
          "token": "@example"
        },
        {
          "prob": 1.917171513758312e-10,
          "token": "@s"
        },
        {
          "prob": 1.2378189627675852e-10,
          "token": "<"
        },
        {
          "prob": 9.640143775040296e-11,
          "token": "@email"
        }
      ],
      [
        {
          "prob": 0.9999998807907247,
          "token": "sk"
        },
        {
          "prob": 4.691164021834418e-08,
          "token": "sky"
        },
        {
          "prob": 2.215948977336598e-08,
          "token": "sku"
        },
        {
          "prob": 1.4307241918567688e-08,
          "token": "<"
        },
        {
          "prob": 1.3440409951135022e-08,
          "token": "ski"
        }
      ],
      [
        {
          "prob": 0.9999998807907247,
          "token": "ol"
        },
        {
          "prob": 1.1253517471925912e-07,
          "token": "\u043e\u043b"
        },
        {
          "prob": 3.2241867372567335e-08,
          "token": "olk"
        },
        {
          "prob": 2.061153622438558e-09,
          "token": "ole"
        },
        {
          "prob": 1.2501528663867426e-09,
          "token": "olare"
        }
      ],
      [
        {
          "prob": 0.9999971389852362,
          "token": "tech"
        },
        {
          "prob": 1.0677009553134769e-06,
          "token": " tech"
        },
        {
          "prob": 8.315263400842229e-07,
          "token": "Tech"
        },
        {
          "prob": 2.699570779818012e-07,
          "token": "itech"
        },
        {
          "prob": 2.382362851497276e-07,
          "token": "techn"
        }
      ],
      [
        {
          "prob": 0.9999986886995842,
          "token": ".ru"
        },
        {
          "prob": 5.043471815847051e-07,
          "token": ".rs"
        },
        {
          "prob": 4.4508482557577276e-07,
          "token": " ru"
        },
        {
          "prob": 3.059020287707785e-07,
          "token": ".rb"
        },
        {
          "prob": 4.691155074157667e-08,
          "token": "_ru"
        }
      ],
      [
        {
          "prob": 0.9994506279166882,
          "token": "]("
        },
        {
          "prob": 0.0003352784033807298,
          "token": "]"
        },
        {
          "prob": 0.00020335663118991248,
          "token": "]."
        },
        {
          "prob": 6.958481265518261e-06,
          "token": "]["
        },
        {
          "prob": 3.7246066225039354e-06,
          "token": "]()"
        }
      ],
      [
        {
          "prob": 0.9999969005680498,
          "token": "mailto"
        },
        {
          "prob": 8.315263400842229e-07,
          "token": "http"
        },
        {
          "prob": 4.450839766446488e-07,
          "token": "(mail"
        },
        {
          "prob": 1.1979272719177258e-07,
          "token": "gmail"
        },
        {
          "prob": 1.1979272719177258e-07,
          "token": "/mail"
        }
      ],
      [
        {
          "prob": 1.0,
          "token": ":"
        },
        {
          "prob": 1.4166087866431961e-09,
          "token": "\uff1a"
        },
        {
          "prob": 2.289734845645553e-11,
          "token": ":<"
        },
        {
          "prob": 1.478363929001648e-11,
          "token": ";"
        },
        {
          "prob": 1.2256067444099483e-11,
          "token": "\u6559\u80b2"
        }
      ],
      [
        {
          "prob": 0.9999963045256735,
          "token": "education"
        },
        {
          "prob": 2.5612790004194033e-06,
          "token": " education"
        },
        {
          "prob": 8.31525547079287e-07,
          "token": "\u6559\u80b2"
        },
        {
          "prob": 1.6373708845046632e-07,
          "token": "Education"
        },
        {
          "prob": 2.2159405241782167e-08,
          "token": "edu"
        }
      ],
      [
        {
          "prob": 1.0,
          "token": "@"
        },
        {
          "prob": 3.398267819495071e-09,
          "token": "@example"
        },
        {
          "prob": 4.3204126993085624e-10,
          "token": "@s"
        },
        {
          "prob": 2.7894680928689246e-10,
          "token": "@email"
        },
        {
          "prob": 2.7894680928689246e-10,
          "token": "@gmail"
        }
      ],
      [
        {
          "prob": 0.9999982118638471,
          "token": "sk"
        },
        {
          "prob": 1.003013181147361e-06,
          "token": "sky"
        },
        {
          "prob": 9.931175369924415e-08,
          "token": "ed"
        },
        {
          "prob": 8.233233559423349e-08,
          "token": "sku"
        },
        {
          "prob": 6.825590357542018e-08,
          "token": " sk"
        }
      ],
      [
        {
          "prob": 0.9999998807907247,
          "token": "ol"
        },
        {
          "prob": 6.023573837886479e-08,
          "token": "\u043e\u043b"
        },
        {
          "prob": 2.215948977336598e-08,
          "token": "ok"
        },
        {
          "prob": 6.34880011604368e-09,
          "token": "olk"
        },
        {
          "prob": 2.335593038799337e-09,
          "token": "olt"
        }
      ],
      [
        {
          "prob": 0.9999985694905718,
          "token": "tech"
        },
        {
          "prob": 4.4508482557577276e-07,
          "token": " tech"
        },
        {
          "prob": 3.4663241069161144e-07,
          "token": "techn"
        },
        {
          "prob": 3.059020287707785e-07,
          "token": "tek"
        },
        {
          "prob": 1.8553895931777327e-07,
          "token": "Tech"
        }
      ],
      [
        {
          "prob": 0.9999971389852362,
          "token": ".ru"
        },
        {
          "prob": 1.209863685851439e-06,
          "token": " ru"
        },
        {
          "prob": 8.315263400842229e-07,
          "token": "_ru"
        },
        {
          "prob": 6.47593364802092e-07,
          "token": "ru"
        },
        {
          "prob": 4.691155074157667e-08,
          "token": "RU"
        }
      ],
      [
        {
          "prob": 0.9999417100552707,
          "token": ")"
        },
        {
          "prob": 5.829127258796956e-05,
          "token": ")."
        },
        {
          "prob": 5.904954841587826e-10,
          "token": "\uff09"
        },
        {
          "prob": 2.789303162612206e-10,
          "token": "))"
        },
        {
          "prob": 2.4615514013746875e-10,
          "token": " )"
        }
      ],
      [
        {
          "prob": 0.9914214227512674,
          "token": " if"
        },
        {
          "prob": 0.008577476750351117,
          "token": " for"
        },
        {
          "prob": 3.43659156883941e-07,
          "token": "\tif"
        },
        {
          "prob": 3.0327814149491143e-07,
          "token": "\u5982\u679c"
        },
        {
          "prob": 1.4325845021965302e-07,
          "token": " If"
        }
      ],
      [
        {
          "prob": 0.9999977350285647,
          "token": " they"
        },
        {
          "prob": 2.2603250957489616e-06,
          "token": "\u4ed6\u4eec"
        },
        {
          "prob": 1.0467381829779195e-08,
          "token": "they"
        },
        {
          "prob": 1.2501504819116561e-09,
          "token": " \u043e\u043d\u0438"
        },
        {
          "prob": 6.691573328117371e-10,
          "token": " They"
        }
      ],
      [
        {
          "prob": 0.9999997615814777,
          "token": " have"
        },
        {
          "prob": 6.023573837886479e-08,
          "token": "have"
        },
        {
          "prob": 4.139937718785167e-08,
          "token": " Have"
        },
        {
          "prob": 3.6534822137210456e-08,
          "token": " need"
        },
        {
          "prob": 9.237449661970594e-09,
          "token": "_have"
        }
      ],
      [
        {
          "prob": 0.9999592320834669,
          "token": " urgent"
        },
        {
          "prob": 4.00636544290992e-05,
          "token": "urgent"
        },
        {
          "prob": 5.043269807052217e-07,
          "token": " urgently"
        },
        {
          "prob": 2.3822719733000979e-07,
          "token": " urgency"
        },
        {
          "prob": 1.343987161541799e-08,
          "token": " urg"
        }
      ],
      [
        {
          "prob": 0.9999996423722521,
          "token": " questions"
        },
        {
          "prob": 3.4663274126619643e-07,
          "token": "questions"
        },
        {
          "prob": 2.215948977336598e-08,
          "token": " Questions"
        },
        {
          "prob": 2.335593038799337e-09,
          "token": "_questions"
        },
        {
          "prob": 1.103256032343554e-09,
          "token": "Questions"
        }
      ],
      [
        {
          "prob": 0.9999997615814777,
          "token": " or"
        },
        {
          "prob": 1.8553913626159784e-07,
          "token": "\u6216"
        },
        {
          "prob": 9.056076989672867e-11,
          "token": " \u0438\u043b\u0438"
        },
        {
          "prob": 3.775134544279098e-11,
          "token": "or"
        },
        {
          "prob": 1.3887943864964021e-11,
          "token": "\u6216\u8005"
        }
      ],
      [
        {
          "prob": 0.9999849798550975,
          "token": " need"
        },
        {
          "prob": 1.4738974314670568e-05,
          "token": "\u9700\u8981"
        },
        {
          "prob": 2.699537311378345e-07,
          "token": "need"
        },
        {
          "prob": 2.2159151648965488e-08,
          "token": "_need"
        },
        {
          "prob": 8.151896325454668e-09,
          "token": " Need"
        }
      ],
      [
        {
          "prob": 0.9999991655356624,
          "token": " assistance"
        },
        {
          "prob": 5.715002286213223e-07,
          "token": " Assistance"
        },
        {
          "prob": 5.3157852544244216e-08,
          "token": " assist"
        },
        {
          "prob": 4.691164021834418e-08,
          "token": "ass"
        },
        {
          "prob": 1.3440409951135022e-08,
          "token": " assistant"
        }
      ],
      [
        {
          "prob": 1.0,
          "token": "."
        },
        {
          "prob": 3.850741922767617e-09,
          "token": "\u3002"
        },
        {
          "prob": 6.691586091292782e-10,
          "token": ".\n\n"
        },
        {
          "prob": 4.5990553786523166e-10,
          "token": ""
        },
        {
          "prob": 3.3647407934131505e-10,
          "token": ".)"
        }
      ],
      [
        {
          "prob": 0.999998927117538,
          "token": ""
        },
        {
          "prob": 2.2380270517518682e-07,
          "token": ""
        },
        {
          "prob": 1.3574320241537807e-07,
          "token": "<tool_call>"
        },
        {
          "prob": 8.677764327999391e-09,
          "token": " b\u1ee5"
        },
        {
          "prob": 4.644872530556089e-09,
          "token": "eka"
        }
      ]
    ],
    "language_consistency_score": 0.4288631908072936
  },
  {
    "question": "How many weeks before the start of a standard term does registration typically occur at Skoltech?\n\n",
    "true_answer": "Registration typically occurs about 3 weeks before the start of a standard term at Skoltech. \n",
    "source_doc": "Any performance below this may be reported to the Disciplinary Board for further examination. *Text Overlay: A-E, F,*  Pass/Fail\n\nSkoltech\u2019s variety of courses allows you to not only choose the ones that complement your educational track, but also be flexible about registering for them or making changes in your schedule (with some regulations, of course). When it comes to course registration, we mostly expect you to register for courses yourself with some exceptions. For instance, the Education Department has already registered you for your first course \\- Innovation Workshop :) \n\nFor standard terms (so, not Term 1A), registration will happen about 3 weeks before the start of the term (check the calendar\\!). Here\u2019s a quick timeline: \n\n*Graph:* \n\n![][image11]\n\nSide note:  Short-term projects follow regular registration schedule\n\nSo how do you register for your courses?As we\u2019ve already mentioned, you do not need to register for any courses in Term 1A \\- you are already signed up for a compulsory course called Innovation Workshop. Instructions on how to register for the other terms will be sent to you individually by the Education Department. Meanwhile, you can explore [the courses offered in 2022-2023](https://www.skoltech.ru/en/education/course-catalog/) (and in the upcoming terms) [using the link below](https://www.skoltech.ru/en/education/course-catalog/) and choose which ones you want to register for. You can filter courses based on your program, credit load, and instructors. After you\u2019ve registered for courses, you will be added to your course \u201cpage\u201d on Canvas. Here you will see information about your registered courses, your grades, assignments, group work and more. Make sure to bookmark Canvas in your browser and check it for updates from your professors and program coordinators on a daily basis\\! As a student, you have rights and channels for feedback. As Skoltech constantly works on improving this communication, please be aware of the following:\n\nYour student rights:\n\n* To obtain full information on your courses and educational programs, course syllabi, assessment criteria and feedback on your progress  \n* To provide your feedback on the quality of courses\n\n At the end of each course, you will be asked to submit a formal evaluation of the coursework, the course load and your professor, course instructor and teaching assistant. These evaluations are used to collect your *anonymous* feedback on each of your learning experiences. The feedback is then followed-up to Education Department, course instructors and program coordinators. If you need to communicate any concerns or issues informally or outside of the formal evaluation period (or if you are unable to solve an issue directly with your research advisor or faculty, please talk to the [Education Department](https://helpdesk.skoltech.ru/servicedesk/customer/portal/21) \u0438\u043d\u0444\u043e\u0440\u043c\u0430\u0446\u0438\u044f \u0434\u043b\u044f \u0441\u0432\u044f\u0437\u0438 \u0442\u0430\u043a\u0436\u0435 \u0432 \u043e\u043f\u0438\u0441\u0430\u043d\u0438\u0438. If you are a student of a network or a joint program, you probably have a few questions about the logistics of your studies. *Text Overlay: Network and Joint Programs and double degrees*\n\nYour schedule, curriculum and even travel times will depend on the program you are in. Moreover, there will be specific regulations on how to submit your original diploma and receive your scholarship if you are a student of a joint or network program. The details of your studies are normally coordinated by the Centers to which your programs belong. Each program has its own *coordinator*, who will be in touch with you regarding the essential information (if they haven\u2019t reached out yet). Until then, if you have urgent questions or need assistance, feel free to reach out to the Education Department via [education@skoltech.ru](mailto:education@skoltech.ru). For more details on the Education Department, as well as for all the relevant links, see the description below. *Text Overlay: education@skoltech.ru.*  \n",
    "context": "Sim: 4.35 - For standard terms (so, not Term 1A), registration will happen about 3 weeks before the start of the term (check the calendar\\!). Here\u2019s a quick timeline: ",
    "generated_answer": "Registration for standard terms typically occurs about 3 weeks before the start of the term.",
    "logprobs": [
      [
        {
          "prob": 0.9987584289828287,
          "token": "Registration"
        },
        {
          "prob": 0.0007092927857173879,
          "token": "About"
        },
        {
          "prob": 0.0003350460283109597,
          "token": " Registration"
        },
        {
          "prob": 0.0001232565456617471,
          "token": "3"
        },
        {
          "prob": 2.1418775995721647e-05,
          "token": "_registration"
        }
      ],
      [
        {
          "prob": 0.6791755591288788,
          "token": " for"
        },
        {
          "prob": 0.3208198175716597,
          "token": " typically"
        },
        {
          "prob": 1.9711860262508134e-06,
          "token": " occurs"
        },
        {
          "prob": 1.7395655625843797e-06,
          "token": "typically"
        },
        {
          "prob": 3.8814954256814605e-07,
          "token": " usually"
        }
      ],
      [
        {
          "prob": 0.985936148983184,
          "token": " standard"
        },
        {
          "prob": 0.014063626520379485,
          "token": " a"
        },
        {
          "prob": 8.640986659566481e-08,
          "token": "\u6807\u51c6"
        },
        {
          "prob": 6.729607176979939e-08,
          "token": "standard"
        },
        {
          "prob": 6.729607176979939e-08,
          "token": " the"
        }
      ],
      [
        {
          "prob": 0.9999992847447459,
          "token": " terms"
        },
        {
          "prob": 4.4508482557577276e-07,
          "token": "_terms"
        },
        {
          "prob": 1.4449788680693535e-07,
          "token": "terms"
        },
        {
          "prob": 8.764248219443636e-08,
          "token": " term"
        },
        {
          "prob": 1.186112015134383e-08,
          "token": " Terms"
        }
      ],
      [
        {
          "prob": 0.9953466054403297,
          "token": " typically"
        },
        {
          "prob": 0.002467217155768698,
          "token": " occurs"
        },
        {
          "prob": 0.0014964428491427157,
          "token": " at"
        },
        {
          "prob": 0.000623810188427094,
          "token": " ("
        },
        {
          "prob": 3.105768049978981e-05,
          "token": " usually"
        }
      ],
      [
        {
          "prob": 0.9999668609159512,
          "token": " occurs"
        },
        {
          "prob": 2.430002014511409e-05,
          "token": " happens"
        },
        {
          "prob": 7.889061496968893e-06,
          "token": " occur"
        },
        {
          "prob": 4.450703939668756e-07,
          "token": " occurring"
        },
        {
          "prob": 1.855329433281412e-07,
          "token": "occ"
        }
      ],
      [
        {
          "prob": 0.9999941587791524,
          "token": " about"
        },
        {
          "prob": 3.7266318480591813e-06,
          "token": "about"
        },
        {
          "prob": 1.2098602244086199e-06,
          "token": " approximately"
        },
        {
          "prob": 5.714975035023703e-07,
          "token": " "
        },
        {
          "prob": 1.8553807460118162e-07,
          "token": " around"
        }
      ],
      [
        {
          "prob": 1.0,
          "token": " "
        },
        {
          "prob": 2.172439935079017e-10,
          "token": "3"
        },
        {
          "prob": 2.129785170955785e-12,
          "token": " three"
        },
        {
          "prob": 6.041735480699455e-14,
          "token": "  "
        },
        {
          "prob": 2.0879679116459336e-14,
          "token": " about"
        }
      ],
      [
        {
          "prob": 1.0,
          "token": "3"
        },
        {
          "prob": 2.020683909022217e-11,
          "token": "2"
        },
        {
          "prob": 1.57371021068629e-11,
          "token": "\uff13"
        },
        {
          "prob": 4.752193062771153e-13,
          "token": "4"
        },
        {
          "prob": 3.2661313427874473e-13,
          "token": ""
        }
      ],
      [
        {
          "prob": 0.9999990463265931,
          "token": " weeks"
        },
        {
          "prob": 8.315279260963632e-07,
          "token": "weeks"
        },
        {
          "prob": 1.1253517471925912e-07,
          "token": " Weeks"
        },
        {
          "prob": 1.4166087866431961e-09,
          "token": "_week"
        },
        {
          "prob": 6.691586091292782e-10,
          "token": " semanas"
        }
      ],
      [
        {
          "prob": 0.9999996423722521,
          "token": " before"
        },
        {
          "prob": 3.927863545481039e-07,
          "token": "before"
        },
        {
          "prob": 1.0467401794744658e-08,
          "token": " Before"
        },
        {
          "prob": 3.850741922767617e-09,
          "token": "Before"
        },
        {
          "prob": 1.8189616875530459e-09,
          "token": "_before"
        }
      ],
      [
        {
          "prob": 0.9999822381318528,
          "token": " the"
        },
        {
          "prob": 1.3007061966414663e-05,
          "token": " their"
        },
        {
          "prob": 4.785030687486948e-06,
          "token": " they"
        },
        {
          "prob": 2.2159109383778193e-08,
          "token": " start"
        },
        {
          "prob": 4.598976431312031e-10,
          "token": "the"
        }
      ],
      [
        {
          "prob": 0.9999896288992495,
          "token": " start"
        },
        {
          "prob": 1.0129987330277146e-05,
          "token": " term"
        },
        {
          "prob": 2.699550183806035e-07,
          "token": "start"
        },
        {
          "prob": 1.7257663405271917e-08,
          "token": ".start"
        },
        {
          "prob": 3.398235411242209e-09,
          "token": " Start"
        }
      ],
      [
        {
          "prob": 0.998830376795955,
          "token": " of"
        },
        {
          "prob": 0.0011695103074966034,
          "token": "."
        },
        {
          "prob": 9.919570578397538e-08,
          "token": " at"
        },
        {
          "prob": 4.358355140757578e-09,
          "token": " c\u1ee7a"
        },
        {
          "prob": 2.9954507614062018e-09,
          "token": ","
        }
      ],
      [
        {
          "prob": 0.9996189139669129,
          "token": " the"
        },
        {
          "prob": 0.00037998415902487534,
          "token": " a"
        },
        {
          "prob": 1.0672967909538389e-06,
          "token": " term"
        },
        {
          "prob": 2.2151038210971456e-08,
          "token": " these"
        },
        {
          "prob": 9.233926526601374e-09,
          "token": " terms"
        }
      ],
      [
        {
          "prob": 0.9999998807907247,
          "token": " term"
        },
        {
          "prob": 1.2751905914873347e-07,
          "token": "term"
        },
        {
          "prob": 4.139937718785167e-08,
          "token": " terms"
        },
        {
          "prob": 3.398267819495071e-09,
          "token": " standard"
        },
        {
          "prob": 1.8189616875530459e-09,
          "token": " semester"
        }
      ],
      [
        {
          "prob": 0.7772994494994885,
          "token": "."
        },
        {
          "prob": 0.22270001424141084,
          "token": " at"
        },
        {
          "prob": 4.442273823731504e-07,
          "token": ","
        },
        {
          "prob": 1.1838247462498554e-08,
          "token": ".at"
        },
        {
          "prob": 8.136300560649687e-09,
          "token": ".\n\n"
        }
      ],
      [
        {
          "prob": 0.999998927117538,
          "token": ""
        },
        {
          "prob": 2.8736836176841304e-07,
          "token": ""
        },
        {
          "prob": 1.275189375371399e-07,
          "token": "<tool_call>"
        },
        {
          "prob": 7.19411930861867e-09,
          "token": " b\u1ee5"
        },
        {
          "prob": 7.19411930861867e-09,
          "token": "checker"
        }
      ]
    ],
    "language_consistency_score": 0.8615809210955365
  },
  {
    "question": "What is the name of the internal committee at Skoltech responsible for addressing student misconduct?\n",
    "true_answer": "Skoltech Disciplinary Board (DB) \n",
    "source_doc": "\n### Video 4 \n\nIn this module, we\u2019re going to talk about Academic Integrity. This includes Academic Misconduct and Disciplinary Measures. On top of that, we\u2019ll discuss the Education Process, which covers Academic Structure, the Grading System, and Course Registration. *Text Overlay:* \n\n- *Academic Integrity : Academic Misconduct , Disciplinary Measures*  \n- *Education Process : Academic structure, grading system, course registration* \n\n\nLet\u2019s start with Academic Integrity. It relies on our community\u2019s personal values and policies on ethics, conflict of interest, and others. We expect everyone to: \n\n- Follow professional courtesy  \n- Be committed to honesty without compromising their values  \n- Promote the truth without compromise\n\n*Text Overlay:* \n\n- *Follow professional courtesy*  \n- *Be committed to honesty without compromising their values*  \n- *Promote the truth without compromise*\n\nThis is very important because it leads to the respectful culture that you develop in terms of how you conduct your academic studies, publish in top journals recognized in the most prominent fields, and other achievements. If, at any stage or time, the integrity of your studies is compromised, you will enter the realms of academic misconduct. *Text Overlay: academic misconduct.*\n\nFormal definitions of academic misconduct say that it is the intent of the individual participating in this to cheat the system in some way to gain something in return. \u200b\u200bWhat\u2019s considered academic misconduct? * Deliberate interference with the integrity of others\u2019 work  \n* Fabrication or falsification of data  \n* Unauthorized collaboration  \n* Plagiarism  \n* Cheating\n\n*Text Overlay:* \n\n* *Deliberate interference with the integrity of others\u2019 work*  \n* *Fabrication or falsification of data*  \n* *Unauthorized collaboration*  \n* *Plagiarism*  \n* *Cheating*\n\nResearch Misconduct includes such offenses as:\n\n* Substitution of data  \n* Unrealistic precision of data  \n* Results that contradict known physics\n\n*Text Overlay: Research Misconduct includes such offenses as:*\n\n* *Substitution of data*  \n* *Unrealistic precision of data*  \n* *Results that contradict known physics*\n\nYou can learn more about disciplinary actions by clicking the link below. Discipline is an important part of any academic organization, and in this case Skoltech is no exception. Students who cheat, plagiarize or participate in any other form of academic or research misconduct (including failing classes and violating full time status) are subject to an evaluation by the Skoltech Disciplinary Board (DB). *Text Overlays: Disciplinary Measures at Skoltech*\n\nIf a faculty member witnesses a student\u2019s academic misconduct, the student\u2019s name will be submitted to the Disciplinary Board. Both the student and the witness will be given a chance to explain their positions in writing. Then the Disciplinary Board will make a decision regarding the student\u2019s status at Skoltech. Each case of academic and research misconduct is taken seriously and reviewed on an individual basis. For more information about this, please see the Disciplinary Board Policy via the link below. The DBP Skoltech Disciplinary Board is an internal committee formed in order to address the issues related to student misconduct and the other disputes between students and Skoltech. The Disciplinary Board reviews individual cases related to the following:\n\n- academic misconduct  \n- full-time student status violation  \n- poor academic performance  \n- violation of the attendance regulations  \n- violation (by the students) of other policies  \n- and regulations governing educational  \n- processes  \n- other academic-related issues /conflicts\n\n*Text Overlay:*\n\n- *academic misconduct*  \n- *full-time student status violation*  \n- *poor academic performance*  \n- *violation of the attendance regulations*  \n- *violation (by the students) of other policies*  \n- *and regulations governing educational*\n\nNow this lesson wouldn\u2019t make sense without some actual advice on how to avoid academic and research misconduct. 1.",
    "context": "Sim: 7.75 - The DBP Skoltech Disciplinary Board is an internal committee formed in order to address the issues related to student misconduct and the other disputes between students and Skoltech. The Disciplinary Board reviews individual cases related to the following:\nSim: 4.28 - Discipline is an important part of any academic organization, and in this case Skoltech is no exception. Students who cheat, plagiarize or participate in any other form of academic or research misconduct (including failing classes and violating full time status) are subject to an evaluation by the Skoltech Disciplinary Board (DB).\nSim: 4.12 - If a faculty member witnesses a student\u2019s academic misconduct, the student\u2019s name will be submitted to the Disciplinary Board. Both the student and the witness will be given a chance to explain their positions in writing. Then the Disciplinary Board will make a decision regarding the student\u2019s status at Skoltech. Each case of academic and research misconduct is taken seriously and reviewed on an individual basis. For more information about this, please see the Disciplinary Board Policy via the link below. ",
    "generated_answer": "The DBP Skoltech Disciplinary Board.",
    "logprobs": [
      [
        {
          "prob": 0.9992903742048809,
          "token": "The"
        },
        {
          "prob": 0.00070967033651176,
          "token": "DB"
        },
        {
          "prob": 9.230897704904775e-09,
          "token": "Db"
        },
        {
          "prob": 5.598822474695727e-09,
          "token": "It"
        },
        {
          "prob": 2.9968337158298627e-09,
          "token": " The"
        }
      ],
      [
        {
          "prob": 0.997205222222544,
          "token": " DB"
        },
        {
          "prob": 0.0016988587833085475,
          "token": " name"
        },
        {
          "prob": 0.0010304099385987351,
          "token": " internal"
        },
        {
          "prob": 2.4232907508317494e-05,
          "token": "DB"
        },
        {
          "prob": 1.887260734357459e-05,
          "token": " Disc"
        }
      ],
      [
        {
          "prob": 0.9999997615814777,
          "token": "P"
        },
        {
          "prob": 2.699578503363014e-07,
          "token": "S"
        },
        {
          "prob": 4.691164021834418e-08,
          "token": " Sk"
        },
        {
          "prob": 3.850741922767617e-09,
          "token": "D"
        },
        {
          "prob": 1.9362746373840963e-09,
          "token": "Sk"
        }
      ],
      [
        {
          "prob": 0.9999988079084972,
          "token": " Sk"
        },
        {
          "prob": 9.422445831379603e-07,
          "token": " ("
        },
        {
          "prob": 8.76423150298272e-08,
          "token": " Disc"
        },
        {
          "prob": 4.691155074157667e-08,
          "token": "Sk"
        },
        {
          "prob": 2.5109943663977427e-08,
          "token": "_sk"
        }
      ],
      [
        {
          "prob": 0.9999998807907247,
          "token": "ol"
        },
        {
          "prob": 4.691164021834418e-08,
          "token": "olk"
        },
        {
          "prob": 1.522997974471263e-08,
          "token": "olt"
        },
        {
          "prob": 8.152020714470167e-09,
          "token": "\u043e\u043b"
        },
        {
          "prob": 7.194133030325383e-09,
          "token": "col"
        }
      ],
      [
        {
          "prob": 0.9997574679353942,
          "token": "tech"
        },
        {
          "prob": 0.00013980775840064373,
          "token": "Tech"
        },
        {
          "prob": 8.479769193568691e-05,
          "token": " tech"
        },
        {
          "prob": 6.960618425850654e-06,
          "token": "otech"
        },
        {
          "prob": 3.7257505619964264e-06,
          "token": "itech"
        }
      ],
      [
        {
          "prob": 0.9999980926550052,
          "token": " Disc"
        },
        {
          "prob": 1.553497204890439e-06,
          "token": "Disc"
        },
        {
          "prob": 3.0590173704000945e-07,
          "token": "_disc"
        },
        {
          "prob": 4.139929822488149e-08,
          "token": " Discipline"
        },
        {
          "prob": 9.237432042950414e-09,
          "token": " Discrim"
        }
      ],
      [
        {
          "prob": 0.9999994039539004,
          "token": "iplinary"
        },
        {
          "prob": 6.47594599989589e-07,
          "token": "ipl"
        },
        {
          "prob": 1.3440409951135022e-08,
          "token": "our"
        },
        {
          "prob": 5.602796437537268e-09,
          "token": "pl"
        },
        {
          "prob": 8.592166619174109e-10,
          "token": "ip"
        }
      ],
      [
        {
          "prob": 0.9999982118638471,
          "token": " Board"
        },
        {
          "prob": 1.7603429545652396e-06,
          "token": "Board"
        },
        {
          "prob": 2.2159447507533765e-08,
          "token": "_board"
        },
        {
          "prob": 1.955564378838448e-08,
          "token": " Committee"
        },
        {
          "prob": 7.582545965339434e-10,
          "token": " Boards"
        }
      ],
      [
        {
          "prob": 0.9999088132058339,
          "token": "."
        },
        {
          "prob": 7.484497731169222e-05,
          "token": " is"
        },
        {
          "prob": 1.4737849863065211e-05,
          "token": ""
        },
        {
          "prob": 1.06760626328772e-06,
          "token": "\u3002"
        },
        {
          "prob": 2.2378242977893918e-07,
          "token": ".\n\n"
        }
      ],
      [
        {
          "prob": 0.9999983310727032,
          "token": ""
        },
        {
          "prob": 5.714996835964923e-07,
          "token": ""
        },
        {
          "prob": 2.2380249174039673e-07,
          "token": "<tool_call>"
        },
        {
          "prob": 7.658100140818556e-09,
          "token": "/WebAPI"
        },
        {
          "prob": 7.19411930861867e-09,
          "token": "ienie"
        }
      ]
    ],
    "language_consistency_score": 0.706530659975566
  },
  {
    "question": "What does Skoltech's Disciplinary Board review cases related to?\n",
    "true_answer": "Skoltech's Disciplinary Board reviews individual cases related to academic misconduct, full-time student status violation, poor academic performance, violation of the attendance regulations, violation of other policies and regulations governing education, and other academic-related issues and conflicts. \n",
    "source_doc": "\n### Video 4 \n\nIn this module, we\u2019re going to talk about Academic Integrity. This includes Academic Misconduct and Disciplinary Measures. On top of that, we\u2019ll discuss the Education Process, which covers Academic Structure, the Grading System, and Course Registration. *Text Overlay:* \n\n- *Academic Integrity : Academic Misconduct , Disciplinary Measures*  \n- *Education Process : Academic structure, grading system, course registration* \n\n\nLet\u2019s start with Academic Integrity. It relies on our community\u2019s personal values and policies on ethics, conflict of interest, and others. We expect everyone to: \n\n- Follow professional courtesy  \n- Be committed to honesty without compromising their values  \n- Promote the truth without compromise\n\n*Text Overlay:* \n\n- *Follow professional courtesy*  \n- *Be committed to honesty without compromising their values*  \n- *Promote the truth without compromise*\n\nThis is very important because it leads to the respectful culture that you develop in terms of how you conduct your academic studies, publish in top journals recognized in the most prominent fields, and other achievements. If, at any stage or time, the integrity of your studies is compromised, you will enter the realms of academic misconduct. *Text Overlay: academic misconduct.*\n\nFormal definitions of academic misconduct say that it is the intent of the individual participating in this to cheat the system in some way to gain something in return. \u200b\u200bWhat\u2019s considered academic misconduct? * Deliberate interference with the integrity of others\u2019 work  \n* Fabrication or falsification of data  \n* Unauthorized collaboration  \n* Plagiarism  \n* Cheating\n\n*Text Overlay:* \n\n* *Deliberate interference with the integrity of others\u2019 work*  \n* *Fabrication or falsification of data*  \n* *Unauthorized collaboration*  \n* *Plagiarism*  \n* *Cheating*\n\nResearch Misconduct includes such offenses as:\n\n* Substitution of data  \n* Unrealistic precision of data  \n* Results that contradict known physics\n\n*Text Overlay: Research Misconduct includes such offenses as:*\n\n* *Substitution of data*  \n* *Unrealistic precision of data*  \n* *Results that contradict known physics*\n\nYou can learn more about disciplinary actions by clicking the link below. Discipline is an important part of any academic organization, and in this case Skoltech is no exception. Students who cheat, plagiarize or participate in any other form of academic or research misconduct (including failing classes and violating full time status) are subject to an evaluation by the Skoltech Disciplinary Board (DB). *Text Overlays: Disciplinary Measures at Skoltech*\n\nIf a faculty member witnesses a student\u2019s academic misconduct, the student\u2019s name will be submitted to the Disciplinary Board. Both the student and the witness will be given a chance to explain their positions in writing. Then the Disciplinary Board will make a decision regarding the student\u2019s status at Skoltech. Each case of academic and research misconduct is taken seriously and reviewed on an individual basis. For more information about this, please see the Disciplinary Board Policy via the link below. The DBP Skoltech Disciplinary Board is an internal committee formed in order to address the issues related to student misconduct and the other disputes between students and Skoltech. The Disciplinary Board reviews individual cases related to the following:\n\n- academic misconduct  \n- full-time student status violation  \n- poor academic performance  \n- violation of the attendance regulations  \n- violation (by the students) of other policies  \n- and regulations governing educational  \n- processes  \n- other academic-related issues /conflicts\n\n*Text Overlay:*\n\n- *academic misconduct*  \n- *full-time student status violation*  \n- *poor academic performance*  \n- *violation of the attendance regulations*  \n- *violation (by the students) of other policies*  \n- *and regulations governing educational*\n\nNow this lesson wouldn\u2019t make sense without some actual advice on how to avoid academic and research misconduct. 1.",
    "context": "Sim: 8.24 - The DBP Skoltech Disciplinary Board is an internal committee formed in order to address the issues related to student misconduct and the other disputes between students and Skoltech. The Disciplinary Board reviews individual cases related to the following:\nSim: 4.23 - If a faculty member witnesses a student\u2019s academic misconduct, the student\u2019s name will be submitted to the Disciplinary Board. Both the student and the witness will be given a chance to explain their positions in writing. Then the Disciplinary Board will make a decision regarding the student\u2019s status at Skoltech. Each case of academic and research misconduct is taken seriously and reviewed on an individual basis. For more information about this, please see the Disciplinary Board Policy via the link below. \nSim: 3.69 - Discipline is an important part of any academic organization, and in this case Skoltech is no exception. Students who cheat, plagiarize or participate in any other form of academic or research misconduct (including failing classes and violating full time status) are subject to an evaluation by the Skoltech Disciplinary Board (DB).",
    "generated_answer": "Skoltech's Disciplinary Board reviews cases related to student misconduct and disputes between students and Skoltech.",
    "logprobs": [
      [
        {
          "prob": 0.9911806910165648,
          "token": "Sk"
        },
        {
          "prob": 0.008575395162616694,
          "token": "The"
        },
        {
          "prob": 0.0001779765637395781,
          "token": "Student"
        },
        {
          "prob": 2.7293590031457294e-05,
          "token": " Sk"
        },
        {
          "prob": 2.125626928932883e-05,
          "token": "Cases"
        }
      ],
      [
        {
          "prob": 0.9999984502816872,
          "token": "ol"
        },
        {
          "prob": 3.0590173704000945e-07,
          "token": "\u043e\u043b"
        },
        {
          "prob": 2.5360144730813174e-07,
          "token": "oll"
        },
        {
          "prob": 2.3823651234966232e-07,
          "token": "olk"
        },
        {
          "prob": 1.5381705313987978e-07,
          "token": "hol"
        }
      ],
      [
        {
          "prob": 0.999874845907329,
          "token": "tech"
        },
        {
          "prob": 7.484247913274521e-05,
          "token": "Tech"
        },
        {
          "prob": 1.4737357942463797e-05,
          "token": " tech"
        },
        {
          "prob": 1.4737357942463797e-05,
          "token": "te"
        },
        {
          "prob": 4.784519618364044e-06,
          "token": "tek"
        }
      ],
      [
        {
          "prob": 0.9999998807907247,
          "token": "'s"
        },
        {
          "prob": 6.023573837886479e-08,
          "token": " Disc"
        },
        {
          "prob": 1.0467401794744658e-08,
          "token": "\u2019s"
        },
        {
          "prob": 5.211412487888539e-10,
          "token": "'S"
        },
        {
          "prob": 4.058652126475693e-10,
          "token": " Discipline"
        }
      ],
      [
        {
          "prob": 0.9999948740268748,
          "token": " Disc"
        },
        {
          "prob": 3.7266354020539563e-06,
          "token": "Disc"
        },
        {
          "prob": 1.2098613782217925e-06,
          "token": " Discipline"
        },
        {
          "prob": 7.734377650551034e-08,
          "token": "_disc"
        },
        {
          "prob": 6.825564320030807e-08,
          "token": " DB"
        }
      ],
      [
        {
          "prob": 0.9999997615814777,
          "token": "iplinary"
        },
        {
          "prob": 2.699578503363014e-07,
          "token": "ipl"
        },
        {
          "prob": 2.4862258480890196e-09,
          "token": "itational"
        },
        {
          "prob": 2.061153622438558e-09,
          "token": "our"
        },
        {
          "prob": 1.8189616875530459e-09,
          "token": "ursive"
        }
      ],
      [
        {
          "prob": 0.9999928474936721,
          "token": " Board"
        },
        {
          "prob": 6.962258245244699e-06,
          "token": "Board"
        },
        {
          "prob": 2.6995604817923813e-07,
          "token": "_board"
        },
        {
          "prob": 7.582502577787526e-10,
          "token": "\u677f"
        },
        {
          "prob": 5.905258945221871e-10,
          "token": "(Board"
        }
      ],
      [
        {
          "prob": 0.9999941587791524,
          "token": " reviews"
        },
        {
          "prob": 3.288741062985334e-06,
          "token": "reviews"
        },
        {
          "prob": 7.338173200706349e-07,
          "token": " reviewers"
        },
        {
          "prob": 7.338173200706349e-07,
          "token": " review"
        },
        {
          "prob": 3.059005701197153e-07,
          "token": " reviewed"
        }
      ],
      [
        {
          "prob": 0.9968234201720128,
          "token": " cases"
        },
        {
          "prob": 0.0031726710050749133,
          "token": " individual"
        },
        {
          "prob": 3.714815823317269e-06,
          "token": " issues"
        },
        {
          "prob": 4.6762629988362344e-08,
          "token": "cases"
        },
        {
          "prob": 3.6418772853414954e-08,
          "token": "individual"
        }
      ],
      [
        {
          "prob": 0.9999945164027223,
          "token": " related"
        },
        {
          "prob": 4.2228271137778295e-06,
          "token": " of"
        },
        {
          "prob": 3.9278410701298514e-07,
          "token": " relating"
        },
        {
          "prob": 3.466307578234157e-07,
          "token": " involving"
        },
        {
          "prob": 3.059005701197153e-07,
          "token": "related"
        }
      ],
      [
        {
          "prob": 1.0,
          "token": " to"
        },
        {
          "prob": 4.058652126475693e-10,
          "token": "to"
        },
        {
          "prob": 2.5946094982764667e-11,
          "token": "\u5230"
        },
        {
          "prob": 1.57371021068629e-11,
          "token": "_to"
        },
        {
          "prob": 5.109089028063325e-12,
          "token": "\tto"
        }
      ],
      [
        {
          "prob": 0.9999392069583942,
          "token": " student"
        },
        {
          "prob": 2.144409943268609e-05,
          "token": " issues"
        },
        {
          "prob": 1.4738299633412718e-05,
          "token": " academic"
        },
        {
          "prob": 1.3006503775850402e-05,
          "token": " misconduct"
        },
        {
          "prob": 4.7848253406541e-06,
          "token": " students"
        }
      ],
      [
        {
          "prob": 0.9999984502816872,
          "token": " misconduct"
        },
        {
          "prob": 1.370956471489639e-06,
          "token": " conduct"
        },
        {
          "prob": 5.315775115378354e-08,
          "token": " mis"
        },
        {
          "prob": 4.139929822488149e-08,
          "token": " academic"
        },
        {
          "prob": 1.18610975280741e-08,
          "token": " disputes"
        }
      ],
      [
        {
          "prob": 0.9975841138568614,
          "token": " and"
        },
        {
          "prob": 0.001323574834649976,
          "token": ","
        },
        {
          "prob": 0.0010308011176790065,
          "token": " including"
        },
        {
          "prob": 5.8153847385537164e-05,
          "token": " such"
        },
        {
          "prob": 3.280815566783842e-06,
          "token": "."
        }
      ],
      [
        {
          "prob": 0.9706793459391061,
          "token": " disputes"
        },
        {
          "prob": 0.029311974260133992,
          "token": " other"
        },
        {
          "prob": 2.4861893355806944e-06,
          "token": " research"
        },
        {
          "prob": 1.9362462014140204e-06,
          "token": " disputed"
        },
        {
          "prob": 1.036397907733337e-06,
          "token": " conflicts"
        }
      ],
      [
        {
          "prob": 0.9999749666753994,
          "token": " between"
        },
        {
          "prob": 1.4738833753528276e-05,
          "token": " involving"
        },
        {
          "prob": 8.939554559922333e-06,
          "token": "."
        },
        {
          "prob": 9.422221185442924e-07,
          "token": ","
        },
        {
          "prob": 3.0589473558501603e-07,
          "token": "\u4e4b\u95f4"
        }
      ],
      [
        {
          "prob": 0.9999997615814777,
          "token": " students"
        },
        {
          "prob": 2.382369667501818e-07,
          "token": "students"
        },
        {
          "prob": 8.152020714470167e-09,
          "token": "\u5b66\u751f"
        },
        {
          "prob": 6.34880011604368e-09,
          "token": "\u5b66\u751f\u4eec"
        },
        {
          "prob": 4.944450501938644e-09,
          "token": " Students"
        }
      ],
      [
        {
          "prob": 0.994076619024973,
          "token": " and"
        },
        {
          "prob": 0.005910996116390646,
          "token": "."
        },
        {
          "prob": 1.1410901460969127e-05,
          "token": ","
        },
        {
          "prob": 9.366638307210955e-07,
          "token": " or"
        },
        {
          "prob": 2.496124559633007e-08,
          "token": " involving"
        }
      ],
      [
        {
          "prob": 0.8519496373592031,
          "token": " Sk"
        },
        {
          "prob": 0.14804664369295154,
          "token": " the"
        },
        {
          "prob": 3.5976569357665894e-06,
          "token": "Sk"
        },
        {
          "prob": 1.0863972230434488e-07,
          "token": "_sk"
        },
        {
          "prob": 1.1450542487494226e-08,
          "token": " SK"
        }
      ],
      [
        {
          "prob": 0.9999648344963598,
          "token": "ol"
        },
        {
          "prob": 2.7535477717122882e-05,
          "token": "olk"
        },
        {
          "prob": 1.370910711644191e-06,
          "token": "opt"
        },
        {
          "prob": 1.209824456746042e-06,
          "token": "col"
        },
        {
          "prob": 1.067666335749473e-06,
          "token": "olt"
        }
      ],
      [
        {
          "prob": 0.9999786619922026,
          "token": "tech"
        },
        {
          "prob": 7.889159304314481e-06,
          "token": "Tech"
        },
        {
          "prob": 7.889159304314481e-06,
          "token": " tech"
        },
        {
          "prob": 1.7603093790081653e-06,
          "token": "itech"
        },
        {
          "prob": 1.209841763547506e-06,
          "token": "te"
        }
      ],
      [
        {
          "prob": 0.9980727693729643,
          "token": "."
        },
        {
          "prob": 0.0019267333340007235,
          "token": ","
        },
        {
          "prob": 4.442273823731504e-07,
          "token": " on"
        },
        {
          "prob": 7.180273738542893e-09,
          "token": ".\n\n"
        },
        {
          "prob": 5.5920028102442495e-09,
          "token": " including"
        }
      ],
      [
        {
          "prob": 0.9999779467683537,
          "token": ""
        },
        {
          "prob": 4.785012434078284e-06,
          "token": " It"
        },
        {
          "prob": 3.7265714306665768e-06,
          "token": " Specifically"
        },
        {
          "prob": 3.5007898814756853e-06,
          "token": "pecific"
        },
        {
          "prob": 6.475810130566981e-07,
          "token": " The"
        }
      ]
    ],
    "language_consistency_score": 0.8278367012714287
  },
  {
    "question": "What should you do if you are unsure about whether a certain action is appropriate during data manipulation?\n",
    "true_answer": "You should consult with your advisor or the Education Department. \n",
    "source_doc": "Always consult with your advisor or Education Department if you are unsure about whether a particular action (e.g., dropping a data point) could be questionable. 2. Make sure you understand why it is ok to manipulate data in certain ways (especially applies if you are following a protocol or methodology originally created by someone else). 3. Be vigilant about your collaborations. Beware of people who will not show you raw data or who refuse to explain how they convert raw data into a plot / figure / table. Now let\u2019s talk about the education process itself.",
    "context": "Sim: 3.19 - 1. Always consult with your advisor or Education Department if you are unsure about whether a particular action (e.g., dropping a data point) could be questionable.  ",
    "generated_answer": "You should always consult with your advisor or Education Department.",
    "logprobs": [
      [
        {
          "prob": 0.5106275348903849,
          "token": "You"
        },
        {
          "prob": 0.3976771240304529,
          "token": "Always"
        },
        {
          "prob": 0.06910592206280358,
          "token": "If"
        },
        {
          "prob": 0.022435408106762998,
          "token": "Consult"
        },
        {
          "prob": 8.091467723618596e-05,
          "token": " Always"
        }
      ],
      [
        {
          "prob": 0.9999997615814777,
          "token": " should"
        },
        {
          "prob": 1.4449802461092448e-07,
          "token": "should"
        },
        {
          "prob": 8.764248219443636e-08,
          "token": "\u5e94\u8be5"
        },
        {
          "prob": 2.8453348089834e-08,
          "token": " Should"
        },
        {
          "prob": 2.9989608248573072e-09,
          "token": "\u5e94"
        }
      ],
      [
        {
          "prob": 0.904591591985148,
          "token": " always"
        },
        {
          "prob": 0.09534325376114217,
          "token": " consult"
        },
        {
          "prob": 3.198408320828581e-05,
          "token": " Always"
        },
        {
          "prob": 1.3332949523771491e-05,
          "token": "always"
        },
        {
          "prob": 9.163593262349345e-06,
          "token": "consult"
        }
      ],
      [
        {
          "prob": 0.9999797348316635,
          "token": " consult"
        },
        {
          "prob": 1.473890403393186e-05,
          "token": "consult"
        },
        {
          "prob": 4.785021560773912e-06,
          "token": "\u54a8\u8be2"
        },
        {
          "prob": 3.4662579926611693e-07,
          "token": " consulted"
        },
        {
          "prob": 1.125328136620996e-07,
          "token": " Consult"
        }
      ],
      [
        {
          "prob": 0.9999991655356624,
          "token": " with"
        },
        {
          "prob": 8.315279260963632e-07,
          "token": " your"
        },
        {
          "prob": 7.194133030325383e-09,
          "token": "with"
        },
        {
          "prob": 8.592166619174109e-10,
          "token": " v\u1edbi"
        },
        {
          "prob": 4.058652126475693e-10,
          "token": "_with"
        }
      ],
      [
        {
          "prob": 1.0,
          "token": " your"
        },
        {
          "prob": 8.152020714470167e-09,
          "token": "your"
        },
        {
          "prob": 3.398267819495071e-09,
          "token": "\u4f60\u7684"
        },
        {
          "prob": 9.056076989672867e-11,
          "token": "\u60a8\u7684"
        },
        {
          "prob": 9.056076989672867e-11,
          "token": " an"
        }
      ],
      [
        {
          "prob": 0.9999240694467058,
          "token": " advisor"
        },
        {
          "prob": 7.484611936412656e-05,
          "token": "advisor"
        },
        {
          "prob": 3.466062962955991e-07,
          "token": "\u987e\u95ee"
        },
        {
          "prob": 3.466062962955991e-07,
          "token": " advisors"
        },
        {
          "prob": 2.3821879140541234e-07,
          "token": " adviser"
        }
      ],
      [
        {
          "prob": 0.9999985694905718,
          "token": " or"
        },
        {
          "prob": 1.3709577789362383e-06,
          "token": "\u6216"
        },
        {
          "prob": 7.582545965339434e-10,
          "token": "\u6216\u8005"
        },
        {
          "prob": 2.1724357914826287e-10,
          "token": " \u0438\u043b\u0438"
        },
        {
          "prob": 4.847359460656998e-11,
          "token": "\u6216\u662f"
        }
      ],
      [
        {
          "prob": 0.9947718965589782,
          "token": " Education"
        },
        {
          "prob": 0.0052200835530716375,
          "token": " the"
        },
        {
          "prob": 7.848081946561722e-06,
          "token": "Education"
        },
        {
          "prob": 9.879277187359726e-08,
          "token": " Educational"
        },
        {
          "prob": 3.634382970863674e-08,
          "token": " Ed"
        }
      ],
      [
        {
          "prob": 0.9999957084838798,
          "token": " Department"
        },
        {
          "prob": 4.2228351681890325e-06,
          "token": "Department"
        },
        {
          "prob": 5.315764976351624e-08,
          "token": "_department"
        },
        {
          "prob": 5.602775064605783e-09,
          "token": " Depart"
        },
        {
          "prob": 5.602775064605783e-09,
          "token": " Division"
        }
      ],
      [
        {
          "prob": 0.999663823633758,
          "token": "."
        },
        {
          "prob": 0.00033534971441097653,
          "token": " if"
        },
        {
          "prob": 6.473772432674506e-07,
          "token": " for"
        },
        {
          "prob": 6.823312451153405e-08,
          "token": " when"
        },
        {
          "prob": 6.823312451153405e-08,
          "token": " in"
        }
      ],
      [
        {
          "prob": 0.9999982118638471,
          "token": ""
        },
        {
          "prob": 3.466320801173418e-07,
          "token": ""
        },
        {
          "prob": 2.2380249174039673e-07,
          "token": "<tool_call>"
        },
        {
          "prob": 2.2159447507533765e-08,
          "token": " b\u1ee5"
        },
        {
          "prob": 7.19411930861867e-09,
          "token": "\ud83e\udd16"
        }
      ]
    ],
    "language_consistency_score": 0.788429751490893
  },
  {
    "question": "What is the name of the Skolkovo train station that can be used to reach the Skoltech campus?\n",
    "true_answer": "The Skolkovo train station is called \"MCD Skolkovo\" (\u0421\u043a\u043e\u043b\u043a\u043e\u0432\u043e). \n",
    "source_doc": "\n### Text After Video 3\n\n**Topic 1  \u201c Location & Transportation  \u2014 Premises Location, Public Transport & Carsharing, Personal Cars & Parking\u201d**\n\nBy now you\u2019ve probably heard that our campus and its premises are pretty cool. In fact, you may have visited it during an Open Doors event or perhaps a conference or a summer school. ![][image7]The campus is located within the Skolkovo Innovation Center territory a few minutes away from the center of Moscow. The campus is part of the Skolkovo Innovation Center, which is a closed territory. This means you may need a car pass if you decide to drive here. So, you can reach the campus in multiple ways. **First, you can use public transportation.** \n\nThis is the safest and surest way to reach the campus if you need to be there by a certain time (or just want your arrival time to be predictable). No matter where you are traveling from, you can use Moscow\u2019s MCD-1(Moscow Central Diameter \\#1) metro line to get to the Skolkovo Train station. It\u2019s about a 20 minute ride from the city center. You\u2019ll need to exit the train at the \u201cMCD Skolkovo\u201d (\u0421\u043a\u043e\u043b\u043a\u043e\u0432\u043e) station. Once you arrive, take the stairs, escalator or an elevator to the second floor and walk down the looooong hall of the Orbion building. Then, once again, go down to the 1st floor and exit. Once you exit the building, you can take the Sk1 bus shuttle from the nearest bus stop (look to your left). Or, you can take a walk towards the Amaltea business center, walk down the stairs, cross the road and catch any shuttle bus that goes towards Skoltech (the wooden building that looks like a crown, you\u2019ll know it when you see it). This way will take about 10 minutes if you are a fast walker. Remember that the shuttle buses at Skolkovo have paid fares (same as within the Moscow public transportation system, we\u2019ll talk about that in the next modules) and can be tracked via [Yandex maps](https://yandex.ru/maps/213/moscow/?ll=37.622504%2C55.753215\\&z=10) \n\n[(links to an external site)](https://yandex.ru/maps/213/moscow/?ll=37.622504%2C55.753215\\&z=10)\n\nBy the way, the Skolkovo Innovation Center website also has some tips on how to reach other buildings on the territory. Visit [https://sk.ru/transport/](https://sk.ru/transport/) \n\n[(links to an external site)](https://sk.ru/transport/)\n\nfor more information. ![][image8]\n\n \n\nThe next best thing is to take a taxi\n\nCurrently, only taxi services [Yandex (links to an external site)](https://taxi.yandex.ru/ru\\_ru/) , [Citi Mobil](https://city-mobil.ru/) \n\n[(links to an external site)](https://city-mobil.ru/) , and [Uber  (links to an external site)](https://support-uber.com/) have automatic access to the Skolkovo Innovation Center. All you need to do is download a relevant app to your smartphone, order a taxi to Skoltech (just type \u201c\u0421\u043a\u043e\u043b\u0442\u0435\u0445\u201d in the destination, it will be there) and relax. Don\u2019t forget to buckle up\\! If you take a different taxi service, you\u2019ll need to order a territory pass ahead of time. To order a pass for your taxi, email security.campus@skoltech.ru from your Skoltech email address with your taxi\u2019s model and license number (i.e. Toyota, \u0425111\u0421\u041a197).",
    "context": "Sim: 4.41 - This is the safest and surest way to reach the campus if you need to be there by a certain time (or just want your arrival time to be predictable). No matter where you are traveling from, you can use Moscow\u2019s MCD-1(Moscow Central Diameter \\#1) metro line to get to the Skolkovo Train station. It\u2019s about a 20 minute ride from the city center. You\u2019ll need to exit the train at the \u201cMCD Skolkovo\u201d (\u0421\u043a\u043e\u043b\u043a\u043e\u0432\u043e) station.\nSim: 2.24 - The buses, metro, trains and other city-sponsored modes of transfer are integrated by one system. You can buy yourself single- or double-ride tickets or get a permanent Troika card and top off its balance every once in a while. If you\u2019re planning to explore the city center, we recommend using the underground metro. Yandex Metro app (links to an external site)has the current map and allows you to plan your route to point A to point B. The metro is designed in a sun-like way, with multi-colored lines stemming away from the center outwards. There are also several circle lines which connect them. You will notice on the map (and have already seen it mentioned in this course) the MCD lines. These are newer extensions of the metro line that take you a little bit outside of the city for a few extra rubles. One of these lines, MCD 1, takes you almost directly to Skoltech and is the best way to get to campus from the city center. If you use the metro app to plan your route, select the stop called \u201cSkolkovo\u201d and it will calculate your route for you. Easy, huh\\! If you live or end up far away from a metro station, you can take the bus, a tramway or a small overground shuttle (aka marshrutka). The Yandex Transport app shows you the nearest stops, when the next bus, tram or shuttle will arrive there and where it can take you. You can also plan your route there.\nSim: 2.02 - \u2192 From there, take an SK1 shuttle and exit at the Technopark stop. The Skoltech dorms will be on your right\\! [Here](https://old.sk.ru/city/transport/p/inner.aspx) you will find the exact map of bus routes around Skolkovo. \nSim: 0.70 - The closest metro stations like Yugo-Zapadnaya, Park Pobedy & Slavyansky Boulevard have bus stops with direct routes to Skolkovo and should get you to the campus within 45 minutes.\nSim: 0.21 - The Skolkovo territory has lots of electric scooter and bike stations where you can rent one from March to November (watch out for puddles\\!). For instance, there is a bike/scooter stop right outside of the MCD Skolkovo station so you can start your day with a breeze.",
    "generated_answer": "MCD Skolkovo station.",
    "logprobs": [
      [
        {
          "prob": 0.6203688228379035,
          "token": "M"
        },
        {
          "prob": 0.20140427500883534,
          "token": "The"
        },
        {
          "prob": 0.17773864886259322,
          "token": "Sk"
        },
        {
          "prob": 0.0004405699577058147,
          "token": "S"
        },
        {
          "prob": 1.9357302218466572e-05,
          "token": "You"
        }
      ],
      [
        {
          "prob": 0.9999970197767496,
          "token": "CD"
        },
        {
          "prob": 1.5534957233607605e-06,
          "token": "PC"
        },
        {
          "prob": 7.338194195418315e-07,
          "token": "cd"
        },
        {
          "prob": 2.1024278372789506e-07,
          "token": "DC"
        },
        {
          "prob": 6.412036513287933e-08,
          "token": "CDATA"
        }
      ],
      [
        {
          "prob": 0.9999998807907247,
          "token": " Sk"
        },
        {
          "prob": 3.6534822137210456e-08,
          "token": "Sk"
        },
        {
          "prob": 1.522997974471263e-08,
          "token": "-"
        },
        {
          "prob": 1.3440409951135022e-08,
          "token": "-S"
        },
        {
          "prob": 5.905303998944039e-10,
          "token": " SK"
        }
      ],
      [
        {
          "prob": 0.9999101242729004,
          "token": "olk"
        },
        {
          "prob": 8.481063202385453e-05,
          "token": "ol"
        },
        {
          "prob": 1.2097586931583238e-06,
          "token": "\u043e\u043b\u044c"
        },
        {
          "prob": 9.42161017559142e-07,
          "token": "olt"
        },
        {
          "prob": 5.043024521536118e-07,
          "token": "lok"
        }
      ],
      [
        {
          "prob": 0.9999399221272516,
          "token": "ovo"
        },
        {
          "prob": 5.829116140629651e-05,
          "token": "\u043e\u0432\u043e"
        },
        {
          "prob": 1.3708767196048878e-06,
          "token": "owo"
        },
        {
          "prob": 8.76373002398104e-08,
          "token": "avo"
        },
        {
          "prob": 8.76373002398104e-08,
          "token": "ogo"
        }
      ],
      [
        {
          "prob": 0.9808803015603611,
          "token": " station"
        },
        {
          "prob": 0.008486278174384581,
          "token": "."
        },
        {
          "prob": 0.0035376070593276018,
          "token": " ("
        },
        {
          "prob": 0.0027550911480032658,
          "token": ""
        },
        {
          "prob": 0.0027550911480032658,
          "token": "\u7ad9"
        }
      ],
      [
        {
          "prob": 0.991410056585321,
          "token": "."
        },
        {
          "prob": 0.008577378589481483,
          "token": ""
        },
        {
          "prob": 5.375672164728217e-06,
          "token": "\u3002"
        },
        {
          "prob": 2.3854400629758822e-06,
          "token": " can"
        },
        {
          "prob": 1.1268020993182265e-06,
          "token": " ("
        }
      ],
      [
        {
          "prob": 0.9999974966112362,
          "token": ""
        },
        {
          "prob": 5.368737561613567e-07,
          "token": ""
        },
        {
          "prob": 1.9750481739625307e-07,
          "token": "<tool_call>"
        },
        {
          "prob": 1.4307214629695401e-08,
          "token": "clus\u00e3o"
        },
        {
          "prob": 9.833195224350998e-09,
          "token": "eker"
        }
      ]
    ],
    "language_consistency_score": 0.3864459777663371
  },
  {
    "question": "Which public transportation line can be used to get to the Skolkovo Train station?\n",
    "true_answer": "The MCD-1 (Moscow Central Diameter #1) metro line can be used to get to the Skolkovo Train station. \n",
    "source_doc": "\n### Text After Video 3\n\n**Topic 1  \u201c Location & Transportation  \u2014 Premises Location, Public Transport & Carsharing, Personal Cars & Parking\u201d**\n\nBy now you\u2019ve probably heard that our campus and its premises are pretty cool. In fact, you may have visited it during an Open Doors event or perhaps a conference or a summer school. ![][image7]The campus is located within the Skolkovo Innovation Center territory a few minutes away from the center of Moscow. The campus is part of the Skolkovo Innovation Center, which is a closed territory. This means you may need a car pass if you decide to drive here. So, you can reach the campus in multiple ways. **First, you can use public transportation.** \n\nThis is the safest and surest way to reach the campus if you need to be there by a certain time (or just want your arrival time to be predictable). No matter where you are traveling from, you can use Moscow\u2019s MCD-1(Moscow Central Diameter \\#1) metro line to get to the Skolkovo Train station. It\u2019s about a 20 minute ride from the city center. You\u2019ll need to exit the train at the \u201cMCD Skolkovo\u201d (\u0421\u043a\u043e\u043b\u043a\u043e\u0432\u043e) station. Once you arrive, take the stairs, escalator or an elevator to the second floor and walk down the looooong hall of the Orbion building. Then, once again, go down to the 1st floor and exit. Once you exit the building, you can take the Sk1 bus shuttle from the nearest bus stop (look to your left). Or, you can take a walk towards the Amaltea business center, walk down the stairs, cross the road and catch any shuttle bus that goes towards Skoltech (the wooden building that looks like a crown, you\u2019ll know it when you see it). This way will take about 10 minutes if you are a fast walker. Remember that the shuttle buses at Skolkovo have paid fares (same as within the Moscow public transportation system, we\u2019ll talk about that in the next modules) and can be tracked via [Yandex maps](https://yandex.ru/maps/213/moscow/?ll=37.622504%2C55.753215\\&z=10) \n\n[(links to an external site)](https://yandex.ru/maps/213/moscow/?ll=37.622504%2C55.753215\\&z=10)\n\nBy the way, the Skolkovo Innovation Center website also has some tips on how to reach other buildings on the territory. Visit [https://sk.ru/transport/](https://sk.ru/transport/) \n\n[(links to an external site)](https://sk.ru/transport/)\n\nfor more information. ![][image8]\n\n \n\nThe next best thing is to take a taxi\n\nCurrently, only taxi services [Yandex (links to an external site)](https://taxi.yandex.ru/ru\\_ru/) , [Citi Mobil](https://city-mobil.ru/) \n\n[(links to an external site)](https://city-mobil.ru/) , and [Uber  (links to an external site)](https://support-uber.com/) have automatic access to the Skolkovo Innovation Center. All you need to do is download a relevant app to your smartphone, order a taxi to Skoltech (just type \u201c\u0421\u043a\u043e\u043b\u0442\u0435\u0445\u201d in the destination, it will be there) and relax. Don\u2019t forget to buckle up\\! If you take a different taxi service, you\u2019ll need to order a territory pass ahead of time. To order a pass for your taxi, email security.campus@skoltech.ru from your Skoltech email address with your taxi\u2019s model and license number (i.e. Toyota, \u0425111\u0421\u041a197).",
    "context": "Sim: 6.51 - This is the safest and surest way to reach the campus if you need to be there by a certain time (or just want your arrival time to be predictable). No matter where you are traveling from, you can use Moscow\u2019s MCD-1(Moscow Central Diameter \\#1) metro line to get to the Skolkovo Train station. It\u2019s about a 20 minute ride from the city center. You\u2019ll need to exit the train at the \u201cMCD Skolkovo\u201d (\u0421\u043a\u043e\u043b\u043a\u043e\u0432\u043e) station.\nSim: 2.37 - The buses, metro, trains and other city-sponsored modes of transfer are integrated by one system. You can buy yourself single- or double-ride tickets or get a permanent Troika card and top off its balance every once in a while. If you\u2019re planning to explore the city center, we recommend using the underground metro. Yandex Metro app (links to an external site)has the current map and allows you to plan your route to point A to point B. The metro is designed in a sun-like way, with multi-colored lines stemming away from the center outwards. There are also several circle lines which connect them. You will notice on the map (and have already seen it mentioned in this course) the MCD lines. These are newer extensions of the metro line that take you a little bit outside of the city for a few extra rubles. One of these lines, MCD 1, takes you almost directly to Skoltech and is the best way to get to campus from the city center. If you use the metro app to plan your route, select the stop called \u201cSkolkovo\u201d and it will calculate your route for you. Easy, huh\\! If you live or end up far away from a metro station, you can take the bus, a tramway or a small overground shuttle (aka marshrutka). The Yandex Transport app shows you the nearest stops, when the next bus, tram or shuttle will arrive there and where it can take you. You can also plan your route there.\nSim: 1.28 - \u2192 From there, take an SK1 shuttle and exit at the Technopark stop. The Skoltech dorms will be on your right\\! [Here](https://old.sk.ru/city/transport/p/inner.aspx) you will find the exact map of bus routes around Skolkovo. \nSim: 0.43 - The closest metro stations like Yugo-Zapadnaya, Park Pobedy & Slavyansky Boulevard have bus stops with direct routes to Skolkovo and should get you to the campus within 45 minutes.",
    "generated_answer": "The MCD-1 metro line can be used to get to the Skolkovo Train station.",
    "logprobs": [
      [
        {
          "prob": 0.6617013162270879,
          "token": "The"
        },
        {
          "prob": 0.27583815532696876,
          "token": "Use"
        },
        {
          "prob": 0.061547811773154,
          "token": "You"
        },
        {
          "prob": 0.0007747726093110164,
          "token": "M"
        },
        {
          "prob": 4.370967961059589e-05,
          "token": "use"
        }
      ],
      [
        {
          "prob": 0.999874250008407,
          "token": " M"
        },
        {
          "prob": 0.00012339426962008568,
          "token": " Moscow"
        },
        {
          "prob": 1.9944826092149355e-06,
          "token": " Sk"
        },
        {
          "prob": 1.4447983562056984e-07,
          "token": " Mos"
        },
        {
          "prob": 8.763145001411706e-08,
          "token": " safest"
        }
      ],
      [
        {
          "prob": 0.9999997615814777,
          "token": "CD"
        },
        {
          "prob": 7.734421907141565e-08,
          "token": "CDATA"
        },
        {
          "prob": 6.023573837886479e-08,
          "token": "DC"
        },
        {
          "prob": 3.2241867372567335e-08,
          "token": "CV"
        },
        {
          "prob": 1.522997974471263e-08,
          "token": " CD"
        }
      ],
      [
        {
          "prob": 0.9998249122210231,
          "token": "-"
        },
        {
          "prob": 0.00015843352138402063,
          "token": " Sk"
        },
        {
          "prob": 8.9382076444756e-06,
          "token": " "
        },
        {
          "prob": 6.961083112772414e-06,
          "token": " ("
        },
        {
          "prob": 6.474815900875015e-07,
          "token": "-S"
        }
      ],
      [
        {
          "prob": 1.0,
          "token": "1"
        },
        {
          "prob": 1.0815941557285693e-11,
          "token": "\uff11"
        },
        {
          "prob": 1.463778514125909e-12,
          "token": "2"
        },
        {
          "prob": 1.5428112031918877e-13,
          "token": "0"
        },
        {
          "prob": 7.287724095819692e-14,
          "token": "\u2081"
        }
      ],
      [
        {
          "prob": 0.9976761824645884,
          "token": " metro"
        },
        {
          "prob": 0.0016996609508372537,
          "token": " ("
        },
        {
          "prob": 0.0005517991213619532,
          "token": " Moscow"
        },
        {
          "prob": 2.7472447480687908e-05,
          "token": "\u5730\u94c1"
        },
        {
          "prob": 2.424434980812505e-05,
          "token": "(M"
        }
      ],
      [
        {
          "prob": 0.9999997615814777,
          "token": " line"
        },
        {
          "prob": 1.8553913626159784e-07,
          "token": "\u7ebf"
        },
        {
          "prob": 2.215948977336598e-08,
          "token": "line"
        },
        {
          "prob": 1.3440409951135022e-08,
          "token": ".line"
        },
        {
          "prob": 1.0467401794744658e-08,
          "token": "(line"
        }
      ],
      [
        {
          "prob": 0.9999356311290551,
          "token": " can"
        },
        {
          "prob": 5.829093904358661e-05,
          "token": "\u53ef\u4ee5"
        },
        {
          "prob": 2.9021349673900363e-06,
          "token": " ("
        },
        {
          "prob": 2.9021349673900363e-06,
          "token": ","
        },
        {
          "prob": 1.4448879203421632e-07,
          "token": "can"
        }
      ],
      [
        {
          "prob": 1.0,
          "token": " be"
        },
        {
          "prob": 4.058652126475693e-10,
          "token": "be"
        },
        {
          "prob": 1.493094676197164e-10,
          "token": " \u0431\u044b\u0442\u044c"
        },
        {
          "prob": 2.5946094982764667e-11,
          "token": "\tbe"
        },
        {
          "prob": 2.289734845645553e-11,
          "token": " been"
        }
      ],
      [
        {
          "prob": 0.9999998807907247,
          "token": " used"
        },
        {
          "prob": 1.4449802461092448e-07,
          "token": "used"
        },
        {
          "prob": 1.522997974471263e-08,
          "token": "\u7528\u4e8e"
        },
        {
          "prob": 1.6052280551856116e-09,
          "token": "_used"
        },
        {
          "prob": 5.905303998944039e-10,
          "token": " Used"
        }
      ],
      [
        {
          "prob": 1.0,
          "token": " to"
        },
        {
          "prob": 1.3887943864964021e-11,
          "token": " for"
        },
        {
          "prob": 1.2256067444099483e-11,
          "token": "to"
        },
        {
          "prob": 3.97896253583724e-12,
          "token": "\tto"
        },
        {
          "prob": 8.878265478459658e-13,
          "token": "_to"
        }
      ],
      [
        {
          "prob": 0.9999955892755635,
          "token": " get"
        },
        {
          "prob": 4.222831140981511e-06,
          "token": " reach"
        },
        {
          "prob": 1.6373693229868488e-07,
          "token": "get"
        },
        {
          "prob": 4.691146126497983e-08,
          "token": ".get"
        },
        {
          "prob": 3.6534682768190175e-08,
          "token": " gets"
        }
      ],
      [
        {
          "prob": 1.0,
          "token": " to"
        },
        {
          "prob": 5.4927883509546835e-11,
          "token": "to"
        },
        {
          "prob": 2.289734845645553e-11,
          "token": "\u5230"
        },
        {
          "prob": 7.433680672352188e-12,
          "token": "\tto"
        },
        {
          "prob": 5.789356328730652e-12,
          "token": "_to"
        }
      ],
      [
        {
          "prob": 1.0,
          "token": " the"
        },
        {
          "prob": 1.783247290814639e-11,
          "token": " Sk"
        },
        {
          "prob": 1.2256067444099483e-11,
          "token": "the"
        },
        {
          "prob": 1.449336997733435e-13,
          "token": "\tthe"
        },
        {
          "prob": 1.3615261080896538e-13,
          "token": " a"
        }
      ],
      [
        {
          "prob": 0.9999998807907247,
          "token": " Sk"
        },
        {
          "prob": 1.1253517471925912e-07,
          "token": "Sk"
        },
        {
          "prob": 3.581747930283181e-10,
          "token": "_sk"
        },
        {
          "prob": 7.05287985111216e-11,
          "token": " SK"
        },
        {
          "prob": 7.05287985111216e-11,
          "token": " Sc"
        }
      ],
      [
        {
          "prob": 0.9986633072685569,
          "token": "olk"
        },
        {
          "prob": 0.0013250070110111779,
          "token": "ol"
        },
        {
          "prob": 4.778719162203895e-06,
          "token": "olg"
        },
        {
          "prob": 1.7579925349068317e-06,
          "token": "olt"
        },
        {
          "prob": 6.075459631631551e-07,
          "token": "ok"
        }
      ],
      [
        {
          "prob": 0.9999752050825816,
          "token": "ovo"
        },
        {
          "prob": 2.4300228714755076e-05,
          "token": "\u043e\u0432\u043e"
        },
        {
          "prob": 2.3823105961103081e-07,
          "token": "avo"
        },
        {
          "prob": 8.764030907938658e-08,
          "token": "ov"
        },
        {
          "prob": 5.315653448333944e-08,
          "token": "owo"
        }
      ],
      [
        {
          "prob": 0.9999740130508765,
          "token": " Train"
        },
        {
          "prob": 1.892501910355223e-05,
          "token": "Train"
        },
        {
          "prob": 6.962125451973665e-06,
          "token": "_train"
        },
        {
          "prob": 1.637334969971692e-07,
          "token": " train"
        },
        {
          "prob": 2.9988807450328848e-09,
          "token": " Training"
        }
      ],
      [
        {
          "prob": 0.9999985694905718,
          "token": " station"
        },
        {
          "prob": 1.0677029917933763e-06,
          "token": "\u7ad9"
        },
        {
          "prob": 2.3823673954981372e-07,
          "token": "_station"
        },
        {
          "prob": 7.734407154916583e-08,
          "token": ".station"
        },
        {
          "prob": 4.691155074157667e-08,
          "token": " ("
        }
      ],
      [
        {
          "prob": 0.9999996423722521,
          "token": "."
        },
        {
          "prob": 1.8553913626159784e-07,
          "token": ","
        },
        {
          "prob": 4.691164021834418e-08,
          "token": " from"
        },
        {
          "prob": 2.510999155743982e-08,
          "token": ".\n\n"
        },
        {
          "prob": 1.4307241918567688e-08,
          "token": " ("
        }
      ],
      [
        {
          "prob": 0.9999980926550052,
          "token": ""
        },
        {
          "prob": 3.2563070405243817e-07,
          "token": ""
        },
        {
          "prob": 1.8553878237411744e-07,
          "token": "<tool_call>"
        },
        {
          "prob": 2.672939589404358e-08,
          "token": "pecific"
        },
        {
          "prob": 1.621219812533441e-08,
          "token": " Specifically"
        }
      ]
    ],
    "language_consistency_score": 0.5754178634762419
  },
  {
    "question": "What is the name of the train station you should get off at to reach Skoltech from Moscow's MCD-1 metro line?\n",
    "true_answer": "MCD Skolkovo (\u0421\u043a\u043e\u043b\u043a\u043e\u0432\u043e) station \n",
    "source_doc": "\n### Text After Video 3\n\n**Topic 1  \u201c Location & Transportation  \u2014 Premises Location, Public Transport & Carsharing, Personal Cars & Parking\u201d**\n\nBy now you\u2019ve probably heard that our campus and its premises are pretty cool. In fact, you may have visited it during an Open Doors event or perhaps a conference or a summer school. ![][image7]The campus is located within the Skolkovo Innovation Center territory a few minutes away from the center of Moscow. The campus is part of the Skolkovo Innovation Center, which is a closed territory. This means you may need a car pass if you decide to drive here. So, you can reach the campus in multiple ways. **First, you can use public transportation.** \n\nThis is the safest and surest way to reach the campus if you need to be there by a certain time (or just want your arrival time to be predictable). No matter where you are traveling from, you can use Moscow\u2019s MCD-1(Moscow Central Diameter \\#1) metro line to get to the Skolkovo Train station. It\u2019s about a 20 minute ride from the city center. You\u2019ll need to exit the train at the \u201cMCD Skolkovo\u201d (\u0421\u043a\u043e\u043b\u043a\u043e\u0432\u043e) station. Once you arrive, take the stairs, escalator or an elevator to the second floor and walk down the looooong hall of the Orbion building. Then, once again, go down to the 1st floor and exit. Once you exit the building, you can take the Sk1 bus shuttle from the nearest bus stop (look to your left). Or, you can take a walk towards the Amaltea business center, walk down the stairs, cross the road and catch any shuttle bus that goes towards Skoltech (the wooden building that looks like a crown, you\u2019ll know it when you see it). This way will take about 10 minutes if you are a fast walker. Remember that the shuttle buses at Skolkovo have paid fares (same as within the Moscow public transportation system, we\u2019ll talk about that in the next modules) and can be tracked via [Yandex maps](https://yandex.ru/maps/213/moscow/?ll=37.622504%2C55.753215\\&z=10) \n\n[(links to an external site)](https://yandex.ru/maps/213/moscow/?ll=37.622504%2C55.753215\\&z=10)\n\nBy the way, the Skolkovo Innovation Center website also has some tips on how to reach other buildings on the territory. Visit [https://sk.ru/transport/](https://sk.ru/transport/) \n\n[(links to an external site)](https://sk.ru/transport/)\n\nfor more information. ![][image8]\n\n \n\nThe next best thing is to take a taxi\n\nCurrently, only taxi services [Yandex (links to an external site)](https://taxi.yandex.ru/ru\\_ru/) , [Citi Mobil](https://city-mobil.ru/) \n\n[(links to an external site)](https://city-mobil.ru/) , and [Uber  (links to an external site)](https://support-uber.com/) have automatic access to the Skolkovo Innovation Center. All you need to do is download a relevant app to your smartphone, order a taxi to Skoltech (just type \u201c\u0421\u043a\u043e\u043b\u0442\u0435\u0445\u201d in the destination, it will be there) and relax. Don\u2019t forget to buckle up\\! If you take a different taxi service, you\u2019ll need to order a territory pass ahead of time. To order a pass for your taxi, email security.campus@skoltech.ru from your Skoltech email address with your taxi\u2019s model and license number (i.e. Toyota, \u0425111\u0421\u041a197).",
    "context": "Sim: 5.50 - This is the safest and surest way to reach the campus if you need to be there by a certain time (or just want your arrival time to be predictable). No matter where you are traveling from, you can use Moscow\u2019s MCD-1(Moscow Central Diameter \\#1) metro line to get to the Skolkovo Train station. It\u2019s about a 20 minute ride from the city center. You\u2019ll need to exit the train at the \u201cMCD Skolkovo\u201d (\u0421\u043a\u043e\u043b\u043a\u043e\u0432\u043e) station.\nSim: 3.21 - The buses, metro, trains and other city-sponsored modes of transfer are integrated by one system. You can buy yourself single- or double-ride tickets or get a permanent Troika card and top off its balance every once in a while. If you\u2019re planning to explore the city center, we recommend using the underground metro. Yandex Metro app (links to an external site)has the current map and allows you to plan your route to point A to point B. The metro is designed in a sun-like way, with multi-colored lines stemming away from the center outwards. There are also several circle lines which connect them. You will notice on the map (and have already seen it mentioned in this course) the MCD lines. These are newer extensions of the metro line that take you a little bit outside of the city for a few extra rubles. One of these lines, MCD 1, takes you almost directly to Skoltech and is the best way to get to campus from the city center. If you use the metro app to plan your route, select the stop called \u201cSkolkovo\u201d and it will calculate your route for you. Easy, huh\\! If you live or end up far away from a metro station, you can take the bus, a tramway or a small overground shuttle (aka marshrutka). The Yandex Transport app shows you the nearest stops, when the next bus, tram or shuttle will arrive there and where it can take you. You can also plan your route there.\nSim: 2.39 - \u2192 From there, take an SK1 shuttle and exit at the Technopark stop. The Skoltech dorms will be on your right\\! [Here](https://old.sk.ru/city/transport/p/inner.aspx) you will find the exact map of bus routes around Skolkovo. \nSim: 2.32 - \u2192 If you\u2019re traveling to the Skoltech Dormitories, you\u2019ll need to go to the Slavyansky Bulvar metro station which will be located on the dark blue metro line. ",
    "generated_answer": "MCD Skolkovo station.",
    "logprobs": [
      [
        {
          "prob": 0.8510779344499895,
          "token": "M"
        },
        {
          "prob": 0.14789517326065368,
          "token": "You"
        },
        {
          "prob": 0.0009965098388508467,
          "token": "The"
        },
        {
          "prob": 1.4214442656011573e-05,
          "token": "\"M"
        },
        {
          "prob": 1.1070219071425392e-05,
          "token": "Get"
        }
      ],
      [
        {
          "prob": 0.9999990463265931,
          "token": "CD"
        },
        {
          "prob": 3.9278597995802437e-07,
          "token": "PC"
        },
        {
          "prob": 2.1024318473456359e-07,
          "token": "cd"
        },
        {
          "prob": 1.1253517471925912e-07,
          "token": "DC"
        },
        {
          "prob": 4.139937718785167e-08,
          "token": "CDATA"
        }
      ],
      [
        {
          "prob": 1.0,
          "token": " Sk"
        },
        {
          "prob": 1.9555681087850496e-08,
          "token": "Sk"
        },
        {
          "prob": 2.4616969518153846e-10,
          "token": "-S"
        },
        {
          "prob": 1.493094676197164e-10,
          "token": "_sk"
        },
        {
          "prob": 1.162823303022097e-10,
          "token": " SK"
        }
      ],
      [
        {
          "prob": 0.9998355182423089,
          "token": "olk"
        },
        {
          "prob": 0.0001584353345221579,
          "token": "ol"
        },
        {
          "prob": 1.3707342236901665e-06,
          "token": "olg"
        },
        {
          "prob": 1.3707342236901665e-06,
          "token": "\u043e\u043b\u044c"
        },
        {
          "prob": 8.31392332985481e-07,
          "token": "olt"
        }
      ],
      [
        {
          "prob": 0.9999876023871354,
          "token": "ovo"
        },
        {
          "prob": 1.1478757578876643e-05,
          "token": "\u043e\u0432\u043e"
        },
        {
          "prob": 8.315184100688966e-07,
          "token": "owo"
        },
        {
          "prob": 4.691110336029911e-08,
          "token": "avo"
        },
        {
          "prob": 3.6534404031744556e-08,
          "token": "ervo"
        }
      ],
      [
        {
          "prob": 0.9474505750169936,
          "token": " station"
        },
        {
          "prob": 0.017353165312048887,
          "token": " ("
        },
        {
          "prob": 0.015314114637921587,
          "token": ""
        },
        {
          "prob": 0.013514658733791214,
          "token": "."
        },
        {
          "prob": 0.0034170408516908573,
          "token": "\u7ad9"
        }
      ],
      [
        {
          "prob": 0.9982969013402139,
          "token": "."
        },
        {
          "prob": 0.0017007181212681912,
          "token": ""
        },
        {
          "prob": 1.285703889059114e-06,
          "token": "\u3002"
        },
        {
          "prob": 3.4604250728717226e-07,
          "token": " ("
        },
        {
          "prob": 5.648983256001893e-08,
          "token": "\uff0e"
        }
      ],
      [
        {
          "prob": 0.9999969005680498,
          "token": ""
        },
        {
          "prob": 5.714991385721822e-07,
          "token": ""
        },
        {
          "prob": 2.382362851497276e-07,
          "token": "<tool_call>"
        },
        {
          "prob": 2.8453239549131867e-08,
          "token": "eker"
        },
        {
          "prob": 1.621216720304997e-08,
          "token": "\ud83e\udd16"
        }
      ]
    ],
    "language_consistency_score": 0.3073955163082088
  },
  {
    "question": "What is the name of the carsharing service that has parking options around the Skolkovo territory?\n",
    "true_answer": "BelkaCar and DeliMobil are carsharing services that have parking options around the Skolkovo territory. \n",
    "source_doc": "your car\u2019s model and license number (i.e. Toyota, \u0425111\u0421\u041a197)   \n2. How long you need the pass for (1 day or the whole month). If you ask for a monthly pass, you\u2019ll need to *renew it every month* via email. Next, you\u2019ll need to find a parking spot because you can park only in designated parking lots. Wait, let us stress that again: if you park your car anywhere *besides* a parking lot, it will be towed and your access to the Skolkovo Innovation Center territory will be restricted\u2026 *forever*\\! A current list of all Skolkovo parking lots is published on [sta-parking.ru (links to an external site).](https://www.sta-parking.ru/) (RUS). ![][image9]\n\n \n\nIn terms of parking prices, parking is free for 2 hours and then 50 RUB per hour. Spaces are pretty limited, though. To secure a spot and entry in the long-term, you can email Clients@sta-parking.ru. Monthly parking plans start at 5000 RUB/month. Finally, you can also park outside of the Skolkovo territory. You can try the [Tri Kita Mall parking lot (links to an external site)](https://yandex.ru/maps/org/tri\\_kita/1112120378/?indoorLevel=1\\&ll=37.355723%2C55.702835\\&z=17.03) or near the [\u201cInnovatsya\u201d apartments (links to an external site)](https://yandex.ru/maps/213/moscow/?indoorLevel=1\\&ll=37.355723%2C55.702835\\&mode=poi\\&poi%5Bpoint%5D=37.357476%2C55.700718\\&poi%5Buri%5D=ymapsbm1%3A%2F%2Forg%3Foid%3D191529528774\\&z=17.03), but spaces there are not guaranteed. **Carsharing is another option.** \n\nA great option for transportation without the upkeep fees, are we right? Carsharing services [BelkaCar (links to an external site)](https://belkacar.ru/) and [DeliMobil (links to an external site)](https://delimobil.ru/) have access to the Skolkovo territory with some parking options around the territory. If you choose to use a different car sharing service, you may need to search for a different parking option outside of the Skolkovo Innovation Center Territory (for example, there is an \u201cexternal\u201d parking lot just behind the Skoltech campus that\u2019s not part of the Skolkovo infrastructure). In that case, we suggest looking for an \u201cend destination\u201d spot ahead of time. *Phew, we\u2019re almost there:)*\n\nAre you up for a scooter or a bike ride? The Skolkovo territory has lots of electric scooter and bike stations where you can rent one from March to November (watch out for puddles\\!). For instance, there is a bike/scooter stop right outside of the MCD Skolkovo station so you can start your day with a breeze. To rent one of these sweet rides, scan a QR code on the vehicle and follow the instructions. [*Virtual campus tour (links to an external site).*](https://360.skoltech.ru/)\n\n[*This brochure that shows how Skoltech navigation works (links to an external site).*](https://box.skoltech.ru/index.php/s/Od9t3Fm1ONOCuY5\\#pdfviewer) \n\n*You can also save [this handout (links to an external site)](https://box.skoltech.ru/index.php/s/mjp6yaRe3tgF2x2) with a map to your smartphone and glance at them as you explore the campus:*\n\n *![][image4]*\n\n[Full equipment catalog on FabLab\u2019s website (links to an external site).](https://fablab.skoltech.ru/en)\n\n[Video tour (links to an external site).](https://box.skoltech.ru/index.php/s/xwVtNw081ffzffQ)\n\n[Skoltech\u2019s virtual tour (links to an external site).](https://360.skoltech.ru/)\n\nFor more information about campus rules, see [this official document (links to an external site).](https://drive.google.com/file/d/1UeumlluoILU0lGHeXphZKpHAOtq9KhC9/view?usp=sharing)\n\nHighlights: \n\n* There are enough ways to get around Skoltech using the developed transport system. Choose a favourite bus route or just rent a bicycle \u2014 the choice is yours\\!",
    "context": "Sim: 7.71 - Carsharing services [BelkaCar (links to an external site)](https://belkacar.ru/) and [DeliMobil (links to an external site)](https://delimobil.ru/) have access to the Skolkovo territory with some parking options around the territory.\nSim: 1.26 - If you choose to use a different car sharing service, you may need to search for a different parking option outside of the Skolkovo Innovation Center Territory (for example, there is an \u201cexternal\u201d parking lot just behind the Skoltech campus that\u2019s not part of the Skolkovo infrastructure). In that case, we suggest looking for an \u201cend destination\u201d spot ahead of time. *Phew, we\u2019re almost there:)*\nSim: 0.65 - Oh, almost forgot\\! When it gets warmer, you can rent electric scooters and bikes all around the city (and even in the Skolkovo Territory). If you see a little parking lot with scooters or bikes, look for a QR code to download its app and reserve yourself a machine. The system will tell you how long you have rented it for, its charge (if it\u2019s electric) and the nearest parking location. Just watch out for those puddles\\!",
    "generated_answer": "BelkaCar and DeliMobil have access to the Skolkovo territory with some parking options around the territory.",
    "logprobs": [
      [
        {
          "prob": 0.9999440939703319,
          "token": "Bel"
        },
        {
          "prob": 3.120112934700109e-05,
          "token": "The"
        },
        {
          "prob": 1.892444156661578e-05,
          "token": "Car"
        },
        {
          "prob": 2.902157109007149e-06,
          "token": " Bel"
        },
        {
          "prob": 1.3708819490945362e-06,
          "token": "bel"
        }
      ],
      [
        {
          "prob": 0.9999965429424904,
          "token": "ka"
        },
        {
          "prob": 1.3709538566001813e-06,
          "token": "\u043a\u0430"
        },
        {
          "prob": 7.338187197174319e-07,
          "token": "ca"
        },
        {
          "prob": 6.475927472092271e-07,
          "token": "k"
        },
        {
          "prob": 2.102425832248476e-07,
          "token": "kar"
        }
      ],
      [
        {
          "prob": 0.9999995231630692,
          "token": "Car"
        },
        {
          "prob": 4.450852500419419e-07,
          "token": " Car"
        },
        {
          "prob": 6.34880011604368e-09,
          "token": "_car"
        },
        {
          "prob": 4.363462252943702e-09,
          "token": "CAR"
        },
        {
          "prob": 3.398267819495071e-09,
          "token": "-car"
        }
      ],
      [
        {
          "prob": 0.8870223876849959,
          "token": " and"
        },
        {
          "prob": 0.07281123798232199,
          "token": " has"
        },
        {
          "prob": 0.03897304725465383,
          "token": "."
        },
        {
          "prob": 0.0009165582205691822,
          "token": ""
        },
        {
          "prob": 0.00020451168502216754,
          "token": "\u548c"
        }
      ],
      [
        {
          "prob": 0.9999876023871354,
          "token": " Del"
        },
        {
          "prob": 1.1478757578876643e-05,
          "token": "Del"
        },
        {
          "prob": 3.466284438211824e-07,
          "token": " DEL"
        },
        {
          "prob": 3.058985280199119e-07,
          "token": "_del"
        },
        {
          "prob": 9.931080659307211e-08,
          "token": "_DEL"
        }
      ],
      [
        {
          "prob": 0.9045244869571529,
          "token": "i"
        },
        {
          "prob": 0.09533618449467145,
          "token": "im"
        },
        {
          "prob": 6.77053327002911e-05,
          "token": "IM"
        },
        {
          "prob": 1.3331970482271619e-05,
          "token": "iT"
        },
        {
          "prob": 1.0382949051477991e-05,
          "token": "imi"
        }
      ],
      [
        {
          "prob": 1.0,
          "token": "M"
        },
        {
          "prob": 3.581747930283181e-10,
          "token": "Mob"
        },
        {
          "prob": 1.917171513758312e-10,
          "token": " Mobil"
        },
        {
          "prob": 4.277787868968998e-11,
          "token": "-M"
        },
        {
          "prob": 3.331544542166412e-11,
          "token": "\u041c"
        }
      ],
      [
        {
          "prob": 0.9999994039539004,
          "token": "obil"
        },
        {
          "prob": 1.4449788680693535e-07,
          "token": "ibil"
        },
        {
          "prob": 1.275189375371399e-07,
          "token": "obl"
        },
        {
          "prob": 1.275189375371399e-07,
          "token": " mobil"
        },
        {
          "prob": 4.691164021834418e-08,
          "token": "oble"
        }
      ],
      [
        {
          "prob": 0.6940637529488727,
          "token": " have"
        },
        {
          "prob": 0.2893288178399123,
          "token": "."
        },
        {
          "prob": 0.016322814949719478,
          "token": " are"
        },
        {
          "prob": 0.0001600232469806052,
          "token": " both"
        },
        {
          "prob": 5.1951941966948064e-05,
          "token": ""
        }
      ],
      [
        {
          "prob": 0.8807916788160935,
          "token": " access"
        },
        {
          "prob": 0.11920220198253449,
          "token": " parking"
        },
        {
          "prob": 3.2824053972703912e-06,
          "token": "\u505c\u8f66"
        },
        {
          "prob": 1.0656410110941966e-06,
          "token": "access"
        },
        {
          "prob": 6.463439454758009e-07,
          "token": " park"
        }
      ],
      [
        {
          "prob": 1.0,
          "token": " to"
        },
        {
          "prob": 4.139937718785167e-08,
          "token": " with"
        },
        {
          "prob": 1.6918979226151304e-10,
          "token": " parking"
        },
        {
          "prob": 9.056076989672867e-11,
          "token": " and"
        },
        {
          "prob": 7.05287985111216e-11,
          "token": " for"
        }
      ],
      [
        {
          "prob": 0.9889724829859989,
          "token": " the"
        },
        {
          "prob": 0.010986491040655057,
          "token": " parking"
        },
        {
          "prob": 3.9623492475342675e-05,
          "token": " Sk"
        },
        {
          "prob": 7.257295796888524e-07,
          "token": "\u505c\u8f66"
        },
        {
          "prob": 3.884550515427415e-07,
          "token": " park"
        }
      ],
      [
        {
          "prob": 0.9999992847447459,
          "token": " Sk"
        },
        {
          "prob": 7.33820819192633e-07,
          "token": "Sk"
        },
        {
          "prob": 7.194133030325383e-09,
          "token": "_sk"
        },
        {
          "prob": 2.172439935079017e-10,
          "token": " parking"
        },
        {
          "prob": 4.8473687062702556e-11,
          "token": " Ski"
        }
      ],
      [
        {
          "prob": 0.9999829533624089,
          "token": "olk"
        },
        {
          "prob": 1.473894620233487e-05,
          "token": "ol"
        },
        {
          "prob": 1.209846378736376e-06,
          "token": "olg"
        },
        {
          "prob": 2.1023977620226084e-07,
          "token": "olt"
        },
        {
          "prob": 1.9750199208738555e-07,
          "token": "\u043e\u043b\u044c"
        }
      ],
      [
        {
          "prob": 0.9999878408000585,
          "token": "ovo"
        },
        {
          "prob": 1.1478757578876643e-05,
          "token": "\u043e\u0432\u043e"
        },
        {
          "prob": 1.4449623316931648e-07,
          "token": "owo"
        },
        {
          "prob": 9.931080659307211e-08,
          "token": "avo"
        },
        {
          "prob": 9.931080659307211e-08,
          "token": "ov"
        }
      ],
      [
        {
          "prob": 0.9999995231630692,
          "token": " territory"
        },
        {
          "prob": 3.927863545481039e-07,
          "token": "territ"
        },
        {
          "prob": 4.139937718785167e-08,
          "token": " Territory"
        },
        {
          "prob": 1.4166087866431961e-09,
          "token": " territories"
        },
        {
          "prob": 5.211412487888539e-10,
          "token": " area"
        }
      ],
      [
        {
          "prob": 0.9999998807907247,
          "token": " with"
        },
        {
          "prob": 8.764248219443636e-08,
          "token": "."
        },
        {
          "prob": 2.646573638909117e-09,
          "token": " and"
        },
        {
          "prob": 5.211412487888539e-10,
          "token": "with"
        },
        {
          "prob": 2.4616969518153846e-10,
          "token": " v\u1edbi"
        }
      ],
      [
        {
          "prob": 0.9890106106850054,
          "token": " some"
        },
        {
          "prob": 0.010986915388990461,
          "token": " parking"
        },
        {
          "prob": 1.741001171474068e-06,
          "token": "\u4e00\u4e9b"
        },
        {
          "prob": 5.652203259928335e-07,
          "token": "some"
        },
        {
          "prob": 5.257373005190027e-08,
          "token": "\u505c\u8f66"
        }
      ],
      [
        {
          "prob": 0.9999964237340748,
          "token": " parking"
        },
        {
          "prob": 3.2887473357670864e-06,
          "token": "\u505c\u8f66"
        },
        {
          "prob": 2.3823605795000956e-07,
          "token": " parked"
        },
        {
          "prob": 2.2159405241782167e-08,
          "token": " Parking"
        },
        {
          "prob": 1.0467361864851814e-08,
          "token": " park"
        }
      ],
      [
        {
          "prob": 0.9999997615814777,
          "token": " options"
        },
        {
          "prob": 2.382369667501818e-07,
          "token": "options"
        },
        {
          "prob": 1.7257827987960214e-08,
          "token": "(options"
        },
        {
          "prob": 2.061153622438558e-09,
          "token": "\u9009\u9879"
        },
        {
          "prob": 1.8189616875530459e-09,
          "token": "_options"
        }
      ],
      [
        {
          "prob": 0.9999923706636761,
          "token": " around"
        },
        {
          "prob": 6.962251605520992e-06,
          "token": "."
        },
        {
          "prob": 5.714964134584279e-07,
          "token": "around"
        },
        {
          "prob": 1.6373646384423408e-07,
          "token": " nearby"
        },
        {
          "prob": 5.60275369175583e-09,
          "token": " surrounding"
        }
      ],
      [
        {
          "prob": 0.9997964319781567,
          "token": " the"
        },
        {
          "prob": 0.00020342704214340812,
          "token": " it"
        },
        {
          "prob": 1.4446867532824235e-07,
          "token": "."
        },
        {
          "prob": 1.1625860109271712e-10,
          "token": "the"
        },
        {
          "prob": 5.4916674624659555e-11,
          "token": " this"
        }
      ],
      [
        {
          "prob": 0.9989645484686859,
          "token": " territory"
        },
        {
          "prob": 0.0010322275240882135,
          "token": " area"
        },
        {
          "prob": 2.257989617579973e-06,
          "token": "territ"
        },
        {
          "prob": 2.3799035476166975e-07,
          "token": " perimeter"
        },
        {
          "prob": 2.1002575092218258e-07,
          "token": " region"
        }
      ],
      [
        {
          "prob": 1.0,
          "token": "."
        },
        {
          "prob": 5.602796437537268e-09,
          "token": "\u3002"
        },
        {
          "prob": 3.398267819495071e-09,
          "token": ".\n\n"
        },
        {
          "prob": 3.3647407934131505e-10,
          "token": ".)"
        },
        {
          "prob": 2.172439935079017e-10,
          "token": ".\n"
        }
      ],
      [
        {
          "prob": 0.9999985694905718,
          "token": ""
        },
        {
          "prob": 2.8736836176841304e-07,
          "token": ""
        },
        {
          "prob": 2.53601689161434e-07,
          "token": "<tool_call>"
        },
        {
          "prob": 1.18610975280741e-08,
          "token": " b\u1ee5"
        },
        {
          "prob": 7.19411930861867e-09,
          "token": "orado"
        }
      ]
    ],
    "language_consistency_score": 0.5341784309186354
  },
  {
    "question": "How many ECTS credits are needed for the MSc Thesis Project?\n",
    "true_answer": "36 ECTS-credits \n",
    "source_doc": "\n### Text After Video 4\n\n[Learn more about what\u2019s considered academic misconduct (links to an external site)](https://www.skoltech.ru/app/data/uploads/sites/2/2015/04/1.-STUDENT-ACADEMIC-INTEGRITY-REGULATIONS.pdf)  \n[Disciplinary Board Policy (links to an external site).](http://www.skoltech.ru/app/data/uploads/sites/2/2015/04/DISCIPLINARY-BOARD-POLICY.pdf)\n\nSave these links\\! 1) [Course timetable (links to an external site)](https://schedule.skoltech.ru/)  \n2) [Course catalog (links to an external site)](https://www.skoltech.ru/en/education/course-catalog/)  \n3) [Education resources for students (Canvas)](https://skoltech.instructure.com/courses/2072)\n\n![][image12]  \n[View the 2022-2023 academic calendar with key dates, breaks and holidays](https://www.skoltech.ru/en/education/academic-calendar/msc-academic-calendar-2022-2023/)   \n[(links to an external site)](https://www.skoltech.ru/en/education/academic-calendar/msc-academic-calendar-2022-2023/)\n\n[Your updated term schedule can be found on the Skoltech website (links to an external site)](https://schedule.skoltech.ru/)![][image13]\n\n* **STE:** **Science, Technology and Engineering** (36 ECTS-credits)  \n  * Provide a solid foundation of scientific and engineering fundamentals  \n  * Core and recommended electives  \n* **Sector:** **Industrial Immersion** (12 ECTS-credits)  \n  * Orients students to how a sector works, provides knowledge and skills to make an impact in an industrial sector  \n  * Happens in the summer term between Year 1 and Year 2  \n* **Enterpreneurship and Innovation: Entrepreneurship and Innovation** (12 ECTS-credits)  \n  * Orients students in the process of, provide the skills for, and experience with innovation  \n  * Includes Innovation Workshop  \n* **MSc Thesis Project** (36 ECTS-credits)  \n* Early research, Thesis Project, Defense\n\n* **Options: elective coursework and short-term projects** (24 ECTS-credits)  \n* Follow your dreams and passions, choose courses to diversify your experience  \n* Additionally you can take 20 credits as an extracurricular activity. **ECTS credits** are based on the workload students need in order to achieve the learning outcomes. 1 ECTS equals 27 astronomical hours (36 academic hours). [The courses offered in 2022-2023 (links to an external site)](https://www.skoltech.ru/en/education/course-catalog/)\n\nIf you need to communicate any concerns or issues informally or outside of the formal evaluation period (or if you are unable to solve an issue directly with your research advisor or faculty, please talk to the [Education Department (links to an external site)](https://helpdesk.skoltech.ru/servicedesk/customer/portal/21) (email: education@skoltech.ru).",
    "context": "Sim: 6.44 - * MSc Thesis Project (36 ECTS-credits)  \nSim: 6.13 - * **MSc Thesis Project** (36 ECTS-credits)  ",
    "generated_answer": "36 ECTS-credits.",
    "logprobs": [
      [
        {
          "prob": 0.9999958276922101,
          "token": "3"
        },
        {
          "prob": 4.2228351681890325e-06,
          "token": "The"
        },
        {
          "prob": 9.736163172423694e-10,
          "token": "4"
        },
        {
          "prob": 8.592133842722118e-10,
          "token": "Thirty"
        },
        {
          "prob": 2.461687561204665e-10,
          "token": "2"
        }
      ],
      [
        {
          "prob": 1.0,
          "token": "6"
        },
        {
          "prob": 5.109089028063325e-12,
          "token": "5"
        },
        {
          "prob": 1.6586783589142312e-12,
          "token": "4"
        },
        {
          "prob": 1.6586783589142312e-12,
          "token": "2"
        },
        {
          "prob": 8.878265478459658e-13,
          "token": "8"
        }
      ],
      [
        {
          "prob": 0.9999653112986742,
          "token": " E"
        },
        {
          "prob": 2.429999697082004e-05,
          "token": ""
        },
        {
          "prob": 6.144001412158703e-06,
          "token": "\u674e"
        },
        {
          "prob": 1.994665217910508e-06,
          "token": "ECT"
        },
        {
          "prob": 2.535932244330909e-07,
          "token": "'E"
        }
      ],
      [
        {
          "prob": 0.9999996423722521,
          "token": "CTS"
        },
        {
          "prob": 3.4663274126619643e-07,
          "token": "CT"
        },
        {
          "prob": 5.602796437537268e-09,
          "token": "cts"
        },
        {
          "prob": 5.905303998944039e-10,
          "token": "TS"
        },
        {
          "prob": 1.493094676197164e-10,
          "token": "TC"
        }
      ],
      [
        {
          "prob": 0.9978019735797764,
          "token": "-"
        },
        {
          "prob": 0.0021826826103546085,
          "token": " credits"
        },
        {
          "prob": 1.4706806757145136e-05,
          "token": "credits"
        },
        {
          "prob": 5.032392536028018e-07,
          "token": "-c"
        },
        {
          "prob": 1.272388094740147e-07,
          "token": " Credits"
        }
      ],
      [
        {
          "prob": 0.9999974966112362,
          "token": "credits"
        },
        {
          "prob": 1.7603412757721762e-06,
          "token": " credits"
        },
        {
          "prob": 5.043462196197153e-07,
          "token": "credit"
        },
        {
          "prob": 1.1253496007565217e-07,
          "token": "credentials"
        },
        {
          "prob": 6.825590357542018e-08,
          "token": "Credits"
        }
      ],
      [
        {
          "prob": 0.7792719739656521,
          "token": "."
        },
        {
          "prob": 0.19703081679141823,
          "token": " are"
        },
        {
          "prob": 0.0235319752894153,
          "token": ""
        },
        {
          "prob": 3.32353871895843e-05,
          "token": "\u90fd\u662f"
        },
        {
          "prob": 3.32353871895843e-05,
          "token": ".are"
        }
      ],
      [
        {
          "prob": 0.9999972581939645,
          "token": ""
        },
        {
          "prob": 6.083576662864179e-07,
          "token": ""
        },
        {
          "prob": 2.238022783058102e-07,
          "token": "<tool_call>"
        },
        {
          "prob": 2.845329381943118e-08,
          "token": " b\u1ee5"
        },
        {
          "prob": 1.4307214629695401e-08,
          "token": "GuidId"
        }
      ]
    ],
    "language_consistency_score": 0.3273393432409973
  },
  {
    "question": "What is the email address for the Skoltech Education Department?\n",
    "true_answer": "education@skoltech.ru \n",
    "source_doc": "\n### Text After Video 4\n\n[Learn more about what\u2019s considered academic misconduct (links to an external site)](https://www.skoltech.ru/app/data/uploads/sites/2/2015/04/1.-STUDENT-ACADEMIC-INTEGRITY-REGULATIONS.pdf)  \n[Disciplinary Board Policy (links to an external site).](http://www.skoltech.ru/app/data/uploads/sites/2/2015/04/DISCIPLINARY-BOARD-POLICY.pdf)\n\nSave these links\\! 1) [Course timetable (links to an external site)](https://schedule.skoltech.ru/)  \n2) [Course catalog (links to an external site)](https://www.skoltech.ru/en/education/course-catalog/)  \n3) [Education resources for students (Canvas)](https://skoltech.instructure.com/courses/2072)\n\n![][image12]  \n[View the 2022-2023 academic calendar with key dates, breaks and holidays](https://www.skoltech.ru/en/education/academic-calendar/msc-academic-calendar-2022-2023/)   \n[(links to an external site)](https://www.skoltech.ru/en/education/academic-calendar/msc-academic-calendar-2022-2023/)\n\n[Your updated term schedule can be found on the Skoltech website (links to an external site)](https://schedule.skoltech.ru/)![][image13]\n\n* **STE:** **Science, Technology and Engineering** (36 ECTS-credits)  \n  * Provide a solid foundation of scientific and engineering fundamentals  \n  * Core and recommended electives  \n* **Sector:** **Industrial Immersion** (12 ECTS-credits)  \n  * Orients students to how a sector works, provides knowledge and skills to make an impact in an industrial sector  \n  * Happens in the summer term between Year 1 and Year 2  \n* **Enterpreneurship and Innovation: Entrepreneurship and Innovation** (12 ECTS-credits)  \n  * Orients students in the process of, provide the skills for, and experience with innovation  \n  * Includes Innovation Workshop  \n* **MSc Thesis Project** (36 ECTS-credits)  \n* Early research, Thesis Project, Defense\n\n* **Options: elective coursework and short-term projects** (24 ECTS-credits)  \n* Follow your dreams and passions, choose courses to diversify your experience  \n* Additionally you can take 20 credits as an extracurricular activity. **ECTS credits** are based on the workload students need in order to achieve the learning outcomes. 1 ECTS equals 27 astronomical hours (36 academic hours). [The courses offered in 2022-2023 (links to an external site)](https://www.skoltech.ru/en/education/course-catalog/)\n\nIf you need to communicate any concerns or issues informally or outside of the formal evaluation period (or if you are unable to solve an issue directly with your research advisor or faculty, please talk to the [Education Department (links to an external site)](https://helpdesk.skoltech.ru/servicedesk/customer/portal/21) (email: education@skoltech.ru).",
    "context": "Sim: 6.19 - Until then, if you have urgent questions or need assistance, feel free to reach out to the Education Department via [education@skoltech.ru](mailto:education@skoltech.ru). For more details on the Education Department, as well as for all the relevant links, see the description below.\nSim: 5.08 - If you need to communicate any concerns or issues informally or outside of the formal evaluation period (or if you are unable to solve an issue directly with your research advisor or faculty, please talk to the [Education Department (links to an external site)](https://helpdesk.skoltech.ru/servicedesk/customer/portal/21) (email: education@skoltech.ru). \nSim: 4.71 - * Email us at education@skoltech.ru \nSim: 3.23 - 1. Email studept@skoltech.ru from your Skoltech email address and ask to pick up your original diploma. Wait for an answer. If you wish for someone else to pick up your diploma, include their full name in your email and ask them to have Skoltech or government ID on them.   \nSim: 1.98 - To order a car pass, send an email to security.campus@skoltech.ru from your Skoltech email address that ends with @skoltech.ru. In that email, write the following information: \nSim: 0.19 - If you wish to end (or resume) your education at Skoltech, please contact the [Education Department  (links to an external site)](https://helpdesk.skoltech.ru/servicedesk/customer/portal/21)",
    "generated_answer": "education@skoltech.ru",
    "logprobs": [
      [
        {
          "prob": 0.9930967727636165,
          "token": "education"
        },
        {
          "prob": 0.006691434432525136,
          "token": "The"
        },
        {
          "prob": 0.00010815691266393966,
          "token": " education"
        },
        {
          "prob": 7.433508650105725e-05,
          "token": "\u6559\u80b2"
        },
        {
          "prob": 1.658639975562829e-05,
          "token": "edu"
        }
      ],
      [
        {
          "prob": 1.0,
          "token": "@"
        },
        {
          "prob": 4.5990553786523166e-10,
          "token": "@s"
        },
        {
          "prob": 3.1608814543136926e-10,
          "token": "@example"
        },
        {
          "prob": 4.8473687062702556e-11,
          "token": "@g"
        },
        {
          "prob": 3.1296964622560676e-11,
          "token": "\uff20"
        }
      ],
      [
        {
          "prob": 0.9999998807907247,
          "token": "sk"
        },
        {
          "prob": 8.764248219443636e-08,
          "token": "sky"
        },
        {
          "prob": 4.139937718785167e-08,
          "token": "ski"
        },
        {
          "prob": 2.358865407619506e-08,
          "token": "sku"
        },
        {
          "prob": 1.0467401794744658e-08,
          "token": ".sk"
        }
      ],
      [
        {
          "prob": 0.9999998807907247,
          "token": "ol"
        },
        {
          "prob": 6.82560337633487e-08,
          "token": "olk"
        },
        {
          "prob": 2.510999155743982e-08,
          "token": "\u043e\u043b"
        },
        {
          "prob": 4.944450501938644e-09,
          "token": "ols"
        },
        {
          "prob": 2.9989608248573072e-09,
          "token": "col"
        }
      ],
      [
        {
          "prob": 0.9999969005680498,
          "token": "tech"
        },
        {
          "prob": 9.422427859507568e-07,
          "token": "te"
        },
        {
          "prob": 5.043462196197153e-07,
          "token": " tech"
        },
        {
          "prob": 4.450839766446488e-07,
          "token": "Tech"
        },
        {
          "prob": 3.466317495433874e-07,
          "token": "techn"
        }
      ],
      [
        {
          "prob": 1.0,
          "token": ".ru"
        },
        {
          "prob": 2.215948977336598e-08,
          "token": ".rs"
        },
        {
          "prob": 1.3440409951135022e-08,
          "token": " ru"
        },
        {
          "prob": 6.34880011604368e-09,
          "token": ".rb"
        },
        {
          "prob": 5.602796437537268e-09,
          "token": "_ru"
        }
      ],
      [
        {
          "prob": 0.9999942779868433,
          "token": ""
        },
        {
          "prob": 4.450827032509989e-07,
          "token": "<tool_call>"
        },
        {
          "prob": 3.466307578234157e-07,
          "token": ""
        },
        {
          "prob": 7.26577539766024e-08,
          "token": "ienie"
        },
        {
          "prob": 4.4069155452666876e-08,
          "token": "\u0119dzi"
        }
      ]
    ],
    "language_consistency_score": 0.5226529433793446
  },
  {
    "question": "How many ECTS credits are required for the Science, Technology, and Engineering track?\n",
    "true_answer": "36 ECTS credits \n",
    "source_doc": "\n### Text After Video 4\n\n[Learn more about what\u2019s considered academic misconduct (links to an external site)](https://www.skoltech.ru/app/data/uploads/sites/2/2015/04/1.-STUDENT-ACADEMIC-INTEGRITY-REGULATIONS.pdf)  \n[Disciplinary Board Policy (links to an external site).](http://www.skoltech.ru/app/data/uploads/sites/2/2015/04/DISCIPLINARY-BOARD-POLICY.pdf)\n\nSave these links\\! 1) [Course timetable (links to an external site)](https://schedule.skoltech.ru/)  \n2) [Course catalog (links to an external site)](https://www.skoltech.ru/en/education/course-catalog/)  \n3) [Education resources for students (Canvas)](https://skoltech.instructure.com/courses/2072)\n\n![][image12]  \n[View the 2022-2023 academic calendar with key dates, breaks and holidays](https://www.skoltech.ru/en/education/academic-calendar/msc-academic-calendar-2022-2023/)   \n[(links to an external site)](https://www.skoltech.ru/en/education/academic-calendar/msc-academic-calendar-2022-2023/)\n\n[Your updated term schedule can be found on the Skoltech website (links to an external site)](https://schedule.skoltech.ru/)![][image13]\n\n* **STE:** **Science, Technology and Engineering** (36 ECTS-credits)  \n  * Provide a solid foundation of scientific and engineering fundamentals  \n  * Core and recommended electives  \n* **Sector:** **Industrial Immersion** (12 ECTS-credits)  \n  * Orients students to how a sector works, provides knowledge and skills to make an impact in an industrial sector  \n  * Happens in the summer term between Year 1 and Year 2  \n* **Enterpreneurship and Innovation: Entrepreneurship and Innovation** (12 ECTS-credits)  \n  * Orients students in the process of, provide the skills for, and experience with innovation  \n  * Includes Innovation Workshop  \n* **MSc Thesis Project** (36 ECTS-credits)  \n* Early research, Thesis Project, Defense\n\n* **Options: elective coursework and short-term projects** (24 ECTS-credits)  \n* Follow your dreams and passions, choose courses to diversify your experience  \n* Additionally you can take 20 credits as an extracurricular activity. **ECTS credits** are based on the workload students need in order to achieve the learning outcomes. 1 ECTS equals 27 astronomical hours (36 academic hours). [The courses offered in 2022-2023 (links to an external site)](https://www.skoltech.ru/en/education/course-catalog/)\n\nIf you need to communicate any concerns or issues informally or outside of the formal evaluation period (or if you are unable to solve an issue directly with your research advisor or faculty, please talk to the [Education Department (links to an external site)](https://helpdesk.skoltech.ru/servicedesk/customer/portal/21) (email: education@skoltech.ru).",
    "context": "Sim: 6.40 - * STE: Science, Technology and Engineering (36 ECTS-credits)  ",
    "generated_answer": "36 ECTS-credits are required for the Science, Technology and Engineering track.",
    "logprobs": [
      [
        {
          "prob": 0.9997040909250393,
          "token": "3"
        },
        {
          "prob": 0.00029595722061387207,
          "token": "The"
        },
        {
          "prob": 1.0464307679539958e-08,
          "token": "Science"
        },
        {
          "prob": 8.149611015125835e-09,
          "token": "Thirty"
        },
        {
          "prob": 1.8184240109524353e-09,
          "token": "2"
        }
      ],
      [
        {
          "prob": 1.0,
          "token": "6"
        },
        {
          "prob": 6.560200168153779e-12,
          "token": "5"
        },
        {
          "prob": 2.129785170955785e-12,
          "token": "8"
        },
        {
          "prob": 2.129785170955785e-12,
          "token": "4"
        },
        {
          "prob": 1.2917800047859961e-12,
          "token": "2"
        }
      ],
      [
        {
          "prob": 0.9999949932351057,
          "token": " E"
        },
        {
          "prob": 3.2887441993747145e-06,
          "token": "\u674e"
        },
        {
          "prob": 1.2098613782217925e-06,
          "token": "ECT"
        },
        {
          "prob": 2.1024238272199137e-07,
          "token": ""
        },
        {
          "prob": 7.26577539766024e-08,
          "token": "'E"
        }
      ],
      [
        {
          "prob": 1.0,
          "token": "CTS"
        },
        {
          "prob": 2.8453348089834e-08,
          "token": "CT"
        },
        {
          "prob": 2.061153622438558e-09,
          "token": "cts"
        },
        {
          "prob": 3.775134544279098e-11,
          "token": "TC"
        },
        {
          "prob": 2.5946094982764667e-11,
          "token": "TS"
        }
      ],
      [
        {
          "prob": 0.952333205883313,
          "token": "-"
        },
        {
          "prob": 0.04741387913682141,
          "token": " credits"
        },
        {
          "prob": 0.00024880514382725675,
          "token": "credits"
        },
        {
          "prob": 2.43919980122046e-06,
          "token": "-c"
        },
        {
          "prob": 1.152196401549077e-06,
          "token": " Credits"
        }
      ],
      [
        {
          "prob": 0.9999983310727032,
          "token": "credits"
        },
        {
          "prob": 1.067701973552941e-06,
          "token": " credits"
        },
        {
          "prob": 2.6995733543305574e-07,
          "token": "credit"
        },
        {
          "prob": 1.6373740075447596e-07,
          "token": "credentials"
        },
        {
          "prob": 1.4449774900307763e-07,
          "token": "Credits"
        }
      ],
      [
        {
          "prob": 0.8485364873069524,
          "token": " are"
        },
        {
          "prob": 0.14745353815260437,
          "token": "."
        },
        {
          "prob": 0.003929503222385446,
          "token": ""
        },
        {
          "prob": 2.8184403771212435e-05,
          "token": ".are"
        },
        {
          "prob": 9.150136225348095e-06,
          "token": "are"
        }
      ],
      [
        {
          "prob": 0.9999996423722521,
          "token": " required"
        },
        {
          "prob": 3.927863545481039e-07,
          "token": "required"
        },
        {
          "prob": 1.6052280551856116e-09,
          "token": "_required"
        },
        {
          "prob": 6.691586091292782e-10,
          "token": ".required"
        },
        {
          "prob": 2.172439935079017e-10,
          "token": " Required"
        }
      ],
      [
        {
          "prob": 1.0,
          "token": " for"
        },
        {
          "prob": 8.592166619174109e-10,
          "token": "\tfor"
        },
        {
          "prob": 9.056076989672867e-11,
          "token": "for"
        },
        {
          "prob": 2.020683909022217e-11,
          "token": " \u0434\u043b\u044f"
        },
        {
          "prob": 8.423463754468647e-12,
          "token": " f\u00fcr"
        }
      ],
      [
        {
          "prob": 1.0,
          "token": " the"
        },
        {
          "prob": 1.57371021068629e-11,
          "token": "the"
        },
        {
          "prob": 1.8795288165390832e-12,
          "token": " this"
        },
        {
          "prob": 2.853913761591079e-14,
          "token": " The"
        },
        {
          "prob": 2.6810038677818034e-14,
          "token": "\tthe"
        }
      ],
      [
        {
          "prob": 0.9999868871505255,
          "token": " Science"
        },
        {
          "prob": 1.3007123989067183e-05,
          "token": "Science"
        },
        {
          "prob": 7.734318642157583e-08,
          "token": " STE"
        },
        {
          "prob": 5.6027216326337694e-09,
          "token": " Sciences"
        },
        {
          "prob": 1.6052066232219309e-09,
          "token": " STEM"
        }
      ],
      [
        {
          "prob": 1.0,
          "token": ","
        },
        {
          "prob": 2.289734845645553e-11,
          "token": " Technology"
        },
        {
          "prob": 9.545034922840628e-12,
          "token": "\uff0c"
        },
        {
          "prob": 5.384940217754036e-13,
          "token": "\u060c"
        },
        {
          "prob": 6.431393941452e-14,
          "token": "Technology"
        }
      ],
      [
        {
          "prob": 0.9999973774024795,
          "token": " Technology"
        },
        {
          "prob": 2.561281443046568e-06,
          "token": "Technology"
        },
        {
          "prob": 6.348788006680007e-09,
          "token": " Techn"
        },
        {
          "prob": 2.0611496911037635e-09,
          "token": " Tech"
        },
        {
          "prob": 1.6052249934589952e-09,
          "token": " Technologies"
        }
      ],
      [
        {
          "prob": 0.6791786964925157,
          "token": " and"
        },
        {
          "prob": 0.32082130911852547,
          "token": ","
        },
        {
          "prob": 1.2353996229264817e-09,
          "token": "\u548c"
        },
        {
          "prob": 2.4326460929708317e-10,
          "token": "and"
        },
        {
          "prob": 1.3021016228047077e-10,
          "token": ",and"
        }
      ],
      [
        {
          "prob": 0.9999850990607846,
          "token": " Engineering"
        },
        {
          "prob": 1.4738974314670568e-05,
          "token": "Engineering"
        },
        {
          "prob": 1.637352146389176e-07,
          "token": " Engineer"
        },
        {
          "prob": 1.9555382694114372e-08,
          "token": " Engineers"
        },
        {
          "prob": 9.237308710750103e-09,
          "token": " Engine"
        }
      ],
      [
        {
          "prob": 0.9999965429424904,
          "token": " track"
        },
        {
          "prob": 2.902309337197794e-06,
          "token": " ("
        },
        {
          "prob": 2.699568205307921e-07,
          "token": "track"
        },
        {
          "prob": 2.102425832248476e-07,
          "token": "(track"
        },
        {
          "prob": 5.602775064605783e-09,
          "token": "_track"
        }
      ],
      [
        {
          "prob": 1.0,
          "token": "."
        },
        {
          "prob": 9.736200313009565e-10,
          "token": "\u3002"
        },
        {
          "prob": 3.581747930283181e-10,
          "token": ".\n\n"
        },
        {
          "prob": 2.4616969518153846e-10,
          "token": ".\n"
        },
        {
          "prob": 9.056076989672867e-11,
          "token": ".)"
        }
      ],
      [
        {
          "prob": 0.9999982118638471,
          "token": ""
        },
        {
          "prob": 4.450844011100084e-07,
          "token": ""
        },
        {
          "prob": 1.8553878237411744e-07,
          "token": "<tool_call>"
        },
        {
          "prob": 8.677764327999391e-09,
          "token": " b\u1ee5"
        },
        {
          "prob": 8.152005165739432e-09,
          "token": "UrlParser"
        }
      ]
    ],
    "language_consistency_score": 0.337578148589058
  },
  {
    "question": "How many ECTS credits does a student need to take for the Entrepreneurship and Innovation track?\n",
    "true_answer": "12 ECTS credits \n",
    "source_doc": "\n### Text After Video 4\n\n[Learn more about what\u2019s considered academic misconduct (links to an external site)](https://www.skoltech.ru/app/data/uploads/sites/2/2015/04/1.-STUDENT-ACADEMIC-INTEGRITY-REGULATIONS.pdf)  \n[Disciplinary Board Policy (links to an external site).](http://www.skoltech.ru/app/data/uploads/sites/2/2015/04/DISCIPLINARY-BOARD-POLICY.pdf)\n\nSave these links\\! 1) [Course timetable (links to an external site)](https://schedule.skoltech.ru/)  \n2) [Course catalog (links to an external site)](https://www.skoltech.ru/en/education/course-catalog/)  \n3) [Education resources for students (Canvas)](https://skoltech.instructure.com/courses/2072)\n\n![][image12]  \n[View the 2022-2023 academic calendar with key dates, breaks and holidays](https://www.skoltech.ru/en/education/academic-calendar/msc-academic-calendar-2022-2023/)   \n[(links to an external site)](https://www.skoltech.ru/en/education/academic-calendar/msc-academic-calendar-2022-2023/)\n\n[Your updated term schedule can be found on the Skoltech website (links to an external site)](https://schedule.skoltech.ru/)![][image13]\n\n* **STE:** **Science, Technology and Engineering** (36 ECTS-credits)  \n  * Provide a solid foundation of scientific and engineering fundamentals  \n  * Core and recommended electives  \n* **Sector:** **Industrial Immersion** (12 ECTS-credits)  \n  * Orients students to how a sector works, provides knowledge and skills to make an impact in an industrial sector  \n  * Happens in the summer term between Year 1 and Year 2  \n* **Enterpreneurship and Innovation: Entrepreneurship and Innovation** (12 ECTS-credits)  \n  * Orients students in the process of, provide the skills for, and experience with innovation  \n  * Includes Innovation Workshop  \n* **MSc Thesis Project** (36 ECTS-credits)  \n* Early research, Thesis Project, Defense\n\n* **Options: elective coursework and short-term projects** (24 ECTS-credits)  \n* Follow your dreams and passions, choose courses to diversify your experience  \n* Additionally you can take 20 credits as an extracurricular activity. **ECTS credits** are based on the workload students need in order to achieve the learning outcomes. 1 ECTS equals 27 astronomical hours (36 academic hours). [The courses offered in 2022-2023 (links to an external site)](https://www.skoltech.ru/en/education/course-catalog/)\n\nIf you need to communicate any concerns or issues informally or outside of the formal evaluation period (or if you are unable to solve an issue directly with your research advisor or faculty, please talk to the [Education Department (links to an external site)](https://helpdesk.skoltech.ru/servicedesk/customer/portal/21) (email: education@skoltech.ru).",
    "context": "Sim: 6.91 - * Enterpreneurship and Innovation: Entrepreneurship and Innovation (12 ECTS-credits)  ",
    "generated_answer": "12 ECTS-credits.",
    "logprobs": [
      [
        {
          "prob": 0.9044533908475503,
          "token": "1"
        },
        {
          "prob": 0.09532868391691846,
          "token": "A"
        },
        {
          "prob": 0.00018402760829295303,
          "token": "The"
        },
        {
          "prob": 1.9396367212051763e-05,
          "token": "Students"
        },
        {
          "prob": 9.162195115655737e-06,
          "token": "To"
        }
      ],
      [
        {
          "prob": 1.0,
          "token": "2"
        },
        {
          "prob": 1.3887943864964021e-11,
          "token": "0"
        },
        {
          "prob": 7.913111885083693e-12,
          "token": "3"
        },
        {
          "prob": 6.560200168153779e-12,
          "token": "1"
        },
        {
          "prob": 5.438596960491441e-12,
          "token": "8"
        }
      ],
      [
        {
          "prob": 0.9999831917733143,
          "token": " E"
        },
        {
          "prob": 6.962185208632192e-06,
          "token": "ECT"
        },
        {
          "prob": 4.785035250849994e-06,
          "token": "\u674e"
        },
        {
          "prob": 2.5612448038836927e-06,
          "token": ""
        },
        {
          "prob": 3.4662679097190204e-07,
          "token": " EC"
        }
      ],
      [
        {
          "prob": 0.9999998807907247,
          "token": "CTS"
        },
        {
          "prob": 8.764248219443636e-08,
          "token": "CT"
        },
        {
          "prob": 9.736200313009565e-10,
          "token": "cts"
        },
        {
          "prob": 4.8473687062702556e-11,
          "token": "TS"
        },
        {
          "prob": 4.277787868968998e-11,
          "token": "TC"
        }
      ],
      [
        {
          "prob": 0.6788488668768611,
          "token": "-"
        },
        {
          "prob": 0.3206654990787669,
          "token": " credits"
        },
        {
          "prob": 0.0004821010791507318,
          "token": "credits"
        },
        {
          "prob": 1.3541227122930602e-06,
          "token": " Credits"
        },
        {
          "prob": 1.1950090993180768e-06,
          "token": "Credits"
        }
      ],
      [
        {
          "prob": 0.9999959469005546,
          "token": "credits"
        },
        {
          "prob": 1.9947260911909763e-06,
          "token": " credits"
        },
        {
          "prob": 1.5534942418324951e-06,
          "token": "credit"
        },
        {
          "prob": 2.3823605795000956e-07,
          "token": "credentials"
        },
        {
          "prob": 1.2751857270305506e-07,
          "token": "Credits"
        }
      ],
      [
        {
          "prob": 0.9963956326657717,
          "token": "."
        },
        {
          "prob": 0.003593563006310319,
          "token": ""
        },
        {
          "prob": 5.0753726307076255e-06,
          "token": " are"
        },
        {
          "prob": 2.3974362734434564e-06,
          "token": "\u3002"
        },
        {
          "prob": 4.1661195540740905e-07,
          "token": " for"
        }
      ],
      [
        {
          "prob": 0.9999973774024795,
          "token": ""
        },
        {
          "prob": 7.338194195418315e-07,
          "token": ""
        },
        {
          "prob": 2.382362851497276e-07,
          "token": "<tool_call>"
        },
        {
          "prob": 1.955564378838448e-08,
          "token": " b\u1ee5"
        },
        {
          "prob": 1.18610975280741e-08,
          "token": "anmar"
        }
      ]
    ],
    "language_consistency_score": 0.33375188823802615
  },
  {
    "question": "How many credits are required per term to maintain full-time student status at Skoltech?\n",
    "true_answer": "A minimum of 12 credits and a maximum of 18 credits per term. \n",
    "source_doc": "In this section, we would like to cover the most critical academic policies and guidelines that regulate the students\u2019 eligibility for their degree. * Full-time Status requirement  \n  1. You must be registered for a minimum of 12 credits and a maximum of 18 credits per term. During Term 1, it\u2019s best to take only 12 credits for a smooth introduction to Skoltech coursework. 2.",
    "context": "Sim: 4.92 -   1. You must be registered for a minimum of 12 credits and a maximum of 18 credits per term. During Term 1, it\u2019s best to take only 12 credits for a smooth introduction to Skoltech coursework.   ",
    "generated_answer": "You must be registered for a minimum of 12 credits and a maximum of 18 credits per term to maintain full-time student status at Skoltech.",
    "logprobs": [
      [
        {
          "prob": 0.5245445436323938,
          "token": "You"
        },
        {
          "prob": 0.36051384108684753,
          "token": "To"
        },
        {
          "prob": 0.0911521629962299,
          "token": "1"
        },
        {
          "prob": 0.010886573390571579,
          "token": "At"
        },
        {
          "prob": 0.010886573390571579,
          "token": "A"
        }
      ],
      [
        {
          "prob": 0.9999828341569776,
          "token": " must"
        },
        {
          "prob": 1.3007074370921508e-05,
          "token": " are"
        },
        {
          "prob": 2.9022705874462532e-06,
          "token": " need"
        },
        {
          "prob": 9.422293071559931e-07,
          "token": "\u5fc5\u987b"
        },
        {
          "prob": 2.3823287717670763e-07,
          "token": "\u987b"
        }
      ],
      [
        {
          "prob": 0.9997643787626572,
          "token": " be"
        },
        {
          "prob": 0.00023050556386956198,
          "token": " register"
        },
        {
          "prob": 4.22185666967895e-06,
          "token": " maintain"
        },
        {
          "prob": 3.926938416508203e-07,
          "token": " take"
        },
        {
          "prob": 3.4655109892089454e-07,
          "token": " have"
        }
      ],
      [
        {
          "prob": 0.9997667618366811,
          "token": " registered"
        },
        {
          "prob": 0.00017951825604750428,
          "token": "registered"
        },
        {
          "prob": 5.1432841481585805e-05,
          "token": "\u6ce8\u518c"
        },
        {
          "prob": 2.2598013422396713e-06,
          "token": "_registered"
        },
        {
          "prob": 3.652632159981908e-08,
          "token": "\tregister"
        }
      ],
      [
        {
          "prob": 1.0,
          "token": " for"
        },
        {
          "prob": 5.211412487888539e-10,
          "token": "for"
        },
        {
          "prob": 9.056076989672867e-11,
          "token": "\tfor"
        },
        {
          "prob": 2.7346982915918745e-12,
          "token": " \u0434\u043b\u044f"
        },
        {
          "prob": 1.2917800047859961e-12,
          "token": " f\u00fcr"
        }
      ],
      [
        {
          "prob": 0.9999998807907247,
          "token": " a"
        },
        {
          "prob": 9.931194312156244e-08,
          "token": " at"
        },
        {
          "prob": 1.917171513758312e-10,
          "token": " between"
        },
        {
          "prob": 7.991959892953932e-11,
          "token": " "
        },
        {
          "prob": 3.331544542166412e-11,
          "token": "a"
        }
      ],
      [
        {
          "prob": 0.999998927117538,
          "token": " minimum"
        },
        {
          "prob": 1.0677029917933763e-06,
          "token": "minimum"
        },
        {
          "prob": 6.691573328117371e-10,
          "token": " m\u00ednimo"
        },
        {
          "prob": 4.0586443852184914e-10,
          "token": "_minimum"
        },
        {
          "prob": 1.4930918283477907e-10,
          "token": " Minimum"
        }
      ],
      [
        {
          "prob": 1.0,
          "token": " of"
        },
        {
          "prob": 6.560200168153779e-12,
          "token": " c\u1ee7a"
        },
        {
          "prob": 1.3615261080896538e-13,
          "token": "of"
        },
        {
          "prob": 3.442477108469977e-14,
          "token": " or"
        },
        {
          "prob": 3.037975385443128e-14,
          "token": "_of"
        }
      ],
      [
        {
          "prob": 1.0,
          "token": " "
        },
        {
          "prob": 1.783247290814639e-11,
          "token": "1"
        },
        {
          "prob": 3.2339079641330587e-14,
          "token": ""
        },
        {
          "prob": 4.959358486191753e-15,
          "token": " **"
        },
        {
          "prob": 4.37661850287085e-15,
          "token": " a"
        }
      ],
      [
        {
          "prob": 1.0,
          "token": "1"
        },
        {
          "prob": 1.2256067444099483e-11,
          "token": " twelve"
        },
        {
          "prob": 4.508755242294825e-12,
          "token": "\uff11"
        },
        {
          "prob": 2.8823507934443873e-13,
          "token": "\u5341\u4e8c"
        },
        {
          "prob": 1.6423139769541602e-13,
          "token": "9"
        }
      ],
      [
        {
          "prob": 1.0,
          "token": "2"
        },
        {
          "prob": 4.8473687062702556e-11,
          "token": "\uff12"
        },
        {
          "prob": 2.707717986972444e-13,
          "token": ""
        },
        {
          "prob": 2.543665647376923e-13,
          "token": ""
        },
        {
          "prob": 2.389552736575778e-13,
          "token": "0"
        }
      ],
      [
        {
          "prob": 0.9999412332751231,
          "token": " credits"
        },
        {
          "prob": 5.829121699710653e-05,
          "token": "credits"
        },
        {
          "prob": 2.3822288073708613e-07,
          "token": " and"
        },
        {
          "prob": 1.6372803189329972e-07,
          "token": " credit"
        },
        {
          "prob": 1.725680760059398e-08,
          "token": " Credits"
        }
      ],
      [
        {
          "prob": 1.0,
          "token": " and"
        },
        {
          "prob": 1.0467401794744658e-08,
          "token": "\u548c"
        },
        {
          "prob": 7.194133030325383e-09,
          "token": " per"
        },
        {
          "prob": 4.8473687062702556e-11,
          "token": " v\u00e0"
        },
        {
          "prob": 3.331544542166412e-11,
          "token": " \u0438"
        }
      ],
      [
        {
          "prob": 1.0,
          "token": " a"
        },
        {
          "prob": 2.215948977336598e-08,
          "token": " up"
        },
        {
          "prob": 1.917171513758312e-10,
          "token": " no"
        },
        {
          "prob": 7.991959892953932e-11,
          "token": "a"
        },
        {
          "prob": 7.05287985111216e-11,
          "token": " maximum"
        }
      ],
      [
        {
          "prob": 0.9999982118638471,
          "token": " maximum"
        },
        {
          "prob": 1.7603429545652396e-06,
          "token": "maximum"
        },
        {
          "prob": 1.8189582181622667e-09,
          "token": ".maximum"
        },
        {
          "prob": 8.592150230932485e-10,
          "token": " m\u00e1ximo"
        },
        {
          "prob": 8.592150230932485e-10,
          "token": " maxim"
        }
      ],
      [
        {
          "prob": 1.0,
          "token": " of"
        },
        {
          "prob": 1.2256067444099483e-11,
          "token": " c\u1ee7a"
        },
        {
          "prob": 3.2661313427874473e-13,
          "token": " or"
        },
        {
          "prob": 1.0603575991523846e-13,
          "token": ""
        },
        {
          "prob": 7.287724095819692e-14,
          "token": "_of"
        }
      ],
      [
        {
          "prob": 1.0,
          "token": " "
        },
        {
          "prob": 1.917171513758312e-10,
          "token": "1"
        },
        {
          "prob": 6.560200168153779e-12,
          "token": ""
        },
        {
          "prob": 1.8609855424356342e-13,
          "token": "  "
        },
        {
          "prob": 6.431393941452e-14,
          "token": "\n"
        }
      ],
      [
        {
          "prob": 1.0,
          "token": "1"
        },
        {
          "prob": 1.9810087980489796e-13,
          "token": "\uff11"
        },
        {
          "prob": 3.442477108469977e-14,
          "token": "2"
        },
        {
          "prob": 1.626111044617819e-14,
          "token": "8"
        },
        {
          "prob": 1.1176086870894152e-14,
          "token": "9"
        }
      ],
      [
        {
          "prob": 1.0,
          "token": "8"
        },
        {
          "prob": 5.211412487888539e-10,
          "token": "5"
        },
        {
          "prob": 5.211412487888539e-10,
          "token": "2"
        },
        {
          "prob": 9.056076989672867e-11,
          "token": "6"
        },
        {
          "prob": 5.109089028063325e-12,
          "token": "7"
        }
      ],
      [
        {
          "prob": 0.99996864893943,
          "token": " credits"
        },
        {
          "prob": 3.1201903005200916e-05,
          "token": "credits"
        },
        {
          "prob": 6.825395078628969e-08,
          "token": " credentials"
        },
        {
          "prob": 4.691020861054355e-08,
          "token": "Credits"
        },
        {
          "prob": 1.7257301328882545e-08,
          "token": " Credits"
        }
      ],
      [
        {
          "prob": 1.0,
          "token": " per"
        },
        {
          "prob": 2.9989608248573072e-09,
          "token": "_per"
        },
        {
          "prob": 2.335593038799337e-09,
          "token": "per"
        },
        {
          "prob": 1.4166087866431961e-09,
          "token": " to"
        },
        {
          "prob": 1.783247290814639e-11,
          "token": ".per"
        }
      ],
      [
        {
          "prob": 0.9999998807907247,
          "token": " term"
        },
        {
          "prob": 1.6373771305908126e-07,
          "token": "term"
        },
        {
          "prob": 5.602796437537268e-09,
          "token": ".term"
        },
        {
          "prob": 4.944450501938644e-09,
          "token": "(term"
        },
        {
          "prob": 2.9989608248573072e-09,
          "token": "_term"
        }
      ],
      [
        {
          "prob": 0.9999543449247886,
          "token": " to"
        },
        {
          "prob": 4.539785156619626e-05,
          "token": "."
        },
        {
          "prob": 1.8553064314836208e-07,
          "token": " at"
        },
        {
          "prob": 9.93073970856393e-08,
          "token": " for"
        },
        {
          "prob": 1.8188784240007025e-09,
          "token": " per"
        }
      ],
      [
        {
          "prob": 0.999998927117538,
          "token": " maintain"
        },
        {
          "prob": 3.9278597995802437e-07,
          "token": "maint"
        },
        {
          "prob": 3.059020287707785e-07,
          "token": " maintained"
        },
        {
          "prob": 1.6373755690670415e-07,
          "token": " maintaining"
        },
        {
          "prob": 7.734407154916583e-08,
          "token": " maintains"
        }
      ],
      [
        {
          "prob": 1.0,
          "token": " full"
        },
        {
          "prob": 1.9555681087850496e-08,
          "token": "full"
        },
        {
          "prob": 4.363462252943702e-09,
          "token": "\u6ee1"
        },
        {
          "prob": 3.398267819495071e-09,
          "token": "(full"
        },
        {
          "prob": 2.061153622438558e-09,
          "token": "_full"
        }
      ],
      [
        {
          "prob": 1.0,
          "token": "-time"
        },
        {
          "prob": 7.194133030325383e-09,
          "token": "-Time"
        },
        {
          "prob": 9.736200313009565e-10,
          "token": "-term"
        },
        {
          "prob": 5.211412487888539e-10,
          "token": "time"
        },
        {
          "prob": 1.493094676197164e-10,
          "token": "_time"
        }
      ],
      [
        {
          "prob": 0.9995620976943403,
          "token": " student"
        },
        {
          "prob": 0.0004305538247965951,
          "token": " status"
        },
        {
          "prob": 3.725022236906538e-06,
          "token": "student"
        },
        {
          "prob": 2.901050235061208e-06,
          "token": "\u5b66\u751f"
        },
        {
          "prob": 3.926144552456504e-07,
          "token": ".student"
        }
      ],
      [
        {
          "prob": 0.9999995231630692,
          "token": " status"
        },
        {
          "prob": 4.450852500419419e-07,
          "token": "status"
        },
        {
          "prob": 2.510999155743982e-08,
          "token": ".status"
        },
        {
          "prob": 2.061153622438558e-09,
          "token": "(status"
        },
        {
          "prob": 1.2501528663867426e-09,
          "token": "\tstatus"
        }
      ],
      [
        {
          "prob": 1.0,
          "token": " at"
        },
        {
          "prob": 1.3176514270095466e-10,
          "token": "."
        },
        {
          "prob": 9.056076989672867e-11,
          "token": "at"
        },
        {
          "prob": 1.3887943864964021e-11,
          "token": ".at"
        },
        {
          "prob": 1.0815941557285693e-11,
          "token": " t\u1ea1i"
        }
      ],
      [
        {
          "prob": 0.9999996423722521,
          "token": " Sk"
        },
        {
          "prob": 3.4663274126619643e-07,
          "token": "Sk"
        },
        {
          "prob": 1.7257827987960214e-08,
          "token": " SK"
        },
        {
          "prob": 1.3440409951135022e-08,
          "token": "_sk"
        },
        {
          "prob": 2.0408184531908878e-10,
          "token": " Ski"
        }
      ],
      [
        {
          "prob": 0.9999988079084972,
          "token": "ol"
        },
        {
          "prob": 1.2098659934854867e-06,
          "token": "olk"
        },
        {
          "prob": 1.7257795071296986e-08,
          "token": "col"
        },
        {
          "prob": 9.237432042950414e-09,
          "token": "\u043e\u043b"
        },
        {
          "prob": 7.19411930861867e-09,
          "token": "olt"
        }
      ],
      [
        {
          "prob": 0.9998974905186837,
          "token": "tech"
        },
        {
          "prob": 4.5395297246920134e-05,
          "token": "Tech"
        },
        {
          "prob": 2.4298351652430655e-05,
          "token": "itech"
        },
        {
          "prob": 1.4737695257678323e-05,
          "token": " tech"
        },
        {
          "prob": 4.784629128580717e-06,
          "token": "tek"
        }
      ],
      [
        {
          "prob": 1.0,
          "token": "."
        },
        {
          "prob": 8.152020714470167e-09,
          "token": ","
        },
        {
          "prob": 7.194133030325383e-09,
          "token": ".\n\n"
        },
        {
          "prob": 2.061153622438558e-09,
          "token": "\u3002"
        },
        {
          "prob": 1.4166087866431961e-09,
          "token": " according"
        }
      ],
      [
        {
          "prob": 0.9999955892755635,
          "token": ""
        },
        {
          "prob": 4.181169042134849e-07,
          "token": " During"
        },
        {
          "prob": 3.927844816012785e-07,
          "token": ""
        },
        {
          "prob": 3.256297724168536e-07,
          "token": " However"
        },
        {
          "prob": 2.8736726554720006e-07,
          "token": "<tool_call>"
        }
      ]
    ],
    "language_consistency_score": 0.6320222971288506
  },
  {
    "question": "What is the maximum number of credits a Skoltech student can take per term?\n",
    "true_answer": "18 credits \n",
    "source_doc": "In this section, we would like to cover the most critical academic policies and guidelines that regulate the students\u2019 eligibility for their degree. * Full-time Status requirement  \n  1. You must be registered for a minimum of 12 credits and a maximum of 18 credits per term. During Term 1, it\u2019s best to take only 12 credits for a smooth introduction to Skoltech coursework. 2.",
    "context": "Sim: 6.58 -   1. You must be registered for a minimum of 12 credits and a maximum of 18 credits per term. During Term 1, it\u2019s best to take only 12 credits for a smooth introduction to Skoltech coursework.   ",
    "generated_answer": "18 credits.",
    "logprobs": [
      [
        {
          "prob": 0.7146454291066631,
          "token": "1"
        },
        {
          "prob": 0.23201140876032347,
          "token": "The"
        },
        {
          "prob": 0.05176874279295379,
          "token": "A"
        },
        {
          "prob": 0.0015632802026951241,
          "token": "According"
        },
        {
          "prob": 4.390932357746731e-06,
          "token": "8"
        }
      ],
      [
        {
          "prob": 1.0,
          "token": "8"
        },
        {
          "prob": 1.026187963170189e-10,
          "token": "6"
        },
        {
          "prob": 5.4927883509546835e-11,
          "token": "2"
        },
        {
          "prob": 1.3750926572355787e-12,
          "token": ""
        },
        {
          "prob": 1.1399918530443554e-12,
          "token": "\uff18"
        }
      ],
      [
        {
          "prob": 0.9775970763041402,
          "token": " credits"
        },
        {
          "prob": 0.01580138205014697,
          "token": "credits"
        },
        {
          "prob": 0.004527171754387611,
          "token": "Credits"
        },
        {
          "prob": 0.0014697574802169668,
          "token": ""
        },
        {
          "prob": 0.000540693560479765,
          "token": " Credits"
        }
      ],
      [
        {
          "prob": 0.9955483650602494,
          "token": "."
        },
        {
          "prob": 0.004068577841476542,
          "token": " per"
        },
        {
          "prob": 0.00037843668973876443,
          "token": ""
        },
        {
          "prob": 7.305550213622173e-07,
          "token": "\u3002"
        },
        {
          "prob": 6.447125435197797e-07,
          "token": "_per"
        }
      ],
      [
        {
          "prob": 0.9999971389852362,
          "token": ""
        },
        {
          "prob": 9.422427859507568e-07,
          "token": ""
        },
        {
          "prob": 1.8553860543063036e-07,
          "token": "<tool_call>"
        },
        {
          "prob": 5.315775115378354e-08,
          "token": " b\u1ee5"
        },
        {
          "prob": 1.4307214629695401e-08,
          "token": "orado"
        }
      ]
    ],
    "language_consistency_score": 0.4164674896858826
  },
  {
    "question": "What is the minimum number of credits a Skoltech student must be registered for each term to maintain full-time status?\n",
    "true_answer": "12 credits \n",
    "source_doc": "In this section, we would like to cover the most critical academic policies and guidelines that regulate the students\u2019 eligibility for their degree. * Full-time Status requirement  \n  1. You must be registered for a minimum of 12 credits and a maximum of 18 credits per term. During Term 1, it\u2019s best to take only 12 credits for a smooth introduction to Skoltech coursework. 2.",
    "context": "Sim: 6.09 -   1. You must be registered for a minimum of 12 credits and a maximum of 18 credits per term. During Term 1, it\u2019s best to take only 12 credits for a smooth introduction to Skoltech coursework.   ",
    "generated_answer": "A Skoltech student must be registered for a minimum of 12 credits each term to maintain full-time status.",
    "logprobs": [
      [
        {
          "prob": 0.38706909865182565,
          "token": "A"
        },
        {
          "prob": 0.3415873010066365,
          "token": "1"
        },
        {
          "prob": 0.2660284575112162,
          "token": "The"
        },
        {
          "prob": 0.004872481161902399,
          "token": "According"
        },
        {
          "prob": 0.00027488657695941293,
          "token": "To"
        }
      ],
      [
        {
          "prob": 0.9999032114269176,
          "token": " Sk"
        },
        {
          "prob": 9.610239492660866e-05,
          "token": " minimum"
        },
        {
          "prob": 3.0587285707099816e-07,
          "token": " student"
        },
        {
          "prob": 2.3821402060718123e-07,
          "token": "Sk"
        },
        {
          "prob": 1.444841070716725e-07,
          "token": " sk"
        }
      ],
      [
        {
          "prob": 0.9999996423722521,
          "token": "ol"
        },
        {
          "prob": 2.382369667501818e-07,
          "token": "olt"
        },
        {
          "prob": 6.023573837886479e-08,
          "token": "\u043e\u043b"
        },
        {
          "prob": 2.215948977336598e-08,
          "token": "oll"
        },
        {
          "prob": 1.0467401794744658e-08,
          "token": "col"
        }
      ],
      [
        {
          "prob": 0.9999200169669461,
          "token": "tech"
        },
        {
          "prob": 4.006208794491641e-05,
          "token": " tech"
        },
        {
          "prob": 2.1443690422849376e-05,
          "token": "Tech"
        },
        {
          "prob": 6.143720168531264e-06,
          "token": "-tech"
        },
        {
          "prob": 4.784734078223732e-06,
          "token": "tek"
        }
      ],
      [
        {
          "prob": 0.9999769931373511,
          "token": " student"
        },
        {
          "prob": 2.144491747576362e-05,
          "token": "\u5b66\u751f"
        },
        {
          "prob": 1.5534646115638898e-06,
          "token": "student"
        },
        {
          "prob": 6.023435970800357e-08,
          "token": ".student"
        },
        {
          "prob": 3.6533985931063466e-08,
          "token": " students"
        }
      ],
      [
        {
          "prob": 0.9999917746265009,
          "token": " must"
        },
        {
          "prob": 7.889257112872668e-06,
          "token": "\u5fc5\u987b"
        },
        {
          "prob": 1.8553754377325157e-07,
          "token": "must"
        },
        {
          "prob": 5.3157446983561815e-08,
          "token": "\u987b"
        },
        {
          "prob": 6.348751678727569e-09,
          "token": " Must"
        }
      ],
      [
        {
          "prob": 0.999860067878919,
          "token": " be"
        },
        {
          "prob": 0.000139822025552885,
          "token": " register"
        },
        {
          "prob": 5.315045154881207e-08,
          "token": "\u6ce8\u518c"
        },
        {
          "prob": 3.2237378441925346e-08,
          "token": "register"
        },
        {
          "prob": 1.3438538686441405e-08,
          "token": "_be"
        }
      ],
      [
        {
          "prob": 0.999579368203004,
          "token": " registered"
        },
        {
          "prob": 0.0002611487027950286,
          "token": "\u6ce8\u518c"
        },
        {
          "prob": 0.00015839469498936715,
          "token": "registered"
        },
        {
          "prob": 1.0672550597746642e-06,
          "token": "_registered"
        },
        {
          "prob": 2.8441356846848437e-08,
          "token": "Registered"
        }
      ],
      [
        {
          "prob": 1.0,
          "token": " for"
        },
        {
          "prob": 2.646573638909117e-09,
          "token": "for"
        },
        {
          "prob": 1.6918979226151304e-10,
          "token": "\tfor"
        },
        {
          "prob": 5.109089028063325e-12,
          "token": " \u0434\u043b\u044f"
        },
        {
          "prob": 3.97896253583724e-12,
          "token": " f\u00fcr"
        }
      ],
      [
        {
          "prob": 0.9997965511486372,
          "token": " a"
        },
        {
          "prob": 0.00020342704214340812,
          "token": " at"
        },
        {
          "prob": 1.8185905002640507e-09,
          "token": "\u81f3\u5c11"
        },
        {
          "prob": 3.1602364275240186e-10,
          "token": "a"
        },
        {
          "prob": 5.4916674624659555e-11,
          "token": "at"
        }
      ],
      [
        {
          "prob": 0.9999985694905718,
          "token": " minimum"
        },
        {
          "prob": 1.3709577789362383e-06,
          "token": "minimum"
        },
        {
          "prob": 3.1608754254165217e-10,
          "token": "_minimum"
        },
        {
          "prob": 2.789462772385846e-10,
          "token": " Minimum"
        },
        {
          "prob": 1.6918946955790182e-10,
          "token": " m\u00ednimo"
        }
      ],
      [
        {
          "prob": 1.0,
          "token": " of"
        },
        {
          "prob": 2.5946094982764667e-11,
          "token": " c\u1ee7a"
        },
        {
          "prob": 2.2447770550209742e-13,
          "token": "_of"
        },
        {
          "prob": 1.9810087980489796e-13,
          "token": "of"
        },
        {
          "prob": 1.2015425731771786e-13,
          "token": "\u0e02\u0e2d\u0e07"
        }
      ],
      [
        {
          "prob": 1.0,
          "token": " "
        },
        {
          "prob": 3.775134544279098e-11,
          "token": "1"
        },
        {
          "prob": 3.900837610180715e-14,
          "token": " at"
        },
        {
          "prob": 2.493722053335376e-15,
          "token": ""
        },
        {
          "prob": 1.039538011670222e-15,
          "token": " a"
        }
      ],
      [
        {
          "prob": 1.0,
          "token": "1"
        },
        {
          "prob": 2.7346982915918745e-12,
          "token": "\uff11"
        },
        {
          "prob": 8.878265478459658e-13,
          "token": " twelve"
        },
        {
          "prob": 2.222630272345391e-14,
          "token": "\u5341\u4e8c"
        },
        {
          "prob": 1.9614643309355633e-14,
          "token": "9"
        }
      ],
      [
        {
          "prob": 1.0,
          "token": "2"
        },
        {
          "prob": 2.7346982915918745e-12,
          "token": "\uff12"
        },
        {
          "prob": 1.0603575991523846e-13,
          "token": "1"
        },
        {
          "prob": 5.008774637843506e-14,
          "token": "0"
        },
        {
          "prob": 2.6810038677818034e-14,
          "token": "3"
        }
      ],
      [
        {
          "prob": 0.9999244270256572,
          "token": " credits"
        },
        {
          "prob": 7.484619074298232e-05,
          "token": "credits"
        },
        {
          "prob": 6.475464294229121e-07,
          "token": " credit"
        },
        {
          "prob": 4.6908061280758204e-08,
          "token": "Credits"
        },
        {
          "prob": 2.845117735445891e-08,
          "token": " Credits"
        }
      ],
      [
        {
          "prob": 0.8806734058907798,
          "token": " each"
        },
        {
          "prob": 0.11918617416910622,
          "token": " per"
        },
        {
          "prob": 0.00013955266241467396,
          "token": " to"
        },
        {
          "prob": 5.703198349179074e-07,
          "token": "each"
        },
        {
          "prob": 3.645936202040493e-08,
          "token": "\u6bcf"
        }
      ],
      [
        {
          "prob": 1.0,
          "token": " term"
        },
        {
          "prob": 5.3157852544244216e-08,
          "token": "term"
        },
        {
          "prob": 2.9989608248573072e-09,
          "token": "(term"
        },
        {
          "prob": 1.4166087866431961e-09,
          "token": "_term"
        },
        {
          "prob": 6.691586091292782e-10,
          "token": "-term"
        }
      ],
      [
        {
          "prob": 0.9999988079084972,
          "token": " to"
        },
        {
          "prob": 1.2098659934854867e-06,
          "token": "."
        },
        {
          "prob": 2.845329381943118e-08,
          "token": " for"
        },
        {
          "prob": 2.2897304783270907e-11,
          "token": ","
        },
        {
          "prob": 1.2256044067528294e-11,
          "token": "to"
        }
      ],
      [
        {
          "prob": 0.9999983310727032,
          "token": " maintain"
        },
        {
          "prob": 7.338201193668986e-07,
          "token": " maintained"
        },
        {
          "prob": 4.450844011100084e-07,
          "token": "maint"
        },
        {
          "prob": 2.6995733543305574e-07,
          "token": " maintaining"
        },
        {
          "prob": 9.931175369924415e-08,
          "token": " maintains"
        }
      ],
      [
        {
          "prob": 1.0,
          "token": " full"
        },
        {
          "prob": 2.510999155743982e-08,
          "token": "full"
        },
        {
          "prob": 4.363462252943702e-09,
          "token": "_full"
        },
        {
          "prob": 3.398267819495071e-09,
          "token": "\u6ee1"
        },
        {
          "prob": 2.061153622438558e-09,
          "token": "(full"
        }
      ],
      [
        {
          "prob": 1.0,
          "token": "-time"
        },
        {
          "prob": 4.944450501938644e-09,
          "token": "-Time"
        },
        {
          "prob": 2.061153622438558e-09,
          "token": "-term"
        },
        {
          "prob": 2.172439935079017e-10,
          "token": "time"
        },
        {
          "prob": 1.162823303022097e-10,
          "token": "_time"
        }
      ],
      [
        {
          "prob": 0.9999983310727032,
          "token": " status"
        },
        {
          "prob": 1.370956471489639e-06,
          "token": "status"
        },
        {
          "prob": 2.1024298423113373e-07,
          "token": ".status"
        },
        {
          "prob": 2.2159447507533765e-08,
          "token": "_status"
        },
        {
          "prob": 1.955564378838448e-08,
          "token": "(status"
        }
      ],
      [
        {
          "prob": 1.0,
          "token": "."
        },
        {
          "prob": 3.850741922767617e-09,
          "token": " during"
        },
        {
          "prob": 1.8189616875530459e-09,
          "token": " according"
        },
        {
          "prob": 1.4166087866431961e-09,
          "token": ","
        },
        {
          "prob": 9.736200313009565e-10,
          "token": ".\n\n"
        }
      ],
      [
        {
          "prob": 0.999998927117538,
          "token": ""
        },
        {
          "prob": 2.6995759288455584e-07,
          "token": ""
        },
        {
          "prob": 1.4449788680693535e-07,
          "token": "<tool_call>"
        },
        {
          "prob": 1.5229950695859287e-08,
          "token": " b\u1ee5"
        },
        {
          "prob": 3.398261337819773e-09,
          "token": "\u00edcul"
        }
      ]
    ],
    "language_consistency_score": 0.35102036447780977
  },
  {
    "question": "How many credits are students required to take per term at Skoltech?\n",
    "true_answer": "Students are required to take a minimum of 12 credits and a maximum of 18 credits per term at Skoltech. \n",
    "source_doc": "In this section, we would like to cover the most critical academic policies and guidelines that regulate the students\u2019 eligibility for their degree. * Full-time Status requirement  \n  1. You must be registered for a minimum of 12 credits and a maximum of 18 credits per term. During Term 1, it\u2019s best to take only 12 credits for a smooth introduction to Skoltech coursework. 2.",
    "context": "Sim: 6.30 -   1. You must be registered for a minimum of 12 credits and a maximum of 18 credits per term. During Term 1, it\u2019s best to take only 12 credits for a smooth introduction to Skoltech coursework.   ",
    "generated_answer": "Students are required to take a minimum of 12 credits and a maximum of 18 credits per term at Skoltech.",
    "logprobs": [
      [
        {
          "prob": 0.9996983723053202,
          "token": "Students"
        },
        {
          "prob": 0.00017950610112056088,
          "token": " Students"
        },
        {
          "prob": 0.00010887595393509649,
          "token": "At"
        },
        {
          "prob": 3.7255302730466327e-06,
          "token": "_students"
        },
        {
          "prob": 3.7255302730466327e-06,
          "token": "students"
        }
      ],
      [
        {
          "prob": 0.9957060026720755,
          "token": " are"
        },
        {
          "prob": 0.0027967326458969307,
          "token": " at"
        },
        {
          "prob": 0.0014969831112284864,
          "token": " must"
        },
        {
          "prob": 2.0934065607343555e-07,
          "token": "are"
        },
        {
          "prob": 1.3382700406383694e-08,
          "token": "\u987b"
        }
      ],
      [
        {
          "prob": 0.9999966621509202,
          "token": " required"
        },
        {
          "prob": 2.561281443046568e-06,
          "token": "required"
        },
        {
          "prob": 7.338194195418315e-07,
          "token": " registered"
        },
        {
          "prob": 1.0467361864851814e-08,
          "token": "_required"
        },
        {
          "prob": 6.348775897339431e-09,
          "token": "\u8981\u6c42"
        }
      ],
      [
        {
          "prob": 1.0,
          "token": " to"
        },
        {
          "prob": 1.162823303022097e-10,
          "token": "to"
        },
        {
          "prob": 8.423463754468647e-12,
          "token": " by"
        },
        {
          "prob": 2.129785170955785e-12,
          "token": " at"
        },
        {
          "prob": 1.1399918530443554e-12,
          "token": "\tto"
        }
      ],
      [
        {
          "prob": 0.6219764932353687,
          "token": " take"
        },
        {
          "prob": 0.2938008744836389,
          "token": " be"
        },
        {
          "prob": 0.08417535986128118,
          "token": " register"
        },
        {
          "prob": 2.8237700888486834e-05,
          "token": "\u6ce8\u518c"
        },
        {
          "prob": 1.0388069622822877e-05,
          "token": "register"
        }
      ],
      [
        {
          "prob": 0.8519496373592031,
          "token": " a"
        },
        {
          "prob": 0.14804664369295154,
          "token": " between"
        },
        {
          "prob": 1.3235040230563764e-06,
          "token": "between"
        },
        {
          "prob": 1.167988200905503e-06,
          "token": " "
        },
        {
          "prob": 1.0307459695544607e-06,
          "token": " at"
        }
      ],
      [
        {
          "prob": 0.9999973774024795,
          "token": " minimum"
        },
        {
          "prob": 2.561281443046568e-06,
          "token": "minimum"
        },
        {
          "prob": 3.850734578067279e-09,
          "token": " m\u00ednimo"
        },
        {
          "prob": 1.6052249934589952e-09,
          "token": "_minimum"
        },
        {
          "prob": 1.6052249934589952e-09,
          "token": " Minimum"
        }
      ],
      [
        {
          "prob": 1.0,
          "token": " of"
        },
        {
          "prob": 3.5114221133765118e-12,
          "token": " c\u1ee7a"
        },
        {
          "prob": 1.5428112031918877e-13,
          "token": "of"
        },
        {
          "prob": 3.442477108469977e-14,
          "token": " or"
        },
        {
          "prob": 2.3659776091347615e-14,
          "token": "_of"
        }
      ],
      [
        {
          "prob": 1.0,
          "token": " "
        },
        {
          "prob": 1.026187963170189e-10,
          "token": "1"
        },
        {
          "prob": 5.9821282237671354e-15,
          "token": " twelve"
        },
        {
          "prob": 6.711761854006597e-16,
          "token": " at"
        },
        {
          "prob": 5.923109047046263e-16,
          "token": " a"
        }
      ],
      [
        {
          "prob": 1.0,
          "token": "1"
        },
        {
          "prob": 1.6586783589142312e-12,
          "token": "\uff11"
        },
        {
          "prob": 1.006039279283317e-12,
          "token": " twelve"
        },
        {
          "prob": 2.543665647376923e-13,
          "token": "9"
        },
        {
          "prob": 6.431393941452e-14,
          "token": "6"
        }
      ],
      [
        {
          "prob": 1.0,
          "token": "2"
        },
        {
          "prob": 1.463778514125909e-12,
          "token": "\uff12"
        },
        {
          "prob": 2.8823507934443873e-13,
          "token": "0"
        },
        {
          "prob": 1.3615261080896538e-13,
          "token": "1"
        },
        {
          "prob": 8.703945206726412e-15,
          "token": "3"
        }
      ],
      [
        {
          "prob": 0.9993877585024403,
          "token": " credits"
        },
        {
          "prob": 0.0005527458429573219,
          "token": " and"
        },
        {
          "prob": 5.825898322749577e-05,
          "token": "credits"
        },
        {
          "prob": 1.0670504988196339e-06,
          "token": " credit"
        },
        {
          "prob": 7.72968788777711e-08,
          "token": " to"
        }
      ],
      [
        {
          "prob": 1.0,
          "token": " and"
        },
        {
          "prob": 1.186112015134383e-08,
          "token": "\u548c"
        },
        {
          "prob": 7.05287985111216e-11,
          "token": " v\u00e0"
        },
        {
          "prob": 6.224144622907783e-11,
          "token": " per"
        },
        {
          "prob": 5.4927883509546835e-11,
          "token": " \u0438"
        }
      ],
      [
        {
          "prob": 1.0,
          "token": " a"
        },
        {
          "prob": 4.058652126475693e-10,
          "token": " maximum"
        },
        {
          "prob": 2.172439935079017e-10,
          "token": " up"
        },
        {
          "prob": 1.6918979226151304e-10,
          "token": "a"
        },
        {
          "prob": 1.8795288165390832e-12,
          "token": "\ta"
        }
      ],
      [
        {
          "prob": 0.9999963045256735,
          "token": " maximum"
        },
        {
          "prob": 3.7266389560521204e-06,
          "token": "maximum"
        },
        {
          "prob": 4.94443164039281e-09,
          "token": " m\u00e1ximo"
        },
        {
          "prob": 2.6465635430511496e-09,
          "token": " Maximum"
        },
        {
          "prob": 1.1032518237638113e-09,
          "token": ".maximum"
        }
      ],
      [
        {
          "prob": 1.0,
          "token": " of"
        },
        {
          "prob": 1.0815941557285693e-11,
          "token": " c\u1ee7a"
        },
        {
          "prob": 8.878265478459658e-13,
          "token": " or"
        },
        {
          "prob": 4.1937956583795446e-13,
          "token": "of"
        },
        {
          "prob": 1.5428112031918877e-13,
          "token": "_of"
        }
      ],
      [
        {
          "prob": 1.0,
          "token": " "
        },
        {
          "prob": 2.4616969518153846e-10,
          "token": "1"
        },
        {
          "prob": 3.442477108469977e-14,
          "token": ""
        },
        {
          "prob": 2.493722053335376e-15,
          "token": "\n"
        },
        {
          "prob": 1.824446028469072e-15,
          "token": "  "
        }
      ],
      [
        {
          "prob": 1.0,
          "token": "1"
        },
        {
          "prob": 1.0603575991523846e-13,
          "token": "\uff11"
        },
        {
          "prob": 2.6810038677818034e-14,
          "token": "2"
        },
        {
          "prob": 9.265301443284929e-15,
          "token": "8"
        },
        {
          "prob": 6.367942346736252e-15,
          "token": "9"
        }
      ],
      [
        {
          "prob": 1.0,
          "token": "8"
        },
        {
          "prob": 2.7346982915918745e-12,
          "token": "6"
        },
        {
          "prob": 4.1937956583795446e-13,
          "token": "9"
        },
        {
          "prob": 3.701011678592672e-13,
          "token": "\uff18"
        },
        {
          "prob": 3.701011678592672e-13,
          "token": "5"
        }
      ],
      [
        {
          "prob": 0.9999482658453687,
          "token": " credits"
        },
        {
          "prob": 5.144221091925853e-05,
          "token": "credits"
        },
        {
          "prob": 8.763796886190017e-08,
          "token": "Credits"
        },
        {
          "prob": 4.139724524052017e-08,
          "token": " credentials"
        },
        {
          "prob": 2.2158348624191795e-08,
          "token": " credit"
        }
      ],
      [
        {
          "prob": 1.0,
          "token": " per"
        },
        {
          "prob": 1.6052280551856116e-09,
          "token": "_per"
        },
        {
          "prob": 9.736200313009565e-10,
          "token": "per"
        },
        {
          "prob": 9.545034922840628e-12,
          "token": ","
        },
        {
          "prob": 7.433680672352188e-12,
          "token": "-per"
        }
      ],
      [
        {
          "prob": 0.9999998807907247,
          "token": " term"
        },
        {
          "prob": 1.2751905914873347e-07,
          "token": "term"
        },
        {
          "prob": 6.34880011604368e-09,
          "token": ".term"
        },
        {
          "prob": 4.363462252943702e-09,
          "token": "(term"
        },
        {
          "prob": 2.335593038799337e-09,
          "token": "_term"
        }
      ],
      [
        {
          "prob": 1.0,
          "token": " at"
        },
        {
          "prob": 5.211412487888539e-10,
          "token": "."
        },
        {
          "prob": 5.211412487888539e-10,
          "token": ","
        },
        {
          "prob": 7.991959892953932e-11,
          "token": "at"
        },
        {
          "prob": 2.289734845645553e-11,
          "token": " for"
        }
      ],
      [
        {
          "prob": 0.9999996423722521,
          "token": " Sk"
        },
        {
          "prob": 2.699578503363014e-07,
          "token": "Sk"
        },
        {
          "prob": 4.139937718785167e-08,
          "token": " SK"
        },
        {
          "prob": 1.522997974471263e-08,
          "token": "_sk"
        },
        {
          "prob": 1.5893910094516368e-10,
          "token": " sk"
        }
      ],
      [
        {
          "prob": 0.9999992847447459,
          "token": "ol"
        },
        {
          "prob": 6.47594599989589e-07,
          "token": "olk"
        },
        {
          "prob": 6.82560337633487e-08,
          "token": "olt"
        },
        {
          "prob": 3.6534822137210456e-08,
          "token": "ok"
        },
        {
          "prob": 1.7257827987960214e-08,
          "token": "\u043e\u043b"
        }
      ],
      [
        {
          "prob": 0.9997640213064081,
          "token": "tech"
        },
        {
          "prob": 0.000139808691721238,
          "token": "Tech"
        },
        {
          "prob": 6.604094975159243e-05,
          "token": "te"
        },
        {
          "prob": 1.1476196267546911e-05,
          "token": " tech"
        },
        {
          "prob": 6.142765208131464e-06,
          "token": "itech"
        }
      ],
      [
        {
          "prob": 0.9999994039539004,
          "token": "."
        },
        {
          "prob": 6.47594599989589e-07,
          "token": ","
        },
        {
          "prob": 1.0467401794744658e-08,
          "token": " during"
        },
        {
          "prob": 8.592166619174109e-10,
          "token": "\u3002"
        },
        {
          "prob": 6.691586091292782e-10,
          "token": ".\n\n"
        }
      ],
      [
        {
          "prob": 0.999579368203004,
          "token": ""
        },
        {
          "prob": 0.0003799691205054469,
          "token": " During"
        },
        {
          "prob": 1.0125834077159042e-05,
          "token": " For"
        },
        {
          "prob": 3.4993946191949675e-06,
          "token": " Initially"
        },
        {
          "prob": 2.5602117952548203e-06,
          "token": " However"
        }
      ]
    ],
    "language_consistency_score": 0.6729153886425847
  },
  {
    "question": "Is the Innovation Workshop (IW) course at Skoltech mandatory for all students?\n",
    "true_answer": "Yes, the Innovation Workshop (IW) course is mandatory for all Skoltech students. \n",
    "source_doc": "We bet your first impression from IW was that it\u2019s an optional class because it doesn\u2019t have any textbook learning. Well, this course sets the foundation to your entire Skoltech curriculum and is definitely not an optional class. In fact:\n\n- You must be present in class at all times, every day.",
    "context": "Sim: 1.73 - IW ground rules. We bet your first impression from IW was that it\u2019s an optional class because it doesn\u2019t have any textbook learning. Well, this course sets the foundation to your entire Skoltech curriculum and is definitely not an optional class. In fact:",
    "generated_answer": "Yes, the Innovation Workshop (IW) course at Skoltech is not an optional class and is mandatory for all students.",
    "logprobs": [
      [
        {
          "prob": 0.9999841454156853,
          "token": "Yes"
        },
        {
          "prob": 1.1478713790975014e-05,
          "token": " Yes"
        },
        {
          "prob": 1.2098475325363445e-06,
          "token": "No"
        },
        {
          "prob": 1.2098475325363445e-06,
          "token": "The"
        },
        {
          "prob": 9.42230205736312e-07,
          "token": "yes"
        }
      ],
      [
        {
          "prob": 0.9978172842081096,
          "token": ","
        },
        {
          "prob": 0.0021827169565025516,
          "token": "."
        },
        {
          "prob": 2.3537149798262404e-08,
          "token": ".,"
        },
        {
          "prob": 1.0444546909954374e-08,
          "token": "\uff0c"
        },
        {
          "prob": 9.811743802379262e-09,
          "token": "repid"
        }
      ],
      [
        {
          "prob": 0.9999763971175267,
          "token": " the"
        },
        {
          "prob": 1.892505520019597e-05,
          "token": " it"
        },
        {
          "prob": 2.5612277057870513e-06,
          "token": " despite"
        },
        {
          "prob": 9.422230171177557e-07,
          "token": " IW"
        },
        {
          "prob": 5.714871481688603e-07,
          "token": " according"
        }
      ],
      [
        {
          "prob": 0.9984076386267751,
          "token": " Innovation"
        },
        {
          "prob": 0.0015010452356403136,
          "token": " IW"
        },
        {
          "prob": 6.59513248840604e-05,
          "token": " course"
        },
        {
          "prob": 1.4715729683381525e-05,
          "token": " innovation"
        },
        {
          "prob": 7.876762492026103e-06,
          "token": " Innov"
        }
      ],
      [
        {
          "prob": 0.9999988079084972,
          "token": " Workshop"
        },
        {
          "prob": 5.715002286213223e-07,
          "token": " workshop"
        },
        {
          "prob": 3.9278597995802437e-07,
          "token": " Work"
        },
        {
          "prob": 2.1024318473456359e-07,
          "token": " Workplace"
        },
        {
          "prob": 5.315775115378354e-08,
          "token": " Workout"
        }
      ],
      [
        {
          "prob": 0.9999151301890851,
          "token": " ("
        },
        {
          "prob": 8.48110364334263e-05,
          "token": " course"
        },
        {
          "prob": 3.850418769204835e-09,
          "token": "course"
        },
        {
          "prob": 3.397982637476857e-09,
          "token": " is"
        },
        {
          "prob": 2.3353970362557145e-09,
          "token": "\u8bfe\u7a0b"
        }
      ],
      [
        {
          "prob": 0.9998635239903881,
          "token": "IW"
        },
        {
          "prob": 0.00012339297516947235,
          "token": " IW"
        },
        {
          "prob": 1.3005523899243766e-05,
          "token": "_IW"
        },
        {
          "prob": 3.223743992990368e-08,
          "token": "IH"
        },
        {
          "prob": 2.8449440885396956e-08,
          "token": "IQ"
        }
      ],
      [
        {
          "prob": 1.0,
          "token": ")"
        },
        {
          "prob": 3.1608814543136926e-10,
          "token": "\uff09"
        },
        {
          "prob": 2.020683909022217e-11,
          "token": "]"
        },
        {
          "prob": 1.2256067444099483e-11,
          "token": " )"
        },
        {
          "prob": 3.97896253583724e-12,
          "token": "),"
        }
      ],
      [
        {
          "prob": 0.9999938011552557,
          "token": " course"
        },
        {
          "prob": 4.785090011545999e-06,
          "token": " is"
        },
        {
          "prob": 8.315239610716842e-07,
          "token": " class"
        },
        {
          "prob": 2.1024218221932638e-07,
          "token": "\u8bfe\u7a0b"
        },
        {
          "prob": 1.8553807460118162e-07,
          "token": " at"
        }
      ],
      [
        {
          "prob": 0.9999599472811979,
          "token": " at"
        },
        {
          "prob": 4.0063692636795675e-05,
          "token": " is"
        },
        {
          "prob": 3.160754849887909e-10,
          "token": "at"
        },
        {
          "prob": 1.3175986504329144e-10,
          "token": " for"
        },
        {
          "prob": 1.1627767278566899e-10,
          "token": " appears"
        }
      ],
      [
        {
          "prob": 0.9999998807907247,
          "token": " Sk"
        },
        {
          "prob": 1.2751905914873347e-07,
          "token": "Sk"
        },
        {
          "prob": 2.215948977336598e-08,
          "token": "_sk"
        },
        {
          "prob": 1.7087563700445755e-09,
          "token": " SK"
        },
        {
          "prob": 1.8010159636784437e-10,
          "token": " Sketch"
        }
      ],
      [
        {
          "prob": 0.9999998807907247,
          "token": "ol"
        },
        {
          "prob": 2.215948977336598e-08,
          "token": "\u043e\u043b"
        },
        {
          "prob": 1.7257827987960214e-08,
          "token": "oll"
        },
        {
          "prob": 1.3440409951135022e-08,
          "token": "ole"
        },
        {
          "prob": 1.186112015134383e-08,
          "token": "ok"
        }
      ],
      [
        {
          "prob": 0.9999177523560532,
          "token": "tech"
        },
        {
          "prob": 1.8923954283534773e-05,
          "token": "Tech"
        },
        {
          "prob": 1.4737990414824348e-05,
          "token": "te"
        },
        {
          "prob": 1.3006230891403943e-05,
          "token": " tech"
        },
        {
          "prob": 1.3006230891403943e-05,
          "token": "ten"
        }
      ],
      [
        {
          "prob": 0.9999828341569776,
          "token": " is"
        },
        {
          "prob": 1.6701414089010932e-05,
          "token": ","
        },
        {
          "prob": 2.6995321624244547e-07,
          "token": " appears"
        },
        {
          "prob": 1.8553595129857372e-07,
          "token": " sets"
        },
        {
          "prob": 1.7257531740251372e-08,
          "token": " was"
        }
      ],
      [
        {
          "prob": 0.8353351039880527,
          "token": " not"
        },
        {
          "prob": 0.16448722978105557,
          "token": " mandatory"
        },
        {
          "prob": 0.0001323683351078344,
          "token": " definitely"
        },
        {
          "prob": 2.0299341641780323e-05,
          "token": " required"
        },
        {
          "prob": 8.462024554936594e-06,
          "token": " compulsory"
        }
      ],
      [
        {
          "prob": 0.914889387293834,
          "token": " an"
        },
        {
          "prob": 0.08509797284756859,
          "token": " optional"
        },
        {
          "prob": 3.863441990209457e-06,
          "token": " considered"
        },
        {
          "prob": 3.008851647326072e-06,
          "token": " mandatory"
        },
        {
          "prob": 2.0679514786797646e-06,
          "token": " just"
        }
      ],
      [
        {
          "prob": 0.999997854237364,
          "token": " optional"
        },
        {
          "prob": 1.7603429545652396e-06,
          "token": "optional"
        },
        {
          "prob": 2.1024298423113373e-07,
          "token": " Optional"
        },
        {
          "prob": 4.139929822488149e-08,
          "token": "_optional"
        },
        {
          "prob": 2.845329381943118e-08,
          "token": " option"
        }
      ],
      [
        {
          "prob": 0.9999984502816872,
          "token": " class"
        },
        {
          "prob": 7.338201193668986e-07,
          "token": " course"
        },
        {
          "prob": 5.714996835964923e-07,
          "token": " or"
        },
        {
          "prob": 6.825590357542018e-08,
          "token": " and"
        },
        {
          "prob": 4.691155074157667e-08,
          "token": ","
        }
      ],
      [
        {
          "prob": 0.9860304845448213,
          "token": " and"
        },
        {
          "prob": 0.006643820352340417,
          "token": " for"
        },
        {
          "prob": 0.0058631508822689134,
          "token": "."
        },
        {
          "prob": 0.0013082457953350704,
          "token": ","
        },
        {
          "prob": 8.363339550794027e-05,
          "token": ";"
        }
      ],
      [
        {
          "prob": 0.9993793050960424,
          "token": " is"
        },
        {
          "prob": 0.0004304752005204864,
          "token": " sets"
        },
        {
          "prob": 0.00015836297620564112,
          "token": " appears"
        },
        {
          "prob": 1.0123806363155358e-05,
          "token": " serves"
        },
        {
          "prob": 6.957983573952502e-06,
          "token": " therefore"
        }
      ],
      [
        {
          "prob": 0.9856302054615995,
          "token": " mandatory"
        },
        {
          "prob": 0.004564373952429511,
          "token": " considered"
        },
        {
          "prob": 0.0040280458752568514,
          "token": " required"
        },
        {
          "prob": 0.0021560575893300087,
          "token": " definitely"
        },
        {
          "prob": 0.0013077150320347601,
          "token": " foundational"
        }
      ],
      [
        {
          "prob": 0.9967720140288039,
          "token": " for"
        },
        {
          "prob": 0.003172506108990777,
          "token": "."
        },
        {
          "prob": 5.1278809775231705e-05,
          "token": " based"
        },
        {
          "prob": 2.8929524858671335e-06,
          "token": ","
        },
        {
          "prob": 7.314529372089826e-07,
          "token": " as"
        }
      ],
      [
        {
          "prob": 0.9769244536829683,
          "token": " all"
        },
        {
          "prob": 0.022975061193414133,
          "token": " students"
        },
        {
          "prob": 3.914076905887583e-05,
          "token": " its"
        },
        {
          "prob": 2.374007647893979e-05,
          "token": " setting"
        },
        {
          "prob": 1.2707147249267391e-05,
          "token": " establishing"
        }
      ],
      [
        {
          "prob": 0.9999970197767496,
          "token": " students"
        },
        {
          "prob": 2.561281443046568e-06,
          "token": "students"
        },
        {
          "prob": 2.382362851497276e-07,
          "token": "\u5b66\u751f"
        },
        {
          "prob": 4.691146126497983e-08,
          "token": "_students"
        },
        {
          "prob": 1.7257762154696544e-08,
          "token": "\u5b66\u751f\u4eec"
        }
      ],
      [
        {
          "prob": 0.9965801766700525,
          "token": "."
        },
        {
          "prob": 0.002470275494951086,
          "token": " based"
        },
        {
          "prob": 0.0006245834576698026,
          "token": ","
        },
        {
          "prob": 0.00017894615666192194,
          "token": " according"
        },
        {
          "prob": 0.0001393634069359231,
          "token": " as"
        }
      ],
      [
        {
          "prob": 0.9999988079084972,
          "token": ""
        },
        {
          "prob": 2.3823673954981372e-07,
          "token": ""
        },
        {
          "prob": 1.4449788680693535e-07,
          "token": "<tool_call>"
        },
        {
          "prob": 1.1142469957177438e-08,
          "token": " It"
        },
        {
          "prob": 7.658100140818556e-09,
          "token": " However"
        }
      ]
    ],
    "language_consistency_score": 0.7800245346714803
  },
  {
    "question": "Is the Introduction Week (IW) course at Skoltech mandatory for all students?\n",
    "true_answer": "Yes, IW is mandatory and students are required to be present in class every day. \n",
    "source_doc": "We bet your first impression from IW was that it\u2019s an optional class because it doesn\u2019t have any textbook learning. Well, this course sets the foundation to your entire Skoltech curriculum and is definitely not an optional class. In fact:\n\n- You must be present in class at all times, every day.",
    "context": "Sim: 0.85 - IW ground rules. We bet your first impression from IW was that it\u2019s an optional class because it doesn\u2019t have any textbook learning. Well, this course sets the foundation to your entire Skoltech curriculum and is definitely not an optional class. In fact:",
    "generated_answer": "Yes, the Introduction Week (IW) course at Skoltech is not an optional class and is mandatory for all students.",
    "logprobs": [
      [
        {
          "prob": 0.9999896288992495,
          "token": "Yes"
        },
        {
          "prob": 8.939682442190776e-06,
          "token": " Yes"
        },
        {
          "prob": 6.475884240756635e-07,
          "token": "yes"
        },
        {
          "prob": 5.043423717781038e-07,
          "token": " yes"
        },
        {
          "prob": 1.855371898888086e-07,
          "token": "The"
        }
      ],
      [
        {
          "prob": 0.9975274099865513,
          "token": ","
        },
        {
          "prob": 0.002472623024627213,
          "token": "."
        },
        {
          "prob": 1.7215154963767096e-08,
          "token": ".,"
        },
        {
          "prob": 1.0441519297228873e-08,
          "token": "\uff0c"
        },
        {
          "prob": 9.808899623435787e-09,
          "token": "\u3002"
        }
      ],
      [
        {
          "prob": 0.9999879600069962,
          "token": " the"
        },
        {
          "prob": 6.9622184069974415e-06,
          "token": " it"
        },
        {
          "prob": 3.7266069701906588e-06,
          "token": " IW"
        },
        {
          "prob": 7.338124213278687e-07,
          "token": " despite"
        },
        {
          "prob": 2.3823401316229748e-07,
          "token": " Introduction"
        }
      ],
      [
        {
          "prob": 0.9987850662770116,
          "token": " Introduction"
        },
        {
          "prob": 0.0011694573304292365,
          "token": " IW"
        },
        {
          "prob": 2.1419347946381545e-05,
          "token": "Introduction"
        },
        {
          "prob": 1.6681404953520835e-05,
          "token": " introduction"
        },
        {
          "prob": 6.1367459322557745e-06,
          "token": " Intro"
        }
      ],
      [
        {
          "prob": 0.9999530337451736,
          "token": " Week"
        },
        {
          "prob": 3.120142690557697e-05,
          "token": " to"
        },
        {
          "prob": 1.3006689836710169e-05,
          "token": "Week"
        },
        {
          "prob": 9.422014515911525e-07,
          "token": "_week"
        },
        {
          "prob": 8.314898626399016e-07,
          "token": " week"
        }
      ],
      [
        {
          "prob": 0.9975272915365344,
          "token": " ("
        },
        {
          "prob": 0.002472623024627213,
          "token": " course"
        },
        {
          "prob": 6.008679488939874e-08,
          "token": " class"
        },
        {
          "prob": 1.950732621649838e-08,
          "token": "course"
        },
        {
          "prob": 1.5192320933038285e-08,
          "token": "\u8bfe\u7a0b"
        }
      ],
      [
        {
          "prob": 0.9998727006874217,
          "token": "IW"
        },
        {
          "prob": 0.00012339415194219605,
          "token": " IW"
        },
        {
          "prob": 3.7261805182703215e-06,
          "token": "_IW"
        },
        {
          "prob": 4.690564565224236e-08,
          "token": "IQ"
        },
        {
          "prob": 4.690564565224236e-08,
          "token": "I"
        }
      ],
      [
        {
          "prob": 1.0,
          "token": ")"
        },
        {
          "prob": 1.917171513758312e-10,
          "token": "\uff09"
        },
        {
          "prob": 2.289734845645553e-11,
          "token": "]"
        },
        {
          "prob": 2.020683909022217e-11,
          "token": " )"
        },
        {
          "prob": 3.97896253583724e-12,
          "token": "))"
        }
      ],
      [
        {
          "prob": 0.9999983310727032,
          "token": " course"
        },
        {
          "prob": 1.553497204890439e-06,
          "token": " class"
        },
        {
          "prob": 6.825590357542018e-08,
          "token": "\u8bfe\u7a0b"
        },
        {
          "prob": 4.139929822488149e-08,
          "token": "course"
        },
        {
          "prob": 8.152005165739432e-09,
          "token": " at"
        }
      ],
      [
        {
          "prob": 0.9999996423722521,
          "token": " at"
        },
        {
          "prob": 3.927863545481039e-07,
          "token": " is"
        },
        {
          "prob": 1.917171513758312e-10,
          "token": "at"
        },
        {
          "prob": 2.9400777392844726e-11,
          "token": " for"
        },
        {
          "prob": 1.783247290814639e-11,
          "token": "_at"
        }
      ],
      [
        {
          "prob": 0.9999998807907247,
          "token": " Sk"
        },
        {
          "prob": 8.764248219443636e-08,
          "token": "Sk"
        },
        {
          "prob": 1.186112015134383e-08,
          "token": "_sk"
        },
        {
          "prob": 2.646573638909117e-09,
          "token": " SK"
        },
        {
          "prob": 1.5893910094516368e-10,
          "token": " Sketch"
        }
      ],
      [
        {
          "prob": 0.9999998807907247,
          "token": "ol"
        },
        {
          "prob": 1.9555681087850496e-08,
          "token": "\u043e\u043b"
        },
        {
          "prob": 1.9555681087850496e-08,
          "token": "ole"
        },
        {
          "prob": 1.522997974471263e-08,
          "token": "ok"
        },
        {
          "prob": 1.3440409951135022e-08,
          "token": "oll"
        }
      ],
      [
        {
          "prob": 0.9999482658453687,
          "token": "tech"
        },
        {
          "prob": 3.120127812593431e-05,
          "token": "Tech"
        },
        {
          "prob": 8.939315851249103e-06,
          "token": "te"
        },
        {
          "prob": 3.726461260295806e-06,
          "token": " tech"
        },
        {
          "prob": 1.99463097750661e-06,
          "token": "techn"
        }
      ],
      [
        {
          "prob": 0.9999724634116024,
          "token": " is"
        },
        {
          "prob": 2.7535687796947383e-05,
          "token": ","
        },
        {
          "prob": 3.653384656523305e-08,
          "token": " appears"
        },
        {
          "prob": 2.510932105727906e-08,
          "token": " sets"
        },
        {
          "prob": 1.5229573065807787e-08,
          "token": " was"
        }
      ],
      [
        {
          "prob": 0.4999679923779601,
          "token": " not"
        },
        {
          "prob": 0.4999679923779601,
          "token": " mandatory"
        },
        {
          "prob": 2.0031359137806108e-05,
          "token": " definitely"
        },
        {
          "prob": 1.376733837502571e-05,
          "token": "mandatory"
        },
        {
          "prob": 1.376733837502571e-05,
          "token": " required"
        }
      ],
      [
        {
          "prob": 0.6224458436370541,
          "token": " an"
        },
        {
          "prob": 0.37753247692522435,
          "token": " optional"
        },
        {
          "prob": 1.1780108072270489e-05,
          "token": " mandatory"
        },
        {
          "prob": 2.628497400731525e-06,
          "token": " just"
        },
        {
          "prob": 2.047075833990864e-06,
          "token": " merely"
        }
      ],
      [
        {
          "prob": 0.9999958276922101,
          "token": " optional"
        },
        {
          "prob": 3.7266389560521204e-06,
          "token": "optional"
        },
        {
          "prob": 3.0590115357930596e-07,
          "token": " Optional"
        },
        {
          "prob": 6.825577338773997e-08,
          "token": " option"
        },
        {
          "prob": 5.315764976351624e-08,
          "token": "_optional"
        }
      ],
      [
        {
          "prob": 0.9999990463265931,
          "token": " class"
        },
        {
          "prob": 6.47594599989589e-07,
          "token": " course"
        },
        {
          "prob": 9.931194312156244e-08,
          "token": " and"
        },
        {
          "prob": 5.3157852544244216e-08,
          "token": "class"
        },
        {
          "prob": 4.691164021834418e-08,
          "token": " or"
        }
      ],
      [
        {
          "prob": 0.9979947564648963,
          "token": " and"
        },
        {
          "prob": 0.001031225390419222,
          "token": " for"
        },
        {
          "prob": 0.0007087501548521658,
          "token": "."
        },
        {
          "prob": 0.00017920010267937308,
          "token": ","
        },
        {
          "prob": 6.592403363155285e-05,
          "token": ";"
        }
      ],
      [
        {
          "prob": 0.9985844888531713,
          "token": " is"
        },
        {
          "prob": 0.0013249021342740868,
          "token": " sets"
        },
        {
          "prob": 6.59630245934465e-05,
          "token": " serves"
        },
        {
          "prob": 6.952451641904448e-06,
          "token": " appears"
        },
        {
          "prob": 5.414574782981259e-06,
          "token": " therefore"
        }
      ],
      [
        {
          "prob": 0.9968366870482418,
          "token": " mandatory"
        },
        {
          "prob": 0.0011671760197448655,
          "token": " required"
        },
        {
          "prob": 0.0010300292221958605,
          "token": " considered"
        },
        {
          "prob": 0.00033440152843708794,
          "token": " definitely"
        },
        {
          "prob": 0.00022983058530612492,
          "token": " therefore"
        }
      ],
      [
        {
          "prob": 0.9989613365283372,
          "token": " for"
        },
        {
          "prob": 0.001032224570865803,
          "token": "."
        },
        {
          "prob": 6.137828732313689e-06,
          "token": " based"
        },
        {
          "prob": 2.3798944690224581e-07,
          "token": ","
        },
        {
          "prob": 7.726386114206306e-08,
          "token": " according"
        }
      ],
      [
        {
          "prob": 0.9963927921666721,
          "token": " all"
        },
        {
          "prob": 0.003593552725058796,
          "token": " students"
        },
        {
          "prob": 5.402690585087764e-06,
          "token": " setting"
        },
        {
          "prob": 2.8918518804201755e-06,
          "token": " its"
        },
        {
          "prob": 1.7539968288224686e-06,
          "token": " establishing"
        }
      ],
      [
        {
          "prob": 0.9999982118638471,
          "token": " students"
        },
        {
          "prob": 1.553497204890439e-06,
          "token": "students"
        },
        {
          "prob": 1.6373740075447596e-07,
          "token": "\u5b66\u751f"
        },
        {
          "prob": 2.5109943663977427e-08,
          "token": "_students"
        },
        {
          "prob": 1.7257795071296986e-08,
          "token": "\u5b66\u751f\u4eec"
        }
      ],
      [
        {
          "prob": 0.9992748992240552,
          "token": "."
        },
        {
          "prob": 0.00043043024948847235,
          "token": " based"
        },
        {
          "prob": 0.0002033207561954099,
          "token": ","
        },
        {
          "prob": 6.600858516400529e-05,
          "token": " as"
        },
        {
          "prob": 2.4283201422651823e-05,
          "token": " according"
        }
      ],
      [
        {
          "prob": 0.9999988079084972,
          "token": ""
        },
        {
          "prob": 2.3823673954981372e-07,
          "token": ""
        },
        {
          "prob": 1.3574320241537807e-07,
          "token": "<tool_call>"
        },
        {
          "prob": 1.3440384315611926e-08,
          "token": " It"
        },
        {
          "prob": 7.19411930861867e-09,
          "token": " However"
        }
      ]
    ],
    "language_consistency_score": 0.6851370238574286
  },
  {
    "question": "What is the name of the document that provides information about academic leave of absence at Skoltech?\n",
    "true_answer": "REGULATIONS ON ACADEMIC LEAVE OF ABSENCE \n",
    "source_doc": "The Independent Studies Period is mandatory to maintain full-time status. * Attendance Policy  \n  1. Students are expected to attend all educational curriculum elements full-time, unless the Course Instructor specifies otherwise. 2. Skoltech strongly advises you to focus on your course and research work, and avoid taking on jobs in addition to your studies. Academic Integrity   \n  3. Please ensure to clarify course collaboration policy, be aware of plagiarism. Review the Academic Integrity section above for more information. **Academic Leave and Return**   \nIn exceptional cases, you may request a leave of absence and temporarily stop your studies. Academic leave of absence may be granted on the following grounds:\n\n* for medical reasons;  \n* in case of call to military service;  \n* in other exceptional cases. You will need to apply for academic leave in written form, stating the reason for your request. Your application will be reviewed within 10 days of submission. Likewise, when you return from academic leave or wish to end it earlier, you will need to request reinstatement in written form. More information and instructions about this process can be found [here (links to an external site)](https://www.skoltech.ru/app/data/uploads/sites/2/2015/04/11.-REGULATIONS-ON-ACADEMIC-LEAVE-OF-ABSENCE.pdf)\n\nContact the [Education Department (links to an external site)](https://helpdesk.skoltech.ru/servicedesk/customer/portal/21)for support. **Withdrawal and Reinstatement** \n\nIf you wish to end (or resume) your education at Skoltech, please contact the [Education Department  (links to an external site)](https://helpdesk.skoltech.ru/servicedesk/customer/portal/21)\n\n What\u2019s next? The [third part](https://skoltech.instructure.com/courses/3974/assignments/22741) of Education module tells about library resources and intellectual property management. ## \u201cEducation Process, Part 3\u201d \\- Module 3.3\n",
    "context": "",
    "generated_answer": "The Academic Calendar and Regulations document provides information about academic leave of absence at Skoltech.",
    "logprobs": [
      [
        {
          "prob": 0.9744989738928032,
          "token": "The"
        },
        {
          "prob": 0.007440392327241309,
          "token": "Reg"
        },
        {
          "prob": 0.004512826066762487,
          "token": "There"
        },
        {
          "prob": 0.004512826066762487,
          "token": "Sk"
        },
        {
          "prob": 0.0031016169727342896,
          "token": "Ac"
        }
      ],
      [
        {
          "prob": 0.49622022449874525,
          "token": " Academic"
        },
        {
          "prob": 0.34104684021723697,
          "token": " document"
        },
        {
          "prob": 0.05230122063929026,
          "token": " Sk"
        },
        {
          "prob": 0.03376820603613781,
          "token": " Regulations"
        },
        {
          "prob": 0.0116699797372032,
          "token": " policy"
        }
      ],
      [
        {
          "prob": 0.776566797667544,
          "token": " Calendar"
        },
        {
          "prob": 0.11909036486166967,
          "token": " Leave"
        },
        {
          "prob": 0.03411996079269859,
          "token": " Regulations"
        },
        {
          "prob": 0.026572652183719292,
          "token": " Handbook"
        },
        {
          "prob": 0.016117132101928888,
          "token": " Regulation"
        }
      ],
      [
        {
          "prob": 0.8557387864194049,
          "token": " and"
        },
        {
          "prob": 0.1312317951747733,
          "token": " provides"
        },
        {
          "prob": 0.005765921299171684,
          "token": "."
        },
        {
          "prob": 0.004490504022923,
          "token": " &"
        },
        {
          "prob": 0.0011353772221154392,
          "token": " document"
        }
      ],
      [
        {
          "prob": 0.3181659261518588,
          "token": " Regulations"
        },
        {
          "prob": 0.3181659261518588,
          "token": " Handbook"
        },
        {
          "prob": 0.24778787243370642,
          "token": " Rules"
        },
        {
          "prob": 0.04305908086504314,
          "token": " Regulation"
        },
        {
          "prob": 0.01397923684501896,
          "token": " Catalog"
        }
      ],
      [
        {
          "prob": 0.8588505432141356,
          "token": " document"
        },
        {
          "prob": 0.11623277632779358,
          "token": " provide"
        },
        {
          "prob": 0.007430514564325987,
          "token": " of"
        },
        {
          "prob": 0.006557406087627408,
          "token": " Document"
        },
        {
          "prob": 0.002128878065818901,
          "token": " for"
        }
      ],
      [
        {
          "prob": 0.9996814550723234,
          "token": " provides"
        },
        {
          "prob": 0.0002034035691171764,
          "token": " at"
        },
        {
          "prob": 3.11929475981047e-05,
          "token": "\u63d0\u4f9b"
        },
        {
          "prob": 2.429309201570924e-05,
          "token": " provided"
        },
        {
          "prob": 2.429309201570924e-05,
          "token": "."
        }
      ],
      [
        {
          "prob": 0.9999840262101118,
          "token": " information"
        },
        {
          "prob": 1.0129929366190528e-05,
          "token": " this"
        },
        {
          "prob": 1.9947013611967364e-06,
          "token": "\u4fe1\u606f"
        },
        {
          "prob": 1.7603177728373962e-06,
          "token": " the"
        },
        {
          "prob": 1.2098475325363445e-06,
          "token": "information"
        }
      ],
      [
        {
          "prob": 0.9999985694905718,
          "token": " about"
        },
        {
          "prob": 1.2098659934854867e-06,
          "token": "\u5173\u4e8e"
        },
        {
          "prob": 2.1024318473456359e-07,
          "token": "about"
        },
        {
          "prob": 5.602785751061334e-09,
          "token": " on"
        },
        {
          "prob": 1.2501504819116561e-09,
          "token": " regarding"
        }
      ],
      [
        {
          "prob": 0.9999955892755635,
          "token": " academic"
        },
        {
          "prob": 2.5612765577945685e-06,
          "token": " the"
        },
        {
          "prob": 1.2098613782217925e-06,
          "token": "\u5b66\u672f"
        },
        {
          "prob": 5.043452576565602e-07,
          "token": "academic"
        },
        {
          "prob": 1.1253474543245463e-07,
          "token": " an"
        }
      ],
      [
        {
          "prob": 0.9999961853172863,
          "token": " leave"
        },
        {
          "prob": 1.9947260911909763e-06,
          "token": "leave"
        },
        {
          "prob": 1.760339596980714e-06,
          "token": " leaves"
        },
        {
          "prob": 5.315764976351624e-08,
          "token": "_leave"
        },
        {
          "prob": 3.6534682768190175e-08,
          "token": " Leave"
        }
      ],
      [
        {
          "prob": 1.0,
          "token": " of"
        },
        {
          "prob": 2.289734845645553e-11,
          "token": "of"
        },
        {
          "prob": 2.020683909022217e-11,
          "token": "_of"
        },
        {
          "prob": 1.783247290814639e-11,
          "token": " c\u1ee7a"
        },
        {
          "prob": 1.3887943864964021e-11,
          "token": "-of"
        }
      ],
      [
        {
          "prob": 0.9999986886995842,
          "token": " absence"
        },
        {
          "prob": 9.422445831379603e-07,
          "token": " abs"
        },
        {
          "prob": 2.3823673954981372e-07,
          "token": " absent"
        },
        {
          "prob": 6.825590357542018e-08,
          "token": "abs"
        },
        {
          "prob": 1.7257795071296986e-08,
          "token": "_abs"
        }
      ],
      [
        {
          "prob": 0.9999998807907247,
          "token": " at"
        },
        {
          "prob": 6.82560337633487e-08,
          "token": " policies"
        },
        {
          "prob": 6.34880011604368e-09,
          "token": "at"
        },
        {
          "prob": 1.103256032343554e-09,
          "token": " rules"
        },
        {
          "prob": 8.592166619174109e-10,
          "token": " regulations"
        }
      ],
      [
        {
          "prob": 0.9999995231630692,
          "token": " Sk"
        },
        {
          "prob": 3.927863545481039e-07,
          "token": "Sk"
        },
        {
          "prob": 8.764248219443636e-08,
          "token": " SK"
        },
        {
          "prob": 9.237449661970594e-09,
          "token": "_sk"
        },
        {
          "prob": 7.507751520922312e-11,
          "token": " Ski"
        }
      ],
      [
        {
          "prob": 0.9999916554191085,
          "token": "ol"
        },
        {
          "prob": 7.889257112872668e-06,
          "token": "olk"
        },
        {
          "prob": 2.699555332794298e-07,
          "token": "olt"
        },
        {
          "prob": 3.224162138757908e-08,
          "token": "\u043e\u043b"
        },
        {
          "prob": 2.2159320710520812e-08,
          "token": "\u00f6"
        }
      ],
      [
        {
          "prob": 0.9999338432228186,
          "token": "tech"
        },
        {
          "prob": 3.5355174278667855e-05,
          "token": "Tech"
        },
        {
          "prob": 1.0129427024666352e-05,
          "token": "itech"
        },
        {
          "prob": 7.888805698874806e-06,
          "token": "tek"
        },
        {
          "prob": 4.222573407688479e-06,
          "token": " tech"
        }
      ],
      [
        {
          "prob": 1.0,
          "token": "."
        },
        {
          "prob": 3.398267819495071e-09,
          "token": ".\n\n"
        },
        {
          "prob": 2.335593038799337e-09,
          "token": ","
        },
        {
          "prob": 1.8189616875530459e-09,
          "token": "\u3002"
        },
        {
          "prob": 8.592166619174109e-10,
          "token": ".\n"
        }
      ],
      [
        {
          "prob": 0.999998927117538,
          "token": ""
        },
        {
          "prob": 4.4508482557577276e-07,
          "token": ""
        },
        {
          "prob": 2.3823673954981372e-07,
          "token": "<tool_call>"
        },
        {
          "prob": 2.0816874453306735e-08,
          "token": " However"
        },
        {
          "prob": 4.9444410711567335e-09,
          "token": "UrlParser"
        }
      ]
    ],
    "language_consistency_score": 0.6127337008468609
  },
  {
    "question": "What department should students contact if they want to end their studies at Skoltech?\n",
    "true_answer": "The Education Department. \n",
    "source_doc": "The Independent Studies Period is mandatory to maintain full-time status. * Attendance Policy  \n  1. Students are expected to attend all educational curriculum elements full-time, unless the Course Instructor specifies otherwise. 2. Skoltech strongly advises you to focus on your course and research work, and avoid taking on jobs in addition to your studies. Academic Integrity   \n  3. Please ensure to clarify course collaboration policy, be aware of plagiarism. Review the Academic Integrity section above for more information. **Academic Leave and Return**   \nIn exceptional cases, you may request a leave of absence and temporarily stop your studies. Academic leave of absence may be granted on the following grounds:\n\n* for medical reasons;  \n* in case of call to military service;  \n* in other exceptional cases. You will need to apply for academic leave in written form, stating the reason for your request. Your application will be reviewed within 10 days of submission. Likewise, when you return from academic leave or wish to end it earlier, you will need to request reinstatement in written form. More information and instructions about this process can be found [here (links to an external site)](https://www.skoltech.ru/app/data/uploads/sites/2/2015/04/11.-REGULATIONS-ON-ACADEMIC-LEAVE-OF-ABSENCE.pdf)\n\nContact the [Education Department (links to an external site)](https://helpdesk.skoltech.ru/servicedesk/customer/portal/21)for support. **Withdrawal and Reinstatement** \n\nIf you wish to end (or resume) your education at Skoltech, please contact the [Education Department  (links to an external site)](https://helpdesk.skoltech.ru/servicedesk/customer/portal/21)\n\n What\u2019s next? The [third part](https://skoltech.instructure.com/courses/3974/assignments/22741) of Education module tells about library resources and intellectual property management. ## \u201cEducation Process, Part 3\u201d \\- Module 3.3\n",
    "context": "Sim: 5.92 - If you wish to end (or resume) your education at Skoltech, please contact the [Education Department  (links to an external site)](https://helpdesk.skoltech.ru/servicedesk/customer/portal/21)\nSim: 1.12 - These trips are aimed to allow thesis research at highly ranked institutions and recognized research labs around the world. Skoltech competitively selects students\u2019 proposals and provides supporting grants for the approved academic trips. The selection is primarily based on the students\u2019 motivation and justification provided, showing how a trip contributes to the students\u2019 overall educational experience and path. Skoltech also looks at how a proposed mobility opportunity enables students to complete their degree at Skoltech and achieve their post-graduation career goals. The competition process includes primary screening by Education Department and assessment by the Programs. The call for applications is usually announced after Term 3 and the winning applicants schedule their trips to Term 6 \u2013 7\\. ",
    "generated_answer": "Students should contact the Education Department if they want to end their studies at Skoltech.",
    "logprobs": [
      [
        {
          "prob": 0.9728204075849592,
          "token": "Students"
        },
        {
          "prob": 0.02287854506939429,
          "token": "The"
        },
        {
          "prob": 0.0014625761051022836,
          "token": "students"
        },
        {
          "prob": 0.0011390554159551839,
          "token": "Education"
        },
        {
          "prob": 0.0008870972499076219,
          "token": "If"
        }
      ],
      [
        {
          "prob": 0.999998927117538,
          "token": " should"
        },
        {
          "prob": 5.715002286213223e-07,
          "token": "should"
        },
        {
          "prob": 3.4663241069161144e-07,
          "token": "\u5e94\u8be5"
        },
        {
          "prob": 8.76423150298272e-08,
          "token": "\u5e94"
        },
        {
          "prob": 5.602785751061334e-09,
          "token": " Should"
        }
      ],
      [
        {
          "prob": 0.9999973774024795,
          "token": " contact"
        },
        {
          "prob": 2.561281443046568e-06,
          "token": "contact"
        },
        {
          "prob": 4.691155074157667e-08,
          "token": "_contact"
        },
        {
          "prob": 9.237432042950414e-09,
          "token": ".contact"
        },
        {
          "prob": 4.363453930307876e-09,
          "token": "(contact"
        }
      ],
      [
        {
          "prob": 1.0,
          "token": " the"
        },
        {
          "prob": 2.289734845645553e-11,
          "token": " ["
        },
        {
          "prob": 1.0815941557285693e-11,
          "token": "the"
        },
        {
          "prob": 7.835041785064389e-13,
          "token": " Education"
        },
        {
          "prob": 2.8823507934443873e-13,
          "token": " The"
        }
      ],
      [
        {
          "prob": 0.9994465793045639,
          "token": " Education"
        },
        {
          "prob": 0.0005527782629881523,
          "token": " ["
        },
        {
          "prob": 6.472371115758032e-07,
          "token": "Education"
        },
        {
          "prob": 4.6885699106101895e-08,
          "token": " Educational"
        },
        {
          "prob": 6.345289368270898e-09,
          "token": " education"
        }
      ],
      [
        {
          "prob": 0.999998927117538,
          "token": " Department"
        },
        {
          "prob": 9.422445831379603e-07,
          "token": "Department"
        },
        {
          "prob": 1.275189375371399e-07,
          "token": " department"
        },
        {
          "prob": 4.139929822488149e-08,
          "token": "_department"
        },
        {
          "prob": 7.582545965339434e-10,
          "token": " Division"
        }
      ],
      [
        {
          "prob": 0.9976944556923488,
          "token": " if"
        },
        {
          "prob": 0.0019260030756768124,
          "token": " to"
        },
        {
          "prob": 0.00037925249207995123,
          "token": "."
        },
        {
          "prob": 1.4416492332692484e-07,
          "token": "\u5982\u679c"
        },
        {
          "prob": 7.716592280230049e-08,
          "token": "\tif"
        }
      ],
      [
        {
          "prob": 0.9999963045256735,
          "token": " they"
        },
        {
          "prob": 3.7266389560521204e-06,
          "token": "\u4ed6\u4eec"
        },
        {
          "prob": 5.602775064605783e-09,
          "token": "they"
        },
        {
          "prob": 2.9989493847514694e-09,
          "token": " \u043e\u043d\u0438"
        },
        {
          "prob": 1.6918914685490615e-10,
          "token": " They"
        }
      ],
      [
        {
          "prob": 0.9998746075477176,
          "token": " want"
        },
        {
