[
  {
    "question": "Is the Skoltech Orientation course part of the academic curriculum?\n",
    "true_answer": "No, the Orientation course is not part of the academic curriculum. \n",
    "source_doc": "\n### Video 1 \n\nHi there, and congratulations on your admission to Skoltech\\! It was a big challenge, but the fact that you’ve made it means you have every bit of potential to succeed in your studies here. We are happy to have you onboard. My name is CyberBoris, and I will be your guide for this intro course. And here is what our course is for:   \nSkoltech will provide you with the resources, opportunities and skills to succeed. Although your classroom work will begin a bit later, your actual Skoltech journey is starting right now with this Orientation course. Orientation is mandatory for every incoming student. You can’t bypass it, sorry. We do ask you to take this seriously, as the information you’ll learn in the course will serve as the foundation to your time at Skoltech. Here’s how it’s going to work: I’m gonna go through the main points and break them down for you. We’ll also do a tour of the Skoltech campus, and explain the key locations throughout so you don’t get lost when you get here for the first time. You can find the important information from the videos in the text below, along with links to resources from both Skoltech and other useful sources. For example, underneath this video you can find a link to STUDENT ACADEMIC INTEGRITY REGULATIONS, along with a description of the course, and links to the separate modules. Please note that a number of text questions will refer to the linked content, so study them in detail. Finally, we want to highlight that although Orientation is not part of your academic curriculum, it is still part of your education at Skoltech. Your performance in this course falls under the same rules and regulations as all academic and research activities.",
    "context": "Sim: 7.42 - Finally, we want to highlight that although Orientation is not part of your academic curriculum, it is still part of your education at Skoltech. Your performance in this course falls under the same rules and regulations as all academic and research activities. in the university as they relate to academic misconduct. That means: No copying or publishing any information or material from this course. Using your common sense and/or contacting Education if you have questions or technical issues with the course material.   \nSim: 2.50 - Skoltech will provide you with the resources, opportunities and skills to succeed. Although your classroom work will begin a bit later, your actual Skoltech journey is starting right now with this Orientation course. Orientation is mandatory for every incoming student. You can’t bypass it, sorry. We do ask you to take this seriously, as the information you’ll learn in the course will serve as the foundation to your time at Skoltech.\nSim: 2.05 - We bet one of the reasons why you got interested in Skoltech is its research-based curriculum, are we right? Even if not, every program dedicates time for students' independent research as part of your academic plan.\nSim: 1.28 - As you now know, your curriculum at Skoltech will comprise compulsory and elective courses in various disciplines. While you will certainly dive deep into your subject area studies throughout your studies, you will also get practical training in applying your knowledge. In this section, we will talk about a few compulsory courses within your Master’s program curriculum that will teach you about entrepreneurship, innovation, industrial application and your required research component.   \nSim: 0.25 - Our [next module](https://skoltech.instructure.com/courses/3974/assignments/22739) is devoted to the education process, student status requirements and detailed program curriculum.",
    "generated_answer": "Yes, the Skoltech Orientation course is considered part of the academic curriculum. \n",
    "logprobs": [
      [
        {
          "prob": 0.9996852673397341,
          "token": "Yes"
        },
        {
          "prob": 0.00013979762560665683,
          "token": " Yes"
        },
        {
          "prob": 0.00011589630228040046,
          "token": "The"
        },
        {
          "prob": 2.282133503200531e-05,
          "token": "According"
        },
        {
          "prob": 1.4734561334531459e-05,
          "token": "Based"
        }
      ],
      [
        {
          "prob": 0.9808229563583156,
          "token": ","
        },
        {
          "prob": 0.019123001464458278,
          "token": "."
        },
        {
          "prob": 1.445654357539344e-05,
          "token": " and"
        },
        {
          "prob": 1.0912371598586725e-05,
          "token": ";"
        },
        {
          "prob": 5.661263806422401e-06,
          "token": " because"
        }
      ],
      [
        {
          "prob": 0.7363236851410351,
          "token": " the"
        },
        {
          "prob": 0.14499073033364673,
          "token": " according"
        },
        {
          "prob": 0.08794131283806124,
          "token": " Sk"
        },
        {
          "prob": 0.022235045992514166,
          "token": " Orientation"
        },
        {
          "prob": 0.0022015676888452644,
          "token": "  "
        }
      ],
      [
        {
          "prob": 0.837116502520577,
          "token": " Sk"
        },
        {
          "prob": 0.14546902926747265,
          "token": " Orientation"
        },
        {
          "prob": 0.01440338439914967,
          "token": " orientation"
        },
        {
          "prob": 0.0006736552527836352,
          "token": " document"
        },
        {
          "prob": 0.0004085925648897391,
          "token": " course"
        }
      ],
      [
        {
          "prob": 0.9999280027712771,
          "token": "ol"
        },
        {
          "prob": 3.535497197531668e-05,
          "token": "ot"
        },
        {
          "prob": 1.2218351372287535e-05,
          "token": "olk"
        },
        {
          "prob": 6.961806758456941e-06,
          "token": "oland"
        },
        {
          "prob": 2.2601677414050805e-06,
          "token": "olat"
        }
      ],
      [
        {
          "prob": 0.9999556561097608,
          "token": "tech"
        },
        {
          "prob": 2.5866965439376575e-05,
          "token": "tek"
        },
        {
          "prob": 1.4738552635265146e-05,
          "token": "Tech"
        },
        {
          "prob": 1.0676571719351338e-06,
          "token": "test"
        },
        {
          "prob": 6.083327192694293e-07,
          "token": "tec"
        }
      ],
      [
        {
          "prob": 0.9956636930463456,
          "token": " Orientation"
        },
        {
          "prob": 0.004069049300720637,
          "token": " orientation"
        },
        {
          "prob": 0.00014821510994435298,
          "token": "Orientation"
        },
        {
          "prob": 3.989155566801716e-05,
          "token": " Orient"
        },
        {
          "prob": 1.8843436634377552e-05,
          "token": "  "
        }
      ],
      [
        {
          "prob": 0.991037596381243,
          "token": " course"
        },
        {
          "prob": 0.007566666345961185,
          "token": " is"
        },
        {
          "prob": 0.0012352243252145545,
          "token": " Course"
        },
        {
          "prob": 4.226705210163947e-05,
          "token": " program"
        },
        {
          "prob": 2.728965990587446e-05,
          "token": " courses"
        }
      ],
      [
        {
          "prob": 0.9449728408539678,
          "token": " is"
        },
        {
          "prob": 0.05331171703507709,
          "token": " falls"
        },
        {
          "prob": 0.00043329180596335246,
          "token": ","
        },
        {
          "prob": 0.00013214659765491138,
          "token": " fulfills"
        },
        {
          "prob": 0.00010291587373386685,
          "token": "  "
        }
      ],
      [
        {
          "prob": 0.5457615188380882,
          "token": " considered"
        },
        {
          "prob": 0.4250394982413424,
          "token": " part"
        },
        {
          "prob": 0.018674932221556254,
          "token": " a"
        },
        {
          "prob": 0.00472176231457932,
          "token": " included"
        },
        {
          "prob": 0.0008205192574401496,
          "token": " required"
        }
      ],
      [
        {
          "prob": 0.959831756961376,
          "token": " part"
        },
        {
          "prob": 0.03284363649664656,
          "token": " a"
        },
        {
          "prob": 0.003251961167923404,
          "token": " an"
        },
        {
          "prob": 0.0026959704994004444,
          "token": " to"
        },
        {
          "prob": 0.0008222245472704848,
          "token": " academic"
        }
      ],
      [
        {
          "prob": 0.9999821189265068,
          "token": " of"
        },
        {
          "prob": 6.962178568978139e-06,
          "token": " the"
        },
        {
          "prob": 4.2227747604794685e-06,
          "token": " academic"
        },
        {
          "prob": 2.56124236129147e-06,
          "token": "  "
        },
        {
          "prob": 1.5056767097195233e-06,
          "token": " and"
        }
      ],
      [
        {
          "prob": 0.9916734083794427,
          "token": " the"
        },
        {
          "prob": 0.0045923594776472645,
          "token": " your"
        },
        {
          "prob": 0.0014005905084093367,
          "token": " academic"
        },
        {
          "prob": 0.0013157330192522982,
          "token": " Sk"
        },
        {
          "prob": 0.00022864000625935545,
          "token": " an"
        }
      ],
      [
        {
          "prob": 0.9907503599865675,
          "token": " academic"
        },
        {
          "prob": 0.003153341475399971,
          "token": " university"
        },
        {
          "prob": 0.0021672577884093063,
          "token": " Sk"
        },
        {
          "prob": 0.0014895330423499496,
          "token": " curriculum"
        },
        {
          "prob": 0.00040090237965996174,
          "token": " educational"
        }
      ],
      [
        {
          "prob": 0.9992848983810337,
          "token": " curriculum"
        },
        {
          "prob": 0.0004304345596579288,
          "token": " and"
        },
        {
          "prob": 9.022398512767043e-05,
          "token": " program"
        },
        {
          "prob": 2.9291439386601255e-05,
          "token": " curricula"
        },
        {
          "prob": 2.1430074849580713e-05,
          "token": " course"
        }
      ],
      [
        {
          "prob": 0.9025658847334285,
          "token": "."
        },
        {
          "prob": 0.03499627850018895,
          "token": " and"
        },
        {
          "prob": 0.021226315886206652,
          "token": ","
        },
        {
          "prob": 0.014588615858622847,
          "token": " at"
        },
        {
          "prob": 0.009419118331742419,
          "token": " as"
        }
      ],
      [
        {
          "prob": 0.985310679326514,
          "token": " "
        },
        {
          "prob": 0.014054703586773253,
          "token": "  "
        },
        {
          "prob": 0.00017692260792554902,
          "token": " It"
        },
        {
          "prob": 0.00017692260792554902,
          "token": "\n"
        },
        {
          "prob": 0.00012943934507233067,
          "token": "   "
        }
      ],
      [
        {
          "prob": 0.9982163589648533,
          "token": "\n"
        },
        {
          "prob": 0.001324413871799667,
          "token": "\n\n\n"
        },
        {
          "prob": 0.000429974231283387,
          "token": "\n\n"
        },
        {
          "prob": 1.8891749259673805e-05,
          "token": ""
        },
        {
          "prob": 4.4871837583037364e-06,
          "token": "\n\n\n\n\n"
        }
      ],
      [
        {
          "prob": 0.9998734157650628,
          "token": ""
        },
        {
          "prob": 0.0001159180782092898,
          "token": " "
        },
        {
          "prob": 3.7261805182703215e-06,
          "token": "  "
        },
        {
          "prob": 7.810498672100387e-07,
          "token": "It"
        },
        {
          "prob": 3.465887776136393e-07,
          "token": "The"
        }
      ]
    ],
    "language_consistency_score": 0.7087980991836972
  },
  {
    "question": "What should students do if they have questions or technical issues with the course material?\n",
    "true_answer": "Students should contact Education. \n",
    "source_doc": "in the university as they relate to academic misconduct. That means: No copying or publishing any information or material from this course. Using your common sense and/or contacting Education if you have questions or technical issues with the course material. You can find a link to Education in the description of this video. ",
    "context": "",
    "generated_answer": "Students should contact their instructor or TA for assistance with course material questions or technical issues. \n",
    "logprobs": [
      [
        {
          "prob": 0.6517016097113522,
          "token": "Students"
        },
        {
          "prob": 0.2716696330592368,
          "token": "The"
        },
        {
          "prob": 0.047209103452439,
          "token": "Please"
        },
        {
          "prob": 0.008203714029607958,
          "token": "According"
        },
        {
          "prob": 0.0034198167992472877,
          "token": "To"
        }
      ],
      [
        {
          "prob": 0.8460474589313465,
          "token": " should"
        },
        {
          "prob": 0.12974558001365263,
          "token": " can"
        },
        {
          "prob": 0.022546401084237673,
          "token": " are"
        },
        {
          "prob": 0.00046793551437368514,
          "token": " may"
        },
        {
          "prob": 0.0003021218753186475,
          "token": " who"
        }
      ],
      [
        {
          "prob": 0.5034248158978206,
          "token": " contact"
        },
        {
          "prob": 0.26946388610937716,
          "token": " reach"
        },
        {
          "prob": 0.16343810861065045,
          "token": " consult"
        },
        {
          "prob": 0.046825807688779024,
          "token": " refer"
        },
        {
          "prob": 0.010448249968676842,
          "token": " seek"
        }
      ],
      [
        {
          "prob": 0.6779808937030626,
          "token": " their"
        },
        {
          "prob": 0.32025551667150376,
          "token": " the"
        },
        {
          "prob": 0.00039916483255360676,
          "token": " course"
        },
        {
          "prob": 0.00039916483255360676,
          "token": " instructors"
        },
        {
          "prob": 0.00029203509076887197,
          "token": " a"
        }
      ],
      [
        {
          "prob": 0.6851604646811854,
          "token": " instructor"
        },
        {
          "prob": 0.2520564563715479,
          "token": " instructors"
        },
        {
          "prob": 0.03010384716658643,
          "token": " course"
        },
        {
          "prob": 0.023444899746799405,
          "token": " professor"
        },
        {
          "prob": 0.003172922147687087,
          "token": " teacher"
        }
      ],
      [
        {
          "prob": 0.6439969230284778,
          "token": " or"
        },
        {
          "prob": 0.2684578580003962,
          "token": " for"
        },
        {
          "prob": 0.032062718835512836,
          "token": "."
        },
        {
          "prob": 0.02497047053649568,
          "token": " directly"
        },
        {
          "prob": 0.011795212275447454,
          "token": ","
        }
      ],
      [
        {
          "prob": 0.25416909464427934,
          "token": " TA"
        },
        {
          "prob": 0.19794708994151475,
          "token": " the"
        },
        {
          "prob": 0.1360469126846754,
          "token": " teaching"
        },
        {
          "prob": 0.1360469126846754,
          "token": " seek"
        },
        {
          "prob": 0.08251662370250319,
          "token": " course"
        }
      ],
      [
        {
          "prob": 0.874791644125869,
          "token": " for"
        },
        {
          "prob": 0.0633696960446354,
          "token": "."
        },
        {
          "prob": 0.01815572189236026,
          "token": " directly"
        },
        {
          "prob": 0.01815572189236026,
          "token": " with"
        },
        {
          "prob": 0.0066791168238256125,
          "token": " if"
        }
      ],
      [
        {
          "prob": 0.6923803247551085,
          "token": " assistance"
        },
        {
          "prob": 0.12031764505721321,
          "token": " questions"
        },
        {
          "prob": 0.093703476187865,
          "token": " help"
        },
        {
          "prob": 0.034471582455813325,
          "token": " any"
        },
        {
          "prob": 0.030421064744444743,
          "token": " support"
        }
      ],
      [
        {
          "prob": 0.8746360412262828,
          "token": " with"
        },
        {
          "prob": 0.10446038478303185,
          "token": "."
        },
        {
          "prob": 0.012476013820921164,
          "token": " regarding"
        },
        {
          "prob": 0.002783774961876163,
          "token": " if"
        },
        {
          "prob": 0.002783774961876163,
          "token": " on"
        }
      ],
      [
        {
          "prob": 0.4845821861399585,
          "token": " course"
        },
        {
          "prob": 0.42764227831618523,
          "token": " questions"
        },
        {
          "prob": 0.0743130850891363,
          "token": " any"
        },
        {
          "prob": 0.004750676589420555,
          "token": " technical"
        },
        {
          "prob": 0.0028814310058626123,
          "token": " their"
        }
      ],
      [
        {
          "prob": 0.8588100133149741,
          "token": " material"
        },
        {
          "prob": 0.11622728947073463,
          "token": " materials"
        },
        {
          "prob": 0.013881373484662032,
          "token": "-"
        },
        {
          "prob": 0.005436023962595776,
          "token": " content"
        },
        {
          "prob": 0.004797274309366411,
          "token": " questions"
        }
      ],
      [
        {
          "prob": 0.8476855437681298,
          "token": " questions"
        },
        {
          "prob": 0.06958226669370583,
          "token": "."
        },
        {
          "prob": 0.025597885386722766,
          "token": "-"
        },
        {
          "prob": 0.01993565318415176,
          "token": " issues"
        },
        {
          "prob": 0.01135899278412201,
          "token": " related"
        }
      ],
      [
        {
          "prob": 0.9810417020498273,
          "token": " or"
        },
        {
          "prob": 0.014896332406714702,
          "token": " and"
        },
        {
          "prob": 0.0035381890747610933,
          "token": "."
        },
        {
          "prob": 0.0004498302612718724,
          "token": ","
        },
        {
          "prob": 3.468718514047137e-05,
          "token": "  "
        }
      ],
      [
        {
          "prob": 0.990357816215718,
          "token": " technical"
        },
        {
          "prob": 0.006268683877802532,
          "token": " issues"
        },
        {
          "prob": 0.0010233345120437415,
          "token": " any"
        },
        {
          "prob": 0.0006206837566965964,
          "token": " tech"
        },
        {
          "prob": 0.0005830784289169238,
          "token": " problems"
        }
      ],
      [
        {
          "prob": 0.9707831415177967,
          "token": " issues"
        },
        {
          "prob": 0.02014796237195012,
          "token": " difficulties"
        },
        {
          "prob": 0.007890055430928092,
          "token": " problems"
        },
        {
          "prob": 0.0006084157449242235,
          "token": " concerns"
        },
        {
          "prob": 0.0003466648417536928,
          "token": " challenges"
        }
      ],
      [
        {
          "prob": 0.9993127542515047,
          "token": "."
        },
        {
          "prob": 0.00026107897787775055,
          "token": ","
        },
        {
          "prob": 7.480037952133099e-05,
          "token": " directly"
        },
        {
          "prob": 5.140949889450658e-05,
          "token": " they"
        },
        {
          "prob": 4.536872353782824e-05,
          "token": " ."
        }
      ],
      [
        {
          "prob": 0.9688035077749464,
          "token": " "
        },
        {
          "prob": 0.02925533120313638,
          "token": "  "
        },
        {
          "prob": 0.001285389545203003,
          "token": "\n"
        },
        {
          "prob": 0.0003249973730607742,
          "token": "   "
        },
        {
          "prob": 0.000135479061324324,
          "token": "\n\n"
        }
      ],
      [
        {
          "prob": 0.9959785001095073,
          "token": "\n"
        },
        {
          "prob": 0.0024687835221269185,
          "token": "\n\n\n"
        },
        {
          "prob": 0.0014973928983633186,
          "token": "\n\n"
        },
        {
          "prob": 1.7707376142346323e-05,
          "token": "\n\n\n\n"
        },
        {
          "prob": 1.7707376142346323e-05,
          "token": ""
        }
      ],
      [
        {
          "prob": 0.9996729966795573,
          "token": ""
        },
        {
          "prob": 0.00029594790661603265,
          "token": " "
        },
        {
          "prob": 9.513229869671609e-06,
          "token": "  "
        },
        {
          "prob": 5.77006558884985e-06,
          "token": "Please"
        },
        {
          "prob": 2.2595901508877786e-06,
          "token": "Let"
        }
      ]
    ],
    "language_consistency_score": 0.7069283154276499
  },
  {
    "question": "What is the email address for contacting the Skoltech education team with questions or technical problems?\n",
    "true_answer": "education@skoltech.ru \n",
    "source_doc": "\n### Text Below Video 1\n\nPlease take the time to go through the STUDENT ACADEMIC INTEGRITY REGULATIONS: [**https://www.skoltech.ru/app/data/uploads/sites/2/2015/04/1.-STUDENT-ACADEMIC-INTEGRITY-REGULATIONS.pdf**](https://www.skoltech.ru/app/data/uploads/sites/2/2015/04/1.-STUDENT-ACADEMIC-INTEGRITY-REGULATIONS.pdf)\n\nIf you have any questions or technical problems when dealing with this course, please email us at education@skoltech.ru\n\nBy the end of this course, you will learn about the following topics and know how to find resources related to them:\n\n1) Skoltech at a Glance — brief history, mission and vision, its role within the Skolkovo ecosystem, Russia and the world  \n2) Navigating the campus — different locations on campus and where to find them  \n3) Education process, part 1 — academic integrity requirements and education process details  \n4) Education process, part 2 — your curriculum structure and degree requirements  \n5) Education process, part 3 — research process and intellectual property  \n6) Experience & success — student life, scholarships and future career opportunities  \n7) Services & resources — student benefits and support services  \n8) Being an international student, part 1\\* — first day in Moscow, visa and migration rules in Russia  \n9) Being an international student, part 2\\* — Russia's culture code, useful tips on living in Moscow\n\n\\* for international students only\n\n## “Meet Skoltech” \\- Module 1\n",
    "context": "Sim: 5.97 - If you have any questions or technical problems when dealing with this course, please email us at education@skoltech.ru\nSim: 4.36 - Until then, if you have urgent questions or need assistance, feel free to reach out to the Education Department via [education@skoltech.ru](mailto:education@skoltech.ru). For more details on the Education Department, as well as for all the relevant links, see the description below.\nSim: 3.79 - If you need to communicate any concerns or issues informally or outside of the formal evaluation period (or if you are unable to solve an issue directly with your research advisor or faculty, please talk to the [Education Department (links to an external site)](https://helpdesk.skoltech.ru/servicedesk/customer/portal/21) (email: education@skoltech.ru). \nSim: 3.53 - To reach the library or ask questions, email the team at [Library@skoltech.ru](mailto:Library@skoltech.ru) \nSim: 3.38 - If you need a consultation or have questions about the technology transfer process at Skoltech, reach out to the KTO team at kto@skoltech.ru to book an appointment. \nSim: 3.36 - * Email us at education@skoltech.ru ",
    "generated_answer": "The email address for contacting the Skoltech education team is education@skoltech.ru. \n",
    "logprobs": [
      [
        {
          "prob": 0.9863384161507026,
          "token": "The"
        },
        {
          "prob": 0.01095722965256965,
          "token": "education"
        },
        {
          "prob": 0.0009574320568411204,
          "token": "Education"
        },
        {
          "prob": 0.00039911706091973794,
          "token": "Email"
        },
        {
          "prob": 0.00022741004636915216,
          "token": "the"
        }
      ],
      [
        {
          "prob": 0.9959137016700422,
          "token": " email"
        },
        {
          "prob": 0.0020465607028618887,
          "token": " Sk"
        },
        {
          "prob": 0.0012413018132487721,
          "token": " education"
        },
        {
          "prob": 0.00026019087087954306,
          "token": " Education"
        },
        {
          "prob": 0.00019035970764471135,
          "token": " contact"
        }
      ],
      [
        {
          "prob": 0.9987543859070424,
          "token": " address"
        },
        {
          "prob": 0.0011694210843447973,
          "token": " for"
        },
        {
          "prob": 4.826777267859431e-05,
          "token": " is"
        },
        {
          "prob": 1.2991094777733918e-05,
          "token": " to"
        },
        {
          "prob": 1.0117474785854014e-05,
          "token": " addresses"
        }
      ],
      [
        {
          "prob": 0.8338223411260016,
          "token": " for"
        },
        {
          "prob": 0.1641893540138039,
          "token": " is"
        },
        {
          "prob": 0.0018239787479203647,
          "token": " to"
        },
        {
          "prob": 4.289586864035284e-05,
          "token": " provided"
        },
        {
          "prob": 3.340733608763491e-05,
          "token": " of"
        }
      ],
      [
        {
          "prob": 0.9350311864228448,
          "token": " contacting"
        },
        {
          "prob": 0.05977454435493779,
          "token": " the"
        },
        {
          "prob": 0.004067708792309369,
          "token": " contact"
        },
        {
          "prob": 0.0005171511386643368,
          "token": " reaching"
        },
        {
          "prob": 0.00015772211090414533,
          "token": " Sk"
        }
      ],
      [
        {
          "prob": 0.9952590992304039,
          "token": " the"
        },
        {
          "prob": 0.004608964078170633,
          "token": " Sk"
        },
        {
          "prob": 5.120096598928071e-05,
          "token": "  "
        },
        {
          "prob": 1.2945631545542307e-05,
          "token": " them"
        },
        {
          "prob": 1.1072985451523179e-05,
          "token": " education"
        }
      ],
      [
        {
          "prob": 0.9920314478898515,
          "token": " Sk"
        },
        {
          "prob": 0.003808574244807495,
          "token": " education"
        },
        {
          "prob": 0.003577824396267129,
          "token": " Education"
        },
        {
          "prob": 0.00020184704025982434,
          "token": "  "
        },
        {
          "prob": 8.414236486883956e-05,
          "token": " educational"
        }
      ],
      [
        {
          "prob": 0.9999641192914955,
          "token": "ol"
        },
        {
          "prob": 1.0783037723747908e-05,
          "token": "olk"
        },
        {
          "prob": 9.515997391660374e-06,
          "token": "ot"
        },
        {
          "prob": 4.784943984415945e-06,
          "token": "kol"
        },
        {
          "prob": 3.2886407001044353e-06,
          "token": "hol"
        }
      ],
      [
        {
          "prob": 0.9999774699527387,
          "token": "tech"
        },
        {
          "prob": 1.5689436786739632e-05,
          "token": "tek"
        },
        {
          "prob": 2.2602776727386586e-06,
          "token": "Tech"
        },
        {
          "prob": 1.4593449487215801e-06,
          "token": "test"
        },
        {
          "prob": 1.0676795725090437e-06,
          "token": "tec"
        }
      ],
      [
        {
          "prob": 0.9239118757672348,
          "token": " education"
        },
        {
          "prob": 0.07583931013637908,
          "token": " Education"
        },
        {
          "prob": 0.00012137340703087423,
          "token": " educational"
        },
        {
          "prob": 4.753050912222371e-05,
          "token": "  "
        },
        {
          "prob": 3.0688003175131214e-05,
          "token": "'"
        }
      ],
      [
        {
          "prob": 0.9987847095487963,
          "token": " team"
        },
        {
          "prob": 0.0011694567727886596,
          "token": " department"
        },
        {
          "prob": 1.2991491240533238e-05,
          "token": " teams"
        },
        {
          "prob": 1.220437657678377e-05,
          "token": " staff"
        },
        {
          "prob": 5.764939291928536e-06,
          "token": "  "
        }
      ],
      [
        {
          "prob": 0.9007334405095306,
          "token": " is"
        },
        {
          "prob": 0.08378126775036722,
          "token": " with"
        },
        {
          "prob": 0.012848270474816884,
          "token": " for"
        },
        {
          "prob": 0.0011950753154555413,
          "token": " about"
        },
        {
          "prob": 0.0005645136070276147,
          "token": " regarding"
        }
      ],
      [
        {
          "prob": 0.9911105436802273,
          "token": " education"
        },
        {
          "prob": 0.00756722200878524,
          "token": "  "
        },
        {
          "prob": 0.0005481677237406431,
          "token": ":"
        },
        {
          "prob": 0.0003324805311135848,
          "token": " email"
        },
        {
          "prob": 0.00013859850570379213,
          "token": " **"
        }
      ],
      [
        {
          "prob": 0.9999922514562126,
          "token": "@"
        },
        {
          "prob": 4.222819059381988e-06,
          "token": "@["
        },
        {
          "prob": 2.5612692299340398e-06,
          "token": "@@"
        },
        {
          "prob": 4.737871676927019e-07,
          "token": " @"
        },
        {
          "prob": 2.1024178121456997e-07,
          "token": "."
        }
      ],
      [
        {
          "prob": 0.9999896288992495,
          "token": "sk"
        },
        {
          "prob": 4.2228069778170326e-06,
          "token": " sk"
        },
        {
          "prob": 1.994712775002134e-06,
          "token": "sky"
        },
        {
          "prob": 1.2878833638270191e-06,
          "token": "SK"
        },
        {
          "prob": 8.315199960659118e-07,
          "token": "ski"
        }
      ],
      [
        {
          "prob": 0.9999665033109116,
          "token": "ol"
        },
        {
          "prob": 1.7778274521883712e-05,
          "token": "ot"
        },
        {
          "prob": 3.2886501089944097e-06,
          "token": "olk"
        },
        {
          "prob": 2.406027817877387e-06,
          "token": "kol"
        },
        {
          "prob": 2.26025396160662e-06,
          "token": "olt"
        }
      ],
      [
        {
          "prob": 0.9999862911193472,
          "token": "tech"
        },
        {
          "prob": 7.411235848116051e-06,
          "token": "tek"
        },
        {
          "prob": 2.260299228529089e-06,
          "token": "test"
        },
        {
          "prob": 1.8738538762513097e-06,
          "token": "tec"
        },
        {
          "prob": 3.058982362924814e-07,
          "token": " tech"
        }
      ],
      [
        {
          "prob": 0.9999995231630692,
          "token": "."
        },
        {
          "prob": 1.1253517471925912e-07,
          "token": "@"
        },
        {
          "prob": 1.0571701315726883e-07,
          "token": " ."
        },
        {
          "prob": 6.615601637697701e-08,
          "token": ","
        },
        {
          "prob": 5.484526391933337e-08,
          "token": ".."
        }
      ],
      [
        {
          "prob": 0.9999864103261001,
          "token": "ru"
        },
        {
          "prob": 6.144130319790621e-06,
          "token": "ру"
        },
        {
          "prob": 1.5534794266275484e-06,
          "token": "edu"
        },
        {
          "prob": 1.1365498277677823e-06,
          "token": " "
        },
        {
          "prob": 1.0676897547434608e-06,
          "token": "Ru"
        }
      ],
      [
        {
          "prob": 0.9950549781087997,
          "token": "."
        },
        {
          "prob": 0.0026255701694984693,
          "token": " ."
        },
        {
          "prob": 0.002044796104014329,
          "token": " "
        },
        {
          "prob": 6.996907501039608e-05,
          "token": ","
        },
        {
          "prob": 6.572986305774202e-05,
          "token": "  "
        }
      ],
      [
        {
          "prob": 0.9940669596750416,
          "token": " "
        },
        {
          "prob": 0.005552811362176112,
          "token": "  "
        },
        {
          "prob": 0.0001784948287532301,
          "token": "\n"
        },
        {
          "prob": 0.00010170328772687782,
          "token": ""
        },
        {
          "prob": 3.9827579725374785e-05,
          "token": "   "
        }
      ],
      [
        {
          "prob": 0.998407044459465,
          "token": "\n"
        },
        {
          "prob": 0.000969147182367278,
          "token": "\n\n\n"
        },
        {
          "prob": 0.00043005645524813737,
          "token": "\n\n"
        },
        {
          "prob": 0.00015820885298897832,
          "token": ""
        },
        {
          "prob": 2.0113998481090427e-05,
          "token": "\n\n\n\n"
        }
      ],
      [
        {
          "prob": 0.9997917847333165,
          "token": ""
        },
        {
          "prob": 0.00020342607212999405,
          "token": " "
        },
        {
          "prob": 1.994319036454671e-06,
          "token": "  "
        },
        {
          "prob": 2.8730889780734444e-07,
          "token": "."
        },
        {
          "prob": 1.2749255056436897e-07,
          "token": "**"
        }
      ]
    ],
    "language_consistency_score": 0.42002312389405544
  },
  {
    "question": "What are the six target domains of Skoltech's research and education activities?\n",
    "true_answer": "The six target domains are Artificial Intelligence & Telecommunications, Cutting-edge Engineering, Advanced Materials, Photonics, Life Sciences & Health, Agro, Energy Efficiency & ESG, and Advanced Studies. \n",
    "source_doc": "Ah, wait, let’s back up a little. Skoltech was established in 2011 in collaboration with MIT with the vision of being a worldleading institute of science and technology and the mission to impact economy and society development by academic and technology excellence and entrepreneurial spirit. Skoltech became a home for talents who are working in promising areas of global science and technology agenda. The broad, but well-structured portfolio divided among several Centers covers Artificial Intelligence and Communications, Life Sciences and Health, Cutting-edge Engineering and Advanced Materials, Energy Efficiency and ESG, Photonics, and Advanced Studies. Skoltech research excellence is globally recognized: the Institute appeared among top-100 world’s leading young universities in the prestigious Nature Index ranking. To learn more about the faculty, students, alumni, and their achievements, see the link below. You can also find more information about the university’s achievements there as well. Today Skoltech brings together some of the most qualified, high-achieving faculty, researchers and students from around the world. So as you join this community, be sure that with their help, you will master and apply unique technological competencies that are shaping the future and humanity literally as we speak right now. *Text Overlay: Skoltech’s Strategy and Goals*\n\nSkoltech’s mission, as stated in the Skoltech Strategy 2021-2025, is to facilitate the economy and society development by academic and technology excellence and entrepreneurial spirit. Our unofficial motto is: “Targeting excellence today, we impact tomorrow”. In context of these aspirations, you will witness Skoltech becoming: a world leading university producing substantial economic impact in Russia a full-fledged university providing education in BSc, MSc and PhD programs the 1st choice university for the brightest students in Russia. You can find more information about Skoltech’s five-year plan in the links below. Let’s now take a look at Governance & Management, which includes: Leadership, Collegial Bodies, Structure: Centers & Departments, Programs Management: Directors, Coordinators & Research Advisors\n\n*Text Overlays: Governance & Management  — Leadership, Collegial Bodies, Structure: Centers & Departments, Programs Management: Directors, Coordinators & Research Advisors*\n\nSo, who is behind Skoltech? You will obviously get to know your professors and fellow students in the next few weeks, but you should also probably know who runs the university on the administrative side. You know, just to have an idea. Skoltech was founded by the top Russian companies and leading institutes. Among them are VEB.RF, Sber, MIPT, New Economic School, Moscow School of Management.The Founders are entitled to approve the Charter, establish the Institute's governance bodies, and appoint the Board of Trustees. You can read more about the Founders below. Honored academics, statesmen and businessmen make up the Board of Trustees. Members of the Board set and hold Skoltech accountable for following its strategies, as well as oversee the development of the university. The final key player of the Skoltech government bodies is the Student Council, whose role is to voice student needs to the university administration. Each year, students elect the Council and its President, Vice President and Coordinator to represent you over the course of the next academic year. You will learn more about the Student Council’s role and activities in the next module.Meanwhile, let’s see what happens behind the scenes of the day-to-day management\\! Below you will see Skoltech’s current leadership team . It consists of the University President and Provost, as well as several Vice Presidents and Deans responsible for different areas of the university’s management. You will get to know team members and leaders of these departments as you attend Skoltech events throughout your time here. Skoltech’s research and education activities revolve around several target domains: \n\n* Artificial Intelligence & Telecommunications  \n* Cutting-edge Engineering, Advanced Materials  \n* Photonics  \n* Life Sciences & Health, Agro  \n* Energy Efficiency & ESG  \n* Advanced Studies\n\n*Text Overlay: **several target domains**:* \n\n* *Artificial Intelligence & Telecommunications*  \n* *Cutting-edge Engineering, Advanced Materials*  \n* *Photonics*  \n* *Life Sciences & Health, Agro*  \n* *Energy Efficiency & ESG*  \n* *Advanced Studies*\n\nBy the way, management doesn’t cover just academics and research, right? There are entire departments responsible for cooperation with industry, communications and student affairs. For instance, you will most likely hear from these people quite often: \n\n* Education Department — about your academic affairs, curriculum and more  \n* Student Department — about student activities, benefits, scholarships and more  \n* Accommodation team — if you’re living in the dorms, you will get to know the housing team pretty well:)\n\n*Text Overlay:* \n\n- *Education Department*   \n- *Student Department*  \n- *Accommodation team* \n\nFinally, the people you will interact the most with are members of your Centers and Programs. You will most likely hear from your Program Director and Coordinator, as well as spend a ton of time with your research advisor while working on your research. Now you know you’ll meet a lot of people here.",
    "context": "Sim: 4.87 -  Skoltech’s research and education activities revolve around several target domains: \nSim: 2.03 - Skoltech’s mission, as stated in the Skoltech Strategy 2021-2025, is to facilitate the economy and society development by academic and technology excellence and entrepreneurial spirit. Our unofficial motto is: “Targeting excellence today, we impact tomorrow”. In context of these aspirations, you will witness Skoltech becoming: a world leading university producing substantial economic impact in Russia a full-fledged university providing education in BSc, MSc and PhD programs the 1st choice university for the brightest students in Russia. You can find more information about Skoltech’s five-year plan in the links below. \nSim: 1.86 - Let us start by saying that you’ve come to a very unique university. Skoltech is a one-of-a-kind institute in Russia, and one with few similar educational organizations worldwide. Don’t get us wrong \\- there are dozens of incredible universities out there, but can you think of one that has been named among the Top 100 in just the first 8 years of its existence? Exactly\\! Ah, wait, let’s back up a little. Skoltech was established in 2011 in collaboration with MIT with the vision of being a worldleading institute of science and technology and the mission to impact economy and society development by academic and technology excellence and entrepreneurial spirit. Skoltech became a home for talents who are working in promising areas of global science and technology agenda. The broad, but well-structured portfolio divided among several Centers covers Artificial Intelligence and Communications, Life Sciences and Health, Cutting-edge Engineering and Advanced Materials, Energy Efficiency and ESG, Photonics, and Advanced Studies. Skoltech research excellence is globally recognized: the Institute appeared among top-100 world’s leading young universities in the prestigious Nature Index ranking. To learn more about the faculty, students, alumni, and their achievements, see the link below. You can also find more information about the university’s achievements there as well.   \nSim: 1.03 - Skoltech hosts more than 25 world-class laboratories based in Centers for Research, Education and Innovation (CREIs) established in collaboration with international and Russian Partners. Students have full access to the facilities throughout their studies and can conduct research based on their interests in IT, Biomedicine, Energy, Space, Cross Cutting Science. As part of your MSc Thesis project, you will develop very specific studies that go deep into one of the following topics: ",
    "generated_answer": "The six target domains of Skoltech's research and education activities are Artificial Intelligence and Communications, Life Sciences and Health, Cutting-edge Engineering and Advanced Materials, Energy Efficiency and ESG, Photonics, and Advanced Studies. \n",
    "logprobs": [
      [
        {
          "prob": 0.9240743104716578,
          "token": "The"
        },
        {
          "prob": 0.04600695018688217,
          "token": "Sk"
        },
        {
          "prob": 0.021732144461905113,
          "token": "Based"
        },
        {
          "prob": 0.003130812251303434,
          "token": "According"
        },
        {
          "prob": 0.001675803038057432,
          "token": "They"
        }
      ],
      [
        {
          "prob": 0.9682885395586341,
          "token": " six"
        },
        {
          "prob": 0.02580401621326769,
          "token": " target"
        },
        {
          "prob": 0.0018692366649969972,
          "token": " document"
        },
        {
          "prob": 0.0018692366649969972,
          "token": " research"
        },
        {
          "prob": 0.0005355452709885839,
          "token": " Sk"
        }
      ],
      [
        {
          "prob": 0.9971022183610905,
          "token": " target"
        },
        {
          "prob": 0.0008541514560078663,
          "token": " research"
        },
        {
          "prob": 0.00045719432851434595,
          "token": " targets"
        },
        {
          "prob": 0.0003790274110053285,
          "token": " areas"
        },
        {
          "prob": 0.0003344905162068608,
          "token": " domains"
        }
      ],
      [
        {
          "prob": 0.9994955225179812,
          "token": " domains"
        },
        {
          "prob": 0.00035691800026098775,
          "token": " areas"
        },
        {
          "prob": 9.606317656596675e-05,
          "token": " domain"
        },
        {
          "prob": 1.3839212721002148e-05,
          "token": " research"
        },
        {
          "prob": 1.2213062360493727e-05,
          "token": "domains"
        }
      ],
      [
        {
          "prob": 0.6201074330090679,
          "token": " of"
        },
        {
          "prob": 0.3761141704356976,
          "token": " are"
        },
        {
          "prob": 0.001197089173014108,
          "token": " mentioned"
        },
        {
          "prob": 0.001124561206482034,
          "token": " for"
        },
        {
          "prob": 0.0002509235220990477,
          "token": " listed"
        }
      ],
      [
        {
          "prob": 0.9969539725026375,
          "token": " Sk"
        },
        {
          "prob": 0.0016984303055638528,
          "token": " research"
        },
        {
          "prob": 0.0005513995893375006,
          "token": "  "
        },
        {
          "prob": 9.581888105613351e-05,
          "token": " its"
        },
        {
          "prob": 9.581888105613351e-05,
          "token": " their"
        }
      ],
      [
        {
          "prob": 0.9999365846769599,
          "token": "ol"
        },
        {
          "prob": 2.586647207087006e-05,
          "token": "olk"
        },
        {
          "prob": 2.0144828704088227e-05,
          "token": "ot"
        },
        {
          "prob": 6.961866512380089e-06,
          "token": "otech"
        },
        {
          "prob": 2.4059566873538718e-06,
          "token": "ole"
        }
      ],
      [
        {
          "prob": 0.99995696730009,
          "token": "tech"
        },
        {
          "prob": 2.4299788403168118e-05,
          "token": "tek"
        },
        {
          "prob": 7.888986261374342e-06,
          "token": "Tech"
        },
        {
          "prob": 3.288618746132514e-06,
          "token": "tec"
        },
        {
          "prob": 1.5534335003900936e-06,
          "token": " tech"
        }
      ],
      [
        {
          "prob": 0.9822796158010406,
          "token": "'"
        },
        {
          "prob": 0.012365072853864444,
          "token": "’"
        },
        {
          "prob": 0.003542652686157884,
          "token": " are"
        },
        {
          "prob": 0.0016734306369190954,
          "token": " research"
        },
        {
          "prob": 5.053322657370058e-05,
          "token": "s"
        }
      ],
      [
        {
          "prob": 0.9999797348316635,
          "token": "s"
        },
        {
          "prob": 1.3845918981029822e-05,
          "token": " s"
        },
        {
          "prob": 3.9669222050026e-06,
          "token": " research"
        },
        {
          "prob": 6.083472232245842e-07,
          "token": "ss"
        },
        {
          "prob": 4.18110524304515e-07,
          "token": "re"
        }
      ],
      [
        {
          "prob": 0.9975475759585816,
          "token": " research"
        },
        {
          "prob": 0.0013235268696647233,
          "token": " activities"
        },
        {
          "prob": 0.00042968626385172533,
          "token": "  "
        },
        {
          "prob": 0.00017911979836634668,
          "token": " Research"
        },
        {
          "prob": 0.00011564843386929288,
          "token": " are"
        }
      ],
      [
        {
          "prob": 0.993386077169016,
          "token": " and"
        },
        {
          "prob": 0.005906890867786026,
          "token": " are"
        },
        {
          "prob": 0.00045549051448012334,
          "token": " &"
        },
        {
          "prob": 9.547599857434586e-05,
          "token": " activities"
        },
        {
          "prob": 4.2367217544670994e-05,
          "token": " include"
        }
      ],
      [
        {
          "prob": 0.9991133928010014,
          "token": " education"
        },
        {
          "prob": 0.0007553065103595309,
          "token": " educational"
        },
        {
          "prob": 3.11752228797228e-05,
          "token": " Education"
        },
        {
          "prob": 2.012823671335413e-05,
          "token": "  "
        },
        {
          "prob": 1.6686894332998333e-05,
          "token": " development"
        }
      ],
      [
        {
          "prob": 0.8724695530731899,
          "token": " activities"
        },
        {
          "prob": 0.12569117125388765,
          "token": " are"
        },
        {
          "prob": 0.0011575756676781381,
          "token": " activity"
        },
        {
          "prob": 0.0002141298654006336,
          "token": " include"
        },
        {
          "prob": 0.00010767125811010579,
          "token": "  "
        }
      ],
      [
        {
          "prob": 0.994627055632895,
          "token": " are"
        },
        {
          "prob": 0.001694466552092691,
          "token": ","
        },
        {
          "prob": 0.0012396982122383417,
          "token": " include"
        },
        {
          "prob": 0.0007519149745134936,
          "token": " listed"
        },
        {
          "prob": 0.0005501127469930878,
          "token": " mentioned"
        }
      ],
      [
        {
          "prob": 0.609338924361722,
          "token": " Artificial"
        },
        {
          "prob": 0.36958273978170164,
          "token": ":"
        },
        {
          "prob": 0.007205717999031687,
          "token": "  "
        },
        {
          "prob": 0.005611818820237594,
          "token": " AI"
        },
        {
          "prob": 0.00340374017122648,
          "token": " artificial"
        }
      ],
      [
        {
          "prob": 0.9939184372894045,
          "token": " Intelligence"
        },
        {
          "prob": 0.005910054784767416,
          "token": " intelligence"
        },
        {
          "prob": 5.794016598068547e-05,
          "token": "  "
        },
        {
          "prob": 4.803408471019371e-05,
          "token": " Intelligent"
        },
        {
          "prob": 2.415305461121655e-05,
          "token": "Intelligence"
        }
      ],
      [
        {
          "prob": 0.993779377909767,
          "token": " and"
        },
        {
          "prob": 0.004061349826462364,
          "token": ","
        },
        {
          "prob": 0.002042174941932078,
          "token": " &"
        },
        {
          "prob": 2.736515987544837e-05,
          "token": ";"
        },
        {
          "prob": 2.570718865297539e-05,
          "token": "  "
        }
      ],
      [
        {
          "prob": 0.9985967327832939,
          "token": " Communications"
        },
        {
          "prob": 0.0009693311257257722,
          "token": " Communication"
        },
        {
          "prob": 0.00033499203297246644,
          "token": " communications"
        },
        {
          "prob": 7.021814471592499e-05,
          "token": "Communications"
        },
        {
          "prob": 6.952537837308133e-06,
          "token": "  "
        }
      ],
      [
        {
          "prob": 0.9934352521808787,
          "token": ","
        },
        {
          "prob": 0.006288161428796362,
          "token": ";"
        },
        {
          "prob": 6.985519685395318e-05,
          "token": " ,"
        },
        {
          "prob": 5.440328201146588e-05,
          "token": " and"
        },
        {
          "prob": 5.110715378149643e-05,
          "token": "."
        }
      ],
      [
        {
          "prob": 0.9981519819868532,
          "token": " Life"
        },
        {
          "prob": 0.0015974452392391175,
          "token": "  "
        },
        {
          "prob": 6.593440800728981e-05,
          "token": " life"
        },
        {
          "prob": 5.46615441280302e-05,
          "token": " Lif"
        },
        {
          "prob": 3.5292145418535896e-05,
          "token": " Energy"
        }
      ],
      [
        {
          "prob": 0.9986612860955385,
          "token": " Sciences"
        },
        {
          "prob": 0.0008036558436591377,
          "token": " Science"
        },
        {
          "prob": 0.00048744190903648977,
          "token": " sciences"
        },
        {
          "prob": 3.317082238043001e-05,
          "token": "Sciences"
        },
        {
          "prob": 5.7642246125416044e-06,
          "token": " Sci"
        }
      ],
      [
        {
          "prob": 0.9995095751770304,
          "token": " and"
        },
        {
          "prob": 0.0003352982282437577,
          "token": " &"
        },
        {
          "prob": 0.00013130467279501713,
          "token": ","
        },
        {
          "prob": 1.3000923187531623e-05,
          "token": "  "
        },
        {
          "prob": 5.091234672230248e-06,
          "token": " And"
        }
      ],
      [
        {
          "prob": 0.9998835460865848,
          "token": " Health"
        },
        {
          "prob": 6.204712703033242e-05,
          "token": " health"
        },
        {
          "prob": 1.669975768934982e-05,
          "token": "  "
        },
        {
          "prob": 1.3005784365568354e-05,
          "token": " Healthcare"
        },
        {
          "prob": 1.2217803725150185e-05,
          "token": "Health"
        }
      ],
      [
        {
          "prob": 0.9997547274596941,
          "token": ","
        },
        {
          "prob": 8.47974493278913e-05,
          "token": "."
        },
        {
          "prob": 7.02995546402489e-05,
          "token": ";"
        },
        {
          "prob": 5.1432252882794517e-05,
          "token": " ,"
        },
        {
          "prob": 7.409518546126647e-06,
          "token": " and"
        }
      ],
      [
        {
          "prob": 0.9985214906069665,
          "token": " Cutting"
        },
        {
          "prob": 0.0013248187442394474,
          "token": "  "
        },
        {
          "prob": 3.115676538900038e-05,
          "token": "Cutting"
        },
        {
          "prob": 3.115676538900038e-05,
          "token": " Advanced"
        },
        {
          "prob": 2.426491328292554e-05,
          "token": " cutting"
        }
      ],
      [
        {
          "prob": 0.9995978304482779,
          "token": "-"
        },
        {
          "prob": 0.0002453309480528291,
          "token": " edge"
        },
        {
          "prob": 0.00011588613421239983,
          "token": " Edge"
        },
        {
          "prob": 1.4279973589040364e-05,
          "token": " -"
        },
        {
          "prob": 7.408352703712182e-06,
          "token": "edge"
        }
      ],
      [
        {
          "prob": 0.9920515087612236,
          "token": "edge"
        },
        {
          "prob": 0.007574405998661479,
          "token": "Edge"
        },
        {
          "prob": 0.00018962154385340982,
          "token": " edge"
        },
        {
          "prob": 0.00013032485411824073,
          "token": " Edge"
        },
        {
          "prob": 3.0954866098660634e-05,
          "token": "e"
        }
      ],
      [
        {
          "prob": 0.9997717663077113,
          "token": " Engineering"
        },
        {
          "prob": 0.00017951928326214388,
          "token": " engineering"
        },
        {
          "prob": 1.777481610281606e-05,
          "token": "  "
        },
        {
          "prob": 1.1476283824309956e-05,
          "token": " Engine"
        },
        {
          "prob": 6.538989414829126e-06,
          "token": " Energy"
        }
      ],
      [
        {
          "prob": 0.999657033339134,
          "token": " and"
        },
        {
          "prob": 0.0002304807247303096,
          "token": ","
        },
        {
          "prob": 7.482613596223563e-05,
          "token": " &"
        },
        {
          "prob": 2.2820682117712786e-05,
          "token": "  "
        },
        {
          "prob": 7.4087907563160255e-06,
          "token": " And"
        }
      ],
      [
        {
          "prob": 0.9989920296519356,
          "token": " Advanced"
        },
        {
          "prob": 0.000910962786514595,
          "token": " Materials"
        },
        {
          "prob": 4.535418815933902e-05,
          "token": "  "
        },
        {
          "prob": 2.2805517999751406e-05,
          "token": " Advance"
        },
        {
          "prob": 6.533890301810186e-06,
          "token": " Material"
        }
      ],
      [
        {
          "prob": 0.9998237205412498,
          "token": " Materials"
        },
        {
          "prob": 0.00010229227206481569,
          "token": " materials"
        },
        {
          "prob": 3.535126328568828e-05,
          "token": " Material"
        },
        {
          "prob": 1.777573150120883e-05,
          "token": "  "
        },
        {
          "prob": 1.473659901145872e-05,
          "token": "Materials"
        }
      ],
      [
        {
          "prob": 0.9996813359301091,
          "token": ","
        },
        {
          "prob": 0.0001910799698515592,
          "token": "."
        },
        {
          "prob": 3.11929475981047e-05,
          "token": " ,"
        },
        {
          "prob": 2.429309201570924e-05,
          "token": ";"
        },
        {
          "prob": 2.0778982741486153e-05,
          "token": " Energy"
        }
      ],
      [
        {
          "prob": 0.9994980233733616,
          "token": " Energy"
        },
        {
          "prob": 0.0003799381394078981,
          "token": "  "
        },
        {
          "prob": 4.830373685546816e-05,
          "token": "Energy"
        },
        {
          "prob": 2.5855127192063284e-05,
          "token": " energy"
        },
        {
          "prob": 1.3839252315363983e-05,
          "token": " and"
        }
      ],
      [
        {
          "prob": 0.9995180308198405,
          "token": " Efficiency"
        },
        {
          "prob": 0.0004044501440381668,
          "token": " efficiency"
        },
        {
          "prob": 3.761970562041156e-05,
          "token": " Efficient"
        },
        {
          "prob": 1.221333025096139e-05,
          "token": "Efficiency"
        },
        {
          "prob": 8.394090939819217e-06,
          "token": ","
        }
      ],
      [
        {
          "prob": 0.999792023058635,
          "token": " and"
        },
        {
          "prob": 0.00013134174370774474,
          "token": ","
        },
        {
          "prob": 5.828254547167032e-05,
          "token": " &"
        },
        {
          "prob": 1.0127987760942036e-05,
          "token": "  "
        },
        {
          "prob": 2.5607563317920035e-06,
          "token": " And"
        }
      ],
      [
        {
          "prob": 0.9996093845982684,
          "token": " ESG"
        },
        {
          "prob": 0.0002959289972796815,
          "token": " Environmental"
        },
        {
          "prob": 3.320231330958352e-05,
          "token": "  "
        },
        {
          "prob": 2.75256845245934e-05,
          "token": " Environment"
        },
        {
          "prob": 6.95958294944716e-06,
          "token": " Sustainability"
        }
      ],
      [
        {
          "prob": 0.9989044759970777,
          "token": ","
        },
        {
          "prob": 0.0004302705983873677,
          "token": "."
        },
        {
          "prob": 0.000260972434336164,
          "token": " ("
        },
        {
          "prob": 0.00016849646766744407,
          "token": " ,"
        },
        {
          "prob": 4.0021419015062693e-05,
          "token": " Photon"
        }
      ],
      [
        {
          "prob": 0.9994596779996514,
          "token": " Photon"
        },
        {
          "prob": 0.0002958846920747869,
          "token": "  "
        },
        {
          "prob": 9.605969533564512e-05,
          "token": " and"
        },
        {
          "prob": 7.4811365949001e-05,
          "token": "Photon"
        },
        {
          "prob": 2.7521563498590755e-05,
          "token": " Ph"
        }
      ],
      [
        {
          "prob": 0.9999855758836753,
          "token": "ics"
        },
        {
          "prob": 7.889211970310518e-06,
          "token": "onics"
        },
        {
          "prob": 4.222790869117525e-06,
          "token": "tics"
        },
        {
          "prob": 1.0030007461016161e-06,
          "token": "ICS"
        },
        {
          "prob": 5.368676121639641e-07,
          "token": "is"
        }
      ],
      [
        {
          "prob": 0.9939621293393147,
          "token": ","
        },
        {
          "prob": 0.005552226232126867,
          "token": " and"
        },
        {
          "prob": 0.00037783373683629776,
          "token": "."
        },
        {
          "prob": 4.239179062069062e-05,
          "token": " ,"
        },
        {
          "prob": 9.458887030173404e-06,
          "token": "  "
        }
      ],
      [
        {
          "prob": 0.9990704364065577,
          "token": " and"
        },
        {
          "prob": 0.0008039850910249906,
          "token": "  "
        },
        {
          "prob": 5.4711872067626166e-05,
          "token": " Advanced"
        },
        {
          "prob": 6.138501920534506e-06,
          "token": " advanced"
        },
        {
          "prob": 4.633584346505024e-06,
          "token": " &"
        }
      ],
      [
        {
          "prob": 0.9977039486576698,
          "token": " Advanced"
        },
        {
          "prob": 0.0010974139386045526,
          "token": "  "
        },
        {
          "prob": 0.00023003056763694596,
          "token": " advanced"
        },
        {
          "prob": 0.00017914798620601328,
          "token": " Advance"
        },
        {
          "prob": 0.00017914798620601328,
          "token": " Cross"
        }
      ],
      [
        {
          "prob": 0.9994868290893051,
          "token": " Studies"
        },
        {
          "prob": 0.00037993397255242585,
          "token": " studies"
        },
        {
          "prob": 2.585483130530736e-05,
          "token": " Materials"
        },
        {
          "prob": 2.2816808543780976e-05,
          "token": " Study"
        },
        {
          "prob": 1.8915798666741768e-05,
          "token": "  "
        }
      ],
      [
        {
          "prob": 0.9974519731801222,
          "token": "."
        },
        {
          "prob": 0.0009095586475510438,
          "token": ","
        },
        {
          "prob": 0.0004036142032117607,
          "token": " ."
        },
        {
          "prob": 0.00021603911498168106,
          "token": " based"
        },
        {
          "prob": 0.0001230953771866309,
          "token": " "
        }
      ],
      [
        {
          "prob": 0.9893130565284263,
          "token": " "
        },
        {
          "prob": 0.009698882835671717,
          "token": "  "
        },
        {
          "prob": 0.00033187767861357317,
          "token": "\n"
        },
        {
          "prob": 0.00029288102341344413,
          "token": ""
        },
        {
          "prob": 0.00015676791497838395,
          "token": "   "
        }
      ],
      [
        {
          "prob": 0.9958252682501996,
          "token": "\n"
        },
        {
          "prob": 0.0027970687297728188,
          "token": "\n\n\n"
        },
        {
          "prob": 0.0009080752644916307,
          "token": "\n\n"
        },
        {
          "prob": 0.00035560738302094506,
          "token": ""
        },
        {
          "prob": 5.453413242908187e-05,
          "token": "\n\n\n\n"
        }
      ],
      [
        {
          "prob": 0.9994596779996514,
          "token": ""
        },
        {
          "prob": 0.0005192940543677608,
          "token": " "
        },
        {
          "prob": 1.2212619771725282e-05,
          "token": "  "
        },
        {
          "prob": 7.807266617371466e-07,
          "token": "."
        },
        {
          "prob": 6.88988860748243e-07,
          "token": "   "
        }
      ]
    ],
    "language_consistency_score": 0.5795155732961238
  },
  {
    "question": "How does Skoltech ensure student input before drafting a policy?\n",
    "true_answer": "Skoltech provides students the opportunity to express their concerns or opinions on the issue through the Student Council before a policy is drafted. \n",
    "source_doc": "Among other things, it highlights that we have all gathered here for science, innovation, and education. Please leave your conflicts and arguments on other topics outside of the Campus. *Text Overlay: Policies*\n\nNow along with the Code of Ethics, you will likely hear the term “Policy”. A Policy is an official document passed by Skoltech’s leadership team to optimize the university’s functions and/or activities. For instance, you can hear something like “Skoltech Policy on Student Scholarships and Other Benefits” or “Skoltech’s IP policy”, which, btw, you will learn about in the next modules. The policies don’t just appear out of thin air: their formation is a long process that involves all the leadership and representative parties of Skoltech you’ve read about already. That includes the students, too. In fact, before a policy is drafted, **Skoltech makes sure to give the students the opportunity to voice their concerns or opinions** on the issue in question through the Student Council. You can also participate in working groups and contribute your feedback any time. So this way, you the students are quite literally the policy makers of the institute\\! *Text Overlay: Feedback and freedom for exploration*\n\nFinally, Skoltech is a young university. That means you, as part of the growing community, have an opportunity to shape its values and mission. One way to do that is through feedback, and here we want to stress that **your feedback and participation in university-wide initiatives is crucial** to strengthening Skoltech as an international community of scientists every day. As a student, you have incredible freedom to explore your passions, try your hand in different subject areas and even work-related activities. This university was literally built to open your abilities and your mind, to help you reach for incredible goals and achieve them. The growth of our community and university wouldn’t be possible without your input. Please keep that in mind as you dive into your academic year and the next lessons of this orientation course. Embrace the opportunities that come your way, and get the most out of them while you are still here. Life tends to be quick, but the memories, knowledge and experience that you’ll gain from the next few years at Skoltech will last you a lifetime. This is the end of Module 1\\.",
    "context": "Sim: 6.01 - The policies don’t just appear out of thin air: their formation is a long process that involves all the leadership and representative parties of Skoltech you’ve read about already. That includes the students, too. In fact, before a policy is drafted, **Skoltech makes sure to give the students the opportunity to voice their concerns or opinions** on the issue in question through the Student Council. You can also participate in working groups and contribute your feedback any time. So this way, you the students are quite literally the policy makers of the institute\\!",
    "generated_answer": "Skoltech ensures student input before drafting a policy by giving students the opportunity to voice their concerns or opinions through the Student Council and by participating in working groups. \n",
    "logprobs": [
      [
        {
          "prob": 0.9617278862035525,
          "token": "Sk"
        },
        {
          "prob": 0.03290852165858642,
          "token": "Students"
        },
        {
          "prob": 0.0015391516727456824,
          "token": "Student"
        },
        {
          "prob": 0.0013582965838059636,
          "token": "Through"
        },
        {
          "prob": 0.000933542679468242,
          "token": "Before"
        }
      ],
      [
        {
          "prob": 0.999963523288439,
          "token": "ol"
        },
        {
          "prob": 1.1478483907231896e-05,
          "token": "olk"
        },
        {
          "prob": 1.0129726494499273e-05,
          "token": "olni"
        },
        {
          "prob": 5.422051873952344e-06,
          "token": "ot"
        },
        {
          "prob": 2.260247494977415e-06,
          "token": "hol"
        }
      ],
      [
        {
          "prob": 0.9999895096921129,
          "token": "tech"
        },
        {
          "prob": 4.2228069778170326e-06,
          "token": "tek"
        },
        {
          "prob": 2.902289962257353e-06,
          "token": "Tech"
        },
        {
          "prob": 1.8738592373979223e-06,
          "token": "tell"
        },
        {
          "prob": 4.18114511736213e-07,
          "token": "test"
        }
      ],
      [
        {
          "prob": 0.31155302308890964,
          "token": " ensures"
        },
        {
          "prob": 0.2749445778668297,
          "token": " provides"
        },
        {
          "prob": 0.24263773834990632,
          "token": " gives"
        },
        {
          "prob": 0.06951686764949896,
          "token": " allows"
        },
        {
          "prob": 0.0255738264228868,
          "token": " makes"
        }
      ],
      [
        {
          "prob": 0.9954016441388334,
          "token": " student"
        },
        {
          "prob": 0.002795877947867724,
          "token": " students"
        },
        {
          "prob": 0.0013206792281188992,
          "token": " that"
        },
        {
          "prob": 0.00016790552163501124,
          "token": " input"
        },
        {
          "prob": 5.8026595583673013e-05,
          "token": " the"
        }
      ],
      [
        {
          "prob": 0.9932411688380522,
          "token": " input"
        },
        {
          "prob": 0.0029697379034330147,
          "token": " involvement"
        },
        {
          "prob": 0.0020410690218486903,
          "token": " voice"
        },
        {
          "prob": 0.0011629660727397288,
          "token": " participation"
        },
        {
          "prob": 0.00029404387176614643,
          "token": " feedback"
        }
      ],
      [
        {
          "prob": 0.4373285506458244,
          "token": " before"
        },
        {
          "prob": 0.3005712420835114,
          "token": " by"
        },
        {
          "prob": 0.20657939219688323,
          "token": " through"
        },
        {
          "prob": 0.03589811561764852,
          "token": " on"
        },
        {
          "prob": 0.010284979870567427,
          "token": " is"
        }
      ],
      [
        {
          "prob": 0.980035159332632,
          "token": " drafting"
        },
        {
          "prob": 0.010887206725964882,
          "token": " a"
        },
        {
          "prob": 0.0066034246779272995,
          "token": " policy"
        },
        {
          "prob": 0.0007886666100105643,
          "token": " draft"
        },
        {
          "prob": 0.0006538275842353839,
          "token": " crafting"
        }
      ],
      [
        {
          "prob": 0.9675144901319354,
          "token": " a"
        },
        {
          "prob": 0.031100705103900016,
          "token": " policies"
        },
        {
          "prob": 0.0008822590938440911,
          "token": " policy"
        },
        {
          "prob": 0.0002527714624598567,
          "token": " any"
        },
        {
          "prob": 8.735547994148435e-05,
          "token": " new"
        }
      ],
      [
        {
          "prob": 0.9999160837028892,
          "token": " policy"
        },
        {
          "prob": 6.204913893649968e-05,
          "token": " new"
        },
        {
          "prob": 9.515543644363269e-06,
          "token": " policies"
        },
        {
          "prob": 7.888662756493593e-06,
          "token": "  "
        },
        {
          "prob": 7.810833869532078e-07,
          "token": " Policy"
        }
      ],
      [
        {
          "prob": 0.5612727059735279,
          "token": " by"
        },
        {
          "prob": 0.43711962292878986,
          "token": " through"
        },
        {
          "prob": 0.0006173660081392162,
          "token": " via"
        },
        {
          "prob": 0.0003304523690075944,
          "token": ","
        },
        {
          "prob": 0.0003104312720833932,
          "token": "  "
        }
      ],
      [
        {
          "prob": 0.6889938183154123,
          "token": " giving"
        },
        {
          "prob": 0.1356709310131307,
          "token": " providing"
        },
        {
          "prob": 0.11972916211702697,
          "token": " allowing"
        },
        {
          "prob": 0.01113654951309598,
          "token": " offering"
        },
        {
          "prob": 0.00867315348151262,
          "token": " involving"
        }
      ],
      [
        {
          "prob": 0.8958866722378842,
          "token": " students"
        },
        {
          "prob": 0.057272125240420996,
          "token": " them"
        },
        {
          "prob": 0.044603575985403446,
          "token": " the"
        },
        {
          "prob": 0.001624684749150168,
          "token": " student"
        },
        {
          "prob": 0.00010386262114832646,
          "token": " its"
        }
      ],
      [
        {
          "prob": 0.9548218089434223,
          "token": " the"
        },
        {
          "prob": 0.02544513904103669,
          "token": " opportunities"
        },
        {
          "prob": 0.009360745762721666,
          "token": " an"
        },
        {
          "prob": 0.0044217032070218935,
          "token": ","
        },
        {
          "prob": 0.003902139384345193,
          "token": " a"
        }
      ],
      [
        {
          "prob": 0.9932709232693623,
          "token": " opportunity"
        },
        {
          "prob": 0.005212206428263326,
          "token": " chance"
        },
        {
          "prob": 0.0012380075401357174,
          "token": " ability"
        },
        {
          "prob": 6.984360609102486e-05,
          "token": " option"
        },
        {
          "prob": 6.163676604066802e-05,
          "token": " platform"
        }
      ],
      [
        {
          "prob": 0.9950614697837097,
          "token": " to"
        },
        {
          "prob": 0.004608047717814717,
          "token": " through"
        },
        {
          "prob": 8.984267045800908e-05,
          "token": "  "
        },
        {
          "prob": 7.928587839912154e-05,
          "token": ","
        },
        {
          "prob": 5.449233418324097e-05,
          "token": " via"
        }
      ],
      [
        {
          "prob": 0.9861839621097487,
          "token": " voice"
        },
        {
          "prob": 0.009668208978139435,
          "token": " express"
        },
        {
          "prob": 0.0019037832261096653,
          "token": " share"
        },
        {
          "prob": 0.0007003627093327893,
          "token": " raise"
        },
        {
          "prob": 0.0005123963040792827,
          "token": " provide"
        }
      ],
      [
        {
          "prob": 0.9038731388845136,
          "token": " their"
        },
        {
          "prob": 0.09526751942314568,
          "token": " concerns"
        },
        {
          "prob": 0.0004999181802070948,
          "token": " opinions"
        },
        {
          "prob": 9.843967938990304e-05,
          "token": " any"
        },
        {
          "prob": 5.970668368225802e-05,
          "token": "  "
        }
      ],
      [
        {
          "prob": 0.9763497910384548,
          "token": " concerns"
        },
        {
          "prob": 0.022961546252209978,
          "token": " opinions"
        },
        {
          "prob": 0.00017531356904633403,
          "token": " views"
        },
        {
          "prob": 0.00011319094751758007,
          "token": " feedback"
        },
        {
          "prob": 9.383859140650338e-05,
          "token": " concern"
        }
      ],
      [
        {
          "prob": 0.8775729115427672,
          "token": " or"
        },
        {
          "prob": 0.08162699854493935,
          "token": " and"
        },
        {
          "prob": 0.023386526636424883,
          "token": " through"
        },
        {
          "prob": 0.01104701296783394,
          "token": ","
        },
        {
          "prob": 0.00297326320465645,
          "token": " to"
        }
      ],
      [
        {
          "prob": 0.9992139562499304,
          "token": " opinions"
        },
        {
          "prob": 0.00020330834685999334,
          "token": " offer"
        },
        {
          "prob": 0.00015833669973951562,
          "token": " opinion"
        },
        {
          "prob": 9.02175320361532e-05,
          "token": " provide"
        },
        {
          "prob": 7.026148459652568e-05,
          "token": " give"
        }
      ],
      [
        {
          "prob": 0.956810351655319,
          "token": " through"
        },
        {
          "prob": 0.025498131243815694,
          "token": " to"
        },
        {
          "prob": 0.008278033194968469,
          "token": " on"
        },
        {
          "prob": 0.005344699934052567,
          "token": " via"
        },
        {
          "prob": 0.0016300413838171678,
          "token": ","
        }
      ],
      [
        {
          "prob": 0.9995183881008686,
          "token": " the"
        },
        {
          "prob": 0.0001583850276394364,
          "token": " their"
        },
        {
          "prob": 0.00010885633141759644,
          "token": " Student"
        },
        {
          "prob": 5.826659545791931e-05,
          "token": " a"
        },
        {
          "prob": 4.537807016953232e-05,
          "token": " both"
        }
      ],
      [
        {
          "prob": 0.9946363721261512,
          "token": " Student"
        },
        {
          "prob": 0.0049031459645104605,
          "token": " student"
        },
        {
          "prob": 0.00029445694294887346,
          "token": " Students"
        },
        {
          "prob": 6.57022248369992e-05,
          "token": " Sk"
        },
        {
          "prob": 3.743599925873161e-05,
          "token": "  "
        }
      ],
      [
        {
          "prob": 0.9999457627138926,
          "token": " Council"
        },
        {
          "prob": 4.264696874151224e-05,
          "token": " council"
        },
        {
          "prob": 4.494957435269457e-06,
          "token": "Council"
        },
        {
          "prob": 3.966786013874893e-06,
          "token": "  "
        },
        {
          "prob": 7.33781629979293e-07,
          "token": " Counsel"
        }
      ],
      [
        {
          "prob": 0.7196316526544332,
          "token": " and"
        },
        {
          "prob": 0.14170388270035647,
          "token": "."
        },
        {
          "prob": 0.12505323756727543,
          "token": ","
        },
        {
          "prob": 0.012381947278467226,
          "token": " or"
        },
        {
          "prob": 0.00037390240948280786,
          "token": "  "
        }
      ],
      [
        {
          "prob": 0.4034811068273422,
          "token": " by"
        },
        {
          "prob": 0.2773082223882886,
          "token": " participating"
        },
        {
          "prob": 0.10201599388444967,
          "token": " participate"
        },
        {
          "prob": 0.10201599388444967,
          "token": " working"
        },
        {
          "prob": 0.024230922428271733,
          "token": " through"
        }
      ],
      [
        {
          "prob": 0.6970698791129291,
          "token": " participating"
        },
        {
          "prob": 0.17624686123001063,
          "token": " allowing"
        },
        {
          "prob": 0.034705064694282514,
          "token": " providing"
        },
        {
          "prob": 0.016393515680810378,
          "token": " engaging"
        },
        {
          "prob": 0.014467226810787152,
          "token": " offering"
        }
      ],
      [
        {
          "prob": 0.9998684102614147,
          "token": " in"
        },
        {
          "prob": 4.2643674491930676e-05,
          "token": "  "
        },
        {
          "prob": 2.753282559718573e-05,
          "token": " actively"
        },
        {
          "prob": 1.0128760494563469e-05,
          "token": " them"
        },
        {
          "prob": 7.88828660470874e-06,
          "token": " on"
        }
      ],
      [
        {
          "prob": 0.9991592091323249,
          "token": " working"
        },
        {
          "prob": 0.0007095772833866377,
          "token": " work"
        },
        {
          "prob": 2.7513297058702197e-05,
          "token": " Working"
        },
        {
          "prob": 2.5846350658012423e-05,
          "token": "  "
        },
        {
          "prob": 2.142737729419345e-05,
          "token": " student"
        }
      ],
      [
        {
          "prob": 0.9999849798550975,
          "token": " groups"
        },
        {
          "prob": 8.939639814564699e-06,
          "token": " group"
        },
        {
          "prob": 2.9022761230933693e-06,
          "token": "groups"
        },
        {
          "prob": 1.9947032634931005e-06,
          "token": "  "
        },
        {
          "prob": 2.699537311378345e-07,
          "token": " parties"
        }
      ],
      [
        {
          "prob": 0.9084925791856895,
          "token": "."
        },
        {
          "prob": 0.03309184224338819,
          "token": " and"
        },
        {
          "prob": 0.021365699181227854,
          "token": " where"
        },
        {
          "prob": 0.021365699181227854,
          "token": " to"
        },
        {
          "prob": 0.006516168538162654,
          "token": " with"
        }
      ],
      [
        {
          "prob": 0.9779799097037495,
          "token": " "
        },
        {
          "prob": 0.020297325517488696,
          "token": "  "
        },
        {
          "prob": 0.0008918020313723959,
          "token": "\n"
        },
        {
          "prob": 0.000508133480536139,
          "token": "   "
        },
        {
          "prob": 0.00010651056371309546,
          "token": "\n\n"
        }
      ],
      [
        {
          "prob": 0.9971236707303809,
          "token": "\n"
        },
        {
          "prob": 0.002321874203098842,
          "token": "\n\n\n"
        },
        {
          "prob": 0.0004034812364683455,
          "token": "\n\n"
        },
        {
          "prob": 6.586653262043458e-05,
          "token": ""
        },
        {
          "prob": 4.526936170116052e-05,
          "token": "\n\n\n\n\n"
        }
      ],
      [
        {
          "prob": 0.9997289915340261,
          "token": ""
        },
        {
          "prob": 0.00026118780669967523,
          "token": " "
        },
        {
          "prob": 6.142548458651395e-06,
          "token": "  "
        },
        {
          "prob": 1.0027434709058192e-06,
          "token": "."
        },
        {
          "prob": 1.974518966561329e-07,
          "token": "   "
        }
      ]
    ],
    "language_consistency_score": 0.737064409419153
  },
  {
    "question": "How many enterprises have Skoltech faculty, students and alumni founded in Russia and abroad?\n",
    "true_answer": "120 \n",
    "source_doc": "\n### Text After Video 2\n\nMore information about the Skolkovo Foundation and the project goals: [https://old.sk.ru/foundation/about/](https://old.sk.ru/foundation/about/)  \nThe Skolkovo Innovation Center: [https://sk.ru/](https://sk.ru/) \n\nFaculty, students and alumni founded more than 120 enterprises in Russia and abroad, 71+ companies received Skolkovo residency. Skoltech campus, marked with the prestigious Prix Versailles Award, cultivates strong and active interaction between research, teaching & learning, building a community of faculty, students, and staff, which now exceeds 2200 people. Over the 10 years of its existence, Skoltech has achieved a lot, and we mean A LOT: from the development of new technology to the construction of one of the most comfortable campuses in the world. Read about our university’s top 10 achievements in the last 10 years in the 2021 Annual Report: [https://www.skoltech.ru/app/data/uploads/2019/10/SKOLTECH-ANNUAL-REPORT-2021-ONLINE-VERSION.pdf](https://www.skoltech.ru/app/data/uploads/2019/10/SKOLTECH-ANNUAL-REPORT-2021-ONLINE-VERSION.pdf)\n\nFor more information on Skoltech strategy, see the [Strategy booklet](https://www.skoltech.ru/app/data/uploads/2019/10/Skoltech-strategy-2021-2025-Dec-2021-for-site.pdf): [https://www.skoltech.ru/app/data/uploads/2019/10/Skoltech-strategy-2021-2025-Dec-2021-for-site.pdf](https://www.skoltech.ru/app/data/uploads/2019/10/Skoltech-strategy-2021-2025-Dec-2021-for-site.pdf)\n\nSkoltech Founders: [founded (links to an external site)](https://www.skoltech.ru/en/about/founders/)  \nMandatory reading: [Code of Ethics https://www.skoltech.ru/app/data/uploads/2018/10/Code-of-Ethics.pdf](https://www.skoltech.ru/app/data/uploads/2018/10/Code-of-Ethics.pdf)\n\nHighlights: \n\n* Skoltech is part of the bigger Skolkovo community which provides a number of career opportunities for students and alumi. * Skoltech is a place of mutual respect and non-discrimination zone. Please remember that while communicating with others.",
    "context": "Sim: 8.69 - Faculty, students and alumni founded more than 120 enterprises in Russia and abroad, 71+ companies received Skolkovo residency. Skoltech campus, marked with the prestigious Prix Versailles Award, cultivates strong and active interaction between research, teaching & learning, building a community of faculty, students, and staff, which now exceeds 2200 people.\nSim: 4.93 - * 93 Startups are founded by Skoltech community members — researchers, students and alumni. Alumni Workshop will teach you all about that.  \nSim: 2.01 - Let us start by saying that you’ve come to a very unique university. Skoltech is a one-of-a-kind institute in Russia, and one with few similar educational organizations worldwide. Don’t get us wrong \\- there are dozens of incredible universities out there, but can you think of one that has been named among the Top 100 in just the first 8 years of its existence? Exactly\\! Ah, wait, let’s back up a little. Skoltech was established in 2011 in collaboration with MIT with the vision of being a worldleading institute of science and technology and the mission to impact economy and society development by academic and technology excellence and entrepreneurial spirit. Skoltech became a home for talents who are working in promising areas of global science and technology agenda. The broad, but well-structured portfolio divided among several Centers covers Artificial Intelligence and Communications, Life Sciences and Health, Cutting-edge Engineering and Advanced Materials, Energy Efficiency and ESG, Photonics, and Advanced Studies. Skoltech research excellence is globally recognized: the Institute appeared among top-100 world’s leading young universities in the prestigious Nature Index ranking. To learn more about the faculty, students, alumni, and their achievements, see the link below. You can also find more information about the university’s achievements there as well.   \nSim: 0.58 - So, who is behind Skoltech? You will obviously get to know your professors and fellow students in the next few weeks, but you should also probably know who runs the university on the administrative side. You know, just to have an idea. Skoltech was founded by the top Russian companies and leading institutes. Among them are VEB.RF, Sber, MIPT, New Economic School, Moscow School of Management.The Founders are entitled to approve the Charter, establish the Institute's governance bodies, and appoint the Board of Trustees. You can read more about the Founders below. Honored academics, statesmen and businessmen make up the Board of Trustees. Members of the Board set and hold Skoltech accountable for following its strategies, as well as oversee the development of the university. The final key player of the Skoltech government bodies is the Student Council, whose role is to voice student needs to the university administration. Each year, students elect the Council and its President, Vice President and Coordinator to represent you over the course of the next academic year. You will learn more about the Student Council’s role and activities in the next module.Meanwhile, let’s see what happens behind the scenes of the day-to-day management\\! Below you will see Skoltech’s current leadership team . It consists of the University President and Provost, as well as several Vice Presidents and Deans responsible for different areas of the university’s management. You will get to know team members and leaders of these departments as you attend Skoltech events throughout your time here.  ",
    "generated_answer": "Over 120 enterprises have been founded. \n",
    "logprobs": [
      [
        {
          "prob": 0.6911676642059573,
          "token": "Over"
        },
        {
          "prob": 0.174754552851145,
          "token": "More"
        },
        {
          "prob": 0.10599399422859124,
          "token": "Sk"
        },
        {
          "prob": 0.01841899435916602,
          "token": "1"
        },
        {
          "prob": 0.007678179189009001,
          "token": "Faculty"
        }
      ],
      [
        {
          "prob": 0.9998301556085302,
          "token": " "
        },
        {
          "prob": 7.966583341127103e-05,
          "token": " than"
        },
        {
          "prob": 3.320966021519404e-05,
          "token": " one"
        },
        {
          "prob": 1.5687132713551632e-05,
          "token": "  "
        },
        {
          "prob": 1.1476951466594516e-05,
          "token": " a"
        }
      ],
      [
        {
          "prob": 0.9999461203042396,
          "token": "1"
        },
        {
          "prob": 4.5397505209397035e-05,
          "token": "8"
        },
        {
          "prob": 4.494961721996961e-06,
          "token": "2"
        },
        {
          "prob": 1.1365043049475188e-06,
          "token": "\n"
        },
        {
          "prob": 9.132068641201274e-07,
          "token": "7"
        }
      ],
      [
        {
          "prob": 0.9999765163221908,
          "token": "2"
        },
        {
          "prob": 8.397942338222913e-06,
          "token": "0"
        },
        {
          "prob": 6.54032406919651e-06,
          "token": "3"
        },
        {
          "prob": 1.9946861428911334e-06,
          "token": "5"
        },
        {
          "prob": 1.9946861428911334e-06,
          "token": "1"
        }
      ],
      [
        {
          "prob": 0.9999866487378297,
          "token": "0"
        },
        {
          "prob": 2.902281658751044e-06,
          "token": "5"
        },
        {
          "prob": 2.8129878394726436e-06,
          "token": "1"
        },
        {
          "prob": 2.642557521936058e-06,
          "token": "2"
        },
        {
          "prob": 1.1726277920936499e-06,
          "token": "3"
        }
      ],
      [
        {
          "prob": 0.975318261052984,
          "token": " enterprises"
        },
        {
          "prob": 0.02154758546066024,
          "token": "."
        },
        {
          "prob": 0.000737317828623607,
          "token": " businesses"
        },
        {
          "prob": 0.0006926459996542841,
          "token": " companies"
        },
        {
          "prob": 0.0003707466872329161,
          "token": " enterprise"
        }
      ],
      [
        {
          "prob": 0.8864053705395551,
          "token": " have"
        },
        {
          "prob": 0.09342643800625994,
          "token": "."
        },
        {
          "prob": 0.011158199465996036,
          "token": " in"
        },
        {
          "prob": 0.005972553785868872,
          "token": " were"
        },
        {
          "prob": 0.0012519152838905152,
          "token": " are"
        }
      ],
      [
        {
          "prob": 0.9999572056975242,
          "token": " been"
        },
        {
          "prob": 2.9311139826430532e-05,
          "token": "  "
        },
        {
          "prob": 1.287841604980292e-06,
          "token": " be"
        },
        {
          "prob": 1.0029720504305862e-06,
          "token": " either"
        },
        {
          "prob": 9.72113844528208e-07,
          "token": " had"
        }
      ],
      [
        {
          "prob": 0.9996293965140844,
          "token": " founded"
        },
        {
          "prob": 0.00019106994757112677,
          "token": " established"
        },
        {
          "prob": 6.603200697594877e-05,
          "token": " formed"
        },
        {
          "prob": 2.4291817825740812e-05,
          "token": " created"
        },
        {
          "prob": 2.2820050984986166e-05,
          "token": " started"
        }
      ],
      [
        {
          "prob": 0.48473696783862874,
          "token": "."
        },
        {
          "prob": 0.42777887268583853,
          "token": " by"
        },
        {
          "prob": 0.08423466447908402,
          "token": " in"
        },
        {
          "prob": 0.0012015429573757255,
          "token": ","
        },
        {
          "prob": 0.0005675687047458154,
          "token": " globally"
        }
      ],
      [
        {
          "prob": 0.9836739326220392,
          "token": " "
        },
        {
          "prob": 0.015899606864920483,
          "token": "  "
        },
        {
          "prob": 0.00018802033826947366,
          "token": "   "
        },
        {
          "prob": 0.00010713075944604437,
          "token": "\n"
        },
        {
          "prob": 9.454256338266954e-05,
          "token": ""
        }
      ],
      [
        {
          "prob": 0.9979680426578638,
          "token": "\n"
        },
        {
          "prob": 0.0017001578363519203,
          "token": "\n\n\n"
        },
        {
          "prob": 0.0002161508126247452,
          "token": "\n\n"
        },
        {
          "prob": 9.010506430590211e-05,
          "token": ""
        },
        {
          "prob": 1.4709247397313865e-05,
          "token": "\n\n\n\n\n"
        }
      ],
      [
        {
          "prob": 0.9998614979875435,
          "token": ""
        },
        {
          "prob": 0.00013135088780511712,
          "token": " "
        },
        {
          "prob": 3.7261378757624216e-06,
          "token": "  "
        },
        {
          "prob": 3.0586002240441555e-07,
          "token": "**"
        },
        {
          "prob": 2.5356686466057015e-07,
          "token": "."
        }
      ]
    ],
    "language_consistency_score": 0.23184823646621677
  },
  {
    "question": "Where can I find information about Skoltech policies?\n",
    "true_answer": "The Skoltech Wiki. \n",
    "source_doc": "* If you are unsure about a certain situation (e.g. terms of getting a scholarship), there is a good chance that we have a policy about it. Don’t forget to consult policies in our [Wiki  Ссылка:  Wiki (links to an external site)](https://wiki.skoltech.ru/pages/viewpage.action?pageId=136773929)  \n* Getting feedback from you makes Skoltech a better place for everyone. Tell us what you think\\! ## “Navigating the Skoltech Campus” \\- Module 2\n",
    "context": "Sim: 2.17 - Now along with the Code of Ethics, you will likely hear the term “Policy”. A Policy is an official document passed by Skoltech’s leadership team to optimize the university’s functions and/or activities. For instance, you can hear something like “Skoltech Policy on Student Scholarships and Other Benefits” or “Skoltech’s IP policy”, which, btw, you will learn about in the next modules.   \nSim: 1.87 - *       [Scholarship Policy](https://skoltech.instructure.com/courses/2072/files/folder/Policies/Scholarship-Related%20Documents?preview=247567)  \nSim: 1.63 - * [Skoltech Policy on Protection, Management and Commercialization of Intellectual Property  (links to an external site)](https://box.skoltech.ru/index.php/s/5ObKxspK8llpIGf\\#pdfviewer) (updated in June 2022\\)  \nSim: 1.22 - * If you are unsure about a certain situation (e.g. terms of getting a scholarship), there is a good chance that we have a policy about it. Don’t forget to consult policies in our [Wiki  Ссылка:  Wiki (links to an external site)](https://wiki.skoltech.ru/pages/viewpage.action?pageId=136773929)  \nSim: 1.00 - *       [IP regulations](https://skoltech.instructure.com/courses/2072/files/folder/Policies/IP%20Policy)\nSim: 0.62 - [Disciplinary Board Policy (links to an external site).](http://www.skoltech.ru/app/data/uploads/sites/2/2015/04/DISCIPLINARY-BOARD-POLICY.pdf)",
    "generated_answer": "You can find information about Skoltech policies in the Wiki, the Policies folder on the Skoltech website, and in specific documents like the IP Policy, Scholarship Policy, and Disciplinary Board Policy. \n",
    "logprobs": [
      [
        {
          "prob": 0.8167678032727612,
          "token": "You"
        },
        {
          "prob": 0.07597123889307188,
          "token": "Sk"
        },
        {
          "prob": 0.04607888564500096,
          "token": "The"
        },
        {
          "prob": 0.027948256909085426,
          "token": "Policies"
        },
        {
          "prob": 0.02176612436627653,
          "token": "Information"
        }
      ],
      [
        {
          "prob": 0.9988616564959835,
          "token": " can"
        },
        {
          "prob": 0.0008556585394038273,
          "token": " should"
        },
        {
          "prob": 0.0001582809899357987,
          "token": " may"
        },
        {
          "prob": 7.476664558040848e-05,
          "token": " will"
        },
        {
          "prob": 1.8903968448227216e-05,
          "token": " could"
        }
      ],
      [
        {
          "prob": 0.9927425458082996,
          "token": " find"
        },
        {
          "prob": 0.004893812203058539,
          "token": " access"
        },
        {
          "prob": 0.0009636487590389844,
          "token": " learn"
        },
        {
          "prob": 0.0005844825175511757,
          "token": " consult"
        },
        {
          "prob": 0.0001674569651096097,
          "token": " view"
        }
      ],
      [
        {
          "prob": 0.9057927216085503,
          "token": " information"
        },
        {
          "prob": 0.03979775943014277,
          "token": " Sk"
        },
        {
          "prob": 0.03512139942690787,
          "token": " policies"
        },
        {
          "prob": 0.01140224898102377,
          "token": " policy"
        },
        {
          "prob": 0.00198141376963632,
          "token": " a"
        }
      ],
      [
        {
          "prob": 0.9914198992527372,
          "token": " about"
        },
        {
          "prob": 0.008057782178500611,
          "token": " on"
        },
        {
          "prob": 0.00037686748752284644,
          "token": " regarding"
        },
        {
          "prob": 4.791330139762393e-05,
          "token": "  "
        },
        {
          "prob": 2.2632641011636857e-05,
          "token": " in"
        }
      ],
      [
        {
          "prob": 0.9923168446228121,
          "token": " Sk"
        },
        {
          "prob": 0.005207200805408939,
          "token": " policies"
        },
        {
          "prob": 0.0005488349270280176,
          "token": " the"
        },
        {
          "prob": 0.00037720836117238207,
          "token": " policy"
        },
        {
          "prob": 0.00025925138612475576,
          "token": " university"
        }
      ],
      [
        {
          "prob": 0.999935750323403,
          "token": "ol"
        },
        {
          "prob": 2.753468993205563e-05,
          "token": "ot"
        },
        {
          "prob": 1.777773198028063e-05,
          "token": "olk"
        },
        {
          "prob": 6.5400621062013175e-06,
          "token": "kol"
        },
        {
          "prob": 2.2601849851822663e-06,
          "token": "olt"
        }
      ],
      [
        {
          "prob": 0.9999741322534375,
          "token": "tech"
        },
        {
          "prob": 7.411143965916963e-06,
          "token": "tek"
        },
        {
          "prob": 6.962125451973665e-06,
          "token": "Tech"
        },
        {
          "prob": 5.422108753838448e-06,
          "token": "tec"
        },
        {
          "prob": 1.7603009852189593e-06,
          "token": " tech"
        }
      ],
      [
        {
          "prob": 0.9625184290154374,
          "token": " policies"
        },
        {
          "prob": 0.025650247780641452,
          "token": "'"
        },
        {
          "prob": 0.008864486320839264,
          "token": " Policies"
        },
        {
          "prob": 0.0016397650890879964,
          "token": "’"
        },
        {
          "prob": 0.001058711913457566,
          "token": " policy"
        }
      ],
      [
        {
          "prob": 0.6414917993789796,
          "token": " in"
        },
        {
          "prob": 0.3030192698842792,
          "token": " on"
        },
        {
          "prob": 0.028185185969210207,
          "token": ","
        },
        {
          "prob": 0.011749333548139325,
          "token": " by"
        },
        {
          "prob": 0.00807519098057525,
          "token": " at"
        }
      ],
      [
        {
          "prob": 0.9214615326389437,
          "token": " the"
        },
        {
          "prob": 0.045876867640233174,
          "token": " various"
        },
        {
          "prob": 0.009033690860159396,
          "token": " several"
        },
        {
          "prob": 0.006208758876099548,
          "token": " their"
        },
        {
          "prob": 0.00583258919206703,
          "token": " a"
        }
      ],
      [
        {
          "prob": 0.21945179956401306,
          "token": " Wiki"
        },
        {
          "prob": 0.193665533381857,
          "token": " ["
        },
        {
          "prob": 0.13310426063194883,
          "token": " university"
        },
        {
          "prob": 0.13310426063194883,
          "token": " \""
        },
        {
          "prob": 0.06287400074985523,
          "token": " Sk"
        }
      ],
      [
        {
          "prob": 0.4613452389029117,
          "token": ","
        },
        {
          "prob": 0.35929601190814014,
          "token": " ("
        },
        {
          "prob": 0.08016977667775546,
          "token": " (["
        },
        {
          "prob": 0.02770593345599349,
          "token": "  "
        },
        {
          "prob": 0.02445040045812917,
          "token": " ["
        }
      ],
      [
        {
          "prob": 0.2442967765979666,
          "token": " the"
        },
        {
          "prob": 0.1481734850756345,
          "token": " on"
        },
        {
          "prob": 0.11539763996379312,
          "token": " in"
        },
        {
          "prob": 0.10183805983361975,
          "token": " ["
        },
        {
          "prob": 0.06176790561474003,
          "token": "  "
        }
      ],
      [
        {
          "prob": 0.1830258306514803,
          "token": " Policies"
        },
        {
          "prob": 0.16151972864290404,
          "token": " ["
        },
        {
          "prob": 0.09796666757038612,
          "token": " Policy"
        },
        {
          "prob": 0.08645528068740048,
          "token": " policies"
        },
        {
          "prob": 0.07629651741871271,
          "token": " course"
        }
      ],
      [
        {
          "prob": 0.6958779350992786,
          "token": " folder"
        },
        {
          "prob": 0.22591848861021438,
          "token": " section"
        },
        {
          "prob": 0.025347351933121744,
          "token": " document"
        },
        {
          "prob": 0.012745445931164917,
          "token": " page"
        },
        {
          "prob": 0.011247816556312473,
          "token": " and"
        }
      ],
      [
        {
          "prob": 0.553786558339368,
          "token": " on"
        },
        {
          "prob": 0.20372667746708642,
          "token": ","
        },
        {
          "prob": 0.14001916122683483,
          "token": " in"
        },
        {
          "prob": 0.05151017078542208,
          "token": " within"
        },
        {
          "prob": 0.020171672710654155,
          "token": " of"
        }
      ],
      [
        {
          "prob": 0.9339735907066863,
          "token": " the"
        },
        {
          "prob": 0.01938400260010666,
          "token": " Sk"
        },
        {
          "prob": 0.012515255698902418,
          "token": " In"
        },
        {
          "prob": 0.006293065771788914,
          "token": " sk"
        },
        {
          "prob": 0.0052171347674374235,
          "token": " in"
        }
      ],
      [
        {
          "prob": 0.39919021021382306,
          "token": " Sk"
        },
        {
          "prob": 0.18856409224736853,
          "token": " website"
        },
        {
          "prob": 0.08907137022562817,
          "token": " university"
        },
        {
          "prob": 0.04767646886711359,
          "token": " course"
        },
        {
          "prob": 0.019874509103084498,
          "token": " internal"
        }
      ],
      [
        {
          "prob": 0.9998512489306338,
          "token": "ol"
        },
        {
          "prob": 4.832078429526023e-05,
          "token": "ole"
        },
        {
          "prob": 2.2825122303294238e-05,
          "token": "kol"
        },
        {
          "prob": 1.777622312350614e-05,
          "token": "otech"
        },
        {
          "prob": 1.012858662435848e-05,
          "token": "olk"
        }
      ],
      [
        {
          "prob": 0.9991743235349113,
          "token": "tech"
        },
        {
          "prob": 0.0005882692057341074,
          "token": "tek"
        },
        {
          "prob": 0.00010881886119905317,
          "token": "tec"
        },
        {
          "prob": 8.474821431476112e-05,
          "token": "Tech"
        },
        {
          "prob": 7.4052164386246135e-06,
          "token": " tech"
        }
      ],
      [
        {
          "prob": 0.4032607066721448,
          "token": " website"
        },
        {
          "prob": 0.4032607066721448,
          "token": " intran"
        },
        {
          "prob": 0.0375090841784092,
          "token": " Int"
        },
        {
          "prob": 0.0375090841784092,
          "token": " In"
        },
        {
          "prob": 0.02921210413043633,
          "token": " in"
        }
      ],
      [
        {
          "prob": 0.9385492793195798,
          "token": ","
        },
        {
          "prob": 0.02662459626354133,
          "token": " and"
        },
        {
          "prob": 0.011814592973941235,
          "token": " ("
        },
        {
          "prob": 0.008643740869378592,
          "token": " or"
        },
        {
          "prob": 0.003384937559984863,
          "token": " in"
        }
      ],
      [
        {
          "prob": 0.8382254272320936,
          "token": " and"
        },
        {
          "prob": 0.11344148406263496,
          "token": " or"
        },
        {
          "prob": 0.012727778733301491,
          "token": "  "
        },
        {
          "prob": 0.010551699179664187,
          "token": " the"
        },
        {
          "prob": 0.00468228812776072,
          "token": " as"
        }
      ],
      [
        {
          "prob": 0.20878692198378113,
          "token": " in"
        },
        {
          "prob": 0.20878692198378113,
          "token": " specific"
        },
        {
          "prob": 0.14349701303121992,
          "token": " the"
        },
        {
          "prob": 0.06778318937418981,
          "token": " by"
        },
        {
          "prob": 0.06778318937418981,
          "token": " on"
        }
      ],
      [
        {
          "prob": 0.4300711334021927,
          "token": " specific"
        },
        {
          "prob": 0.20315123082737144,
          "token": " the"
        },
        {
          "prob": 0.0959618465910196,
          "token": " documents"
        },
        {
          "prob": 0.07473516127006409,
          "token": " various"
        },
        {
          "prob": 0.04000284918201162,
          "token": " individual"
        }
      ],
      [
        {
          "prob": 0.5688625951834644,
          "token": " documents"
        },
        {
          "prob": 0.2371372103477367,
          "token": " policy"
        },
        {
          "prob": 0.09885348466223041,
          "token": " document"
        },
        {
          "prob": 0.013378364345689103,
          "token": " policies"
        },
        {
          "prob": 0.00978782044504866,
          "token": " links"
        }
      ],
      [
        {
          "prob": 0.4588699871880864,
          "token": " like"
        },
        {
          "prob": 0.21675483400434997,
          "token": " such"
        },
        {
          "prob": 0.11602050208756497,
          "token": " linked"
        },
        {
          "prob": 0.04836454082433693,
          "token": " related"
        },
        {
          "prob": 0.02755728468770474,
          "token": ","
        }
      ],
      [
        {
          "prob": 0.9332445814830502,
          "token": " the"
        },
        {
          "prob": 0.03193387302705648,
          "token": " \""
        },
        {
          "prob": 0.005907172537007011,
          "token": " ["
        },
        {
          "prob": 0.004897218039294401,
          "token": " Scholarship"
        },
        {
          "prob": 0.004059936352653387,
          "token": " \"["
        }
      ],
      [
        {
          "prob": 0.5139303472611528,
          "token": " IP"
        },
        {
          "prob": 0.2750870918342654,
          "token": " Scholarship"
        },
        {
          "prob": 0.0576613869067418,
          "token": " Code"
        },
        {
          "prob": 0.05088599534393159,
          "token": " Policy"
        },
        {
          "prob": 0.021212438792422496,
          "token": " scholarship"
        }
      ],
      [
        {
          "prob": 0.6387247264941389,
          "token": " Policy"
        },
        {
          "prob": 0.34188468915573805,
          "token": " policy"
        },
        {
          "prob": 0.009698522108937197,
          "token": ","
        },
        {
          "prob": 0.004876723176022948,
          "token": " and"
        },
        {
          "prob": 0.0016853504325113442,
          "token": " regulations"
        }
      ],
      [
        {
          "prob": 0.4051317582188148,
          "token": ","
        },
        {
          "prob": 0.21685139071726248,
          "token": " and"
        },
        {
          "prob": 0.19137068062914603,
          "token": "."
        },
        {
          "prob": 0.1688840329007272,
          "token": " or"
        },
        {
          "prob": 0.004500607031327742,
          "token": " document"
        }
      ],
      [
        {
          "prob": 0.9125800146620746,
          "token": " Scholarship"
        },
        {
          "prob": 0.02284599295884483,
          "token": " the"
        },
        {
          "prob": 0.021461824218483524,
          "token": " Student"
        },
        {
          "prob": 0.007417009751693174,
          "token": "  "
        },
        {
          "prob": 0.006545488132308965,
          "token": " scholarship"
        }
      ],
      [
        {
          "prob": 0.9837958699535819,
          "token": " Policy"
        },
        {
          "prob": 0.012384161541139319,
          "token": " policy"
        },
        {
          "prob": 0.0018991726825436583,
          "token": " Policies"
        },
        {
          "prob": 0.000842752769258217,
          "token": "-"
        },
        {
          "prob": 0.0002570251954664181,
          "token": " policies"
        }
      ],
      [
        {
          "prob": 0.948558134936234,
          "token": ","
        },
        {
          "prob": 0.04436465880065808,
          "token": " and"
        },
        {
          "prob": 0.0028361377502914074,
          "token": " or"
        },
        {
          "prob": 0.0016159825786870433,
          "token": "."
        },
        {
          "prob": 0.000980142979535175,
          "token": " etc"
        }
      ],
      [
        {
          "prob": 0.8855766493496022,
          "token": " and"
        },
        {
          "prob": 0.06415095970390113,
          "token": " or"
        },
        {
          "prob": 0.0365521150292884,
          "token": " etc"
        },
        {
          "prob": 0.008155879280248949,
          "token": "  "
        },
        {
          "prob": 0.0012507445966138165,
          "token": " Student"
        }
      ],
      [
        {
          "prob": 0.7972773642896329,
          "token": " Discipl"
        },
        {
          "prob": 0.10789974987511938,
          "token": " the"
        },
        {
          "prob": 0.03728915576220982,
          "token": " more"
        },
        {
          "prob": 0.00885695293168008,
          "token": " Student"
        },
        {
          "prob": 0.00885695293168008,
          "token": " others"
        }
      ],
      [
        {
          "prob": 0.9995672192513024,
          "token": "inary"
        },
        {
          "prob": 0.0002611454651545604,
          "token": "in"
        },
        {
          "prob": 7.028634843353425e-05,
          "token": "ines"
        },
        {
          "prob": 2.5856902583709857e-05,
          "token": "inar"
        },
        {
          "prob": 2.4290312051032552e-05,
          "token": "inery"
        }
      ],
      [
        {
          "prob": 0.9932259980334689,
          "token": " Board"
        },
        {
          "prob": 0.0038131607642492805,
          "token": " board"
        },
        {
          "prob": 0.001917377644144345,
          "token": " Policy"
        },
        {
          "prob": 0.00040190418768160015,
          "token": " Boards"
        },
        {
          "prob": 0.00015738794128108288,
          "token": "  "
        }
      ],
      [
        {
          "prob": 0.9635157446388347,
          "token": " Policy"
        },
        {
          "prob": 0.030972165744538694,
          "token": " policy"
        },
        {
          "prob": 0.004191625824126865,
          "token": " Policies"
        },
        {
          "prob": 0.0007753728128345956,
          "token": " policies"
        },
        {
          "prob": 0.00011890727200470833,
          "token": "."
        }
      ],
      [
        {
          "prob": 0.9649524933355327,
          "token": "."
        },
        {
          "prob": 0.015597003299902075,
          "token": ","
        },
        {
          "prob": 0.0034801618441427386,
          "token": " ("
        },
        {
          "prob": 0.0018627964001731257,
          "token": " linked"
        },
        {
          "prob": 0.0011298431295073247,
          "token": " on"
        }
      ],
      [
        {
          "prob": 0.9549988815732008,
          "token": " "
        },
        {
          "prob": 0.04195972434585585,
          "token": "  "
        },
        {
          "prob": 0.0011181885117024096,
          "token": "   "
        },
        {
          "prob": 0.0009867978980830552,
          "token": "\n"
        },
        {
          "prob": 0.00023438504503436368,
          "token": ""
        }
      ],
      [
        {
          "prob": 0.9925809124384527,
          "token": "\n"
        },
        {
          "prob": 0.005208586496403231,
          "token": "\n\n\n"
        },
        {
          "prob": 0.0018000393271542594,
          "token": "\n\n"
        },
        {
          "prob": 0.00018972283972979717,
          "token": ""
        },
        {
          "prob": 0.00013880419471445847,
          "token": "\n\n\n\n"
        }
      ],
      [
        {
          "prob": 0.9996647766678914,
          "token": ""
        },
        {
          "prob": 0.0003150322027664172,
          "token": " "
        },
        {
          "prob": 8.936775703826524e-06,
          "token": "  "
        },
        {
          "prob": 1.4588885294572455e-06,
          "token": "."
        },
        {
          "prob": 6.891301454931274e-07,
          "token": "   "
        }
      ]
    ],
    "language_consistency_score": 0.5509968958971361
  },
  {
    "question": "What does the letter section, like \"A\" or \"C\", in a Skoltech location indicate?\n",
    "true_answer": "The letter section, like \"A\" or \"C\", in a Skoltech location indicates a laboratory facility. \n",
    "source_doc": "\n### Sometimes the location can include an additional letter section \\- like A, B, or C and look like this: E-C4 or E-A1. The C4 and A1 here means it’s a laboratory facility.",
    "context": "Sim: 1.41 - 1) The first letter E indicates that the room is located on the main Skoltech campus. That’s an easy one\\! R3 (or R1 or R2) indicate the ring you’re on.   \nSim: 1.02 - ### Sometimes the location can include an additional letter section \\- like A, B, or C and look like this: E-C4 or E-A1. The C4 and A1 here means it’s a laboratory facility.",
    "generated_answer": "The letter section, like \"A\" or \"C\", indicates a laboratory facility. \n",
    "logprobs": [
      [
        {
          "prob": 0.5637282665497554,
          "token": "The"
        },
        {
          "prob": 0.2073840396708699,
          "token": "A"
        },
        {
          "prob": 0.18301577265502353,
          "token": "It"
        },
        {
          "prob": 0.019289718220916196,
          "token": "An"
        },
        {
          "prob": 0.009111817699359722,
          "token": "Letter"
        }
      ],
      [
        {
          "prob": 0.9932272916661018,
          "token": " letter"
        },
        {
          "prob": 0.004599554246217367,
          "token": " letters"
        },
        {
          "prob": 0.0010262992755698717,
          "token": " \""
        },
        {
          "prob": 0.0007992826794794315,
          "token": " additional"
        },
        {
          "prob": 7.434487016670978e-05,
          "token": "  "
        }
      ],
      [
        {
          "prob": 0.9872343192467464,
          "token": " section"
        },
        {
          "prob": 0.01167450469905837,
          "token": " sections"
        },
        {
          "prob": 0.00035253949466312466,
          "token": " \""
        },
        {
          "prob": 0.00024229661503235274,
          "token": " after"
        },
        {
          "prob": 6.126217820963833e-05,
          "token": " A"
        }
      ],
      [
        {
          "prob": 0.7753668560714793,
          "token": ","
        },
        {
          "prob": 0.09260435683677609,
          "token": " indicates"
        },
        {
          "prob": 0.04956754032753509,
          "token": " like"
        },
        {
          "prob": 0.038603239222007764,
          "token": " \""
        },
        {
          "prob": 0.02653159244388909,
          "token": " after"
        }
      ],
      [
        {
          "prob": 0.9744485994538253,
          "token": " like"
        },
        {
          "prob": 0.01784764567128403,
          "token": " such"
        },
        {
          "prob": 0.005113436097483883,
          "token": " \""
        },
        {
          "prob": 0.0017671562291837225,
          "token": " A"
        },
        {
          "prob": 0.0004468070667106523,
          "token": "  "
        }
      ],
      [
        {
          "prob": 0.9922303398858118,
          "token": " \""
        },
        {
          "prob": 0.006280535055355974,
          "token": " A"
        },
        {
          "prob": 0.0006619635246681254,
          "token": " “"
        },
        {
          "prob": 0.0006218571821792876,
          "token": " '"
        },
        {
          "prob": 0.00012245093948068318,
          "token": "  "
        }
      ],
      [
        {
          "prob": 0.9996795489440699,
          "token": "A"
        },
        {
          "prob": 0.0002453510699388553,
          "token": "C"
        },
        {
          "prob": 4.538538438604438e-05,
          "token": " A"
        },
        {
          "prob": 1.3841760189071493e-05,
          "token": "E"
        },
        {
          "prob": 8.93691206924227e-06,
          "token": "a"
        }
      ],
      [
        {
          "prob": 0.9975487623415495,
          "token": "\""
        },
        {
          "prob": 0.0019257220688894774,
          "token": "\","
        },
        {
          "prob": 0.0004868987895302956,
          "token": ",\""
        },
        {
          "prob": 1.4703076446280612e-05,
          "token": ","
        },
        {
          "prob": 1.218927850079903e-05,
          "token": " or"
        }
      ],
      [
        {
          "prob": 0.9998129956035993,
          "token": " or"
        },
        {
          "prob": 0.00015843170826663298,
          "token": " and"
        },
        {
          "prob": 2.282425161058511e-05,
          "token": "  "
        },
        {
          "prob": 1.2096410198706773e-06,
          "token": " \""
        },
        {
          "prob": 1.2096410198706773e-06,
          "token": "or"
        }
      ],
      [
        {
          "prob": 0.9999734170346474,
          "token": " \""
        },
        {
          "prob": 1.6701254812673777e-05,
          "token": "  "
        },
        {
          "prob": 7.889114162311994e-06,
          "token": " “"
        },
        {
          "prob": 8.315065151877061e-07,
          "token": "\""
        },
        {
          "prob": 4.1810773312495246e-07,
          "token": " '"
        }
      ],
      [
        {
          "prob": 0.9998727006874217,
          "token": "C"
        },
        {
          "prob": 0.00012339415194219605,
          "token": "B"
        },
        {
          "prob": 2.2600427279548603e-06,
          "token": " C"
        },
        {
          "prob": 1.2097136990790742e-06,
          "token": "c"
        },
        {
          "prob": 1.4906597575761666e-07,
          "token": "A"
        }
      ],
      [
        {
          "prob": 0.9218373126723137,
          "token": "\","
        },
        {
          "prob": 0.07566901115949697,
          "token": ",\""
        },
        {
          "prob": 0.0024323763779988275,
          "token": "\""
        },
        {
          "prob": 4.742378953885102e-05,
          "token": "”,"
        },
        {
          "prob": 4.998430643179952e-06,
          "token": ",\","
        }
      ],
      [
        {
          "prob": 0.7844568371389536,
          "token": " indicates"
        },
        {
          "prob": 0.17503597448386685,
          "token": " in"
        },
        {
          "prob": 0.014367831150198474,
          "token": "  "
        },
        {
          "prob": 0.007690545826174882,
          "token": " after"
        },
        {
          "prob": 0.005285629694380656,
          "token": " designates"
        }
      ],
      [
        {
          "prob": 0.8419639369767402,
          "token": " a"
        },
        {
          "prob": 0.08874235003349493,
          "token": " that"
        },
        {
          "prob": 0.041918917967458474,
          "token": " it"
        },
        {
          "prob": 0.022437579913232187,
          "token": " the"
        },
        {
          "prob": 0.002364903523899536,
          "token": " which"
        }
      ],
      [
        {
          "prob": 0.8336421122762679,
          "token": " laboratory"
        },
        {
          "prob": 0.12784316420369787,
          "token": " specific"
        },
        {
          "prob": 0.016253434381387703,
          "token": " lab"
        },
        {
          "prob": 0.004656686915719913,
          "token": " location"
        },
        {
          "prob": 0.004374552518059882,
          "token": "  "
        }
      ],
      [
        {
          "prob": 0.9991107748515233,
          "token": " facility"
        },
        {
          "prob": 0.00020328740782387815,
          "token": " location"
        },
        {
          "prob": 0.00015832039240179234,
          "token": "."
        },
        {
          "prob": 0.00013971725591055946,
          "token": " facilities"
        },
        {
          "prob": 6.199915648222061e-05,
          "token": " building"
        }
      ],
      [
        {
          "prob": 0.8955079464316722,
          "token": "."
        },
        {
          "prob": 0.08329521298023679,
          "token": " in"
        },
        {
          "prob": 0.007747663536236863,
          "token": " within"
        },
        {
          "prob": 0.005002267545430442,
          "token": " location"
        },
        {
          "prob": 0.0014331736469438705,
          "token": ","
        }
      ],
      [
        {
          "prob": 0.9955260351878435,
          "token": " "
        },
        {
          "prob": 0.004330881505954323,
          "token": "  "
        },
        {
          "prob": 6.17767068330914e-05,
          "token": "\n"
        },
        {
          "prob": 3.306668834867937e-05,
          "token": "   "
        },
        {
          "prob": 2.1349458606175186e-05,
          "token": ""
        }
      ],
      [
        {
          "prob": 0.9991481414146475,
          "token": "\n"
        },
        {
          "prob": 0.0006261928870785943,
          "token": "\n\n\n"
        },
        {
          "prob": 0.00017940718035971818,
          "token": "\n\n"
        },
        {
          "prob": 3.3186991376362896e-05,
          "token": ""
        },
        {
          "prob": 5.417627414039459e-06,
          "token": "\n\n\n\n"
        }
      ],
      [
        {
          "prob": 0.999871628071919,
          "token": ""
        },
        {
          "prob": 0.0001233939165867535,
          "token": " "
        },
        {
          "prob": 2.4057983721249403e-06,
          "token": "  "
        },
        {
          "prob": 1.8551525037153058e-07,
          "token": "**"
        },
        {
          "prob": 1.3572585657976109e-07,
          "token": "."
        }
      ]
    ],
    "language_consistency_score": 0.4145658770909755
  },
  {
    "question": "What should students do if they hear an alarm during an emergency at Skoltech?\n",
    "true_answer": "Students should walk to the nearest fire exit, take the stairs, check in with an employee in a bright vest, and follow the instructions of security and safety personnel. \n",
    "source_doc": "\n### For more information on campus regulations, feel free to refer to [this official document](https://drive.google.com/file/d/1UeumlluoILU0lGHeXphZKpHAOtq9KhC9/view?usp=sharing) by clicking the link in the description. We also expect you to follow some basic social behavior rules. Avoid any discriminatory or violent actions or words. Be respectful of others’ space and activities, don’t interrupt people when they’re conferencing or studying in silence. And the most important rule: don’t cut in line at the cafeteria \\- everyone there is as hungry as you are\\! But that one is a pretty obvious one, right? In case of emergency, you will hear an alarm throughout the building and you will be asked to walk towards general assembly areas outside of the buildings. In case of a fire or any kind of alarm-sounding emergency \n\n1. Walk to the nearest fire exit  \n2. Take the stairs (don’t take the elevators)   \n3. Check in with an employee in a bright vest  \n4. Follow the instructions of security and safety personnel.",
    "context": "Sim: 1.43 - 2. Save emergency numbers on your phone or just flip your student pass when necessary. Skoltech cares about you, don’t hesitate to use your medical insurance or request mental health support.  ",
    "generated_answer": "The provided text does not contain information about what to do if a student hears an alarm during an emergency. \n",
    "logprobs": [
      [
        {
          "prob": 0.8173622095335843,
          "token": "The"
        },
        {
          "prob": 0.14203625861103028,
          "token": "This"
        },
        {
          "prob": 0.03169256935271408,
          "token": "Based"
        },
        {
          "prob": 0.005173669724966426,
          "token": "According"
        },
        {
          "prob": 0.0007934079491388364,
          "token": "While"
        }
      ],
      [
        {
          "prob": 0.6110071032995045,
          "token": " provided"
        },
        {
          "prob": 0.22477695171360343,
          "token": " document"
        },
        {
          "prob": 0.13633411281104663,
          "token": " text"
        },
        {
          "prob": 0.012681047865108477,
          "token": " context"
        },
        {
          "prob": 0.006787675795395655,
          "token": " passage"
        }
      ],
      [
        {
          "prob": 0.8745907133046918,
          "token": " text"
        },
        {
          "prob": 0.0813496011932043,
          "token": " document"
        },
        {
          "prob": 0.03391155905344034,
          "token": " context"
        },
        {
          "prob": 0.008574184884180647,
          "token": " information"
        },
        {
          "prob": 0.0007038119544190223,
          "token": " documents"
        }
      ],
      [
        {
          "prob": 0.7950613413055222,
          "token": " does"
        },
        {
          "prob": 0.13816094250490238,
          "token": " doesn"
        },
        {
          "prob": 0.021187666757103374,
          "token": " advises"
        },
        {
          "prob": 0.018698050286138326,
          "token": " suggests"
        },
        {
          "prob": 0.006878629930253073,
          "token": " states"
        }
      ],
      [
        {
          "prob": 0.9999007085246283,
          "token": " not"
        },
        {
          "prob": 3.3212003966694845e-05,
          "token": " suggest"
        },
        {
          "prob": 1.777710468719145e-05,
          "token": "  "
        },
        {
          "prob": 1.0129088924205277e-05,
          "token": " no"
        },
        {
          "prob": 5.09322576716612e-06,
          "token": " NOT"
        }
      ],
      [
        {
          "prob": 0.3281219735215434,
          "token": " contain"
        },
        {
          "prob": 0.1756310362756116,
          "token": " specify"
        },
        {
          "prob": 0.12070932825517616,
          "token": " mention"
        },
        {
          "prob": 0.10652560829826015,
          "token": " state"
        },
        {
          "prob": 0.05701904927158113,
          "token": " give"
        }
      ],
      [
        {
          "prob": 0.9622035555479135,
          "token": " information"
        },
        {
          "prob": 0.012112353508775502,
          "token": " instructions"
        },
        {
          "prob": 0.012112353508775502,
          "token": " the"
        },
        {
          "prob": 0.005374824288270259,
          "token": " any"
        },
        {
          "prob": 0.0025388872206389,
          "token": " an"
        }
      ],
      [
        {
          "prob": 0.6697964073122277,
          "token": " about"
        },
        {
          "prob": 0.31638941053125424,
          "token": " on"
        },
        {
          "prob": 0.011524482062345773,
          "token": " regarding"
        },
        {
          "prob": 0.0005737701763422307,
          "token": " relevant"
        },
        {
          "prob": 0.0005063504034174357,
          "token": " related"
        }
      ],
      [
        {
          "prob": 0.8804509194551451,
          "token": " what"
        },
        {
          "prob": 0.046662193422497104,
          "token": " actions"
        },
        {
          "prob": 0.01716605754739445,
          "token": " alarms"
        },
        {
          "prob": 0.015148992615164518,
          "token": " how"
        },
        {
          "prob": 0.005932430746583701,
          "token": " emergency"
        }
      ],
      [
        {
          "prob": 0.688752898463802,
          "token": " to"
        },
        {
          "prob": 0.28711492431304714,
          "token": " students"
        },
        {
          "prob": 0.01521653171326591,
          "token": " should"
        },
        {
          "prob": 0.003614243076326934,
          "token": " actions"
        },
        {
          "prob": 0.002484030517304003,
          "token": " a"
        }
      ],
      [
        {
          "prob": 0.9999723442092404,
          "token": " do"
        },
        {
          "prob": 1.0129813439012308e-05,
          "token": " should"
        },
        {
          "prob": 5.422098411996593e-06,
          "token": "  "
        },
        {
          "prob": 3.2886689268551154e-06,
          "token": " to"
        },
        {
          "prob": 1.0029873546863013e-06,
          "token": " perform"
        }
      ],
      [
        {
          "prob": 0.7260389199366469,
          "token": " if"
        },
        {
          "prob": 0.11134168444973405,
          "token": " in"
        },
        {
          "prob": 0.08671299103794214,
          "token": " when"
        },
        {
          "prob": 0.06753214532281306,
          "token": " during"
        },
        {
          "prob": 0.002618504813768535,
          "token": " with"
        }
      ],
      [
        {
          "prob": 0.38282582563479894,
          "token": " an"
        },
        {
          "prob": 0.38282582563479894,
          "token": " a"
        },
        {
          "prob": 0.11675529415451304,
          "token": " you"
        },
        {
          "prob": 0.07538288362351642,
          "token": " students"
        },
        {
          "prob": 0.02159755775929092,
          "token": " there"
        }
      ],
      [
        {
          "prob": 0.5433963982563864,
          "token": " student"
        },
        {
          "prob": 0.15568567469700495,
          "token": " fire"
        },
        {
          "prob": 0.08870702349899906,
          "token": " school"
        },
        {
          "prob": 0.034738169527959065,
          "token": " siren"
        },
        {
          "prob": 0.02705411363084173,
          "token": " campus"
        }
      ],
      [
        {
          "prob": 0.9964222623906477,
          "token": " hears"
        },
        {
          "prob": 0.0015946764995451272,
          "token": " hear"
        },
        {
          "prob": 0.0006647600663342358,
          "token": " encounters"
        },
        {
          "prob": 0.00029498563194521425,
          "token": " experiences"
        },
        {
          "prob": 0.00029498563194521425,
          "token": " hearing"
        }
      ],
      [
        {
          "prob": 0.9901687899975757,
          "token": " an"
        },
        {
          "prob": 0.009707271201197342,
          "token": " a"
        },
        {
          "prob": 2.90242153041271e-05,
          "token": " emergency"
        },
        {
          "prob": 1.8162889828643593e-05,
          "token": " the"
        },
        {
          "prob": 1.4594291980742564e-05,
          "token": " and"
        }
      ],
      [
        {
          "prob": 0.8733478224853407,
          "token": " alarm"
        },
        {
          "prob": 0.12581769609933238,
          "token": " emergency"
        },
        {
          "prob": 0.00035339601437238,
          "token": " alert"
        },
        {
          "prob": 4.4929239878556535e-05,
          "token": " actual"
        },
        {
          "prob": 4.4929239878556535e-05,
          "token": "  "
        }
      ],
      [
        {
          "prob": 0.9300587290133288,
          "token": " during"
        },
        {
          "prob": 0.040863925597929465,
          "token": " in"
        },
        {
          "prob": 0.01703462261811521,
          "token": "."
        },
        {
          "prob": 0.008046585963363202,
          "token": " at"
        },
        {
          "prob": 0.0017954360146533387,
          "token": " for"
        }
      ],
      [
        {
          "prob": 0.9971314934241438,
          "token": " an"
        },
        {
          "prob": 0.0023218930248253724,
          "token": " a"
        },
        {
          "prob": 0.0004034845071939873,
          "token": " emergency"
        },
        {
          "prob": 4.526970708029863e-05,
          "token": " emergencies"
        },
        {
          "prob": 1.8290615075981646e-05,
          "token": "  "
        }
      ],
      [
        {
          "prob": 0.9997965511486372,
          "token": " emergency"
        },
        {
          "prob": 4.831815767606858e-05,
          "token": " emer"
        },
        {
          "prob": 3.320855174169365e-05,
          "token": " Emergency"
        },
        {
          "prob": 3.320855174169365e-05,
          "token": " actual"
        },
        {
          "prob": 2.4295895468906298e-05,
          "token": "  "
        }
      ],
      [
        {
          "prob": 0.7035085128499555,
          "token": "."
        },
        {
          "prob": 0.29326598826766376,
          "token": " at"
        },
        {
          "prob": 0.0021034519240623758,
          "token": ","
        },
        {
          "prob": 0.00013446924677635975,
          "token": " situation"
        },
        {
          "prob": 0.00011866869377302108,
          "token": " and"
        }
      ],
      [
        {
          "prob": 0.9398452981453761,
          "token": " "
        },
        {
          "prob": 0.053022438316515146,
          "token": "  "
        },
        {
          "prob": 0.0036082230701945947,
          "token": " It"
        },
        {
          "prob": 0.0011004458620750663,
          "token": "   "
        },
        {
          "prob": 0.0007105012492624378,
          "token": " However"
        }
      ],
      [
        {
          "prob": 0.9883700560372366,
          "token": "\n"
        },
        {
          "prob": 0.0066595840855154876,
          "token": "\n\n\n"
        },
        {
          "prob": 0.004299750651435716,
          "token": "\n\n"
        },
        {
          "prob": 0.0005135319831077288,
          "token": ""
        },
        {
          "prob": 6.528829618832101e-05,
          "token": "\n\n\n\n"
        }
      ],
      [
        {
          "prob": 0.9997547274596941,
          "token": ""
        },
        {
          "prob": 0.00021653787267432846,
          "token": " "
        },
        {
          "prob": 7.887391435600929e-06,
          "token": "  "
        },
        {
          "prob": 2.90160915362929e-06,
          "token": "It"
        },
        {
          "prob": 2.5606610905889577e-06,
          "token": "."
        }
      ]
    ],
    "language_consistency_score": 0.5679406755316672
  },
  {
    "question": "What should I do if there is a fire at Skoltech?\n",
    "true_answer": "Walk to the nearest fire exit, take the stairs, check in with an employee in a bright vest, and follow the instructions of security and safety personnel. \n",
    "source_doc": "*Text Overlay:* \n\n1. *Walk to the nearest fire exit*   \n2. *Take the stairs (don’t take the elevators)*   \n3. *Check in with an employee in a bright vest*  \n4. *Follow the instructions of security and safety personnel.* \n\n![][image5]\n",
    "context": "",
    "generated_answer": "Follow the instructions of the fire alarm system and evacuate the building immediately. \n",
    "logprobs": [
      [
        {
          "prob": 0.5051763621664317,
          "token": "Follow"
        },
        {
          "prob": 0.06836818198317435,
          "token": "Ev"
        },
        {
          "prob": 0.0603347088354913,
          "token": "Refer"
        },
        {
          "prob": 0.05324519366566449,
          "token": "Please"
        },
        {
          "prob": 0.05324519366566449,
          "token": "In"
        }
      ],
      [
        {
          "prob": 0.9315589222036753,
          "token": " the"
        },
        {
          "prob": 0.05255495419538165,
          "token": " all"
        },
        {
          "prob": 0.005539252739738135,
          "token": " any"
        },
        {
          "prob": 0.0038070690205355396,
          "token": " evacuation"
        },
        {
          "prob": 0.0029649483343999646,
          "token": " your"
        }
      ],
      [
        {
          "prob": 0.5158072275073929,
          "token": " instructions"
        },
        {
          "prob": 0.31285291663208986,
          "token": " evacuation"
        },
        {
          "prob": 0.06980692139102157,
          "token": " fire"
        },
        {
          "prob": 0.037364952464271066,
          "token": " directions"
        },
        {
          "prob": 0.025680531231227818,
          "token": " emergency"
        }
      ],
      [
        {
          "prob": 0.49463102769412837,
          "token": " of"
        },
        {
          "prob": 0.3000088656597351,
          "token": " provided"
        },
        {
          "prob": 0.14171415366343126,
          "token": " given"
        },
        {
          "prob": 0.04600784964643328,
          "token": " from"
        },
        {
          "prob": 0.011632606108449737,
          "token": " and"
        }
      ],
      [
        {
          "prob": 0.7108421194440627,
          "token": " the"
        },
        {
          "prob": 0.12352582722239705,
          "token": " emergency"
        },
        {
          "prob": 0.05149322581838691,
          "token": " fire"
        },
        {
          "prob": 0.03123222022635782,
          "token": " Sk"
        },
        {
          "prob": 0.02146557011441428,
          "token": " any"
        }
      ],
      [
        {
          "prob": 0.4729532496744534,
          "token": " fire"
        },
        {
          "prob": 0.22340728284026987,
          "token": " emergency"
        },
        {
          "prob": 0.08218694636490884,
          "token": " Sk"
        },
        {
          "prob": 0.030234887900309964,
          "token": " designated"
        },
        {
          "prob": 0.030234887900309964,
          "token": " on"
        }
      ],
      [
        {
          "prob": 0.4074392942937147,
          "token": " alarm"
        },
        {
          "prob": 0.28002864203522165,
          "token": " safety"
        },
        {
          "prob": 0.1498885309620057,
          "token": " alarms"
        },
        {
          "prob": 0.05514090900831108,
          "token": " department"
        },
        {
          "prob": 0.03789775558420075,
          "token": " emergency"
        }
      ],
      [
        {
          "prob": 0.5171201796418737,
          "token": " system"
        },
        {
          "prob": 0.21556776250202456,
          "token": " and"
        },
        {
          "prob": 0.1018269887164514,
          "token": " personnel"
        },
        {
          "prob": 0.06176119064274015,
          "token": ","
        },
        {
          "prob": 0.02917392071709178,
          "token": " staff"
        }
      ],
      [
        {
          "prob": 0.8032063101785155,
          "token": " and"
        },
        {
          "prob": 0.13957633416355028,
          "token": ","
        },
        {
          "prob": 0.024254729999957217,
          "token": " personnel"
        },
        {
          "prob": 0.010110873323918735,
          "token": " or"
        },
        {
          "prob": 0.006528070462487214,
          "token": "."
        }
      ],
      [
        {
          "prob": 0.854959081490076,
          "token": " evacuate"
        },
        {
          "prob": 0.0795235905557739,
          "token": " evacuation"
        },
        {
          "prob": 0.00949773846730335,
          "token": " emergency"
        },
        {
          "prob": 0.00949773846730335,
          "token": " any"
        },
        {
          "prob": 0.006527693821338192,
          "token": " staff"
        }
      ],
      [
        {
          "prob": 0.8620128302821495,
          "token": " the"
        },
        {
          "prob": 0.08017967832265109,
          "token": " to"
        },
        {
          "prob": 0.04291708915717534,
          "token": " immediately"
        },
        {
          "prob": 0.003991911126363169,
          "token": " promptly"
        },
        {
          "prob": 0.0018856452976086712,
          "token": " your"
        }
      ],
      [
        {
          "prob": 0.9578287850696922,
          "token": " building"
        },
        {
          "prob": 0.03713905044254556,
          "token": " area"
        },
        {
          "prob": 0.0018490448843471652,
          "token": " premises"
        },
        {
          "prob": 0.0010535540172575905,
          "token": " nearest"
        },
        {
          "prob": 0.0006002969839596416,
          "token": " designated"
        }
      ],
      [
        {
          "prob": 0.3778808441663065,
          "token": " immediately"
        },
        {
          "prob": 0.1784982717057028,
          "token": "."
        },
        {
          "prob": 0.12267993380145885,
          "token": " to"
        },
        {
          "prob": 0.10826466158907064,
          "token": " as"
        },
        {
          "prob": 0.05114060497850184,
          "token": " promptly"
        }
      ],
      [
        {
          "prob": 0.7737610317958623,
          "token": "."
        },
        {
          "prob": 0.1523625900601667,
          "token": " to"
        },
        {
          "prob": 0.02336555994708429,
          "token": " if"
        },
        {
          "prob": 0.02062003428045657,
          "token": " and"
        },
        {
          "prob": 0.006694345006163978,
          "token": " using"
        }
      ],
      [
        {
          "prob": 0.9359621962573693,
          "token": " "
        },
        {
          "prob": 0.059834059148073854,
          "token": "  "
        },
        {
          "prob": 0.0020474089149960144,
          "token": "\n"
        },
        {
          "prob": 0.0010958990206032828,
          "token": "   "
        },
        {
          "prob": 0.000178900597216174,
          "token": "\n\n"
        }
      ],
      [
        {
          "prob": 0.9967497476832515,
          "token": "\n"
        },
        {
          "prob": 0.001595201262565643,
          "token": "\n\n\n"
        },
        {
          "prob": 0.001595201262565643,
          "token": "\n\n"
        },
        {
          "prob": 2.0080610823302936e-05,
          "token": "\n\n\n\n"
        },
        {
          "prob": 1.1441587157223891e-05,
          "token": " evacuation"
        }
      ],
      [
        {
          "prob": 0.9992788274357454,
          "token": ""
        },
        {
          "prob": 0.0006262747066415519,
          "token": " "
        },
        {
          "prob": 2.4283317214255478e-05,
          "token": "  "
        },
        {
          "prob": 2.281206539951494e-05,
          "token": "Please"
        },
        {
          "prob": 5.090059805910223e-06,
          "token": "("
        }
      ]
    ],
    "language_consistency_score": 0.5127536145971954
  },
  {
    "question": "What should you do if you need to evacuate a Skoltech building?\n",
    "true_answer": "You should walk to the nearest fire exit, take the stairs, check in with an employee in a bright vest, and follow the instructions of security and safety personnel. \n",
    "source_doc": "*Text Overlay:* \n\n1. *Walk to the nearest fire exit*   \n2. *Take the stairs (don’t take the elevators)*   \n3. *Check in with an employee in a bright vest*  \n4. *Follow the instructions of security and safety personnel.* \n\n![][image5]\n",
    "context": "",
    "generated_answer": "Follow the evacuation procedures outlined in the building's emergency plan, which may include designated assembly points and emergency exits. \n",
    "logprobs": [
      [
        {
          "prob": 0.29523695103179776,
          "token": "Follow"
        },
        {
          "prob": 0.15802895216087123,
          "token": "Refer"
        },
        {
          "prob": 0.12307308636229441,
          "token": "Please"
        },
        {
          "prob": 0.10861161750625123,
          "token": "The"
        },
        {
          "prob": 0.06587627601852276,
          "token": "Consult"
        }
      ],
      [
        {
          "prob": 0.9096810157523848,
          "token": " the"
        },
        {
          "prob": 0.039968595896532566,
          "token": " all"
        },
        {
          "prob": 0.02424217883691155,
          "token": " any"
        },
        {
          "prob": 0.0061293826985510955,
          "token": " evacuation"
        },
        {
          "prob": 0.004773568045375914,
          "token": " your"
        }
      ],
      [
        {
          "prob": 0.33138042159765835,
          "token": " evacuation"
        },
        {
          "prob": 0.2924421956371108,
          "token": " instructions"
        },
        {
          "prob": 0.17737515784758784,
          "token": " designated"
        },
        {
          "prob": 0.044847457869753304,
          "token": " directions"
        },
        {
          "prob": 0.044847457869753304,
          "token": " building"
        }
      ],
      [
        {
          "prob": 0.6437914797874241,
          "token": " procedures"
        },
        {
          "prob": 0.1436493045493281,
          "token": " instructions"
        },
        {
          "prob": 0.12677006632321328,
          "token": " plan"
        },
        {
          "prob": 0.03205249232930215,
          "token": " procedure"
        },
        {
          "prob": 0.02496250612545071,
          "token": " route"
        }
      ],
      [
        {
          "prob": 0.7265345694985832,
          "token": " outlined"
        },
        {
          "prob": 0.0675782418758,
          "token": " posted"
        },
        {
          "prob": 0.0596375891375061,
          "token": " provided"
        },
        {
          "prob": 0.040988275627148886,
          "token": " announced"
        },
        {
          "prob": 0.015078740337244307,
          "token": " and"
        }
      ],
      [
        {
          "prob": 0.6527206544105548,
          "token": " in"
        },
        {
          "prob": 0.2720944421744152,
          "token": " by"
        },
        {
          "prob": 0.06879625698124953,
          "token": " on"
        },
        {
          "prob": 0.003881218305837226,
          "token": " and"
        },
        {
          "prob": 0.0007642571984355921,
          "token": " for"
        }
      ],
      [
        {
          "prob": 0.8063088185807475,
          "token": " the"
        },
        {
          "prob": 0.1587716296621759,
          "token": " your"
        },
        {
          "prob": 0.01673440265902386,
          "token": " building"
        },
        {
          "prob": 0.0054328651130202245,
          "token": " any"
        },
        {
          "prob": 0.003507721354503011,
          "token": " emergency"
        }
      ],
      [
        {
          "prob": 0.8680190391743549,
          "token": " building"
        },
        {
          "prob": 0.06287908267706634,
          "token": " Sk"
        },
        {
          "prob": 0.020413849336339253,
          "token": " emergency"
        },
        {
          "prob": 0.010926748762479992,
          "token": " designated"
        },
        {
          "prob": 0.005161430645599823,
          "token": " safety"
        }
      ],
      [
        {
          "prob": 0.7690295352312919,
          "token": "'"
        },
        {
          "prob": 0.10407682686611631,
          "token": " emergency"
        },
        {
          "prob": 0.06312578645990306,
          "token": " safety"
        },
        {
          "prob": 0.020493942328143833,
          "token": "’"
        },
        {
          "prob": 0.012430207323993758,
          "token": " evacuation"
        }
      ],
      [
        {
          "prob": 0.9999827149515604,
          "token": "s"
        },
        {
          "prob": 3.288703426546071e-06,
          "token": " safety"
        },
        {
          "prob": 3.288703426546071e-06,
          "token": "sk"
        },
        {
          "prob": 2.260290606188248e-06,
          "token": " s"
        },
        {
          "prob": 1.0029978764975686e-06,
          "token": "0"
        }
      ],
      [
        {
          "prob": 0.7351745772934394,
          "token": " emergency"
        },
        {
          "prob": 0.18588125404818434,
          "token": " safety"
        },
        {
          "prob": 0.019591740037265534,
          "token": " evacuation"
        },
        {
          "prob": 0.01728964989912944,
          "token": " Emergency"
        },
        {
          "prob": 0.015258062482753795,
          "token": " signage"
        }
      ],
      [
        {
          "prob": 0.9208365243203162,
          "token": " plan"
        },
        {
          "prob": 0.031509291726320776,
          "token": " plans"
        },
        {
          "prob": 0.009027563225258004,
          "token": " procedures"
        },
        {
          "prob": 0.006204547418327476,
          "token": " protocol"
        },
        {
          "prob": 0.005475493878613245,
          "token": " instructions"
        }
      ],
      [
        {
          "prob": 0.4377140139822672,
          "token": ","
        },
        {
          "prob": 0.30083614898657396,
          "token": "."
        },
        {
          "prob": 0.23429142840692962,
          "token": " and"
        },
        {
          "prob": 0.013217817909544604,
          "token": " by"
        },
        {
          "prob": 0.005510006269515524,
          "token": " or"
        }
      ],
      [
        {
          "prob": 0.593067858745306,
          "token": " which"
        },
        {
          "prob": 0.1323313341882884,
          "token": " including"
        },
        {
          "prob": 0.07083185897544714,
          "token": " such"
        },
        {
          "prob": 0.04868197727065892,
          "token": " and"
        },
        {
          "prob": 0.01580472026866312,
          "token": " using"
        }
      ],
      [
        {
          "prob": 0.3772521075651231,
          "token": " may"
        },
        {
          "prob": 0.20192850200710755,
          "token": " will"
        },
        {
          "prob": 0.10808453844302418,
          "token": " include"
        },
        {
          "prob": 0.06555658640658295,
          "token": " includes"
        },
        {
          "prob": 0.06555658640658295,
          "token": " are"
        }
      ],
      [
        {
          "prob": 0.8513667790849144,
          "token": " include"
        },
        {
          "prob": 0.13056132028840997,
          "token": " involve"
        },
        {
          "prob": 0.010717128351370751,
          "token": " be"
        },
        {
          "prob": 0.0025455411043687377,
          "token": " direct"
        },
        {
          "prob": 0.0016435248629973044,
          "token": " require"
        }
      ],
      [
        {
          "prob": 0.4436928012142011,
          "token": " designated"
        },
        {
          "prob": 0.08736829797068602,
          "token": " using"
        },
        {
          "prob": 0.060047294501467556,
          "token": " finding"
        },
        {
          "prob": 0.0364205251479339,
          "token": " seeking"
        },
        {
          "prob": 0.028364333505082717,
          "token": " heading"
        }
      ],
      [
        {
          "prob": 0.6416371887091233,
          "token": " assembly"
        },
        {
          "prob": 0.16223128744650858,
          "token": " evacuation"
        },
        {
          "prob": 0.04101849314485887,
          "token": " routes"
        },
        {
          "prob": 0.04101849314485887,
          "token": " emergency"
        },
        {
          "prob": 0.04101849314485887,
          "token": " exit"
        }
      ],
      [
        {
          "prob": 0.845212991433015,
          "token": " points"
        },
        {
          "prob": 0.14687599238823945,
          "token": " areas"
        },
        {
          "prob": 0.003454192261335744,
          "token": " point"
        },
        {
          "prob": 0.0023740293080988005,
          "token": " locations"
        },
        {
          "prob": 0.0015327885244706188,
          "token": " zones"
        }
      ],
      [
        {
          "prob": 0.5399033511923017,
          "token": " and"
        },
        {
          "prob": 0.371069784857786,
          "token": "."
        },
        {
          "prob": 0.039110465251183016,
          "token": " or"
        },
        {
          "prob": 0.03451486444281146,
          "token": ","
        },
        {
          "prob": 0.0032103832517383214,
          "token": " for"
        }
      ],
      [
        {
          "prob": 0.19700688407119304,
          "token": " emergency"
        },
        {
          "prob": 0.15342911558510264,
          "token": " routes"
        },
        {
          "prob": 0.15342911558510264,
          "token": " instructions"
        },
        {
          "prob": 0.038792960193698024,
          "token": " exit"
        },
        {
          "prob": 0.038792960193698024,
          "token": " communication"
        }
      ],
      [
        {
          "prob": 0.7079519290973381,
          "token": " exits"
        },
        {
          "prob": 0.09581087198690805,
          "token": " contact"
        },
        {
          "prob": 0.0658497851082162,
          "token": " exit"
        },
        {
          "prob": 0.027450274415606768,
          "token": " contacts"
        },
        {
          "prob": 0.01664943702012544,
          "token": " instructions"
        }
      ],
      [
        {
          "prob": 0.9896194224871753,
          "token": "."
        },
        {
          "prob": 0.003569125655784946,
          "token": ","
        },
        {
          "prob": 0.0024530217978787914,
          "token": " marked"
        },
        {
          "prob": 0.00033198024150095845,
          "token": " located"
        },
        {
          "prob": 0.0002281664607540465,
          "token": " listed"
        }
      ],
      [
        {
          "prob": 0.9530859599501456,
          "token": " "
        },
        {
          "prob": 0.041875675183727264,
          "token": "  "
        },
        {
          "prob": 0.003437363920299566,
          "token": "\n"
        },
        {
          "prob": 0.0009251539484020616,
          "token": "   "
        },
        {
          "prob": 0.00030035365525479796,
          "token": "\n\n"
        }
      ],
      [
        {
          "prob": 0.9969175992730559,
          "token": "\n"
        },
        {
          "prob": 0.0019245039288289338,
          "token": "\n\n\n"
        },
        {
          "prob": 0.0009677013473443282,
          "token": "\n\n"
        },
        {
          "prob": 0.00014840180803778205,
          "token": ""
        },
        {
          "prob": 1.0098869775826692e-05,
          "token": "\n\n\n\n"
        }
      ],
      [
        {
          "prob": 0.9989901260884348,
          "token": ""
        },
        {
          "prob": 0.0009109610489926265,
          "token": " "
        },
        {
          "prob": 4.535410165317274e-05,
          "token": "  "
        },
        {
          "prob": 1.2206890859843686e-05,
          "token": "Please"
        },
        {
          "prob": 4.780287144944376e-06,
          "token": "."
        }
      ]
    ],
    "language_consistency_score": 0.4848871419894785
  },
  {
    "question": "Where can I find more information about fire safety at Skoltech?\n",
    "true_answer": "The Skoltech instruction for fire safety can be found at https://box.skoltech.ru/index.php/s/PWWi2TSueEeAn1E. \n",
    "source_doc": "\n### For more details on fire safety consult our [instruction](https://box.skoltech.ru/index.php/s/PWWi2TSueEeAn1E) \n",
    "context": "Sim: 2.85 - ### For more details on fire safety consult our [instruction](https://box.skoltech.ru/index.php/s/PWWi2TSueEeAn1E) ",
    "generated_answer": "You can find more details on fire safety in the provided link: [https://box.skoltech.ru/index.php/s/PWWi2TSueEeAn1E](https://box.skoltech.ru/index.php/s/PWWi2TSueEeAn1E). \n",
    "logprobs": [
      [
        {
          "prob": 0.8678564937047023,
          "token": "You"
        },
        {
          "prob": 0.1174516078845901,
          "token": "The"
        },
        {
          "prob": 0.00516046349958771,
          "token": "Information"
        },
        {
          "prob": 0.004554093054287016,
          "token": "More"
        },
        {
          "prob": 0.0010161555125339139,
          "token": "Sk"
        }
      ],
      [
        {
          "prob": 0.9909694591207064,
          "token": " can"
        },
        {
          "prob": 0.008573567544422823,
          "token": " should"
        },
        {
          "prob": 0.0003122921749773137,
          "token": " may"
        },
        {
          "prob": 0.00010138642514309039,
          "token": " will"
        },
        {
          "prob": 1.8754602854565974e-05,
          "token": " could"
        }
      ],
      [
        {
          "prob": 0.9961121430439211,
          "token": " find"
        },
        {
          "prob": 0.0027978744285596193,
          "token": " consult"
        },
        {
          "prob": 0.0005509341407386517,
          "token": " learn"
        },
        {
          "prob": 0.00015784519880919682,
          "token": " get"
        },
        {
          "prob": 0.0001482818416637496,
          "token": " access"
        }
      ],
      [
        {
          "prob": 0.9651226863685379,
          "token": " more"
        },
        {
          "prob": 0.013766735749242552,
          "token": " information"
        },
        {
          "prob": 0.007844049582527601,
          "token": " details"
        },
        {
          "prob": 0.0057388292688095735,
          "token": " fire"
        },
        {
          "prob": 0.004469404728461994,
          "token": " detailed"
        }
      ],
      [
        {
          "prob": 0.6467060564149314,
          "token": " details"
        },
        {
          "prob": 0.3461568179048158,
          "token": " information"
        },
        {
          "prob": 0.0036124701271708385,
          "token": " detailed"
        },
        {
          "prob": 0.0017064100608515842,
          "token": " detail"
        },
        {
          "prob": 0.0014146636280019521,
          "token": " fire"
        }
      ],
      [
        {
          "prob": 0.8513735155653327,
          "token": " on"
        },
        {
          "prob": 0.14794653976278235,
          "token": " about"
        },
        {
          "prob": 0.00023677412492574177,
          "token": " at"
        },
        {
          "prob": 0.0001349098297233816,
          "token": " regarding"
        },
        {
          "prob": 5.6238784092972515e-05,
          "token": "  "
        }
      ],
      [
        {
          "prob": 0.9997961936663362,
          "token": " fire"
        },
        {
          "prob": 0.0001398130917451054,
          "token": " Fire"
        },
        {
          "prob": 1.777523989250791e-05,
          "token": "  "
        },
        {
          "prob": 1.2604532502085236e-05,
          "token": " the"
        },
        {
          "prob": 9.514400297131526e-06,
          "token": " safety"
        }
      ],
      [
        {
          "prob": 0.9999972581939645,
          "token": " safety"
        },
        {
          "prob": 1.873873533863877e-06,
          "token": " saf"
        },
        {
          "prob": 4.450839766446488e-07,
          "token": " safe"
        },
        {
          "prob": 1.090726233457906e-07,
          "token": " Safety"
        },
        {
          "prob": 8.76423150298272e-08,
          "token": "  "
        }
      ],
      [
        {
          "prob": 0.7175726543207547,
          "token": " in"
        },
        {
          "prob": 0.2055880136855954,
          "token": " at"
        },
        {
          "prob": 0.058901952097881495,
          "token": " by"
        },
        {
          "prob": 0.011598482060391036,
          "token": " on"
        },
        {
          "prob": 0.002145503448330889,
          "token": " instructions"
        }
      ],
      [
        {
          "prob": 0.49411756518991284,
          "token": " the"
        },
        {
          "prob": 0.49411756518991284,
          "token": " our"
        },
        {
          "prob": 0.003329337965566791,
          "token": " Sk"
        },
        {
          "prob": 0.0027601181177183648,
          "token": " ["
        },
        {
          "prob": 0.0008960791571177511,
          "token": "  "
        }
      ],
      [
        {
          "prob": 0.3125351012221188,
          "token": " provided"
        },
        {
          "prob": 0.27581125877748286,
          "token": " ["
        },
        {
          "prob": 0.24340258156908692,
          "token": " instruction"
        },
        {
          "prob": 0.047928810085794395,
          "token": " link"
        },
        {
          "prob": 0.030945165605335438,
          "token": " document"
        }
      ],
      [
        {
          "prob": 0.4832855596650603,
          "token": " link"
        },
        {
          "prob": 0.2931275093332383,
          "token": " instruction"
        },
        {
          "prob": 0.15689984938392276,
          "token": " ["
        },
        {
          "prob": 0.024061371200245745,
          "token": " document"
        },
        {
          "prob": 0.010030271794768737,
          "token": " hyperlink"
        }
      ],
      [
        {
          "prob": 0.9070501035697595,
          "token": ":"
        },
        {
          "prob": 0.05798577572070343,
          "token": "."
        },
        {
          "prob": 0.010076416911019712,
          "token": ","
        },
        {
          "prob": 0.006111655796580321,
          "token": " ["
        },
        {
          "prob": 0.004759762320239645,
          "token": " from"
        }
      ],
      [
        {
          "prob": 0.5468165066568113,
          "token": " ["
        },
        {
          "prob": 0.3758211224911587,
          "token": " https"
        },
        {
          "prob": 0.07400356680685466,
          "token": "  "
        },
        {
          "prob": 0.000991648362459614,
          "token": " ("
        },
        {
          "prob": 0.0008221053674749317,
          "token": "https"
        }
      ],
      [
        {
          "prob": 0.9948208552737301,
          "token": "https"
        },
        {
          "prob": 0.0038192822883265642,
          "token": "instruction"
        },
        {
          "prob": 0.000663691744392947,
          "token": " https"
        },
        {
          "prob": 0.00021546916238253744,
          "token": "http"
        },
        {
          "prob": 0.00015764060675510622,
          "token": "link"
        }
      ],
      [
        {
          "prob": 0.9999901057270286,
          "token": "://"
        },
        {
          "prob": 3.966963819890921e-06,
          "token": ":/"
        },
        {
          "prob": 2.1233627211179646e-06,
          "token": ":\\/\\/"
        },
        {
          "prob": 1.0030055287932736e-06,
          "token": ":///"
        },
        {
          "prob": 1.0030055287932736e-06,
          "token": "//"
        }
      ],
      [
        {
          "prob": 0.9999244270256572,
          "token": "box"
        },
        {
          "prob": 1.2218304763064864e-05,
          "token": "www"
        },
        {
          "prob": 1.0782616108239351e-05,
          "token": "sk"
        },
        {
          "prob": 8.39750986865515e-06,
          "token": " box"
        },
        {
          "prob": 7.410776448511744e-06,
          "token": "link"
        }
      ],
      [
        {
          "prob": 0.9999982118638471,
          "token": "."
        },
        {
          "prob": 2.4579895104234264e-07,
          "token": " ."
        },
        {
          "prob": 1.6893498378946919e-07,
          "token": "/"
        },
        {
          "prob": 1.6373740075447596e-07,
          "token": "..."
        },
        {
          "prob": 1.4005202064080386e-07,
          "token": "...."
        }
      ],
      [
        {
          "prob": 0.9999768739326302,
          "token": "sk"
        },
        {
          "prob": 7.411165169400262e-06,
          "token": "sky"
        },
        {
          "prob": 3.288684608487957e-06,
          "token": " sk"
        },
        {
          "prob": 1.4593449487215801e-06,
          "token": "sp"
        },
        {
          "prob": 1.3709277079799143e-06,
          "token": "sh"
        }
      ],
      [
        {
          "prob": 0.9999802116501774,
          "token": "ol"
        },
        {
          "prob": 1.3007037157436464e-05,
          "token": "olk"
        },
        {
          "prob": 1.5534690560681523e-06,
          "token": "olni"
        },
        {
          "prob": 1.5534690560681523e-06,
          "token": "ole"
        },
        {
          "prob": 1.0676826271691727e-06,
          "token": "olt"
        }
      ],
      [
        {
          "prob": 0.9999860527077029,
          "token": "tech"
        },
        {
          "prob": 5.422170805303821e-06,
          "token": "tek"
        },
        {
          "prob": 4.495137481344538e-06,
          "token": "tach"
        },
        {
          "prob": 1.994705165791279e-06,
          "token": "teh"
        },
        {
          "prob": 4.1811291675897055e-07,
          "token": "."
        }
      ],
      [
        {
          "prob": 0.9999977350285647,
          "token": "."
        },
        {
          "prob": 5.89641030938504e-07,
          "token": "/"
        },
        {
          "prob": 3.8070086274686825e-07,
          "token": "ru"
        },
        {
          "prob": 2.0377448763230073e-07,
          "token": "-"
        },
        {
          "prob": 1.9750500575161462e-07,
          "token": ".."
        }
      ],
      [
        {
          "prob": 0.9999885560391694,
          "token": "ru"
        },
        {
          "prob": 3.089468636647581e-06,
          "token": "RU"
        },
        {
          "prob": 2.123358671128844e-06,
          "token": " ru"
        },
        {
          "prob": 1.760326166706652e-06,
          "token": "rs"
        },
        {
          "prob": 1.4593616496947003e-06,
          "token": "edu"
        }
      ],
      [
        {
          "prob": 0.9998553008697935,
          "token": "/"
        },
        {
          "prob": 0.00012339191608361626,
          "token": "]("
        },
        {
          "prob": 5.421462426630905e-06,
          "token": "]."
        },
        {
          "prob": 3.089056175618322e-06,
          "token": "//"
        },
        {
          "prob": 2.057755034492296e-06,
          "token": "/?"
        }
      ],
      [
        {
          "prob": 0.9997845160493511,
          "token": "index"
        },
        {
          "prob": 0.00019109965149555498,
          "token": "]("
        },
        {
          "prob": 4.784086165019318e-06,
          "token": "instruction"
        },
        {
          "prob": 3.5001122085555354e-06,
          "token": " index"
        },
        {
          "prob": 2.190314251935864e-06,
          "token": "]."
        }
      ],
      [
        {
          "prob": 0.9999871255623688,
          "token": "."
        },
        {
          "prob": 3.966952470332629e-06,
          "token": "/"
        },
        {
          "prob": 1.8738556632984764e-06,
          "token": "...."
        },
        {
          "prob": 1.1365509116666793e-06,
          "token": " php"
        },
        {
          "prob": 1.0348413813084353e-06,
          "token": "..."
        }
      ],
      [
        {
          "prob": 0.9998774678668052,
          "token": "php"
        },
        {
          "prob": 0.0001088954761388968,
          "token": " php"
        },
        {
          "prob": 6.539681654822878e-06,
          "token": "ph"
        },
        {
          "prob": 6.143462373182259e-06,
          "token": "PHP"
        },
        {
          "prob": 3.465904302816574e-07,
          "token": "pdf"
        }
      ],
      [
        {
          "prob": 0.9999327704835214,
          "token": "/"
        },
        {
          "prob": 3.12008020358452e-05,
          "token": "?"
        },
        {
          "prob": 1.0129417364496564e-05,
          "token": "/?"
        },
        {
          "prob": 6.961839955017595e-06,
          "token": "]("
        },
        {
          "prob": 5.421886408585497e-06,
          "token": "//"
        }
      ],
      [
        {
          "prob": 0.9999582784885006,
          "token": "s"
        },
        {
          "prob": 1.6700999973693784e-05,
          "token": "S"
        },
        {
          "prob": 6.540205560827558e-06,
          "token": "]("
        },
        {
          "prob": 1.653622930479595e-06,
          "token": "c"
        },
        {
          "prob": 1.5534349818604317e-06,
          "token": "t"
        }
      ],
      [
        {
          "prob": 0.9999034498006232,
          "token": "/"
        },
        {
          "prob": 2.5865608698626768e-05,
          "token": "//"
        },
        {
          "prob": 2.4298490689111854e-05,
          "token": "/%"
        },
        {
          "prob": 1.2218048415518331e-05,
          "token": "/..."
        },
        {
          "prob": 1.0129117903802599e-05,
          "token": "/-"
        }
      ],
      [
        {
          "prob": 0.9995258911192296,
          "token": "P"
        },
        {
          "prob": 0.00023045061361139072,
          "token": "WW"
        },
        {
          "prob": 0.0001088571619286642,
          "token": "PW"
        },
        {
          "prob": 4.262907711533233e-05,
          "token": "p"
        },
        {
          "prob": 1.5682361066842776e-05,
          "token": "W"
        }
      ],
      [
        {
          "prob": 0.9999610200823912,
          "token": "WW"
        },
        {
          "prob": 1.7778172794071947e-05,
          "token": "ww"
        },
        {
          "prob": 5.422036361359692e-06,
          "token": " WW"
        },
        {
          "prob": 3.0893831937693007e-06,
          "token": "WWW"
        },
        {
          "prob": 2.5611886248519122e-06,
          "token": "YY"
        }
      ],
      [
        {
          "prob": 0.9999864103261001,
          "token": "i"
        },
        {
          "prob": 5.771876282039648e-06,
          "token": "2"
        },
        {
          "prob": 1.3709407822277047e-06,
          "token": "iX"
        },
        {
          "prob": 1.3709407822277047e-06,
          "token": "..."
        },
        {
          "prob": 8.315176170715234e-07,
          "token": "ii"
        }
      ],
      [
        {
          "prob": 0.9999893904859,
          "token": "2"
        },
        {
          "prob": 1.8738592373979223e-06,
          "token": "..."
        },
        {
          "prob": 8.315199960659118e-07,
          "token": "Z"
        },
        {
          "prob": 7.338138209653221e-07,
          "token": "4"
        },
        {
          "prob": 5.539117325514964e-07,
          "token": "1"
        }
      ],
      [
        {
          "prob": 0.9999828341569776,
          "token": "TS"
        },
        {
          "prob": 6.540367730715846e-06,
          "token": "T"
        },
        {
          "prob": 2.5612448038836927e-06,
          "token": "TW"
        },
        {
          "prob": 1.0029978764975686e-06,
          "token": "PS"
        },
        {
          "prob": 6.4758410097096e-07,
          "token": " TS"
        }
      ],
      [
        {
          "prob": 0.999935273546097,
          "token": "ue"
        },
        {
          "prob": 2.9310496908013155e-05,
          "token": "sue"
        },
        {
          "prob": 1.4738243411368642e-05,
          "token": "UE"
        },
        {
          "prob": 6.540055869115033e-06,
          "token": "u"
        },
        {
          "prob": 2.9021321996997747e-06,
          "token": "une"
        }
      ],
      [
        {
          "prob": 0.9999032114269176,
          "token": "Ee"
        },
        {
          "prob": 4.8323318887733187e-05,
          "token": " Ee"
        },
        {
          "prob": 1.6700092141428838e-05,
          "token": "E"
        },
        {
          "prob": 9.515425673610013e-06,
          "token": "Qe"
        },
        {
          "prob": 6.143620564500437e-06,
          "token": "Et"
        }
      ],
      [
        {
          "prob": 0.9999805692637573,
          "token": "An"
        },
        {
          "prob": 1.0783222828447009e-05,
          "token": "Ann"
        },
        {
          "prob": 3.089445065962375e-06,
          "token": "At"
        },
        {
          "prob": 8.851408310342668e-07,
          "token": "AN"
        },
        {
          "prob": 7.338075226178049e-07,
          "token": "A"
        }
      ],
      [
        {
          "prob": 0.999985933501902,
          "token": "1"
        },
        {
          "prob": 3.0894597976195546e-06,
          "token": "E"
        },
        {
          "prob": 2.726438702058888e-06,
          "token": "I"
        },
        {
          "prob": 1.034839407507024e-06,
          "token": "2"
        },
        {
          "prob": 7.33811021693085e-07,
          "token": "IE"
        }
      ],
      [
        {
          "prob": 0.999977350747961,
          "token": "E"
        },
        {
          "prob": 7.411165169400262e-06,
          "token": "]("
        },
        {
          "prob": 4.4950988994356315e-06,
          "token": "e"
        },
        {
          "prob": 1.5056695301106065e-06,
          "token": "Ee"
        },
        {
          "prob": 7.338047233695941e-07,
          "token": "]."
        }
      ],
      [
        {
          "prob": 0.888874666292957,
          "token": "]("
        },
        {
          "prob": 0.07296327521585712,
          "token": "]."
        },
        {
          "prob": 0.020904328343973284,
          "token": "]"
        },
        {
          "prob": 0.009874507871474801,
          "token": " ]."
        },
        {
          "prob": 0.005285443189207616,
          "token": " ]"
        }
      ],
      [
        {
          "prob": 0.9998636431688657,
          "token": "https"
        },
        {
          "prob": 9.609854568749548e-05,
          "token": " https"
        },
        {
          "prob": 3.1198629966994506e-05,
          "token": "http"
        },
        {
          "prob": 1.5532883231504442e-06,
          "token": "HTTPS"
        },
        {
          "prob": 9.131310987952094e-07,
          "token": "  "
        }
      ],
      [
        {
          "prob": 0.9999945164027223,
          "token": "://"
        },
        {
          "prob": 3.7266318480591813e-06,
          "token": ":"
        },
        {
          "prob": 1.2878895049480937e-06,
          "token": ":/"
        },
        {
          "prob": 1.9750425233124627e-07,
          "token": ":///"
        },
        {
          "prob": 1.3156619577722912e-07,
          "token": ")."
        }
      ],
      [
        {
          "prob": 0.999991297797926,
          "token": "box"
        },
        {
          "prob": 2.0580356808504912e-06,
          "token": " box"
        },
        {
          "prob": 6.893556039281075e-07,
          "token": "link"
        },
        {
          "prob": 5.539127890552897e-07,
          "token": "www"
        },
        {
          "prob": 4.7378671585426407e-07,
          "token": "..."
        }
      ],
      [
        {
          "prob": 0.9999990463265931,
          "token": "."
        },
        {
          "prob": 8.315279260963632e-07,
          "token": "sk"
        },
        {
          "prob": 4.2713534488134696e-08,
          "token": " sk"
        },
        {
          "prob": 3.2241867372567335e-08,
          "token": "..."
        },
        {
          "prob": 2.510999155743982e-08,
          "token": ".."
        }
      ],
      [
        {
          "prob": 0.99995911288632,
          "token": "sk"
        },
        {
          "prob": 2.014527057586643e-05,
          "token": " sk"
        },
        {
          "prob": 1.0129678192314484e-05,
          "token": "sky"
        },
        {
          "prob": 3.089377301244109e-06,
          "token": "Sk"
        },
        {
          "prob": 2.260236717303188e-06,
          "token": "sh"
        }
      ],
      [
        {
          "prob": 0.9999854566779314,
          "token": "ol"
        },
        {
          "prob": 8.398022427623994e-06,
          "token": "olni"
        },
        {
          "prob": 1.6536686646258332e-06,
          "token": "olk"
        },
        {
          "prob": 1.5534779451148246e-06,
          "token": "ot"
        },
        {
          "prob": 9.422320028995207e-07,
          "token": "olt"
        }
      ],
      [
        {
          "prob": 0.9999947548186582,
          "token": "tech"
        },
        {
          "prob": 1.9947241888728423e-06,
          "token": "test"
        },
        {
          "prob": 1.8738699597371628e-06,
          "token": "tek"
        },
        {
          "prob": 3.466310883964243e-07,
          "token": "tell"
        },
        {
          "prob": 2.5360072174960893e-07,
          "token": "tach"
        }
      ],
      [
        {
          "prob": 0.9999998807907247,
          "token": "."
        },
        {
          "prob": 1.0907283138550802e-07,
          "token": "/"
        },
        {
          "prob": 3.432128916326245e-08,
          "token": ".."
        },
        {
          "prob": 1.7257827987960214e-08,
          "token": "ru"
        },
        {
          "prob": 1.522997974471263e-08,
          "token": "-"
        }
      ],
      [
        {
          "prob": 0.9999911785905904,
          "token": "ru"
        },
        {
          "prob": 3.089477475700895e-06,
          "token": " ru"
        },
        {
          "prob": 2.5612667873185223e-06,
          "token": "RU"
        },
        {
          "prob": 1.5534868342123606e-06,
          "token": "edu"
        },
        {
          "prob": 2.8736616933016877e-07,
          "token": "rs"
        }
      ],
      [
        {
          "prob": 0.9999933243243502,
          "token": "/"
        },
        {
          "prob": 2.902301033636053e-06,
          "token": "/)"
        },
        {
          "prob": 1.2878882767215364e-06,
          "token": "/)."
        },
        {
          "prob": 6.68147636088898e-07,
          "token": "//"
        },
        {
          "prob": 3.3596573017213465e-07,
          "token": ")."
        }
      ],
      [
        {
          "prob": 0.9999984502816872,
          "token": "index"
        },
        {
          "prob": 9.422436845439301e-07,
          "token": " index"
        },
        {
          "prob": 8.233233559423349e-08,
          "token": "...)"
        },
        {
          "prob": 3.889104154376442e-08,
          "token": "i"
        },
        {
          "prob": 3.5410696290458855e-08,
          "token": "instruction"
        }
      ],
      [
        {
          "prob": 0.9999967813595916,
          "token": "."
        },
        {
          "prob": 1.0030122245999073e-06,
          "token": "/"
        },
        {
          "prob": 8.315263400842229e-07,
          "token": "php"
        },
        {
          "prob": 7.811467059485997e-07,
          "token": " php"
        },
        {
          "prob": 2.873678136572838e-07,
          "token": "_"
        }
      ],
      [
        {
          "prob": 0.9990480671949075,
          "token": "php"
        },
        {
          "prob": 0.0007094984515599741,
          "token": " php"
        },
        {
          "prob": 0.00010880505963320011,
          "token": "Php"
        },
        {
          "prob": 9.602012811183129e-05,
          "token": "ph"
        },
        {
          "prob": 3.117317150757087e-05,
          "token": "PHP"
        }
      ],
      [
        {
          "prob": 0.9999922514562126,
          "token": "/"
        },
        {
          "prob": 2.5612692299340398e-06,
          "token": "%"
        },
        {
          "prob": 2.5612692299340398e-06,
          "token": "//"
        },
        {
          "prob": 1.0676958641307217e-06,
          "token": "/%"
        },
        {
          "prob": 7.338159204265076e-07,
          "token": "?"
        }
      ],
      [
        {
          "prob": 0.9999973774024795,
          "token": "s"
        },
        {
          "prob": 1.3709551640442868e-06,
          "token": "S"
        },
        {
          "prob": 9.625625225943644e-08,
          "token": "w"
        },
        {
          "prob": 8.233233559423349e-08,
          "token": "p"
        },
        {
          "prob": 8.233233559423349e-08,
          "token": "r"
        }
      ],
      [
        {
          "prob": 0.9999344391863586,
          "token": "/"
        },
        {
          "prob": 2.7534637413852516e-05,
          "token": "/%"
        },
        {
          "prob": 1.3006441756155282e-05,
          "token": "//"
        },
        {
          "prob": 8.93918797422475e-06,
          "token": "/-"
        },
        {
          "prob": 5.0933957747544755e-06,
          "token": "%"
        }
      ],
      [
        {
          "prob": 0.9999541065280364,
          "token": "P"
        },
        {
          "prob": 2.7535188859981226e-05,
          "token": "p"
        },
        {
          "prob": 1.0782934889176963e-05,
          "token": "PW"
        },
        {
          "prob": 1.8737931176616692e-06,
          "token": "WW"
        },
        {
          "prob": 8.314906556108061e-07,
          "token": "Pw"
        }
      ],
      [
        {
          "prob": 0.9999144150525098,
          "token": "WW"
        },
        {
          "prob": 5.828966047446582e-05,
          "token": "ww"
        },
        {
          "prob": 1.7777342038730183e-05,
          "token": " WW"
        },
        {
          "prob": 3.96666117611528e-06,
          "token": "Ww"
        },
        {
          "prob": 2.1232007275782826e-06,
          "token": "WWW"
        }
      ],
      [
        {
          "prob": 0.9999984502816872,
          "token": "i"
        },
        {
          "prob": 2.5360144730813174e-07,
          "token": "2"
        },
        {
          "prob": 2.2380249174039673e-07,
          "token": "..."
        },
        {
          "prob": 2.1024298423113373e-07,
          "token": "iX"
        },
        {
          "prob": 1.5381705313987978e-07,
          "token": "iQ"
        }
      ],
      [
        {
          "prob": 0.9999985694905718,
          "token": "2"
        },
        {
          "prob": 1.9750519410715577e-07,
          "token": "TS"
        },
        {
          "prob": 1.8553895931777327e-07,
          "token": "..."
        },
        {
          "prob": 1.275189375371399e-07,
          "token": "...)."
        },
        {
          "prob": 9.931175369924415e-08,
          "token": "Z"
        }
      ],
      [
        {
          "prob": 0.9999964237340748,
          "token": "TS"
        },
        {
          "prob": 1.1365606668032673e-06,
          "token": "T"
        },
        {
          "prob": 5.368732441588884e-07,
          "token": " TS"
        },
        {
          "prob": 3.6898722478013197e-07,
          "token": "PS"
        },
        {
          "prob": 1.7429722337486484e-07,
          "token": "TTS"
        }
      ],
      [
        {
          "prob": 0.9999468354816792,
          "token": "ue"
        },
        {
          "prob": 2.931083234194975e-05,
          "token": "sue"
        },
        {
          "prob": 8.939298800873496e-06,
          "token": "u"
        },
        {
          "prob": 6.1438842257493485e-06,
          "token": " ue"
        },
        {
          "prob": 4.2226257584905e-06,
          "token": "UE"
        }
      ],
      [
        {
          "prob": 0.9998682910823691,
          "token": "Ee"
        },
        {
          "prob": 0.00011591752547013767,
          "token": " Ee"
        },
        {
          "prob": 5.093060622371077e-06,
          "token": "E"
        },
        {
          "prob": 5.093060622371077e-06,
          "token": "ee"
        },
        {
          "prob": 9.421214837389683e-07,
          "token": "Et"
        }
      ],
      [
        {
          "prob": 0.9999750858798929,
          "token": "An"
        },
        {
          "prob": 1.5689406861542363e-05,
          "token": "Ann"
        },
        {
          "prob": 2.5612252632111344e-06,
          "token": "At"
        },
        {
          "prob": 1.5534616485681124e-06,
          "token": "Ee"
        },
        {
          "prob": 1.4593421652446419e-06,
          "token": "A"
        }
      ],
      [
        {
          "prob": 0.9999965429424904,
          "token": "1"
        },
        {
          "prob": 1.4593727837829625e-06,
          "token": ")."
        },
        {
          "prob": 2.699568205307921e-07,
          "token": "...)."
        },
        {
          "prob": 2.2380206487142718e-07,
          "token": ")"
        },
        {
          "prob": 1.490843155763487e-07,
          "token": "E"
        }
      ],
      [
        {
          "prob": 0.9999841454156853,
          "token": "E"
        },
        {
          "prob": 6.962191848292578e-06,
          "token": ")."
        },
        {
          "prob": 5.7718597685927675e-06,
          "token": "e"
        },
        {
          "prob": 8.315152380839415e-07,
          "token": ")"
        },
        {
          "prob": 5.043394859161604e-07,
          "token": "...)."
        }
      ],
      [
        {
          "prob": 0.5615295946346551,
          "token": ")."
        },
        {
          "prob": 0.43731968801923793,
          "token": ")"
        },
        {
          "prob": 0.000657483598017922,
          "token": "),"
        },
        {
          "prob": 0.00010082832729641818,
          "token": " )."
        },
        {
          "prob": 6.929822834925534e-05,
          "token": "/)."
        }
      ],
      [
        {
          "prob": 0.9828632388305218,
          "token": " "
        },
        {
          "prob": 0.014019790408046096,
          "token": "  "
        },
        {
          "prob": 0.0015729768895297131,
          "token": "\n"
        },
        {
          "prob": 0.0008962552153527009,
          "token": ""
        },
        {
          "prob": 0.0002567814184095115,
          "token": "   "
        }
      ],
      [
        {
          "prob": 0.9934823140349146,
          "token": "\n"
        },
        {
          "prob": 0.004060135758186998,
          "token": "\n\n\n"
        },
        {
          "prob": 0.0011632483706241596,
          "token": ""
        },
        {
          "prob": 0.0010927707146608271,
          "token": "\n\n"
        },
        {
          "prob": 0.00013051278785352537,
          "token": "\n\n\n\n"
        }
      ],
      [
        {
          "prob": 0.9995523311954484,
          "token": ""
        },
        {
          "prob": 0.00043054971873492895,
          "token": " "
        },
        {
          "prob": 9.512077729024634e-06,
          "token": "  "
        },
        {
          "prob": 9.418232365723737e-07,
          "token": "."
        },
        {
          "prob": 5.366347041314274e-07,
          "token": "   "
        }
      ]
    ],
    "language_consistency_score": 0.36945277083404887
  },
  {
    "question": "What is the name of the universal laboratory for students and Skoltech community members where you can create almost anything, anytime?\n",
    "true_answer": "FabLab & Machine Shop \n",
    "source_doc": "Also, book crossing shelves. They are everywhere :) Bring your own books, exchange old ones anonymously or read on the spot as you desire. While no food or drinks are allowed on the premises of the library, your thoughts, debates and other activities are allowed any time. Librarians are there for you if you want to organize a group activity, do not hesitate to contact them and suggest your ideas. Like the campus, the library is open 24/7 and has several multifunctional zones that vary based on the level of noise, from silent to loud. If you need a quick distraction from your studies, just glance around and solve some quirky riddles, word search puzzles and even quests. That stuff will keep you entertained for a loooong time :)     \n\nAlright, so what else can you find on the campus? Quick answer: a lot\\! Let me just list a few spaces and facilities so you know they exist:\n\n* Music room  \n* Exercise room   \n* Several photo zones  \n* A coffee shop, cafeteria and several food machines around the campus  \n* Fully equipped kitchens with hot water, basic kitchenware and some ingredients for tea  \n* Outside terraces (aka summer lounge zones)   \n* Art exhibitions   \n* An indoor basketball court  \n* A table tennis table  \n* A multifaith prayer and meditation room \n\n*Text Overlay:* \n\n* *Music room*  \n* *Exercise room*   \n* *Several photo zones*  \n* *A coffee shop, cafeteria and several food machines around the campus*  \n* *Fully equipped kitchens with hot water, basic kitchenware and some ingredients for tea*  \n* *Outside terraces (aka summer lounge zones)*   \n* *Art exhibitions*   \n* *An indoor basketball court*  \n* *A table tennis table*  \n* *A multifaith prayer and meditation room* \n\nWell, that’s a quick tour\\! You’ll get to know all of these facilities as you spend time on campus. Speaking of tours, check out [this virtual tour](https://360.skoltech.ru/)  of Skoltech to see the campus with your own eyes. The link is available in the description. Let’s keep exploring the campus, shall we? We’ve already talked about the classrooms, the library and the cafeteria, but we haven’t yet seen the most technological part: research facilities\\! *Text Overlay: Research Facilities*\n\nOne of the most impressive (and open to all students) research space here is the FabLab. FabLab & Machine Shop (links to an external site)is a universal laboratory for students and Skoltech community members where you can create almost anything, anytime\\! In fact, it is one of the most unique university facilities, because students can come here with an idea and leave with a prototype within a few hours. How cool is that? At Skoltech, creative research and spontaneous ideas revolve about this laboratory. It has equipment to quickly create prototypes and conduct experiences. There are machine tools, 3D printers and a bunch of other things like:\n\n- Metalworking  \n- Woodworking  \n- Auxiliary equipment  \n- 3D printing  \n- Electronics  \n- Laser cutting and engraving  \n- Working with fabric  \n- Casting  \n- And more\n\nYou can find the complete equipment catalog on the FabLab page, linked below. The complete video tour of the facilities is also available there. As a Skoltech student, you have 24/7 access to the FabLab Facility and any basic materials, tools and equipment you may need. Some tools can be custom ordered for your project, too.",
    "context": "Sim: 8.63 - One of the most impressive (and open to all students) research space here is the FabLab. FabLab & Machine Shop (links to an external site)is a universal laboratory for students and Skoltech community members where you can create almost anything, anytime\\! In fact, it is one of the most unique university facilities, because students can come here with an idea and leave with a prototype within a few hours. How cool is that? At Skoltech, creative research and spontaneous ideas revolve about this laboratory. It has equipment to quickly create prototypes and conduct experiences. There are machine tools, 3D printers and a bunch of other things like:\nSim: 3.42 - As a Skoltech student, you have 24/7 access to the FabLab Facility and any basic materials, tools and equipment you may need. Some tools can be custom ordered for your project, too.\nSim: 1.01 - Contrary to popular belief, the library is no longer a strict, no-talking-allowed place where you will bury yourself in books. By all means, you can do that too, but the Skoltech library is truly special. The librarians, designers and architects at Skoltech have put a lot of thought into creating a space where you can….well, do everything. Sometimes you need a few hours of quiet, at others \\- a large networking zone to debate a new concept with your friends. Or perhaps you want to eat? Just kidding, that’s what the cafeteria is for.\nSim: 0.11 - The Skoltech library is not only about books for loan, it is an academic hub for learning outside a classroom and doing research outside a lab. It combines digital infrastructure and self-directed learning space. In the library students can discover, analyze, share information, and create new knowledge. There are designated areas either for group collaboration or silent individual study, which makes the library your go-to place for any type of work.",
    "generated_answer": "The universal laboratory is called the FabLab & Machine Shop. \n",
    "logprobs": [
      [
        {
          "prob": 0.9986341798692543,
          "token": "The"
        },
        {
          "prob": 0.0011692805716836717,
          "token": "Fab"
        },
        {
          "prob": 7.9570541497926e-05,
          "token": "It"
        },
        {
          "prob": 2.5832772626341634e-05,
          "token": "Sk"
        },
        {
          "prob": 1.4719070157668602e-05,
          "token": "This"
        }
      ],
      [
        {
          "prob": 0.9527851255624962,
          "token": " universal"
        },
        {
          "prob": 0.030627228930085924,
          "token": " name"
        },
        {
          "prob": 0.011993792318996823,
          "token": " Fab"
        },
        {
          "prob": 0.0015248395771102798,
          "token": " university"
        },
        {
          "prob": 0.0009845104260001823,
          "token": " laboratory"
        }
      ],
      [
        {
          "prob": 0.9995732936941499,
          "token": " laboratory"
        },
        {
          "prob": 0.0003799667651286041,
          "token": " lab"
        },
        {
          "prob": 1.0778822310415265e-05,
          "token": " library"
        },
        {
          "prob": 8.394555255938938e-06,
          "token": " Laboratory"
        },
        {
          "prob": 8.394555255938938e-06,
          "token": " research"
        }
      ],
      [
        {
          "prob": 0.9772267229032061,
          "token": " is"
        },
        {
          "prob": 0.020281695890775112,
          "token": " for"
        },
        {
          "prob": 0.001074890503338401,
          "token": "'"
        },
        {
          "prob": 0.0004209331691687744,
          "token": " where"
        },
        {
          "prob": 0.00028930271630688725,
          "token": ","
        }
      ],
      [
        {
          "prob": 0.826773454407761,
          "token": " called"
        },
        {
          "prob": 0.16280135077364882,
          "token": " the"
        },
        {
          "prob": 0.00918462262175716,
          "token": " named"
        },
        {
          "prob": 0.000968052102226562,
          "token": " known"
        },
        {
          "prob": 0.00010861243573150219,
          "token": " Fab"
        }
      ],
      [
        {
          "prob": 0.9452300934893106,
          "token": " the"
        },
        {
          "prob": 0.053326234406707064,
          "token": " Fab"
        },
        {
          "prob": 0.0006712782239650065,
          "token": "  "
        },
        {
          "prob": 0.000461362326416994,
          "token": " The"
        },
        {
          "prob": 7.531532940289261e-05,
          "token": " \""
        }
      ],
      [
        {
          "prob": 0.9996195095536512,
          "token": " Fab"
        },
        {
          "prob": 0.00020339096075858655,
          "token": "  "
        },
        {
          "prob": 4.830958759599166e-05,
          "token": " Sk"
        },
        {
          "prob": 3.32026616175384e-05,
          "token": " Fabric"
        },
        {
          "prob": 3.1191014043691184e-05,
          "token": " Lab"
        }
      ],
      [
        {
          "prob": 0.9981428368418496,
          "token": "Lab"
        },
        {
          "prob": 0.0010313788205264884,
          "token": " Lab"
        },
        {
          "prob": 0.0008032386330692912,
          "token": "lab"
        },
        {
          "prob": 7.397572062574765e-06,
          "token": "Fab"
        },
        {
          "prob": 6.528334431868567e-06,
          "token": " lab"
        }
      ],
      [
        {
          "prob": 0.8878185803274135,
          "token": " &"
        },
        {
          "prob": 0.1060348146510153,
          "token": "."
        },
        {
          "prob": 0.005279161307753592,
          "token": " and"
        },
        {
          "prob": 0.00033748549136989247,
          "token": " Machine"
        },
        {
          "prob": 0.00020469529772402313,
          "token": "  "
        }
      ],
      [
        {
          "prob": 0.999910362648254,
          "token": " Machine"
        },
        {
          "prob": 3.3212320702556945e-05,
          "token": "  "
        },
        {
          "prob": 3.120008791433243e-05,
          "token": " Mach"
        },
        {
          "prob": 6.143661577729328e-06,
          "token": " Machines"
        },
        {
          "prob": 6.143661577729328e-06,
          "token": " machine"
        }
      ],
      [
        {
          "prob": 0.9999004701515762,
          "token": " Shop"
        },
        {
          "prob": 9.027958686937632e-05,
          "token": " shop"
        },
        {
          "prob": 5.09322576716612e-06,
          "token": "Shop"
        },
        {
          "prob": 1.2877691443126016e-06,
          "token": "  "
        },
        {
          "prob": 1.1364522810998858e-06,
          "token": " SHOP"
        }
      ],
      [
        {
          "prob": 0.9994778976166461,
          "token": "."
        },
        {
          "prob": 0.00023043940536756133,
          "token": " ("
        },
        {
          "prob": 0.00011587220982765619,
          "token": " ."
        },
        {
          "prob": 9.606143593503613e-05,
          "token": " at"
        },
        {
          "prob": 1.891561827248833e-05,
          "token": ","
        }
      ],
      [
        {
          "prob": 0.9931621454588456,
          "token": " "
        },
        {
          "prob": 0.006691874767004675,
          "token": "  "
        },
        {
          "prob": 6.163000655025734e-05,
          "token": "\n"
        },
        {
          "prob": 4.2357642753809264e-05,
          "token": "   "
        },
        {
          "prob": 2.1298760345027305e-05,
          "token": ""
        }
      ],
      [
        {
          "prob": 0.998685421389156,
          "token": "\n"
        },
        {
          "prob": 0.0009106830881584265,
          "token": "\n\n\n"
        },
        {
          "prob": 0.00029565565253172226,
          "token": "\n\n"
        },
        {
          "prob": 9.598533708286654e-05,
          "token": ""
        },
        {
          "prob": 6.531884162367549e-06,
          "token": "\n\n\n\n\n"
        }
      ],
      [
        {
          "prob": 0.9998561350834737,
          "token": ""
        },
        {
          "prob": 0.0001398214921752038,
          "token": " "
        },
        {
          "prob": 2.2600039320831835e-06,
          "token": "  "
        },
        {
          "prob": 1.5379519767814179e-07,
          "token": "."
        },
        {
          "prob": 6.61465533597867e-08,
          "token": "   "
        }
      ]
    ],
    "language_consistency_score": 0.38867328489299596
  },
  {
    "question": "What are some examples of equipment available in the FabLab at Skoltech?\n",
    "true_answer": "The FabLab has equipment for metalworking, woodworking, 3D printing, electronics, laser cutting and engraving, working with fabric, casting, and more. \n",
    "source_doc": "Also, book crossing shelves. They are everywhere :) Bring your own books, exchange old ones anonymously or read on the spot as you desire. While no food or drinks are allowed on the premises of the library, your thoughts, debates and other activities are allowed any time. Librarians are there for you if you want to organize a group activity, do not hesitate to contact them and suggest your ideas. Like the campus, the library is open 24/7 and has several multifunctional zones that vary based on the level of noise, from silent to loud. If you need a quick distraction from your studies, just glance around and solve some quirky riddles, word search puzzles and even quests. That stuff will keep you entertained for a loooong time :)     \n\nAlright, so what else can you find on the campus? Quick answer: a lot\\! Let me just list a few spaces and facilities so you know they exist:\n\n* Music room  \n* Exercise room   \n* Several photo zones  \n* A coffee shop, cafeteria and several food machines around the campus  \n* Fully equipped kitchens with hot water, basic kitchenware and some ingredients for tea  \n* Outside terraces (aka summer lounge zones)   \n* Art exhibitions   \n* An indoor basketball court  \n* A table tennis table  \n* A multifaith prayer and meditation room \n\n*Text Overlay:* \n\n* *Music room*  \n* *Exercise room*   \n* *Several photo zones*  \n* *A coffee shop, cafeteria and several food machines around the campus*  \n* *Fully equipped kitchens with hot water, basic kitchenware and some ingredients for tea*  \n* *Outside terraces (aka summer lounge zones)*   \n* *Art exhibitions*   \n* *An indoor basketball court*  \n* *A table tennis table*  \n* *A multifaith prayer and meditation room* \n\nWell, that’s a quick tour\\! You’ll get to know all of these facilities as you spend time on campus. Speaking of tours, check out [this virtual tour](https://360.skoltech.ru/)  of Skoltech to see the campus with your own eyes. The link is available in the description. Let’s keep exploring the campus, shall we? We’ve already talked about the classrooms, the library and the cafeteria, but we haven’t yet seen the most technological part: research facilities\\! *Text Overlay: Research Facilities*\n\nOne of the most impressive (and open to all students) research space here is the FabLab. FabLab & Machine Shop (links to an external site)is a universal laboratory for students and Skoltech community members where you can create almost anything, anytime\\! In fact, it is one of the most unique university facilities, because students can come here with an idea and leave with a prototype within a few hours. How cool is that? At Skoltech, creative research and spontaneous ideas revolve about this laboratory. It has equipment to quickly create prototypes and conduct experiences. There are machine tools, 3D printers and a bunch of other things like:\n\n- Metalworking  \n- Woodworking  \n- Auxiliary equipment  \n- 3D printing  \n- Electronics  \n- Laser cutting and engraving  \n- Working with fabric  \n- Casting  \n- And more\n\nYou can find the complete equipment catalog on the FabLab page, linked below. The complete video tour of the facilities is also available there. As a Skoltech student, you have 24/7 access to the FabLab Facility and any basic materials, tools and equipment you may need. Some tools can be custom ordered for your project, too.",
    "context": "Sim: 3.41 - One of the most impressive (and open to all students) research space here is the FabLab. FabLab & Machine Shop (links to an external site)is a universal laboratory for students and Skoltech community members where you can create almost anything, anytime\\! In fact, it is one of the most unique university facilities, because students can come here with an idea and leave with a prototype within a few hours. How cool is that? At Skoltech, creative research and spontaneous ideas revolve about this laboratory. It has equipment to quickly create prototypes and conduct experiences. There are machine tools, 3D printers and a bunch of other things like:\nSim: 1.73 - As a Skoltech student, you have 24/7 access to the FabLab Facility and any basic materials, tools and equipment you may need. Some tools can be custom ordered for your project, too.",
    "generated_answer": "The FabLab at Skoltech has machine tools, 3D printers, and other equipment. \n",
    "logprobs": [
      [
        {
          "prob": 0.9622407524943967,
          "token": "The"
        },
        {
          "prob": 0.01762405106093974,
          "token": "Machine"
        },
        {
          "prob": 0.008325012244987728,
          "token": "According"
        },
        {
          "prob": 0.0030626008524315,
          "token": "3"
        },
        {
          "prob": 0.0027027357661237403,
          "token": "Equipment"
        }
      ],
      [
        {
          "prob": 0.986833526652188,
          "token": " Fab"
        },
        {
          "prob": 0.003559078240641261,
          "token": " equipment"
        },
        {
          "prob": 0.003343444590833604,
          "token": " document"
        },
        {
          "prob": 0.0013937550648180804,
          "token": " available"
        },
        {
          "prob": 0.0011554635323456,
          "token": " documents"
        }
      ],
      [
        {
          "prob": 0.9959241066091223,
          "token": "Lab"
        },
        {
          "prob": 0.0026278635265098724,
          "token": "lab"
        },
        {
          "prob": 0.0012413148350913145,
          "token": " Lab"
        },
        {
          "prob": 7.45467146282758e-05,
          "token": "Labs"
        },
        {
          "prob": 5.805703972790175e-05,
          "token": "Fab"
        }
      ],
      [
        {
          "prob": 0.7269737265869024,
          "token": " at"
        },
        {
          "prob": 0.20828145985847588,
          "token": " has"
        },
        {
          "prob": 0.02818783372313344,
          "token": " offers"
        },
        {
          "prob": 0.013314989845033464,
          "token": " provides"
        },
        {
          "prob": 0.00915124976770217,
          "token": " is"
        }
      ],
      [
        {
          "prob": 0.9997829669983489,
          "token": " Sk"
        },
        {
          "prob": 7.966203473887818e-05,
          "token": " SK"
        },
        {
          "prob": 6.60421464120286e-05,
          "token": "  "
        },
        {
          "prob": 2.586247613276337e-05,
          "token": " sk"
        },
        {
          "prob": 1.1476404215949876e-05,
          "token": " the"
        }
      ],
      [
        {
          "prob": 0.9997274426708883,
          "token": "ol"
        },
        {
          "prob": 0.00017951123690477684,
          "token": "olk"
        },
        {
          "prob": 4.8314793968780206e-05,
          "token": "ot"
        },
        {
          "prob": 1.568551707187481e-05,
          "token": "otech"
        },
        {
          "prob": 1.0127330983715514e-05,
          "token": "kol"
        }
      ],
      [
        {
          "prob": 0.9998897435685532,
          "token": "tech"
        },
        {
          "prob": 5.475671073805695e-05,
          "token": "tek"
        },
        {
          "prob": 4.5394907617630615e-05,
          "token": "Tech"
        },
        {
          "prob": 2.2600793691118433e-06,
          "token": "tec"
        },
        {
          "prob": 2.2600793691118433e-06,
          "token": " tech"
        }
      ],
      [
        {
          "prob": 0.8645291948281517,
          "token": " has"
        },
        {
          "prob": 0.048773396026611994,
          "token": " offers"
        },
        {
          "prob": 0.029582560068446506,
          "token": " provides"
        },
        {
          "prob": 0.023038920946563013,
          "token": " includes"
        },
        {
          "prob": 0.010223459197207983,
          "token": " features"
        }
      ],
      [
        {
          "prob": 0.9718487810578081,
          "token": " machine"
        },
        {
          "prob": 0.007420158087907968,
          "token": " "
        },
        {
          "prob": 0.006151527116377508,
          "token": " a"
        },
        {
          "prob": 0.004790814135319785,
          "token": " machines"
        },
        {
          "prob": 0.004790814135319785,
          "token": " equipment"
        }
      ],
      [
        {
          "prob": 0.9999372998439418,
          "token": " tools"
        },
        {
          "prob": 2.0144828704088227e-05,
          "token": " tooling"
        },
        {
          "prob": 1.8924315232760343e-05,
          "token": " tolls"
        },
        {
          "prob": 6.961866512380089e-06,
          "token": " shops"
        },
        {
          "prob": 6.961866512380089e-06,
          "token": "tools"
        }
      ],
      [
        {
          "prob": 0.9988752156277637,
          "token": ","
        },
        {
          "prob": 0.0010987025056586113,
          "token": " and"
        },
        {
          "prob": 3.6079336858239262e-06,
          "token": " ("
        },
        {
          "prob": 3.1839903024702376e-06,
          "token": " as"
        },
        {
          "prob": 2.558408082441896e-06,
          "token": " available"
        }
      ],
      [
        {
          "prob": 0.999799768495098,
          "token": " "
        },
        {
          "prob": 9.027046101437898e-05,
          "token": "  "
        },
        {
          "prob": 1.669835624871756e-05,
          "token": " including"
        },
        {
          "prob": 1.669835624871756e-05,
          "token": " as"
        },
        {
          "prob": 1.5686653987558303e-05,
          "token": " a"
        }
      ],
      [
        {
          "prob": 0.9999998807907247,
          "token": "3"
        },
        {
          "prob": 1.0907283138550802e-07,
          "token": "\n"
        },
        {
          "prob": 1.3867054361168895e-08,
          "token": "2"
        },
        {
          "prob": 3.1428839598508367e-09,
          "token": "4"
        },
        {
          "prob": 2.525378208225411e-09,
          "token": "\n\n"
        }
      ],
      [
        {
          "prob": 0.999977350747961,
          "token": "D"
        },
        {
          "prob": 1.6701318523026363e-05,
          "token": "d"
        },
        {
          "prob": 4.222754624768311e-06,
          "token": "-"
        },
        {
          "prob": 1.3709277079799143e-06,
          "token": " D"
        },
        {
          "prob": 1.5381382596352822e-07,
          "token": "DS"
        }
      ],
      [
        {
          "prob": 0.9990805504655695,
          "token": " printers"
        },
        {
          "prob": 0.0007552816598518577,
          "token": " Printers"
        },
        {
          "prob": 6.19972644469893e-05,
          "token": "prin"
        },
        {
          "prob": 6.19972644469893e-05,
          "token": " printing"
        },
        {
          "prob": 2.2807518998916553e-05,
          "token": " printer"
        }
      ],
      [
        {
          "prob": 0.9378742475557934,
          "token": ","
        },
        {
          "prob": 0.05995629696063813,
          "token": " and"
        },
        {
          "prob": 0.001810523287902779,
          "token": "."
        },
        {
          "prob": 0.0001311538670805314,
          "token": " among"
        },
        {
          "prob": 9.014064671642546e-05,
          "token": " as"
        }
      ],
      [
        {
          "prob": 0.9951283999847729,
          "token": " and"
        },
        {
          "prob": 0.002176835005746373,
          "token": " among"
        },
        {
          "prob": 0.0013203171721209016,
          "token": " as"
        },
        {
          "prob": 0.00048571754344889633,
          "token": " etc"
        },
        {
          "prob": 0.0003553585460407821,
          "token": "  "
        }
      ],
      [
        {
          "prob": 0.7333344140926947,
          "token": " other"
        },
        {
          "prob": 0.12743440920696783,
          "token": " various"
        },
        {
          "prob": 0.09924601768062839,
          "token": " a"
        },
        {
          "prob": 0.025093322995600804,
          "token": " \""
        },
        {
          "prob": 0.0028153928129290473,
          "token": " many"
        }
      ],
      [
        {
          "prob": 0.45487010258890226,
          "token": " equipment"
        },
        {
          "prob": 0.2758926798512848,
          "token": " tools"
        },
        {
          "prob": 0.054326489766090884,
          "token": " materials"
        },
        {
          "prob": 0.054326489766090884,
          "token": " various"
        },
        {
          "prob": 0.04794295894686893,
          "token": " items"
        }
      ],
      [
        {
          "prob": 0.7974267500307677,
          "token": "."
        },
        {
          "prob": 0.05776539830329854,
          "token": " like"
        },
        {
          "prob": 0.0397015389389473,
          "token": " for"
        },
        {
          "prob": 0.019963187472545628,
          "token": " available"
        },
        {
          "prob": 0.01655006765227766,
          "token": ","
        }
      ],
      [
        {
          "prob": 0.9884463382576082,
          "token": " "
        },
        {
          "prob": 0.010980646131820133,
          "token": "  "
        },
        {
          "prob": 0.00025824016820139397,
          "token": "\n"
        },
        {
          "prob": 0.00012198401803255227,
          "token": "   "
        },
        {
          "prob": 9.500124876594807e-05,
          "token": ""
        }
      ],
      [
        {
          "prob": 0.999265852501042,
          "token": "\n"
        },
        {
          "prob": 0.00040434813562683703,
          "token": "\n\n\n"
        },
        {
          "prob": 0.000277904138515443,
          "token": "\n\n"
        },
        {
          "prob": 4.261797994810417e-05,
          "token": ""
        },
        {
          "prob": 2.9001899322892483e-06,
          "token": "\n\n\n\n"
        }
      ],
      [
        {
          "prob": 0.9998833077248994,
          "token": ""
        },
        {
          "prob": 0.00010889609924559211,
          "token": " "
        },
        {
          "prob": 2.9019827483452117e-06,
          "token": "  "
        },
        {
          "prob": 3.6894570366699144e-07,
          "token": "."
        },
        {
          "prob": 1.2358133084599126e-07,
          "token": "Let"
        }
      ]
    ],
    "language_consistency_score": 0.4675447256893091
  },
  {
    "question": "What are some of the things you can do at the Skoltech FabLab?\n",
    "true_answer": "At the Skoltech FabLab you can do metalworking, woodworking, 3D printing, electronics, laser cutting and engraving, work with fabric, casting, and more. \n",
    "source_doc": "Also, book crossing shelves. They are everywhere :) Bring your own books, exchange old ones anonymously or read on the spot as you desire. While no food or drinks are allowed on the premises of the library, your thoughts, debates and other activities are allowed any time. Librarians are there for you if you want to organize a group activity, do not hesitate to contact them and suggest your ideas. Like the campus, the library is open 24/7 and has several multifunctional zones that vary based on the level of noise, from silent to loud. If you need a quick distraction from your studies, just glance around and solve some quirky riddles, word search puzzles and even quests. That stuff will keep you entertained for a loooong time :)     \n\nAlright, so what else can you find on the campus? Quick answer: a lot\\! Let me just list a few spaces and facilities so you know they exist:\n\n* Music room  \n* Exercise room   \n* Several photo zones  \n* A coffee shop, cafeteria and several food machines around the campus  \n* Fully equipped kitchens with hot water, basic kitchenware and some ingredients for tea  \n* Outside terraces (aka summer lounge zones)   \n* Art exhibitions   \n* An indoor basketball court  \n* A table tennis table  \n* A multifaith prayer and meditation room \n\n*Text Overlay:* \n\n* *Music room*  \n* *Exercise room*   \n* *Several photo zones*  \n* *A coffee shop, cafeteria and several food machines around the campus*  \n* *Fully equipped kitchens with hot water, basic kitchenware and some ingredients for tea*  \n* *Outside terraces (aka summer lounge zones)*   \n* *Art exhibitions*   \n* *An indoor basketball court*  \n* *A table tennis table*  \n* *A multifaith prayer and meditation room* \n\nWell, that’s a quick tour\\! You’ll get to know all of these facilities as you spend time on campus. Speaking of tours, check out [this virtual tour](https://360.skoltech.ru/)  of Skoltech to see the campus with your own eyes. The link is available in the description. Let’s keep exploring the campus, shall we? We’ve already talked about the classrooms, the library and the cafeteria, but we haven’t yet seen the most technological part: research facilities\\! *Text Overlay: Research Facilities*\n\nOne of the most impressive (and open to all students) research space here is the FabLab. FabLab & Machine Shop (links to an external site)is a universal laboratory for students and Skoltech community members where you can create almost anything, anytime\\! In fact, it is one of the most unique university facilities, because students can come here with an idea and leave with a prototype within a few hours. How cool is that? At Skoltech, creative research and spontaneous ideas revolve about this laboratory. It has equipment to quickly create prototypes and conduct experiences. There are machine tools, 3D printers and a bunch of other things like:\n\n- Metalworking  \n- Woodworking  \n- Auxiliary equipment  \n- 3D printing  \n- Electronics  \n- Laser cutting and engraving  \n- Working with fabric  \n- Casting  \n- And more\n\nYou can find the complete equipment catalog on the FabLab page, linked below. The complete video tour of the facilities is also available there. As a Skoltech student, you have 24/7 access to the FabLab Facility and any basic materials, tools and equipment you may need. Some tools can be custom ordered for your project, too.",
    "context": "Sim: 4.16 - One of the most impressive (and open to all students) research space here is the FabLab. FabLab & Machine Shop (links to an external site)is a universal laboratory for students and Skoltech community members where you can create almost anything, anytime\\! In fact, it is one of the most unique university facilities, because students can come here with an idea and leave with a prototype within a few hours. How cool is that? At Skoltech, creative research and spontaneous ideas revolve about this laboratory. It has equipment to quickly create prototypes and conduct experiences. There are machine tools, 3D printers and a bunch of other things like:\nSim: 2.82 - As a Skoltech student, you have 24/7 access to the FabLab Facility and any basic materials, tools and equipment you may need. Some tools can be custom ordered for your project, too.\nSim: 1.34 - The Skoltech library is not only about books for loan, it is an academic hub for learning outside a classroom and doing research outside a lab. It combines digital infrastructure and self-directed learning space. In the library students can discover, analyze, share information, and create new knowledge. There are designated areas either for group collaboration or silent individual study, which makes the library your go-to place for any type of work.\nSim: 1.18 - Contrary to popular belief, the library is no longer a strict, no-talking-allowed place where you will bury yourself in books. By all means, you can do that too, but the Skoltech library is truly special. The librarians, designers and architects at Skoltech have put a lot of thought into creating a space where you can….well, do everything. Sometimes you need a few hours of quiet, at others \\- a large networking zone to debate a new concept with your friends. Or perhaps you want to eat? Just kidding, that’s what the cafeteria is for.\nSim: 0.62 - For a little extra motivation, if you win prizes or get top scores, you can be awarded a scholarship. If you don’t feel like competing in sports, but want to just work out before or after classes, Skoltech has a gym with a shower, changing rooms and all the equipment you may need. Send a request for gym membership via HelpDesk (links to an external site)to get your access at the beginning of the year\\!",
    "generated_answer": "The FabLab offers equipment for creating prototypes and conducting experiences, including machine tools, 3D printers, and other tools. \n",
    "logprobs": [
      [
        {
          "prob": 0.582248937024118,
          "token": "The"
        },
        {
          "prob": 0.16681711342415653,
          "token": "You"
        },
        {
          "prob": 0.11465159990774378,
          "token": "Students"
        },
        {
          "prob": 0.10117968179495217,
          "token": "At"
        },
        {
          "prob": 0.01871635918060584,
          "token": "Sk"
        }
      ],
      [
        {
          "prob": 0.5600340183556373,
          "token": " Fab"
        },
        {
          "prob": 0.43615493204199585,
          "token": " Sk"
        },
        {
          "prob": 0.00047974411477338957,
          "token": "  "
        },
        {
          "prob": 0.00022661507369329574,
          "token": " students"
        },
        {
          "prob": 0.0001999871006133133,
          "token": " Fabric"
        }
      ],
      [
        {
          "prob": 0.992402894777761,
          "token": "Lab"
        },
        {
          "prob": 0.0045957374027455035,
          "token": "lab"
        },
        {
          "prob": 0.002787455638753255,
          "token": " Lab"
        },
        {
          "prob": 0.00010153301580488197,
          "token": " lab"
        },
        {
          "prob": 5.434670708156233e-05,
          "token": "Labs"
        }
      ],
      [
        {
          "prob": 0.25712674980681305,
          "token": " offers"
        },
        {
          "prob": 0.2269135602761567,
          "token": " provides"
        },
        {
          "prob": 0.17672045843259127,
          "token": " at"
        },
        {
          "prob": 0.13763003141203975,
          "token": " allows"
        },
        {
          "prob": 0.1071863634602276,
          "token": " is"
        }
      ],
      [
        {
          "prob": 0.58908558222824,
          "token": " equipment"
        },
        {
          "prob": 0.2782643091607415,
          "token": " machine"
        },
        {
          "prob": 0.029328842408785038,
          "token": " students"
        },
        {
          "prob": 0.02588261258214452,
          "token": " tools"
        },
        {
          "prob": 0.018936123883067927,
          "token": " a"
        }
      ],
      [
        {
          "prob": 0.2952745768704633,
          "token": " for"
        },
        {
          "prob": 0.2952745768704633,
          "token": " like"
        },
        {
          "prob": 0.17909308390561082,
          "token": " to"
        },
        {
          "prob": 0.13947783398836253,
          "token": " such"
        },
        {
          "prob": 0.05131102762344201,
          "token": " and"
        }
      ],
      [
        {
          "prob": 0.2948515712989545,
          "token": " creating"
        },
        {
          "prob": 0.26020559839352836,
          "token": " prototyping"
        },
        {
          "prob": 0.20264832378844336,
          "token": " quickly"
        },
        {
          "prob": 0.1578226732545473,
          "token": " quick"
        },
        {
          "prob": 0.05123752027717941,
          "token": " rapid"
        }
      ],
      [
        {
          "prob": 0.9864337557423902,
          "token": " prototypes"
        },
        {
          "prob": 0.006243845624829198,
          "token": " and"
        },
        {
          "prob": 0.003139602748139822,
          "token": " rapid"
        },
        {
          "prob": 0.002027079887905436,
          "token": " quick"
        },
        {
          "prob": 0.00048147367534722866,
          "token": " prototyping"
        }
      ],
      [
        {
          "prob": 0.8605335999810537,
          "token": " and"
        },
        {
          "prob": 0.13196711545928352,
          "token": ","
        },
        {
          "prob": 0.005116919141802377,
          "token": " quickly"
        },
        {
          "prob": 0.0005393193096917309,
          "token": "."
        },
        {
          "prob": 0.000198404486262362,
          "token": " rapidly"
        }
      ],
      [
        {
          "prob": 0.991564276374089,
          "token": " conducting"
        },
        {
          "prob": 0.0035761392261106075,
          "token": " conducts"
        },
        {
          "prob": 0.0006214398156490634,
          "token": " conduct"
        },
        {
          "prob": 0.0004546550815785746,
          "token": " performing"
        },
        {
          "prob": 0.0003326327634628956,
          "token": " engaging"
        }
      ],
      [
        {
          "prob": 0.535535650389231,
          "token": " experiences"
        },
        {
          "prob": 0.41707558388578725,
          "token": " experiments"
        },
        {
          "prob": 0.011114687169102641,
          "token": " research"
        },
        {
          "prob": 0.009214399302652174,
          "token": " experimental"
        },
        {
          "prob": 0.009214399302652174,
          "token": " hands"
        }
      ],
      [
        {
          "prob": 0.7567704220486405,
          "token": ","
        },
        {
          "prob": 0.14901693155058277,
          "token": "."
        },
        {
          "prob": 0.016719240341035342,
          "token": " using"
        },
        {
          "prob": 0.016719240341035342,
          "token": " with"
        },
        {
          "prob": 0.015706272776686632,
          "token": " and"
        }
      ],
      [
        {
          "prob": 0.8975769616562321,
          "token": " including"
        },
        {
          "prob": 0.083487671324156,
          "token": " such"
        },
        {
          "prob": 0.006047825184163244,
          "token": " like"
        },
        {
          "prob": 0.0032371675475083433,
          "token": " with"
        },
        {
          "prob": 0.0022248705490525494,
          "token": " includes"
        }
      ],
      [
        {
          "prob": 0.973748536841639,
          "token": " machine"
        },
        {
          "prob": 0.014785589304270923,
          "token": " "
        },
        {
          "prob": 0.006561065481733807,
          "token": " machines"
        },
        {
          "prob": 0.0012136750776946114,
          "token": " tools"
        },
        {
          "prob": 0.0012136750776946114,
          "token": " a"
        }
      ],
      [
        {
          "prob": 0.9998201455395507,
          "token": " tools"
        },
        {
          "prob": 8.480294860837056e-05,
          "token": " tooling"
        },
        {
          "prob": 2.5863438061442524e-05,
          "token": " tolls"
        },
        {
          "prob": 2.4296451564186345e-05,
          "token": " shops"
        },
        {
          "prob": 2.4296451564186345e-05,
          "token": " tool"
        }
      ],
      [
        {
          "prob": 0.9849636028949756,
          "token": ","
        },
        {
          "prob": 0.014955882967360182,
          "token": " and"
        },
        {
          "prob": 4.471725898290587e-05,
          "token": "."
        },
        {
          "prob": 9.977769158254601e-06,
          "token": " "
        },
        {
          "prob": 3.1396443654642082e-06,
          "token": " ,"
        }
      ],
      [
        {
          "prob": 0.9997599701154202,
          "token": " "
        },
        {
          "prob": 7.029988985544669e-05,
          "token": "  "
        },
        {
          "prob": 6.604063484455518e-05,
          "token": " a"
        },
        {
          "prob": 3.534900454719761e-05,
          "token": " and"
        },
        {
          "prob": 1.6697687420786187e-05,
          "token": " three"
        }
      ],
      [
        {
          "prob": 1.0,
          "token": "3"
        },
        {
          "prob": 4.993718107117558e-08,
          "token": "\n"
        },
        {
          "prob": 1.2626096677664469e-08,
          "token": "2"
        },
        {
          "prob": 5.964145762203144e-09,
          "token": " "
        },
        {
          "prob": 2.409732720382012e-09,
          "token": "３"
        }
      ],
      [
        {
          "prob": 0.9999020195665175,
          "token": "D"
        },
        {
          "prob": 7.484447766923194e-05,
          "token": "d"
        },
        {
          "prob": 1.8923647482105978e-05,
          "token": "-"
        },
        {
          "prob": 2.902035332203476e-06,
          "token": " D"
        },
        {
          "prob": 4.4504153215287507e-07,
          "token": "DS"
        }
      ],
      [
        {
          "prob": 0.9980200470247788,
          "token": " printers"
        },
        {
          "prob": 0.0012439272896229594,
          "token": " Printers"
        },
        {
          "prob": 0.0005185460422854397,
          "token": " printing"
        },
        {
          "prob": 0.00011570326145948464,
          "token": "prin"
        },
        {
          "prob": 3.756334931422994e-05,
          "token": " printer"
        }
      ],
      [
        {
          "prob": 0.8953105821344067,
          "token": ","
        },
        {
          "prob": 0.06485608780502744,
          "token": " and"
        },
        {
          "prob": 0.03933720572276377,
          "token": "."
        },
        {
          "prob": 0.00028214646031387094,
          "token": " etc"
        },
        {
          "prob": 4.60591435010083e-05,
          "token": " among"
        }
      ],
      [
        {
          "prob": 0.9812486071492258,
          "token": " and"
        },
        {
          "prob": 0.015860405724117174,
          "token": " etc"
        },
        {
          "prob": 0.0014752475371026424,
          "token": " among"
        },
        {
          "prob": 0.0007896431041286824,
          "token": "  "
        },
        {
          "prob": 0.00015548994644741868,
          "token": " amongst"
        }
      ],
      [
        {
          "prob": 0.6080684713081465,
          "token": " other"
        },
        {
          "prob": 0.13567841942772954,
          "token": " various"
        },
        {
          "prob": 0.11973578489254492,
          "token": " more"
        },
        {
          "prob": 0.07262342460208523,
          "token": " a"
        },
        {
          "prob": 0.012620055871124278,
          "token": " many"
        }
      ],
      [
        {
          "prob": 0.6396478904295653,
          "token": " tools"
        },
        {
          "prob": 0.16172831407357005,
          "token": " resources"
        },
        {
          "prob": 0.04633593777018921,
          "token": " materials"
        },
        {
          "prob": 0.04633593777018921,
          "token": " items"
        },
        {
          "prob": 0.024801840242638512,
          "token": " related"
        }
      ],
      [
        {
          "prob": 0.9126564686421564,
          "token": "."
        },
        {
          "prob": 0.05834416910159228,
          "token": " and"
        },
        {
          "prob": 0.007896024650568817,
          "token": " for"
        },
        {
          "prob": 0.005426853087405181,
          "token": ","
        },
        {
          "prob": 0.0030921276815414544,
          "token": " needed"
        }
      ],
      [
        {
          "prob": 0.9598975440600563,
          "token": " "
        },
        {
          "prob": 0.03721926257231462,
          "token": "  "
        },
        {
          "prob": 0.0012735731301724252,
          "token": "\n"
        },
        {
          "prob": 0.000725660095611048,
          "token": "   "
        },
        {
          "prob": 0.0003884178593959966,
          "token": ""
        }
      ],
      [
        {
          "prob": 0.9938599123913007,
          "token": "\n"
        },
        {
          "prob": 0.0040616790622331434,
          "token": "\n\n\n"
        },
        {
          "prob": 0.0015905763745258435,
          "token": "\n\n"
        },
        {
          "prob": 0.00033340292023412615,
          "token": ""
        },
        {
          "prob": 7.439224698579475e-05,
          "token": "\n\n\n\n\n"
        }
      ],
      [
        {
          "prob": 0.9996907475687071,
          "token": ""
        },
        {
          "prob": 0.0002780223670547889,
          "token": " "
        },
        {
          "prob": 9.513402249170208e-06,
          "token": "  "
        },
        {
          "prob": 3.7255018496147685e-06,
          "token": "."
        },
        {
          "prob": 8.312718243378148e-07,
          "token": "The"
        }
      ]
    ],
    "language_consistency_score": 0.41923925027580106
  },
  {
    "question": "How often does a Skoltech student need to repeat the required safety training course?\n",
    "true_answer": "Every 3 months. \n",
    "source_doc": "On a more serious note, all this equipment and machinery requires training. That’s why to gain access to the lab, you’ll need to pass at least one required safety training course and repeat it every 3 months. Here are some of the important safety rules at the FabLab and any research facility at Skoltech, really:\n\n* Every new student needs to pass the EHS induction training and safety training provided by a responsible person before lab access. * Always wear safety goggles and other required means of personal protection. Always\\! * No food or drinks  \n* Do not work in the FabLab without an employee accompanying you (for safety reasons)   \n* Pay attentions to signs on machinery and equipment  \n* Do not try to access rooms or areas marked with red lines  \n* Be extra careful around yellow lines\n\n *Text Overlay:* \n\n* *Every new student needs to pass the EHS induction training and safety training provided by a responsible person before lab access.*  \n* *Always wear safety goggles and other required means of personal protection. Always\\!*   \n* *No food or drinks*  \n* *Do not work in the FabLab without an employee accompanying you (for safety reasons)*   \n* *Pay attentions to signs on machinery and equipment*  \n* *Do not try to access rooms or areas marked with red lines*  \n* *Be extra careful around yellow lines*\n\nSome of the more advanced equipment requires more targeted training \\- special (free\\!) 1-3 hour courses led by FabLab employees. That equipment is marked with a special sign. If you want to use it, ask the FabLab team about training. Speaking of the FabLab team, they are your most valuable resource\\! All of the FabLab employees are trained experts. You can consult with them about your projects, get help with any equipment and, of course, learn from them. At this point you may be asking, “What about other labs?”\n\nDuh, Skoltech has dozens of labs with fascinating and unique equipment\\! To save you some time and intrigue right now, we won’t go into detail about each and every lab here. That’s mostly because your scientific advisors and program coordinators will give you a much more in-depth orientation around the labs related to your center. If you want to take a look at some of the interesting objects right now, click the Skoltech virtual tour link in the description. Let’s talk about some safety and ground rules here at Skoltech. As an educational institution, it should come to you as no surprise that there are some rules to ensure your safety. Some are just good, logical practices \\- like no running \\- while others are strictly prohibited for everyone’s safety \\- like no food or drinks in laboratories. *Text Overlay: Ground Rules and Safety*\n\nFor a start, you should know that the campus is closed to visitors without a pass. That’s basically anyone who is not a student or an employee of Skoltech. Each visitor \\- even your mom and girlfriend \\- will need a pass to enter the halls beyond the security line. Talk to the Education Office if you need a guest pass for someone as an exception. It is prohibited to: \n\n* ### smoke tobacco products, as well as evaporative mixtures used in devices for \n\n* ### drink alcoholic beverages (including beer and other low-alcohol drinks);\n\n* ### generating aerosol, steam, or smoke outside designated areas, use open fire, including in areas directly adjacent to buildings;\n\n* ### perform actions that violate/change the designated modes of operation of technical means of protection and fire alarm;\n\n* ### use evacuation and emergency exits to enter the building, as well as exit the building in the absence of factors that threaten the life and health of citizens;\n\n* ### ride bicycles inside the buildings;\n\n* ### place bicycles, scooters, electric scooters, skateboards, gyro scooters, segways, unicycles in places not intended for parking and attaching them to poles, building facades, trees, etc. * ### ride inside the buildings and in outdoor areas on roller skates, scooters, electric scooters, skateboards, gyroscooters, segways, unicycles at а speed of more than 10 km/h.",
    "context": "Sim: 1.30 - On a more serious note, all this equipment and machinery requires training. That’s why to gain access to the lab, you’ll need to pass at least one required safety training course and repeat it every 3 months. ",
    "generated_answer": "Skoltech students need to repeat the required safety training course every 3 months. \n",
    "logprobs": [
      [
        {
          "prob": 0.6098052626051036,
          "token": "Sk"
        },
        {
          "prob": 0.19797479491307027,
          "token": "A"
        },
        {
          "prob": 0.17471214330060503,
          "token": "Students"
        },
        {
          "prob": 0.009856584649450871,
          "token": "Every"
        },
        {
          "prob": 0.0018232848267602684,
          "token": "The"
        }
      ],
      [
        {
          "prob": 0.9998006026187986,
          "token": "ol"
        },
        {
          "prob": 0.00013981375842746837,
          "token": "olk"
        },
        {
          "prob": 1.8921734597156776e-05,
          "token": "olni"
        },
        {
          "prob": 8.396468829556426e-06,
          "token": "ul"
        },
        {
          "prob": 6.539176499493186e-06,
          "token": "ole"
        }
      ],
      [
        {
          "prob": 0.9999717481958249,
          "token": "tech"
        },
        {
          "prob": 1.7778359295504835e-05,
          "token": "tek"
        },
        {
          "prob": 4.495073178347e-06,
          "token": "Tech"
        },
        {
          "prob": 3.2886657905375205e-06,
          "token": "tec"
        },
        {
          "prob": 1.7602959489646475e-06,
          "token": "test"
        }
      ],
      [
        {
          "prob": 0.9992583533831915,
          "token": " students"
        },
        {
          "prob": 0.0006666522858032008,
          "token": " student"
        },
        {
          "prob": 4.8292129609912224e-05,
          "token": " Students"
        },
        {
          "prob": 8.933145739746544e-06,
          "token": " requires"
        },
        {
          "prob": 5.767672383232958e-06,
          "token": " lab"
        }
      ],
      [
        {
          "prob": 0.9140418401178042,
          "token": " need"
        },
        {
          "prob": 0.08501912600754613,
          "token": " must"
        },
        {
          "prob": 0.0002705972415928534,
          "token": " are"
        },
        {
          "prob": 0.00023880122755362857,
          "token": " have"
        },
        {
          "prob": 0.0001278210861924437,
          "token": " require"
        }
      ],
      [
        {
          "prob": 0.9999678145263777,
          "token": " to"
        },
        {
          "prob": 1.3845747323628757e-05,
          "token": " repeat"
        },
        {
          "prob": 8.939486356793838e-06,
          "token": "  "
        },
        {
          "prob": 2.6425071196319673e-06,
          "token": " the"
        },
        {
          "prob": 1.0029825720813046e-06,
          "token": " a"
        }
      ],
      [
        {
          "prob": 0.9982668449243917,
          "token": " repeat"
        },
        {
          "prob": 0.0009103014645568937,
          "token": " retake"
        },
        {
          "prob": 0.0005186741398319231,
          "token": " re"
        },
        {
          "prob": 0.00013959925091601227,
          "token": " complete"
        },
        {
          "prob": 3.1148803213490654e-05,
          "token": " refresh"
        }
      ],
      [
        {
          "prob": 0.985466132815243,
          "token": " the"
        },
        {
          "prob": 0.010284263873447186,
          "token": " their"
        },
        {
          "prob": 0.0027679720709057635,
          "token": " required"
        },
        {
          "prob": 0.0008986289623985572,
          "token": " safety"
        },
        {
          "prob": 0.00042448226516144137,
          "token": " a"
        }
      ],
      [
        {
          "prob": 0.9662565021430771,
          "token": " required"
        },
        {
          "prob": 0.033063483004880365,
          "token": " safety"
        },
        {
          "prob": 0.0004162077278640662,
          "token": " training"
        },
        {
          "prob": 9.286854125648393e-05,
          "token": " mandatory"
        },
        {
          "prob": 3.8713367672774774e-05,
          "token": " necessary"
        }
      ],
      [
        {
          "prob": 0.9989590762328293,
          "token": " safety"
        },
        {
          "prob": 0.0009696829337213413,
          "token": " training"
        },
        {
          "prob": 1.4723857620992214e-05,
          "token": " security"
        },
        {
          "prob": 1.4723857620992214e-05,
          "token": "  "
        },
        {
          "prob": 1.0119549485352699e-05,
          "token": " course"
        }
      ],
      [
        {
          "prob": 0.9991300527882583,
          "token": " training"
        },
        {
          "prob": 0.0008558886878695475,
          "token": " course"
        },
        {
          "prob": 3.0868151182946843e-06,
          "token": "  "
        },
        {
          "prob": 2.404014031324551e-06,
          "token": " train"
        },
        {
          "prob": 2.258362184213168e-06,
          "token": " safety"
        }
      ],
      [
        {
          "prob": 0.9905596637882841,
          "token": " course"
        },
        {
          "prob": 0.00912273850999273,
          "token": " every"
        },
        {
          "prob": 0.00018933639736980128,
          "token": " courses"
        },
        {
          "prob": 5.095920003361987e-05,
          "token": " at"
        },
        {
          "prob": 1.9955909464114066e-05,
          "token": " once"
        }
      ],
      [
        {
          "prob": 0.9994528904297463,
          "token": " every"
        },
        {
          "prob": 0.00027795608925832024,
          "token": " at"
        },
        {
          "prob": 0.0002164724199738451,
          "token": " once"
        },
        {
          "prob": 2.7521379772946214e-05,
          "token": "  "
        },
        {
          "prob": 1.012454981113849e-05,
          "token": " **"
        }
      ],
      [
        {
          "prob": 0.966852435313244,
          "token": " "
        },
        {
          "prob": 0.0330838745956349,
          "token": " three"
        },
        {
          "prob": 4.123556169120023e-05,
          "token": " **"
        },
        {
          "prob": 1.181418622575316e-05,
          "token": "  "
        },
        {
          "prob": 5.24251335847491e-06,
          "token": " month"
        }
      ],
      [
        {
          "prob": 0.9999949932351057,
          "token": "3"
        },
        {
          "prob": 3.2887441993747145e-06,
          "token": "9"
        },
        {
          "prob": 6.083565059373613e-07,
          "token": "\n"
        },
        {
          "prob": 3.927844816012785e-07,
          "token": "1"
        },
        {
          "prob": 3.689868728866604e-07,
          "token": "2"
        }
      ],
      [
        {
          "prob": 0.9999940395710211,
          "token": " months"
        },
        {
          "prob": 3.288741062985334e-06,
          "token": "  "
        },
        {
          "prob": 1.0676979006009105e-06,
          "token": " month"
        },
        {
          "prob": 6.083559257636631e-07,
          "token": " moths"
        },
        {
          "prob": 3.9278410701298514e-07,
          "token": " Months"
        }
      ],
      [
        {
          "prob": 0.9994784930611875,
          "token": "."
        },
        {
          "prob": 0.00021647799403866144,
          "token": " after"
        },
        {
          "prob": 0.00011587232033205937,
          "token": ","
        },
        {
          "prob": 6.602205798692715e-05,
          "token": " to"
        },
        {
          "prob": 2.013559004085515e-05,
          "token": " ."
        }
      ],
      [
        {
          "prob": 0.9929686388937596,
          "token": " "
        },
        {
          "prob": 0.006690569802030418,
          "token": "  "
        },
        {
          "prob": 0.00017829764588998926,
          "token": "\n"
        },
        {
          "prob": 6.559203833219296e-05,
          "token": "   "
        },
        {
          "prob": 3.737321688077588e-05,
          "token": "\n\n"
        }
      ],
      [
        {
          "prob": 0.9989802517598771,
          "token": "\n"
        },
        {
          "prob": 0.0007094500741321349,
          "token": "\n\n\n"
        },
        {
          "prob": 0.00020326084937167412,
          "token": "\n\n"
        },
        {
          "prob": 7.024506990379192e-05,
          "token": ""
        },
        {
          "prob": 1.668466654096637e-05,
          "token": "\n\n\n\n"
        }
      ],
      [
        {
          "prob": 0.999814783075519,
          "token": ""
        },
        {
          "prob": 0.00017952698755929758,
          "token": " "
        },
        {
          "prob": 3.7259637572531524e-06,
          "token": "  "
        },
        {
          "prob": 3.2557108474821013e-07,
          "token": "."
        },
        {
          "prob": 1.357182199370617e-07,
          "token": "**"
        }
      ]
    ],
    "language_consistency_score": 0.6876861456375517
  },
  {
    "question": "What email address should I use to order a car pass for the Skolkovo Innovation Center Territory?\n",
    "true_answer": "security.campus@skoltech.ru \n",
    "source_doc": "Wait for an email confirmation from the security team before trying to enter the gates. You should get an answer within 10-20 minutes. Third, you can drive your personal car. This is surely a comfortable way, but it also involves a few nuances like parking and a security pass. Let’s go in order. If you decide to drive your own car, you will first need to order a security pass to enter the Skolkovo Innovation Center Territory. Without this pass, security will not let you through the territory gates no matter how hard you try to convince them. To order a car pass, send an email to security.campus@skoltech.ru from your Skoltech email address that ends with @skoltech.ru. In that email, write the following information: \n\n1.",
    "context": "Sim: 5.47 - To order a car pass, send an email to security.campus@skoltech.ru from your Skoltech email address that ends with @skoltech.ru. In that email, write the following information: \nSim: 3.00 - To order a pass for your taxi, email security.campus@skoltech.ru from your Skoltech email address with your taxi’s model and license number (i.e. Toyota, Х111СК197). \nSim: 0.63 - If you decide to drive your own car, you will first need to order a security pass to enter the Skolkovo Innovation Center Territory. Without this pass, security will not let you through the territory gates no matter how hard you try to convince them. ",
    "generated_answer": "You should use security.campus@skoltech.ru. \n",
    "logprobs": [
      [
        {
          "prob": 0.6524035958438457,
          "token": "You"
        },
        {
          "prob": 0.24000588456273853,
          "token": "security"
        },
        {
          "prob": 0.07791850260381632,
          "token": "Use"
        },
        {
          "prob": 0.007714974678016008,
          "token": "Send"
        },
        {
          "prob": 0.006808441256867714,
          "token": "Security"
        }
      ],
      [
        {
          "prob": 0.998673888585888,
          "token": " should"
        },
        {
          "prob": 0.000855497798647981,
          "token": " need"
        },
        {
          "prob": 0.0004041085460248735,
          "token": " must"
        },
        {
          "prob": 4.8263906167717294e-05,
          "token": " can"
        },
        {
          "prob": 3.2844000332961188e-06,
          "token": " would"
        }
      ],
      [
        {
          "prob": 0.5558903642644453,
          "token": " use"
        },
        {
          "prob": 0.262584015069543,
          "token": " email"
        },
        {
          "prob": 0.18047117833918397,
          "token": " send"
        },
        {
          "prob": 0.00032728344693490406,
          "token": " contact"
        },
        {
          "prob": 0.0002394456848731047,
          "token": "  "
        }
      ],
      [
        {
          "prob": 0.9637183144095575,
          "token": " security"
        },
        {
          "prob": 0.027338582113669897,
          "token": "  "
        },
        {
          "prob": 0.005057129190867447,
          "token": " the"
        },
        {
          "prob": 0.0017476970829508672,
          "token": " `"
        },
        {
          "prob": 0.0009958077806977393,
          "token": " email"
        }
      ],
      [
        {
          "prob": 0.9999477890584575,
          "token": "."
        },
        {
          "prob": 4.539754850385243e-05,
          "token": "@"
        },
        {
          "prob": 1.816130440151572e-06,
          "token": "_"
        },
        {
          "prob": 1.5056250172994402e-06,
          "token": " ."
        },
        {
          "prob": 4.591896864166198e-07,
          "token": "campus"
        }
      ],
      [
        {
          "prob": 0.999546733413629,
          "token": "campus"
        },
        {
          "prob": 0.00037995661905680964,
          "token": "camp"
        },
        {
          "prob": 4.0047152111701074e-05,
          "token": " campus"
        },
        {
          "prob": 1.4732523939360338e-05,
          "token": "Campus"
        },
        {
          "prob": 6.959151546410117e-06,
          "token": "camera"
        }
      ],
      [
        {
          "prob": 0.9999843838268748,
          "token": "@"
        },
        {
          "prob": 6.540380205489192e-06,
          "token": "@["
        },
        {
          "prob": 5.771865273069812e-06,
          "token": " @"
        },
        {
          "prob": 1.2098486863374133e-06,
          "token": "."
        },
        {
          "prob": 5.71492053303449e-07,
          "token": "@@"
        }
      ],
      [
        {
          "prob": 0.99998354938796,
          "token": "sk"
        },
        {
          "prob": 4.222782814790816e-06,
          "token": "sky"
        },
        {
          "prob": 3.0894539049482533e-06,
          "token": " sk"
        },
        {
          "prob": 2.9022733552684914e-06,
          "token": "ski"
        },
        {
          "prob": 1.7603177728373962e-06,
          "token": "SK"
        }
      ],
      [
        {
          "prob": 0.99998354938796,
          "token": "ol"
        },
        {
          "prob": 4.222782814790816e-06,
          "token": "olk"
        },
        {
          "prob": 3.2887065628995586e-06,
          "token": "olt"
        },
        {
          "prob": 2.4060691204367094e-06,
          "token": "ot"
        },
        {
          "prob": 2.260292761770375e-06,
          "token": "olni"
        }
      ],
      [
        {
          "prob": 0.9999775891557117,
          "token": "tech"
        },
        {
          "prob": 1.777847797925352e-05,
          "token": "tek"
        },
        {
          "prob": 2.123336396326759e-06,
          "token": "test"
        },
        {
          "prob": 8.851382986296586e-07,
          "token": "tec"
        },
        {
          "prob": 3.466251381305031e-07,
          "token": " tech"
        }
      ],
      [
        {
          "prob": 0.9999991655356624,
          "token": "."
        },
        {
          "prob": 2.1691701982150197e-07,
          "token": "@"
        },
        {
          "prob": 2.1691701982150197e-07,
          "token": " ."
        },
        {
          "prob": 1.1253517471925912e-07,
          "token": ".."
        },
        {
          "prob": 9.625643585384267e-08,
          "token": ","
        }
      ],
      [
        {
          "prob": 0.9999945164027223,
          "token": "ru"
        },
        {
          "prob": 2.5612741151720626e-06,
          "token": "ру"
        },
        {
          "prob": 8.315239610716842e-07,
          "token": "Ru"
        },
        {
          "prob": 5.043447766756707e-07,
          "token": "RU"
        },
        {
          "prob": 5.043447766756707e-07,
          "token": " ru"
        }
      ],
      [
        {
          "prob": 0.6519262275581567,
          "token": "."
        },
        {
          "prob": 0.21164945200473123,
          "token": " to"
        },
        {
          "prob": 0.06871252499954941,
          "token": " "
        },
        {
          "prob": 0.047225381750846965,
          "token": " from"
        },
        {
          "prob": 0.008735815144647649,
          "token": "  "
        }
      ],
      [
        {
          "prob": 0.9925113888464338,
          "token": " "
        },
        {
          "prob": 0.007118794633327561,
          "token": "  "
        },
        {
          "prob": 0.00020194465950143894,
          "token": "\n"
        },
        {
          "prob": 4.7966060936735165e-05,
          "token": "   "
        },
        {
          "prob": 3.9765261200968904e-05,
          "token": ""
        }
      ],
      [
        {
          "prob": 0.9982405915813879,
          "token": "\n"
        },
        {
          "prob": 0.0012442019487398672,
          "token": "\n\n\n"
        },
        {
          "prob": 0.000429984687822749,
          "token": "\n\n"
        },
        {
          "prob": 6.194519702310599e-05,
          "token": ""
        },
        {
          "prob": 8.9240517469091e-06,
          "token": "\n\n\n\n"
        }
      ],
      [
        {
          "prob": 0.9996956321370843,
          "token": ""
        },
        {
          "prob": 0.000295954680403573,
          "token": " "
        },
        {
          "prob": 3.725519614234271e-06,
          "token": "  "
        },
        {
          "prob": 5.041942521959511e-07,
          "token": "."
        },
        {
          "prob": 1.6368790800331358e-07,
          "token": "Please"
        }
      ]
    ],
    "language_consistency_score": 0.3629383126835275
  },
  {
    "question": "How many ECTS credits are needed to graduate from Skoltech?\n",
    "true_answer": "120 ECTS credits. \n",
    "source_doc": "So, how do you succeed and graduate from Skoltech? To get your degree, you will need to meet several requirements. *Text Overlay: MSc Degree Requirements*  \n***![][image10]***  \nYou need 120 credits to graduate. Here’s how you get them: \n\n* STE: Science, Technology and Engineering (36 ECTS-credits)  \n  * Provide a solid foundation of scientific and engineering fundamentals  \n  * Core and recommended electives  \n* Sector: Industrial Immersion (12 ECTS-credits)  \n  * Orients students to how a sector works, provides knowledge and skills to make an impact in an industrial sector  \n  * Happens in the summer term between Year 1 and Year 2  \n* Enterpreneurship and Innovation: Entrepreneurship and Innovation (12 ECTS-credits)  \n  * Orients students in the process of, provide the skills for, and experience with innovation  \n  * Includes Innovation Workshop  \n* MSc Thesis Project (36 ECTS-credits)  \n* Early research, Thesis Project, Defense\n\n* Options: elective coursework and short-term projects (24 ECTS-credits)  \n* Follow your dreams and passions, choose courses to diversify your experience  \n* Additionally you can take 20 credits as an extracurricular activity. ECTS credits are based on the workload students need in order to achieve the learning outcomes. 1 ECTS equals 27 astronomical hours (36 academic hours). This information is available in the description. *Text Overlay:* \n\n- *STE: Science, Technology and Engineering*   \n- *Sector: Industrial Immersion*  \n- *Enterpreneurship and Innovation: Entrepreneurship and Innovation*  \n- *MSc Thesis Project*   \n- *Early research, Thesis Project, Defense*  \n- *Options*\n\nHow will your course performance be assessed? The assessment criteria are set separately for all courses and described in detail in the each course syllabus. You can refer to the assessment rules prior to course registration. Your instructors will also walk through it at the very beginning of a course. *Text Overlay: Grading System*\n\nSkoltech uses an “A-F” grading system. * A-E are technically passing grades (although there is a world of difference between an A and an E), but you will receive a full number of credits if you get one of these grades. Aim to get as close to an A as possible, as it comes with many obvious and not-so-obvious benefits like scholarships :)   \n* F is a failing grade, which means you will not have passed the course if you get it. If you ever feel you are having trouble with a course and are likely to receive a poor grade, talk to your instructor as soon as possible. * Some projects have a Pass/Fail grading scale, and you will be notified in advance if that applies to your course. * The course instructor sets the grading scheme for each class, which is explained in the Course Syllabus. The course instructor also makes the final decision about your grade. We expect you to perform at a “B” grade or better level.",
    "context": "Sim: 3.20 -   1. You must be registered for a minimum of 12 credits and a maximum of 18 credits per term. During Term 1, it’s best to take only 12 credits for a smooth introduction to Skoltech coursework.   \nSim: 0.23 - Most academic programs at Skoltech focus on preparing specialists who are ready to meet the needs of industry and interests of business. One of such programs is Industrial Immersion. What is industrial immersion? Industrial immersion is a compulsory educational element aimed at getting a real hands-on work experience in the industrial sector. Basically, this is your mandatory summer internship which grants you 12 credits upon successful completion.",
    "generated_answer": "The provided text does not state how many ECTS credits are needed to graduate from Skoltech. \n",
    "logprobs": [
      [
        {
          "prob": 0.8127714025377875,
          "token": "The"
        },
        {
          "prob": 0.1813538051051734,
          "token": "This"
        },
        {
          "prob": 0.0013846533889267656,
          "token": "There"
        },
        {
          "prob": 0.0010783691435786397,
          "token": "Based"
        },
        {
          "prob": 0.0010783691435786397,
          "token": "While"
        }
      ],
      [
        {
          "prob": 0.9036666190567646,
          "token": " provided"
        },
        {
          "prob": 0.044990912415152434,
          "token": " document"
        },
        {
          "prob": 0.018755002616559324,
          "token": " context"
        },
        {
          "prob": 0.016551227770958906,
          "token": " text"
        },
        {
          "prob": 0.006088856423081619,
          "token": " documents"
        }
      ],
      [
        {
          "prob": 0.4165910031519409,
          "token": " text"
        },
        {
          "prob": 0.4165910031519409,
          "token": " documents"
        },
        {
          "prob": 0.10533069457463179,
          "token": " context"
        },
        {
          "prob": 0.03419586988222295,
          "token": " document"
        },
        {
          "prob": 0.015174325276119048,
          "token": " texts"
        }
      ],
      [
        {
          "prob": 0.7693886201585588,
          "token": " does"
        },
        {
          "prob": 0.22043352375563882,
          "token": " doesn"
        },
        {
          "prob": 0.002161054740466458,
          "token": " states"
        },
        {
          "prob": 0.002161054740466458,
          "token": " mentions"
        },
        {
          "prob": 0.0007950076102636969,
          "token": " only"
        }
      ],
      [
        {
          "prob": 0.9998508914142256,
          "token": " not"
        },
        {
          "prob": 5.143720713286964e-05,
          "token": " mention"
        },
        {
          "prob": 2.9308037176436044e-05,
          "token": "  "
        },
        {
          "prob": 8.938446323556121e-06,
          "token": " contain"
        },
        {
          "prob": 6.961268996227227e-06,
          "token": " state"
        }
      ],
      [
        {
          "prob": 0.4123468707107583,
          "token": " state"
        },
        {
          "prob": 0.19477886985118578,
          "token": " specify"
        },
        {
          "prob": 0.17189174933259949,
          "token": " mention"
        },
        {
          "prob": 0.13386941302526353,
          "token": " contain"
        },
        {
          "prob": 0.029870303567303354,
          "token": " say"
        }
      ],
      [
        {
          "prob": 0.6909918586130753,
          "token": " how"
        },
        {
          "prob": 0.2880482617628529,
          "token": " the"
        },
        {
          "prob": 0.016250574793872173,
          "token": " a"
        },
        {
          "prob": 0.0011058654931203054,
          "token": " what"
        },
        {
          "prob": 0.0008612489120137392,
          "token": " an"
        }
      ],
      [
        {
          "prob": 0.9997014698857285,
          "token": " many"
        },
        {
          "prob": 0.0002780252836407863,
          "token": " much"
        },
        {
          "prob": 6.538527962208859e-06,
          "token": "  "
        },
        {
          "prob": 3.610918087589263e-06,
          "token": " to"
        },
        {
          "prob": 1.9327851738280893e-06,
          "token": " may"
        }
      ],
      [
        {
          "prob": 0.9856774575382465,
          "token": " ECTS"
        },
        {
          "prob": 0.012407846411297286,
          "token": " credits"
        },
        {
          "prob": 0.0009567903778778397,
          "token": " total"
        },
        {
          "prob": 0.0004245731564947513,
          "token": " credit"
        },
        {
          "prob": 6.116556248088784e-05,
          "token": "  "
        }
      ],
      [
        {
          "prob": 0.9992108616922908,
          "token": " credits"
        },
        {
          "prob": 0.0004581611213684465,
          "token": " credit"
        },
        {
          "prob": 0.00013973124731071247,
          "token": " Credits"
        },
        {
          "prob": 4.828982691662847e-05,
          "token": " are"
        },
        {
          "prob": 4.828982691662847e-05,
          "token": " ("
        }
      ],
      [
        {
          "prob": 0.9957474882794007,
          "token": " are"
        },
        {
          "prob": 0.0009665654977035424,
          "token": " students"
        },
        {
          "prob": 0.000752761966501321,
          "token": " a"
        },
        {
          "prob": 0.0004860196544225401,
          "token": " it"
        },
        {
          "prob": 0.00040292444552426134,
          "token": " Sk"
        }
      ],
      [
        {
          "prob": 0.9600948573024387,
          "token": " needed"
        },
        {
          "prob": 0.03722692141828254,
          "token": " required"
        },
        {
          "prob": 0.002235649869519155,
          "token": " necessary"
        },
        {
          "prob": 0.00020794792982448696,
          "token": " need"
        },
        {
          "prob": 6.34205353856051e-05,
          "token": " generally"
        }
      ],
      [
        {
          "prob": 0.9822914627808725,
          "token": " to"
        },
        {
          "prob": 0.016901260258612886,
          "token": " for"
        },
        {
          "prob": 0.00024108352968572747,
          "token": " in"
        },
        {
          "prob": 0.000199865266023177,
          "token": "."
        },
        {
          "prob": 0.00014622455230613453,
          "token": " overall"
        }
      ],
      [
        {
          "prob": 0.998135235821583,
          "token": " graduate"
        },
        {
          "prob": 0.0011686963985255532,
          "token": " complete"
        },
        {
          "prob": 0.0001907844424803995,
          "token": " finish"
        },
        {
          "prob": 7.018567408389454e-05,
          "token": " earn"
        },
        {
          "prob": 6.593333905677977e-05,
          "token": " obtain"
        }
      ],
      [
        {
          "prob": 0.9313134011367942,
          "token": " from"
        },
        {
          "prob": 0.06746412102491343,
          "token": "."
        },
        {
          "prob": 0.0007494586869213233,
          "token": ","
        },
        {
          "prob": 9.528297946402342e-05,
          "token": "  "
        },
        {
          "prob": 5.429060518778979e-05,
          "token": " Sk"
        }
      ],
      [
        {
          "prob": 0.9994408636413572,
          "token": " Sk"
        },
        {
          "prob": 0.0001685869608532971,
          "token": " SK"
        },
        {
          "prob": 0.00013976349949292258,
          "token": " the"
        },
        {
          "prob": 0.000108847922849888,
          "token": "  "
        },
        {
          "prob": 3.7616835574133254e-05,
          "token": " sk"
        }
      ],
      [
        {
          "prob": 0.999669780133819,
          "token": "ol"
        },
        {
          "prob": 0.00027801653397458196,
          "token": "olk"
        },
        {
          "prob": 1.7773002397096973e-05,
          "token": "ot"
        },
        {
          "prob": 7.886722005776367e-06,
          "token": "oland"
        },
        {
          "prob": 6.960007741643412e-06,
          "token": "otech"
        }
      ],
      [
        {
          "prob": 0.9996229640044612,
          "token": "tech"
        },
        {
          "prob": 0.00029593323060822334,
          "token": "tek"
        },
        {
          "prob": 2.7526078285485377e-05,
          "token": "test"
        },
        {
          "prob": 2.2819920407980608e-05,
          "token": "tec"
        },
        {
          "prob": 1.0126278297305733e-05,
          "token": "tell"
        }
      ],
      [
        {
          "prob": 0.9968916537911996,
          "token": "."
        },
        {
          "prob": 0.002048570041812094,
          "token": ","
        },
        {
          "prob": 0.00029512463687542703,
          "token": " overall"
        },
        {
          "prob": 0.00013096076375212622,
          "token": " ."
        },
        {
          "prob": 0.0001230262521847769,
          "token": " but"
        }
      ],
      [
        {
          "prob": 0.9459923512846723,
          "token": " "
        },
        {
          "prob": 0.04709818692161284,
          "token": "  "
        },
        {
          "prob": 0.0038660536869095817,
          "token": " It"
        },
        {
          "prob": 0.0010405342338227134,
          "token": "   "
        },
        {
          "prob": 0.0009182682383817797,
          "token": " However"
        }
      ],
      [
        {
          "prob": 0.994069433407704,
          "token": "\n"
        },
        {
          "prob": 0.004062535200150348,
          "token": "\n\n\n"
        },
        {
          "prob": 0.0015909116429514319,
          "token": "\n\n"
        },
        {
          "prob": 0.00020226171775673918,
          "token": ""
        },
        {
          "prob": 3.98276936731574e-05,
          "token": "\n\n\n\n\n"
        }
      ],
      [
        {
          "prob": 0.9997140986828226,
          "token": ""
        },
        {
          "prob": 0.0002611838213204332,
          "token": " "
        },
        {
          "prob": 9.513619996159395e-06,
          "token": "  "
        },
        {
          "prob": 2.4054198344688955e-06,
          "token": "It"
        },
        {
          "prob": 1.994163084223393e-06,
          "token": "."
        }
      ]
    ],
    "language_consistency_score": 0.27211312892995243
  },
  {
    "question": "What email address should students contact if they have urgent questions or need assistance?\n",
    "true_answer": "education@skoltech.ru \n",
    "source_doc": "Any performance below this may be reported to the Disciplinary Board for further examination. *Text Overlay: A-E, F,*  Pass/Fail\n\nSkoltech’s variety of courses allows you to not only choose the ones that complement your educational track, but also be flexible about registering for them or making changes in your schedule (with some regulations, of course). When it comes to course registration, we mostly expect you to register for courses yourself with some exceptions. For instance, the Education Department has already registered you for your first course \\- Innovation Workshop :) \n\nFor standard terms (so, not Term 1A), registration will happen about 3 weeks before the start of the term (check the calendar\\!). Here’s a quick timeline: \n\n*Graph:* \n\n![][image11]\n\nSide note:  Short-term projects follow regular registration schedule\n\nSo how do you register for your courses?As we’ve already mentioned, you do not need to register for any courses in Term 1A \\- you are already signed up for a compulsory course called Innovation Workshop. Instructions on how to register for the other terms will be sent to you individually by the Education Department. Meanwhile, you can explore [the courses offered in 2022-2023](https://www.skoltech.ru/en/education/course-catalog/) (and in the upcoming terms) [using the link below](https://www.skoltech.ru/en/education/course-catalog/) and choose which ones you want to register for. You can filter courses based on your program, credit load, and instructors. After you’ve registered for courses, you will be added to your course “page” on Canvas. Here you will see information about your registered courses, your grades, assignments, group work and more. Make sure to bookmark Canvas in your browser and check it for updates from your professors and program coordinators on a daily basis\\! As a student, you have rights and channels for feedback. As Skoltech constantly works on improving this communication, please be aware of the following:\n\nYour student rights:\n\n* To obtain full information on your courses and educational programs, course syllabi, assessment criteria and feedback on your progress  \n* To provide your feedback on the quality of courses\n\n At the end of each course, you will be asked to submit a formal evaluation of the coursework, the course load and your professor, course instructor and teaching assistant. These evaluations are used to collect your *anonymous* feedback on each of your learning experiences. The feedback is then followed-up to Education Department, course instructors and program coordinators. If you need to communicate any concerns or issues informally or outside of the formal evaluation period (or if you are unable to solve an issue directly with your research advisor or faculty, please talk to the [Education Department](https://helpdesk.skoltech.ru/servicedesk/customer/portal/21) информация для связи также в описании. If you are a student of a network or a joint program, you probably have a few questions about the logistics of your studies. *Text Overlay: Network and Joint Programs and double degrees*\n\nYour schedule, curriculum and even travel times will depend on the program you are in. Moreover, there will be specific regulations on how to submit your original diploma and receive your scholarship if you are a student of a joint or network program. The details of your studies are normally coordinated by the Centers to which your programs belong. Each program has its own *coordinator*, who will be in touch with you regarding the essential information (if they haven’t reached out yet). Until then, if you have urgent questions or need assistance, feel free to reach out to the Education Department via [education@skoltech.ru](mailto:education@skoltech.ru). For more details on the Education Department, as well as for all the relevant links, see the description below. *Text Overlay: education@skoltech.ru.*  \n",
    "context": "Sim: 3.04 - Until then, if you have urgent questions or need assistance, feel free to reach out to the Education Department via [education@skoltech.ru](mailto:education@skoltech.ru). For more details on the Education Department, as well as for all the relevant links, see the description below.",
    "generated_answer": "Students should contact education@skoltech.ru. \n",
    "logprobs": [
      [
        {
          "prob": 0.898790533855313,
          "token": "Students"
        },
        {
          "prob": 0.08360054926553015,
          "token": "The"
        },
        {
          "prob": 0.009984661747510391,
          "token": "students"
        },
        {
          "prob": 0.0028606534856881753,
          "token": "You"
        },
        {
          "prob": 0.0009287182123859297,
          "token": "Email"
        }
      ],
      [
        {
          "prob": 0.9461718223299574,
          "token": " should"
        },
        {
          "prob": 0.0533793670910117,
          "token": " can"
        },
        {
          "prob": 0.00018085205616814762,
          "token": " may"
        },
        {
          "prob": 8.025261344724788e-05,
          "token": " are"
        },
        {
          "prob": 7.539035339726506e-05,
          "token": " need"
        }
      ],
      [
        {
          "prob": 0.9313955049396629,
          "token": " contact"
        },
        {
          "prob": 0.036114118845994636,
          "token": " reach"
        },
        {
          "prob": 0.031870598021162225,
          "token": " email"
        },
        {
          "prob": 0.0004839295847339252,
          "token": " send"
        },
        {
          "prob": 7.421297003464092e-05,
          "token": " use"
        }
      ],
      [
        {
          "prob": 0.7640737823769682,
          "token": " education"
        },
        {
          "prob": 0.11717451305557161,
          "token": " ["
        },
        {
          "prob": 0.05534932080116738,
          "token": "  "
        },
        {
          "prob": 0.051995874978470275,
          "token": " the"
        },
        {
          "prob": 0.00514828757503018,
          "token": " Education"
        }
      ],
      [
        {
          "prob": 0.9999583976891858,
          "token": "@"
        },
        {
          "prob": 3.535601722175802e-05,
          "token": "@["
        },
        {
          "prob": 2.4060071668636016e-06,
          "token": "@@"
        },
        {
          "prob": 1.2098163803234179e-06,
          "token": "["
        },
        {
          "prob": 8.314938275019864e-07,
          "token": " department"
        }
      ],
      [
        {
          "prob": 0.9999669801176596,
          "token": "sk"
        },
        {
          "prob": 6.144007271537844e-06,
          "token": "SK"
        },
        {
          "prob": 5.771760688903632e-06,
          "token": "ski"
        },
        {
          "prob": 5.422067386589378e-06,
          "token": "sky"
        },
        {
          "prob": 4.4950517442189e-06,
          "token": " skol"
        }
      ],
      [
        {
          "prob": 0.9999536297383403,
          "token": "ol"
        },
        {
          "prob": 1.777803715789507e-05,
          "token": "olt"
        },
        {
          "prob": 1.3845549260041213e-05,
          "token": "olk"
        },
        {
          "prob": 2.5611690846079645e-06,
          "token": "ole"
        },
        {
          "prob": 2.5611690846079645e-06,
          "token": "ot"
        }
      ],
      [
        {
          "prob": 0.9999890328655274,
          "token": "tech"
        },
        {
          "prob": 7.411257051862227e-06,
          "token": "tek"
        },
        {
          "prob": 8.315199960659118e-07,
          "token": "tach"
        },
        {
          "prob": 7.338138209653221e-07,
          "token": "teh"
        },
        {
          "prob": 5.043423717781038e-07,
          "token": "tec"
        }
      ],
      [
        {
          "prob": 0.9999984502816872,
          "token": "."
        },
        {
          "prob": 8.059437327595797e-07,
          "token": "@"
        },
        {
          "prob": 1.5381705313987978e-07,
          "token": " ."
        },
        {
          "prob": 1.0246424716636977e-07,
          "token": ".."
        },
        {
          "prob": 8.494584447335412e-08,
          "token": "ru"
        }
      ],
      [
        {
          "prob": 0.9999957084838798,
          "token": "ru"
        },
        {
          "prob": 1.8738717467996679e-06,
          "token": "ру"
        },
        {
          "prob": 3.466314189697482e-07,
          "token": "rub"
        },
        {
          "prob": 3.256300829617523e-07,
          "token": "RU"
        },
        {
          "prob": 3.256300829617523e-07,
          "token": "rus"
        }
      ],
      [
        {
          "prob": 0.7773760378493825,
          "token": "."
        },
        {
          "prob": 0.17345604499027745,
          "token": " for"
        },
        {
          "prob": 0.026600346028536417,
          "token": " if"
        },
        {
          "prob": 0.006725620738121541,
          "token": " "
        },
        {
          "prob": 0.006725620738121541,
          "token": " to"
        }
      ],
      [
        {
          "prob": 0.9924711116503598,
          "token": " "
        },
        {
          "prob": 0.007118506106181533,
          "token": "  "
        },
        {
          "prob": 0.00021496036078354238,
          "token": "\n"
        },
        {
          "prob": 6.555920599489296e-05,
          "token": ""
        },
        {
          "prob": 5.435049073455333e-05,
          "token": "   "
        }
      ],
      [
        {
          "prob": 0.9985104371021947,
          "token": "\n"
        },
        {
          "prob": 0.0008035343743287953,
          "token": "\n\n\n"
        },
        {
          "prob": 0.0003795627624106012,
          "token": "\n\n"
        },
        {
          "prob": 0.00026086941723309123,
          "token": ""
        },
        {
          "prob": 2.7495434288273265e-05,
          "token": "\n\n\n\n"
        }
      ],
      [
        {
          "prob": 0.9998374249589462,
          "token": ""
        },
        {
          "prob": 0.00015843563671386478,
          "token": " "
        },
        {
          "prob": 1.8735751177626604e-06,
          "token": "  "
        },
        {
          "prob": 2.8732205006597575e-07,
          "token": "."
        },
        {
          "prob": 1.0244783193789998e-07,
          "token": "**"
        }
      ]
    ],
    "language_consistency_score": 0.40747069426671434
  },
  {
    "question": "How many weeks before the start of a standard term does registration typically occur at Skoltech?\n\n",
    "true_answer": "Registration typically occurs about 3 weeks before the start of a standard term at Skoltech. \n",
    "source_doc": "Any performance below this may be reported to the Disciplinary Board for further examination. *Text Overlay: A-E, F,*  Pass/Fail\n\nSkoltech’s variety of courses allows you to not only choose the ones that complement your educational track, but also be flexible about registering for them or making changes in your schedule (with some regulations, of course). When it comes to course registration, we mostly expect you to register for courses yourself with some exceptions. For instance, the Education Department has already registered you for your first course \\- Innovation Workshop :) \n\nFor standard terms (so, not Term 1A), registration will happen about 3 weeks before the start of the term (check the calendar\\!). Here’s a quick timeline: \n\n*Graph:* \n\n![][image11]\n\nSide note:  Short-term projects follow regular registration schedule\n\nSo how do you register for your courses?As we’ve already mentioned, you do not need to register for any courses in Term 1A \\- you are already signed up for a compulsory course called Innovation Workshop. Instructions on how to register for the other terms will be sent to you individually by the Education Department. Meanwhile, you can explore [the courses offered in 2022-2023](https://www.skoltech.ru/en/education/course-catalog/) (and in the upcoming terms) [using the link below](https://www.skoltech.ru/en/education/course-catalog/) and choose which ones you want to register for. You can filter courses based on your program, credit load, and instructors. After you’ve registered for courses, you will be added to your course “page” on Canvas. Here you will see information about your registered courses, your grades, assignments, group work and more. Make sure to bookmark Canvas in your browser and check it for updates from your professors and program coordinators on a daily basis\\! As a student, you have rights and channels for feedback. As Skoltech constantly works on improving this communication, please be aware of the following:\n\nYour student rights:\n\n* To obtain full information on your courses and educational programs, course syllabi, assessment criteria and feedback on your progress  \n* To provide your feedback on the quality of courses\n\n At the end of each course, you will be asked to submit a formal evaluation of the coursework, the course load and your professor, course instructor and teaching assistant. These evaluations are used to collect your *anonymous* feedback on each of your learning experiences. The feedback is then followed-up to Education Department, course instructors and program coordinators. If you need to communicate any concerns or issues informally or outside of the formal evaluation period (or if you are unable to solve an issue directly with your research advisor or faculty, please talk to the [Education Department](https://helpdesk.skoltech.ru/servicedesk/customer/portal/21) информация для связи также в описании. If you are a student of a network or a joint program, you probably have a few questions about the logistics of your studies. *Text Overlay: Network and Joint Programs and double degrees*\n\nYour schedule, curriculum and even travel times will depend on the program you are in. Moreover, there will be specific regulations on how to submit your original diploma and receive your scholarship if you are a student of a joint or network program. The details of your studies are normally coordinated by the Centers to which your programs belong. Each program has its own *coordinator*, who will be in touch with you regarding the essential information (if they haven’t reached out yet). Until then, if you have urgent questions or need assistance, feel free to reach out to the Education Department via [education@skoltech.ru](mailto:education@skoltech.ru). For more details on the Education Department, as well as for all the relevant links, see the description below. *Text Overlay: education@skoltech.ru.*  \n",
    "context": "Sim: 4.35 - For standard terms (so, not Term 1A), registration will happen about 3 weeks before the start of the term (check the calendar\\!). Here’s a quick timeline: ",
    "generated_answer": "Registration for standard terms at Skoltech typically occurs about 3 weeks before the start of the term. \n",
    "logprobs": [
      [
        {
          "prob": 0.9601721120862654,
          "token": "Registration"
        },
        {
          "prob": 0.012086782989079862,
          "token": "Standard"
        },
        {
          "prob": 0.010666548550075157,
          "token": "3"
        },
        {
          "prob": 0.003924003919829707,
          "token": "Three"
        },
        {
          "prob": 0.003056017325538638,
          "token": "About"
        }
      ],
      [
        {
          "prob": 0.9694372049223446,
          "token": " for"
        },
        {
          "prob": 0.017755859323269268,
          "token": " typically"
        },
        {
          "prob": 0.0057644835393671255,
          "token": " occurs"
        },
        {
          "prob": 0.005087138868491373,
          "token": " happens"
        },
        {
          "prob": 0.0005036949581894297,
          "token": " generally"
        }
      ],
      [
        {
          "prob": 0.9973772591735796,
          "token": " standard"
        },
        {
          "prob": 0.001925390607061106,
          "token": " non"
        },
        {
          "prob": 0.0002952682127093926,
          "token": " Standard"
        },
        {
          "prob": 0.00010204196384229717,
          "token": " regular"
        },
        {
          "prob": 6.18915796476412e-05,
          "token": " terms"
        }
      ],
      [
        {
          "prob": 0.9990356931703256,
          "token": " terms"
        },
        {
          "prob": 0.0007094896554186403,
          "token": " term"
        },
        {
          "prob": 0.00012329075646976662,
          "token": " Terms"
        },
        {
          "prob": 4.260814531417114e-05,
          "token": " courses"
        },
        {
          "prob": 2.2806496727407963e-05,
          "token": " academic"
        }
      ],
      [
        {
          "prob": 0.30597750920940575,
          "token": " at"
        },
        {
          "prob": 0.27002420413785005,
          "token": " typically"
        },
        {
          "prob": 0.21029506163079054,
          "token": " occurs"
        },
        {
          "prob": 0.14453354124152906,
          "token": " happens"
        },
        {
          "prob": 0.017262069844576153,
          "token": " will"
        }
      ],
      [
        {
          "prob": 0.99945384305917,
          "token": " Sk"
        },
        {
          "prob": 0.00045827255372337197,
          "token": " SK"
        },
        {
          "prob": 3.118583865709783e-05,
          "token": " sk"
        },
        {
          "prob": 2.2816046963341124e-05,
          "token": "  "
        },
        {
          "prob": 1.3000191687965903e-05,
          "token": " the"
        }
      ],
      [
        {
          "prob": 0.9997678342233,
          "token": "ol"
        },
        {
          "prob": 0.00014882614537142,
          "token": "olk"
        },
        {
          "prob": 5.1432939582039246e-05,
          "token": "ole"
        },
        {
          "prob": 8.396196579083478e-06,
          "token": "otech"
        },
        {
          "prob": 7.887496744340837e-06,
          "token": "ot"
        }
      ],
      [
        {
          "prob": 0.9998665034129377,
          "token": "tech"
        },
        {
          "prob": 0.00010889422993620245,
          "token": "tek"
        },
        {
          "prob": 1.0781988857137611e-05,
          "token": "tec"
        },
        {
          "prob": 1.0781988857137611e-05,
          "token": "Tech"
        },
        {
          "prob": 6.082781874924484e-07,
          "token": "teh"
        }
      ],
      [
        {
          "prob": 0.4523687316572204,
          "token": " typically"
        },
        {
          "prob": 0.35230510145264043,
          "token": " occurs"
        },
        {
          "prob": 0.14686261613458948,
          "token": " happens"
        },
        {
          "prob": 0.015479205857712479,
          "token": " usually"
        },
        {
          "prob": 0.015479205857712479,
          "token": " will"
        }
      ],
      [
        {
          "prob": 0.7425909492233921,
          "token": " occurs"
        },
        {
          "prob": 0.24108398390335326,
          "token": " happens"
        },
        {
          "prob": 0.009347841611117633,
          "token": " takes"
        },
        {
          "prob": 0.005003539054336084,
          "token": " begins"
        },
        {
          "prob": 0.0018406991511886455,
          "token": " starts"
        }
      ],
      [
        {
          "prob": 0.8533579817178722,
          "token": " about"
        },
        {
          "prob": 0.06181703841086195,
          "token": " "
        },
        {
          "prob": 0.042486187746395135,
          "token": " approximately"
        },
        {
          "prob": 0.02274121754546148,
          "token": " around"
        },
        {
          "prob": 0.01771088225500545,
          "token": " three"
        }
      ],
      [
        {
          "prob": 0.9625870179744429,
          "token": " "
        },
        {
          "prob": 0.03732355089859234,
          "token": " three"
        },
        {
          "prob": 5.973271126758711e-05,
          "token": " **"
        },
        {
          "prob": 1.1762068240189014e-05,
          "token": "  "
        },
        {
          "prob": 9.751097061141592e-06,
          "token": " a"
        }
      ],
      [
        {
          "prob": 0.9999729402230112,
          "token": "3"
        },
        {
          "prob": 1.4738805641460676e-05,
          "token": "4"
        },
        {
          "prob": 8.397918311551527e-06,
          "token": "2"
        },
        {
          "prob": 1.2878624842344022e-06,
          "token": "1"
        },
        {
          "prob": 7.570952976334111e-07,
          "token": "6"
        }
      ],
      [
        {
          "prob": 0.9999953508594287,
          "token": " weeks"
        },
        {
          "prob": 1.6536844353143667e-06,
          "token": "  "
        },
        {
          "prob": 1.2878907331758228e-06,
          "token": "-"
        },
        {
          "prob": 3.576343402872495e-07,
          "token": "."
        },
        {
          "prob": 2.3823583075050818e-07,
          "token": " to"
        }
      ],
      [
        {
          "prob": 0.8849776953395946,
          "token": " before"
        },
        {
          "prob": 0.10569551064176967,
          "token": " prior"
        },
        {
          "prob": 0.005262269614498078,
          "token": " in"
        },
        {
          "prob": 0.0036167014881520313,
          "token": " beforehand"
        },
        {
          "prob": 0.00040578266091095773,
          "token": " ahead"
        }
      ],
      [
        {
          "prob": 0.9982049558028924,
          "token": " the"
        },
        {
          "prob": 0.001168777763926721,
          "token": " term"
        },
        {
          "prob": 0.0001792378752360719,
          "token": " their"
        },
        {
          "prob": 0.00013959059758990758,
          "token": " a"
        },
        {
          "prob": 6.194295219313196e-05,
          "token": "."
        }
      ],
      [
        {
          "prob": 0.7477652680925387,
          "token": " start"
        },
        {
          "prob": 0.2427638537609734,
          "token": " term"
        },
        {
          "prob": 0.008306922269788979,
          "token": " beginning"
        },
        {
          "prob": 0.0005310437739179781,
          "token": " starting"
        },
        {
          "prob": 0.0001619591232481283,
          "token": " semester"
        }
      ],
      [
        {
          "prob": 0.9808823661086212,
          "token": " of"
        },
        {
          "prob": 0.014893910438066819,
          "token": "."
        },
        {
          "prob": 0.004008641612705164,
          "token": " date"
        },
        {
          "prob": 0.00010682673146248785,
          "token": " time"
        },
        {
          "prob": 3.060637099689816e-05,
          "token": " term"
        }
      ],
      [
        {
          "prob": 0.9892516887680382,
          "token": " the"
        },
        {
          "prob": 0.0037979016561487133,
          "token": " a"
        },
        {
          "prob": 0.0027786042088407334,
          "token": " term"
        },
        {
          "prob": 0.002303543797027582,
          "token": " that"
        },
        {
          "prob": 0.0015832009549225045,
          "token": " each"
        }
      ],
      [
        {
          "prob": 0.9995903263662442,
          "token": " term"
        },
        {
          "prob": 0.0002033849478166706,
          "token": " semester"
        },
        {
          "prob": 7.482114094547974e-05,
          "token": " academic"
        },
        {
          "prob": 7.482114094547974e-05,
          "token": " terms"
        },
        {
          "prob": 6.141693251548242e-06,
          "token": " course"
        }
      ],
      [
        {
          "prob": 0.9993810910218334,
          "token": "."
        },
        {
          "prob": 0.00035687715657453737,
          "token": ","
        },
        {
          "prob": 6.601563601809614e-05,
          "token": " ("
        },
        {
          "prob": 2.9294260906321814e-05,
          "token": " according"
        },
        {
          "prob": 2.9294260906321814e-05,
          "token": " ."
        }
      ],
      [
        {
          "prob": 0.9893218068140521,
          "token": " "
        },
        {
          "prob": 0.009698970707036623,
          "token": "  "
        },
        {
          "prob": 0.000482883317689142,
          "token": "\n"
        },
        {
          "prob": 0.00025846881443427954,
          "token": ""
        },
        {
          "prob": 0.0001299662818182671,
          "token": "   "
        }
      ],
      [
        {
          "prob": 0.9983544055681381,
          "token": "\n"
        },
        {
          "prob": 0.001031597202730283,
          "token": "\n\n\n"
        },
        {
          "prob": 0.00031461937108326566,
          "token": "\n\n"
        },
        {
          "prob": 0.0002450258125690802,
          "token": ""
        },
        {
          "prob": 2.4260840839580703e-05,
          "token": "\n\n\n\n"
        }
      ],
      [
        {
          "prob": 0.9998449327583442,
          "token": ""
        },
        {
          "prob": 0.00014883750033836812,
          "token": " "
        },
        {
          "prob": 3.089023770299392e-06,
          "token": "  "
        },
        {
          "prob": 4.4501606740069754e-07,
          "token": "."
        },
        {
          "prob": 2.5356251193421625e-07,
          "token": "**"
        }
      ]
    ],
    "language_consistency_score": 0.7849460063972516
  },
  {
    "question": "What is the name of the internal committee at Skoltech responsible for addressing student misconduct?\n",
    "true_answer": "Skoltech Disciplinary Board (DB) \n",
    "source_doc": "\n### Video 4 \n\nIn this module, we’re going to talk about Academic Integrity. This includes Academic Misconduct and Disciplinary Measures. On top of that, we’ll discuss the Education Process, which covers Academic Structure, the Grading System, and Course Registration. *Text Overlay:* \n\n- *Academic Integrity : Academic Misconduct , Disciplinary Measures*  \n- *Education Process : Academic structure, grading system, course registration* \n\n\nLet’s start with Academic Integrity. It relies on our community’s personal values and policies on ethics, conflict of interest, and others. We expect everyone to: \n\n- Follow professional courtesy  \n- Be committed to honesty without compromising their values  \n- Promote the truth without compromise\n\n*Text Overlay:* \n\n- *Follow professional courtesy*  \n- *Be committed to honesty without compromising their values*  \n- *Promote the truth without compromise*\n\nThis is very important because it leads to the respectful culture that you develop in terms of how you conduct your academic studies, publish in top journals recognized in the most prominent fields, and other achievements. If, at any stage or time, the integrity of your studies is compromised, you will enter the realms of academic misconduct. *Text Overlay: academic misconduct.*\n\nFormal definitions of academic misconduct say that it is the intent of the individual participating in this to cheat the system in some way to gain something in return. ​​What’s considered academic misconduct? * Deliberate interference with the integrity of others’ work  \n* Fabrication or falsification of data  \n* Unauthorized collaboration  \n* Plagiarism  \n* Cheating\n\n*Text Overlay:* \n\n* *Deliberate interference with the integrity of others’ work*  \n* *Fabrication or falsification of data*  \n* *Unauthorized collaboration*  \n* *Plagiarism*  \n* *Cheating*\n\nResearch Misconduct includes such offenses as:\n\n* Substitution of data  \n* Unrealistic precision of data  \n* Results that contradict known physics\n\n*Text Overlay: Research Misconduct includes such offenses as:*\n\n* *Substitution of data*  \n* *Unrealistic precision of data*  \n* *Results that contradict known physics*\n\nYou can learn more about disciplinary actions by clicking the link below. Discipline is an important part of any academic organization, and in this case Skoltech is no exception. Students who cheat, plagiarize or participate in any other form of academic or research misconduct (including failing classes and violating full time status) are subject to an evaluation by the Skoltech Disciplinary Board (DB). *Text Overlays: Disciplinary Measures at Skoltech*\n\nIf a faculty member witnesses a student’s academic misconduct, the student’s name will be submitted to the Disciplinary Board. Both the student and the witness will be given a chance to explain their positions in writing. Then the Disciplinary Board will make a decision regarding the student’s status at Skoltech. Each case of academic and research misconduct is taken seriously and reviewed on an individual basis. For more information about this, please see the Disciplinary Board Policy via the link below. The DBP Skoltech Disciplinary Board is an internal committee formed in order to address the issues related to student misconduct and the other disputes between students and Skoltech. The Disciplinary Board reviews individual cases related to the following:\n\n- academic misconduct  \n- full-time student status violation  \n- poor academic performance  \n- violation of the attendance regulations  \n- violation (by the students) of other policies  \n- and regulations governing educational  \n- processes  \n- other academic-related issues /conflicts\n\n*Text Overlay:*\n\n- *academic misconduct*  \n- *full-time student status violation*  \n- *poor academic performance*  \n- *violation of the attendance regulations*  \n- *violation (by the students) of other policies*  \n- *and regulations governing educational*\n\nNow this lesson wouldn’t make sense without some actual advice on how to avoid academic and research misconduct. 1.",
    "context": "Sim: 7.75 - The DBP Skoltech Disciplinary Board is an internal committee formed in order to address the issues related to student misconduct and the other disputes between students and Skoltech. The Disciplinary Board reviews individual cases related to the following:\nSim: 4.28 - Discipline is an important part of any academic organization, and in this case Skoltech is no exception. Students who cheat, plagiarize or participate in any other form of academic or research misconduct (including failing classes and violating full time status) are subject to an evaluation by the Skoltech Disciplinary Board (DB).\nSim: 4.12 - If a faculty member witnesses a student’s academic misconduct, the student’s name will be submitted to the Disciplinary Board. Both the student and the witness will be given a chance to explain their positions in writing. Then the Disciplinary Board will make a decision regarding the student’s status at Skoltech. Each case of academic and research misconduct is taken seriously and reviewed on an individual basis. For more information about this, please see the Disciplinary Board Policy via the link below. ",
    "generated_answer": "The internal committee at Skoltech responsible for addressing student misconduct is the DBP Skoltech Disciplinary Board. \n",
    "logprobs": [
      [
        {
          "prob": 0.9999560137072835,
          "token": "The"
        },
        {
          "prob": 8.93938405307674e-06,
          "token": "Sk"
        },
        {
          "prob": 6.961999300712195e-06,
          "token": "According"
        },
        {
          "prob": 6.143942818674631e-06,
          "token": " The"
        },
        {
          "prob": 5.093507497116633e-06,
          "token": "It"
        }
      ],
      [
        {
          "prob": 0.9703689891568913,
          "token": " internal"
        },
        {
          "prob": 0.012215142749391459,
          "token": " Internal"
        },
        {
          "prob": 0.007886688916250946,
          "token": " Sk"
        },
        {
          "prob": 0.006538294757602659,
          "token": " Discipl"
        },
        {
          "prob": 0.0012874665736983394,
          "token": " name"
        }
      ],
      [
        {
          "prob": 0.9998931998844517,
          "token": " committee"
        },
        {
          "prob": 3.5353724463563614e-05,
          "token": " Sk"
        },
        {
          "prob": 3.1199552333924126e-05,
          "token": " Committee"
        },
        {
          "prob": 7.645779119170453e-06,
          "token": " committees"
        },
        {
          "prob": 7.645779119170453e-06,
          "token": " commit"
        }
      ],
      [
        {
          "prob": 0.6864825453080059,
          "token": " at"
        },
        {
          "prob": 0.1966805480530735,
          "token": " responsible"
        },
        {
          "prob": 0.10527551111278602,
          "token": " is"
        },
        {
          "prob": 0.006730038262883386,
          "token": " that"
        },
        {
          "prob": 0.0010320847946695816,
          "token": " addressing"
        }
      ],
      [
        {
          "prob": 0.9999289563119074,
          "token": " Sk"
        },
        {
          "prob": 3.321295418334312e-05,
          "token": " SK"
        },
        {
          "prob": 2.1443894926792575e-05,
          "token": "  "
        },
        {
          "prob": 5.771546022078492e-06,
          "token": " the"
        },
        {
          "prob": 1.9945929333027495e-06,
          "token": " sk"
        }
      ],
      [
        {
          "prob": 0.9997466252567434,
          "token": "ol"
        },
        {
          "prob": 0.00013133573149746734,
          "token": "ot"
        },
        {
          "prob": 9.608727380268685e-05,
          "token": "olk"
        },
        {
          "prob": 9.513928479592222e-06,
          "token": "otech"
        },
        {
          "prob": 7.887323737867737e-06,
          "token": "olt"
        }
      ],
      [
        {
          "prob": 0.9999517225672779,
          "token": "tech"
        },
        {
          "prob": 3.763603317349973e-05,
          "token": "tek"
        },
        {
          "prob": 4.4949831556958004e-06,
          "token": "Tech"
        },
        {
          "prob": 2.260219473131319e-06,
          "token": "tell"
        },
        {
          "prob": 1.0029663113948985e-06,
          "token": " tech"
        }
      ],
      [
        {
          "prob": 0.9561877081581693,
          "token": " responsible"
        },
        {
          "prob": 0.02112493892683668,
          "token": " is"
        },
        {
          "prob": 0.01645211505606565,
          "token": " that"
        },
        {
          "prob": 0.002523013558951896,
          "token": " addressing"
        },
        {
          "prob": 0.0009281648181351952,
          "token": ","
        }
      ],
      [
        {
          "prob": 0.999629634757054,
          "token": " for"
        },
        {
          "prob": 0.0003569658273510744,
          "token": " is"
        },
        {
          "prob": 1.0126345897732106e-05,
          "token": "  "
        },
        {
          "prob": 5.041610755270269e-07,
          "token": " to"
        },
        {
          "prob": 4.886496699301326e-07,
          "token": ","
        }
      ],
      [
        {
          "prob": 0.988021636009683,
          "token": " addressing"
        },
        {
          "prob": 0.010975929527023648,
          "token": " student"
        },
        {
          "prob": 0.0003528206765096789,
          "token": " address"
        },
        {
          "prob": 0.00020103116168516006,
          "token": " handling"
        },
        {
          "prob": 0.000138166562129105,
          "token": " dealing"
        }
      ],
      [
        {
          "prob": 0.9998050116343511,
          "token": " student"
        },
        {
          "prob": 7.030310800267494e-05,
          "token": " students"
        },
        {
          "prob": 2.4296104003144752e-05,
          "token": " misconduct"
        },
        {
          "prob": 2.4296104003144752e-05,
          "token": " issues"
        },
        {
          "prob": 1.669845179775181e-05,
          "token": " Student"
        }
      ],
      [
        {
          "prob": 0.9998791363900517,
          "token": " misconduct"
        },
        {
          "prob": 3.3211275485675183e-05,
          "token": " mis"
        },
        {
          "prob": 3.119910602394023e-05,
          "token": " conduct"
        },
        {
          "prob": 1.777671475940022e-05,
          "token": " issues"
        },
        {
          "prob": 7.888369356562479e-06,
          "token": " disputes"
        }
      ],
      [
        {
          "prob": 0.9996232022458977,
          "token": " is"
        },
        {
          "prob": 0.00010886775150021277,
          "token": " and"
        },
        {
          "prob": 8.478629011958882e-05,
          "token": ","
        },
        {
          "prob": 5.474214327700026e-05,
          "token": "  "
        },
        {
          "prob": 2.585835750941133e-05,
          "token": " issues"
        }
      ],
      [
        {
          "prob": 0.9764750364918381,
          "token": " the"
        },
        {
          "prob": 0.02296449170017757,
          "token": " called"
        },
        {
          "prob": 0.0002715659282859571,
          "token": " known"
        },
        {
          "prob": 0.00022513606205474884,
          "token": " named"
        },
        {
          "prob": 2.3729166361482298e-05,
          "token": " referred"
        }
      ],
      [
        {
          "prob": 0.7266491631280793,
          "token": " D"
        },
        {
          "prob": 0.26731928805925403,
          "token": " Discipl"
        },
        {
          "prob": 0.00262070577214192,
          "token": " Sk"
        },
        {
          "prob": 0.002312764726500815,
          "token": "  "
        },
        {
          "prob": 0.0003129988185700664,
          "token": " Dis"
        }
      ],
      [
        {
          "prob": 0.9957859040686484,
          "token": "BP"
        },
        {
          "prob": 0.0012411426026748681,
          "token": "DB"
        },
        {
          "prob": 0.0009080393258684455,
          "token": "SB"
        },
        {
          "prob": 0.0008013418925039073,
          "token": "BC"
        },
        {
          "prob": 0.00045659084708609993,
          "token": "BD"
        }
      ],
      [
        {
          "prob": 0.47303870192104447,
          "token": " Sk"
        },
        {
          "prob": 0.22344766093952817,
          "token": " ("
        },
        {
          "prob": 0.13552785720089686,
          "token": " Discipl"
        },
        {
          "prob": 0.09314684323169027,
          "token": "."
        },
        {
          "prob": 0.04985791237022897,
          "token": ","
        }
      ],
      [
        {
          "prob": 0.9999581592914675,
          "token": "ol"
        },
        {
          "prob": 2.0145251363848445e-05,
          "token": "olk"
        },
        {
          "prob": 7.411023813990802e-06,
          "token": "ot"
        },
        {
          "prob": 2.7263632991991877e-06,
          "token": "olni"
        },
        {
          "prob": 2.7263632991991877e-06,
          "token": "ole"
        }
      ],
      [
        {
          "prob": 0.9999850990607846,
          "token": "tech"
        },
        {
          "prob": 1.0783263963256106e-05,
          "token": "Tech"
        },
        {
          "prob": 2.2602949173545573e-06,
          "token": "tek"
        },
        {
          "prob": 5.043399668920043e-07,
          "token": " Tech"
        },
        {
          "prob": 4.181125180156106e-07,
          "token": " tech"
        }
      ],
      [
        {
          "prob": 0.9997161240814908,
          "token": " Discipl"
        },
        {
          "prob": 0.00010887782293075511,
          "token": "Discipl"
        },
        {
          "prob": 6.603773777026619e-05,
          "token": "."
        },
        {
          "prob": 3.119401854135574e-05,
          "token": " disciplinary"
        },
        {
          "prob": 2.752862474191288e-05,
          "token": "  "
        }
      ],
      [
        {
          "prob": 0.9999789004002659,
          "token": "inary"
        },
        {
          "prob": 1.0129881063038375e-05,
          "token": "INARY"
        },
        {
          "prob": 7.889159304314481e-06,
          "token": "ary"
        },
        {
          "prob": 2.4060576474324445e-06,
          "token": "inar"
        },
        {
          "prob": 5.714887832090453e-07,
          "token": "inal"
        }
      ],
      [
        {
          "prob": 0.9997629489238792,
          "token": " Board"
        },
        {
          "prob": 0.0001910954598644472,
          "token": " board"
        },
        {
          "prob": 1.77746465897684e-05,
          "token": "  "
        },
        {
          "prob": 8.396148535798733e-06,
          "token": "."
        },
        {
          "prob": 6.538927054463882e-06,
          "token": " Boards"
        }
      ],
      [
        {
          "prob": 0.999750795485941,
          "token": "."
        },
        {
          "prob": 9.608773198360503e-05,
          "token": " ("
        },
        {
          "prob": 9.026607060151878e-05,
          "token": " ."
        },
        {
          "prob": 3.320703160962869e-05,
          "token": ","
        },
        {
          "prob": 4.636740537239528e-06,
          "token": ".."
        }
      ],
      [
        {
          "prob": 0.9921763548341468,
          "token": " "
        },
        {
          "prob": 0.007575359562853049,
          "token": "  "
        },
        {
          "prob": 0.00012244428329758587,
          "token": "\n"
        },
        {
          "prob": 6.156885218404603e-05,
          "token": "   "
        },
        {
          "prob": 3.2955431772307034e-05,
          "token": ""
        }
      ],
      [
        {
          "prob": 0.9989036433768766,
          "token": "\n"
        },
        {
          "prob": 0.0007551480573701044,
          "token": "\n\n\n"
        },
        {
          "prob": 0.00024516068004606906,
          "token": "\n\n"
        },
        {
          "prob": 7.959201967620726e-05,
          "token": ""
        },
        {
          "prob": 6.954673172233728e-06,
          "token": "\n\n\n\n"
        }
      ],
      [
        {
          "prob": 0.9998928423312176,
          "token": ""
        },
        {
          "prob": 0.00010229939371913363,
          "token": " "
        },
        {
          "prob": 2.5610152103964203e-06,
          "token": "  "
        },
        {
          "prob": 1.8551931960213907e-07,
          "token": "."
        },
        {
          "prob": 7.49565809644368e-08,
          "token": "   "
        }
      ]
    ],
    "language_consistency_score": 0.5913434294786675
  },
  {
    "question": "What does Skoltech's Disciplinary Board review cases related to?\n",
    "true_answer": "Skoltech's Disciplinary Board reviews individual cases related to academic misconduct, full-time student status violation, poor academic performance, violation of the attendance regulations, violation of other policies and regulations governing education, and other academic-related issues and conflicts. \n",
    "source_doc": "\n### Video 4 \n\nIn this module, we’re going to talk about Academic Integrity. This includes Academic Misconduct and Disciplinary Measures. On top of that, we’ll discuss the Education Process, which covers Academic Structure, the Grading System, and Course Registration. *Text Overlay:* \n\n- *Academic Integrity : Academic Misconduct , Disciplinary Measures*  \n- *Education Process : Academic structure, grading system, course registration* \n\n\nLet’s start with Academic Integrity. It relies on our community’s personal values and policies on ethics, conflict of interest, and others. We expect everyone to: \n\n- Follow professional courtesy  \n- Be committed to honesty without compromising their values  \n- Promote the truth without compromise\n\n*Text Overlay:* \n\n- *Follow professional courtesy*  \n- *Be committed to honesty without compromising their values*  \n- *Promote the truth without compromise*\n\nThis is very important because it leads to the respectful culture that you develop in terms of how you conduct your academic studies, publish in top journals recognized in the most prominent fields, and other achievements. If, at any stage or time, the integrity of your studies is compromised, you will enter the realms of academic misconduct. *Text Overlay: academic misconduct.*\n\nFormal definitions of academic misconduct say that it is the intent of the individual participating in this to cheat the system in some way to gain something in return. ​​What’s considered academic misconduct? * Deliberate interference with the integrity of others’ work  \n* Fabrication or falsification of data  \n* Unauthorized collaboration  \n* Plagiarism  \n* Cheating\n\n*Text Overlay:* \n\n* *Deliberate interference with the integrity of others’ work*  \n* *Fabrication or falsification of data*  \n* *Unauthorized collaboration*  \n* *Plagiarism*  \n* *Cheating*\n\nResearch Misconduct includes such offenses as:\n\n* Substitution of data  \n* Unrealistic precision of data  \n* Results that contradict known physics\n\n*Text Overlay: Research Misconduct includes such offenses as:*\n\n* *Substitution of data*  \n* *Unrealistic precision of data*  \n* *Results that contradict known physics*\n\nYou can learn more about disciplinary actions by clicking the link below. Discipline is an important part of any academic organization, and in this case Skoltech is no exception. Students who cheat, plagiarize or participate in any other form of academic or research misconduct (including failing classes and violating full time status) are subject to an evaluation by the Skoltech Disciplinary Board (DB). *Text Overlays: Disciplinary Measures at Skoltech*\n\nIf a faculty member witnesses a student’s academic misconduct, the student’s name will be submitted to the Disciplinary Board. Both the student and the witness will be given a chance to explain their positions in writing. Then the Disciplinary Board will make a decision regarding the student’s status at Skoltech. Each case of academic and research misconduct is taken seriously and reviewed on an individual basis. For more information about this, please see the Disciplinary Board Policy via the link below. The DBP Skoltech Disciplinary Board is an internal committee formed in order to address the issues related to student misconduct and the other disputes between students and Skoltech. The Disciplinary Board reviews individual cases related to the following:\n\n- academic misconduct  \n- full-time student status violation  \n- poor academic performance  \n- violation of the attendance regulations  \n- violation (by the students) of other policies  \n- and regulations governing educational  \n- processes  \n- other academic-related issues /conflicts\n\n*Text Overlay:*\n\n- *academic misconduct*  \n- *full-time student status violation*  \n- *poor academic performance*  \n- *violation of the attendance regulations*  \n- *violation (by the students) of other policies*  \n- *and regulations governing educational*\n\nNow this lesson wouldn’t make sense without some actual advice on how to avoid academic and research misconduct. 1.",
    "context": "Sim: 8.24 - The DBP Skoltech Disciplinary Board is an internal committee formed in order to address the issues related to student misconduct and the other disputes between students and Skoltech. The Disciplinary Board reviews individual cases related to the following:\nSim: 4.23 - If a faculty member witnesses a student’s academic misconduct, the student’s name will be submitted to the Disciplinary Board. Both the student and the witness will be given a chance to explain their positions in writing. Then the Disciplinary Board will make a decision regarding the student’s status at Skoltech. Each case of academic and research misconduct is taken seriously and reviewed on an individual basis. For more information about this, please see the Disciplinary Board Policy via the link below. \nSim: 3.69 - Discipline is an important part of any academic organization, and in this case Skoltech is no exception. Students who cheat, plagiarize or participate in any other form of academic or research misconduct (including failing classes and violating full time status) are subject to an evaluation by the Skoltech Disciplinary Board (DB).",
    "generated_answer": "The Disciplinary Board reviews individual cases related to student misconduct and disputes between students and Skoltech. \n",
    "logprobs": [
      [
        {
          "prob": 0.9655224799462013,
          "token": "The"
        },
        {
          "prob": 0.033038361712907374,
          "token": "Sk"
        },
        {
          "prob": 0.0005684565493142173,
          "token": "According"
        },
        {
          "prob": 0.00016286552818511445,
          "token": "It"
        },
        {
          "prob": 0.0001268398008859051,
          "token": "They"
        }
      ],
      [
        {
          "prob": 0.5537774811447115,
          "token": " Discipl"
        },
        {
          "prob": 0.4312823359628114,
          "token": " Sk"
        },
        {
          "prob": 0.009528266751670776,
          "token": " D"
        },
        {
          "prob": 0.0010690419015858372,
          "token": " disciplinary"
        },
        {
          "prob": 0.0009434261668826473,
          "token": "  "
        }
      ],
      [
        {
          "prob": 0.9999760395072578,
          "token": "inary"
        },
        {
          "prob": 1.2218934002573041e-05,
          "token": "ary"
        },
        {
          "prob": 1.1478626215672864e-05,
          "token": "INARY"
        },
        {
          "prob": 1.3574009553559513e-07,
          "token": "itary"
        },
        {
          "prob": 6.825434133964623e-08,
          "token": "inal"
        }
      ],
      [
        {
          "prob": 0.999702065579845,
          "token": " Board"
        },
        {
          "prob": 0.0002611808323259094,
          "token": " board"
        },
        {
          "prob": 1.777357869474112e-05,
          "token": " Boards"
        },
        {
          "prob": 8.937116621267376e-06,
          "token": "  "
        },
        {
          "prob": 2.057441069946363e-06,
          "token": " Body"
        }
      ],
      [
        {
          "prob": 0.9960781964650465,
          "token": " reviews"
        },
        {
          "prob": 0.002978219575139818,
          "token": " addresses"
        },
        {
          "prob": 0.00027701770463113296,
          "token": " at"
        },
        {
          "prob": 0.00010190911837429686,
          "token": " in"
        },
        {
          "prob": 7.936690119201889e-05,
          "token": " handles"
        }
      ],
      [
        {
          "prob": 0.7274849088349372,
          "token": " individual"
        },
        {
          "prob": 0.2676267576746517,
          "token": " cases"
        },
        {
          "prob": 0.002175140618349785,
          "token": " student"
        },
        {
          "prob": 0.0010937293894335105,
          "token": " issues"
        },
        {
          "prob": 0.0004559342422609951,
          "token": " individuals"
        }
      ],
      [
        {
          "prob": 0.9993134684924319,
          "token": " cases"
        },
        {
          "prob": 0.0005883511199526631,
          "token": " student"
        },
        {
          "prob": 3.3192498860453085e-05,
          "token": " instances"
        },
        {
          "prob": 2.7517548060485366e-05,
          "token": " case"
        },
        {
          "prob": 5.767991419955339e-06,
          "token": " disputes"
        }
      ],
      [
        {
          "prob": 0.9604841202570007,
          "token": " related"
        },
        {
          "prob": 0.03286596109995916,
          "token": " of"
        },
        {
          "prob": 0.003687457760219449,
          "token": " regarding"
        },
        {
          "prob": 0.0013565399001728292,
          "token": " relating"
        },
        {
          "prob": 0.000772933136180679,
          "token": " involving"
        }
      ],
      [
        {
          "prob": 0.9999853374722015,
          "token": " to"
        },
        {
          "prob": 7.41122878021414e-06,
          "token": "  "
        },
        {
          "prob": 2.5612521316743374e-06,
          "token": " student"
        },
        {
          "prob": 1.2878784509512434e-06,
          "token": " specifically"
        },
        {
          "prob": 5.53909619549955e-07,
          "token": " students"
        }
      ],
      [
        {
          "prob": 0.9990334325902721,
          "token": " student"
        },
        {
          "prob": 0.00035675295242188,
          "token": " students"
        },
        {
          "prob": 0.00019095609494170288,
          "token": " issues"
        },
        {
          "prob": 0.0001158207262411393,
          "token": "  "
        },
        {
          "prob": 8.473625347396795e-05,
          "token": " academic"
        }
      ],
      [
        {
          "prob": 0.9993844247856625,
          "token": " misconduct"
        },
        {
          "prob": 0.0002779370041835559,
          "token": " conduct"
        },
        {
          "prob": 0.00013975550239013346,
          "token": " academic"
        },
        {
          "prob": 4.537196867786257e-05,
          "token": " mis"
        },
        {
          "prob": 4.0040621822379e-05,
          "token": " and"
        }
      ],
      [
        {
          "prob": 0.9666457641660973,
          "token": " and"
        },
        {
          "prob": 0.027421630324831234,
          "token": ","
        },
        {
          "prob": 0.004765164837386234,
          "token": "."
        },
        {
          "prob": 0.00047181521196506914,
          "token": " or"
        },
        {
          "prob": 0.00017357111651389523,
          "token": " between"
        }
      ],
      [
        {
          "prob": 0.9310165430521938,
          "token": " disputes"
        },
        {
          "prob": 0.06744261920838265,
          "token": " other"
        },
        {
          "prob": 0.0004544246853622851,
          "token": " student"
        },
        {
          "prob": 0.0004544246853622851,
          "token": " the"
        },
        {
          "prob": 0.0001385917647981292,
          "token": " any"
        }
      ],
      [
        {
          "prob": 0.9968809915523865,
          "token": " between"
        },
        {
          "prob": 0.0024710212303110752,
          "token": "."
        },
        {
          "prob": 0.00021591532585631639,
          "token": " with"
        },
        {
          "prob": 0.0001309592650336998,
          "token": " involving"
        },
        {
          "prob": 9.000689881600732e-05,
          "token": " among"
        }
      ],
      [
        {
          "prob": 0.999917156409734,
          "token": " students"
        },
        {
          "prob": 5.144059199392749e-05,
          "token": " student"
        },
        {
          "prob": 7.410719908990116e-06,
          "token": "  "
        },
        {
          "prob": 6.338724646138784e-06,
          "token": " the"
        },
        {
          "prob": 4.494828835345322e-06,
          "token": " Students"
        }
      ],
      [
        {
          "prob": 0.91000252301996,
          "token": " and"
        },
        {
          "prob": 0.08464342048975924,
          "token": "."
        },
        {
          "prob": 0.0047752550184271434,
          "token": " at"
        },
        {
          "prob": 0.0002694014532856986,
          "token": ","
        },
        {
          "prob": 3.881095912758697e-05,
          "token": " or"
        }
      ],
      [
        {
          "prob": 0.8897754427800084,
          "token": " Sk"
        },
        {
          "prob": 0.10626851351266742,
          "token": " the"
        },
        {
          "prob": 0.0018284512112645612,
          "token": " other"
        },
        {
          "prob": 0.0008113703066131413,
          "token": " others"
        },
        {
          "prob": 0.00021837735549220537,
          "token": " students"
        }
      ],
      [
        {
          "prob": 0.9997950020498901,
          "token": "ol"
        },
        {
          "prob": 0.00010888644149247009,
          "token": "ot"
        },
        {
          "prob": 6.604296519218895e-05,
          "token": "olk"
        },
        {
          "prob": 1.01280167373889e-05,
          "token": "olt"
        },
        {
          "prob": 5.770769985551515e-06,
          "token": "otech"
        }
      ],
      [
        {
          "prob": 0.9999512457787185,
          "token": "tech"
        },
        {
          "prob": 3.535578119566696e-05,
          "token": "tek"
        },
        {
          "prob": 3.966808712071474e-06,
          "token": "test"
        },
        {
          "prob": 2.5611641995702713e-06,
          "token": "Tech"
        },
        {
          "prob": 1.8737877567042264e-06,
          "token": "tec"
        }
      ],
      [
        {
          "prob": 0.9987879203398687,
          "token": "."
        },
        {
          "prob": 0.0004579673810078303,
          "token": ","
        },
        {
          "prob": 9.599513222894968e-05,
          "token": " itself"
        },
        {
          "prob": 9.017908118238222e-05,
          "token": " staff"
        },
        {
          "prob": 8.471540685524676e-05,
          "token": " ."
        }
      ],
      [
        {
          "prob": 0.9945626688458645,
          "token": " "
        },
        {
          "prob": 0.005218985962234329,
          "token": "  "
        },
        {
          "prob": 0.00013908126490465555,
          "token": "\n"
        },
        {
          "prob": 3.984744954856662e-05,
          "token": "   "
        },
        {
          "prob": 1.465905747203393e-05,
          "token": ""
        }
      ],
      [
        {
          "prob": 0.9996760940940556,
          "token": "\n"
        },
        {
          "prob": 0.0001910788764863296,
          "token": "\n\n\n"
        },
        {
          "prob": 0.00010227715238787647,
          "token": "\n\n"
        },
        {
          "prob": 2.585971386981115e-05,
          "token": ""
        },
        {
          "prob": 9.129595614631453e-07,
          "token": "\n\n\n\n"
        }
      ],
      [
        {
          "prob": 0.9999568480995752,
          "token": ""
        },
        {
          "prob": 4.0063578013815575e-05,
          "token": " "
        },
        {
          "prob": 9.42205045811309e-07,
          "token": "  "
        },
        {
          "prob": 7.496129906788321e-08,
          "token": "."
        },
        {
          "prob": 7.041962354983712e-08,
          "token": "Let"
        }
      ]
    ],
    "language_consistency_score": 0.6944916144168983
  },
  {
    "question": "What should you do if you are unsure about whether a certain action is appropriate during data manipulation?\n",
    "true_answer": "You should consult with your advisor or the Education Department. \n",
    "source_doc": "Always consult with your advisor or Education Department if you are unsure about whether a particular action (e.g., dropping a data point) could be questionable. 2. Make sure you understand why it is ok to manipulate data in certain ways (especially applies if you are following a protocol or methodology originally created by someone else). 3. Be vigilant about your collaborations. Beware of people who will not show you raw data or who refuse to explain how they convert raw data into a plot / figure / table. Now let’s talk about the education process itself.",
    "context": "Sim: 3.19 - 1. Always consult with your advisor or Education Department if you are unsure about whether a particular action (e.g., dropping a data point) could be questionable.  ",
    "generated_answer": "Consult with your advisor or Education Department. \n",
    "logprobs": [
      [
        {
          "prob": 0.7830429105972312,
          "token": "Consult"
        },
        {
          "prob": 0.17472049525172925,
          "token": "You"
        },
        {
          "prob": 0.011169506238910774,
          "token": "Always"
        },
        {
          "prob": 0.011169506238910774,
          "token": "If"
        },
        {
          "prob": 0.009857054659238073,
          "token": "Seek"
        }
      ],
      [
        {
          "prob": 0.754794363942591,
          "token": " with"
        },
        {
          "prob": 0.24504584529920298,
          "token": " your"
        },
        {
          "prob": 4.6838264036511826e-05,
          "token": " an"
        },
        {
          "prob": 4.6838264036511826e-05,
          "token": "  "
        },
        {
          "prob": 2.668763838821651e-05,
          "token": " a"
        }
      ],
      [
        {
          "prob": 0.9971159667313084,
          "token": " your"
        },
        {
          "prob": 0.0028006935314506334,
          "token": " an"
        },
        {
          "prob": 6.187540907215775e-05,
          "token": " a"
        },
        {
          "prob": 8.373926012161744e-06,
          "token": " either"
        },
        {
          "prob": 4.210674430507198e-06,
          "token": " the"
        }
      ],
      [
        {
          "prob": 0.9998760377062386,
          "token": " advisor"
        },
        {
          "prob": 5.475597966197588e-05,
          "token": " academic"
        },
        {
          "prob": 3.321118046758977e-05,
          "token": " Advisor"
        },
        {
          "prob": 8.397101445623889e-06,
          "token": " adviser"
        },
        {
          "prob": 7.888346787789003e-06,
          "token": " supervisor"
        }
      ],
      [
        {
          "prob": 0.999969840959284,
          "token": " or"
        },
        {
          "prob": 9.516051842790005e-06,
          "token": ","
        },
        {
          "prob": 4.784971364163379e-06,
          "token": " and"
        },
        {
          "prob": 4.784971364163379e-06,
          "token": "  "
        },
        {
          "prob": 4.495064604683495e-06,
          "token": "."
        }
      ],
      [
        {
          "prob": 0.6734681301196668,
          "token": " Education"
        },
        {
          "prob": 0.31812382848639287,
          "token": " the"
        },
        {
          "prob": 0.004262861232008921,
          "token": " education"
        },
        {
          "prob": 0.0031187759013684632,
          "token": " your"
        },
        {
          "prob": 0.0004782797749511226,
          "token": " Educational"
        }
      ],
      [
        {
          "prob": 0.9889786623458494,
          "token": " Department"
        },
        {
          "prob": 0.010986559144839305,
          "token": " department"
        },
        {
          "prob": 1.5516871389926265e-05,
          "token": "Department"
        },
        {
          "prob": 6.4683943466963265e-06,
          "token": " Dept"
        },
        {
          "prob": 3.2525129362876275e-06,
          "token": " Depart"
        }
      ],
      [
        {
          "prob": 0.9281966630811779,
          "token": "."
        },
        {
          "prob": 0.035990094613373796,
          "token": " for"
        },
        {
          "prob": 0.021829095828969705,
          "token": " if"
        },
        {
          "prob": 0.008030475574839237,
          "token": " to"
        },
        {
          "prob": 0.002449156674881006,
          "token": " about"
        }
      ],
      [
        {
          "prob": 0.9854747003927865,
          "token": " "
        },
        {
          "prob": 0.014057042711318206,
          "token": "  "
        },
        {
          "prob": 0.00024186466469492969,
          "token": "\n"
        },
        {
          "prob": 0.00015615956435525755,
          "token": "   "
        },
        {
          "prob": 3.273282290141666e-05,
          "token": "\n\n"
        }
      ],
      [
        {
          "prob": 0.999341206901095,
          "token": "\n"
        },
        {
          "prob": 0.00037987853960614725,
          "token": "\n\n\n"
        },
        {
          "prob": 0.00026108644751407674,
          "token": "\n\n"
        },
        {
          "prob": 1.0776324684732254e-05,
          "token": ""
        },
        {
          "prob": 3.4985603979530167e-06,
          "token": "\n\n\n\n"
        }
      ],
      [
        {
          "prob": 0.9998440985540105,
          "token": ""
        },
        {
          "prob": 0.00014883750033836812,
          "token": " "
        },
        {
          "prob": 3.7260739129155736e-06,
          "token": "  "
        },
        {
          "prob": 2.8732396815399583e-07,
          "token": "**"
        },
        {
          "prob": 2.381999359508006e-07,
          "token": "."
        }
      ]
    ],
    "language_consistency_score": 0.8280084215001824
  },
  {
    "question": "What is the name of the Skolkovo train station that can be used to reach the Skoltech campus?\n",
    "true_answer": "The Skolkovo train station is called \"MCD Skolkovo\" (Сколково). \n",
    "source_doc": "\n### Text After Video 3\n\n**Topic 1  “ Location & Transportation  — Premises Location, Public Transport & Carsharing, Personal Cars & Parking”**\n\nBy now you’ve probably heard that our campus and its premises are pretty cool. In fact, you may have visited it during an Open Doors event or perhaps a conference or a summer school. ![][image7]The campus is located within the Skolkovo Innovation Center territory a few minutes away from the center of Moscow. The campus is part of the Skolkovo Innovation Center, which is a closed territory. This means you may need a car pass if you decide to drive here. So, you can reach the campus in multiple ways. **First, you can use public transportation.** \n\nThis is the safest and surest way to reach the campus if you need to be there by a certain time (or just want your arrival time to be predictable). No matter where you are traveling from, you can use Moscow’s MCD-1(Moscow Central Diameter \\#1) metro line to get to the Skolkovo Train station. It’s about a 20 minute ride from the city center. You’ll need to exit the train at the “MCD Skolkovo” (Сколково) station. Once you arrive, take the stairs, escalator or an elevator to the second floor and walk down the looooong hall of the Orbion building. Then, once again, go down to the 1st floor and exit. Once you exit the building, you can take the Sk1 bus shuttle from the nearest bus stop (look to your left). Or, you can take a walk towards the Amaltea business center, walk down the stairs, cross the road and catch any shuttle bus that goes towards Skoltech (the wooden building that looks like a crown, you’ll know it when you see it). This way will take about 10 minutes if you are a fast walker. Remember that the shuttle buses at Skolkovo have paid fares (same as within the Moscow public transportation system, we’ll talk about that in the next modules) and can be tracked via [Yandex maps](https://yandex.ru/maps/213/moscow/?ll=37.622504%2C55.753215\\&z=10) \n\n[(links to an external site)](https://yandex.ru/maps/213/moscow/?ll=37.622504%2C55.753215\\&z=10)\n\nBy the way, the Skolkovo Innovation Center website also has some tips on how to reach other buildings on the territory. Visit [https://sk.ru/transport/](https://sk.ru/transport/) \n\n[(links to an external site)](https://sk.ru/transport/)\n\nfor more information. ![][image8]\n\n \n\nThe next best thing is to take a taxi\n\nCurrently, only taxi services [Yandex (links to an external site)](https://taxi.yandex.ru/ru\\_ru/) , [Citi Mobil](https://city-mobil.ru/) \n\n[(links to an external site)](https://city-mobil.ru/) , and [Uber  (links to an external site)](https://support-uber.com/) have automatic access to the Skolkovo Innovation Center. All you need to do is download a relevant app to your smartphone, order a taxi to Skoltech (just type “Сколтех” in the destination, it will be there) and relax. Don’t forget to buckle up\\! If you take a different taxi service, you’ll need to order a territory pass ahead of time. To order a pass for your taxi, email security.campus@skoltech.ru from your Skoltech email address with your taxi’s model and license number (i.e. Toyota, Х111СК197).",
    "context": "Sim: 4.41 - This is the safest and surest way to reach the campus if you need to be there by a certain time (or just want your arrival time to be predictable). No matter where you are traveling from, you can use Moscow’s MCD-1(Moscow Central Diameter \\#1) metro line to get to the Skolkovo Train station. It’s about a 20 minute ride from the city center. You’ll need to exit the train at the “MCD Skolkovo” (Сколково) station.\nSim: 2.24 - The buses, metro, trains and other city-sponsored modes of transfer are integrated by one system. You can buy yourself single- or double-ride tickets or get a permanent Troika card and top off its balance every once in a while. If you’re planning to explore the city center, we recommend using the underground metro. Yandex Metro app (links to an external site)has the current map and allows you to plan your route to point A to point B. The metro is designed in a sun-like way, with multi-colored lines stemming away from the center outwards. There are also several circle lines which connect them. You will notice on the map (and have already seen it mentioned in this course) the MCD lines. These are newer extensions of the metro line that take you a little bit outside of the city for a few extra rubles. One of these lines, MCD 1, takes you almost directly to Skoltech and is the best way to get to campus from the city center. If you use the metro app to plan your route, select the stop called “Skolkovo” and it will calculate your route for you. Easy, huh\\! If you live or end up far away from a metro station, you can take the bus, a tramway or a small overground shuttle (aka marshrutka). The Yandex Transport app shows you the nearest stops, when the next bus, tram or shuttle will arrive there and where it can take you. You can also plan your route there.\nSim: 2.02 - → From there, take an SK1 shuttle and exit at the Technopark stop. The Skoltech dorms will be on your right\\! [Here](https://old.sk.ru/city/transport/p/inner.aspx) you will find the exact map of bus routes around Skolkovo. ",
    "generated_answer": "The Skolkovo train station is located on the MCD-1 metro line. \n",
    "logprobs": [
      [
        {
          "prob": 0.9881530353715237,
          "token": "The"
        },
        {
          "prob": 0.005875773364556587,
          "token": "Sk"
        },
        {
          "prob": 0.004576056897466773,
          "token": "Moscow"
        },
        {
          "prob": 0.0003314882917614309,
          "token": "It"
        },
        {
          "prob": 0.00017743289658554335,
          "token": "You"
        }
      ],
      [
        {
          "prob": 0.9477040396449771,
          "token": " Sk"
        },
        {
          "prob": 0.03452011493452091,
          "token": " train"
        },
        {
          "prob": 0.011207043158953017,
          "token": " Moscow"
        },
        {
          "prob": 0.0015167083601618494,
          "token": " station"
        },
        {
          "prob": 0.001338490429966993,
          "token": " SK"
        }
      ],
      [
        {
          "prob": 0.9998992782944437,
          "token": "ol"
        },
        {
          "prob": 1.4737709312646475e-05,
          "token": " Schol"
        },
        {
          "prob": 1.4737709312646475e-05,
          "token": "ot"
        },
        {
          "prob": 1.012906960451979e-05,
          "token": "olk"
        },
        {
          "prob": 9.515380300632819e-06,
          "token": "olni"
        }
      ],
      [
        {
          "prob": 0.99776541957122,
          "token": "kovo"
        },
        {
          "prob": 0.0019261408390785512,
          "token": "tech"
        },
        {
          "prob": 0.00013952910786392035,
          "token": "kov"
        },
        {
          "prob": 4.821996939308609e-05,
          "token": "ka"
        },
        {
          "prob": 8.919797441820431e-06,
          "token": "kova"
        }
      ],
      [
        {
          "prob": 0.8902829178526454,
          "token": " train"
        },
        {
          "prob": 0.10632913543736644,
          "token": " Train"
        },
        {
          "prob": 0.0030163246781959663,
          "token": " station"
        },
        {
          "prob": 9.695964413531589e-05,
          "token": " metro"
        },
        {
          "prob": 8.038236827658637e-05,
          "token": " Station"
        }
      ],
      [
        {
          "prob": 0.9999277643917183,
          "token": " station"
        },
        {
          "prob": 4.264619599345682e-05,
          "token": " stations"
        },
        {
          "prob": 1.22183397199652e-05,
          "token": " Station"
        },
        {
          "prob": 8.939128298906074e-06,
          "token": " stop"
        },
        {
          "prob": 2.12322907555556e-06,
          "token": "  "
        }
      ],
      [
        {
          "prob": 0.6297779143592935,
          "token": " is"
        },
        {
          "prob": 0.33709582608966576,
          "token": " can"
        },
        {
          "prob": 0.009562672520476047,
          "token": " that"
        },
        {
          "prob": 0.005118529753769302,
          "token": "'"
        },
        {
          "prob": 0.00257375839297903,
          "token": ","
        }
      ],
      [
        {
          "prob": 0.3116432492465109,
          "token": " located"
        },
        {
          "prob": 0.12991223430007331,
          "token": " accessed"
        },
        {
          "prob": 0.12991223430007331,
          "token": " reached"
        },
        {
          "prob": 0.0892872858182212,
          "token": " connected"
        },
        {
          "prob": 0.07879575317476568,
          "token": " accessible"
        }
      ],
      [
        {
          "prob": 0.7420523449035052,
          "token": " on"
        },
        {
          "prob": 0.21260154366416661,
          "token": " at"
        },
        {
          "prob": 0.02385323211894458,
          "token": " near"
        },
        {
          "prob": 0.0053223755027577745,
          "token": " off"
        },
        {
          "prob": 0.0036580116207451286,
          "token": " in"
        }
      ],
      [
        {
          "prob": 0.5815243021638397,
          "token": " the"
        },
        {
          "prob": 0.39967541823360875,
          "token": " Moscow"
        },
        {
          "prob": 0.01367614319286698,
          "token": " MCD"
        },
        {
          "prob": 0.0011226061951667289,
          "token": "  "
        },
        {
          "prob": 0.0006396417289425327,
          "token": " Mos"
        }
      ],
      [
        {
          "prob": 0.7940288179104569,
          "token": " MCD"
        },
        {
          "prob": 0.20076192537780055,
          "token": " Moscow"
        },
        {
          "prob": 0.0010535017716878834,
          "token": "  "
        },
        {
          "prob": 0.0008204680047576359,
          "token": " \""
        },
        {
          "prob": 0.0006801918664794554,
          "token": " Sk"
        }
      ],
      [
        {
          "prob": 0.9891736493130662,
          "token": "-"
        },
        {
          "prob": 0.004303247801750699,
          "token": " line"
        },
        {
          "prob": 0.002957576078124075,
          "token": " ("
        },
        {
          "prob": 0.0007024858926131629,
          "token": " -"
        },
        {
          "prob": 0.0006199416243404909,
          "token": " "
        }
      ],
      [
        {
          "prob": 0.9998439793924122,
          "token": "1"
        },
        {
          "prob": 3.119800515327691e-05,
          "token": "Sk"
        },
        {
          "prob": 2.014294605470302e-05,
          "token": "2"
        },
        {
          "prob": 1.669908880528582e-05,
          "token": " "
        },
        {
          "prob": 1.669908880528582e-05,
          "token": "line"
        }
      ],
      [
        {
          "prob": 0.7019072632185948,
          "token": " metro"
        },
        {
          "prob": 0.22787593165189532,
          "token": " ("
        },
        {
          "prob": 0.037199718803884535,
          "token": " line"
        },
        {
          "prob": 0.011345275941005808,
          "token": " Metro"
        },
        {
          "prob": 0.0060726886071248995,
          "token": "("
        }
      ],
      [
        {
          "prob": 0.9992972785751018,
          "token": " line"
        },
        {
          "prob": 0.00019100654605394487,
          "token": " lines"
        },
        {
          "prob": 0.00010883224935271383,
          "token": "."
        },
        {
          "prob": 9.60441229550843e-05,
          "token": " station"
        },
        {
          "prob": 4.261932121041515e-05,
          "token": " ("
        }
      ],
      [
        {
          "prob": 0.9539136617570672,
          "token": "."
        },
        {
          "prob": 0.01747153868046498,
          "token": ","
        },
        {
          "prob": 0.01448441430552064,
          "token": " and"
        },
        {
          "prob": 0.0020866777247947384,
          "token": " ("
        },
        {
          "prob": 0.0017299165941132661,
          "token": " that"
        }
      ],
      [
        {
          "prob": 0.97254250528314,
          "token": " "
        },
        {
          "prob": 0.02591737805258797,
          "token": "  "
        },
        {
          "prob": 0.00047469333735400594,
          "token": "\n"
        },
        {
          "prob": 0.0003262516414769144,
          "token": "   "
        },
        {
          "prob": 0.0003262516414769144,
          "token": ""
        }
      ],
      [
        {
          "prob": 0.9916870070854371,
          "token": "\n"
        },
        {
          "prob": 0.004592422982507985,
          "token": "\n\n\n"
        },
        {
          "prob": 0.0027854453412600277,
          "token": "\n\n"
        },
        {
          "prob": 0.0007980434516628672,
          "token": ""
        },
        {
          "prob": 6.550739563155789e-05,
          "token": "\n\n\n\n"
        }
      ],
      [
        {
          "prob": 0.9993393020905506,
          "token": ""
        },
        {
          "prob": 0.0006263126339334708,
          "token": " "
        },
        {
          "prob": 1.3837048401575208e-05,
          "token": "  "
        },
        {
          "prob": 3.087462825825051e-06,
          "token": "."
        },
        {
          "prob": 1.6525997626503951e-06,
          "token": "OR"
        }
      ]
    ],
    "language_consistency_score": 0.44442912006345986
  },
  {
    "question": "Which public transportation line can be used to get to the Skolkovo Train station?\n",
    "true_answer": "The MCD-1 (Moscow Central Diameter #1) metro line can be used to get to the Skolkovo Train station. \n",
    "source_doc": "\n### Text After Video 3\n\n**Topic 1  “ Location & Transportation  — Premises Location, Public Transport & Carsharing, Personal Cars & Parking”**\n\nBy now you’ve probably heard that our campus and its premises are pretty cool. In fact, you may have visited it during an Open Doors event or perhaps a conference or a summer school. ![][image7]The campus is located within the Skolkovo Innovation Center territory a few minutes away from the center of Moscow. The campus is part of the Skolkovo Innovation Center, which is a closed territory. This means you may need a car pass if you decide to drive here. So, you can reach the campus in multiple ways. **First, you can use public transportation.** \n\nThis is the safest and surest way to reach the campus if you need to be there by a certain time (or just want your arrival time to be predictable). No matter where you are traveling from, you can use Moscow’s MCD-1(Moscow Central Diameter \\#1) metro line to get to the Skolkovo Train station. It’s about a 20 minute ride from the city center. You’ll need to exit the train at the “MCD Skolkovo” (Сколково) station. Once you arrive, take the stairs, escalator or an elevator to the second floor and walk down the looooong hall of the Orbion building. Then, once again, go down to the 1st floor and exit. Once you exit the building, you can take the Sk1 bus shuttle from the nearest bus stop (look to your left). Or, you can take a walk towards the Amaltea business center, walk down the stairs, cross the road and catch any shuttle bus that goes towards Skoltech (the wooden building that looks like a crown, you’ll know it when you see it). This way will take about 10 minutes if you are a fast walker. Remember that the shuttle buses at Skolkovo have paid fares (same as within the Moscow public transportation system, we’ll talk about that in the next modules) and can be tracked via [Yandex maps](https://yandex.ru/maps/213/moscow/?ll=37.622504%2C55.753215\\&z=10) \n\n[(links to an external site)](https://yandex.ru/maps/213/moscow/?ll=37.622504%2C55.753215\\&z=10)\n\nBy the way, the Skolkovo Innovation Center website also has some tips on how to reach other buildings on the territory. Visit [https://sk.ru/transport/](https://sk.ru/transport/) \n\n[(links to an external site)](https://sk.ru/transport/)\n\nfor more information. ![][image8]\n\n \n\nThe next best thing is to take a taxi\n\nCurrently, only taxi services [Yandex (links to an external site)](https://taxi.yandex.ru/ru\\_ru/) , [Citi Mobil](https://city-mobil.ru/) \n\n[(links to an external site)](https://city-mobil.ru/) , and [Uber  (links to an external site)](https://support-uber.com/) have automatic access to the Skolkovo Innovation Center. All you need to do is download a relevant app to your smartphone, order a taxi to Skoltech (just type “Сколтех” in the destination, it will be there) and relax. Don’t forget to buckle up\\! If you take a different taxi service, you’ll need to order a territory pass ahead of time. To order a pass for your taxi, email security.campus@skoltech.ru from your Skoltech email address with your taxi’s model and license number (i.e. Toyota, Х111СК197).",
    "context": "Sim: 6.51 - This is the safest and surest way to reach the campus if you need to be there by a certain time (or just want your arrival time to be predictable). No matter where you are traveling from, you can use Moscow’s MCD-1(Moscow Central Diameter \\#1) metro line to get to the Skolkovo Train station. It’s about a 20 minute ride from the city center. You’ll need to exit the train at the “MCD Skolkovo” (Сколково) station.\nSim: 2.37 - The buses, metro, trains and other city-sponsored modes of transfer are integrated by one system. You can buy yourself single- or double-ride tickets or get a permanent Troika card and top off its balance every once in a while. If you’re planning to explore the city center, we recommend using the underground metro. Yandex Metro app (links to an external site)has the current map and allows you to plan your route to point A to point B. The metro is designed in a sun-like way, with multi-colored lines stemming away from the center outwards. There are also several circle lines which connect them. You will notice on the map (and have already seen it mentioned in this course) the MCD lines. These are newer extensions of the metro line that take you a little bit outside of the city for a few extra rubles. One of these lines, MCD 1, takes you almost directly to Skoltech and is the best way to get to campus from the city center. If you use the metro app to plan your route, select the stop called “Skolkovo” and it will calculate your route for you. Easy, huh\\! If you live or end up far away from a metro station, you can take the bus, a tramway or a small overground shuttle (aka marshrutka). The Yandex Transport app shows you the nearest stops, when the next bus, tram or shuttle will arrive there and where it can take you. You can also plan your route there.\nSim: 1.28 - → From there, take an SK1 shuttle and exit at the Technopark stop. The Skoltech dorms will be on your right\\! [Here](https://old.sk.ru/city/transport/p/inner.aspx) you will find the exact map of bus routes around Skolkovo. \nSim: 0.73 - * By taxi: If you don't want to worry about taking public transport on your first day, you can always order a taxi directly from the airport or the railway station directly to the Skoltech dormitories or your planned accommodation. We recommend using the [Uber App](https://support-uber.com/) or [Yandex Taxi](https://taxi.yandex.ru/ru\\_ru/) (which have open access to the Skolkovo territory). You’ll see the price in advance, would be able to choose the type of the vehicle (considering your bags) and can pay by credit card if you don't have cash on you yet.\nSim: 0.57 - Remember that the shuttle buses at Skolkovo have paid fares (same as within the Moscow public transportation system, we’ll talk about that in the next modules) and can be tracked via [Yandex maps](https://yandex.ru/maps/213/moscow/?ll=37.622504%2C55.753215\\&z=10) \nSim: 0.43 - The closest metro stations like Yugo-Zapadnaya, Park Pobedy & Slavyansky Boulevard have bus stops with direct routes to Skolkovo and should get you to the campus within 45 minutes.",
    "generated_answer": "The Moscow MCD-1 metro line can be used to reach the Skolkovo Train station. \n",
    "logprobs": [
      [
        {
          "prob": 0.9677180736412867,
          "token": "The"
        },
        {
          "prob": 0.018867498322475296,
          "token": "You"
        },
        {
          "prob": 0.0121817724892869,
          "token": "Moscow"
        },
        {
          "prob": 0.00032463339559357293,
          "token": "MCD"
        },
        {
          "prob": 0.0002528247426994038,
          "token": "Use"
        }
      ],
      [
        {
          "prob": 0.49907355914093043,
          "token": " Moscow"
        },
        {
          "prob": 0.49907355914093043,
          "token": " MCD"
        },
        {
          "prob": 0.0004016210393365169,
          "token": " McDonald"
        },
        {
          "prob": 0.0003544293232272821,
          "token": "  "
        },
        {
          "prob": 0.00014774812351381168,
          "token": " metro"
        }
      ],
      [
        {
          "prob": 0.41132722129584315,
          "token": " MCD"
        },
        {
          "prob": 0.36299499874231,
          "token": " Central"
        },
        {
          "prob": 0.13353839728534941,
          "token": "'"
        },
        {
          "prob": 0.04072691013332327,
          "token": " Metro"
        },
        {
          "prob": 0.024702119671221698,
          "token": " metro"
        }
      ],
      [
        {
          "prob": 0.9998051307913051,
          "token": "-"
        },
        {
          "prob": 9.609295540049526e-05,
          "token": " ("
        },
        {
          "prob": 3.1196815066526646e-05,
          "token": " line"
        },
        {
          "prob": 2.5863068084639614e-05,
          "token": " -"
        },
        {
          "prob": 6.539207680790919e-06,
          "token": " lines"
        }
      ],
      [
        {
          "prob": 0.999991297797926,
          "token": "1"
        },
        {
          "prob": 2.190767578520592e-06,
          "token": " "
        },
        {
          "prob": 1.7603312030474177e-06,
          "token": "2"
        },
        {
          "prob": 1.653678127020905e-06,
          "token": "line"
        },
        {
          "prob": 4.052512535462743e-07,
          "token": "l"
        }
      ],
      [
        {
          "prob": 0.6994951879214152,
          "token": " metro"
        },
        {
          "prob": 0.29159297679231894,
          "token": " ("
        },
        {
          "prob": 0.0036706147438991137,
          "token": "("
        },
        {
          "prob": 0.0018457010037981926,
          "token": " subway"
        },
        {
          "prob": 0.0009879325559119549,
          "token": "  "
        }
      ],
      [
        {
          "prob": 0.9998659075335375,
          "token": " line"
        },
        {
          "prob": 7.48417653826474e-05,
          "token": " is"
        },
        {
          "prob": 2.7532746825252522e-05,
          "token": " lines"
        },
        {
          "prob": 1.1477356448871806e-05,
          "token": "  "
        },
        {
          "prob": 4.22228347653641e-06,
          "token": " train"
        }
      ],
      [
        {
          "prob": 0.8024675346300625,
          "token": " can"
        },
        {
          "prob": 0.13944794174981368,
          "token": "."
        },
        {
          "prob": 0.03995250422360199,
          "token": " is"
        },
        {
          "prob": 0.006522068580782983,
          "token": " connects"
        },
        {
          "prob": 0.004210963968444186,
          "token": " takes"
        }
      ],
      [
        {
          "prob": 0.9503091624983522,
          "token": " be"
        },
        {
          "prob": 0.041753669816683284,
          "token": " take"
        },
        {
          "prob": 0.0036483958785121597,
          "token": " get"
        },
        {
          "prob": 0.0030246264179359427,
          "token": " reach"
        },
        {
          "prob": 0.0005594996289864059,
          "token": " transport"
        }
      ],
      [
        {
          "prob": 0.9998390933571737,
          "token": " used"
        },
        {
          "prob": 8.480456611167708e-05,
          "token": " utilized"
        },
        {
          "prob": 4.5392613201869424e-05,
          "token": " taken"
        },
        {
          "prob": 1.7776002739415615e-05,
          "token": " use"
        },
        {
          "prob": 5.771023149120064e-06,
          "token": " directly"
        }
      ],
      [
        {
          "prob": 0.9987521265448706,
          "token": " to"
        },
        {
          "prob": 0.001098566823372469,
          "token": "."
        },
        {
          "prob": 4.826768061521188e-05,
          "token": " for"
        },
        {
          "prob": 3.116395686330368e-05,
          "token": "  "
        },
        {
          "prob": 1.8901895315555632e-05,
          "token": " get"
        }
      ],
      [
        {
          "prob": 0.5888818962519128,
          "token": " reach"
        },
        {
          "prob": 0.40473221376803725,
          "token": " get"
        },
        {
          "prob": 0.003090168769715142,
          "token": " access"
        },
        {
          "prob": 0.0017607250905035746,
          "token": " travel"
        },
        {
          "prob": 0.0008853481756309402,
          "token": " go"
        }
      ],
      [
        {
          "prob": 0.9829795626853811,
          "token": " the"
        },
        {
          "prob": 0.016913095230954366,
          "token": " Sk"
        },
        {
          "prob": 5.3830674710620786e-05,
          "token": "  "
        },
        {
          "prob": 1.1641699846857799e-05,
          "token": " The"
        },
        {
          "prob": 7.285189608779828e-06,
          "token": " Moscow"
        }
      ],
      [
        {
          "prob": 0.9989559832786075,
          "token": " Sk"
        },
        {
          "prob": 0.000519032139854605,
          "token": " SK"
        },
        {
          "prob": 0.00019094134460763643,
          "token": "  "
        },
        {
          "prob": 0.00017937279335558307,
          "token": " Moscow"
        },
        {
          "prob": 4.82775323930096e-05,
          "token": " train"
        }
      ],
      [
        {
          "prob": 0.9999824765407688,
          "token": "ol"
        },
        {
          "prob": 6.144106881838195e-06,
          "token": "olni"
        },
        {
          "prob": 5.771854264120973e-06,
          "token": "olk"
        },
        {
          "prob": 2.7264309016663503e-06,
          "token": "kol"
        },
        {
          "prob": 3.2562573536012095e-07,
          "token": "ole"
        }
      ],
      [
        {
          "prob": 0.999937776622214,
          "token": "kovo"
        },
        {
          "prob": 4.006281386899555e-05,
          "token": "kov"
        },
        {
          "prob": 9.515752365432704e-06,
          "token": "kova"
        },
        {
          "prob": 6.961873151736542e-06,
          "token": "'"
        },
        {
          "prob": 1.7602371937289837e-06,
          "token": "tech"
        }
      ],
      [
        {
          "prob": 0.9855497256339354,
          "token": " Train"
        },
        {
          "prob": 0.01320637077842522,
          "token": " train"
        },
        {
          "prob": 0.0007931042112006261,
          "token": " station"
        },
        {
          "prob": 0.0003306150232966233,
          "token": " Station"
        },
        {
          "prob": 3.948633358588637e-05,
          "token": "Train"
        }
      ],
      [
        {
          "prob": 0.9045485732951252,
          "token": " station"
        },
        {
          "prob": 0.09533870754891544,
          "token": " Station"
        },
        {
          "prob": 5.6131191109129805e-05,
          "token": " stations"
        },
        {
          "prob": 1.939842057844615e-05,
          "token": "Station"
        },
        {
          "prob": 1.1765736830828069e-05,
          "token": "station"
        }
      ],
      [
        {
          "prob": 0.9979421611516208,
          "token": "."
        },
        {
          "prob": 0.001409444059304886,
          "token": " from"
        },
        {
          "prob": 0.00029543552438277134,
          "token": ","
        },
        {
          "prob": 6.592057586906312e-05,
          "token": " in"
        },
        {
          "prob": 4.822852357496943e-05,
          "token": " ."
        }
      ],
      [
        {
          "prob": 0.989746693701821,
          "token": " "
        },
        {
          "prob": 0.009703133946973596,
          "token": "  "
        },
        {
          "prob": 0.00024291320528193336,
          "token": ""
        },
        {
          "prob": 0.00014733430665256139,
          "token": "\n"
        },
        {
          "prob": 0.0001077920814270311,
          "token": "   "
        }
      ],
      [
        {
          "prob": 0.9970883517825412,
          "token": "\n"
        },
        {
          "prob": 0.001698659515563395,
          "token": "\n\n\n"
        },
        {
          "prob": 0.0005870410203555926,
          "token": "\n\n"
        },
        {
          "prob": 0.0005514740029293953,
          "token": ""
        },
        {
          "prob": 3.525453670770072e-05,
          "token": "\n\n\n\n"
        }
      ],
      [
        {
          "prob": 0.9998118039525784,
          "token": ""
        },
        {
          "prob": 0.00017952647392920093,
          "token": " "
        },
        {
          "prob": 3.725953097200584e-06,
          "token": "  "
        },
        {
          "prob": 6.892320199091203e-07,
          "token": "."
        },
        {
          "prob": 2.3819221246054115e-07,
          "token": "OR"
        }
      ]
    ],
    "language_consistency_score": 0.5491656869250918
  },
  {
    "question": "What is the name of the train station you should get off at to reach Skoltech from Moscow's MCD-1 metro line?\n",
    "true_answer": "MCD Skolkovo (Сколково) station \n",
    "source_doc": "\n### Text After Video 3\n\n**Topic 1  “ Location & Transportation  — Premises Location, Public Transport & Carsharing, Personal Cars & Parking”**\n\nBy now you’ve probably heard that our campus and its premises are pretty cool. In fact, you may have visited it during an Open Doors event or perhaps a conference or a summer school. ![][image7]The campus is located within the Skolkovo Innovation Center territory a few minutes away from the center of Moscow. The campus is part of the Skolkovo Innovation Center, which is a closed territory. This means you may need a car pass if you decide to drive here. So, you can reach the campus in multiple ways. **First, you can use public transportation.** \n\nThis is the safest and surest way to reach the campus if you need to be there by a certain time (or just want your arrival time to be predictable). No matter where you are traveling from, you can use Moscow’s MCD-1(Moscow Central Diameter \\#1) metro line to get to the Skolkovo Train station. It’s about a 20 minute ride from the city center. You’ll need to exit the train at the “MCD Skolkovo” (Сколково) station. Once you arrive, take the stairs, escalator or an elevator to the second floor and walk down the looooong hall of the Orbion building. Then, once again, go down to the 1st floor and exit. Once you exit the building, you can take the Sk1 bus shuttle from the nearest bus stop (look to your left). Or, you can take a walk towards the Amaltea business center, walk down the stairs, cross the road and catch any shuttle bus that goes towards Skoltech (the wooden building that looks like a crown, you’ll know it when you see it). This way will take about 10 minutes if you are a fast walker. Remember that the shuttle buses at Skolkovo have paid fares (same as within the Moscow public transportation system, we’ll talk about that in the next modules) and can be tracked via [Yandex maps](https://yandex.ru/maps/213/moscow/?ll=37.622504%2C55.753215\\&z=10) \n\n[(links to an external site)](https://yandex.ru/maps/213/moscow/?ll=37.622504%2C55.753215\\&z=10)\n\nBy the way, the Skolkovo Innovation Center website also has some tips on how to reach other buildings on the territory. Visit [https://sk.ru/transport/](https://sk.ru/transport/) \n\n[(links to an external site)](https://sk.ru/transport/)\n\nfor more information. ![][image8]\n\n \n\nThe next best thing is to take a taxi\n\nCurrently, only taxi services [Yandex (links to an external site)](https://taxi.yandex.ru/ru\\_ru/) , [Citi Mobil](https://city-mobil.ru/) \n\n[(links to an external site)](https://city-mobil.ru/) , and [Uber  (links to an external site)](https://support-uber.com/) have automatic access to the Skolkovo Innovation Center. All you need to do is download a relevant app to your smartphone, order a taxi to Skoltech (just type “Сколтех” in the destination, it will be there) and relax. Don’t forget to buckle up\\! If you take a different taxi service, you’ll need to order a territory pass ahead of time. To order a pass for your taxi, email security.campus@skoltech.ru from your Skoltech email address with your taxi’s model and license number (i.e. Toyota, Х111СК197).",
    "context": "Sim: 5.50 - This is the safest and surest way to reach the campus if you need to be there by a certain time (or just want your arrival time to be predictable). No matter where you are traveling from, you can use Moscow’s MCD-1(Moscow Central Diameter \\#1) metro line to get to the Skolkovo Train station. It’s about a 20 minute ride from the city center. You’ll need to exit the train at the “MCD Skolkovo” (Сколково) station.\nSim: 3.21 - The buses, metro, trains and other city-sponsored modes of transfer are integrated by one system. You can buy yourself single- or double-ride tickets or get a permanent Troika card and top off its balance every once in a while. If you’re planning to explore the city center, we recommend using the underground metro. Yandex Metro app (links to an external site)has the current map and allows you to plan your route to point A to point B. The metro is designed in a sun-like way, with multi-colored lines stemming away from the center outwards. There are also several circle lines which connect them. You will notice on the map (and have already seen it mentioned in this course) the MCD lines. These are newer extensions of the metro line that take you a little bit outside of the city for a few extra rubles. One of these lines, MCD 1, takes you almost directly to Skoltech and is the best way to get to campus from the city center. If you use the metro app to plan your route, select the stop called “Skolkovo” and it will calculate your route for you. Easy, huh\\! If you live or end up far away from a metro station, you can take the bus, a tramway or a small overground shuttle (aka marshrutka). The Yandex Transport app shows you the nearest stops, when the next bus, tram or shuttle will arrive there and where it can take you. You can also plan your route there.\nSim: 2.39 - → From there, take an SK1 shuttle and exit at the Technopark stop. The Skoltech dorms will be on your right\\! [Here](https://old.sk.ru/city/transport/p/inner.aspx) you will find the exact map of bus routes around Skolkovo. \nSim: 2.32 - → If you’re traveling to the Skoltech Dormitories, you’ll need to go to the Slavyansky Bulvar metro station which will be located on the dark blue metro line. ",
    "generated_answer": "You should exit the train at the “MCD Skolkovo” (Сколково) station. \n",
    "logprobs": [
      [
        {
          "prob": 0.900924113120417,
          "token": "You"
        },
        {
          "prob": 0.06526271705330926,
          "token": "The"
        },
        {
          "prob": 0.027205548040549532,
          "token": "Exit"
        },
        {
          "prob": 0.0017391924991886655,
          "token": "At"
        },
        {
          "prob": 0.001441841223948346,
          "token": "\""
        }
      ],
      [
        {
          "prob": 0.9595352096046142,
          "token": " should"
        },
        {
          "prob": 0.032833489693402794,
          "token": " need"
        },
        {
          "prob": 0.00253184625918103,
          "token": " will"
        },
        {
          "prob": 0.0018523382933069313,
          "token": "'"
        },
        {
          "prob": 0.0016346828063822027,
          "token": " must"
        }
      ],
      [
        {
          "prob": 0.7020937761238365,
          "token": " exit"
        },
        {
          "prob": 0.2926762469635562,
          "token": " get"
        },
        {
          "prob": 0.003684250227758987,
          "token": " disemb"
        },
        {
          "prob": 0.0006815177647396621,
          "token": " take"
        },
        {
          "prob": 0.00032192619716183606,
          "token": " alight"
        }
      ],
      [
        {
          "prob": 0.987465930590102,
          "token": " the"
        },
        {
          "prob": 0.012430361431752194,
          "token": " at"
        },
        {
          "prob": 2.1176609804113863e-05,
          "token": " MCD"
        },
        {
          "prob": 2.1176609804113863e-05,
          "token": "  "
        },
        {
          "prob": 1.2844263114966202e-05,
          "token": " your"
        }
      ],
      [
        {
          "prob": 0.8891131196584404,
          "token": " train"
        },
        {
          "prob": 0.07298284811612425,
          "token": " MCD"
        },
        {
          "prob": 0.025222197405662408,
          "token": " metro"
        },
        {
          "prob": 0.007226280544076921,
          "token": " \""
        },
        {
          "prob": 0.0016124011350773662,
          "token": " Moscow"
        }
      ],
      [
        {
          "prob": 0.9998581610609016,
          "token": " at"
        },
        {
          "prob": 5.828638079496091e-05,
          "token": "  "
        },
        {
          "prob": 3.76325158710815e-05,
          "token": " and"
        },
        {
          "prob": 9.514990101959953e-06,
          "token": " the"
        },
        {
          "prob": 4.637235821010631e-06,
          "token": " station"
        }
      ],
      [
        {
          "prob": 0.9967078232572191,
          "token": " the"
        },
        {
          "prob": 0.002470591197454234,
          "token": " \""
        },
        {
          "prob": 0.000707836229151199,
          "token": " “"
        },
        {
          "prob": 7.00852776116586e-05,
          "token": "  "
        },
        {
          "prob": 1.041724652305361e-05,
          "token": " **"
        }
      ],
      [
        {
          "prob": 0.704489449229215,
          "token": " “"
        },
        {
          "prob": 0.2936748858956968,
          "token": " \""
        },
        {
          "prob": 0.0014476963422620293,
          "token": "  "
        },
        {
          "prob": 9.851697245981455e-05,
          "token": " MCD"
        },
        {
          "prob": 5.975356429894266e-05,
          "token": " ”"
        }
      ],
      [
        {
          "prob": 0.9997863034267085,
          "token": "MCD"
        },
        {
          "prob": 0.00014882884209762855,
          "token": " MCD"
        },
        {
          "prob": 2.0141793499059668e-05,
          "token": "McDonald"
        },
        {
          "prob": 1.078112516124119e-05,
          "token": "Sk"
        },
        {
          "prob": 3.966154299516785e-06,
          "token": "mcd"
        }
      ],
      [
        {
          "prob": 0.9996756175860276,
          "token": " Sk"
        },
        {
          "prob": 9.608049298053564e-05,
          "token": "  "
        },
        {
          "prob": 8.479073745412367e-05,
          "token": "-"
        },
        {
          "prob": 3.023306849786159e-05,
          "token": " SK"
        },
        {
          "prob": 2.429295300991941e-05,
          "token": " -"
        }
      ],
      [
        {
          "prob": 0.9999816421070834,
          "token": "ol"
        },
        {
          "prob": 1.0129910044902026e-05,
          "token": "olk"
        },
        {
          "prob": 1.3709342450882239e-06,
          "token": "kol"
        },
        {
          "prob": 1.2098452249375081e-06,
          "token": "olni"
        },
        {
          "prob": 8.851416751707463e-07,
          "token": " Schol"
        }
      ],
      [
        {
          "prob": 0.9999933243243502,
          "token": "kovo"
        },
        {
          "prob": 1.2878882767215364e-06,
          "token": "vo"
        },
        {
          "prob": 9.422391915866334e-07,
          "token": "ково"
        },
        {
          "prob": 8.315231680690172e-07,
          "token": " enggak"
        },
        {
          "prob": 6.083553455905181e-07,
          "token": " jätte"
        }
      ],
      [
        {
          "prob": 0.9975336969155755,
          "token": "”"
        },
        {
          "prob": 0.0020498891926832527,
          "token": "\""
        },
        {
          "prob": 0.00013104509428614027,
          "token": " ("
        },
        {
          "prob": 7.948286748947691e-05,
          "token": "”("
        },
        {
          "prob": 7.948286748947691e-05,
          "token": "”."
        }
      ],
      [
        {
          "prob": 0.9031584594247953,
          "token": " ("
        },
        {
          "prob": 0.09519220837223338,
          "token": " station"
        },
        {
          "prob": 0.000993419838323819,
          "token": "  "
        },
        {
          "prob": 0.000267375322239992,
          "token": " (“"
        },
        {
          "prob": 0.00022166192761982097,
          "token": " (\""
        }
      ],
      [
        {
          "prob": 0.9981186090384656,
          "token": "Ско"
        },
        {
          "prob": 0.0017004148471786574,
          "token": " Ско"
        },
        {
          "prob": 0.00010870383251022313,
          "token": "ско"
        },
        {
          "prob": 3.3152795808471113e-05,
          "token": "СКО"
        },
        {
          "prob": 6.132650579491996e-06,
          "token": "Sco"
        }
      ],
      [
        {
          "prob": 0.9999066678402974,
          "token": "лко"
        },
        {
          "prob": 3.321219400784963e-05,
          "token": "лков"
        },
        {
          "prob": 8.938940750498008e-06,
          "token": " fato"
        },
        {
          "prob": 5.954618267401288e-06,
          "token": "л"
        },
        {
          "prob": 4.784670195558178e-06,
          "token": ")"
        }
      ],
      [
        {
          "prob": 0.9996075978572159,
          "token": "во"
        },
        {
          "prob": 0.00037997981047616075,
          "token": "vo"
        },
        {
          "prob": 1.0779192378263813e-05,
          "token": "вод"
        },
        {
          "prob": 2.698518010020185e-07,
          "token": "вы"
        },
        {
          "prob": 2.2371500062409625e-07,
          "token": "ве"
        }
      ],
      [
        {
          "prob": 0.999717553780562,
          "token": ")"
        },
        {
          "prob": 0.0002453604295179301,
          "token": ")."
        },
        {
          "prob": 1.1839936548553399e-05,
          "token": " )"
        },
        {
          "prob": 5.953493977784922e-06,
          "token": " station"
        },
        {
          "prob": 5.253939994951236e-06,
          "token": "),"
        }
      ],
      [
        {
          "prob": 0.9994265747136066,
          "token": " station"
        },
        {
          "prob": 0.000404413117216541,
          "token": " Station"
        },
        {
          "prob": 0.00010225169785256518,
          "token": "  "
        },
        {
          "prob": 2.2815437717291728e-05,
          "token": " stop"
        },
        {
          "prob": 1.4730753741976753e-05,
          "token": " metro"
        }
      ],
      [
        {
          "prob": 0.9984198781800904,
          "token": "."
        },
        {
          "prob": 0.0006257365062445876,
          "token": " to"
        },
        {
          "prob": 0.00017927651060961063,
          "token": " when"
        },
        {
          "prob": 0.00015821096531915574,
          "token": " ."
        },
        {
          "prob": 0.0001396206868490738,
          "token": " on"
        }
      ],
      [
        {
          "prob": 0.9853133414097803,
          "token": " "
        },
        {
          "prob": 0.014054737095837789,
          "token": "  "
        },
        {
          "prob": 0.00021341001205631404,
          "token": "\n"
        },
        {
          "prob": 0.0001883336746202383,
          "token": "   "
        },
        {
          "prob": 0.0001294397154017972,
          "token": ""
        }
      ],
      [
        {
          "prob": 0.9952148204649158,
          "token": "\n"
        },
        {
          "prob": 0.0033718406223700566,
          "token": "\n\n\n"
        },
        {
          "prob": 0.0009660485125570701,
          "token": "\n\n"
        },
        {
          "prob": 0.00033385727328487326,
          "token": ""
        },
        {
          "prob": 5.119867107553996e-05,
          "token": "\n\n\n\n"
        }
      ],
      [
        {
          "prob": 0.9995530458112446,
          "token": ""
        },
        {
          "prob": 0.00043054992403708227,
          "token": " "
        },
        {
          "prob": 9.512086800453186e-06,
          "token": "  "
        },
        {
          "prob": 1.6529528337576775e-06,
          "token": "."
        },
        {
          "prob": 2.8724013225965967e-07,
          "token": "   "
        }
      ]
    ],
    "language_consistency_score": 0.37264809874237953
  },
  {
    "question": "What is the name of the carsharing service that has parking options around the Skolkovo territory?\n",
    "true_answer": "BelkaCar and DeliMobil are carsharing services that have parking options around the Skolkovo territory. \n",
    "source_doc": "your car’s model and license number (i.e. Toyota, Х111СК197)   \n2. How long you need the pass for (1 day or the whole month). If you ask for a monthly pass, you’ll need to *renew it every month* via email. Next, you’ll need to find a parking spot because you can park only in designated parking lots. Wait, let us stress that again: if you park your car anywhere *besides* a parking lot, it will be towed and your access to the Skolkovo Innovation Center territory will be restricted… *forever*\\! A current list of all Skolkovo parking lots is published on [sta-parking.ru (links to an external site).](https://www.sta-parking.ru/) (RUS). ![][image9]\n\n \n\nIn terms of parking prices, parking is free for 2 hours and then 50 RUB per hour. Spaces are pretty limited, though. To secure a spot and entry in the long-term, you can email Clients@sta-parking.ru. Monthly parking plans start at 5000 RUB/month. Finally, you can also park outside of the Skolkovo territory. You can try the [Tri Kita Mall parking lot (links to an external site)](https://yandex.ru/maps/org/tri\\_kita/1112120378/?indoorLevel=1\\&ll=37.355723%2C55.702835\\&z=17.03) or near the [“Innovatsya” apartments (links to an external site)](https://yandex.ru/maps/213/moscow/?indoorLevel=1\\&ll=37.355723%2C55.702835\\&mode=poi\\&poi%5Bpoint%5D=37.357476%2C55.700718\\&poi%5Buri%5D=ymapsbm1%3A%2F%2Forg%3Foid%3D191529528774\\&z=17.03), but spaces there are not guaranteed. **Carsharing is another option.** \n\nA great option for transportation without the upkeep fees, are we right? Carsharing services [BelkaCar (links to an external site)](https://belkacar.ru/) and [DeliMobil (links to an external site)](https://delimobil.ru/) have access to the Skolkovo territory with some parking options around the territory. If you choose to use a different car sharing service, you may need to search for a different parking option outside of the Skolkovo Innovation Center Territory (for example, there is an “external” parking lot just behind the Skoltech campus that’s not part of the Skolkovo infrastructure). In that case, we suggest looking for an “end destination” spot ahead of time. *Phew, we’re almost there:)*\n\nAre you up for a scooter or a bike ride? The Skolkovo territory has lots of electric scooter and bike stations where you can rent one from March to November (watch out for puddles\\!). For instance, there is a bike/scooter stop right outside of the MCD Skolkovo station so you can start your day with a breeze. To rent one of these sweet rides, scan a QR code on the vehicle and follow the instructions. [*Virtual campus tour (links to an external site).*](https://360.skoltech.ru/)\n\n[*This brochure that shows how Skoltech navigation works (links to an external site).*](https://box.skoltech.ru/index.php/s/Od9t3Fm1ONOCuY5\\#pdfviewer) \n\n*You can also save [this handout (links to an external site)](https://box.skoltech.ru/index.php/s/mjp6yaRe3tgF2x2) with a map to your smartphone and glance at them as you explore the campus:*\n\n *![][image4]*\n\n[Full equipment catalog on FabLab’s website (links to an external site).](https://fablab.skoltech.ru/en)\n\n[Video tour (links to an external site).](https://box.skoltech.ru/index.php/s/xwVtNw081ffzffQ)\n\n[Skoltech’s virtual tour (links to an external site).](https://360.skoltech.ru/)\n\nFor more information about campus rules, see [this official document (links to an external site).](https://drive.google.com/file/d/1UeumlluoILU0lGHeXphZKpHAOtq9KhC9/view?usp=sharing)\n\nHighlights: \n\n* There are enough ways to get around Skoltech using the developed transport system. Choose a favourite bus route or just rent a bicycle — the choice is yours\\!",
    "context": "Sim: 7.71 - Carsharing services [BelkaCar (links to an external site)](https://belkacar.ru/) and [DeliMobil (links to an external site)](https://delimobil.ru/) have access to the Skolkovo territory with some parking options around the territory.\nSim: 1.26 - If you choose to use a different car sharing service, you may need to search for a different parking option outside of the Skolkovo Innovation Center Territory (for example, there is an “external” parking lot just behind the Skoltech campus that’s not part of the Skolkovo infrastructure). In that case, we suggest looking for an “end destination” spot ahead of time. *Phew, we’re almost there:)*\nSim: 0.85 - Finally, if you are in a huge rush, feel free to catch a taxi. Watch out if you’re traveling to the campus, as not all services have automatic access to the Skolkovo Territory. Here’s a quick list of apps you can use: яндекс такси, ситимобил, убер. \nSim: 0.71 - Finally, you can also park outside of the Skolkovo territory. You can try the [Tri Kita Mall parking lot (links to an external site)](https://yandex.ru/maps/org/tri\\_kita/1112120378/?indoorLevel=1\\&ll=37.355723%2C55.702835\\&z=17.03) or near the [“Innovatsya” apartments (links to an external site)](https://yandex.ru/maps/213/moscow/?indoorLevel=1\\&ll=37.355723%2C55.702835\\&mode=poi\\&poi%5Bpoint%5D=37.357476%2C55.700718\\&poi%5Buri%5D=ymapsbm1%3A%2F%2Forg%3Foid%3D191529528774\\&z=17.03), but spaces there are not guaranteed.   \nSim: 0.67 - * By taxi: If you don't want to worry about taking public transport on your first day, you can always order a taxi directly from the airport or the railway station directly to the Skoltech dormitories or your planned accommodation. We recommend using the [Uber App](https://support-uber.com/) or [Yandex Taxi](https://taxi.yandex.ru/ru\\_ru/) (which have open access to the Skolkovo territory). You’ll see the price in advance, would be able to choose the type of the vehicle (considering your bags) and can pay by credit card if you don't have cash on you yet.\nSim: 0.65 - Oh, almost forgot\\! When it gets warmer, you can rent electric scooters and bikes all around the city (and even in the Skolkovo Territory). If you see a little parking lot with scooters or bikes, look for a QR code to download its app and reserve yourself a machine. The system will tell you how long you have rented it for, its charge (if it’s electric) and the nearest parking location. Just watch out for those puddles\\!",
    "generated_answer": "BelkaCar and DeliMobil have parking options around the Skolkovo territory. \n",
    "logprobs": [
      [
        {
          "prob": 0.8966410704374915,
          "token": "Bel"
        },
        {
          "prob": 0.04752023652600034,
          "token": "C"
        },
        {
          "prob": 0.041936461544282655,
          "token": "Both"
        },
        {
          "prob": 0.0056754815478964014,
          "token": "The"
        },
        {
          "prob": 0.0007680929027887285,
          "token": "Car"
        }
      ],
      [
        {
          "prob": 0.9841309249823096,
          "token": "ka"
        },
        {
          "prob": 0.012388378592045557,
          "token": "k"
        },
        {
          "prob": 0.0027642208992225046,
          "token": "car"
        },
        {
          "prob": 0.0004239070043523255,
          "token": "ca"
        },
        {
          "prob": 9.458648287151448e-05,
          "token": "kar"
        }
      ],
      [
        {
          "prob": 0.9990605605281992,
          "token": "Car"
        },
        {
          "prob": 0.0005525648001895465,
          "token": " Car"
        },
        {
          "prob": 0.00023034316877405762,
          "token": "Cars"
        },
        {
          "prob": 0.00012329381356759295,
          "token": " car"
        },
        {
          "prob": 1.7762157927119844e-05,
          "token": " and"
        }
      ],
      [
        {
          "prob": 0.9987803095237063,
          "token": " and"
        },
        {
          "prob": 0.0003796653974041526,
          "token": ","
        },
        {
          "prob": 0.00027776900606050076,
          "token": " ("
        },
        {
          "prob": 0.0002451302874823936,
          "token": "  "
        },
        {
          "prob": 7.476051377131832e-05,
          "token": "."
        }
      ],
      [
        {
          "prob": 0.9992604959908582,
          "token": " Deli"
        },
        {
          "prob": 0.00048773439421465135,
          "token": " De"
        },
        {
          "prob": 0.00016855641598033456,
          "token": " Del"
        },
        {
          "prob": 3.11798017914002e-05,
          "token": "  "
        },
        {
          "prob": 1.472829548735183e-05,
          "token": " Deliver"
        }
      ],
      [
        {
          "prob": 0.9963426138255441,
          "token": "Mobil"
        },
        {
          "prob": 0.001697389125989808,
          "token": "mobil"
        },
        {
          "prob": 0.000908546928329905,
          "token": "Mobile"
        },
        {
          "prob": 0.0006244345631196135,
          "token": " Mobil"
        },
        {
          "prob": 0.0002949620019931534,
          "token": "Mob"
        }
      ],
      [
        {
          "prob": 0.8217266433082987,
          "token": " have"
        },
        {
          "prob": 0.05952567927682591,
          "token": "."
        },
        {
          "prob": 0.0409113611797124,
          "token": " are"
        },
        {
          "prob": 0.03610414952161585,
          "token": " both"
        },
        {
          "prob": 0.028117939919561512,
          "token": " offer"
        }
      ],
      [
        {
          "prob": 0.5448674514205664,
          "token": " parking"
        },
        {
          "prob": 0.42434319783645774,
          "token": " access"
        },
        {
          "prob": 0.02712735143838333,
          "token": " car"
        },
        {
          "prob": 0.00046675197531580127,
          "token": " park"
        },
        {
          "prob": 0.0003869509785050187,
          "token": " some"
        }
      ],
      [
        {
          "prob": 0.9854899817952728,
          "token": " options"
        },
        {
          "prob": 0.007524307573358806,
          "token": " access"
        },
        {
          "prob": 0.0020251399100848686,
          "token": " around"
        },
        {
          "prob": 0.0010839792812228461,
          "token": " near"
        },
        {
          "prob": 0.0008442039130495311,
          "token": " in"
        }
      ],
      [
        {
          "prob": 0.8132319537843479,
          "token": " around"
        },
        {
          "prob": 0.06675414082315602,
          "token": " within"
        },
        {
          "prob": 0.04048843307201885,
          "token": " in"
        },
        {
          "prob": 0.03803536292070366,
          "token": " near"
        },
        {
          "prob": 0.015855498206329578,
          "token": "."
        }
      ],
      [
        {
          "prob": 0.9807115001628661,
          "token": " the"
        },
        {
          "prob": 0.019120831370873014,
          "token": " Sk"
        },
        {
          "prob": 5.370648014900942e-05,
          "token": "  "
        },
        {
          "prob": 1.9757509904502747e-05,
          "token": " The"
        },
        {
          "prob": 1.6899493776046545e-05,
          "token": " their"
        }
      ],
      [
        {
          "prob": 0.9673321887966801,
          "token": " Sk"
        },
        {
          "prob": 0.03109484040306405,
          "token": " territory"
        },
        {
          "prob": 0.00039142636732286115,
          "token": "  "
        },
        {
          "prob": 0.0003454325567523651,
          "token": " area"
        },
        {
          "prob": 8.733898638058414e-05,
          "token": " SK"
        }
      ],
      [
        {
          "prob": 0.9999460011086556,
          "token": "ol"
        },
        {
          "prob": 3.321349265151146e-05,
          "token": "olk"
        },
        {
          "prob": 1.3006590603920403e-05,
          "token": "kol"
        },
        {
          "prob": 2.902162644437822e-06,
          "token": "olni"
        },
        {
          "prob": 7.33781629979293e-07,
          "token": "ok"
        }
      ],
      [
        {
          "prob": 0.9999157261341967,
          "token": "kovo"
        },
        {
          "prob": 5.8289771653276064e-05,
          "token": "kov"
        },
        {
          "prob": 5.77146896414001e-06,
          "token": "tech"
        },
        {
          "prob": 5.0933034842166816e-06,
          "token": "'"
        },
        {
          "prob": 5.0933034842166816e-06,
          "token": "kova"
        }
      ],
      [
        {
          "prob": 0.9754166987499003,
          "token": " territory"
        },
        {
          "prob": 0.022939604161324574,
          "token": " Territory"
        },
        {
          "prob": 0.0006507464802775304,
          "token": " area"
        },
        {
          "prob": 0.0002248918586191087,
          "token": " territorial"
        },
        {
          "prob": 9.9795157321364e-05,
          "token": " Innovation"
        }
      ],
      [
        {
          "prob": 0.997203207134935,
          "token": "."
        },
        {
          "prob": 0.0009679782485297459,
          "token": ","
        },
        {
          "prob": 0.0008024821537964237,
          "token": " according"
        },
        {
          "prob": 0.00015801810522552348,
          "token": " ."
        },
        {
          "prob": 8.458099673487781e-05,
          "token": " "
        }
      ],
      [
        {
          "prob": 0.9811511690321264,
          "token": " "
        },
        {
          "prob": 0.017970411779206785,
          "token": "  "
        },
        {
          "prob": 0.00035036725148792036,
          "token": "\n"
        },
        {
          "prob": 0.00022621409963176646,
          "token": "   "
        },
        {
          "prob": 0.00019963324224599695,
          "token": ""
        }
      ],
      [
        {
          "prob": 0.9934718425448579,
          "token": "\n"
        },
        {
          "prob": 0.004321946677781529,
          "token": "\n\n\n"
        },
        {
          "prob": 0.0016924986372163452,
          "token": "\n\n"
        },
        {
          "prob": 0.00033327258301829674,
          "token": ""
        },
        {
          "prob": 8.969909885091839e-05,
          "token": "\n\n\n\n\n"
        }
      ],
      [
        {
          "prob": 0.9994914734912841,
          "token": ""
        },
        {
          "prob": 0.00048784697102803484,
          "token": " "
        },
        {
          "prob": 1.0777948589518787e-05,
          "token": "  "
        },
        {
          "prob": 1.993720018218141e-06,
          "token": "."
        },
        {
          "prob": 3.4645658970185966e-07,
          "token": "**"
        }
      ]
    ],
    "language_consistency_score": 0.6198685026617435
  },
  {
    "question": "How many ECTS credits are needed for the MSc Thesis Project?\n",
    "true_answer": "36 ECTS-credits \n",
    "source_doc": "\n### Text After Video 4\n\n[Learn more about what’s considered academic misconduct (links to an external site)](https://www.skoltech.ru/app/data/uploads/sites/2/2015/04/1.-STUDENT-ACADEMIC-INTEGRITY-REGULATIONS.pdf)  \n[Disciplinary Board Policy (links to an external site).](http://www.skoltech.ru/app/data/uploads/sites/2/2015/04/DISCIPLINARY-BOARD-POLICY.pdf)\n\nSave these links\\! 1) [Course timetable (links to an external site)](https://schedule.skoltech.ru/)  \n2) [Course catalog (links to an external site)](https://www.skoltech.ru/en/education/course-catalog/)  \n3) [Education resources for students (Canvas)](https://skoltech.instructure.com/courses/2072)\n\n![][image12]  \n[View the 2022-2023 academic calendar with key dates, breaks and holidays](https://www.skoltech.ru/en/education/academic-calendar/msc-academic-calendar-2022-2023/)   \n[(links to an external site)](https://www.skoltech.ru/en/education/academic-calendar/msc-academic-calendar-2022-2023/)\n\n[Your updated term schedule can be found on the Skoltech website (links to an external site)](https://schedule.skoltech.ru/)![][image13]\n\n* **STE:** **Science, Technology and Engineering** (36 ECTS-credits)  \n  * Provide a solid foundation of scientific and engineering fundamentals  \n  * Core and recommended electives  \n* **Sector:** **Industrial Immersion** (12 ECTS-credits)  \n  * Orients students to how a sector works, provides knowledge and skills to make an impact in an industrial sector  \n  * Happens in the summer term between Year 1 and Year 2  \n* **Enterpreneurship and Innovation: Entrepreneurship and Innovation** (12 ECTS-credits)  \n  * Orients students in the process of, provide the skills for, and experience with innovation  \n  * Includes Innovation Workshop  \n* **MSc Thesis Project** (36 ECTS-credits)  \n* Early research, Thesis Project, Defense\n\n* **Options: elective coursework and short-term projects** (24 ECTS-credits)  \n* Follow your dreams and passions, choose courses to diversify your experience  \n* Additionally you can take 20 credits as an extracurricular activity. **ECTS credits** are based on the workload students need in order to achieve the learning outcomes. 1 ECTS equals 27 astronomical hours (36 academic hours). [The courses offered in 2022-2023 (links to an external site)](https://www.skoltech.ru/en/education/course-catalog/)\n\nIf you need to communicate any concerns or issues informally or outside of the formal evaluation period (or if you are unable to solve an issue directly with your research advisor or faculty, please talk to the [Education Department (links to an external site)](https://helpdesk.skoltech.ru/servicedesk/customer/portal/21) (email: education@skoltech.ru).",
    "context": "Sim: 6.44 - * MSc Thesis Project (36 ECTS-credits)  \nSim: 6.13 - * **MSc Thesis Project** (36 ECTS-credits)  ",
    "generated_answer": "36 ECTS credits are needed for the MSc Thesis Project. \n",
    "logprobs": [
      [
        {
          "prob": 0.9323192826355508,
          "token": "3"
        },
        {
          "prob": 0.028153600122877858,
          "token": "Both"
        },
        {
          "prob": 0.015069539812581863,
          "token": "The"
        },
        {
          "prob": 0.006281918801898566,
          "token": "You"
        },
        {
          "prob": 0.004055911617585478,
          "token": "Each"
        }
      ],
      [
        {
          "prob": 0.9999860527077029,
          "token": "6"
        },
        {
          "prob": 3.726599862258728e-06,
          "token": "0"
        },
        {
          "prob": 1.994705165791279e-06,
          "token": "4"
        },
        {
          "prob": 1.505682453431306e-06,
          "token": "5"
        },
        {
          "prob": 1.0676887365156493e-06,
          "token": "9"
        }
      ],
      [
        {
          "prob": 0.9702506931409692,
          "token": " ECTS"
        },
        {
          "prob": 0.021435631465084412,
          "token": " credits"
        },
        {
          "prob": 0.00695912898533809,
          "token": "."
        },
        {
          "prob": 0.0005041176128679081,
          "token": "  "
        },
        {
          "prob": 0.00018545450570652753,
          "token": " "
        }
      ],
      [
        {
          "prob": 0.8922203032590004,
          "token": " credits"
        },
        {
          "prob": 0.10656051043274041,
          "token": "-"
        },
        {
          "prob": 0.0005591782391219651,
          "token": "."
        },
        {
          "prob": 0.0002811724763447099,
          "token": " are"
        },
        {
          "prob": 0.0002641370971818335,
          "token": " credit"
        }
      ],
      [
        {
          "prob": 0.6483594292132645,
          "token": " are"
        },
        {
          "prob": 0.3470418046171007,
          "token": "."
        },
        {
          "prob": 0.0026496968761347537,
          "token": " is"
        },
        {
          "prob": 0.0006699482871670105,
          "token": " for"
        },
        {
          "prob": 0.0005912272883167418,
          "token": " "
        }
      ],
      [
        {
          "prob": 0.5307958207458742,
          "token": " needed"
        },
        {
          "prob": 0.4684256677130821,
          "token": " required"
        },
        {
          "prob": 0.0006615810688416795,
          "token": " necessary"
        },
        {
          "prob": 2.9067843508199803e-05,
          "token": " the"
        },
        {
          "prob": 1.9978017200759488e-05,
          "token": " typically"
        }
      ],
      [
        {
          "prob": 0.9849248616130679,
          "token": " for"
        },
        {
          "prob": 0.01404919578262127,
          "token": "."
        },
        {
          "prob": 0.0008981350380572739,
          "token": " to"
        },
        {
          "prob": 4.759941320105959e-05,
          "token": "  "
        },
        {
          "prob": 2.2484370726279665e-05,
          "token": ","
        }
      ],
      [
        {
          "prob": 0.9959204414944942,
          "token": " the"
        },
        {
          "prob": 0.0035918498704144526,
          "token": " both"
        },
        {
          "prob": 0.0002769738534470276,
          "token": " an"
        },
        {
          "prob": 8.992024491532747e-05,
          "token": " MSc"
        },
        {
          "prob": 5.453938547001514e-05,
          "token": " each"
        }
      ],
      [
        {
          "prob": 0.9998860489022633,
          "token": " MSc"
        },
        {
          "prob": 4.006075075078166e-05,
          "token": " Master"
        },
        {
          "prob": 2.4298073581454972e-05,
          "token": " MSC"
        },
        {
          "prob": 2.14429746744066e-05,
          "token": "MSc"
        },
        {
          "prob": 9.515262331904647e-06,
          "token": " Masters"
        }
      ],
      [
        {
          "prob": 0.9980559070695721,
          "token": " Thesis"
        },
        {
          "prob": 0.001809968255162197,
          "token": " thesis"
        },
        {
          "prob": 9.592475755480641e-05,
          "token": "Thesis"
        },
        {
          "prob": 2.0106921493195724e-05,
          "token": "  "
        },
        {
          "prob": 5.411704504077979e-06,
          "token": "."
        }
      ],
      [
        {
          "prob": 0.9943548256173795,
          "token": " Project"
        },
        {
          "prob": 0.0055544214499290406,
          "token": " project"
        },
        {
          "prob": 5.4453631818673615e-05,
          "token": " Projects"
        },
        {
          "prob": 2.5722074346415287e-05,
          "token": "."
        },
        {
          "prob": 3.0720636891696197e-06,
          "token": "  "
        }
      ],
      [
        {
          "prob": 0.9971423979367915,
          "token": "."
        },
        {
          "prob": 0.0014083147533913108,
          "token": ","
        },
        {
          "prob": 0.0005180900444710931,
          "token": " according"
        },
        {
          "prob": 0.00031423734662352056,
          "token": " in"
        },
        {
          "prob": 0.00020288687979608678,
          "token": " for"
        }
      ],
      [
        {
          "prob": 0.9944098729133825,
          "token": " "
        },
        {
          "prob": 0.005218184692477961,
          "token": "  "
        },
        {
          "prob": 0.0001390599117889254,
          "token": ""
        },
        {
          "prob": 0.00013063469764820618,
          "token": "\n"
        },
        {
          "prob": 3.3029624151447714e-05,
          "token": "   "
        }
      ],
      [
        {
          "prob": 0.9988913918462349,
          "token": "\n"
        },
        {
          "prob": 0.0007551386952791429,
          "token": "\n\n\n"
        },
        {
          "prob": 0.0002957165619926891,
          "token": "\n\n"
        },
        {
          "prob": 4.002088467503792e-05,
          "token": ""
        },
        {
          "prob": 7.880579444515574e-06,
          "token": "\n\n\n\n\n"
        }
      ],
      [
        {
          "prob": 0.9998353990671837,
          "token": ""
        },
        {
          "prob": 0.0001584351834265206,
          "token": " "
        },
        {
          "prob": 2.9018416069105137e-06,
          "token": "  "
        },
        {
          "prob": 3.2557760507791727e-07,
          "token": "**"
        },
        {
          "prob": 1.444741864759659e-07,
          "token": "."
        }
      ]
    ],
    "language_consistency_score": 0.08901104098531627
  },
  {
    "question": "What is the email address for the Skoltech Education Department?\n",
    "true_answer": "education@skoltech.ru \n",
    "source_doc": "\n### Text After Video 4\n\n[Learn more about what’s considered academic misconduct (links to an external site)](https://www.skoltech.ru/app/data/uploads/sites/2/2015/04/1.-STUDENT-ACADEMIC-INTEGRITY-REGULATIONS.pdf)  \n[Disciplinary Board Policy (links to an external site).](http://www.skoltech.ru/app/data/uploads/sites/2/2015/04/DISCIPLINARY-BOARD-POLICY.pdf)\n\nSave these links\\! 1) [Course timetable (links to an external site)](https://schedule.skoltech.ru/)  \n2) [Course catalog (links to an external site)](https://www.skoltech.ru/en/education/course-catalog/)  \n3) [Education resources for students (Canvas)](https://skoltech.instructure.com/courses/2072)\n\n![][image12]  \n[View the 2022-2023 academic calendar with key dates, breaks and holidays](https://www.skoltech.ru/en/education/academic-calendar/msc-academic-calendar-2022-2023/)   \n[(links to an external site)](https://www.skoltech.ru/en/education/academic-calendar/msc-academic-calendar-2022-2023/)\n\n[Your updated term schedule can be found on the Skoltech website (links to an external site)](https://schedule.skoltech.ru/)![][image13]\n\n* **STE:** **Science, Technology and Engineering** (36 ECTS-credits)  \n  * Provide a solid foundation of scientific and engineering fundamentals  \n  * Core and recommended electives  \n* **Sector:** **Industrial Immersion** (12 ECTS-credits)  \n  * Orients students to how a sector works, provides knowledge and skills to make an impact in an industrial sector  \n  * Happens in the summer term between Year 1 and Year 2  \n* **Enterpreneurship and Innovation: Entrepreneurship and Innovation** (12 ECTS-credits)  \n  * Orients students in the process of, provide the skills for, and experience with innovation  \n  * Includes Innovation Workshop  \n* **MSc Thesis Project** (36 ECTS-credits)  \n* Early research, Thesis Project, Defense\n\n* **Options: elective coursework and short-term projects** (24 ECTS-credits)  \n* Follow your dreams and passions, choose courses to diversify your experience  \n* Additionally you can take 20 credits as an extracurricular activity. **ECTS credits** are based on the workload students need in order to achieve the learning outcomes. 1 ECTS equals 27 astronomical hours (36 academic hours). [The courses offered in 2022-2023 (links to an external site)](https://www.skoltech.ru/en/education/course-catalog/)\n\nIf you need to communicate any concerns or issues informally or outside of the formal evaluation period (or if you are unable to solve an issue directly with your research advisor or faculty, please talk to the [Education Department (links to an external site)](https://helpdesk.skoltech.ru/servicedesk/customer/portal/21) (email: education@skoltech.ru).",
    "context": "Sim: 6.19 - Until then, if you have urgent questions or need assistance, feel free to reach out to the Education Department via [education@skoltech.ru](mailto:education@skoltech.ru). For more details on the Education Department, as well as for all the relevant links, see the description below.\nSim: 4.71 - * Email us at education@skoltech.ru \nSim: 4.68 - *Text Overlay: education@skoltech.ru.*  \nSim: 3.37 - If you have any questions or technical problems when dealing with this course, please email us at education@skoltech.ru\nSim: 1.75 - *Text Overlay:  [Scholarships@skoltech.ru](mailto:Scholarships@skoltech.ru).* \nSim: 0.97 - To reach the library or ask questions, email the team at [Library@skoltech.ru](mailto:Library@skoltech.ru) ",
    "generated_answer": "The email address for the Skoltech Education Department is education@skoltech.ru. \n",
    "logprobs": [
      [
        {
          "prob": 0.9975149551604142,
          "token": "The"
        },
        {
          "prob": 0.0015964256200280936,
          "token": "education"
        },
        {
          "prob": 0.00027741717541760375,
          "token": "Education"
        },
        {
          "prob": 0.00013104259482316284,
          "token": "Email"
        },
        {
          "prob": 0.00010205607546398805,
          "token": "the"
        }
      ],
      [
        {
          "prob": 0.9422215622015465,
          "token": " email"
        },
        {
          "prob": 0.03224105105314619,
          "token": " Sk"
        },
        {
          "prob": 0.022158928725779757,
          "token": " Education"
        },
        {
          "prob": 0.002486162307547056,
          "token": " education"
        },
        {
          "prob": 8.50717959816498e-05,
          "token": "  "
        }
      ],
      [
        {
          "prob": 0.9980449824586728,
          "token": " address"
        },
        {
          "prob": 0.0019266800479308206,
          "token": " for"
        },
        {
          "prob": 1.774410979416093e-05,
          "token": " addresses"
        },
        {
          "prob": 3.959246060062451e-06,
          "token": " is"
        },
        {
          "prob": 1.7569047891018262e-06,
          "token": " to"
        }
      ],
      [
        {
          "prob": 0.9989746604672287,
          "token": " for"
        },
        {
          "prob": 0.0009109471489361851,
          "token": " is"
        },
        {
          "prob": 7.024466795942777e-05,
          "token": " of"
        },
        {
          "prob": 1.6684571070811768e-05,
          "token": " to"
        },
        {
          "prob": 7.881233320681816e-06,
          "token": "  "
        }
      ],
      [
        {
          "prob": 0.9990233194153075,
          "token": " the"
        },
        {
          "prob": 0.0009109914561055457,
          "token": " Sk"
        },
        {
          "prob": 1.567446635795641e-05,
          "token": "  "
        },
        {
          "prob": 4.490809799778184e-06,
          "token": " contacting"
        },
        {
          "prob": 4.352642107657073e-06,
          "token": " The"
        }
      ],
      [
        {
          "prob": 0.9949692933589732,
          "token": " Sk"
        },
        {
          "prob": 0.004607621463585191,
          "token": " Education"
        },
        {
          "prob": 0.00016783267957151178,
          "token": " education"
        },
        {
          "prob": 0.00011534960130026066,
          "token": "  "
        },
        {
          "prob": 3.744853267093153e-05,
          "token": " SK"
        }
      ],
      [
        {
          "prob": 0.9999226391540047,
          "token": "ol"
        },
        {
          "prob": 2.282675494164945e-05,
          "token": "ot"
        },
        {
          "prob": 1.892404452019574e-05,
          "token": "olk"
        },
        {
          "prob": 8.397493851691459e-06,
          "token": "ole"
        },
        {
          "prob": 6.539974787534616e-06,
          "token": "kol"
        }
      ],
      [
        {
          "prob": 0.9999796156266157,
          "token": "tech"
        },
        {
          "prob": 1.3845918981029822e-05,
          "token": "tek"
        },
        {
          "prob": 2.9022622839953758e-06,
          "token": "Tech"
        },
        {
          "prob": 2.2602841394542027e-06,
          "token": "tec"
        },
        {
          "prob": 2.8736288070416535e-07,
          "token": "test"
        }
      ],
      [
        {
          "prob": 0.999554594142374,
          "token": " Education"
        },
        {
          "prob": 0.00035693910466376465,
          "token": " education"
        },
        {
          "prob": 3.320050849961162e-05,
          "token": " Educational"
        },
        {
          "prob": 3.118899137658499e-05,
          "token": "  "
        },
        {
          "prob": 6.959204640725406e-06,
          "token": "Education"
        }
      ],
      [
        {
          "prob": 0.9975137688176531,
          "token": " Department"
        },
        {
          "prob": 0.00247259001176858,
          "token": " department"
        },
        {
          "prob": 7.869712007098647e-06,
          "token": "Department"
        },
        {
          "prob": 1.4557503439404292e-06,
          "token": "  "
        },
        {
          "prob": 1.0650497034712673e-06,
          "token": " Dept"
        }
      ],
      [
        {
          "prob": 0.9998562542610705,
          "token": " is"
        },
        {
          "prob": 4.53933924244061e-05,
          "token": "  "
        },
        {
          "prob": 2.586437535969739e-05,
          "token": "'"
        },
        {
          "prob": 2.429733207441072e-05,
          "token": ","
        },
        {
          "prob": 1.3005424675349362e-05,
          "token": " can"
        }
      ],
      [
        {
          "prob": 0.9046806619357892,
          "token": " education"
        },
        {
          "prob": 0.061564293040711156,
          "token": " ["
        },
        {
          "prob": 0.03095647061632621,
          "token": "  "
        },
        {
          "prob": 0.0007280262349787722,
          "token": " `"
        },
        {
          "prob": 0.0006839173552099716,
          "token": " **"
        }
      ],
      [
        {
          "prob": 0.9999775891557117,
          "token": "@"
        },
        {
          "prob": 1.8925091296908553e-05,
          "token": "@["
        },
        {
          "prob": 1.7603077002471222e-06,
          "token": "["
        },
        {
          "prob": 8.851382986296586e-07,
          "token": "@@"
        },
        {
          "prob": 3.689805388615582e-07,
          "token": "."
        }
      ],
      [
        {
          "prob": 0.9999898673126559,
          "token": "sk"
        },
        {
          "prob": 2.5612619020944764e-06,
          "token": "ski"
        },
        {
          "prob": 2.2603056953063047e-06,
          "token": " sk"
        },
        {
          "prob": 1.994712775002134e-06,
          "token": "sky"
        },
        {
          "prob": 1.136553079467574e-06,
          "token": "SK"
        }
      ],
      [
        {
          "prob": 0.9999812844913009,
          "token": "ol"
        },
        {
          "prob": 8.39798238282798e-06,
          "token": "ot"
        },
        {
          "prob": 2.9022650518096954e-06,
          "token": "olt"
        },
        {
          "prob": 2.260286295030162e-06,
          "token": "olk"
        },
        {
          "prob": 1.994695654318529e-06,
          "token": "kol"
        }
      ],
      [
        {
          "prob": 0.9999915362117302,
          "token": "tech"
        },
        {
          "prob": 4.222815032189829e-06,
          "token": "tek"
        },
        {
          "prob": 1.8738628115041854e-06,
          "token": "tec"
        },
        {
          "prob": 7.811422362040829e-07,
          "token": "test"
        },
        {
          "prob": 2.699555332794298e-07,
          "token": "teh"
        }
      ],
      [
        {
          "prob": 0.9999995231630692,
          "token": "."
        },
        {
          "prob": 1.0571701315726883e-07,
          "token": "@"
        },
        {
          "prob": 9.931194312156244e-08,
          "token": " ."
        },
        {
          "prob": 6.82560337633487e-08,
          "token": ","
        },
        {
          "prob": 6.214782596823444e-08,
          "token": ".."
        }
      ],
      [
        {
          "prob": 0.9999873639751784,
          "token": "ru"
        },
        {
          "prob": 4.4951460551470435e-06,
          "token": "ру"
        },
        {
          "prob": 2.1233566461371803e-06,
          "token": " "
        },
        {
          "prob": 1.5534809081416851e-06,
          "token": "edu"
        },
        {
          "prob": 7.571061280459825e-07,
          "token": "Ru"
        }
      ],
      [
        {
          "prob": 0.9950847233941963,
          "token": "."
        },
        {
          "prob": 0.002975250153362276,
          "token": " ."
        },
        {
          "prob": 0.0015925366472900368,
          "token": " "
        },
        {
          "prob": 0.00010837342723772404,
          "token": ","
        },
        {
          "prob": 5.800811547676302e-05,
          "token": "  "
        }
      ],
      [
        {
          "prob": 0.9941190292506934,
          "token": " "
        },
        {
          "prob": 0.00555310262636165,
          "token": "  "
        },
        {
          "prob": 0.00013901920406342107,
          "token": "\n"
        },
        {
          "prob": 0.00010170862241652135,
          "token": ""
        },
        {
          "prob": 3.5149559364492955e-05,
          "token": "   "
        }
      ],
      [
        {
          "prob": 0.9988882993341478,
          "token": "\n"
        },
        {
          "prob": 0.0006260298770475258,
          "token": "\n\n\n"
        },
        {
          "prob": 0.0002777992064351813,
          "token": "\n\n"
        },
        {
          "prob": 0.0001793606482777126,
          "token": ""
        },
        {
          "prob": 1.4722818567057635e-05,
          "token": "\n\n\n\n"
        }
      ],
      [
        {
          "prob": 0.9998365907754261,
          "token": ""
        },
        {
          "prob": 0.0001584354856179393,
          "token": " "
        },
        {
          "prob": 1.7600592612644261e-06,
          "token": "  "
        },
        {
          "prob": 1.8550888132019832e-07,
          "token": "."
        },
        {
          "prob": 1.5867415481125884e-07,
          "token": "**"
        }
      ]
    ],
    "language_consistency_score": 0.42509664513857304
  },
  {
    "question": "How many ECTS credits are required for the Science, Technology, and Engineering track?\n",
    "true_answer": "36 ECTS credits \n",
    "source_doc": "\n### Text After Video 4\n\n[Learn more about what’s considered academic misconduct (links to an external site)](https://www.skoltech.ru/app/data/uploads/sites/2/2015/04/1.-STUDENT-ACADEMIC-INTEGRITY-REGULATIONS.pdf)  \n[Disciplinary Board Policy (links to an external site).](http://www.skoltech.ru/app/data/uploads/sites/2/2015/04/DISCIPLINARY-BOARD-POLICY.pdf)\n\nSave these links\\! 1) [Course timetable (links to an external site)](https://schedule.skoltech.ru/)  \n2) [Course catalog (links to an external site)](https://www.skoltech.ru/en/education/course-catalog/)  \n3) [Education resources for students (Canvas)](https://skoltech.instructure.com/courses/2072)\n\n![][image12]  \n[View the 2022-2023 academic calendar with key dates, breaks and holidays](https://www.skoltech.ru/en/education/academic-calendar/msc-academic-calendar-2022-2023/)   \n[(links to an external site)](https://www.skoltech.ru/en/education/academic-calendar/msc-academic-calendar-2022-2023/)\n\n[Your updated term schedule can be found on the Skoltech website (links to an external site)](https://schedule.skoltech.ru/)![][image13]\n\n* **STE:** **Science, Technology and Engineering** (36 ECTS-credits)  \n  * Provide a solid foundation of scientific and engineering fundamentals  \n  * Core and recommended electives  \n* **Sector:** **Industrial Immersion** (12 ECTS-credits)  \n  * Orients students to how a sector works, provides knowledge and skills to make an impact in an industrial sector  \n  * Happens in the summer term between Year 1 and Year 2  \n* **Enterpreneurship and Innovation: Entrepreneurship and Innovation** (12 ECTS-credits)  \n  * Orients students in the process of, provide the skills for, and experience with innovation  \n  * Includes Innovation Workshop  \n* **MSc Thesis Project** (36 ECTS-credits)  \n* Early research, Thesis Project, Defense\n\n* **Options: elective coursework and short-term projects** (24 ECTS-credits)  \n* Follow your dreams and passions, choose courses to diversify your experience  \n* Additionally you can take 20 credits as an extracurricular activity. **ECTS credits** are based on the workload students need in order to achieve the learning outcomes. 1 ECTS equals 27 astronomical hours (36 academic hours). [The courses offered in 2022-2023 (links to an external site)](https://www.skoltech.ru/en/education/course-catalog/)\n\nIf you need to communicate any concerns or issues informally or outside of the formal evaluation period (or if you are unable to solve an issue directly with your research advisor or faculty, please talk to the [Education Department (links to an external site)](https://helpdesk.skoltech.ru/servicedesk/customer/portal/21) (email: education@skoltech.ru).",
    "context": "Sim: 6.40 - * STE: Science, Technology and Engineering (36 ECTS-credits)  \nSim: 6.14 - * **STE:** **Science, Technology and Engineering** (36 ECTS-credits)  ",
    "generated_answer": "36 ECTS credits. \n",
    "logprobs": [
      [
        {
          "prob": 0.9811182355502165,
          "token": "3"
        },
        {
          "prob": 0.013994896954371934,
          "token": "The"
        },
        {
          "prob": 0.0013017281917667755,
          "token": "You"
        },
        {
          "prob": 0.00074170236613675,
          "token": "Students"
        },
        {
          "prob": 0.0004788790397442735,
          "token": "A"
        }
      ],
      [
        {
          "prob": 0.9999824765407688,
          "token": "6"
        },
        {
          "prob": 4.637815193264664e-06,
          "token": "0"
        },
        {
          "prob": 2.4824435855539208e-06,
          "token": "4"
        },
        {
          "prob": 1.6536639334486014e-06,
          "token": "9"
        },
        {
          "prob": 1.6536639334486014e-06,
          "token": "5"
        }
      ],
      [
        {
          "prob": 0.9433698612975638,
          "token": " ECTS"
        },
        {
          "prob": 0.03657841674762567,
          "token": "."
        },
        {
          "prob": 0.017278424743297126,
          "token": " credits"
        },
        {
          "prob": 0.0010376500597127803,
          "token": "  "
        },
        {
          "prob": 0.0007591610010632861,
          "token": " "
        }
      ],
      [
        {
          "prob": 0.7974444790439849,
          "token": " credits"
        },
        {
          "prob": 0.20162554576711716,
          "token": "-"
        },
        {
          "prob": 0.00034349323016077233,
          "token": "."
        },
        {
          "prob": 0.0002675127966289358,
          "token": " credit"
        },
        {
          "prob": 0.00015242419691490397,
          "token": " are"
        }
      ],
      [
        {
          "prob": 0.620744233054253,
          "token": "."
        },
        {
          "prob": 0.37650040918720873,
          "token": " are"
        },
        {
          "prob": 0.0009934406813201446,
          "token": " is"
        },
        {
          "prob": 0.0005660454376052047,
          "token": " "
        },
        {
          "prob": 0.000499533345408735,
          "token": " for"
        }
      ],
      [
        {
          "prob": 0.9928799052342736,
          "token": " "
        },
        {
          "prob": 0.006689973240229641,
          "token": "  "
        },
        {
          "prob": 0.000228918186679334,
          "token": ""
        },
        {
          "prob": 0.0001225310756159572,
          "token": "\n"
        },
        {
          "prob": 4.5076663623734083e-05,
          "token": "   "
        }
      ],
      [
        {
          "prob": 0.9995802019682769,
          "token": "\n"
        },
        {
          "prob": 0.00024532673670414027,
          "token": "\n\n\n"
        },
        {
          "prob": 0.00010886307950343158,
          "token": "\n\n"
        },
        {
          "prob": 5.827020744798319e-05,
          "token": ""
        },
        {
          "prob": 2.901102802022354e-06,
          "token": "\n\n\n\n\n"
        }
      ],
      [
        {
          "prob": 0.9997890440762561,
          "token": ""
        },
        {
          "prob": 0.00020342549012416578,
          "token": " "
        },
        {
          "prob": 3.966165646791488e-06,
          "token": "  "
        },
        {
          "prob": 1.1363254829478597e-06,
          "token": "**"
        },
        {
          "prob": 1.4446757312392543e-07,
          "token": "."
        }
      ]
    ],
    "language_consistency_score": 0.2548667672842617
  },
  {
    "question": "How many ECTS credits does a student need to take for the Entrepreneurship and Innovation track?\n",
    "true_answer": "12 ECTS credits \n",
    "source_doc": "\n### Text After Video 4\n\n[Learn more about what’s considered academic misconduct (links to an external site)](https://www.skoltech.ru/app/data/uploads/sites/2/2015/04/1.-STUDENT-ACADEMIC-INTEGRITY-REGULATIONS.pdf)  \n[Disciplinary Board Policy (links to an external site).](http://www.skoltech.ru/app/data/uploads/sites/2/2015/04/DISCIPLINARY-BOARD-POLICY.pdf)\n\nSave these links\\! 1) [Course timetable (links to an external site)](https://schedule.skoltech.ru/)  \n2) [Course catalog (links to an external site)](https://www.skoltech.ru/en/education/course-catalog/)  \n3) [Education resources for students (Canvas)](https://skoltech.instructure.com/courses/2072)\n\n![][image12]  \n[View the 2022-2023 academic calendar with key dates, breaks and holidays](https://www.skoltech.ru/en/education/academic-calendar/msc-academic-calendar-2022-2023/)   \n[(links to an external site)](https://www.skoltech.ru/en/education/academic-calendar/msc-academic-calendar-2022-2023/)\n\n[Your updated term schedule can be found on the Skoltech website (links to an external site)](https://schedule.skoltech.ru/)![][image13]\n\n* **STE:** **Science, Technology and Engineering** (36 ECTS-credits)  \n  * Provide a solid foundation of scientific and engineering fundamentals  \n  * Core and recommended electives  \n* **Sector:** **Industrial Immersion** (12 ECTS-credits)  \n  * Orients students to how a sector works, provides knowledge and skills to make an impact in an industrial sector  \n  * Happens in the summer term between Year 1 and Year 2  \n* **Enterpreneurship and Innovation: Entrepreneurship and Innovation** (12 ECTS-credits)  \n  * Orients students in the process of, provide the skills for, and experience with innovation  \n  * Includes Innovation Workshop  \n* **MSc Thesis Project** (36 ECTS-credits)  \n* Early research, Thesis Project, Defense\n\n* **Options: elective coursework and short-term projects** (24 ECTS-credits)  \n* Follow your dreams and passions, choose courses to diversify your experience  \n* Additionally you can take 20 credits as an extracurricular activity. **ECTS credits** are based on the workload students need in order to achieve the learning outcomes. 1 ECTS equals 27 astronomical hours (36 academic hours). [The courses offered in 2022-2023 (links to an external site)](https://www.skoltech.ru/en/education/course-catalog/)\n\nIf you need to communicate any concerns or issues informally or outside of the formal evaluation period (or if you are unable to solve an issue directly with your research advisor or faculty, please talk to the [Education Department (links to an external site)](https://helpdesk.skoltech.ru/servicedesk/customer/portal/21) (email: education@skoltech.ru).",
    "context": "Sim: 6.91 - * Enterpreneurship and Innovation: Entrepreneurship and Innovation (12 ECTS-credits)  \nSim: 6.65 - * **Enterpreneurship and Innovation: Entrepreneurship and Innovation** (12 ECTS-credits)  ",
    "generated_answer": "A student needs to take 12 ECTS credits for the Entrepreneurship and Innovation track. \n",
    "logprobs": [
      [
        {
          "prob": 0.6524278418928128,
          "token": "A"
        },
        {
          "prob": 0.2719723797605198,
          "token": "Students"
        },
        {
          "prob": 0.02866568134621898,
          "token": "The"
        },
        {
          "prob": 0.025297374998515264,
          "token": "1"
        },
        {
          "prob": 0.0043960235643428795,
          "token": "To"
        }
      ],
      [
        {
          "prob": 0.9990480671949075,
          "token": " student"
        },
        {
          "prob": 0.0004876306790759661,
          "token": " course"
        },
        {
          "prob": 0.00011582238308176878,
          "token": " students"
        },
        {
          "prob": 8.473746564446714e-05,
          "token": "  "
        },
        {
          "prob": 5.139587093971527e-05,
          "token": " minimum"
        }
      ],
      [
        {
          "prob": 0.9416663799419692,
          "token": " needs"
        },
        {
          "prob": 0.053125187002398225,
          "token": " must"
        },
        {
          "prob": 0.002334157258548954,
          "token": " would"
        },
        {
          "prob": 0.0008066631636149407,
          "token": " is"
        },
        {
          "prob": 0.0006282299034981727,
          "token": " takes"
        }
      ],
      [
        {
          "prob": 0.9987530778668747,
          "token": " to"
        },
        {
          "prob": 0.000969482743478754,
          "token": " "
        },
        {
          "prob": 7.958002761105231e-05,
          "token": " a"
        },
        {
          "prob": 4.5343332924390234e-05,
          "token": "  "
        },
        {
          "prob": 4.259611926067255e-05,
          "token": " credits"
        }
      ],
      [
        {
          "prob": 0.9983975381792798,
          "token": " take"
        },
        {
          "prob": 0.001098177157410116,
          "token": " complete"
        },
        {
          "prob": 0.0002450363281618124,
          "token": " earn"
        },
        {
          "prob": 9.01438274708697e-05,
          "token": " enroll"
        },
        {
          "prob": 3.3162060875038455e-05,
          "token": "  "
        }
      ],
      [
        {
          "prob": 0.9732663534690629,
          "token": " "
        },
        {
          "prob": 0.01225161269571694,
          "token": " **"
        },
        {
          "prob": 0.007430978730876871,
          "token": " a"
        },
        {
          "prob": 0.003736530761115317,
          "token": " at"
        },
        {
          "prob": 0.0008875038469554858,
          "token": "  "
        }
      ],
      [
        {
          "prob": 0.9971486801176048,
          "token": "1"
        },
        {
          "prob": 0.0028007856807239348,
          "token": "6"
        },
        {
          "prob": 1.7728176332359457e-05,
          "token": "\n"
        },
        {
          "prob": 1.3806717610069493e-05,
          "token": "2"
        },
        {
          "prob": 4.771473929481683e-06,
          "token": "0"
        }
      ],
      [
        {
          "prob": 0.9999896288992495,
          "token": "2"
        },
        {
          "prob": 2.332055500064955e-06,
          "token": "0"
        },
        {
          "prob": 1.6027967427401632e-06,
          "token": "1"
        },
        {
          "prob": 6.893542890878928e-07,
          "token": "8"
        },
        {
          "prob": 6.893542890878928e-07,
          "token": " credit"
        }
      ],
      [
        {
          "prob": 0.9966149861511159,
          "token": " ECTS"
        },
        {
          "prob": 0.0031720069345627785,
          "token": " credits"
        },
        {
          "prob": 4.969330649031888e-05,
          "token": " credit"
        },
        {
          "prob": 4.668254125139924e-05,
          "token": "  "
        },
        {
          "prob": 4.250493750494987e-05,
          "token": " ECT"
        }
      ],
      [
        {
          "prob": 0.9938168176581769,
          "token": " credits"
        },
        {
          "prob": 0.005909451734918617,
          "token": "-"
        },
        {
          "prob": 0.00010823533239653247,
          "token": " for"
        },
        {
          "prob": 8.973024217265982e-05,
          "token": " credit"
        },
        {
          "prob": 3.100994192136369e-05,
          "token": " Credits"
        }
      ],
      [
        {
          "prob": 0.9708612292172251,
          "token": " for"
        },
        {
          "prob": 0.017781947295653817,
          "token": " to"
        },
        {
          "prob": 0.009517990511321059,
          "token": "."
        },
        {
          "prob": 0.0014596311192939845,
          "token": " in"
        },
        {
          "prob": 0.00012754114580843984,
          "token": "  "
        }
      ],
      [
        {
          "prob": 0.9876536930068631,
          "token": " the"
        },
        {
          "prob": 0.010307092396946854,
          "token": " Entrepreneurs"
        },
        {
          "prob": 0.0007014064401269229,
          "token": " a"
        },
        {
          "prob": 0.00020095621382158036,
          "token": " entrepreneurs"
        },
        {
          "prob": 0.00018878089231753054,
          "token": " an"
        }
      ],
      [
        {
          "prob": 0.9984380599541467,
          "token": " Entrepreneurs"
        },
        {
          "prob": 0.0004873329113603889,
          "token": " entrepreneurs"
        },
        {
          "prob": 0.00023019976737654937,
          "token": " Entrepre"
        },
        {
          "prob": 0.00023019976737654937,
          "token": " course"
        },
        {
          "prob": 0.0001684177475925648,
          "token": " \""
        }
      ],
      [
        {
          "prob": 0.9999928474936721,
          "token": "hip"
        },
        {
          "prob": 3.0894833684171545e-06,
          "token": " and"
        },
        {
          "prob": 2.902301033636053e-06,
          "token": "hips"
        },
        {
          "prob": 5.368717081544133e-07,
          "token": "hi"
        },
        {
          "prob": 4.4508227878725854e-07,
          "token": "preneurship"
        }
      ],
      [
        {
          "prob": 0.9996965852306375,
          "token": " and"
        },
        {
          "prob": 0.0002959549626480851,
          "token": " &"
        },
        {
          "prob": 2.901440359941361e-06,
          "token": " And"
        },
        {
          "prob": 2.641791510652825e-06,
          "token": "  "
        },
        {
          "prob": 3.255325864156476e-07,
          "token": " Innovation"
        }
      ],
      [
        {
          "prob": 0.9997283958238651,
          "token": " Innovation"
        },
        {
          "prob": 0.00020341307439649263,
          "token": " innovation"
        },
        {
          "prob": 5.143087951181002e-05,
          "token": " Innovations"
        },
        {
          "prob": 7.887180822339136e-06,
          "token": "Innovation"
        },
        {
          "prob": 4.22170367395283e-06,
          "token": "  "
        }
      ],
      [
        {
          "prob": 0.9973980119610384,
          "token": " track"
        },
        {
          "prob": 0.0015962383671871087,
          "token": " course"
        },
        {
          "prob": 0.00033458973836989327,
          "token": " program"
        },
        {
          "prob": 0.000314317970908021,
          "token": " Track"
        },
        {
          "prob": 0.00014847329638237243,
          "token": "  "
        }
      ],
      [
        {
          "prob": 0.998868673838837,
          "token": "."
        },
        {
          "prob": 0.00037969889101674404,
          "token": ","
        },
        {
          "prob": 0.00014869222216509764,
          "token": " to"
        },
        {
          "prob": 9.018639160393414e-05,
          "token": " in"
        },
        {
          "prob": 8.47222743607473e-05,
          "token": " according"
        }
      ],
      [
        {
          "prob": 0.9925622390090801,
          "token": " "
        },
        {
          "prob": 0.006687833073956467,
          "token": "  "
        },
        {
          "prob": 0.00031279411526896953,
          "token": "\n"
        },
        {
          "prob": 0.00024360430191160078,
          "token": ""
        },
        {
          "prob": 7.42951144669248e-05,
          "token": "   "
        }
      ],
      [
        {
          "prob": 0.9979788466449625,
          "token": "\n"
        },
        {
          "prob": 0.001324098775944672,
          "token": "\n\n\n"
        },
        {
          "prob": 0.00048710871775031674,
          "token": "\n\n"
        },
        {
          "prob": 0.00015814112249694777,
          "token": ""
        },
        {
          "prob": 2.2782388761321447e-05,
          "token": "\n\n\n\n\n"
        }
      ],
      [
        {
          "prob": 0.9998535132381372,
          "token": ""
        },
        {
          "prob": 0.00013982109214327813,
          "token": " "
        },
        {
          "prob": 2.56091263272471e-06,
          "token": "  "
        },
        {
          "prob": 5.367964493181964e-07,
          "token": "**"
        },
        {
          "prob": 1.5867672733103628e-07,
          "token": "."
        }
      ]
    ],
    "language_consistency_score": 0.2558083120599902
  },
  {
    "question": "How many credits are required per term to maintain full-time student status at Skoltech?\n",
    "true_answer": "A minimum of 12 credits and a maximum of 18 credits per term. \n",
    "source_doc": "In this section, we would like to cover the most critical academic policies and guidelines that regulate the students’ eligibility for their degree. * Full-time Status requirement  \n  1. You must be registered for a minimum of 12 credits and a maximum of 18 credits per term. During Term 1, it’s best to take only 12 credits for a smooth introduction to Skoltech coursework. 2.",
    "context": "Sim: 4.92 -   1. You must be registered for a minimum of 12 credits and a maximum of 18 credits per term. During Term 1, it’s best to take only 12 credits for a smooth introduction to Skoltech coursework.   \nSim: 0.11 - Most academic programs at Skoltech focus on preparing specialists who are ready to meet the needs of industry and interests of business. One of such programs is Industrial Immersion. What is industrial immersion? Industrial immersion is a compulsory educational element aimed at getting a real hands-on work experience in the industrial sector. Basically, this is your mandatory summer internship which grants you 12 credits upon successful completion.",
    "generated_answer": "The minimum and maximum credits per term for full-time students is 12 and 18 credits, respectively. \n",
    "logprobs": [
      [
        {
          "prob": 0.9112677653154566,
          "token": "The"
        },
        {
          "prob": 0.02143096594688609,
          "token": "You"
        },
        {
          "prob": 0.018912761067522914,
          "token": "1"
        },
        {
          "prob": 0.012998537914043802,
          "token": "A"
        },
        {
          "prob": 0.008933755748280273,
          "token": "Minimum"
        }
      ],
      [
        {
          "prob": 0.7898314561565655,
          "token": " minimum"
        },
        {
          "prob": 0.10689206542095092,
          "token": " document"
        },
        {
          "prob": 0.027026546615767748,
          "token": " documents"
        },
        {
          "prob": 0.02104829566807575,
          "token": " text"
        },
        {
          "prob": 0.018575055731761606,
          "token": " required"
        }
      ],
      [
        {
          "prob": 0.45743007170882194,
          "token": " and"
        },
        {
          "prob": 0.24484468822428843,
          "token": " number"
        },
        {
          "prob": 0.06190643200556825,
          "token": " credit"
        },
        {
          "prob": 0.054632234494977845,
          "token": " is"
        },
        {
          "prob": 0.048212777723093236,
          "token": " required"
        }
      ],
      [
        {
          "prob": 0.9995578099393064,
          "token": " maximum"
        },
        {
          "prob": 0.00013131093403899905,
          "token": " max"
        },
        {
          "prob": 0.00013131093403899905,
          "token": " the"
        },
        {
          "prob": 4.8306593033967095e-05,
          "token": "  "
        },
        {
          "prob": 2.75242670320209e-05,
          "token": " maxim"
        }
      ],
      [
        {
          "prob": 0.5206889532870173,
          "token": " credits"
        },
        {
          "prob": 0.24595604591451556,
          "token": " number"
        },
        {
          "prob": 0.2170554486915145,
          "token": " credit"
        },
        {
          "prob": 0.003975510164901322,
          "token": " for"
        },
        {
          "prob": 0.002566782279767644,
          "token": " allowed"
        }
      ],
      [
        {
          "prob": 0.44027910877911186,
          "token": " per"
        },
        {
          "prob": 0.16196964215126303,
          "token": " required"
        },
        {
          "prob": 0.14293770751122495,
          "token": " for"
        },
        {
          "prob": 0.09823955390742473,
          "token": " allowed"
        },
        {
          "prob": 0.052583843961556506,
          "token": " you"
        }
      ],
      [
        {
          "prob": 0.999433480955669,
          "token": " term"
        },
        {
          "prob": 0.00023042929643874753,
          "token": " semester"
        },
        {
          "prob": 0.00019103259642954494,
          "token": " terms"
        },
        {
          "prob": 4.2625133834894724e-05,
          "token": " course"
        },
        {
          "prob": 3.533747711546432e-05,
          "token": " academic"
        }
      ],
      [
        {
          "prob": 0.7978211235565598,
          "token": " for"
        },
        {
          "prob": 0.06548914680512193,
          "token": " are"
        },
        {
          "prob": 0.04500998847632835,
          "token": " to"
        },
        {
          "prob": 0.035053814271399426,
          "token": " a"
        },
        {
          "prob": 0.02126121309547602,
          "token": " required"
        }
      ],
      [
        {
          "prob": 0.9647205605944562,
          "token": " full"
        },
        {
          "prob": 0.029132036338088967,
          "token": " a"
        },
        {
          "prob": 0.0017495147673979757,
          "token": " students"
        },
        {
          "prob": 0.0010611343460468887,
          "token": " registration"
        },
        {
          "prob": 0.0009968434660764824,
          "token": " registered"
        }
      ],
      [
        {
          "prob": 0.9964858245784206,
          "token": "-"
        },
        {
          "prob": 0.0029794382923284115,
          "token": " time"
        },
        {
          "prob": 0.00013935024973416098,
          "token": " enrollment"
        },
        {
          "prob": 8.452019890238088e-05,
          "token": "time"
        },
        {
          "prob": 7.458881373718504e-05,
          "token": " registration"
        }
      ],
      [
        {
          "prob": 0.9997363785557283,
          "token": "time"
        },
        {
          "prob": 0.00020341482031240732,
          "token": "term"
        },
        {
          "prob": 1.0127427565930582e-05,
          "token": "fledged"
        },
        {
          "prob": 7.409384288259861e-06,
          "token": "student"
        },
        {
          "prob": 7.409384288259861e-06,
          "token": " time"
        }
      ],
      [
        {
          "prob": 0.2750353166600978,
          "token": " students"
        },
        {
          "prob": 0.2750353166600978,
          "token": " student"
        },
        {
          "prob": 0.21419771998717596,
          "token": " status"
        },
        {
          "prob": 0.18902882442936525,
          "token": " enrollment"
        },
        {
          "prob": 0.019923489139630768,
          "token": " study"
        }
      ],
      [
        {
          "prob": 0.4194779263872919,
          "token": " at"
        },
        {
          "prob": 0.4194779263872919,
          "token": " is"
        },
        {
          "prob": 0.15431730514311237,
          "token": " are"
        },
        {
          "prob": 0.0010397818230959903,
          "token": " during"
        },
        {
          "prob": 0.0007146308992956055,
          "token": " in"
        }
      ],
      [
        {
          "prob": 0.9831698855694737,
          "token": " "
        },
        {
          "prob": 0.007506593618863244,
          "token": " between"
        },
        {
          "prob": 0.0040179900237442764,
          "token": " a"
        },
        {
          "prob": 0.0013044503750298136,
          "token": "  "
        },
        {
          "prob": 0.0006982219711705906,
          "token": " stated"
        }
      ],
      [
        {
          "prob": 0.9998926039673159,
          "token": "1"
        },
        {
          "prob": 4.006097998089201e-05,
          "token": "4"
        },
        {
          "prob": 2.586531269192021e-05,
          "token": "9"
        },
        {
          "prob": 1.3844704220567578e-05,
          "token": "\n"
        },
        {
          "prob": 1.0450531023508762e-05,
          "token": "6"
        }
      ],
      [
        {
          "prob": 0.9999909401759619,
          "token": "2"
        },
        {
          "prob": 2.3320599481120668e-06,
          "token": "0"
        },
        {
          "prob": 1.3709473193983572e-06,
          "token": "8"
        },
        {
          "prob": 1.2098567629757041e-06,
          "token": "3"
        },
        {
          "prob": 1.2098567629757041e-06,
          "token": "1"
        }
      ],
      [
        {
          "prob": 0.6087259792770926,
          "token": " and"
        },
        {
          "prob": 0.2875418095338455,
          "token": " to"
        },
        {
          "prob": 0.08238210772930588,
          "token": "-"
        },
        {
          "prob": 0.015239157615081354,
          "token": " credits"
        },
        {
          "prob": 0.004101563629807684,
          "token": " -"
        }
      ],
      [
        {
          "prob": 0.9997947637384105,
          "token": " "
        },
        {
          "prob": 6.2041624208478e-05,
          "token": "  "
        },
        {
          "prob": 5.143431300803429e-05,
          "token": " up"
        },
        {
          "prob": 3.3208488401468294e-05,
          "token": "1"
        },
        {
          "prob": 1.4736177400010296e-05,
          "token": " a"
        }
      ],
      [
        {
          "prob": 0.9999947548186582,
          "token": "1"
        },
        {
          "prob": 1.8738699597371628e-06,
          "token": "2"
        },
        {
          "prob": 8.851534931659876e-07,
          "token": "\n"
        },
        {
          "prob": 6.276678144100613e-07,
          "token": "6"
        },
        {
          "prob": 5.368727321569085e-07,
          "token": "8"
        }
      ],
      [
        {
          "prob": 0.9999953508594287,
          "token": "8"
        },
        {
          "prob": 1.0676989188374615e-06,
          "token": "6"
        },
        {
          "prob": 1.0348492765517285e-06,
          "token": "2"
        },
        {
          "prob": 7.112408129385968e-07,
          "token": "5"
        },
        {
          "prob": 6.083565059373613e-07,
          "token": "7"
        }
      ],
      [
        {
          "prob": 0.5034448306027075,
          "token": " credits"
        },
        {
          "prob": 0.3053547070338158,
          "token": ","
        },
        {
          "prob": 0.09913415905801433,
          "token": "."
        },
        {
          "prob": 0.08748558830902625,
          "token": " respectively"
        },
        {
          "prob": 0.0021901588484975524,
          "token": " credit"
        }
      ],
      [
        {
          "prob": 0.4428567279055345,
          "token": ","
        },
        {
          "prob": 0.344897187038744,
          "token": " respectively"
        },
        {
          "prob": 0.20919071838764094,
          "token": "."
        },
        {
          "prob": 0.0010977321436771172,
          "token": " per"
        },
        {
          "prob": 0.0003563814489433466,
          "token": " respectfully"
        }
      ],
      [
        {
          "prob": 0.9927391387974874,
          "token": " respectively"
        },
        {
          "prob": 0.0027883995038411047,
          "token": " respectfully"
        },
        {
          "prob": 0.001691249790607125,
          "token": "  "
        },
        {
          "prob": 0.0010257948512357926,
          "token": " according"
        },
        {
          "prob": 0.00022888587857694304,
          "token": " as"
        }
      ],
      [
        {
          "prob": 0.995420779355849,
          "token": "."
        },
        {
          "prob": 0.003590048532942991,
          "token": ","
        },
        {
          "prob": 0.00020253658228285164,
          "token": " during"
        },
        {
          "prob": 0.0001577356488824909,
          "token": " ."
        },
        {
          "prob": 9.567150717689751e-05,
          "token": " for"
        }
      ],
      [
        {
          "prob": 0.9634620741965113,
          "token": " "
        },
        {
          "prob": 0.03296785948928908,
          "token": "  "
        },
        {
          "prob": 0.0012008539078100361,
          "token": "\n"
        },
        {
          "prob": 0.0009352259637568129,
          "token": "   "
        },
        {
          "prob": 0.0003440504049158799,
          "token": ""
        }
      ],
      [
        {
          "prob": 0.9884770873607823,
          "token": "\n"
        },
        {
          "prob": 0.007547114275366534,
          "token": "\n\n\n"
        },
        {
          "prob": 0.0027764281820788555,
          "token": "\n\n"
        },
        {
          "prob": 0.0007954599923034094,
          "token": ""
        },
        {
          "prob": 0.0001889383089295726,
          "token": "\n\n\n\n\n"
        }
      ],
      [
        {
          "prob": 0.9995006433265753,
          "token": ""
        },
        {
          "prob": 0.0004582941878508456,
          "token": " "
        },
        {
          "prob": 2.0136031709985584e-05,
          "token": "  "
        },
        {
          "prob": 3.0879604752732674e-06,
          "token": "."
        },
        {
          "prob": 1.3702741545392054e-06,
          "token": "   "
        }
      ]
    ],
    "language_consistency_score": 0.4122966782902265
  },
  {
    "question": "What is the maximum number of credits a Skoltech student can take per term?\n",
    "true_answer": "18 credits \n",
    "source_doc": "In this section, we would like to cover the most critical academic policies and guidelines that regulate the students’ eligibility for their degree. * Full-time Status requirement  \n  1. You must be registered for a minimum of 12 credits and a maximum of 18 credits per term. During Term 1, it’s best to take only 12 credits for a smooth introduction to Skoltech coursework. 2.",
    "context": "Sim: 6.58 -   1. You must be registered for a minimum of 12 credits and a maximum of 18 credits per term. During Term 1, it’s best to take only 12 credits for a smooth introduction to Skoltech coursework.   ",
    "generated_answer": "The maximum number of credits a Skoltech student can take per term is 18. \n",
    "logprobs": [
      [
        {
          "prob": 0.940499237456643,
          "token": "The"
        },
        {
          "prob": 0.05305933914847173,
          "token": "A"
        },
        {
          "prob": 0.0028120412845912004,
          "token": "1"
        },
        {
          "prob": 0.0015051772350446622,
          "token": "Sk"
        },
        {
          "prob": 0.0007568506442234454,
          "token": "Students"
        }
      ],
      [
        {
          "prob": 0.9999181099254703,
          "token": " maximum"
        },
        {
          "prob": 2.429883828429551e-05,
          "token": " max"
        },
        {
          "prob": 2.144364952229477e-05,
          "token": " Sk"
        },
        {
          "prob": 1.7777409854037596e-05,
          "token": " student"
        },
        {
          "prob": 5.093313198931384e-06,
          "token": "maximum"
        }
      ],
      [
        {
          "prob": 0.9962440473054669,
          "token": " number"
        },
        {
          "prob": 0.0026287069732214025,
          "token": " a"
        },
        {
          "prob": 0.0003557568027669774,
          "token": " credits"
        },
        {
          "prob": 0.000215777408279512,
          "token": " amount"
        },
        {
          "prob": 0.0002027041159978102,
          "token": " credit"
        }
      ],
      [
        {
          "prob": 0.9993043020612083,
          "token": " of"
        },
        {
          "prob": 0.0005192133369450642,
          "token": " a"
        },
        {
          "prob": 0.00015835104554553326,
          "token": " is"
        },
        {
          "prob": 3.3907948933274284e-06,
          "token": " students"
        },
        {
          "prob": 2.8110677003458425e-06,
          "token": " for"
        }
      ],
      [
        {
          "prob": 0.9999164412717095,
          "token": " credits"
        },
        {
          "prob": 5.8289771653276064e-05,
          "token": " credit"
        },
        {
          "prob": 9.515543644363269e-06,
          "token": " courses"
        },
        {
          "prob": 6.143696732143438e-06,
          "token": "  "
        },
        {
          "prob": 2.057880633725296e-06,
          "token": "credits"
        }
      ],
      [
        {
          "prob": 0.9975421192654255,
          "token": " a"
        },
        {
          "prob": 0.0006655072962862626,
          "token": " is"
        },
        {
          "prob": 0.0005517249269828227,
          "token": " per"
        },
        {
          "prob": 0.0002953172133845485,
          "token": " students"
        },
        {
          "prob": 0.0002774248479271195,
          "token": " allowed"
        }
      ],
      [
        {
          "prob": 0.9866076658524433,
          "token": " Sk"
        },
        {
          "prob": 0.013220547280636133,
          "token": " student"
        },
        {
          "prob": 5.402935502736754e-05,
          "token": "  "
        },
        {
          "prob": 2.3975380958810013e-05,
          "token": " SK"
        },
        {
          "prob": 2.1158199434435525e-05,
          "token": " sk"
        }
      ],
      [
        {
          "prob": 0.9997733153268107,
          "token": "ol"
        },
        {
          "prob": 0.00013980989171401433,
          "token": "olk"
        },
        {
          "prob": 5.475034026028199e-05,
          "token": "ot"
        },
        {
          "prob": 7.887534354945838e-06,
          "token": "oland"
        },
        {
          "prob": 4.494181604923238e-06,
          "token": "otech"
        }
      ],
      [
        {
          "prob": 0.9999592320834669,
          "token": "tech"
        },
        {
          "prob": 2.9311195733046325e-05,
          "token": "tek"
        },
        {
          "prob": 4.784921168079426e-06,
          "token": "Tech"
        },
        {
          "prob": 4.222678109941558e-06,
          "token": "tell"
        },
        {
          "prob": 5.043269807052217e-07,
          "token": "technik"
        }
      ],
      [
        {
          "prob": 0.9999593512842658,
          "token": " student"
        },
        {
          "prob": 2.144452890141081e-05,
          "token": " students"
        },
        {
          "prob": 8.939409628896255e-06,
          "token": " Student"
        },
        {
          "prob": 5.422026019655913e-06,
          "token": " can"
        },
        {
          "prob": 2.561183739776949e-06,
          "token": "  "
        }
      ],
      [
        {
          "prob": 0.9997115967339845,
          "token": " can"
        },
        {
          "prob": 0.00023049347368865955,
          "token": " may"
        },
        {
          "prob": 2.752851972874365e-05,
          "token": " is"
        },
        {
          "prob": 7.4092005709106564e-06,
          "token": "  "
        },
        {
          "prob": 6.5385965544566706e-06,
          "token": " takes"
        }
      ],
      [
        {
          "prob": 0.9999715097912857,
          "token": " take"
        },
        {
          "prob": 8.939520458293042e-06,
          "token": "  "
        },
        {
          "prob": 4.495073178347e-06,
          "token": " typically"
        },
        {
          "prob": 2.0579944646520217e-06,
          "token": " takes"
        },
        {
          "prob": 1.1015650570338158e-06,
          "token": " enroll"
        }
      ],
      [
        {
          "prob": 0.9951581497820107,
          "token": " per"
        },
        {
          "prob": 0.004066983433612328,
          "token": " in"
        },
        {
          "prob": 0.0004026858915211739,
          "token": " is"
        },
        {
          "prob": 0.000190215437117066,
          "token": " during"
        },
        {
          "prob": 7.448943545582988e-05,
          "token": " a"
        }
      ],
      [
        {
          "prob": 0.9999737746439785,
          "token": " term"
        },
        {
          "prob": 1.0129832760116547e-05,
          "token": " semester"
        },
        {
          "prob": 9.516097218969371e-06,
          "token": " terms"
        },
        {
          "prob": 2.0580003526298372e-06,
          "token": "  "
        },
        {
          "prob": 9.132321206254042e-07,
          "token": " Term"
        }
      ],
      [
        {
          "prob": 0.9999023771230333,
          "token": " is"
        },
        {
          "prob": 2.2826297791138968e-05,
          "token": "  "
        },
        {
          "prob": 1.777713859436011e-05,
          "token": " are"
        },
        {
          "prob": 1.5688269746339865e-05,
          "token": " during"
        },
        {
          "prob": 1.1477783337553011e-05,
          "token": ","
        }
      ],
      [
        {
          "prob": 0.9998071565635409,
          "token": " "
        },
        {
          "prob": 5.828343479952272e-05,
          "token": " **"
        },
        {
          "prob": 4.005757986882462e-05,
          "token": " a"
        },
        {
          "prob": 3.535069015927277e-05,
          "token": " up"
        },
        {
          "prob": 2.930675148981046e-05,
          "token": "  "
        }
      ],
      [
        {
          "prob": 0.9999949932351057,
          "token": "1"
        },
        {
          "prob": 1.7603379181908526e-06,
          "token": "2"
        },
        {
          "prob": 1.4144712545871572e-06,
          "token": "\n"
        },
        {
          "prob": 6.681489104805937e-07,
          "token": "6"
        },
        {
          "prob": 2.6165087280217334e-07,
          "token": "3"
        }
      ],
      [
        {
          "prob": 0.9999961853172863,
          "token": "8"
        },
        {
          "prob": 9.721518555515831e-07,
          "token": "6"
        },
        {
          "prob": 7.81145960989404e-07,
          "token": "2"
        },
        {
          "prob": 7.112414912310163e-07,
          "token": "5"
        },
        {
          "prob": 4.0525318593944246e-07,
          "token": "7"
        }
      ],
      [
        {
          "prob": 0.973825179778995,
          "token": "."
        },
        {
          "prob": 0.025951559104211413,
          "token": " credits"
        },
        {
          "prob": 7.75937566085004e-05,
          "token": ","
        },
        {
          "prob": 3.038615168287881e-05,
          "token": " credit"
        },
        {
          "prob": 2.8545147819528033e-05,
          "token": " ."
        }
      ],
      [
        {
          "prob": 0.991813638055751,
          "token": " "
        },
        {
          "prob": 0.007572589502122275,
          "token": "  "
        },
        {
          "prob": 0.00022867249773492827,
          "token": "\n"
        },
        {
          "prob": 0.0001780903203028562,
          "token": ""
        },
        {
          "prob": 0.00013029366169768302,
          "token": "   "
        }
      ],
      [
        {
          "prob": 0.9989469424082967,
          "token": "\n"
        },
        {
          "prob": 0.0007094263940763343,
          "token": "\n\n\n"
        },
        {
          "prob": 0.0002032540649220973,
          "token": "\n\n"
        },
        {
          "prob": 0.0001232798220864741,
          "token": ""
        },
        {
          "prob": 7.881015355931719e-06,
          "token": "\n\n\n\n"
        }
      ],
      [
        {
          "prob": 0.9998342073749112,
          "token": ""
        },
        {
          "prob": 0.00015843503233102738,
          "token": " "
        },
        {
          "prob": 5.092885769012783e-06,
          "token": "  "
        },
        {
          "prob": 2.5355985197156076e-07,
          "token": "   "
        },
        {
          "prob": 1.7426896779187966e-07,
          "token": "."
        }
      ]
    ],
    "language_consistency_score": 0.3308222422549034
  },
  {
    "question": "What is the minimum number of credits a Skoltech student must be registered for each term to maintain full-time status?\n",
    "true_answer": "12 credits \n",
    "source_doc": "In this section, we would like to cover the most critical academic policies and guidelines that regulate the students’ eligibility for their degree. * Full-time Status requirement  \n  1. You must be registered for a minimum of 12 credits and a maximum of 18 credits per term. During Term 1, it’s best to take only 12 credits for a smooth introduction to Skoltech coursework. 2.",
    "context": "Sim: 6.09 -   1. You must be registered for a minimum of 12 credits and a maximum of 18 credits per term. During Term 1, it’s best to take only 12 credits for a smooth introduction to Skoltech coursework.   ",
    "generated_answer": "The minimum number of credits a Skoltech student must be registered for each term to maintain full-time status is 12. \n",
    "logprobs": [
      [
        {
          "prob": 0.4582170419847545,
          "token": "The"
        },
        {
          "prob": 0.4582170419847545,
          "token": "A"
        },
        {
          "prob": 0.03319313514725884,
          "token": "1"
        },
        {
          "prob": 0.025850839645280156,
          "token": "Minimum"
        },
        {
          "prob": 0.010776233224916743,
          "token": "Students"
        }
      ],
      [
        {
          "prob": 0.9993071591201504,
          "token": " minimum"
        },
        {
          "prob": 0.00021644083631748874,
          "token": " document"
        },
        {
          "prob": 0.00013127800324040057,
          "token": " required"
        },
        {
          "prob": 0.00010223941172367438,
          "token": " student"
        },
        {
          "prob": 5.140920472783591e-05,
          "token": " minimal"
        }
      ],
      [
        {
          "prob": 0.9879093507487436,
          "token": " number"
        },
        {
          "prob": 0.003347089502812216,
          "token": " credits"
        },
        {
          "prob": 0.003347089502812216,
          "token": " credit"
        },
        {
          "prob": 0.002448782991740662,
          "token": " is"
        },
        {
          "prob": 0.0013107390822921134,
          "token": " registration"
        }
      ],
      [
        {
          "prob": 0.9946146726825296,
          "token": " of"
        },
        {
          "prob": 0.00521925971612159,
          "token": " is"
        },
        {
          "prob": 7.444874142257542e-05,
          "token": " for"
        },
        {
          "prob": 1.3771632409684913e-05,
          "token": " required"
        },
        {
          "prob": 1.1065817517729704e-05,
          "token": "  "
        }
      ],
      [
        {
          "prob": 0.9996074787238038,
          "token": " credits"
        },
        {
          "prob": 0.0001488021608516318,
          "token": " credit"
        },
        {
          "prob": 9.607389588314225e-05,
          "token": " registered"
        },
        {
          "prob": 4.0049558276229406e-05,
          "token": " courses"
        },
        {
          "prob": 2.5857938285135504e-05,
          "token": " "
        }
      ],
      [
        {
          "prob": 0.8229807322234258,
          "token": " a"
        },
        {
          "prob": 0.08674152583550641,
          "token": " is"
        },
        {
          "prob": 0.06755436824550089,
          "token": " for"
        },
        {
          "prob": 0.015073420599127708,
          "token": " required"
        },
        {
          "prob": 0.0016911909207274257,
          "token": " students"
        }
      ],
      [
        {
          "prob": 0.9389009819751899,
          "token": " Sk"
        },
        {
          "prob": 0.06002193121535315,
          "token": " student"
        },
        {
          "prob": 0.0005884344485128367,
          "token": " registered"
        },
        {
          "prob": 0.00013976536554941753,
          "token": "  "
        },
        {
          "prob": 6.202050500505286e-05,
          "token": " Student"
        }
      ],
      [
        {
          "prob": 0.9997100478977962,
          "token": "ol"
        },
        {
          "prob": 0.00021652816708128363,
          "token": "olk"
        },
        {
          "prob": 4.0053683466058526e-05,
          "token": "ot"
        },
        {
          "prob": 8.39570815183152e-06,
          "token": "oland"
        },
        {
          "prob": 4.783730306367001e-06,
          "token": "kol"
        }
      ],
      [
        {
          "prob": 0.9999393261531683,
          "token": "tech"
        },
        {
          "prob": 4.8325024052017135e-05,
          "token": "tek"
        },
        {
          "prob": 6.5400808174958595e-06,
          "token": "Tech"
        },
        {
          "prob": 3.0893154304081565e-06,
          "token": "tell"
        },
        {
          "prob": 3.927623815031879e-07,
          "token": "technik"
        }
      ],
      [
        {
          "prob": 0.9999285987313362,
          "token": " student"
        },
        {
          "prob": 3.321292250901684e-05,
          "token": " students"
        },
        {
          "prob": 2.2826885557762633e-05,
          "token": " Student"
        },
        {
          "prob": 6.143772900730753e-06,
          "token": "  "
        },
        {
          "prob": 2.4059360369506018e-06,
          "token": " must"
        }
      ],
      [
        {
          "prob": 0.9975312059686592,
          "token": " must"
        },
        {
          "prob": 0.0020498843053723924,
          "token": " needs"
        },
        {
          "prob": 0.0002029660318264351,
          "token": " registered"
        },
        {
          "prob": 7.466703036509413e-05,
          "token": " should"
        },
        {
          "prob": 4.5287843186123775e-05,
          "token": " is"
        }
      ],
      [
        {
          "prob": 0.9733361434390667,
          "token": " be"
        },
        {
          "prob": 0.025938531849957362,
          "token": " register"
        },
        {
          "prob": 0.00047508078266774925,
          "token": " take"
        },
        {
          "prob": 7.755476884261996e-05,
          "token": " enroll"
        },
        {
          "prob": 5.3302561144644835e-05,
          "token": " have"
        }
      ],
      [
        {
          "prob": 0.9996662062353423,
          "token": " registered"
        },
        {
          "prob": 0.0002959459309572044,
          "token": " enrolled"
        },
        {
          "prob": 1.0126712879349768e-05,
          "token": " register"
        },
        {
          "prob": 5.77002706963493e-06,
          "token": " registering"
        },
        {
          "prob": 5.77002706963493e-06,
          "token": " Registered"
        }
      ],
      [
        {
          "prob": 0.9996865778227431,
          "token": " for"
        },
        {
          "prob": 0.00021652300470903106,
          "token": " is"
        },
        {
          "prob": 2.7527810900329255e-05,
          "token": "  "
        },
        {
          "prob": 1.3003217139495058e-05,
          "token": " at"
        },
        {
          "prob": 1.2215392039441737e-05,
          "token": " with"
        }
      ],
      [
        {
          "prob": 0.6992392179046051,
          "token": " each"
        },
        {
          "prob": 0.20033539605289705,
          "token": " is"
        },
        {
          "prob": 0.04470086900468204,
          "token": " per"
        },
        {
          "prob": 0.027112447567137803,
          "token": " to"
        },
        {
          "prob": 0.014512247415432401,
          "token": " a"
        }
      ],
      [
        {
          "prob": 0.999855420032741,
          "token": " term"
        },
        {
          "prob": 4.5393349133914254e-05,
          "token": " terms"
        },
        {
          "prob": 4.264310514125183e-05,
          "token": " semester"
        },
        {
          "prob": 1.777629093454522e-05,
          "token": " Term"
        },
        {
          "prob": 9.817000223413286e-06,
          "token": "  "
        }
      ],
      [
        {
          "prob": 0.577322527447825,
          "token": " to"
        },
        {
          "prob": 0.39678758351939686,
          "token": " is"
        },
        {
          "prob": 0.02238522633372377,
          "token": " for"
        },
        {
          "prob": 0.000815381809602184,
          "token": " in"
        },
        {
          "prob": 0.0007195719213977497,
          "token": " during"
        }
      ],
      [
        {
          "prob": 0.9972102011014726,
          "token": " maintain"
        },
        {
          "prob": 0.0011676129955471928,
          "token": " remain"
        },
        {
          "prob": 0.0006652858307954141,
          "token": " be"
        },
        {
          "prob": 0.0002447450963558241,
          "token": " have"
        },
        {
          "prob": 0.000123065563001249,
          "token": " retain"
        }
      ],
      [
        {
          "prob": 0.9998057266053867,
          "token": " full"
        },
        {
          "prob": 7.030310800267494e-05,
          "token": " status"
        },
        {
          "prob": 3.320883677420281e-05,
          "token": " a"
        },
        {
          "prob": 2.1441236527648433e-05,
          "token": "  "
        },
        {
          "prob": 1.3004767336169219e-05,
          "token": " their"
        }
      ],
      [
        {
          "prob": 0.9987445162339971,
          "token": "-"
        },
        {
          "prob": 0.001098558442004727,
          "token": " time"
        },
        {
          "prob": 0.00011578726313484438,
          "token": " status"
        },
        {
          "prob": 6.3312935583566e-06,
          "token": " enrollment"
        },
        {
          "prob": 5.087337294791666e-06,
          "token": " academic"
        }
      ],
      [
        {
          "prob": 0.9997117158507098,
          "token": "time"
        },
        {
          "prob": 0.00015841569329750474,
          "token": "term"
        },
        {
          "prob": 0.0001233742659908962,
          "token": "status"
        },
        {
          "prob": 2.9014846327455646e-06,
          "token": " time"
        },
        {
          "prob": 1.2095187440724711e-06,
          "token": "timing"
        }
      ],
      [
        {
          "prob": 0.9997619957088622,
          "token": " status"
        },
        {
          "prob": 0.00010888280707603333,
          "token": " standing"
        },
        {
          "prob": 4.831645275406696e-05,
          "token": " student"
        },
        {
          "prob": 2.9305409963898517e-05,
          "token": " enrollment"
        },
        {
          "prob": 2.4295038180285905e-05,
          "token": " is"
        }
      ],
      [
        {
          "prob": 0.9992675189857811,
          "token": " is"
        },
        {
          "prob": 0.0002303910623278002,
          "token": " are"
        },
        {
          "prob": 0.00012331944913958605,
          "token": "  "
        },
        {
          "prob": 0.00010882903189412325,
          "token": ","
        },
        {
          "prob": 0.00010882903189412325,
          "token": " during"
        }
      ],
      [
        {
          "prob": 0.9969436645072373,
          "token": " "
        },
        {
          "prob": 0.0013227256066799108,
          "token": " between"
        },
        {
          "prob": 0.00040340851777025485,
          "token": " a"
        },
        {
          "prob": 0.00027725821702940173,
          "token": " either"
        },
        {
          "prob": 0.00027725821702940173,
          "token": "  "
        }
      ],
      [
        {
          "prob": 0.9999008277075381,
          "token": "1"
        },
        {
          "prob": 7.967145577884151e-05,
          "token": "6"
        },
        {
          "prob": 1.0782359033702778e-05,
          "token": "\n"
        },
        {
          "prob": 4.494755963688151e-06,
          "token": "9"
        },
        {
          "prob": 8.578391875449373e-07,
          "token": "8"
        }
      ],
      [
        {
          "prob": 0.9999960661089133,
          "token": "2"
        },
        {
          "prob": 9.721518555515831e-07,
          "token": "0"
        },
        {
          "prob": 6.083570861116129e-07,
          "token": "3"
        },
        {
          "prob": 5.714985935483917e-07,
          "token": "8"
        },
        {
          "prob": 4.313897708913455e-07,
          "token": "1"
        }
      ],
      [
        {
          "prob": 0.7045947701363187,
          "token": "."
        },
        {
          "prob": 0.29371879018043795,
          "token": " credits"
        },
        {
          "prob": 0.0004148338558005601,
          "token": " to"
        },
        {
          "prob": 0.00030349907703949023,
          "token": ","
        },
        {
          "prob": 0.00018408149541893735,
          "token": " credit"
        }
      ],
      [
        {
          "prob": 0.9849644128878431,
          "token": " "
        },
        {
          "prob": 0.01404976522434158,
          "token": "  "
        },
        {
          "prob": 0.0003517289901133364,
          "token": "   "
        },
        {
          "prob": 0.0003517289901133364,
          "token": "\n"
        },
        {
          "prob": 0.00017686035878320343,
          "token": ""
        }
      ],
      [
        {
          "prob": 0.9982190910111178,
          "token": "\n"
        },
        {
          "prob": 0.0010979808055877566,
          "token": "\n\n\n"
        },
        {
          "prob": 0.00031457676766130806,
          "token": "\n\n"
        },
        {
          "prob": 0.00031457676766130806,
          "token": ""
        },
        {
          "prob": 2.2787864618005332e-05,
          "token": "\n\n\n\n"
        }
      ],
      [
        {
          "prob": 0.9996883648504417,
          "token": ""
        },
        {
          "prob": 0.00029595242245716624,
          "token": " "
        },
        {
          "prob": 1.0780066199988776e-05,
          "token": "  "
        },
        {
          "prob": 6.081697185985217e-07,
          "token": "   "
        },
        {
          "prob": 5.71322578059047e-07,
          "token": "."
        }
      ]
    ],
    "language_consistency_score": 0.30954249218579827
  },
  {
    "question": "How many credits are students required to take per term at Skoltech?\n",
    "true_answer": "Students are required to take a minimum of 12 credits and a maximum of 18 credits per term at Skoltech. \n",
    "source_doc": "In this section, we would like to cover the most critical academic policies and guidelines that regulate the students’ eligibility for their degree. * Full-time Status requirement  \n  1. You must be registered for a minimum of 12 credits and a maximum of 18 credits per term. During Term 1, it’s best to take only 12 credits for a smooth introduction to Skoltech coursework. 2.",
    "context": "Sim: 6.30 -   1. You must be registered for a minimum of 12 credits and a maximum of 18 credits per term. During Term 1, it’s best to take only 12 credits for a smooth introduction to Skoltech coursework.   \nSim: 1.44 - Most academic programs at Skoltech focus on preparing specialists who are ready to meet the needs of industry and interests of business. One of such programs is Industrial Immersion. What is industrial immersion? Industrial immersion is a compulsory educational element aimed at getting a real hands-on work experience in the industrial sector. Basically, this is your mandatory summer internship which grants you 12 credits upon successful completion.\nSim: 0.86 - Skoltech follows a term structure. We have two terms (first of them is divided to 1A and 1B) in the fall and two terms in the spring. In between there is a very short winter term. ",
    "generated_answer": "Students must take a minimum of 12 credits and a maximum of 18 credits per term at Skoltech. \n",
    "logprobs": [
      [
        {
          "prob": 0.9664608902503323,
          "token": "Students"
        },
        {
          "prob": 0.017701350182590943,
          "token": "Sk"
        },
        {
          "prob": 0.007379020588151395,
          "token": "The"
        },
        {
          "prob": 0.0022504741293503214,
          "token": "Minimum"
        },
        {
          "prob": 0.0014530153053791284,
          "token": "A"
        }
      ],
      [
        {
          "prob": 0.9310880484129439,
          "token": " must"
        },
        {
          "prob": 0.05252839714323486,
          "token": " are"
        },
        {
          "prob": 0.008055488681739623,
          "token": " at"
        },
        {
          "prob": 0.0029634486746012508,
          "token": " need"
        },
        {
          "prob": 0.0027839023958976966,
          "token": " can"
        }
      ],
      [
        {
          "prob": 0.779120126276631,
          "token": " take"
        },
        {
          "prob": 0.13539077676469893,
          "token": " register"
        },
        {
          "prob": 0.06395408211718935,
          "token": " be"
        },
        {
          "prob": 0.015190425968973005,
          "token": " enroll"
        },
        {
          "prob": 0.0049316092710514365,
          "token": " complete"
        }
      ],
      [
        {
          "prob": 0.7883156595781725,
          "token": " a"
        },
        {
          "prob": 0.19931742461454122,
          "token": " between"
        },
        {
          "prob": 0.00531162818299361,
          "token": " "
        },
        {
          "prob": 0.004989812899912405,
          "token": " at"
        },
        {
          "prob": 0.000982552417077249,
          "token": " either"
        }
      ],
      [
        {
          "prob": 0.9996558420631103,
          "token": " minimum"
        },
        {
          "prob": 0.00010227510408742622,
          "token": "  "
        },
        {
          "prob": 6.603377024430602e-05,
          "token": " term"
        },
        {
          "prob": 2.9302307920422848e-05,
          "token": " maximum"
        },
        {
          "prob": 2.4292466495918714e-05,
          "token": " between"
        }
      ],
      [
        {
          "prob": 0.9998494613353214,
          "token": " of"
        },
        {
          "prob": 0.00012339121003142897,
          "token": " "
        },
        {
          "prob": 9.514908434495303e-06,
          "token": "  "
        },
        {
          "prob": 3.3926450823313053e-06,
          "token": " number"
        },
        {
          "prob": 1.8159520532265818e-06,
          "token": " between"
        }
      ],
      [
        {
          "prob": 0.999687173507986,
          "token": " "
        },
        {
          "prob": 0.000261176847053087,
          "token": " twelve"
        },
        {
          "prob": 2.7527837152908016e-05,
          "token": "  "
        },
        {
          "prob": 8.936980252730436e-06,
          "token": " **"
        },
        {
          "prob": 4.091647713194107e-06,
          "token": " six"
        }
      ],
      [
        {
          "prob": 0.9998121614550102,
          "token": "1"
        },
        {
          "prob": 0.00017952647392920093,
          "token": "6"
        },
        {
          "prob": 3.500209010940557e-06,
          "token": "9"
        },
        {
          "prob": 1.1724231601341312e-06,
          "token": "4"
        },
        {
          "prob": 1.0028266716477312e-06,
          "token": "3"
        }
      ],
      [
        {
          "prob": 0.9999984502816872,
          "token": "2"
        },
        {
          "prob": 4.0525395889928976e-07,
          "token": " credit"
        },
        {
          "prob": 2.2380249174039673e-07,
          "token": "3"
        },
        {
          "prob": 1.742975558207526e-07,
          "token": "0"
        },
        {
          "prob": 1.3156669766339368e-07,
          "token": "8"
        }
      ],
      [
        {
          "prob": 0.5916098920891526,
          "token": " credits"
        },
        {
          "prob": 0.40660713605955856,
          "token": " and"
        },
        {
          "prob": 0.0010078780832588157,
          "token": " or"
        },
        {
          "prob": 0.00047608789577218823,
          "token": " to"
        },
        {
          "prob": 9.374726510094132e-05,
          "token": " credit"
        }
      ],
      [
        {
          "prob": 0.9915566587307095,
          "token": " and"
        },
        {
          "prob": 0.006276271918386506,
          "token": " per"
        },
        {
          "prob": 0.0010906525214253134,
          "token": " or"
        },
        {
          "prob": 0.00022861318791580237,
          "token": " in"
        },
        {
          "prob": 0.00020175043022568564,
          "token": " to"
        }
      ],
      [
        {
          "prob": 0.9964574159886457,
          "token": " a"
        },
        {
          "prob": 0.002629269839332161,
          "token": " maximum"
        },
        {
          "prob": 0.00035583297841150117,
          "token": " up"
        },
        {
          "prob": 0.00035583297841150117,
          "token": " no"
        },
        {
          "prob": 6.582251386635804e-05,
          "token": "  "
        }
      ],
      [
        {
          "prob": 0.999954464125005,
          "token": " maximum"
        },
        {
          "prob": 1.670093626455637e-05,
          "token": " max"
        },
        {
          "prob": 1.2218665989191184e-05,
          "token": "  "
        },
        {
          "prob": 6.961986021765011e-06,
          "token": "maximum"
        },
        {
          "prob": 5.093497782031337e-06,
